# 植物: 竹や木の骨組みをスギ・ヒノキなどの青葉で包んだ門。緑門。, 野球: 野球で、ホームランのこと。アーチをかける。, 交通: 上方が半円形をなす構造物。家の入口、橋、トンネルなど。せりもち。
交通	アーチ	更倉小学校の北にあるという煉瓦のアーチ橋は、道路を走っていては全く分からなくて探すのに苦労したが、春の町3丁目と尾倉1丁目の境の、道路の左側がいきなり開けて市道が立体交差しているところがその場所だった
交通	アーチ	アーチを飾っていたも地盤が吹っ飛び地面に落ち、煉瓦の壁も粉々になるが、一般のゲームのように破片はゲーム世界から消失せずに、道路上にバラバラと散らばりそこにのこり続けるのだ
交通	アーチ	1929(昭和4)年に建設された6連アーチが素晴らしい道路橋梁で、当初の計画が良かったのでしょう、構造が堅牢であり、そして車道の広さも十分あることから、今も新潟市を代表する交通の要衝です
その他	アーチ	マットのボールは、重力のボディ部に基づいて低しゃがんだのマットボール前方プレス完全前に、上半身を移動し続けて、カンタヤオは、顔に腕に近いボールの肩、脚、膝の内側の内側にアーチを崩壊拡張では、両手でボールを持ってアリスの腕の動きで虎の口の部分を舗装する
交通	アーチ	明治時代を代表する建物「鹿鳴館」スタイルのアーチ型の窓が湯船を囲み、碁板の目のように仕切られた浴槽の底には大小の玉石が敷き詰められ、その隙間から源泉が滾々と沸き出している【写真5】
その他	アーチ	「アーチファクトの除去・抜歯シミュレーション・骨補填を行った、より臨床的インプラント埋入モデルへの有限要素解析ソフトVOXELCONの適用」:日本顎咬合学会
野球	アーチ	お立ち台とまではいきませんでしたが西岡は逆方向へのヒットを含む2安打に2四球で盗塁も決めましたし、今江も今季初アーチと期待通りの活躍を見せてくれました
野球	アーチ	ザトペック投法の村山、江夏の奪三振ショー、田淵の芸術的アーチ、藤田平の広角打法、上田次郎のサブマリン投法、カークランドの怪力、遠井と池田の渋く勝負強いバッティング
その他	アーチ	アーチの左側の花壇では黒花フウロソウが背高のっぽに背伸びしながら、ワインチョコレート色のシックな小花を満開に咲かせている中で、空中ブランコを楽しんでいる子は誰でしょう
野球	アーチ	さらにワイルドピッチで2点目を献上した後、安打で出たランナーをおいて相手7番打者が末永のカーブを左中間深く、推定95メートルの大アーチをかけ、一気に1点差に詰め寄る
野球	アーチ	セントルイス・カーディナルズのフェルナンド・タティース内野手は23日、ドジャースタジアムで行われた対LA戦の3回に満塁アーチを2本放ち、同一イニングにグランドスラム2本を記録した初の選手となった
交通	アーチ	現在は、国道4号の橋となり、関東大震災後の1927(昭和2)年に架けられたアーチ橋と、増大する交通をさばくため1973(昭和48)年に加えられた桁橋の2本が並ぶ
その他	アーチ	シクラメンの和名に「カガリビバナ(篝火花)」というのがありますが、これは日本に入ってきた初期のシクラメンの品種は、花茎が長くアーチ状に弧を描き、その先に炎のような赤い花をつける様子にちなんだものといわれます
野球	アーチ	これまで14試合HRが出ていなかった信彦会長が、4回にセンターバックスクリーン横へ先制アーチをたたき込んでくれて、昨日の立役者・ズレータがレフトへ中押しの4号2ランなど、打つべき人がしっかりと打ち、投げては先発の杉内俊哉が9回130球3安打12奪三振の力投で今季チーム初完封
野球	アーチ	この場面での継投は妥当だが、いかんせん勢いづいた和智弁打線相手にしかも無死満塁での登板と大変なところで9番・西川をセカンドゴロにしとめたものの押し出しで7点目そして芝田の2点タイムリーに3番・勝谷のセンターバックスクリーンへぶちこむ特大アーチであえなくKO・・・・・
交通	アーチ	2010年までに三原市本郷町と同市大和町の約10Km区間を暫定開通させる予定であるが、途中県道瀬野川福富本郷線と山陽本線が並走する沼田川の渓谷を鋼アーチ橋で跨ぐ「空港大橋」(仮称)が建設中で、完成すれば橋長800m、地上高190mの大規模な橋になる[6]が、山陽本線の車窓から眺めることができる
野球	アーチ	初回表、2死1・2塁から、佐賀北・諸隈に右前タイムリーを打たれ、1点を先制されるが、その裏、2塁にヒットの大河原を置き、松浦が甲子園通算900号の記念アーチを放ち、逆転に成功
野球	アーチ	ここから一気に白星街道に乗りたい所だったが、いきなり片岡に4号先頭打者アーチを 3点を追うヤクルトは7回、一死二、三塁から代打・上田が走者一掃のタイムリー二塁打を放ち佐々木内閣の成立とともに、球団は前ヤクルトの伊勢孝夫コーチを ヘッド兼打撃コーチとして、前阪神の有田修三コーチをバッテリー コーチとして招へいした
交通	アーチ	アーチ型のトンネルの中にネズミさんが吊るされているので 子猫達はそれに夢中で しかもそのトンネルと空き缶入れの隙間から出入りできることが判明 そんな様子をジッとみていたスフレちゃん
交通	アーチ	パネリストは山田代表、道遺産の旭橋を守り語り継ぐ「旭橋を語る会」(旭川)の海老子川雄介若手幹事、道遺産の旧国鉄士幌線の橋りょう群の保存活動などに取り組む「NPOひがし大雪アーチ橋友の会」(上士幌)の角田久和事務局長、白鳥大橋の建設に携わった橋本幸・北海道開発局道路建設課道路技術対策管、道トライアスロン連合の森谷直樹常任理事
交通	アーチ	1143年に着工されたピーサ・ロマネスク様式の典型的教会で、写真では判別が難しいがファサード上部の四層の開口連続アーチは動物模様の繊細な象嵌細工で装飾されており、また柱の一つひとつに異なる彫刻が施されている
その他	アーチ	私の一番好きな「ニシキギアーチ」がすべての方にお見せしたいほどの美しい・・ ・・ きみどり・・色・・です♪ ニシキギはど~こにでもある低木で紅葉の美しい木
交通	アーチ	内部は太湖を模した築山で、明るく透き通るような感じで、青竹・樹木・草花のなかに見え隠れする亭・軒・アーチ橋とあいまって、幽雅な雰囲気を醸し、「乾隆小花園」とか「園中の園」とかいわれる
野球	アーチ	『野球は9回から』『野球は2OUTから』といっても、さすがに春日部共栄がここから勝つシナリオを考えると、どーしても「まさかのソロアーチ4本連続」とか「埼玉栄終盤にきてエラー連発」とか、ありえない単細胞な妄想しか浮かんでこなかった
その他	アーチ	ここ何試合かはあまり跳び上がらないセットシュート気味の3ポイントが目立った小菅ですが、ここでは今までのような高いジャンプで、しかしアーチは緩くリラックスした感じのシュートが決まります
交通	アーチ	連続アーチが美しい現在の十三大橋は、旧能勢街道を府県道大阪池田線として拡幅整備するのに伴い、1930(昭和5)年1月に着工し、同7年1月にに架け替えられたものである
その他	アーチ	現地に到着するやいなや、大きな虹の歓迎アーチで迎えてくれたロッキーの山々は、何処も日本のどこかで出会ったことがあるような花や全く初めて見る花で一杯だった
その他	アーチ	『アーチ上部に多く花を咲かせたいとき』アーチの柱になる部分は、枝をまっすぐ伸ばすことによってアーチ上部の横向きの枝にだけ頂芽優勢が働き、上部にのみ無数の花をつけます
その他	アーチ	Q3 買ってきたツルバラを、アーチに這わせるつもりで植えたのですが、春には、いくつかの花が咲きましたが、なかなか、シュートと呼ばれる枝が伸びずに短いままです
野球	アーチ	その裏、キューバはベルのソロアーチで再び1点差と詰め寄ると、土壇場9回には一死満塁と一打サヨナラのチャンスを作ったが、グリエルが痛恨のゲッツーに打ち取られ、韓国が初の金メダルに輝いた
野球	アーチ	6回表には前田選手が石井投手から右中間への3号ソロアーチで勝ち越したが、 6回裏に広池投手が二死から英智選手への四球と暴投の後、谷繁選手に適時二塁打を浴びて同点
野球	アーチ	バティスタ・松中の連続アーチ、ズレータのヒットでファイターズ先発の江尻をマウンドから引きずり降ろすとなおも打線が繋がり宮地のタイムリーでその回一挙6点を奪います
野球	アーチ	打線は相手の巧みな継投に的を絞れず、スミ1で試合は進むも5回に四月昨日の今季初アーチなどで3加点で中押しすると、最終回9回にはトンボ3人目の投手から、先頭打者中嶋の第1号ソロを皮切りに打者一巡の猛攻をみせ、駄目押しで試合を決めた
その他	アーチ	ひときわ目を引いたのが藤の花、古い建物の玄関、入り口の壁面を覆うように3階付近までアーチ状に飾って何ともいえない風情、藤の花は日本情緒と思っていた私にはちょっと衝撃でした
交通	アーチ	まもなく豪快なダムの放水音と共に高さ186m・長さ492mという日本最大のアーチ式ドーム型ダム・黒部第四ダムがトンネルの向こうにその姿を現した
野球	アーチ	◆YB7−5G◆ 坂本の17号先頭打者アーチで先制した巨人は続く2回には連続四球で無死一、二塁とすると、マッスル千代の富士がゲッツーを食らった後、脇谷がタイムリーを放って、2点目
その他	アーチ	クリスマス前にも中央郵便局〜三宮に行ったのですが、ルミナリエで道路が渋滞していたので裏道に逃げたつもりが午後4時前に点灯前の ルミナリエのアーチの真下に出てしまって、4時予約を遥かにオーバーして到着の状態でした
交通	アーチ	トンネル覆工コンクリートにおいては、内部温度の測定と反発度の測定をトンネル覆工コンクリートのクラウン部(アーチ部の頂部)の妻部で行えばよい(図1参照)
野球	アーチ	巨人はマッスル千代の富士の先頭打者アーチで先制した後、ガッツが古巣との初打席で内野安打を放つなど、二死満塁のチャンスを作ったが、ここでDH制が使える事でようやく今季初スタメンで起用された清水があえなく倒れ、三者残塁
野球	アーチ	3回表1死後1番・藤井のツーベースを足がかりに3連続2塁打であっさり川口投手を攻略しトドメは4番・佐藤のレフトへのアーチであっさり4点を先行した
その他	アーチ	[花の庭」は中央に施したバラのアーチを中心に東側(上の写真 右側)は朝日の花壇 そして西側(写真左側)には芝生が広がり夕日の花壇とされモネが生前に自然の色彩の変化を好んだとされています
その他	アーチ	巨大なアーチの前に据えられた松明がもはや弱々しい光によってしか輝かないのと同じように、太陽は、大地の松明は、その炎の身体から最後の弱い光を放ちながら、それでもなお木々の緑葉や、しなびた小さな花や、樹齢何百年の松やポプラや樫の木の巨大な梢を見せながら、消えていった
野球	アーチ	巨人は5回裏に坂本のタイムリー、小笠原の3ランで1点差に迫るも、中日は7回にはブランコのタイムリー、9回には森野の特大アーチで追加点を奪い、浅尾、岩瀬のリレーで逃げ切った
野球	アーチ	1回表に島田選手の先制タイムリー(中前安打)が飛び出しましたが、その裏すぐさま金村投手がBu大村選手に先頭打者アーチ(右翼席)を放たれてあっという間に同点
その他	アーチ	先頭の山口神学生の十字架に続いて侍者、ワレ神父様、アーチ、多国籍の少年達、若者達に担がれた複数のマリア様達そして信者さん達の長い行列が街に繰り出した、教会の周囲約1kmを30分ほどかけてアーメンハレルヤの歌声を響かせながら300人を超えるパレードとなった、途中交通安全のため蟹のヨコバイ的なところもあったものの、交通整理のスタッフのお陰もあって何とか無事に皆さん戻ってこられた
交通	アーチ	ウェリントン・アーチは、ロンドンで最も多く観光される名所旧跡のうちのひとつであり、ハイドパーク・コーナーの込み合った交通量のインターチェンジの近くにある恩恵を受けています
交通	アーチ	実際に、旧天城トンネルを訪れ、眺めていただければ、ここでいちいち言葉にするべくもなく、一目でその芸術的なすばらしさがご理解頂けるかと思いますが、南北のトンネルの入口にある「天城山隧道」の「題字」から、アーチを支える「要石」、入口をそれとなく飾りたてる「笠石」と「帯石」に至るまで、見れば見るほど、そのこだわりようが伝わってきます
野球	アーチ	鈴木一朗が川相不在では一発に賭けるしかないとばかりにらしくないバッティングでいきなり先頭打者アーチを放つなど、3回まで3−1と言う展開で出勤時間になってしまったのだが、会社に着いた頃には既に追いつかれており、最終的には無念のサヨナラ負け
その他	アーチ	きれいな海の向こうに、大きなアーチの虹が出て、 なんとなく、あの虹を わたって、赤ちゃんがやってくるんだなと美しい景色に感動したり写真を 撮ったり
野球	アーチ	するとその裏成美は1死から四球で出塁し注目の1年生・桑原選手がPLのエース多司から両翼100mの広さをもろともせず文句なしの特大アーチを放ちあっさり2点を先制した
野球	アーチ	あれだけ外角中心の攻めをしていたのに後藤には内角を要求して同点アーチを浴び、次の打席でも内角を要求して2打席連続アーチを喰らったリードに、里崎の疲れを感じました
野球	アーチ	その裏、日本ハムは二死走者なしから田中のヒットと連続四死球で山本をKOし、先制アーチの小谷野の打席となったが、代わった香月の前にライトフライに倒れて、三者残塁
交通	アーチ	明治15年、当時の国道を建設するにあたり農業用水路を維持するために架けられた石造アーチ橋で、国道2号拡張のときここに文化遺産として移転復原されている
その他	アーチ	ビルケナウの焼却棟の燃焼室のドアは60cm×60cmで、下の10cmは、タウバーの話にありますように、ストレッチャーを押し込めるためのローラーがスペースをとっていますので、使うことはできません、さらに、これらのドアは30cmの半円アーチ形状をしており、それは、ストレッチャーの上ちょうど20センチのところから始まっています(下図参照)
野球	アーチ	今回も阿部に2試合連続のソロアーチは出ているものの、その直前に二岡のバント失敗で1走のスンヨプもろともアウトになってチグハグだったし、また今回も苦労するのかなという雰囲気がありました
その他	アーチ	雑木を組んでつくったアーチには、朝顔やるこう草等、つる性の植物が茂り、アイスクリームや、プリンのカップでつくった風りんがさげられ、涼風をうけて、かわいらしい音を出しています
野球	アーチ	いてまえ打線の幾多のアーチを飲み込んだ外野スタンドのフォルムを偲ばせるようにレフトウイング、センターウイング、ライトウイングの三棟で構成し、“藤井寺球場の跡地”であることを多分に意識したデザインは、この球場を人一倍愛した私にとってはささやかながらも熱くこみあげて来るものがあった
野球	アーチ	その後も川崎宗則内野手(福岡ソフトバンク)、昨年のプレーオフで先頭打者アーチを許した栗山巧外野手(西武)、WBC対策でメジャーのラミレス(レッドソックス)など次々と想定
その他	アーチ	元請けのGREEN HOUSE(グリーンハウス)さん、村田さん、取り付けの手間で来ていただいた、尾上さん、そしてこのアーチをこれからも育てていただくお客さん、みなさん、どうもありがとうございました
その他	アーチ	庭の奥のよう壁がある前に、何かの木を植えて目隠ししておいて、その前にパーゴラか、アーチみたいのにからませるか、あるいは2階のベランダあたりまで柱をつたって伸ばすか・・・
その他	アーチ	PAGE=top 「ガタガタになってきた日本の消費(コンビニ・デパート)」 Nevada 10月のコンビニ・デパートの売上が発表になり新来島特有のアーチ型整流板 スタンチューブの上部あたりにもフィンが付いています
その他	アーチ	その後、花咲く桜の木のアーチが美しい旭川さくらみちを通って中区浜へと向かいましたが、河川敷で眺めても自転車で通ってもきれいな桜に心癒されまくった修ちゃんであります☆
野球	アーチ	その裏、ヤクルトは守護神・小野寺に対して、ガイエルが2打席連続アーチを放り込み、更に、2本のヒットで一発が出ればサヨナラと言う場面を作ったものの、最後は福川がゲッツーに倒れて、3連敗
交通	アーチ	年配のご夫婦が、橋上に設けられたホームを模した足湯などを熱心に観察している様子を見て、ともかくアーチ橋が生き延びている事を喜ぶ心の余裕も生まれてきた
野球	アーチ	逆方向に伸びる打球が岩村の持ち味とはいえ、タイガースの剛腕バーランダーの速球を左越えに運んだ今季初アーチに「すべてが完璧(かんぺき)だったから、あそこまで飛んだ」と納得顔だ
交通	アーチ	そしてオジー・アーチであるが、大门のイーワーンには 大きく用いられているものの、本来これは構造的に不安定なアーチなので、礼拝殿においては ほとんどが壁つきアーチとして用いられている
その他	アーチ	中目黒辺りは川幅が狭いので両川岸から迫り出した桜の枝が重なって花のアーチのようになりますが、目黒辺りでは川幅も広くなり延々と川岸に沿って咲く桜を楽しめます
その他	アーチ	右回り、サンゴ礁の上にオヤビッチャやミヤケスズメダイなどのスズメダイ系多い、サザナミフグ1匹、ブダイ、小アーチの手前にコケギンポ、小アーチに50センチ位の亀の死骸、メジナ、イシガキダイ、オーバーハング付近にキンギョハナダイ多い、アーチの下にニザダイの群、浅瀬にチョウチョウウオ多い、波打ち際にギンユゴイの群
野球	アーチ	2/27:マートン、先頭打者初球アーチ:オープン戦(オリックス:安芸)で新外国人、マット・マートン外野手がオリックスとのオープン戦開幕で、初球アーチを放った
その他	アーチ	アーチの部分に はわせる花をいろいろ考えましたが このモンタナの花に魅せられ 探すこと3年 植えてここまでなるのに3年 とうとうきれいになりました
野球	アーチ	6回の攻撃は二岡の犠牲フライで2アウトランナーなしになったところで攻撃が切れてしまうのですが、そこからイ・スンヨプが2塁打を放って攻撃をつなげたのが、小久保の安打と阿部の逆転アーチという流れにつながったのでしょう
野球	アーチ	さらにピエロは4回、1番武田の目の覚めるようなライトオーバーのソロアーチで1点を加え、とん吉エース・金木をノックアウトすると、5回には代わった細谷から7番橋口のタイムリーと押し出しの四球でダメ押しとなる2点を挙げ勝負あり
交通	アーチ	モジュラーチ工法 [33]アーチ特有の合理性と美しい形状をもつ多分割式2ヒンジアーチ構造の大型鉄筋コンクリート二次製品構造物で道路、水路、鉄道等の開削トンネル、シェルター、多径間連続アーチ橋等に用いられています
交通	アーチ	アーチの完成と同時に、教会の前にあったオーリブの枯れ木が芽を吹いたという伝説があり、信者から「オリーブの樹の聖母教会」と呼ばれるようになりました
その他	アーチ	足のもっとも大切な役割をはたす、3本のアーチやかかとをしっかり保持し、正しい荷重分散や歩行を助けるとともに、筋組織や関節を強化し、正しい足の立体構想へと導きます
その他	アーチ	アーチなどに誘引して、優雅にアーチングする花を楽しむには、枝ぶりが柔らかいランブラーを、壁面に誘引し、葉と幹と花の織りなすコントラストをめでるにはクライマーを使うといったぐあいです
野球	アーチ	その結果、長打量産の大会となり、従来の大会記録であります43本(第38回都市対抗野球大会 第38回大会)を19本も上回る62本のアーチが飛び出した
野球	アーチ	記念すべき初アーチを、淡々と「球場が狭いから入った」と語ったイチローの脳裏にはきっと、エレベーター生活を強いられていた頃の、必死且つ苦々しい己の姿が映っていたのかもしれない
交通	アーチ	また、このトンネル構築方法においては、上段のトンネル2Aと地中連続壁1の間の地山Gを例えばNATM掘削し、アーチ状のNATM支保工8の一端を上段のトンネル2Aの覆工体4に、他端を地中連続壁1にそれぞれ繋げて拡幅部5の上方の地山Gを支持させる
交通	アーチ	柱廊の下へ入り込むと、各々のアーチのデリンペット(迫持)には穹窿をもち半円形に刳り抜かれた壁龕が設えられており、その壁龕の中に長衣を纏った男性像がありました
交通	アーチ	向皆外トンネルは1954年2月に着工され同年6月に開通したものの、その後の降雨や台風の影響により坑内のアーチ、側壁のコンクリートに剥脱が生じ始め、ついで地盤の変化によるトンネル中心線の移動、隧道断面の変形が発生し、ついにはトンネル周辺の地山全体が水窪川に向かって滑り始めたため、放棄せざるを得ないと判断された
交通	アーチ	早速R325〜R218で宮崎県高千穂に移動し、東洋一のアーチ橋等を寄り道して、道の駅「青雲橋」付近から渓谷下の道を走り、237〜205〜上の切林道〜九郎山林道を快走しました
その他	アーチ	それまでの15分間、一度も韓国DFに披露していなかったのが良かったのか、ザックリと一発かわし、ボールが流れたところを韓国DFがクリアしたボールが、さらに足を出した永井の足に当たって、狙ってもできないような見事なアーチを描き、素晴らしきエンディング
野球	アーチ	五回にエラーと死球で一死二、三塁でオープン戦でアーチを描いた金澤に打席が回るがスクイズが決まらないなどで追い込まれるがまたも金澤のバットが火を噴きセンター前へ
その他	アーチ	特に、アーチ、フェンス、ポール、グラウンドカバーなど、用途によっても適した品種が異なりますので、植えたあとにこれじゃない方がよかったと思わないよう、よく調べて植えることをおすすめします
