# 植物: 竹や木の骨組みをスギ・ヒノキなどの青葉で包んだ門。緑門。, 野球: 野球で、ホームランのこと。アーチをかける。, 交通: 上方が半円形をなす構造物。家の入口、橋、トンネルなど。せりもち。
野球	アーチ	初回、中村(友)の2ランアーチで先制、2回には盗塁と相手のエラーを誘って2点を追加し、どうやら勝てるかな・・・と思ったが、5回に四球とタイムリーエラー等が出て自滅
その他	アーチ	クレマチス達の殆どが2番花となり、僅かばかりの開花に変わった庭〜今年もアーチやフェンス等で沢山の花をつけてくれ、楽しませて貰ったクレマチス達です
交通	アーチ	また今年は大人も滑られるコースを新設し、長さの違った15本の滑り台から構成され、最長20mのアーチトンネル滑り台、ノーマル滑り台、トンネル滑り台の3本が呼び物です
交通	アーチ	山岳トンネルの覆工コンクリート※1施工の場合、トンネル形状がアーチ型であること、セントル(トンネル覆工用の移動式型枠)その他の施工設備でトンネル坑内が輻輳していること、あるいは坑内をダンプトラックやトラックミキサーなどの作業車輌が常時運行していることなどから、生コン打込み後15〜20時間程度でセントルを脱型せざるを得ず、効果的な湿潤養生を行なうことは困難であるのが実情でした
野球	アーチ	両投手が大崩をしそうにないだけに、FIREは5回戦でダメ押しアーチを放った桜井、ジェニオンは2試合連続ホームランと絶好調の1番・小林の前に走者をためたい
交通	アーチ	川底からの高さ20m、全長147m の10連アーチ橋は、国道の舗装工事の際に一部が切り取られてしまいましたが、今なお優美な姿を誇り見る者を引きつけてやみません
その他	アーチ	アーチトップ・ギターが普及していたのにもかかわらず、1935年のベークライト・モデルB・スパニッシュギターは、リッケンバッカーの殆どの歴史を作りました
野球	アーチ	キンケードは、去年春のフリー打撃で豪快アーチで度肝を抜き、虎党に夢を見せてくれましたが、シーズンでは頑固な性格が災いして、岡田監督の「打席の立ち位置をベースから離れろ」というアドバイスに耳を貸さず、死球渦に泣いて結局解雇されました
交通	アーチ	「旧万世橋駅」については、この STOCKTAKING にエントリー「万世橋駅」に書いたが、今年、2006年の5月14日(日)の交通博物館の閉館を前にして、交通博物館の裏手、現JR中央線の高架下レンガアーチ内の遺構、旧万世橋駅の特別公開が始まったのだ
交通	アーチ	○南谷参考人 一部のトンネルにおきまして、コンクリートのはつり作業の際にアーチと側壁の接合部にセメント袋あるいは木片の切れ端があったという報告を受けておりますが、これはトンネルの強度に影響を及ぼすほどのものでないという報告もあわせて受けておるところでございます
野球	アーチ	0−0と互いに譲らず迎えた9回裏、阪神は先頭の金本が広島2番手・横山から球団創設7000号となるメモリアルアーチを放ち、劇的なサヨナラ勝ちを決めた
その他	アーチ	以前は子会社独自で導入した車両には独自塗装が施されており、嘉穂交通はクリーム色地に山吹色と緑色の帯、添田交通はクリーム色地に緑・水色・ピンク色のアーチ型模様の帯、直方交通は白地に赤・水色の波状模様の帯であったが、西鉄バス筑豊発足後はこれらの色の車両の新規導入はなくなり、車体更新の際に西鉄色に変更されたり、経年により廃車されたりして減少している
その他	アーチ	昨日うちの学校で入学式があって、6年生の補助12人は、6年生が花のアーチしている所を、1年生と通るんだけど、同じ学年が花のアーチしてる所を通るのは、すっごくはずかしかった
交通	アーチ	「お江戸日本橋七つ立ち」で有名な東京の日本橋(にほんばし)が明治44(1911)年のこの日、木橋から現在の花崗岩欧風アーチ型のものにかけかえられました
野球	アーチ	ここから脇谷にタイムリーを浴び2点差とされ、更に代打エドガーに満塁アーチを浴びてしまい、一気に逆転され、坂本にも間髪いれずにダメ押しソロを浴びた
その他	アーチ	そこから約300m位先の右方向にトラピスト修道院へ通じるアーチ型の入り口(国道に平行している踏切の前にあるアーチ状の道路)が出現しますので、そこを上がっていくと、素晴らしい景観のトラピスト男子修道院が現れます
その他	アーチ	アーチ形の門をくぐると左右に剪定されたイヌマキ・リョウキュウゲッキツなどがあり、ゆったりとした階段を上がると、右側塀沿いの花壇の中に、1メートルほどの形の良い自然石が1個置いてあり、石にはガジュマル・オオタニワタリが植えられ、庭造りを工夫しながら楽しんでいる様子が感じられる
その他	アーチ	■アーチなどは、植物の寿命よりも長く保つようステンレス製を採用するなど、機能性の素材(木・鉄などは寿命が短い)と雰囲気の素材をご相談の上、決定した
野球	アーチ	4部DのWHITE SIXはここまで打率1割を切っていた1番三屋の先頭打者アーチで勢いに乗ると、その後も8安打9得点の猛攻でMBファイターズとの首位決戦に勝利
野球	アーチ	前日(28日)の同カードで復帰1号アーチを放ち、お立ち台に上がった小久保も「明日は超高校級の田中投手が投げるので、みなさん球場に足を運んでください」と、スタンドに向かってPRを忘れなかった
その他	アーチ	その他にも春の訪れを感じる水芭蕉の群生地があったり、アーチのように連なる桜並木があったり、菜の花、ボタンと、花にかけては、話題の欠くことがない五泉市へ、足をのばしてみてはいかがでしょうか
その他	アーチ	じょんの散歩、洗濯物干し、ストーブの掃除、自然薯植え付け、じょんのびの木の枝片付け、看板用柱の作業用枕木作り、バラアーチの柵作り、メニュー立て作製、白樺と榎の種蒔き、予告看板作り、以上が今日行った仕事である
野球	アーチ	球場に詰めかけた千葉ロッテファンは一つになり猛虎の大声援に負けないもの凄い応援歌を選手に送り正にそれが井口のサヨナラアーチを呼び込んだ、劇的な幕切れに私は全身に電流が走り気が付くと同伴者や回りのファンと抱き合っていた、野球観戦はこれだから止められない
その他	アーチ	用水には、多摩川の宿河原堰(ぜき)近くの取り入れ口から緑化センター付近まで約2kmにわたって約400本のソメイヨシノが両岸に植えられており、シーズンにはピンクのアーチができ、川崎市北部で指折りの花の名所として例年多くの見物客が訪れる
その他	アーチ	細かいことで、もしかしたら気にしていたのは僕だけかもしれませんが、車に関してもタイヤとフェンダーアーチの隙間が気になりだしたらどうにも気になるじゃないですかー
その他	アーチ	Summary : 太地町の入口には、最近まで高さ6mもある非常に大きな親子のくじらのアーチが道路を覆っていて、 ちょっとした名物になっていたのだが、道路の拡張工事のため、
その他	アーチ	弘前公園には現在2600本もの桜の木があるが、本日の写真を撮影した西濠には、約300本の染井吉野がアーチ型に並木道として植えられ、開花期間中は桜のトンネルとして多くの人々の目を楽しませてくれている場所である
その他	アーチ	シンガポール植物園のバンドスタンドからプラントハウスと呼ばれる古い植物園のたたづまいを残しているエリアに下りる階段にアーチがついて、見慣れない植物が絡ませられました
その他	アーチ	そんな方々に、自宅でできる簡単テーピング法として、足裏のアーチを形成するコツのひとつである、足裏の支点と作用点を押圧するテーピング法をなどもご紹介しておりますので、ぜひ機会がありましたらチェックしてみて下さいねっ(*^_^*)
その他	アーチ	毎年恒例になりましたイルミネーション青いライトが増え、色鮮やかになったみたいまた電飾アーチも出現してロマンチック今日は一人だけどいつかは誰かと
交通	アーチ	建物はネオ・ルネッサンス様式を基調とした鉄骨煉瓦造地上3階・地下1階建てで、アーチ状の屋根と、洋画家・松岡壽氏によって描かれた「天地開闢(てんちかいびゃく)」の天井画が特徴である
交通	アーチ	Subsurf(Lv1)を掛けているのはアーチのある主塔の上半分の外周、六芒星の先の丸い塔、底面の球状部分と浮遊リングだけで、あとは全てプリミティブ形状を引っ張ってちょいちょいと足したもので、木も板ポリ4枚を交差させただけのものにハイポリの木のノーマルを焼き付けてアルファマップで抜いたただけです
その他	アーチ	フェ●シモの花箱で作ったお花模様のおうち~♪ 「マフィンのおうち」の表札もつけちゃった~*^^* 窓はアーチ状にして乙女チックでとってもカワイイ~(笑)
野球	アーチ	1000打点おめでとーー ここぞっというときに打ってくれている証拠ですね ありがとうございまーすおめでとうございます メモリアルアーチでもヒットでもありませんでしたが 当てて走るっっ小技を利かせた広島野球らしいじゃないですか 次は2000安打
交通	アーチ	「畑のトンネル」は明治四十四年に開通した延長七十八・三メートル、幅四・〇七メートルの人・車用のトンネルで、内部の壁面にはれんがを三重に積み、アーチ状の開口部にはれんがを環状に四重に巻くほかは装飾的な要素は見られないが、当時の状況を考えると、これだけでも相当手がかかっていることが推測される
その他	アーチ	数年前などは東側のアーチ入り口(実は此の中庭、外部からストンと真っ直ぐ入れる口はこの東側しかないのです)から見ると前にこの枝垂れの紅が垂れて、その奥にメインの花が下がってそれは凄かったのですが、此の木も少し元気がないみたいです
交通	アーチ	千葉県君津市が管理する市道のアーチ橋で10月下旬、橋を支える「つり鋼材」の1本が破断しているのが見つかり、国土交通省は全国の自治体にアーチ橋や斜張橋など「つり橋」の有無を調査し、つり橋があれば緊急点検するよう指示した
野球	アーチ	3回に先頭打者に四球を出しエンドランで1塁3塁のピンチ・・・踏ん張れずエラーも絡み一挙3失点・・・反撃の4回裏の攻撃でまたまた熊倉の2打席連続のソロアーチ
交通	アーチ	斜張橋・吊り橋・アーチ橋・上(車道)下(歩道)2段の橋など、橋梁技術の現物展示場みたいなものだが、全線開通後だったので昔の人たちの生活の苦労を偲ぶ時間も無くあっという間に通過してしまった
その他	アーチ	これは観賞用・食用とあるようですが、アーチや、棚に絡ませた枝、大きな緑の葉の間から垂れ下がる房が、だんだん色づいていくのは、ほんとに楽しみなものです
野球	アーチ	3番・勝谷が足元のボール球に手を出して三振してくれてようやくアウト1つ取れたが4番・坂口が打った瞬間それと分かるレフト場外へのアーチを架けてあっさり逆転
野球	アーチ	しかし、長尾軍が逆転に成功した直後の6回裏に同点アーチを浴びると、さらに7回には3本の本塁打を浴びるなど背信の投球内容で、長尾軍の勝利の芽をつみとってしまった
その他	アーチ	アウト(イン)側からスタートしたら、イン(アウト)側のスタート/ゴールのアーチをくぐって1周、そして再びアウト側のアーチを通過してゴールという具合で、左回りで2周するようなイメージだ
野球	アーチ	「すごくプロで活躍しているバッターに並べてうれしいです」今大会から導入された低反発球、いわゆる“飛ばないボール”も関係ない連続アーチに表情を崩した
野球	アーチ	しかしその後リリーフとしてマウンドにあがった畔柳が自らの同点アーチをフイにする大乱調で再びリードを奪われると、後はWヘッダー2試合目のお決まりのパターン
その他	アーチ	(*^_^*)狭いうえにアーチを置いたり、だんだん大きくなってしまう木を放置したり、鉢植えを増やし、ついつい気に入った苗をプランダーに植えこんだりしているうちに、家人からそう呼ばれるようになりました
その他	アーチ	約8メートルのポールの先に星形に電球を配したほか、そこから豆電球1500個を放射状に伸ばして“光のクリスマスツリー”を演出、その近くには電飾のアーチも設置した
その他	アーチ	植物園の西の賀茂川沿いに「半木の道(なからぎのみち)」がありますが、4月には、枝垂桜のアーチが、とても美しい散歩道となりますので、ぜひ歩いてみてください
交通	アーチ	なお、現行の橋の意匠(デザイン)は、すぐ北側の堂島川に架かる大江橋とともに、1924年に大阪市の第1次都市計画事業で公募されたものであり、鉄筋コンクリート造りのアーチ橋ながら、パリのセーヌ川を参考に景観に配慮したデザインは、一部補修された以外は懸架された当時のままで、市の第1次都市計画事業の目指すところを後世に伝えている
交通	アーチ	アーケード(英語:arcade)は、柱で支えられる連続したアーチやヴォールトを用いた通路や歩道、または一続きのアーチが覆う歩道等の道路を指す言葉である
交通	アーチ	【目次】(「BOOK」データベースより)第1部 北海道編(宗谷支庁・天北線—国道を走っていると、腕木式信号を見つけた/網走支庁・根北線—突然、国道を跨ぐようにローマ時代風の巨大アーチ橋が/根室支庁・標津線—北方領土に近い、標津の地
交通	アーチ	また、コンクリート練りや石造アーチ橋づくりなどの体験イベントもあり、ご参加の皆さんには、にぎやかで、ほのぼのとした休日のひとときを過ごしていただきました
交通	アーチ	今回の事故の原因については、今後、専門的分析等を行うこととされておりますが、これまでのところ、送水トンネル上部で地下水の影響による空隙化が進行し、その上にある岩盤が剥離、落下し、トンネルアーチ部分を突き破ったものではないかと県から聞いております
その他	アーチ	図3に示すように、超音波通過膜B(23)が下に凸のアーチ型を成し応力を当該膜の横方向に分散するように構成されているため、当該膜Bをゲル状の超音波伝播媒体(GL)にしっかり押し付けることができる
交通	アーチ	あとはダブルアーチで道路拡張することによって国道1号線を挟んで造幣局の向かいにある泉布観(1871年トーマス・J・ウォートルス設計)の敷地が狭まらないことを祈るばかりである
交通	アーチ	池田ダムから国道32号を南下、右岸のJR大歩危駅前に架かるアーチ橋を渡り、10時30分、県道163号の西祖谷山村徳善登山口(標高250メートル)着
野球	アーチ	同年の日本シリーズではAK砲の後続の5番打者を任され、1988年の初アーチも満塁本塁打を放つなど、チャンスに強いバッティングを遺憾なく発揮し、一躍全国のファンに名前を売った
その他	アーチ	その後、いつも届けてもらっている野菜たちの畑にも挨拶してまわり、ズッキーニの幹のグロテスクさやゴーヤのつるがアーチのようになっている様に驚いておりました
野球	アーチ	「甘いところに来たら思いっきり振ろうと思っていましたよ」という二岡は狙いすましたようにバットを叩きつけ、打球はバックスクリーン左に飛び込む満塁アーチとなった
交通	アーチ	【0014】角度や向きを変えることなく内寄せしただけの両側版と該側版上に載上するやはり位置を下げただけの頂版という搬入姿勢にて既に組立てしたアーチ形コンクリート構造物内を搬入移動することができるので、組立てのための据付け移動作業が至極単純容易になるとともにトンネル坑の掘削とほぼ同時にトンネル坑内にアーチ形コンクリート構造物を順次組立てしてトンネルを構築することができるという効果を生ずる
交通	アーチ	「コンクリートアーチ橋梁群」は上士幌から三国峠に通じる国道273号に入っていくが、今回は2本の国道の交差点を直進し、そのまま国道241号を行く
その他	アーチ	JR埼京線の踏み切りを渡り板橋区に入りますと平尾宿(下宿)が始まりますが、相変わらずの街並みは国道17号を渡りきると”板橋宿”とアーチがある商店街が始まり仲宿交差点を経て石神井川を渡す”板橋”までの旧街道は賑やかな商店街です
交通	アーチ	千葉県君津市の市道にかかるアーチ橋「君津新橋」で、橋をつっている「吊(つ)り鋼材」(40本)の1本に破断が見付かり、国土交通省は近く、同様の橋を管理する全国の自治体に緊急点検を指示する方針を固めた
交通	アーチ	そして、棕櫚の向こうに長く延びた塀にもアーチ状の入り口が開き、そこからは、かつてのコルドバの街やそこを歩く人や驢馬の姿さえ見えるような気さえしてくるのだった
野球	アーチ	不調の内海が2本のアーチで3点を失点し4回途中で降板し、打線はソフトバンク先発の新垣に対して6回まで3安打と苦しい展開でしたが、7回に一気に試合が動きました
その他	アーチ	家の中も、ちゃらちゃらしたアーチがあったりして、住むのだったら飽きのこないシンプルなインテリアがいいなぁ なんて買えもしないくせにオープンハウスの広告を見て思っていたものです
交通	アーチ	「讃良地区鋼製橋脚工事」のホームページ # 過去の資料を見る # 枯松沢橋(国土交通省東北地方整備局:岩手県) 当工事は岩手県の遠野盆地と釜石を結ぶ一般国道283号仙人峠道路に架設される、アーチ部分を持つローゼという形式の橋です
その他	アーチ	両岸には桜の木がアーチ状に植えられ、春には静かな水面を眺めながら、延々と続く桜のトンネルを散歩したり、ボートから両岸に咲き誇る桜と、水面に映る桜の姿を楽しむのも格別です
交通	アーチ	小串の町並みを抜け間もなく 貝殻山を示す道路標識が見えてくる 標識に従い右折、国民宿舎おかやま桃太郎荘歓迎のアーチを潜り貝殻山に向う そして第一駐車場に駐車 すでに2台の車が駐車
交通	アーチ	一条戻橋 (現況の保全)、堀川第一橋 (アーチ型の保全、見晴らしの確保、橋下の通路と道路からのアクセスの確保)、堀川第二橋 (アーチ型の保全、ボードウォークの設置と道路からのアクセスの確保)、史跡指定の石垣 (現況の保全)
交通	アーチ	シールドトンネル内でトンネル上半のアーチコンクリート打設のために型枠を設置していたところ、駆動用チェーンが突然外れて型枠が移動し、別 の型枠に衝突・破損した
交通	アーチ	途中、サンギリ林道という道へは、坂本ダムというアーチ式のダムの堰堤を 通って抜けることが出来ますが、局巡り家の5人は、それだと、上池原局が回れなくなるという理由で、国道をそのまま行くことに なります
野球	アーチ	この日3安打を打たれている二番打者に四本目のヒットを打たれると、続く3番打者にホームランを打たれて1点差に詰め寄られ、ここで一呼吸を置くも・・なんと四番に連続アーチを打たれてしまい(*_*; とうとう同点とされる
交通	アーチ	そのお店は横浜初登場とかで水道管をイメージしたお店でお店の中がアーチ状になっており壁はレンガ風でテーブルの上のスポットライトには水道のバルブがついてたり、天井には大きい水道管が走っているっていうかわったお店でした
交通	アーチ	天竜川の中州には「弁天岩水神」と呼ばれる岩を見ることができ、また県道1号線と林道天竜川線を結ぶコンクリートアーチ橋「水神橋」が架設されています
交通	アーチ	アーチ型の石橋で、橋の上を覆う一面の紅葉が幡桃渓の静かな水面に反映し、橋下の通路には落葉が積もり、石橋の白い色と整合して紅葉の美しい景観を形成している
交通	アーチ	アーチの桁を構成する段階までは一切釘を使わず、そしていくつもの方程式を緻密なまでに使われた錦帯橋は最高の技術が使われている橋の1つであるといえるでしょう
その他	アーチ	この歯牙(上顎左側三番(犬歯):23)は、クロスアーチと言われる上顎全部に渡る1ユニットの補綴物を安全に支えるためには”キー(かなめ)”になる大変重要な歯牙と言えます(23はKey toothと言います)
その他	アーチ	それでも薄明前には、さそり座からカシオペア座までアーチ状にのびる天の川を見る事が出来たし、痕を引く大きな流星も数個見る事が出来たので、良しとしよう
その他	アーチ	春は桜やチューリップ、バラのアーチが彩りを添え、夏はトトロのトピアリーやバーベナ、秋は菊や紅葉、冬はサザンカやスイセンと四季折々、美しい花が地域の人々にも歓ばれ、特に夕方は学校帰りの子供たちで賑います
その他	アーチ	【結果・結論】US検査において、魚骨穿通による膿瘍形成は腸間壁を貫通する線状高エコー像の特徴的所見を認めるが、消化管の場合はアーチファクトや術者の技量によっては見逃す可能性がある
その他	アーチ	ブランドマークの、豊かに育ち連なる並木がアーチを作っている様子は、たまプラーザの街の象徴である並木道が、施設を訪れる人々をあたたかく歓迎するイメージを表しています
野球	アーチ	ぽろぽろとミスをする内野手、敬遠をした挙げ句にど真ん中に投げて満塁アーチを食らう投手と、ロッテの選手には相手がミスをしたことを喜ぶのではなく、相手から見た自分たちがああいった感じなのだと反省をしてもらわ
その他	アーチ	またチェックバイトを取り、半調節性の咬合器にマウントしてみて下さい、作業側の顆路調整だけの咬合器でも良いと思います(例えば松風プロアーチシリーズはおすすめ)
その他	アーチ	花色:パープルピンク、裏はクリーム色花径:8~10cm花形:半剣弁咲き樹形:ツル性樹高:300cm香り:微香用途:鉢植え、庭植え、アーチ、オベリスク、フェンス、壁面栽培方法植付けの際には30センチくらい深く掘り、植え土の一部に元肥として腐葉土や乾燥鶏糞をまぜた土を植え穴に戻し、根が肥料に触れないように植え付けてください
その他	アーチ	ほぼ10形に準じているが二重屋根をやめ、斜め方向に向いていた乗務員室扉をホームと並行に、側窓のアーチ形状をやめ、表示装置をLED表示にするなど、軽量化と保守性を向上させている
