# 植物: 竹や木の骨組みをスギ・ヒノキなどの青葉で包んだ門。緑門。, 野球: 野球で、ホームランのこと。アーチをかける。, 交通: 上方が半円形をなす構造物。家の入口、橋、トンネルなど。せりもち。
交通	アーチ	石工:藤原林七(アーチ技術を知るためオランダ人と接触し長崎奉行所から逃亡して来た下級武士)=種山組の元祖/林七の長男が嘉八、長女の三与の婿が三五郎(岩永三五郎)、長男・嘉八の長男が宇助、次男が宇一、三男が丈八(橋本勘五郎)、四男が甚平(この兄弟は、霊台橋、通潤橋、八勢橋などに関与)/林七が20年がかりで造った3橋の1つ(半円に近い)
交通	アーチ	炉頂に燃焼装置を備えた垂直軸回りに回転する炉体と、焼却灰が装入された炉体の上方を覆うアーチ形反射天蓋とを備える竪型回転炉が使用され、その天蓋を上下させて炉負荷が調整されるようになっている
その他	アーチ	が、アーチ形ルーフに不満だった米道路交通安全局(NHTSA)はコースを変更し、1975年に「1985年の安全な車の外観」 を競うパン焼きコンテスト(コンペですね)を開催
野球	アーチ	7番・野島投手はバントで9回のピッチングに専念することとなり、余裕ができたのか佐野監督は8番・栩木に初球スクイズのサインを出しこれがファールで失敗すると2球目ライトへタイムリーツーベースを放ち9番・町田は9番打者と思えないような打球をセンターへ特大アーチとわずか9球で4点をもぎとり試合が決まってしまった・・・・・
野球	アーチ	しかし林君の打球は何度見ても素晴らしいの一言ですね〜打った瞬間にわかる特大アーチに、今現在の猛虎打線で一番ストレートに強いバッターとして、赤丸急上昇中(^o^)/
交通	アーチ	(2)円形花壇に植えられたイングリッシュ・ローズや、シュラブローズとともに、パット・オースティン夫人の彫刻とアーチがある“ビクトリアン(Victorian)・ガーデン
野球	アーチ	5番・森本もヒットで続き手堅く高嶋先生は送りバントのサインを出すと先ほどの特大アーチの動揺はまだ続いており、2塁封殺を狙うが送球はセンターへ抜けていきまた送りバントすると1塁への送球がライトへ転がりやらずもがなの6点目に岡田投手へ死球をぶつけ駒大岩ベンチはもう完全に板木投手の気持ちが切れたと察知しライトへ向かわせ2番手・沼舘投手をマウンドへ上げた
その他	アーチ	●アーチを二重にして氷を割りやすくしたI型、シングルアーチのII型、既存の丸パイプを使用した平らなガードパイプに三角形の鋭角部分のみを取り付けて強度を高めたIII型の3種類を用意した
その他	アーチ	つる性植物のそれぞれの特性をうまく活用しながら、フェンス、アーチ、パーゴラ、トレリス、オベリスクなどの資材と組み合わせて、様々な立体演出が期待できるます
野球	アーチ	キューバ戦と同じくらい素晴らしいピッチングで決勝に導いてくれることを期待しましたが、ロバーツ選手にセンターバックスクリーンに突き刺さる先頭打者アーチを浴びていきなり1点を失ってしま
その他	アーチ	弟の家のアーチのバラ剪定後の大きく伸びた枝をもらい挿し木で今年、やっとたくさん咲いてくれた♪名前は判らなかったけど、これって、ハイブリットのパレード(ピンククラウド)かな
交通	アーチ	【請求項2】 トンネル坑の掘削と同時に該トンネル坑内に頂版載上の側版を搬入してアーチ形コンクリート構造物を構築し、引き続くトンネル坑の掘削と同時に既構築したアーチ形コンクリート構造物内を前記搬入姿勢にて側版と頂版とを通過搬入することによりアーチ形コンクリート構造物を順次組立て構築する請求項1記載の方法
交通	アーチ	硬いレンガの質の良さ、接着剤なしでレンガを積み重ねる技術、アーチを使わずに屋根を架ける構造、そして壁面を飾る精緻な女神像など、高度の文化レベルが窺われる遺構である
その他	アーチ	アーチだったら柔らかいワイヤーか枯れたつる植物を使って2~3重の輪を作り、そこにヘデラの茎をらせん状に絡ませて誘引すると数ヶ月後には立派なアーチ状のヘデラが出来ると思います
その他	アーチ	黄木香バラは塀やアーチに絡ませて形作りをする場合はシュートを伸ばして使用しますが鎌倉文学館の黄木香バラは丸く刈込んだように仕立ててあるので長く伸びたシュートは形を崩すので適当な長さに切ってしまいます
野球	アーチ	先手を取ってもすぐに取り返される首位攻防らしい一歩も引かない展開で、杉内は決して本調子ではなく投球数も多かったけど、6回にバティスタ、ズレータ、そしてカブレラの3本のタイムリーで突き放し、バティスタがぎりぎりいっぱいのプレイでピンチを救い、杉内以降の継投がズバリ決まって、仕上げはバティスタの4安打目のソロアーチ
交通	アーチ	現在建設中のアーチパスの仕様の確認と、横断誘導林の設置について、さらには交通事故防止のために道路デザイン上配慮することや、ゴミの不法投棄の問題についても協議しました
野球	アーチ	練習の後、ホームラン競争を行い、我がボルメッツからは岩本・宇野・原田が参加、見事岩本がアーチをかけるが、ここは長距離打者を揃えたレッドキャップスが圧勝
交通	アーチ	木曽川橋(きそがわばし)は、愛知県一宮市北方町と岐阜県羽島郡笠松町の木曽川に架かる県道(岐阜県道・愛知県道14号岐阜稲沢線)のアーチ橋#現代のアーチ橋の構造 下路ブレースドリブタイドアーチ橋であります
交通	アーチ	プレライニング工法は、トンネル掘削に先立ち切羽前方地山内にアーチシェル(プレライニング)を構築する先受け工法の一種で、確実な先受け効果とともに、トンネル横断方向のアーチによる支保効果を期待できる工法である
交通	アーチ	現在の状態から推察しても、昭和48年の国道拡幅工事の際橋脚を撤去することをせず、アーチの下をそのまま国道として利用、多くの犠牲者を弔う意味からも貴重な北海道の遺産として丸ごと保存して欲しかった
その他	アーチ	アーチやポールにからむつる性のバラや、大輪で一枝にひとつ、又は少数の花をつける、バラと言えば思い浮かぶ形のハイブリッドティ、中輪で比較的長い間、次々と花を咲かせる房咲き性のフロリバンダなど、様々なモダンローズの美しく可憐な姿とバラの高貴な香りを楽しんでいただけます
交通	アーチ	しかも興味深いことにその“近世琉球時代の宿道”のほか、すぐ近くには“大正時代に整備された村道(アーチ型の奥首橋も残っている)”や、“戦後アメリカ軍によって造られた道(のちに旧国道329号線になる)”、“そして現在の金武大橋(現在の国道329号線)”と、4つの時代の4本の道が残っている場所としても、とても珍しい
その他	アーチ	日本・小野寺透・1983年花色:赤、中心は白花径:2~3cm花形:丸弁一重咲き樹形:ツル性樹高:300cm香り:ほとんどない用途:鉢植え、庭植え、アーチ、オベリスク、フェンス、壁面栽培方法植付けの際には30センチくらい深く掘り、植え土の一部に元肥として腐葉土や乾燥鶏糞をまぜた土を植え穴に戻し、根が肥料に触れないように植え付けてください
野球	アーチ	(写真左:早くも3号アーチを放つなど好調な打撃だがこの日も不安定なピッチングに終わった相川 写真中:グリーンモンスター越えの2号アーチで相川とのキング争いを演じる野口 写真右:打っては会心の当たりをグリンモンスターに阻まれ、投げては数球で故障再発とついてなかった板倉)
野球	アーチ	小林監督は3連升延長十一回二死満塁から石川は刻んでIOC委員を山形にダルビッシュとの活気がフィギュア規定を二死無走者からの初アーチに緩和したことが中越えに高橋のしかし、この夜は白星の高橋の8位だった
交通	アーチ	昭和62年には建設委員会が組織され、 建設が始められ「千住宿」をモチーフとしたタイルをはめたカラー舗装、ガス灯をイメージした街路灯、区内初のカリヨン装置を装備したアーチなど画期的な事業であった
野球	アーチ	4試合ぶりにスタメン復帰を果たした松井は、2回無死一塁で迎えた第1打席、第2戦で決勝アーチを放ったフィリーズ先発マルティネスのストレートをとらえ、ライトスタンド2階席へ今シリーズ3本目となる先制2ランを放った
野球	アーチ	[中村2安打、メジャーいける/日米野球][西武カブレラ、メジャー撃ち/日米野球][イチローが上原との対決で無安打に苦笑い][今岡がペニーから全日本初アーチ]www
その他	アーチ	イエローやアプリコットのランブラーをトレリスやアーチに絡ませてみたい、香りがある、返り咲きの品種がほしいとお考えの方におすすめしたいのが、バフ・ビューティです
交通	アーチ	1755年の法令で橋上の家は取り除かれ道路専用となり、交通量の増加により部分的改修が加えられたが、1831年に五つのアーチがある橋脚間隔の広い2代目石橋が完成、テムズ川の航行が便利かつ安全になった
交通	アーチ	合計34基ものアーチ橋すべてが大雪山国立公園内の自然の中にあるので、周囲の木の枝を折ったり植物を持って帰ったり、ゴミを捨てないよう必ずマナーは守って鑑賞しましょう
野球	アーチ	早稲田大学でも1年秋に六大学史上初のデビューから2試合連続で代打本塁打を放ち、その後もスラッガーとして六大学通算でも10本のアーチを架けました
野球	アーチ	ペナントレースでのチーム成績がいまいちの巨人も、監督推薦で出た高橋由伸は連続アーチで MVPと活躍、立派に実力は見せてくれたし、ルーキーの木佐貫投手も実力通り頑張っていた
交通	アーチ	今回開発したウィングプラス工法では、防護と止水の機能を兼ねた先受けアーチシェルを本線シールドの施工時にトンネルに沿って連続的に行えることが特長である
交通	アーチ	このように、水領域が5タイル幅以内でないとアーチ橋になってしまうのだが(道路の場合に限る)、このようなアーチが道路より上に来る中路式アーチ橋(上路式も)は、私の記憶では名古屋にはありません
その他	アーチ	桜の花を写真に撮っている人がいたり、画を書いていたりしていた人もいましたし、桜の木のアーチの中を、家族・夫婦・カップルでお散歩している人たちもたくさんいました
交通	アーチ	アーチと縦の木に対して屋根を作る斜の木の美的バランスの悪さと木組みの細部の荒い加工などが残念ですが他の全米のcovered bridgeに比べれば抜きん出てすばらしい仕事です
交通	アーチ	映画では入り口部分のアーチがちらと出てきただけなんですけど、ものの本をみると、昔の建物がまだまだ面影を残しているらしい、、というので早速探検することになりました
交通	アーチ	記念事業として南北の両入口にアーチが建設され、昭和40年代前半、戦前の活気を再び取り戻したと思われた矢先の昭和42年、山陽電鉄兵庫駅が撤去され、市電も廃止された
交通	アーチ	車/中央自動車道を甲府・長野方面へ~一宮御坂IC~石和方面に出て笛吹川沿いを笛吹橋へ、石和温泉入り口アーチ前 車以外/JR中央線石和温泉駅下車、車7分
交通	アーチ	園内は5つのゾーンに分かれ、石碑の森があるバンナ森といこいの広場ゾーン、展望台がいくつも楽しめるバンナスカイラインゾーン、熱帯植物園がある森林散策広場ゾーン、アーチ橋の野鳥観察広場ゾーン、子供広場で人々が賑わうふれあい子供広場ゾーンで構成されています
その他	アーチ	走るときの衝撃は主に足裏のアーチという部分で受けますが、偏平足の人や、特に体重のある人は、受けきれず、それが脛や腰の負担となってくることが多いです
野球	アーチ	気になる金本、9戦連続ノーアーチ ★好投“おジャン”最長タイ7回2失点「こういう日もあるよ」 ★「止めないといけなかった」林、痛恨ミスに反省しきり ★二軍調整中の安藤、18日にウエスタンで今季初登板 ★ヤ軍・井川ひとまず残留
野球	アーチ	いきなりのフリー打撃で33スイング中5アーチを放つなど、とてもシーズン終了後からボールを握らなかった選手には見えず、体の切れも若手を上回っているという
交通	アーチ	2Dと小さく、トンネル地形の関係が偏圧を受けやすい斜面平行型であり、グランドアーチの形成が困難と推測され、ゆるみ土圧・湧水による支保能力不足、および切羽天端の崩壊に伴い発生する現道の沈下と斜面崩壊が懸念された
その他	アーチ	黄色よりも若干遅く咲くようですがいい香りと美しさでは負けません アーチに絡ませていますがすくすくと育ってくれました 普通のバラよりは手入れは楽ですが毛虫はこの花が好きなようで花ばかり食べてしまいます
野球	アーチ	というには程遠く、技の一発という感じの一打ではございましたが、アーチを掛けた打球はレフトスタンドへ吸い込まれ、実に見事な満塁ホームランでございました
交通	アーチ	当時の姿を偲ばせる、レンガアーチ橋、石造の新内沢大築堤、石造の新内トンネルやレンガ造の狩勝トンネル、 レンガ造りの新内駅舎に石造のホーム、機関車、列車など
交通	アーチ	道路交通に影響を与えず、昼夜間の施工を可能とする「アーチフレーム工法」の全国初の採用を視野に、既存工法とコストや工期を比較検証するとともに、施工手順などを検討する
野球	アーチ	最近怪我が多くて「そろそろかな」と思っていた矢先に1試合4打席連続アーチの日本タイ記録(四球を挟む)を達成(03 6/28)まだまだいけますね
野球	アーチ	3年間の兵役からもどり、初のMVPを獲得することになるウィリアムスは、本拠フェンウェイ・パークで開催されたオールスター戦で4回に中堅越えにアーチを放つなど3打数3安打
その他	アーチ	2週間前はやさしいピンク色のアーチになっていた満開の桜並木もすっかり葉桜になりましたが、様々な植物の新芽や鮮やかな黄緑の葉っぱが見られこれからますます新緑のきれいな季節と移り変わっていくのでしょうね
野球	アーチ	ここのところ鬼神のような働きを見せる里崎が攻守に活躍し、決勝アーチを含む3打点も見事でしたが、最後のホームクロスプレーで体ごと走者に飛び込んでいった姿に気合いを感じました
交通	アーチ	明治21年に造られたこのトンネルは、一般に「ねじりまんぽ」と称されているのですが、「まんぽ」とは、線路の下をくぐって通り抜けが出来るようなトンネルなどの構造物を示す、中部地方から近畿地方にかけて使われていた方言で、この「まんぽ」はトンネル内のアーチ構造を煉瓦積みをしていく時にねじれるような積み方をしていった事から、「ねじりまんぽ」と呼ばれているのです
その他	アーチ	花のタイプは総状花序、花房の長さ及び幅は中、花の向きはアーチ状、花形は一重咲、花の縦径及び横径は中、つぼみの色は淡紫ピンク(JHS カラーチャート9501)、旗弁、翼弁及び舟弁の色は黄白(同3301)、旗弁基部の色は鮮黄緑(同3506)、旗弁全体の形は扁円形、がくの色は浅黄緑(同3109)、小花柄の長さは中、花数は多、花の香りは無である
交通	アーチ	リビングとダイニングを繋ぐ壁はアーチ型に、キッチンの壁には暖色系で組み合わせたモザイクタイルを貼るなど、曲線や配色でもぬくもりを表現しています
野球	アーチ	そして、同点で迎えた8回も小久保第10号の3ランで勝ち越し これで流れを呼び込んだと思った、すぐ裏 ノーアウト1・2塁から、球は120を越えてました まさか同点アーチを叩かれるとは
その他	アーチ	こうした細部の変更などもありまた、アーチよりも南側のチューリップ畑としてしか使われていない花壇をどうするかを決めないことにはアーチが良いのかどうか決まらないのでアーチの製作は当分見合わせ
その他	アーチ	我が家のエントランスは、片方がボーダーガーデンになっていて、高くなっているのとそんなに広いわけではないので、市販のアーチはおくにおけない状態だったのですが、左右それぞれ違う高さの支柱を組み合わせることで解消されました
野球	アーチ	しかし今日は、ウッズに満塁アーチを浴びたあと佐伯に出した四球のときの審判の判定に対してなのか分かりませんが怒りの表情、7回にウッズを三振に取ったときのどうだと言わんばかりの気迫の表情など気持ちが前面に出ていたのが結果的にウッズのホームランによる失点だけに抑えられた一番の要因だと思います
その他	アーチ	すでに、アーチを削り始めてから、のべにして4日くらいかかっているでしょうか、実際には、作業ができる日とできない日があるため、実質2週間くらいかかっています
その他	アーチ	潜行して直ぐ小アーチから大アーチ、トンネルを抜けて沖の根回りのコース、大アーチの付近は底揺れで浮遊物が多いがトンネルを抜けて少し沖に出れば回復する
交通	アーチ	向皆外トンネルは1954年2月に着工され同年6月に開通したものの、その後の降雨や台風の影響により坑内のアーチ、側壁のコンクリートに剥脱が生じ始め、ついで地盤の変化によるトンネル中心線の移動や断面の変形が発生し、ついにはトンネル周辺の地山全体が水窪川に向かって滑り始めたため、放棄せざるを得ないと判断された
交通	アーチ	老朽化していた街路灯・アーチを新設、街路をカラー舗装化(平成13年~平成14年3月)によりハード、ソフト両面の積極な取り組みと実績が評価され、法人化のモデル商店街として全国商店街振興組合連合会より全国で唯一推挙され、全国県市町村機関及び未組織商店街への啓蒙用としてVTR撮影(平成14年8月~平成15年3月)
野球	アーチ	先んじて韓国がベネズエラを下した事で、勝てばまたまたまたまた韓国とやらされる羽目になってしまったと言う欝な雰囲気の中、2大会連続MVPを狙う霊感投手・松坂がロバーツに初回先頭打者アーチを被弾し、試合開始早々追いかける展開に
交通	アーチ	ところで、鉄道橋に眼鏡橋と同じ石造アーチ構造を用いた例は九州の他の路線にもその存在が知られているが、数は非常に少なく、今のところ福岡県中間市筑前垣生(JR筑豊本線)、長崎県多良見町伊木力・山川内(JR長崎本線)、熊本県植木町円台寺(JR鹿児島本線)地区、それに大分県日田市の筑後鉄道軌道橋(廃線)のわずか5例が確認されているにすぎない
交通	アーチ	で、こちらは深山峡から車で15分程度の場所で、日本第2位のアーチダム・温井ダムの少し奥にある瀧山峡大橋 からダム湖と紅葉を空撮風に撮影してみたのですが、その途中で見事な紅葉を見つけたので思わず撮影した のがこの1枚です
その他	アーチ	(地元情報)天草下島北部広域農道桜のアーチが入口から永遠と桜が出口までありました昼食は富岡の明月でチャンポンと思ってましたが、出前だけ営業中だったので食べれませんでした
交通	アーチ	・ めがね型トンネルの中央導坑から本坑のアーチ状の掘削断面に沿って、ウォータージェットを併用する刃口推進方式により曲線鋼管を挿入し、鋼管から所定の領域に薬液注入して地盤を補強するとともに、この鋼管をトンネル支保工とする(プレ・サポーティング・システム)
野球	アーチ	「秦」の先頭打者アーチで幕を開けると、5回には4連続四球から「吉崎」「西郡」の連続タイムリーで一挙5点を上げて早々と勝負を決めれば、絶好調「山下」が2安打8奪三振の好投で反撃を許さず初優勝へ王手をかけた
その他	アーチ	成株になったときの樹形の目安は枝長400cm×幅200cmのクライミング型で花壇の後方や、大型のアーチやフェンスやパーゴラやトレリスに適します
交通	アーチ	この日も、他のアーチ橋が見られる橋(国道です)の真ん中に堂々と路上駐車している人や、車が来ているのに道路の真ん中で写真を撮って交通の妨げになっている あほぉなカップルが・・・
交通	アーチ	まず、現地に入って最初に気がついたのは、国道により沿うように点在していた旧国鉄線の石造アーチ達が、国道の新道工事によりすっかり消滅してしまっていたことだ
その他	アーチ	超音波の性質、画像の作成のしかた、ドプラ法、カラードプラ法、探触子について、 アーチファクトについて、安全性について、 超音波用語について、超音波画像のトレーニング
その他	アーチ	紅葉を残した枝々が雪の重さでアーチを描くロマンチックな林道を、フロントガラスに迫りくる枝を避けたり、凹凸のある路面に翻弄されたりしながら、ワイルドに疾走することひととき
その他	アーチ	これらのトレーニングは、足の横のアーチ(5本の指を横に繋いでいる靱帯)を鍛え、足の発達を促し、「開張足」や「外反母趾」の予防や進行を食い止めるのに有効です
交通	アーチ	鋼材を組み合わせて荷重を支えるトラス橋やアーチ橋などと呼ばれる橋で、高速道路や国が管理する国道に設置された26本のうち12本で鋼材が損傷していたことが、国土交通省の調査で分かった
交通	アーチ	そこで元の場所に戻り新しい道を進むことになりますが、そこに三永の石門といわれる国道をまたいでかけられた石造りのアーチ橋が国道2号線の工事に伴い移設保存されています
交通	アーチ	薄肉鋼鈑によるトンネル補強工法は、劣化した既設トンネル覆工の内側に、厚さ6mm、大きさ40cm×1mの鋼鈑を 1枚ずつボルトで、既設覆工面に沿ってアーチ状に組み立て、既設覆工面との隙間に充填材(モルタル)を注入し、 既設トンネルの覆工を補強する工法です
その他	アーチ	集合住宅の花壇でマンデヴィラ(キョウチクトウ科)が綺麗な花を咲かせています、この場所では鉢植えに成っていするものと地植えのものがあって、地植えのものは2メートル程のアーチに絡ませてあり、これから更に沢山の綺麗な花を咲かせるものと思います
交通	アーチ	これももともとは前二つと同じく狭い煉瓦積みアーチのトンネルだったはずだが、今はすっかり改築されて、二車線幅の広いコンクリートのトンネルに変貌していた
