# 植物: 竹や木の骨組みをスギ・ヒノキなどの青葉で包んだ門。緑門。, 野球: 野球で、ホームランのこと。アーチをかける。, 交通: 上方が半円形をなす構造物。家の入口、橋、トンネルなど。せりもち。
その他	アーチ	もう一つは、日光近くの旅籠の便所で、渡り廊下の縁取りの自然の木の幹や、便所の入り口に使われた葡萄づるのアーチなどの素材に注目し、外側の竹垣や植木の趣味を褒め、木製の四脚台と手洗い桶が外国人にも使いやすい設備だと記述しています
その他	アーチ	S字に曲げて・・・って言うけれど、地面に近い枝は木の様になっていて、ちょっとやそっとの力じゃ曲がんないので、アーチと枝をS字フックで強引に固定しながら麻紐で結んでいきました
交通	アーチ	15年前に、あいロード商店街のアーチ、街路灯、カラー舗装のデザインを行い、最近は、中野のまちづくりを中心に都市計画審議会作りの委員としてすみよい中野を目指しています
植物	アーチ	その長さおよそ110メートル、中央の塔の高さ30メートル、杉の葉で覆ったアーチの上には「聖駕奉迎」の文字がガス灯や色とりどりの花で飾られ、その前には「皇威発揮」「国光宣揚」と書かれた巨大の幟が翻った
交通	アーチ	素晴らしい桜の木がありました、未だ花は咲いていませんでしたが バックが裏妙義で古い建造物や民家があって逆光でしたが、此れが桜が5分咲きになったら、素晴らしいのでは、少し上にはダムもありましたが、ダムサイトまでいかなかったのでカメラポジションが無く、絵には成りそうも有りません、アーチ橋は素晴らしいのがありましたが、此れもこのままでは絵には いかがな物か
その他	アーチ	観音様には 女とお金以外の願い事をしたあとに 男祭りだったので、砂辺秘密ポイント女性のアソコポイントに・・・その後空を飛ぶように根から根へお花畑ポイントをとうり最後は小さなアーチを
交通	アーチ	聖堂の建築は、本来煉瓦造りか石造りであるが、当教会の聖堂は秋田杉をたくみに加工し、聖所の架構法も四方から木製アーチをのばしてドームをかけるなど、貴重な木造ビザンチン様式建造物である
交通	アーチ	午後、雪花石膏(アラバスタ)の切片で出来たステンドガラスの窓の隙間から日の光が射し込むと、堂内は暖かい光に包まれ、ダークブルーのアーチには567もの星々が煌き、魅惑的な雰囲気が広がる
野球	アーチ	まずは2回、男・村田選手のスコアボード直撃の特大ソロアーチで1点返すと3回には石川選手と早川選手の連打でチャンスを作り、ウッチーは四球を選び相手ピッチャーにプレッシャーを与え、村田選手が今度は犠牲フライで2点差に
その他	アーチ	コガネムシにかなりやらたアーチの薔薇ニュードーン、花の終わりかけたソープワートやレースフラワーなど、白っぽい花などは、きれいな部分だけが宵闇に浮かぶように、とてもきれいに見えます
その他	アーチ	モロコ根から入り透明度20mを味わった後は、26アーチでテングダイ3匹、そこから軍艦でキビナゴ群れ襲う巨大なマダイやソウシハギを見て、コブ根へ行ってトビエイやアカエイ
交通	アーチ	駅前の県道は人や自動車の往来が多く、今年1月には、アーチ上部から落ちた氷雪が歩行者の頭部に当たってけがをしたこともあり、道路を管理する県が市に撤去を要請していた
交通	アーチ	遠くから眺めると木と木の組み合わせによってのみで橋が支えられているかに見えますので(実際には金物が使われております)、その木のぬくもりが伝わってくるアーチ状の橋を建造した匠達の技術は素晴らしいものであると感激しております
その他	アーチ	その後、アーチを保つために(偏平足の予防)、当院では、足病学に基づいたリジットインソール(矯正用インソール)を挿入し距踵関節のアライメントを整えます
野球	アーチ	攻撃面でも前田選手の先制アーチ、捕逸で二塁から一気にホームインした嶋選手の好走塁、3−1の均衡した場面で飛び出した東出選手の上から叩いたツーラン、止めのシーツ選手と緒方選手の本塁打と気づけばスコアは8−1
交通	アーチ	環境に対し無害なものにするための準備(放射能を環境に放出することなく、その中で核燃料含有物質を解体撤去作業をするための、石棺を覆うドームかアーチ「第2シェルター」の建設を含む)
その他	アーチ	何年か前まではこの温泉もほんの茅葺《かやぶき》屋根の吹き曝《さら》しの温泉で、桜の花も散り込んで来たし、溪の眺めも眺められたし、というのが古くからこの温泉を知っている浴客のいつもの懐旧談であったが、多少牢門じみた感じながら、その溪へ出口のアーチのなかへは溪の楓が枝を差し伸べているのが見えたし、瀬のたぎりの白い高まりが眼の高さに見えたし、時にはそこを弾丸のように擦過してゆく川烏の姿も見えた
その他	アーチ	フェンスの上で大きく写っている木は、プリペット アーチに、つるばらのアルバメイディランドを誘引 アルバメイディランドは、昨年の春に新苗を、植えつけまし [続きを読む]
その他	アーチ	広場にアオブダイ数匹、キホシスズメダイ、シラコダイ、チョウチョウウオ、キンギョハナダイ、ブダイ、沖根で15センチ位のサザナミヤッコの幼魚1匹、120センチ位のカメ1匹、沖根からアーチ行く途中にもう1匹120センチ位のカメ1匹、アーチの下にニザダイの大きな群、浅瀬に戻るとヘビギンポの雄はが婚姻色
野球	アーチ	(メモリアルアーチ)プロ初打席初本塁打(それと同時に福岡ダイエーホークスチーム1号本塁打)、日本プロ野球通算6万号、パ・リーグ通算3万号、平和台球場公式最終戦本塁打、ロッテに日本記録を更新させる17連敗を付ける代打サヨナラ満塁本塁打
その他	アーチ	頑固なお祖父ちゃん(小松政夫さん)からのプレッシャーもあって“君はtoo shy”だった境野涼子ちゃん役山口愛さんは、笑うとクシャッとなるクチもとやアーチ型に細まる目もとが、80年代初頭の『金八先生』などで活躍した名子役伊藤つかささんにそっくりですね
その他	アーチ	江南団地、犬山まつり、江南市民まつり、アジサイ、ツララ、霜柱、ツインアーチ138ライトアップ、エノキ、桜、キバナコスモス、馬の像、夕焼け、ヤナギ、雪景色、雑木林、
その他	アーチ	道路において工事もしくは作業をしようとする行為 道路に石碑、広告塔、アーチ等の工作物を設けようとする行為 場所を移動しないで、道路に露店、屋台等を出そうとする行為 道路において祭礼行事、ロケーション等をしようとする行為
交通	アーチ	利根川源流の町・水源の町みなかみ町には、大きなダムだけでも5つ、すべて合わせると7つものダムがあり、「アーチ式」「重力式」「ロックフィル式」と種類も豊富です
交通	アーチ	国道脇の遺跡にしてはとても目立たなくて気に入っていたのだが、個人的にはしょうもないと思えるレプリカの駅名板などが設置されてわかりやすくなった^^;)それでも、特に国道に案内板があるわけでもないので、アーチ橋に入りこむ数を思えば微々たるもんなんだろうな
交通	アーチ	忙しかったので、昨日はチラッと見ただけだけど、数棟の大きなマンションに向かって、幹線道路の低いアーチが伸びやかに登って行っていて、そこをひっきりなしに車のヘッドライトとテイルランプが行き来している様を、飽かずずーっと見ている日もある
野球	アーチ	一方、イチローはオリックス時代に初の年間200安打(94年)以外にも、リーグ優勝を決めたサヨナラ安打(96年)、同年の日本シリーズ初戦の延長戦での決勝アーチなど、チームの勝利と連動するハイライトシーンが多かったが、渡米後は年間最多安打記録を樹立し、従来の記録保持者ジョージ・シスラーの遺族らから祝福された試合(04年)
その他	アーチ	中足頭部分のMPパッド(メタターサルパッド)で前ずれや、横アーチの復活を狙っているものですが、以前の記事にも書きましたが、黄色人種、モンゴリアンである日本人の関節の動きには、位置的に前過ぎるので踵部分を5mm程度カットして使った方が快適だと思います
その他	アーチ	つまり、木をこのように組み合わせれば、 アーチ状に曲げられない木で、 アーチ構造と同じように横方向の力を縦方向の力に換える効果があるように思える
野球	アーチ	まだ1点をリードしていた6回に登板した栂野投手が目覚めた怪物・中田翔選手に同点アーチを浴び、7回に佐竹投手が傷口を広げてマウンドを投げ出しましたが、ノーアウト満塁で登板させられて5点を失うことになった青山投手が気の毒過ぎます
野球	アーチ	試合の方は4点を先制される苦しい展開ですが、ジョーのアーチ、マートンのタイムリー、あ~らいさんのバットを折りながら根性で打った同点タイムリー(次回からは技術で打つように)このころ、ガッツさんから電話がありTV映ってたとの連絡です
その他	アーチ	お昼からは急に風が強くなりアーチのマダム・アルフレッド・キャリエールの伸びっぱなしになっていた長いシュートが気になり、さっそくこちらも株元からと途中からの太い枝をノコギリで切りました
その他	アーチ	選択してください 前浜ホールB&G前宇勝のアーチニュードロップオフハキビナのクレパスヨロンコロン沈船あまみハキビナのカスミ根ウワノマキのアーチ品覇沖電報口那間ホヌホヌ(カメポイント)供利沖海中宮殿(茶花沖)フンチュ崎ブルーコーナー長崎の塔供利パスサイドマーメイドロックダブルクレパスウワノマキのキャニオンクマノミパラダイスハキビナのマグロ根その他
野球	アーチ	しかし、調子がどうもあがってこなかったようで、本来143K前後の球速も137〜139Kと伸びてこず、開幕の慶応戦ではスラッガー佐藤翔にグランドスラムを被弾、続く法政2回戦でも法政4番の大澤に2連続アーチをかけられ(ツーラン、スリーラン)、リリーフにまわることになる
野球	アーチ	青木選手が4打数3安打(1本塁打)2打点と、今季12度目の猛打賞、梶本選手が5打数2安打、宮本選手が4打数2安打1打点、鬼崎選手がプロ初アーチを含む4打数2安打2打点と活躍しました
その他	アーチ	そして最後に鈴なりの花を付けたのが、娘が両手で持っている「ホワイトドロシー」 ボクの指さすアーチの上には、まだまだ花や蕾が無数に咲いており、まさか2年でこんなにバラが咲き乱れるとは・・・バラの花園に囲まれて、久しぶりに、娘相手に美味しい酒を飲んだのである
その他	アーチ	裏板は平坦ではなくかなりきつめにアーチがかかっているため直線的に接着できないわけです、従って一発で「はい接着オシマイ」というわけにはいきません
野球	アーチ	夏の南大阪大会決勝戦では小泉 孝太郎もビックリの特大アーチを舞洲BSで放つも延長サヨナラエラーでの敗戦となってしまい8月に藤原監督の部内暴力があり、7年ぶりに河野監督が復帰した
交通	アーチ	橋の両側は平坦な農地や牧草地になっており、グランドキャニオンのような深くえぐられた渓谷をまたぐ長さ約80mのアーチ型の橋であり、川面から橋までの高さは約50mと大変高く吸い込まれるような感覚を覚えます^−^
野球	アーチ	そんななかワンボール、ツーストライクでむかえた第四球目、レフト方向へのレインボーアーチは、火星にも届きそうな勢いで、みごとフェンスを越え満塁ホームランとなった
その他	アーチ	また、低層部においては、花崗岩貼りの壁と開放的なアーチ状のガラス窓の組み合わせにより1・2階店舗の表情を歩道空間に引き出し、街路樹や植栽と一体となった街の賑わいを演出しています
交通	アーチ	なお、先受けアーチシェルは本線シールド・ランプシールドのどちらからも施工可能であり、施工規模や時期などプロジェクトの条件により最適な施工手順を選択することができます
交通	アーチ	神戸市創設水道の水源池堰堤としては明治33年3月(西暦1900年3月)竣工の布引五本松堰堤がわが国初の重力式粗石コンクリート堰堤として著名であるが、五本松堰堤が直線型であるのに対し、烏原堰堤は堤体をアーチ状に湾曲させ優美な姿となっている
交通	アーチ	年には大江橋とともに、国の重要文化財に指定されたコンクリート製のアーチ橋で、名前は江戸時代初期、大阪の豪商「淀屋」がこの橋を架橋し、管理を任されたことに由来します
交通	アーチ	現在の橋は、大震災復興事業の最初の工事として架け換えられ重量感あふれるシンプルなアーチ型で、テレビドラマやお天気カメラのロケ地としてよく登場しています
野球	アーチ	神宮球場レフトスタンドに掲げられた横断幕では 「バースデーアーチ、種田仁」なる ご無体な要求 をされてしまった緊張からか、得意のブン回しで敢え無くピッチャーゴロ
その他	アーチ	上のアーチ状の部分にも出来るだけ隙間がでないよう木を詰め込みます(挿し木と呼びます)この部分は大概燃え尽きてしまいいい炭にならないので、桜や朴の木などの雑木を使います
その他	アーチ	また、現在の靴には、土ふまず(縦アーチ)を支えるためという事でクッションが入っていますが、アーチは本来足裏の筋肉と靭帯により形成されるものです
交通	アーチ	3m 高速道路の山江サービスエリアのすぐ近くに位置し、現在ではコンクリートで拡幅されており、道路からはアーチ橋とは気付き難いが、輪石は確固たるもの、架橋当時のままであろうか
野球	アーチ	ミッキーくんのデビュー、浩二監督600勝、古田兼任監督の2000本安打、清原の500号アーチ、野間口疑惑のプロ初勝利、佳紀の離脱、仰木監督意味不明な44分間抗議で退場、クルーンから新井が一発、大島プロ初勝利、市民球場に阪神ファン占拠(9月下旬)
野球	アーチ	3回タイガースはエラーで先制2点を失う[:悲しい:] 新井サン(4回鳥谷を置いて)、金本の(6回浅井を置いて) アベックアーチが出ましたがゲームの行方はどっち
交通	アーチ	「ねじりまんぽ」とは、煉瓦をねじって積んで作る、アーチ構造のことで、この場合、インクラインと下をくぐるトンネルが直角に交わっていないため、下から少しずつ斜めにずらして煉瓦を積んで行き、トンネル最上部でインクラインと煉瓦が直交するようにして上からの重さを支える工法らしい
交通	アーチ	国道51号に架かる成田橋のアーチ部分の鉛直部材に2007年12月、亀裂が見つかったことを受け、国土交通省関東地方整備局千葉国道事務所は詳細調査を実施
交通	アーチ	コミュニティホール、買い物客用駐車場、装飾街路灯、アーチなどの共同施設ができたほか、一部の地区では、歩道のカラー舗装、電柱のスリム化が実施されました
交通	アーチ	これらのアーチ橋は、まだ環境云々と騒ぐ事がほとんど無かった頃に周囲の景観や環境に配慮した設計がなされていて、技術的な価値も高く評価されていると言うのが選定理由でもある
その他	アーチ	図1 カボチャの立体栽培/図2 カボチャの立体栽培とアーチの構造(右下はおもちゃかぼちゃ)/図3 ジャイアント・パンプキン世界チャンピオンの白井昭二さんと439
野球	アーチ	1点リードの8回、今季の“勝利の方程式”として原監督が送り出したM・中村が、栗原に逆転3ランを喫し、続くシーボルにも2試合連続のアーチを許し、自身初の2被弾で逃げ切りに失敗した
その他	アーチ	エントリーして直ぐの浅瀬の水面近くにギンユゴイの群、ニザダイ、キホシスズメダイ、キンギョハナダイ多い、沖根を廻りアーチへ、沖根にススメダイ系多い、アーチ手前の水路にスズメダイが 卵を守っている、幾つかの卵は、目が出来ていて金色、アーチの下にニザダイの群、浅瀬に戻るとチョウチョウウオの群
野球	アーチ	打線は相変わらず絶好調、ブラゼルの5試合連続アーチ、城島の場外アーチ、マートンの満塁弾、関本の同点の2点タイムリー、桧山の逆転2点タイムリーと、こーなると誰がヒーローかわからん
その他	アーチ	選択してください 宇勝のアーチヨロンコロンハキビナのマグロ根マーメイドロックB&G前電報口ハキビナのカスミ根那間沈船あまみウワノマキのキャニオンホヌホヌ(カメポイント)クマノミパラダイス長崎の塔ニュードロップオフハキビナのクレパス海中宮殿(茶花沖)前浜ホールダブルクレパス品覇沖ウワノマキのアーチ供利パスサイドブルーコーナーフンチュ崎供利沖その他
野球	アーチ	4回には代打、梶原慎平の大会第2号となる代打ランニングアーチも飛び出し、川之石はこれ以上ない上げ潮ムードで第1シード今治西の待つ2回戦へと駒を進めることになった
野球	アーチ	実に6月12日のバースデー満塁アーチ以来70日振りで、自身日米通算443号となるこの本塁打は長嶋茂雄・巨人軍終身名誉監督(72)の持つ444号まであと1本と迫る一発となった
その他	アーチ	最高の地形が楽しめるポイントです☆エントリーしてすぐにトンネルやアーチにドロップオフ、トンネルを抜けた先に広がる広大な砂地、まるで山のように大きなハマサンゴとダイナミックな地形でこれでもかって言う位、遊んできました
その他	アーチ	一人の大法弟子はアーチ形の花の冠を作る際、始めはどうつくるか全く知らなかったが、彼女は正念の作用の下で、突然予想できない知恵が生み出され、その結果非常に立派なアーチ形の花の冠を作り出した
野球	アーチ	リーグ優勝を果たしながら、日本シリーズを出場辞退するなどと言う訳の分からない事態を死力を尽くして回避したい西武は初回、日本ハム先発・グリンから中島のソロアーチで先制すると、3回には一死一塁からまたも中島が2打席連続の2ラン
野球	アーチ	横浜の先発「二代目番長」三浦大輔は、序盤に2本のアーチを食らったものの、完全アウェーの中でも崩れることなく、散発5安打2失点できっちりまとめて完投勝利
交通	アーチ	歩道と道路の境界線には絶えず水が流れる側溝にはゴミが点在して、あまり治安のよさそうな場所ではないが、通りの両側に立ち並ぶ普通の商店から突如として石造りのアーチがあったり、ふと見上げると、そこから見える古いアパートメントの屋根の傾斜がとても美しかったり、観光客相手ではない素顔のパリが広がっている所に好奇心をそそられたのだろう
その他	アーチ	それでも赤城道路は蓑輪の駐車場を過ぎると除雪車が3台も出て除雪作業中で、山側の路側から削り取った雪を谷側に飛ばしていたりして、すごい勢いで噴き出す汚れた雪のアーチの下をくぐって大沼に向う
交通	アーチ	与那国島の海底のアーチ門や陸上の巨石遺構を見ますと、瀬戸内海の安芸の宮島の弥山の巨石遺構と厳島神社、そして、伊予の大三島の大山祇神社のエリアに、これに似た遺構があるのです
野球	アーチ	1回3者凡退で今日も打てないのかな・・・と思っていたら 2回にアニキいきなり先制アーチ1−0(サンスポ) さらに4回、3試合無安打の新井さんがヒットで出塁すると、 アニキまたまたホームランで3−1 (サンスポ)
その他	アーチ	今の時期たくさんの種類のバラが咲いていて、いろいろなお花や植物がきれいに植えられていて、いくつもの花のアーチを通ったり、池の上の小さな橋を渡ったり、とっても憧れの世界でした
交通	アーチ	国道218号沿いに位置していて、水面からの高さ137メートル、長さ410メートルの、国道に架かる道路橋としては東洋一の規模を誇るアーチ橋「青雲橋」を一望することができる
その他	アーチ	ぶどうの樹の下で結ばれたカップルは幸せになれる、との言い伝えのごとく、ぶどうの樹のアーチの元で行われた挙式は、人前式で行われ、皆さんに見守られた新郎新婦は感動的でした
野球	アーチ	14日(日本時間15日)トロント・スカイドームで行われた対トロント戦にカズヒロ・ササキ投手は4点差リードをした9回から登板し、ソロアーチ2発を浴びてメジャー初の被弾と失点を記録した
その他	アーチ	昨年のミニトマトの栽培では、栽培容器002号の使用時の支柱の設置にかなり悩まされたのですが、今年は、栽培容器002号の穴を利用して、180cmのアーチ状支柱を2本用い、真上でアーチを交差させ固定しているので、昨年と違いかなり安定していると思います
交通	アーチ	ステンドグラスの天井はあまり興味はないのですが、梅田駅が地上線だった頃の造りがそのまま残っているアーチ状の仕切、レリーフ、ここは21mmの出番かも知れません
交通	アーチ	それに向かって歩き、王宮の左手前の建物 Palazzo Chiablese の右端に、上がアーチになった狭い通路があり、これを抜けるとドゥオーモ(司教座聖堂 Duomo)までショートカットでたどり着けます
その他	アーチ	スイッチバックを繰り返して登る沿線には、一万株にもおよぶ紫陽花が植えられていて、6月下旬~7月下旬の開花期に乗車すると、紫陽花のアーチをくぐりぬけて行くかのようなのだそうです
その他	アーチ	アーチ部分があるので多少荷物の出し入れがやりにくい(物によって)時がありますが結構大きく広がるし収納もあるのでデイバッグとしては優秀はほうですね
その他	アーチ	この案内板の後方に見える大杉が、古来 「衣かけの大杉」とよばれ、樹高十五メートル、 目通り三・九メートル、地上二メートルの ところから大きな枝が四方にたれ、特に、 一つの枝が長大に成長して、一大アーチを 形成している
交通	アーチ	礼拝用アーチの先端に生命の樹、その両側にも生命の樹、そしてボーダーには十字文様の伝統的のオブルクデザインは、一度見たら忘れないほど印象的で伝統的な図柄です
交通	アーチ	ヨーロッパのゴチック建築とはちがった、半円アーチに基づく垂直性の強いこの特異な大聖堂は、イェレヴァンの国立博物館にある高さ 3メートル近くの大復原模型によって その概要を知ることができるが、この壮大な内部空間を ぜひとも実際に体験してみたかったものである
