# 自動車: おおいがないこと。無蓋。オープンカー, スポーツ: 非公式。オープン戦, ショッピング: 開くこと。開業。開店。来月オープンする予定
スポーツ	オープン	昨年までは何か不安を持ちながらやっていたが、こんなにオープン戦が心待ちなのは初めて」といい、今季は清水直行投手(31)と開幕投手争いをしている
ショッピング	オープン	富士重工業ではこどもの国がオープンした平成2年にこども達が実際に見て、触って、自動車に親しめるよう当時の軽自動車「レックス」の展示車両を児童会館に寄贈しました
ショッピング	オープン	キャナルのオープンの時、親子が手を繋いで歩くシルエットのサインデザインマークで天神からの道案内矢印ボードが、数十メートルおきにずっと設置してあったんだけど、
ショッピング	オープン	オープンした新業態の韓国料理[土古里(とこり)]は牛肉の仕入 れ段階からのトレーサビリティーを確実に実行し安心の食材を提供するとともに、自 慢の多品種にわたる野菜のキムチを始め、生菜(センチェ)・熟菜(スッチェ)・焼 菜(クイチェ)・常備菜(サンビチェ)など伝統の5つの韓の惣菜を、選び抜いたジ ャン
その他	オープン	それぞれオープン価格で、ラインアップと実勢価格は、グラスに入れたろうそくを再現した「ティーライト」が498円前後、ソフトなボールを使い色が変化する「バルーンライト」が1980円前後から、ろうそく風ライトの「キャンドルバー」が598円前後、8種類の点灯パターンの「ダンシングキューブ」が980円前後、「ダンシングライト」が5980円前後
その他	オープン	テキサス州政府観光局×『地球の歩き方』観光プロモーションキャンペーン テキサス・スペシャルサイトが8月27日オープンDream News (プレスリリース)テキサス州政府観光局では、このたび日本市場における同州への旅行需要喚起を目的に、日本最大級の海外旅行情報サイト『地球の歩き方』内にスペシャルサイト(URL: http://www
ショッピング	オープン	2) 平成7年4月のオープン以来人気を博し、夏季の最盛期には満員で、予約を断る人数が定員の何倍にも及んだことや利用者から飲食提供施設の整備を望む声が多かったことから、施設の拡充整備を図ることとした
ショッピング	オープン	西武池袋線保谷駅下車数分、保谷街道沿いの小売市場で約40年営業してきましたが、2003年11月に老朽化のため取り壊し、2004年11月5日マンションの1階に「味の名店館」として新装オープンしました
自動車	オープン	htmlオープンカフェタイプの展望車とシックな指定席車が人気のリゾート展望列車『きのくにシーサイド号』を、この夏休み期間中には初めて天王寺発着とし、「天王寺~白浜」間を1日1往復運転します
自動車	オープン	でも、スーツにオープンが似合わないのも事実、最近スーツ着る機会が増えてしまったんだけど・・・(でも意地でもオープンで運転している)この間都心の某ホテルでぱーてぃーがあったんだけど、そのときにボーイさんに車預けるのちょっと気の毒になった・・・向こうも困った顔していた・・・
その他	オープン	6月8日に近所の『ローソン』で¥600以上の買い物をして、1枚スピードくじを引いたところ、オハヨー乳業の「オープン仕上げとろ~りプリン」の商品無料券が当たった
ショッピング	オープン	うちの嫁さんがプレオープンだから車で行ったら混むやろうと思って、気合いを入れて自転車で行ったのはいいのですが、食料品やらなんやらかんやら買ってたら自転車で持って帰れないほど買い込んでしまい、車で取りに来てということで呼ばれました
ショッピング	オープン	レニエがモゾにオープンするという話が余り伝わってこなかったのでオープン当初は客足が心なしか少なかったように感じてました でも赤城町の駐車場待ち渋滞は多少緩和されてるのでこちらに流れている方も多いことでしょう
ショッピング	オープン	フィッシャーマ○では、オープン時にワゴンセールをしていたDコンも残り僅かとなり、欲しいカラーもなかったので立ち去ろうとすると、ワゴンの下に落ちているピンクを発見このカラーは先日ロストしたので補充です
その他	オープン	このほか同小は、機能性の高い「オープンスペース型教室」や図書室とコンピュータ室を一体にした「メディアセンター」など、色々な教育活動ができる環境です
その他	オープン	ダブルスの結果も掲載しても良いのですが、そもそも神奈川オープンのダブルスは当日エントリーだけで、シングルに出ている誰かを捜してペアを決めて出場もしくは予選で知り合った仲間で出場と力を入れていないのですから止めた
その他	オープン	6月8日(日)、東京辰巳国際水泳場で「ジャパンオープン2008長水路兼世界ジュニア選手権代表選手選考会兼第29回オリンピック競技大会壮行会」最終日が開催されました
ショッピング	オープン	使用済み車両部品のリサイクル製品を展示、販売する県自動車販売店リサイクルセンター(遠藤栄次郎社長)のエコショップ庄内が12日、鶴岡市末広町にオープンした
ショッピング	オープン	前回はなかった遊園地がオープンしていたので遊ぶ事に、電気自動車と小型ジェットコースターとメリーゴーランドと自転車みたいなものをこぐやつがあったけど、我が家はメリーゴーランドに乗る
その他	オープン	▲28型BS/110度CSデジタルテレビ「VIZZON」オープン価格(サンヨー)・・・30型ハイビジョンが中心のデジタルBSテレビ市場ですが、このテレビはBSデジタルハイビジョンを標準画質テレビにダウンでコードして表示する方法を採用することにより、10万円台前半でBSデジタルハイビジョンのコンテンツを楽しむことが出来ます
ショッピング	オープン	29日にオープンしたイギリスのメルセデスベンツ・ワールドでは、62万平方メートルの敷地内に専用のコースを設置し、来場者にさまざまなベンツの乗り心地を味わってもらう無料の試乗会も開かれていた
ショッピング	オープン	減農薬あるいは有機肥料、これらを活用した環境保全型農業の推進が今後求められますし、地元でとれた安全・安心な食材を地元で消費するというふうな地産地消、これを推進して、地元産の安全性、これをまず地元にPRする意味で、御承知のように9月14日にオープンしました産地直売所「まゆの郷」、これを最大限にやはり活用していくことが重要ではないかなというふうに思います
ショッピング	オープン	郡山市の開成山野球場は18日、リニューアルオープンし、元プロ野球読売巨人軍選手で同市フロンティア大使の中畑清さんを迎えたオープンセレモニーを行い、新球場の完成を祝った
ショッピング	オープン	打ちっぱなしのオープン時間である6:00から 7:00ぐらいまでの特打ちで7番、5番、3番アイアンのフルスイング、コントロールショットから始まってドライバー、スプーンと 続けて、その次は短い9番→10番→11番→SWと続けフォームと距離感とコントロールをチェックします
ショッピング	オープン	補正予算案には今年12月か来年1月オープン予定の桑原地区温泉施設管理運営事業費に704万円、磯部地区の戸倉体育館横に本年度完成予定で建設中のサッカー場施設整備工事費の追加に270万円、地域生活支援事業の訪問用自動車(戸倉庁舎用)購入費に141万円、団体営土地改良事業費追加に1300万円、市有林整備事業費の委託料ほか追加に1437万円―などが入っている
その他	オープン	4200REPORT ICは、オープンリールタイプで、フルトラック・モノーラル方式のモデル4100REPORTを、2トラック・2チャンネル方式のステレオタイプにした製品で、最新のモデルは、型番は変わっていないが、随所にマイナーチェンジの跡が見受けられ、絶えず改良が加えられているのがわかる
ショッピング	オープン	でも店内は新しくオープンしたお店だけあって、身体障害者専用の駐車場はもちろん、車椅子が3台ほど入れるスペース(3台も一緒に入ることって、この通信の取材だけかも
ショッピング	オープン	ランドがオープンし、県営の温泉保養施設である「アカシアの湯」や、本格的な野球場とサッカー場、日本TBG協会公認のターゲットバードゴルフ場、花の広場やアカシアの林に囲まれた散策路などが整備され、1年を通して家族連れで楽しめる施設があります
ショッピング	オープン	カレーがとても美味しい&オープン当初からずっと通ってきた為 すっかり店主さまと仲良くなってしまったので、我が家ではカレーといえばこのお店です^^ お店の写真を撮り忘れてしまったので・・・ま
その他	オープン	オープンハンドル・・・ ハンドル全体に柔らかなエラストマー樹脂を採用し、親指の機能が低下していても使用できるなど様々な握り方を追求したデザインです
ショッピング	オープン	しかし、現在の店舗数は近日池袋店オープンで12店舗と、全国のバイヤー達に訴求が難しいため、弊社『シイレ』『健康美容EXPO』にて、ランキンランキン特集をという狙い
その他	オープン	北海道、札幌、不動産、家さがし、555ネット、モデルハウス、オープンハウス、中古住宅、新築住宅、 売り土地、中古マンション、二世帯住宅、不動産投資物件、田舎暮らし、一棟売り
その他	オープン	このため、企業に対しては、ニーズにあった信頼性のあるワーカー情報を検索・参照できるオープンな場を提供すること、ワーカーに対しては、営業、マーケティングを自分に代わって行ってくれ、さらに受注から納品、代金の回収までの業務をサポートしてくれるマネジメント業務を集約的、効率的に行ってくれるシステムを提供いくことをシステム開発の目的とした
ショッピング	オープン	商品名:【オープン特価・消費税当店負担】【インターフォルム/INTERFORM】ペーパーホルダー・perfume販売元:ヘキサゴン ショップ* 商品説明 *華やかな花たちがそよ風に吹かれる花畑の風景をお部屋に
その他	オープン	國學院大學伝統文化リサーチセンターが推進しております平成19年度の文部科学省オープン・リサーチ・センター整備事業に選定の「モノと心に学ぶ伝統の知恵と実践」は、國學院大學が建学以来125年間以上、日本の伝統文化を考究し続けてきたあゆみを踏まえ、祭祀遺物や祭具、古典籍といった「モノ」を通じて、人々が長い間培ってきた「心」を明らかにし、伝統文化が育んだ知恵と実践の社会的意義を究明する研究事業です
ショッピング	オープン	・ 10時に主催者テント、スポンサーブース、飲食ブースがオープンしますのでその時点から観戦場所の入場順番列を別紙図面場所でスタッフがつくります
ショッピング	オープン	異国情緒あふれる函館を、昔ながらの人力車に乗って楽しめる観光人力車サービス会社「えびす屋」の函館店(函館市豊川町7、松田耕治店長)が18日、オープンした
その他	オープン	写真(撮影 : 藤井隆弘・藤井栄美)=オープンシアターに詰めかけたサポーター、ハイタッチで入場する柱谷監督、あいさつする新加入選手、スローガンを持つヴェルディ君、模擬店でラーメンを作るディエゴ選手(上から)
ショッピング	オープン	蘇我の駅前でフクアリに行く途中にあるので、本当はオープンしてすぐにでも行きたかったのだが、日曜休みで夜のみ営業なのでなかなかタイミングが合わなかった
ショッピング	オープン	お父ちゃんの会社の帰り際、その会社の側に出来て、今日オープンの プレミアム・アウトレットモールの様子を見ようと車をやると、まだ朝の8時半 だというのに、もう駐車場に車は入っているし、人も並んでいる
ショッピング	オープン	インターネット・カフェがアッという間にいくつもオープンしたし、アイスクリーム屋やジュース屋、ガソリンスタンドなどもネオンがキラキラと街角に溢れているありさまだ
スポーツ	オープン	守備について、野球をしたい、いつまでも野球少年の心を持ち続けてくれる松井秀喜選手が、オープン戦のドジャースで、645日ぶりに、レフトの守備につきました
ショッピング	オープン	「ピープルエグザス加古川」は、移転オープンに伴い会員制スポーツクラブ「エグザス」を併設した大型複合施設となり、加古川市内で最大規模のスポーツクラブへと生まれ変わります
自動車	オープン	機関車がブレーキをかけはじめた時に、客車の車掌もオープンデッキの備え付けのハンドルブレーキを機関車とのタイミングを併せてブレーキをかけて土山駅に到着
その他	オープン	*1983年PGAゴルフ・ハワイアンオープン最終日、青木功が首位に1打差の2位で迎えた最終ホール、残り128ヤードの第2打をチップインしてイーグルで逆転、日本人としてのPGAツアー初優勝
その他	オープン	同年の全米オープンジュニア男子シングルス部門、世界スーパージュニアテニス選手権大会においてもそれぞれ準優勝を遂げるなど、フランスのテニス界において早くからその銀座・柏・亀有 美容室を期待されていた1人であった
その他	オープン	「雑貨屋さんに来たような」 くつろぎ感ただよう空間づくり 4月上旬にはこころ住宅展示場に、5月には春日野に、相次いで、ドヒハウスの新しいモデルハウスがオープンする
その他	オープン	まず始めはメッツの本拠地シェイスタジアム(近くには全米オープンテニスの会場もある)でメッツvsシンシナティ・レッズ(ケン・グリフィー・Jrがいるところ)を観ました
ショッピング	オープン	当然シミュレーションができていると思いますが、中心商店街の空き店舗利用、促進事業にも取り組み、活性化を推進する中で、現実問題として、先ほどの小松議員の質問にもございましたが、ニュー天童商店街の空き店舗は既に21%を超え、そして先ほどのヤマザワさんの天童店の再オープンも白紙撤回の可能性もあるのではないかということも伺っております
ショッピング	オープン	秋田市内で若者向けセレクト・ショップを6店舗営む(有)ヤシロは、本年9月に同社の“旗艦店舗”とも言うべき「ボックス・イング」を秋田城東消防署のそばに、「いっさい、広告やダイレクトメールをうたないで、ひっそりと静かに」(八代店長)オープンした
その他	オープン	それからもう一つは、業務方法書等のいろんな報告書等ですね、これについてはすべてオープンにするということで、そこに、それをオープンにした上で御意見をちょうだいすると、こういうような透明な形でやっていきたいというふうに考えているところでございます
その他	オープン	この間NIIのオープンハウスで、日本のネットメディアはアメリカとは逆に情報格差を減らす役割をしている、というプレゼンテーションを聞いて、じゃあ新聞は
自動車	オープン	ひとつは真新しいオープンカットにて太陽光を燦々と浴びる明るく広い峠、もうひとつは狭い切り通しで荒れ放題日中でも光をほとんど通す事のない薄暗い峠、つまり吉見峠はほぼ同地点に二つ存在しているのだ
スポーツ	オープン	オープン戦であまり打ちすぎても、その分シーズンで打てなくなるのではないかとか、福留などがホームランを打つと「シーズンにとっておいて欲しい」とか思う
ショッピング	オープン	顕著な例として、JR東日本の財団法人東日本鉄道文化財団が、汐留にある国指定史跡「旧新橋停車場跡」上に旧新橋停車場を再現し、2003年に博物館としてオープンしたことが取り上げられました
その他	オープン	早稲田大学(八丁堀)オープンカレッジで「豪商が生み、町人が育てた江戸しぐさ―その誕生と系譜をたどる」をテーマに、8回の連続セミナーが来年1月から始まります
ショッピング	オープン	んでもって、本題の買い物は、新規オープンしたドスパラ新潟店でハードディスクを調達する予定だったのですが、お目当ての機種は残念ながら在庫切れだったのでした
その他	オープン	受賞したのは第41回ばんえい記念競走(4歳以上、オープン定量、3月29日実施)と第33回ばんえいオークス競走(3歳牝馬、オープン定量、平成20年12月14日実施)に出走した馬の生産者
ショッピング	オープン	日曜の最終日なのと、大丸がニューオープンということで混んでいたのはもちろん、ジュエリーのコーナーはなかなか人が移動せず、見るのにもかなり時間がかかりました
ショッピング	オープン	しかし、'90年代以降、アートプラザ、デザイナークラブ、ウノコレ、巨平プレヤーなど新しい衣類ショッピング商店街が次々とオープンし、近代的市場へと変わりつつある
ショッピング	オープン	立川北口にオープンしたアニメイトに行ってみる、デパート内の一角ということでかなり狭いですね、売り場面積としては立川南口にあるゲーマーズが圧勝か
ショッピング	オープン	このエイデンの店舗の隣りに建設されているバロー名古屋みなと店のオープンは、11月11日と言われています、分離オープンですが、両店舗の人気度からして、混乱を回避する為には賢明だと思われます
ショッピング	オープン	伊方「14日(木)から仮オープン」/金川「らくらくウォーク導入」/弓削田「豆まきで1年の厄除け」/ご利用者さまの声/スタッフインタビュー「鈴本 愛さん」/ご利用者さま募集中/ホームページについて/編集後記
ショッピング	オープン	1983年にフォルクスワーゲンの直接の子会社フォルクスワーゲン株式会社が設立され、1989年にはフォルクスワーゲンアウディ日本株式会社となり系列の販売店をオープンし、より直接的な販売にも乗り出した
その他	オープン	デッドスペースからオープンスペースに入る場合、どうしてもディフェンスがオープンがわに張るので、斜めに走ってディフェンスの前に出ないとパスがもらえない事からやむを得ない状況がある
ショッピング	オープン	第3海兵師団の海兵隊員が、第3海兵遠征軍車両輸送の訓練及びシミュレーター・センターを6月11日にオープンし、沖縄での車両訓練をより効果的且つ、有効にした
その他	オープン	米プロゴルフ協会は八日、1995年以降の全米プロ選手権開催コース選定基準に「オープンな会員資格の方針を持ち、人種、宗教、性別などの差別禁止を実行しているクラブ」の一項を追加すると発表した
その他	オープン	発進時のわずかなスロットルオープン時は、いまだに息つきを起こし、エンストしそうな感じになるが、2000回転近くまで何とか回転が上がってしまえば、スタートも問題ない・・・(一気に加速していくから、大変であるが・・)
自動車	オープン	レディースレディースシャツ【カフェ・オープンキッチン用ユニフォーム】■発売年:2004■メーカー:ボストン■商品コード:08949■商品名:レディースシャツ■性別:レディース■季節:オールシーズン■使用素材:ストレッチブロード ポリエステル55%・綿45%素材感と肌触りがやさしいレディースシャツは、初のストレッチ素材を使用
その他	オープン	スポーツカーチャレンジ部門でもオープンクラスで森田信之選手が2連覇を成し遂げたが、ターボクラスでは竹尾佳彦選手が、NAクラスでは、高山尚也選手が優勝を決めた
ショッピング	オープン	石川県輪島市の朝市を介護に活用する初の試みとして、朝市通りのわきに7月1日、認知症対応型の通所介護施設「認知症デイ 笑 ( え ) ちゃけや」がオープンする
ショッピング	オープン	オープンを急いだためか、併設の駐車場はまだ建設中だし、展示パネルも糊が一部浮いていて、パコパコしてたり、第一2つめの呼び物のビッグバンの劇場はジョディ・フォスターがナレーションをするはずが、この劇場自体がオープンしていなかった
その他	オープン	名匠・加藤俊輔設計の「北海道ゴルフ倶楽部」で1プレイ2007年度日本女子オープンゴルフ選手権開催の「樽前カントリークラブ」で1プレイお泊りは・・・・・
スポーツ	オープン	それでも8回からリリーフの森慎二が、火だるまになっていたオープン戦とは別人のピッチングを見せて無失点に抑える好投を見せ、打っても8回裏に赤田がバックスクリーンの今シーズン1号を放ち 、すがるバファローズを突き離して2連勝
ショッピング	オープン	京滋地区で初めての大型アウトレット施設「三井アウトレットパーク滋賀竜王」が8日、滋賀県竜王町の名神高速道路竜王インターチェンジ(IC)近くにオープンした
その他	オープン	ランドローム独自のオープンな人事制度にて、早い方では2~3年後には、店長・バイヤー・店舗運営など年功序列ではなく、若い人材が活躍できる場を設けております
ショッピング	オープン	新映画館「鶴岡まちなかキネマ」、5月22日オープン(文化通信) 山形県鶴岡市に新映画館「鶴岡まちなかキネマ」が、5月22日(土)にオープンすることが決まった
その他	オープン	なお、オープン選手権期間中の12月11日に、日本武道館で力道山家主催による特別興行「力道山十三回忌追善特別大試合」が選手権参加選手により行われた
自動車	オープン	・フィアットオートジャパンは10日、アルファロメオの2ドア・オープンスポーツカー「アルファ スパイダー」で、新たに排気量2000ccエンジンの搭載車を発売する
ショッピング	オープン	軍隊が終わってある洋服屋さんに入社したジュク君ですが、結構いい業績を出せたので、台北で新しくオープンされた「京○城」というデパートへ転勤され、副店長を勤めていました
その他	オープン	その間、ルバラン期になるとルバラン帰省車両に便宜をはかるために工事未完のその区間をオープンするといったことも行われて開通の予感を抱かせたものの、「いつ通じる」「いついつ開通する」という国有自動車専用道路運営管理会社ジャサマルガの表明は毎回毎回裏切られてきた
