# 自動車: おおいがないこと。無蓋。オープンカー, スポーツ: 非公式。オープン戦, ショッピング: 開くこと。開業。開店。来月オープンする予定
ショッピング	オープン	ジェラートが美味しい、オシャレなイタリアンカフェのオープニングスタッフです』とか、『今、注目の町にジェラートを目玉としたイタリアンカフェがついにオープンします』と書いてある
その他	オープン	活用方法と致しまして、東京市場がオープンする前に、まずは前日のNY市場の動きを『NYマーケットサマリー』と『NY外為レポート』を読むことがオススメです
ショッピング	オープン	新しくオープンした博物館を見るつもりだったが、たまたまその日に長老の一人が死亡し、弔意を示すということか、館員がみんな長老の家に行ってしまったので、博物館は突如休館になった
ショッピング	オープン	土佐藩の名家老、深尾弘人蕃顕(ひろめしげあき)の屋敷跡にオープンしちゅう「ひろめ市場」は大橋通電停からアーケードを北に入り、帯屋町商店街との交差点にあるき、すっとわかるぞね
自動車	オープン	建物自体は古めかしくてお洒落でも何でもないのですが、内装やインテリアの類はどれもセンスの良さが感じられるものでしたし、オープンテラスになっているので外を見れば緑の樹々が生い茂っていて、雰囲気はほんとうに良い感じでした
その他	オープン	価格はオープンプライスだが、店頭予想価格は40万円弱程度となっているので、ZDとくらべて価格面でも安いし、画質も充分なので中判デジタルであることの意味ってドコにあるのかな
その他	オープン	八洲学園大学、八洲学園大学国際高等学校で使っているeラーニング(eLy)にもSNS機能を追加しようとしていることは、すでにこのブログでも紹介したが、オープンが間近になってきた
ショッピング	オープン	東北最大級のキャンピングカー福祉車輌の総合展示場としてリニューアルオープンした6メートルクラスの大型キャブコンからハイエース等のバンコン軽自動車キャンパーまでキャンピングカーを多数展示
その他	オープン	※ただいま商品の価格を調整しておりますので、お買い物をしていただくことは出来ませんが、間もなくショッピングもオープンいたしますので、もうしばらくお待ちください
ショッピング	オープン	坊っちゃんスタジアムオープンに伴い、久方振りのプロ野球公式戦誘致が実現しましたが、次なる課題はさらなる有効活用、自分の頭の中に四国初のオールスターゲーム開催という目標が浮かび上がりました
その他	オープン	その水帆さんと、婚約者の山田祥平さんが、人の心をオープンにしてくれる人力車そのものの魅力を伝えたいという想いから、人力車で日本一周する旅をやってるんです
ショッピング	オープン	西早稲田リサイクル活動センター(愛称:戸塚エコ市場)は、ごみ減量・リサイクル活動を推進し、資源循環型社会を形成していくための区民活動の拠点として、戸塚小売市場の跡地にオープン
ショッピング	オープン	事業としてはその間、2店舗目のオープン、そしてその2番目の店の2年半での不振閉鎖という大きな失敗を経験し、当然、スタート当初に想い描いてきた「5年後には10店舗体制」の成功のイメージと比べれば、現在の所帯は全く小さなものでしかありません
ショッピング	オープン	今日はみやき町に建設されたミニボートピアみやきのオープンを明日に控え、佐賀県唐津市出身の競艇選手、「峰竜太」選手がPRのため、FM佐賀に来社されました
ショッピング	オープン	オープン記念福袋先着1000名様限り、売り切れご免のオリジナル家具、今朝ハワイから直行のトロピカルフルーツ、人気の有名歌手がオープン一日店長でサイン入りファッション特売、当店のゴールデンカード入会受け付けなどなど、オープンならではの特典を満載します
ショッピング	オープン	また、新たに「軽井沢星野リゾート・ハルニレテラス」内に11日にオープン致します「フレンチデリ&ワイン CERCLE」様の一部コーナーに引き継がれることになりました
ショッピング	オープン	長引く不況風でスキー人口が減少する中、スキー場にとって営業日数の確保は切実な問題で、関係者は「早く雪が降ってほしい」と天を仰ぎながら予定通りのオープン
その他	オープン	二重価格にならないように、希望小売価格の設定を止めて販売価格だけが売り場に表示されるオープン価格へ、家電や化粧品、玩具などでも導入が進んでいる
ショッピング	オープン	今日は先週の コストコ入間店 に続き、同じ敷地内にオープンする関東最大級の店舗数の 「三井アウトレットパーク入間」 に早速行ってきましたよ~お 招待状を持っている人だけが入れるプレオープン(明日から正式オープンです)なので
ショッピング	オープン	また、国内の出来事としては、都心に新たにオープンしたビジネススポット「赤坂サカス」(15位)、「ガソリン国会」の与野党混戦で3月末で期限切れを向かえた「暫定税率」(25位)、高橋尚子選手の出場で、その記録が注目された「名古屋国際女子マラソン」(36位)などのキーワードがランクインしている
ショッピング	オープン	また平成20年秋にオープンした、イオンレイクタウン店は新業態として広いイートイン併設店舗で、ライトミール系クレープの他にトルティーヤも召し上がれる、アメリカの店舗をそのまま再現した店舗で、この業態の展開も今後開発してゆく所存です
ショッピング	オープン	函館競馬場では、2010年6月のリニューアルオープンに向けスタンドの全面改築工事や施設整備を進めており、それに合わせて1996年に設置されたCRT方式の大型映像装置(三菱電機製)を更新するものです
その他	オープン	最初は親戚や限られた友人だけにURLを教えて見てもらっていたのですが、三菱地所ホームのユーザーさんのサイトが見つからなかったので、折角だし記念になるからドーンとやってみよーという欽ちゃんのノリで、一般の方にもオープンにしたところであります
スポーツ	オープン	しかし、たとえ練習試合やオープン戦であっても、とくに若手選手の場合は、そこで良い結果を出せばそれが自信となり、その後の選手生活にいい影響を与えるのも一理あるような気がするのだが
ショッピング	オープン	魔法の言葉『池袋価格』電化製品を安く買った人の感想ブログ集 ヤマダ電機がオープンしてからビックカメラとの壮絶な価格競争でうまれたこの言葉「池袋価格」
その他	オープン	0のコアにあった思想性というか、初期インターネットの頃から包含されていたことだけれど、オープン化の次は、互いのプラットフォームに相互乗入れする「PaaS(プラットフォーム・アズ・サービス)」の時代だとも語られているようだ
ショッピング	オープン	時間貸駐車場「タイムズ」を運営するパーク24は、沖縄県内の駐車場で初めて電子マネー「Edy」が使える駐車場、「タイムズはいさい沖縄」を、去る10月23日に、那覇市にオープンした
その他	オープン	JUGEMテーマ:ゴルフこんばんはミズノオープンよみうりクラシックは今日、最終日がおこなわれここまで単独首位だった石川遼選手は途中でスコアを崩したのが原因
その他	オープン	10月13日(土)〜15日(月)まで秋田県内7市町村で行われた、 第7回全国障害者スポーツ大会(秋田わか杉大会)に本県から個人競技41名、団体競技85名、 オープン競技(精神バレーボール)12名が参加しました
自動車	オープン	ジュリエッタには、上記のスプリント(※ベルリネッタ・タイプと言う/クーペタイプの事)の他に、セダンタイプのジュリエッタ・ベルリーナと、オープンタイプのジュリエッタ・スパイダーと言う、3つのボディタイプがある
自動車	オープン	4台目はセルボのセカンドカーとしてジープを購入夏はほとんどフルオープンでご機嫌に走っていました、この頃今の嫁と知り合うのですが、知り合ったその日に飲み過ぎの為(当時は飲酒運転OK
その他	オープン	というより 要するに 高橋大輔選手について 高橋大輔選手についてフィギアスケートの大会で4月29日に開催される大会(ジャパンオープン2007)には、あの高橋大輔選手は出場するのでしょうか
ショッピング	オープン	駐車場にはすでに数台、車が停まっていて、入口には交通警備の方も立っていたので、プレオープンでもしてるのかと思い、一瞬入ろうかと思いましたが、その場を通り過ぎました
ショッピング	オープン	平成15年(2003)に新館(設計:芦原建築設計研究所)が新たに造られたが、創立130年という節目にあたる2007年4月17日、かつての本館をリニューアルし、「日本館」としてオープンし、新館は「地球館」と改められて展示が行われている
その他	オープン	オープン・マーケット・オペレーションopen market operationともいい、中央銀行が金融市場や債券市場に対して手形や債券を売買して、銀行の現金準備を増減させ、また市場金利に影響を与えて、ひいては銀行の与信活動、通貨供給量を調節する政策手段をいう
ショッピング	オープン	●NIKKEI NET 自動車によれば、自動車用品店のオートバックスセブンが12月8日(水)に東京都内に、自動車レース場の雰囲気を再現したイタリア料理店をオープンするそうです
自動車	オープン	更に燃費についてはストレス解消用にオープンで2速を引っ張って乗るのが大好きだし元々燃費を気にしてもたいして伸びないのであんまり関係ナッシング状態
その他	オープン	オープンでの握手会ではなく抽選方式でメンバーが分散して行う握手会券を一般層が買うとは思えないので、既存のヲタがどこまで意欲を持ち続けて財布をひっくり返すか、そこに集約されると思う
その他	オープン	スコットランド・オープン(8日開幕、英国グラスゴー、ロック・ローモンドGC)に出場する石川遼(18=パナソニック)は6日、公式記者会見を行った
その他	オープン	その学校の教育方針・就職実績・実習環境・自習時間を除く授業時間数・雰囲気といった内容は、やはりオープンキャンパス・体験入学等、実際に足を運んで行ってみることが、いわゆる大学・短大進学以上に必要だと思います
その他	オープン	オープンシステムと呼ばれるこの単一料金制導入によって自動車道から一般道へ出る際には料金所が不要になることから、渋滞緩和や管理会社の合理化が推進される
自動車	オープン	今までの車歴はまた別の機会に披露いたしますが、初めてのスポーツカーでFRのオープンスポーツ、しかも新車という思い切りすぎたことをしてしまいました
その他	オープン	・まるがめ競艇 【オープン懸賞】サンスポクイズ 丸亀ボートレース場で平成22年6月30日から7月4日まで開催するレースは、『サンケイスポーツ大阪発刊55周年記念競走』です
ショッピング	オープン	店舗目が開発区にオープン、落ち着いた雰囲気でいただく上質な料理 市内に3店舗を持つ「大江戸」が、開発区に2店舗目の時代大江戸店をオープンさせた
スポーツ	オープン	あと1994年の『横浜‐日ハム』オープン戦の前売りを球場に買いに行ったら事務員に『スタンド1周して見学していって』と言われ、青学大が練習している中スタンド1周
ショッピング	オープン	今年1月のオープン以来、総勢14名のバイヤーが、ブランド品、ホテル、ゴルフ用品、車、PC・家電などお勧めの商品をオンライン販売しており、毎日約4万人の電子メール会員にしてバイヤー独自の視点を活かした商品を紹介しています
その他	オープン	第20回 日本シニアオープンゴルフ選手権競技(2010年度のJGA主催オープンゴルフ選手権競技開催コース) が 鳴尾ゴルフ倶楽部 に決まったそうです
ショッピング	オープン	店舗の移動や新店舗のオープンを経験する中で、きちんと在庫や書類が整理されていたり、行動動線に合わせたレイアウトにすることで、作業効率が大幅にアップすることを実体験してきました
ショッピング	オープン	オープン初日は日曜日とあって、路行く車が色鮮やかな花に誘われ止め、バスの運転手やガイド、タクシーの乗務員さんらが、あまりの花のにぎやかさに釣られ見学している
ショッピング	オープン	オープンモール内の樹木を地中埋込照明によりライトアップして防犯効果と安全性を高め、柱面に設置した75Wナトリウムランプブラケットによりオープンコリドール空間の照度アップを図ると共に、ガラスグローブのきらめき感と華やかさを演出し、ショッピングセンターへの期待感と誘導性を高めています
スポーツ	オープン	プロ野球好きが集まって、オープン戦の映像を流したり、今シーズンの展望を語ったり、選手名鑑をネタにトークしたり、昔の名勝負話で盛り上がったり、各球団の応援歌を歌ったり、野球ソングにツッコミ入れたり、ヤバくてネットには書けないような危険ネタを披露したり、などなど色々やりつつマターリ飲んで楽しみましょうか(笑)
その他	オープン	このページでご紹介致しますのは、白濱 隆一郎 師範代が、第7回オープントーナメント全日本マスターズ空手道選手権大会で優勝されたときの新聞記事です
スポーツ	オープン	オリックスは2004年、近鉄とがっぺいしてしんせいオリックスになり、こんねん、きよはら、中村がにゅうだんしたものの・・・、結局、早々とプレーオフ出場権かんいまシーズンのオープンせんのオーダを見ていて、オリックスのオーダーがしあいによりコロコロへんかしていて、らいしゅうからはじまるシーズンのオーダーのかたちがみえてきません
ショッピング	オープン	伊藤 恵生涯スポーツ課長 昨年度のスキー場の 114万何がしの減額の主な理由、中身についてですが、14年度については1月3日から3月23日までオープンして、そのうちちょうど80日営業することができました
その他	オープン	このようなプラットフォーム上に、世の中で最も優れた技術を迅速に構築し技術革新を強く進めていくためには、プラットフォームがオープンスタンダードを採用するものであること、すなわち、インターフェイス、プロトコル、データやファイルのフォーマット等が開かれた参画プロセスのもとで合意され公開されていることが不可欠である
ショッピング	オープン	オープン前鹿児島中央駅で千円分入ったポイントカード先行受付を有楽町店の人達がしていたのでしれっと申込みんで、ネット通販の消耗品三千円以上で配送料無料に使わせてもらった
その他	オープン	オープンな開発プラットフォームとしては Eclipse が普及しているが、Eclipse が開発者デスクトップの標準プラットフォームであるのとは異なり、「Jazz はチームコラボレーションの標準プラットフォームだ」、とRational 事業部長は説明する
その他	オープン	日本でだって、性がオープンになってきた最近でこそ受け入れられるけれど、20数年前、小学校の体育館で「女の秘密」を伝授してくれた先生方に使ってもらえるとは考えにくいモノじゃないでしょうか
その他	オープン	ブロケードは、顧客のニーズに十分対応できているとはいえなかった従来の販売ネットワークに加え、ファブリックインテグレーションパートナー(*)との販売協力を強化することで、マルチベンダ環境を含めたオープンなストレージシステムの構築に関して、ユーザーに近い立場で市場や技術の成長に対応した各種の支援が可能になります
その他	オープン	オープン価格って、「メーカーが自社製品に希望小売価格や標準価格を設けず、小売店が自由に販売価格を設定するもの」って書いてあったが、メーカー側と末端の小売店側との双方が、売買取引価格を秘密に出来るシステムの別名なのかな
ショッピング	オープン	この他にも、旧東祖谷山村の「ホテル祖谷温泉」(現在は三代目)と「ホテルかずら橋」(2000年オープン)にあるに温泉ケーブルカー二ヶ所に乗ったり、先にも述べた「祖谷ふれあい公園」の「てんとうむしモノライダー」で気恥ずかしい目にあったり
ショッピング	オープン	先月オープンした8店舗(リニューアル2店舗含む)イオン戸畑店、ジャスコ茅ヶ崎店、天神ビブレ店、南アルプスガーデン店、イオンモール京都ハナ店、大宮OPA店、イオン津城山、WonderGOO那珂店に続く、新店舗として、川崎ダイス店をオープン致しました
ショッピング	オープン	楽天の三木谷社長の右腕として活躍した山田善久氏が、その輝かしい経歴を捨て、赤坂にオープンしたヨーロッパテイストのドーナツショップ「Neyn」を訪ねたのは9月の自民党総裁選の時だった
ショッピング	オープン	ITp 13時17分 エキサイト、食材ショッピングサイト「しょくこストアー」をリニューアルオープン(ニュース) エキサイトは10月6日、食材ショッピングサイト「しょくこストアー」を同日にリニューアルオープンしたと発表した
ショッピング	オープン	これまた株式会社ビックポンドストアーさんの「スーパービック井口店」として営業をしておりましたスーパーマーケットが、今年の4月バロー井口店としてオープンしましたので、オープン2ヶ月後の様子を見に行ってき [続きを読む]
その他	オープン	片マヒゴルファーを主な対象とした「日本片マヒ障害オープンゴルフ選手権」を5月16日(前夜祭)~5月17日(競技)のスケジュールでホワイトバーチCC(茨城県土浦市)で開催します
その他	オープン	CNJ 12時34分 グーグル、OAuthをガジェットプラットフォームに採用 グーグルは、ウェブにおいてプライバシーを制御しつつAPIアクセス権を委譲できるようにするオープンな標準OAuthを、同社のガジェットプラットフォームに採用した
その他	オープン	1月18日(日)にP'sLAB横浜で開催される『第7回 プロ・アマ オープン キャッチレスリング トーナメント』のパンクラス所属選手及びプロ選手の追加参戦選手が発表された
ショッピング	オープン	まちの駅はちのへは中心市街地の空き店舗対策として、平成11年10月20日に三日町の「クドウキチ」店舗跡、現在の居酒屋・ワタミがある場所にオープン
自動車	オープン	販売先:テーマパーク、オープンカフェ、ホテル、イベント会場、コンサート会場、ショッピングモール、デパートの屋上などの屋外施設、または大規模な屋内施設、地方自治体の設置補助事業の対象地区の施設、学校、介護施設、公共施設など
ショッピング	オープン	2000年にショップをオープンした後、このお店の品揃えが香港のお茶好きに受け、いまでは咀沙嘴店を中心に、銅鑼灣店、 紅[石勘]の 日系スーパージャスコ内のワンポワ店、康怡(コーンヒル)店の4店舗にまで増えたそうです
ショッピング	オープン	那須ガーデンアウトレットモールのオープン 2008/7/17に那須塩原駅から那須方面に向かう県道30号線沿い(黒磯ICの近く)に店舗面積2万m2に及ぶ大規模アウトレットモールが出現します
自動車	オープン	お昼をその会社の近くのオープンカフェで取り、コーヒーとチキンサンドイッチを注文しPCを見ながらアポイントまでゆっくりしていたところ、ある拍子に右腕に巻いていたミサンガが切れました
その他	オープン	全日空オープンでジャンボ尾崎が、米シニアツアーのバンクワン・クラシックで青木功が、そして廣済堂アサヒゴルフカップでは岡本綾子が優勝した1週間は、ゴルフ界にとってこれ以上ないゴールデンウイークだった
ショッピング	オープン	洋館などのモダン建築が点在する城下町・弘前は、12年前にオープンした「レストラン山崎」を草分けに、カジュアルなブラッスリー、賑やかなバールまで、フレンチレストランが数多く点在
ショッピング	オープン	緑新鮮市は平成13年の12月2日にオープンしてから現在の店舗で営業をしてきましたが、ビニールハウスで出来ている現在の店舗では、台風や冬の北風など風速が30mを超える強風には耐えることが出来ません
その他	オープン	同じ(オナジ)年に引退、種牡馬(シュボバ)デビューを果た(ハタ)したエルコンドルパサーはオープン勝ち馬(ウマ)も出し(ダシ)、クラシックにも産駒を進(ススム)初めてレンタカー付(ツキ)カーナビありで3泊4日で沖縄に行き(イキ)ますどんなプランがよいか
ショッピング	オープン	ホーランエンヤ見学(けんがく)の興奮(こうふん)を引(ひ)きずりながら、今年(ことし)の3月(さんがつ)にリニューアルオープンし、お買い物(かいもの)や休憩(きゅうけい)をしやすくなった島根(しまね)県(けん)物産(ぶっさん)観光(かんこう)館(かん)でお買い物(かいもの)タイムです
ショッピング	オープン	先月だけで、釜山(プサン)、蔚山(ウルサン)、全羅南道麗水(チョルラナムド・ヨス)の3カ所で店舗をオープンしたのに続き、年末までに、9つの店舗を追加して、店舗を55個に増やす計画だ
ショッピング	オープン	7月8日、滋賀県竜王町にオープンする【三井アウトレットパーク滋賀竜王】でお得にお買い物ができる、【スペシャルクーポンブック付プラン】はコチラ☆
ショッピング	オープン	先週、大阪に新店舗をオープンさせ、11年に大阪でオープンする大型新店舗の魁となったが、筆者には、土地の含みとブランドに時価総額3321億円では簡単にTOB(株式公開買い付け)の対象となるといえる
その他	オープン	極端なオープンスタンスからスクエアに踏み込んでインコースはレフトへ、難しいアウトコースも引き付けてリストを利かせボールの外を叩きいて軽々とセンターへ持っていく
ショッピング	オープン	東京千代田区にある「交通博物館」が鉄道専門に衣替えして、今度は「鉄道博物館」として埼玉新都市交通・大成駅(さいたま市大宮区)近くで2007年秋にオープンすることをニュースで知りました
