# 自動車: おおいがないこと。無蓋。オープンカー, スポーツ: 非公式。オープン戦, ショッピング: 開くこと。開業。開店。来月オープンする予定
その他	オープン	この基幹業務系のオープン化という動きは電子小売店の構築や電子調達システム、取引市場システム(マーケット・プレイス)、電子顧客管理(eCRM)など企業システム全体へと広がり続けている
自動車	オープン	財団法人相模原市みどりの協会では、平成16年10月から個人の庭園を始め、企業や公共施設等の庭園を対象に「さがみはらオープンガーデン」として、公開していただけるオーナーを募集するとともに、登録していただいた庭園の公開を随時行っていきます
ショッピング	オープン	厚生労働省の発表※によると、「眠れない」と自覚する人は年々増加傾向にあり、デパートの寝具売り場は拡大、2007年には快眠専門のホテルもオープンする程、日本人にとって「快眠」は大きな関心事となりました
自動車	オープン	約70人の選手らを乗せたオープンバスなどが幕張メッセの交差点を左折すると、パレードを先頭で引っ張るバレンタイン監督には千葉マリンスタジアムが見えた
その他	オープン	先ほど中川先生のお話の中で、現在は非常にオープンに、フリーにやっていらっしゃるというお話だったのですが、であるならば、そもそも国会対策委員会というものは必要なくて、議院運営委員会においてその役割をカバー、あるいは通常の規定どおりに議院運営委員会をもっともっと活用していくことが大切なのではないかと思いますが、いかがお考えでしょうか
その他	オープン	自治体では基幹システムや情報系システムのリプレースに伴うオープン系の導入支援、一方、民間企業では再構築での業務やシステムの見直しなどが増えつつある
ショッピング	オープン	コナミスポーツ株式会社(本社:東京都品川区/代表取締役社長:太田 護)は、本年5月、関西地区に「エグザス守口INコナミスポーツプラザ(大阪府守口市)」「エグザス寝屋川(大阪府寝屋川市)」「セレ堺(大阪府堺市)」「セレ伊丹(兵庫県伊丹市)」「セレ京都丸太町(京都府京都市)」の5施設を新たにオープン予定です
ショッピング	オープン	このほど決まった記念行事では、七月七日のオープン当日は、春の選抜出場校、広島商業高校対東洋大姫路高校(午前十時四十五分プレーボール)、広陵高校対玉野光南高校(午後二時十分プレーボール)の高校野球招待試合が行われる
ショッピング	オープン	日本のスクーターと同様にハンドルロックもシートオープン(エンジン停止時専用)もこのイグニッションで出来るのだが、精度が低くてハンドルを左右に動かしながらでないとハンドルをロックする位置が見つからない
ショッピング	オープン	道をはさんで南側、ゴルフ5さんや、スポーツDEPOさん、ドラッグユタカさん、ちゃんぽん亭さんなどの入った「レイクサイドガーデン」に2009年10月1日に県下最大級360坪の総合リサイクルショップとしてオープンしました
ショッピング	オープン	4月6日からはプレオープン期間として、隔週で、『週 刊パーゴルフ』の誌面で取り上げたゴルフクラブや『週刊パーゴルフ』おすすめグ ッズを販売しEC会員の募集を始めます
ショッピング	オープン	私も新規オープンの開店前のコンビニで面接中に コンビニが開いていると思ってやってきた人が道を尋ねてきた 面接の店長候補の人は、いまいち土地勘が無いらしく微妙な感じだったんで 私が道案内してあげたけど、尋ねた人が帰ってからも 店長候補の人にはありがとうとも何も言われなかった
ショッピング	オープン	名古屋市東区名古屋ドーム西で建設され来春オープン予定のイオン大曽根店、ドーム客と絡んで交通渋滞、周辺の商住環境の悪化を懸念して名商連(名古屋市商店街振興組合連合会)が反対決議、この決議に法的な拘束力はありませんが、この決議を受けて営業を続けたダイエー栄店は10月に閉店となります
ショッピング	オープン	一大温泉テーマパーク「スパリゾートハワイアンズ」のオフィシャルゴルフコース『クレストヒルズゴルフ倶楽部』では、衛星通信GPSゴルフシステム搭載のナビ付き乗用カートを導入し、リニューアルオープン致しました
その他	オープン	【ニューヨーク共同】テニスの全米オープン第6日は5日、ニューヨークのビリー・ジーン・キング・ナショナル・テニスセンターで行われ、男子シングルス3回戦で6連覇を目指す第1シードのロジャー・フェデラー(スイス)は元世界ラン
ショッピング	オープン	このところテナントの撤退が相次ぎ、空き店舗だらけになっていた地下街「西堀ローサ」が、賃料の見直しなどで空き店舗が全部埋まり、今日からリニューアルオープンしました
その他	オープン	すべての試合でレフェリーへの取材をオープンにすることはできないかもしれないが、まずはW杯を経験した西村主審など数人に限定し、カメラの前に立つ機会を設けてはどうだろうか
自動車	オープン	「カヌー」が基本的にオープンデッキのタイプを指すのに対して、「カヤック」は基本的にクローズドデッキのタイプを指すが、広義ではカヌーという言葉の中にカヤックを含める場合も多い
ショッピング	オープン	同日から、提携を機にオープンした店舗「マザーウォーター東京ショーケース」(以下「東京ショーケース」)で、コロプラユーザーの商品購入額に応じてプラスチック製カード「コロカ」が配布され、ゲームアイテムをあしらったデザインの特製金属ボトル等が発売されます
ショッピング	オープン	オープン当時はラリマー関係のアクセは4ページもあったりして^^;最近はその美しさと貴重性からか回転も速いのでUP商品は少なめになっちゃってますけど・・・ラリマー在庫はたんまりありますのでこれからもジャンジャン作って行きたいです
その他	オープン	MCJ 09時00分 【コラム】欧州から眺めるITトレンド 第9回 発展するEUのオープンソース利用、加盟国共同で活用へ 欧州連合(EU)および加盟国は、さまざまな理由と多様なイニシアティブでオープンソースソフトウェアを支持している
その他	オープン	専門学校北海道自動車整備大学校のホームページは、学校の特色やオープンキャンパスなどのイベント情報以外にも、クルマ好きのための情報満載で毎日更新
ショッピング	オープン	毎年、路面電車の日である6月10日前後の週末に行われるイベントですが、レトロ調の新車9000型の登場や、車庫敷地内の「都電おもいで広場」オープン記念を兼ねて、今年は5月下旬での開催となりました
ショッピング	オープン	地域での健康づくりの拠点として山口保健福祉センター(平成21年4月開所)につづき、鳴尾支所の2階に「鳴尾保健福祉センター」が6月1日にオープンします
自動車	オープン	オープン・トップとされた車体中央部は戦闘区画とされ、操縦手席上部装甲板と機関室隔壁、車体側面左右にそれぞれ補強材を溶接し、この補強材に十字型砲座を各6本のボルトで止めて、中央部に7
その他	オープン	これがきっかけで公取委は「クイズ番組・歌合戦番組・ゲーム番組・さらにはテレビ・ラジオ番組のプレゼント・商品・雑誌を含むオープン懸賞企画における賞金・賞品の総額は100万円までを上限とする」という取り決めを設けた
自動車	オープン	オープンホイールの車体は、接触すれば簡単に転倒しかねないデンジャラスな形状ながら、ストックカーレースばりのテール・トゥ・ノーズ&サイド・バイ・サイドを繰り広げるというこのレースは、まさに全米中に数多くのファンとレーサーを抱え、ちょっとした町なら必ずといっていいほどレースが開催されています
ショッピング	オープン	鍬ノ町への施設整備について、互いに関連いたしますので、一括してお答え申し上げますが、鍬ノ町地区のわくわくランドにつきましては、市と民間が連携し整備を進めており、民間施設が先行し、昨年オープンしたところであります
自動車	オープン	官庁施設の整備に当たりましては、昭和五十一年の中央官衙整備計画の基本方針に関する建築審議会答申を受けまして、霞が関の自然や歴史を生かして首都の中核としてふさわしいすぐれた景観を創造するよう、緑とオープンスペースの確保、建物の高さ、形に対する配慮、歴史的建築物の保存等に努めてきておる次第でございます
その他	オープン	テニス全米オープン第4日(28日、ニューヨーク・ナショナル・テニスセンター) 男子シングルスの2回戦を行い、世界ランキング126位の錦織圭(18)=ソニー=は同100位のロコ・カラヌシッチ(クロアチア)と対戦、6−1、7−5と2セットを奪ったところでカラヌシッチが棄権し錦織が3回戦に進出した
ショッピング	オープン	じんざい紹介かいしゃに行ったところ、新しくオープンしたばかりのシマンテックのほうじんむけコールセンター(ぺきんにコールセンターがあり、にっぽんのほうじん向け)のお仕事をつよくすすめられました
ショッピング	オープン	ジョギングはかなり前からやっているのですが、まだ、スノーボードはやったことがないので、今年の冬こそ挑戦してみようかと思っている中で、丁度、昨年にオープンしたことでのBURTONの直営オンラインストアでは、品揃えが充実しているので、助かりますね
その他	オープン	日本ゴルフ協会(JGA)主催ナショナルオープン3大会の優勝者に胸元に輝くゴルファー憧れの逸品JGA(日本ゴルフ協会)公認チャンピオンエンブレムレプリカモデル
ショッピング	オープン	全室ガラス張りの教員室や、24時間オープンの図書館、全室個室15階建てのドミトリー(学生寮)、都内の駅前の放置自転車問題を解決した「地下型自転車『エコサイクル』」などを見ていただきました
ショッピング	オープン	東京湾 ヴァンテアンのレストラン席で楽しむクリスマス スターナイトクルーズと、運河のある街「田町」に昨年オープンしたばかり、落ち着いた色合いの客室で、上品かつ機能的なホテル「ホテルグレイスリー田町」でのご宿泊をセットにしたプランです
その他	オープン	html つるやオープンゴルフ 2007最新レポート山の原ゴルフクラブ 山の原コース最新レポートゴルフクラブ 評価山の原ゴルフクラブ 山の原コース最新レポートつるや
ショッピング	オープン	コープこうべは、加古川市のダイエー店舗跡に2例めとなる居抜き出店したほか、コープかながわは茅ヶ崎市に4店舗めとなる「ミアクチーナ」店をオープン、生協エルは野田市の基幹店舗を大幅にリニューアルしている
ショッピング	オープン	コープとうきょうは、東京の流通業で初の「CO2排出量ゼロ店舗」となる東村山駅前店をオープン(9月1日)し、15日には多摩市に2店目の「ゼロ店舗」となる貝取店を開店した
ショッピング	オープン	当日は当センターをオープンにし、同協議会加盟各団体による各種日本文化体験・紹介コーナーや、当センター研修生による出身国紹介ブース等が出され、国籍を超えた和気あいあいとした交流が随所に見られる一日となる
その他	オープン	テニスの全米オープン第12日は12日、ニューヨークのビリー・ジーン・キング・ナショナル・テニスセンターで行われ、10日に第2セットの途中で中断された男子シングルス準々決勝は、第3シードのラファエル・ナダル(スペイン)が
その他	オープン	米自動車最大手ゼネラル・モーターズ(GM)の大株主の投資会社トラシンダがGMに対し、フランスのルノーと日産自動車のグループとの提携を求めていることについて、日産自動車は1日、「ルノーと日産はオープンな提携で、2社によることを制限していない」とするコメントを発表、GMを加えた3社による提携を検討する方針を示した
ショッピング	オープン	前回の時はオープンしたてで、駐車場は満車状態で買い物を済ませてから、駐車場から出るのにかなり時間が掛かったので、今日は出口のスグそばにインテ(インテグラの略)を停め、買い物に・・・・2時間強の買い物を済ませて駐車場へ
その他	オープン	ジャパンオープンで陳静に勝ったり、ナショナルチームの合宿でトップの成績を収めたり、 国体2連覇の原動力となったり、と、このところ好調だった西飯由だったが、小山にはあえなく ストレート負け
その他	オープン	【ニューヨーク4日共同】テニスの全米オープン第10日は、3日から4日の未明にかけてニューヨークのビリー・ジーン・キング・ナショナル・テニスセンターで行われ、男子シングルス準々決勝で、第1シードのラファエル・ナダル(スペイン)がマーディ・
ショッピング	オープン	新潟・福岡・広島(今秋オープン予定)の各店舗 ※ほかにも全国に店舗がございますので詳細はHPをご覧下さい ※勤務地の希望については相談の上、決定致します ※U・Iターン歓迎します
ショッピング	オープン	道の駅「サンピコごうつ」のオープンにあわせ農業普及部では江津市での農産物の栽培を積極的に行ってもらうため、市内主要地区12カ所において栽培実証ほを設置し、出荷品目数の増加と出荷量の増加を図ることを計画しており、5月末の段階で栽培者と栽培品目が決定した
ショッピング	オープン	らめんら星住所京都市オープンました富山ブラックを追加た逸品です販売元株森光商店ニンニクげんこつラーメン屋データベース、宅配商品として送料込みの営業時間の老舗
その他	オープン	・そうした率直さであらゆる価値観や思考をオープンに受け入れつつも、しかし黒部が”率直でない”自分の短所をはっきり自覚しつつかつ柔道黒帯の腕を隠し持ちながら、学校ではいじめられっぱなしに甘んじていることに対しては極めてオーソドックスに『根性なし』とキレてみせる浮風の反応の素直さ
その他	オープン	もしあの時けーがオープンキャンパスで早稲田魂を買っていなかったらおそらく僕はこうしてブログ担当をやらせてもらうことはなかったんだろうなぁと感慨深くなります
ショッピング	オープン	このため、現在、大阪府では、こうした活動の拠点として小学校の余裕教室等を活用し、地域安全センターの整備を進めており、このたび、岬町に「多奈川小学校区地域安全センター」が次のとおりオープンしますので、お知らせします
その他	オープン	昨年、USオープン優勝者のアンヘル・カブレラ(アルゼンチン)は、「ゴルフをする上で英語が上手である必要がない」とし、アルゼンチンの伝説的なゴルファ、ロベルト・デ・ビセンゾと交わした対話を紹介した
その他	オープン	ここはオープンミニスポーツを愛する人が集えるスペースを目指して、古今東西のオープンスポーツの紹介や分析、私達 の車やツーリングの紹介他、いろんな情報の交換をしていくサイトです
その他	オープン	8 メーカー希望小売価格: オープン価格 ※1: 製品を部屋の壁際中央に置いて「強」運転時に、製品正面でのイオン量が約10万個/cc測定できる床面積の目安です
その他	オープン	ヤフーニュースより引用 バドミントンの女子ダブルスで小椋久美子、、また、オープンの本戦から出場する菅山かおる=WINDS=のパートナー、マスターズレディースにおいても、どさくさでヘソ出ししてんじゃねーよ
その他	オープン	今日の韓国戦の第三セット目でチャンスカットが崩れてかなりネット際にボールがかえってきたんですけど、セッターの竹下選手がうまくレフトのオープンにあげたっていう場面がありました
ショッピング	オープン	7月22日にリニューアルオープンしたこの博物館は、東武鉄道の古い車両展示や、HOゲージの運転、さらには最新式の鉄道シミュレーターで、迫力ある本物の映像と共に東武鉄道の車両を運転できます
ショッピング	オープン	中日青年交流センターがオープン以来、日本青年団協議会並びに日本青年館は、この構想段階から青年の立場で共に関わり、建物の内容・運営等について中日青年交流センターから研修生の受け入れ・施設間の交流を続けています
その他	オープン	◆バドミントン ヨネックス・オープン・ジャパン第3日(18日・東京体育館) 各種目の2回戦を行い、女子ダブルス2回戦で北京五輪4位の末綱聡子、前田美順組(NEC・SKY)がニコル・グレター(ドイツ)シャーマイン・リード(カナダ)組を2―0で下し、8強入りを果たした
その他	オープン	大学時代も速いバレーをやってきていたというのもありますが、僕は身長がある選手ではないので、オープンバレーだと通用しないと思っていたし、 NEC のバレースタイルに魅力があったというのが一番大きな理由です
その他	オープン	プラットフォームのオープン化議論に関しても「自動車でコストを削減したいからといって、トヨタ、日産、ホンダでエンジンを統一化するという議論にならない
その他	オープン	「オープンセミナー」は基本的な考え方を学ぶ講義+デモンストレーションによるセミナーで、「実技中心セミナー」は実技を中心とした少人数制セミナーになります
ショッピング	オープン	オープンにあたってはチンドンマンの皆さんの演奏もあってにぎやかでした、お店の中もかなり活気がありましたよ、昼間は無料の田町中央駐車場を利用すると便利ですが、心無い違法駐車も見受けられたので気をつけましょうね
その他	オープン	#4(03/5/25)ジョイフルは5年前まで4月中旬にJACオープンを開催し関東のラケットボーラーを集めたり全日本やジャパンオープン優勝者や世界選手権代表を所属イントラからだすなど大活躍のクラブでした
その他	オープン	約200 社の旅行会社が多彩な旅行プランを掲載中の『トラベルコちゃん』 ()を運営する株式会社オープンドア(東京都港区・ 代表取締役社長 関根大介)は、2010年7月6日から、本サイトにおいて 「ヨーロッパ鉄道予約」のサービス提供を開始いたしました
その他	オープン	卓球のフォルクスワーゲンオープン荻村杯第2日は22日、横浜文化体育館で男女シングルスの予選を行い、女子では北京五輪代表の福岡春菜(中国電力)が勝ち残り、石川佳純(ミキハウスJSC)らとともに23日からの本戦へ進んだ
自動車	オープン	オープンスペースには、らんの専門店・オーキッドハウス、わさび漬けなど伊豆の名産品が揃ったショップや洋ランの販売、ギャラリー、レストランなどもあり、みどころ、食べ処満載です
ショッピング	オープン	パーク24と子会社のマツダレンタカーは、都内2か所に新規カーシェアリングステーション「カーシェア24」とマツダレンタカーの新規店舗を29日にオープンすると発表した
その他	オープン	パソコン向けWEBサイト開発と並行して携帯サイトも同時オープンしたり、さらに“攻め”としてのメール一斉配信や会員登録・管理機能などをつけ加えたり・・・
ショッピング	オープン	兵庫芸術文化センター管弦楽団は、阪神・淡路大震災の復興のシンボルとして2005年(平成17年)10月にオープンした兵庫県立芸術文化センター専属のオーケストラです
その他	オープン	OGCでは、クラウド用の共通APIである「オープンAPI」の整備、ガバナンス関連機能の整備、分散配置による仮想データセンターの実現、高度IT人材の育成の4点を主な活動内容としてあげており、できるだけ短期間で提言内容をまとめて、政府に対してアプローチしていく予定だ
その他	オープン	高橋大輔選手について高橋大輔選手についてフィギアスケートの大会で4月29日に開催される大会(ジャパンオープン2007)には、あの高橋大輔選手は出場するのでしょうか
ショッピング	オープン	◆閉校の中学に芸術センター、校舎を活用、若手育成へ秋葉原にほど近い千代田区外神田6丁目に14日、5年前に閉校した区立中学校の校舎を活用した文化芸術センター「アーツ千代田3331」がオープンした
ショッピング	オープン	今回オープンした「KEYUCA新宿三越アルコット店」は、新宿三越5階のワンフロアをすべて利用する大型店(総売場面積1650平米)で、全商品を品揃えるフルラインナップショップとなっている
ショッピング	オープン	ガイダンス施設の整備とのことでありますが、工事期間と完成予定、19年度以降の整備はあるのか、オープンはいつごろになるのか、施設の維持管理をどうするのかなど、今後の利活用方について、御説明をいただきたいと思います
ショッピング	オープン	アップルのタブレット型コンピュータ「iPad」が5月28日より日本で発売され、アップルストア銀座では、オープン前に1000人以上の行列ができるなどテレビやネットに大きな話題を振りまいた
ショッピング	オープン	時間貸駐車場「タイムズ」を運営するパーク24は、東京・有楽町の複合商業施設「有楽町イトシア」オープンを記念し、対象タイムズに5回とめると駐車サービス券をプレゼントする『Go
ショッピング	オープン	2003年にオープンしたメイフィールドホテルは、約3200坪の広大な敷地にフィットネスクラブ・ゴルフ練習場・スパなど様々な付帯施設を完備したヨーロッパ風の特1級ホテル
その他	オープン	現在、中小企業向けオープンソースERP&CRMであるCompiereの日本語化プロジェクトをリードして、導入サポート、教育トレーニング、カスタマイズ開発などの関連事業を行う
その他	オープン	オープンスカイによって競争が激しくなり運賃やサービス面でメリットが出ればいいのですが、メガキャリアによる独占寡占状態になりやすいとの指摘もあり、日米間などでは日本が拒否していますよね
ショッピング	オープン	ちょうど、西那須野のワイルドワンで会員向けのキャンペーンをやっていたり、宇都宮にオープンした好日山荘でオープンセールをやっているので買って来る必要があります
