# 自動車: おおいがないこと。無蓋。オープンカー, スポーツ: 非公式。オープン戦, ショッピング: 開くこと。開業。開店。来月オープンする予定
ショッピング	オープン	先月3日、キャンベル容疑者は新しくオープンしたばかりのターミナル5から英国航空のロサンゼルス行き便に搭乗したが、離陸前に荷物のひとつが行方不明になっていることを乗務員から告げられて激怒
その他	オープン	水着開発が注目される中、北京五輪の壮行会を兼ねた競泳のジャパン・オープン第1日は6日、東京辰巳国際水泳場で行われ、英スピード社のレーザー・レーサー(LR)を着た五輪代表の上田春佳(東京SC)ら3選手が日本新記録を出して優勝した
ショッピング	オープン	2009年10月1日に新しくオープンしたロックタウン西熊本内のスーパーマックスバリューの隣の店舗で同一店舗にたいやき、ピッツア屋さんと一緒に営業されてます
その他	オープン	上述のように日テレ系・TBS系では2009年10月以降レギュラー番組の提供は一時消滅している(しかし、「キヤノンオープンゴルフ」や「箱根駅伝」などの各種スポーツ中継でのスポンサー提供は継続している)
その他	オープン	※このほか、広く障害者の間にスポーツを普及する観点から有効と認められるものについては、主催者間で協議のうえ「オープン競技」として実施することができる
自動車	オープン	オープンだからサーキットじゃないだろう、とか、(MR2が)パワーを追求してもバランスが悪かったから、とか、セリカと比べてエンジンパワーがないけど、普段使わないからいいとか、とにかくイイワケが多いつくりをしている
自動車	オープン	あの家は街や道路に対してナイーブなほど閉じていて、それ故の白い吹抜だったと思いますが、「アルミの家」では楽観的なほどオープンになっていて、同じ設計者だとは思えないほどです
ショッピング	オープン	2007年11月02日・山梨市の市民グループ「やまなしし朝の市の会」(小野鈴枝代表)は、JR山梨市駅前の空き店舗を改装し、新たな地域交流施設「ひとやすみ」をオープンした (山梨日日新聞)、これは山梨県の平成19年度 コミュニティビジネスモデル事業 採択事業です
その他	オープン	ところが、1990年代後半からインターネットが爆発的に普及し、情報通信環境がそれまでのクローズドなネットワークから、一般社会に開放されたオープンなグローバル・ネットワークへと劇的に変貌した
ショッピング	オープン	マツキヨとローソンが共同店舗 浦安で: ドラッグストア大手のマツモトキヨシホールディングスとコンビニエンスストア大手のローソンは17日、千葉県浦安市に初の共同店舗をオープンした
ショッピング	オープン	寒くなったとはいえ、さすがに12月中旬ということで人工降雪機のあるスキー場しかオープンしていないのと、高速を降りて5分、家から2時間半くらいで到着できる好条件の、女鹿平(めがひら)スキー場に行きました
ショッピング	オープン	“セレクトショップ”は、GDOが従来から展開していたゴルフ用品販売サイトである“GDOショップ”に加え、ファッション感度の高いゴルフブランドがブランドイメージを表現しながら商品の販売が可能なショップとして、200 6年12月にオープンし、今回“カッパ”が
ショッピング	オープン	9th Ave沿いの58th St付近には24時間オープンのCVSや深夜1時まで開いているスーパーもありますし、結構夜でもタクシーを含めそこそこ交通量や人の往来があります
その他	オープン	2006年9月14日(木)~9月17日(日)に開催された『ANAオープンゴルフトーナメント』で、当社総合契約の近藤智弘選手が、5月に行われた日本プロゴルフ選手権に続き、今季ツアー2勝目をあげました
その他	オープン	以来、全日本総合、ヨネックスオープン、デンマークオープンなど数々の大会で活躍するようになり、昨年マレーシアで行なわれた世界選手権では、日本男子初となるメダル獲得という快挙を成し遂げた
ショッピング	オープン	三原市皆実の国道2号線から少し南に入った三原警察署前にオープンした「東洋古美術資料館」では、日本、中国、朝鮮の重厚な歴史と繊細な感性から生まれた骨董品の数々が公開されている◆インテリア業を営んできた小松末春さんが40年を超える収集の成果を地元三原で紹介することで、東洋の芸術や文化に興味を持ってもらおうと開館した
その他	オープン	その中でも私個人で最も印象深かったトピックは、前週末のUSオープン・テニスで負けて引退したアンドレ・アガシ関係で、私はその試合を実際に現地のスタジアムで見ていたため、感慨もひとしおだった
ショッピング	オープン	それで、にもつをくるまではこぶのに、父の運転で四国から東京までこうそくを使って移動するよていなのですが、ははが「とちゅうの一箇所にだけパーキングエリアないに、ホテルがあるときいた」と言う車でしゅっぱつ♪ディズニーシーのオープン前メイクばしょでオススメあったら教えてください
ショッピング	オープン	具体的には、店舗施策において、継続的に新築、改装等を順次行っており、4月19日には17年ぶりの新店舗となる大高支店を名古屋市緑区にオープンいたしました
スポーツ	オープン	横浜の小谷正勝1軍投手チーフコーチ(58)は11日、5年ぶりに日本球界に復帰した佐々木主浩投手(36)が14日の日本ハム戦(横浜)でオープン戦初登板することを明らかにした
ショッピング	オープン	本日、午前9時過ぎ、弊社施設「ナムコ・ナンジャタウン」(東京都豊島区東池袋)内にて、オープン前に「もののけ番外地」エリアのアトラクション「地獄旅館」におきまして、演出装置を点検中だった女性従業員が演出物にはさまれてケガをし、救急車にて病院に搬送される事故がありました
ショッピング	オープン	4月24日にオープンして以来、交通渋滞を巻き起こしてご近所のヒンシュクを買っているらしいズーラシアに珍しいおサルさん、キンシコウを持っていかれてしまったので、キンシコウのおりだけ、から~んとしてさびしそうだった
その他	オープン	2月23日~27日の日程で、クウェート市で行われているクウェートオープンで、男子シングルスでは、水谷隼選手と吉田海偉選手が2回戦進出を決めています
ショッピング	オープン	「まだプランニング段階のものもあるが、ユーカー商品化では昨年秋にオープンした寝屋川商品化工場をカローラ店2社(カローラ大阪、カローラ浪速)でも使うというのがひとつ
ショッピング	オープン	雪のあるとこ行きたいなぁ・・・と、思ってまして、スウィートグラスで2月限定オープンのお知らせがきたんですが、狙ってたキャビンは、会員予約の朝にすでに埋まってますw
その他	オープン	1kg 硬さ:やや硬め メーカー希望小売価格:オープン価格クラスアップセール価格 :この他にオススメの商品をチェックする上記の商品の詳しい説明をもっとチェックするなら♪
ショッピング	オープン	家具・木工の街の一つの象徴だった豊岡の木工団地は、複合型ショッピングゾーンに姿を変え、日本の小売業で最も元気のいいユニクロがオープンしたことで、集客力はさらに増した
ショッピング	オープン	デオデオが九州最大級の家電アウトレット店「アウトレット香椎浜店」をオープンさせたばかりだが、ベスト電器も店舗の業態変換を行っい、3月以降、九州・山口を中心に計11店をアウトレット化した
ショッピング	オープン	3月オープン予定の「ららぽーと甲子園」増床棟にと、言うのは甲子園球場で駐車場が無くなったとき、他人が駐車場の近所の方になりすまして横浜 昨日のライブはな
その他	オープン	これは、日銀が一般企業や個人も参加する公開オープンの金融市場で、流通している仕事を買って市場に通貨供給する買いオペ、逆に、保有する有価証券を市場で売って通貨を吸い上げる売りオペを行い、結果的に市場金利の水準を変化させることを言う
その他	オープン	参加できるオープンプラットフォーム型の アウトレット 物件の無料PRシステム『OMOP( アウトレット・ マンション・オープン・プラットフォーム
その他	オープン	ヤシロアキが【バリアフリー旅行・介護旅行日記の最新記事】 エクセルの成田 高橋大輔選手についてフィギアスケートの大会で4月29日に開催される大会(ジャパンオープン2007)には、あの高橋大輔選手は出場するのでしょうか
ショッピング	オープン	八ヶ岳エリアのスキー場は、『シャトレーゼ スキーリゾート八ヶ岳』と『小海リエックス』が12月5日オープン、『富士見パノラマスキー場』・『サンメドウズ』が12月12日にopen予定です
ショッピング	オープン	会員システムはオープン時点では作られていませんが、ポイントカードはあり、商品購入1000円ごとにスタンプ1個が捺印され、30ポイントで1000円分のヨコハマライズサーキット商品券と交換されます
その他	オープン	全米オープンゴルフに6人の自国選手が参加している南アフリカ共和国の記者団は、朝から晩まで母国で開催されているワールドカップ・サッカーに釘づけとなっている
ショッピング	オープン	11月28日にオープンする「スポーツミュージアム・オブ・ロサンゼルス」がこのほど報道陣に公開され、野球関連では、日本にゆかりのある多くの展示品が興味を引いた
ショッピング	オープン	オープン前日の7月25日には、プレス内覧会&開会式が行われ、MOT館長の氏家齊一郎、スタジオジブリの鈴木敏夫プロデューサー、「千と千尋の神隠し」でヒロイン千尋の声優を務めた柊瑠美(ひいらぎ・るみ)、さらに同映画の人気キャラクター“カオナシ”が登壇した
ショッピング	オープン	全国に「プレミアム・アウトレット・ショッピング®」を広げているチェルシージャパンは、さらに、2007年7月には神戸市北区に「神戸三田プレミアム・アウトレット」をオープンする予定です
ショッピング	オープン	道すがらに新規オープンしていた「餐休」の駐車場は満車、「豚太郎」は駐車無し、ここ「ラーメン道場」は駐車場には2台しか止まっていませんでしたが、歩いてこられる近所のお客さんも多いようでほぼ満席状態でした
ショッピング	オープン	松下電器産業は6日、近未来の家電製品の展示などを行う総合情報拠点「パナソニックセンター」の14日オープンに先立ち、報道関係者らにセンターを公開
その他	オープン	うちの正道会館は毎年五月の連休明けに、全日本ジュニア選手権って言う、オープン参加でどこの流派の選手でも参加できる子供の空手の大会を開催するんだけど、全国から800名以上の選手たちが参加する一大イベントなんだ
ショッピング	オープン	津市河芸町にオープンした「イオンスーパーセンター津河芸ショッピングセンター」は、日常生活に必要な幅広い商品を平屋建ての広い店舗で販売しているのが特徴です
ショッピング	オープン	だがここもオープンして1年ちょいすると改装に入り、エロゲ売場が改装前の3分の1にまでスペースが激減、これ以後新作ソフトでも入荷本数が少なくなりもはやエロゲ売場はただの「おまけ」程度のものになってしまった
ショッピング	オープン	また、その道の反対側に市立図書館をメインとした複合施設「えんパーク」も7月29日オープンの予定となっており、塩尻市の中心市街地の活性化につながって欲しいとともに、これから車を運転できなくなるお年寄りの買い物の場であり、世代を超えた交流の場所になるよう願ってやみません
ショッピング	オープン	3月オープン春頃に初めて行った時、凄い渋滞(高速降りてから、通常10分程のところ1時以上かかりました(^^;)だったので、今回は気構えて行きましたら、全く渋滞もなく楽勝で行けました
その他	オープン	2年生のうちにオープンキャンパスにいって、どの大学が一番自分に合っているか考えたり、自分が将来何をしたいのかという事をしっかり考えて、伝えるように練習してきました
その他	オープン	あなたがクライエントとの関係にオープンにならなければ、またクライエントとの関係を通じて、あなたがあなたの心全体に開かれなければ、プロセスワーカーとしてのあなたの極道の過程は、道半ばで挫折することになるでしょう
自動車	オープン	その理由はパイオニアのモニター10やKOSSのPROその他のところで書いたとおりだが、ゼンハイザーがオープンタイプとは別に密閉型を用意しているのもそのためだと思う
ショッピング	オープン	県環境部は、一台の車を複数の人で共同利用する「カーシェアリング」の実験を、豊橋市八町通に一日オープンしたマツダレンタカー(広島市)の「豊橋ステーション」で始めた
その他	オープン	土曜日に袖ヶ浦カントリークラブで開催されているブリジストン・オープン観戦に行くつもりだったけど、石川遼クンが予選落ちしちゃったので自宅待機です
その他	オープン	男子ゴルフの「ミズノオープンよみうりクラシック」で今季初優勝を飾り、日本人選手最年少で全英オープン(7月)出場を決めたプロ2年目の石川遼(17)(東京・杉並学院高3年)が、一夜明けた29日、兵庫県内のゴルフ場で記者会見し、「応援して
ショッピング	オープン	10月(じゅうがつ)には、全(すべ)ての子(こ)どもの居場所(いばしょ)が、正式(せいしき)にオープンし、公民館(こうみんかん)、学校(がっこう)、体育館(たいいくかん)、図書館(としょかん)等(など)の公共(こうきょう)施設(しせつ)、個人(こじん)の住宅(じゅうたく)等(とう)を活用(かつよう)し、地域(ちいき)の特色(とくしょく)を生(い)かした活動(かつどう)を展開(てんかい)している
その他	オープン	名古屋を中心として半径100kmに拡がる愛知県、岐阜県、三重県の経済産業地域を「グレーター・ナゴヤ」と呼び、圏内の産業経済を世界によりオープンなものとして、世界から優れた企業・技術やヒト・情報を呼び込むために、圏内の県、市、産業界、大学、研究機関が一体になって国際的産業交流を促進しています
自動車	オープン	1938年にドイツ陸軍が自重550kg、ペイロード400kg(乗員3名含む)のオープントップ車両という要求をまとめてポルシェに開発を命じ、1939年に初号車が完成し、4輪駆動型のVW86/87と同等の不整地踏破能力を示したため、1940年3月から生産に入った
その他	オープン	仁木氏は、学生時代からテニスにのめりこみ、全日本選手権、ジャパンオープン、大学選手権などの大会には、殆どスタンドから観戦していた程のテニス通であり、発起人の一人として誠に心強い存在です
ショッピング	オープン	10月16日オープンの『仙台泉プレミアム・アウトレット』は、常に国内外の著名ブランドの商品が25〜65%オフでお買い求め頂ける、100%アウトレット専業のショッピングセンターです
ショッピング	オープン	尾道市の漁師町“吉和”で44年続く、惣菜卸、仕出し、弁当の「やすもと」が直営のお持ち帰り専用寿司、弁当、惣菜の小売店「やすもと」を次々にオープンしている
その他	オープン	「早稲田の講義」は、大学の方ではなく、早稲田大学エクステンションセンターという系列のカルチャーセンターのようなところが主催した、オープンカレッジ講座のひとつです
ショッピング	オープン	11月21日より札幌国際スキー場がオープン致しました 宿泊スキーパック・日帰り入浴スキーパック各種プランが御座いますので 当館・もしくは札幌国際スキー場までお気軽に御問合せ下さいませ 続きを読む
ショッピング	オープン	待ちに待った道の駅が、神湊(こうのみなと)にオープンした 予想以上の人手でビックリした山の幸、海の幸がびっちり並んでお客様を歓迎したしかし、入場制限がかかるなどお客様も大変で、車も大渋滞 メディアやイベントでも盛り上がっていたさざなみ館のスタッフ、大島の婦人部隊も
その他	オープン	競泳のジャパンオープンが5日、東京辰巳国際水泳場で開幕し、第1日は男女10種目の決勝が行われた日豪対抗(5月、キャンベラ)の男子二百メートル背泳ぎで従来の世界記録を塗り替える1分52秒86(公認申請中)をマークした入江陵介(近大)は百メートルに出場53秒31で優勝したものの、タイムは自己の持つ52秒56の日本記録に及ばなかった
ショッピング	オープン	このうち07年9月にオープンする同社最大規模店となる新館を総合店舗にし、他の13店舗の配置地区をソフト系商品(テレビゲームやDVDなど)重視のエリアと、PCを中心としたエリアに分類する
自動車	オープン	同じ河岸の二三間さきのところに一台オープンにした自家用らしい自動車がテイルまで消して止っていて、柔かい桃色の装をした若い女が車の踏段のところに腰かけて涼んでいるのが見えた
その他	オープン	これは平成(へいせい)17年度(ねんど)からは選定(せんてい)結果(けっか)にあわせて、落選(らくせん)した団体(だんたい)も、オープンにしようということにしたが、その前年度(ぜんねんど)は、やはり落選(らくせん)した団体(だんたい)は恐(おそ)らく出(だ)さなかったのではないかと思(おも)う
スポーツ	オープン	オープン戦打率2割1分1厘と当たりの出ない阪神鳥谷敬内野手(23)は23日、昨秋キャンプから臨時打撃コーチとして指導を受ける中西太氏(71=日刊スポーツ評論家)とともに、ヤクルト戦(雨天中止)前の神宮球場で打撃フォームを緊急チェックした
自動車	オープン	オープンカフェのように外の空気と同じ空気を感じながらのショースペースは中古輸入車の展示があり、 ステップを上がると光岡自動車のオリジナルカーが展示してあるほか、 商談スペースが設けられています
ショッピング	オープン	プレオープン期間中はその他のテナントは営業準備中ですので、ご迷惑をおかけすることもあるかもしれませんが、その分、お受けいただきやすい プレオープン特別価格にてお待ちしております
その他	オープン	5月28日から6月2日にかけて本選が行われた「第81回関東オープンテニス選手権大会」(於:昭和の森テニスセンター)で、女子複に出場した坪奈津美さん(法4)・土屋奈夏さん(法4)のペアが優勝、「全日本テニス選手権大会」(例年11月に開催)の本選出場のワイルドカードを手にしました
ショッピング	オープン	2004 年、 2005 年に直営ショップオープン、ハウスメーカーとのコラボレーションなど行っており、カウンター材・窓枠材などの部材供給をはじめキッチンなども製作しています
ショッピング	オープン	11日の河北新報朝刊に『仙台港背後地に商業施設 アウトレットと隣接』という記事があって、三井アウトレットパーク仙台港の南側にカインズホームがカインズモール仙台港(仮称)を来年4月にオープンさせるそうで、その中にケーズデンキも出店と
ショッピング	オープン	ココをクリック・ショップオープンです♪ 在庫入荷しております、どうぞです☆ショッピングカートでお買い物が出来るようになりました♪超カワな商品もあります♪ ☆6月中旬in大分県中津市・別府市・出張対面鑑定☆ ( お申込み受付中) ご予約
ショッピング	オープン	同じく地方だけど 大型店舗はかなり客増えてる 新台入らない小型店舗は客激減 最近も1店舗潰れたが あと数件潰れそう でも大型店舗1、2件オープンする可能性大
その他	オープン	ナダル初来日のビッグニュースのご報告ができること、そして、ロディック、ツォンガ、モンフィス、ヒューイット選手の来日など、今年も「楽天オープン」を通じて、多くのテニスファンのみなさまに世界トップレベルのテニスをご覧頂けることを嬉しく思います
その他	オープン	価格はいずれもオープン価格だが、同社オンラインストアでは新規契約で「ウィルコム定額プラン」に「データ定額」のオプションを追加した場合、または「通話パック」に加入した場合に、WX320Tが税込9800円、9(nine)が税込7800円となっている
ショッピング	オープン	ロッテ側は新たにオープンする名品館に最高級ソファーを設置し、休息をともに楽しめる空間として作り替えるほか、顧客の乗用車は全て代理で駐車するサービスを行う予定
ショッピング	オープン	優雅に記録は、■産科医療補償制度(下)産科医療補償制度では、先天性などのインテリア噴水、つぼ、照明器具などが、観葉植物と重視した障害児のアンケートで原因で見直しが助産所がオープンさせるなどつくり、販売して間ではなりません
ショッピング	オープン	mederuがオープンした頃は同じチェーングループのかに屋さんで、途中でふぐ屋さんに変わっても(かに屋の前はふぐ屋だったらしい)、店長さんはずっと同じ方だったので、挨拶に来られたことはなかったのですが、今回は挨拶に来られたということは、“その店長さんのお店”としては、昨日が最後だったのでしょう
その他	オープン	テニスの全米オープンは31日、ニューヨークのビリー・ジーン・キング・ナショナル・テニスセンターで開幕し、女子シングルス1回戦で四大大会62回連続出場となる杉山愛(フリー)は第15シードのサマンサ・ストーサー(オーストラ
ショッピング	オープン	オープン時は周りの道路駐車待ちの長蛇の列の予想で自転車で行くつもりだったのですが、晴れたり土砂降ったりの妙な天気だったので久しぶりに市バスで出かけました
自動車	オープン	たかが近くのスーパーへ買い物に行くだけだったが、とても気持ちの良い秋晴れの午後だったので、分割式の3枚のルーフを外してフル・オープンにしてみた
ショッピング	オープン	来年度には、港湾物流効率化推進調査を実施し、荷主・船社・港運事業者のニーズ、労働力コスト、港湾管理者の意向等について検討を行い、港湾の24時間フルオープン化等、港湾荷役の更なる効率化やサービス向上を図りたい
