# 菓子: 「アイス　クリーム」の略。, 美容: おしろい下などに使う、クリームに似た化粧品。, 菓子: 牛乳から作る、薄黄色のどろどろした食品。, 菓子: くつずみ。, 菓子: クリーム色。薄黄色。
菓子	クリーム	前回食べてもらったのは、ごく普通のバタ・クリーム・ケーキで、今回彼女に試食してもらったケーキと比べると、手間も時間もさほど掛かっていないものなのだが、彼女は、そちらのほうが良かった、という
菓子	クリーム	それぞれ「デボンシャー・クリーム」と「コーニッシュ・クリーム」と呼ばれ、現在「本物」のクロテッド・クリームが製造されているのは両州とレバノンだけだと言われている
菓子	クリーム	菜の花をイメージした装飾でご好評をいただいております「新なのはな号」の記念ハンカチや、昔懐かしい豊鉄カラーとしてクリーム色と赤帯に塗装復元した「モ3203号リバイバルカラーピンバッジ」などを販売しています
菓子	クリーム	が、しかし、何日間にかけて10個のクリームパンを食べるともなると途中から訳が解らなくなってしまったので、上位3位のみランキングを発表し、後はご紹介ということにさせて頂きます(スンマセン)
菓子	クリーム	当初は土台が本物のパンケーキやカステラで、その上にシェービングクリーム(生クリームだと衣装についたらクリーニングが不可になるため)を盛っていたが、的がはずれることが多かった為、後に手のひらに置いたとき持ちやすくコントロールしやすい為、土台が紙皿になった
菓子	クリーム	金箔で美しくお化粧したマカロン達に、ガルニ(中に挟むクリーム)は、 マダカスカル産のヴァニラビーンズをたっぷり入れた、とっても美味しい、 ヴァニラクリー・・・
美容	クリーム	事前に「ニュージーランドでは、虫除け成分入り日焼け止めクリーム が売られている」との情報を仕入れていたので・・・欲しかったのだけれど、残念ながらそれらしき ものは見つからず、ごく普通の日焼け止めを買うことに
その他	クリーム	1960年代にはペンギンブックスのアートディレクターを務めた彼は、ザ・フー、クリーム、エルトン・ジョン、ザ・ローリングストーンズらのアルバムカバーなど、今でも知られる有名なグラフィックを数多く手掛けており、デザイン・ファンだけでなくロック・ファンからも熱く支持されるアーティスト
菓子	クリーム	毎日十数種類の焼きたてデニッシュやカフェ・マ・メゾンのパティシエ自慢のクリームを使ったクリームパン(天使のおしりパン)、洋食屋マ・メゾンの味が楽しめる惣菜パンなど
その他	クリーム	ちゃんと独立した歯らしい歯にして、よくCMとかでみるように、クリームとかで歯茎に接着させて使うような(実はよく知らないのです、入れ歯というものを)立派なしろものだったら、きっとこうはいかなかったでしょう
その他	クリーム	【0004】例えば、油脂をスプレッド状にした食品として、大豆やパーム、とうもろこし等から搾油されて作られる可塑性油脂の性質を有するマーガリンや、落花生を焙炒して引き砕きクリーム状にしたピーナツバター、その加工品であるピーナツクリーム、カカオ脂を利用したチョコレートクリーム等があり、パンや菓子に利用されている
菓子	クリーム	中にはカスタードクリームとバナナが入っていて、マロンペーストが薄っすらと混ぜてある生クリームでデコレーションされたシンプルなパイは、パイのサクサク感も抜群で美味しかった
菓子	クリーム	めちゃハマってます♪クリスマス限定なのでいまの内に食べようと2日続けて(笑)右がベリーを練り込んだドーナツにチーズクリーム、左が抹茶を練り込んだドーナツにチョコクリームです
菓子	クリーム	普段はチーズケーキの方が好きだったりするんだけれど、病院では何故かゴージャスな苺がで〜んと乗っかった、生クリームとカスタードクリームがうにゅうにゅしたミルフィーユに手がのびるのよね〜っ
菓子	クリーム	コーヒー用の粉末のクリーム小さじ2杯で25kcalに対して、脱脂粉乳は小さじ2杯で15kcalと他の乳製品に比べて脂肪が少なくなっているのでエネルギーも少なくなります
菓子	クリーム	それが、以前、このblogでも特集したブラックココアをタップリ使用した黒いビスケットにホワイトクリームをサンドしてあって、アメリカでも日本でも人気な定番菓子のOREO(オレオ)を貰った
美容	クリーム	毎日皆さんが使っているセッケン、洗顔・洗髪料、ローションやクリームなど化粧品全般、そしてしょう油、ソース、清涼飲料水、シロップなど常温で保存できる加工食品すべてに添加されているといっても過言ではありません
菓子	クリーム	論争的な建築をブレンドしつつも、巨大な立方体でできた前オーストリア王族の最盛期に見られるクリーム色のバロック調厩舎が現在、展覧会とパフォーマンス空間として生まれ変わったのだ
菓子	クリーム	「春咲き苺のシフォンケーキ」は、木いちごクリームと生クリームがタップリ入ったチョコ生地に、甘酸っぱい苺を咲き誇る花のようにトッピングした春らしいシフォンケーキです
菓子	クリーム	宇治ならではの抹茶のふくよかな香りと、深くてやさしいカフェオレの風味が、中に詰まったクリームと絶妙な相性で、全国の方々にもお取り寄せにご好評いただいております
菓子	クリーム	カスタードクリームを包んだり、シナモンとお砂糖で 煮たりんごを包んだり、チョコレートクリームを包んでみたり・・・同じ基本の皮を使って おやつもできますね
菓子	クリーム	ここ数年、浅草には若いお客様が増えており、皆さん『あんみつ』をよく召し上がられますが、中でも『クリームあんみつ』『抹茶あんみつ』が人気ですね」
菓子	クリーム	理由としては、うどんも中々ではありますが、 それ以上にお店の雰囲気がおしゃれで、うどん屋みたいではないという事と、 結構芸能人の方々とかが来るとかこないとか・・・ 今回は、浅利のクリームうどんを注文
菓子	クリーム	さてそこに苺とカスタードクリームを乗っけまして♪ ・・すごい歯ごたえのいいパイ生地に、濃厚なカスタードクリームがいいバランスで口の中広がっていきます
美容	クリーム	ポルトA クリームファンデーションEX2ご注文後1週間前後で出荷となりますポルトA クリームファンデーションEX2ご注文後1週間前後で出荷となります
菓子	クリーム	厳しい残暑だ」 08/14●ブログ*たまたま日記「長野市で一番のカスタードクリームのケーキ店ルベルジュ」 08/12●ブログ*たまたま日記「信州上田で
美容	クリーム	それが可能となれば恋愛相談室に行ってみて、さらに願うならライスフォース 激安で懸命に肌を修復してからパーフェクト BBクリームで効果を実感してください
その他	クリーム	念じながらやるっていうのもけっこう大事でクリームに限らず化粧水とかも「潤え~」とか思いながらつけると違うというのを聞いたのでみなさんもぜひ試してみて下さいね(・ω・)ノ
美容	クリーム	ビタミンK配合のクリーム・美容液などを青くまに塗布することで、青くまの原因となっている、小さな血栓が溶け、微細な毛細血管にいたるまでの血行が促進されます
その他	クリーム	メントールが苦手なので、無香料なのにイギーさんには香りつきらしいです この時期だし、何回も塗るので では安いリップクリームを使用 近江兄弟社さんのモイスキューブです 四角いので転がらないし、とにかく安い @cosmeってサイトでも7つ星中4
菓子	クリーム	そしてまた食品につきましても、北海道産のクリームシチュー、それからカレーのこくまろ、晩餐館の焼き肉のたれ、こういったものが北京のデパートで実に日本の二倍から三倍、こういった値段で売れておるわけでありまして、もはや北京や上海もそういう消費水準になっておると実感をしております
その他	クリーム	パーマをかけた部分がパサパサに乾燥して爆発している状態で、あれこれとヘアケアー剤を使用して落ち着かせたは良いけれど、オイルやクリームでずっしり重い髪になってしまいました
その他	クリーム	ニキビ跡ケアのつもりが、あっという間にシミまで消してしまうなんて、大手化粧品メーカーの「効いてるような効いてないような」名ばかりの美白クリームとは一線を課したアイテムといっていいとおもいます
菓子	クリーム	とかちのぎゅうにゅうとナマクリームをしようした「なまキャラメル」(ホワイト・プレーン・チョコレート、かく851えん)や「なまキャラメルプリン」(421えん)、「なまキャラメルソフトクリーム」(381えん)などをそろえている
菓子	クリーム	茶クリーム色の見事な析出に覆われた30cm角位の木槽に、沢沿いの自家源泉から非加熱で直接引いている鉱泉水をいったんためてから湯船に投入するしくみ
美容	クリーム	さらにお得なプレゼントをご用意♪売り切れ続出中の超〜オールマイティーのパーフェクトクリーム『椿とお茶のうるおいくり〜むお試し用』を商品到着後にレビューを書いていただいた方へプレゼント
美容	クリーム	でもEPAはお肌の油分の補給には重要な働きを持ちますので、この機会に覚えておいてください、油分はクリームで補給しなくてもEPAを摂取することで体内から確実に補うことができるのです
その他	クリーム	薬用ソワニティ ローションRタイプ&クリームは、消炎作用成分のグリチルリチン酸ジカリウムが配合されているので、この季節の乾燥による痒みや痛みをケアに役立つことだと思います
その他	クリーム	研究チームは初期より経皮膚パッチを数多く創り、パッチに付着させる医薬品にも、治療効果の高い経皮膚吸収クリーム、軟膏、ジェルなど独自の経皮膚吸収技術が応用されています
菓子	クリーム	ひとつは一度箱からだしたケーキを保存しておくという まさに私のためにあるかのような ケース 今までケーキ屋さんの箱で冷蔵庫にいれていたけどクリームとか乾燥してきてたのがこれでも心配なし
菓子	クリーム	この結果、湯葉のお刺身やおからコロッケ、豆乳カニクリームなどに雑穀米を組み合わせた「ヘルシーランチ」(月・火・水曜日のみ、一日20食限定)や「卓上出来たて豆腐」、「厚揚げの三色田楽」)などの一品料理9品、「豆乳ティラミス」をはじめとするデザート3品を19年11月からレストランこ~ぱる(コープマートあだたら店内)で提供している
菓子	クリーム	パスタ、サンドウィッチ、ハンバーガー、クリームをたっぷりのせたハニートースト、パフェ、ケーキ、フルーツにフレーバーティ・・ううっ食べたいものばかり
その他	クリーム	【商品の情報】製品名コスメディカ デュア アンチドライクリーム製品特長贅沢な潤いを与える高保湿クリーム●高分子(ヒアルロン酸)や低分子(月見草オイル)等の保湿成分を配合
菓子	クリーム	ケーキはショコラケーキと謎のクリームが乗ったケーキ2つを食べたけど、両方とも程良く甘くスポンジもふっかふかでおいしかったですよ( ゚∀ ゚)=3ウマー
美容	クリーム	●韓国発の人気メイクアップコスメが登場『パルガントン ワンタッチカラー BBクリーム』 韓国TV放送局などプロメイクなどで紹介され、韓国の芸能人がこのメーカーのファンデーションを
美容	クリーム	この「美肌一族」ブランドでは、他にもクリームや入浴剤、化粧下地やピーリングジェルなどの商品も展開中だが、商品展開もさることながら、注目すべきは、その驚くべきプロモーション方法だ
菓子	クリーム	キッズBメニューは、いちごづくし イチゴジャムをつくり、カスタードクリームもつくりデザートプレートの出来上がり パティシエのようにお皿に絵を書いたら でも味は完璧
その他	クリーム	よく知られた代表曲である「レッド・ハウス」「ファイア」「ストーン・フリー」の'69年ヴァージョンに加え、エルモア・ジェイムスの「ブリーディング・ハート」や、クリームの「サンシャイン・オブ・ユア・ラヴ」にインスパイアされた未発表曲も収録
菓子	クリーム	マロンクリームで包まれているロールケーキですが、そのマロンクリームがとっても濃厚でたっぷりあって、 それだけでもマロン好きにはたまらないおいしさです
菓子	クリーム	でも、生地はおいしかったので許そう・・・本当はこれに絶品カスタードクリームをはさみ、イチゴとブルーベリーをトッピングして粉糖をかけてできあがり
菓子	クリーム	セットメニューにすると付いているバジルロールっていうパンがフカフカで美味しかったよ〜 カルボナーラの残ったクリームソースもパンですくって全部食べちゃいましたー
美容	クリーム	ビオテルム アクアスルス ノンストップクリーム(ノーマル/コンビ肌)は5000リットル分のスパ水に相当する凝縮スパ成分で、肌をうるおいでみたすクリームです
美容	クリーム	続きを読む: ★最大ポイント5倍★9/8(火)AM9:59まで 詳しくはこちら♪肌が喜ぶ成分ぎっしり詰まったクリームファンデーション☆【ワンタッチビューティー・楽々美人・2個セット】
美容	クリーム	昨日は(こちら)SPF50の最大16時間のCCクリームとUVカット(はこちら)を付けて出かけましたが、海の上で強い日差しを浴びたので、帰ってシャワー後すぐに、美白ケア私のお気に入りで簡単に日焼け後のトラブルを解消出来るのが、プラセンタのシートマスク洗顔後、VCセラム(についてはこちらから)を塗布し、マスクに閉じ込めながら、パックですなんといっても、プラセンタ
その他	クリーム	スマイルは、ロジャーがロンドンの歯科医大学に在学していた1968年にブライアン・メイが出した「ミッチ・ミッチェル(ジミ・ヘンドリックス・エクスペリエンス)やジンジャー・ベイカー(クリーム)のようなドラマーを求む」というメンバー募集の広告にロジャーが応募し結成された、トリオ形式のバンドだった
菓子	クリーム	バターをクリーム状にして、グラニュー糖、卵、小麦粉+紅茶、アーモンド粉の順に混ぜていって、割にしっかり目に混ぜてから325°F(約160°C)のオーブンで1時間弱焼いたものです
菓子	クリーム	チーズクリームを使い、ソフトクリームのようにクルクルと巻いた人気の「とんがりチーズモンブラン」(494円)やミルク風味のバウムクーヘンに生クリームをたっぷり詰め込ん
その他	クリーム	【0017】本発明の膣投与製剤の剤形としては、一般に、生理学的に活性なペプチド、有機酸とショ糖脂肪酸エステル、必要に応じて動物性タンパク質および/または植物性タンパク質からなる液状製剤、ゲル剤(高粘性のものが好ましい)、坐剤、フィルム剤、錠剤、軟カプセル剤、タンポン、クリーム剤などが含まれる
美容	クリーム	それからクリームに関してですが、バイオラブ化粧品は「正しいスキンケア理論」に基づいて処方を考えてありますので、お肌に負担をかけてしまうような過度な油分は配合しておらず、水分ベースのクリームとなっています
菓子	クリーム	私が確認できたところでは、種類は「アンコ」・「(カスタード)クリーム」・「ウインナー」の3種類で、もう1種類くらいあったけど覚えていませんでした
菓子	クリーム	いつものカスタードクリームが、まだ熱いうちに、刻んだチョコレートを加え、溶かしながら混ぜた「チョコレートクリーム」をたっぷり入れたチョコクリームパンは子供他ちが大喜びで食べていました☆
その他	クリーム	マッキーさんお勧めのルブランシーを購入してみたのですが、マッキーさんは洗顔後化粧水→ルブランシー&トシコリッチ という使い方をしているようですが、ルブランシーの使用方法の説明書に、洗顔後ルブランシーをつけてそれだけでもOK ルブランシーを塗布後、化粧水やクリームで調えることもできます
その他	クリーム	フランスではなぜか、サワークリームのような酸っぱいクリームが自動的についてくることが多いのですが、私はふんわりたてたあまり甘くない生クリームを添えて食べるのが好きです
その他	クリーム	手荒れをガードする皮膚保護クリーム「シルキーガード21」をおススメに営業活動をしています、今日は、スタッフの方に、試供させて頂きお悩みを改善することに徹しました
菓子	クリーム	内容量305g / 3〜4人前原材料スーパースイートコーン、小麦粉、クリーム(乳製品)、砂糖、食塩、でん粉、マーガリン、植物油、ホエイパウダー、バター、タマネギ、大豆たんぱく、香辛料、調味料(核酸)、カロチン色素作り方スプーン等で中身を鍋にあけ、缶と同量の牛乳を加えて、ゆっくりかきまぜながら中火で温めます
菓子	クリーム	白いのにコーヒー味の生クリームやクリーム味のお米粒、最高級マスカルポーネチーズのまろやかな舌ざわり、コーヒー味のスポンジケーキが絶妙な美味しさ
菓子	クリーム	メニューはチーズスフレ(プレーン)、チーズスフレ(カスタードクリーム)、ピンクスフレ(中にチョコ)、カスタードアップルパイ、ブリック3種(スティックタイプのケーキ)、あと今期間限定のグラタンパイとか
美容	クリーム	化粧水、美容液、クリームとお肌に良いものをたくさん与えようと意識してしまいますが、一番大事なのは、その前のステップで清潔にして、整えてあげること
その他	クリーム	という事になっていて、とってみると確かに見た目はシャレているし、口に入れたときの甘味と酸味、そして塩加減とクリーム由来のこってり感の取り合わせが面白く、各種酒精への寄り添いを見せる
菓子	クリーム	普通のオムライスはケチャップ味のチキンライスですが、ちょっと変わったクリームソース味にしてみました、もう少しソースが多ければ、リゾット(ドリア)とオムライスが一度に2度味わえるオムライスが出来たと思います、急遽2人前から3人前にしたのでちょっとソース足りなかったかな
菓子	クリーム	カスタードクリームが入った白い求肥で巻いたプレーン、イチゴが入った赤い求肥で巻いたイチゴ、小豆が入った緑の求肥で巻いた抹茶の三種類で、"もちっと三兄弟"です
菓子	クリーム	あじわいこだわり製法(製法特許出願中)によって良質な牛乳本来の、やわらかな「あじわい」を大切に、まろやかなコクと、すっきりとした後味のクリームに仕上げた32%のフレッシュクリームです
菓子	クリーム	そして、もうひとつの発見、3年前はクリームパイの中にバナナが中に忍ばせてあったことを この記事 で確認して思い出したんですけど(アルツですっかり忘れてました)、ケーキにも年々、アレンジが加わっているんだなぁ〜ということに、ビックリ&現状のケーキに満足せず更に美味しい何かを探してる小山シェフの信念に感動しちゃいました
美容	クリーム	韓国のBBクリームをこってりと厚塗りしていましたから、紫外線への備えはあったのですが、やっぱりこの年になるとこれ以上はシミ、シワがいやですから、助かったねぇ
美容	クリーム	クリニーク リペアウェア インテンシブ ナイトクリームは、眠っている間に、肌のダメージを一気に修復して、抗酸化パワーを補ってくれるミラクル効果のナイトクリーム
菓子	クリーム	(4)のスポンジケーキ1台は長さを4等分し、それぞれを横3等分にして(6)のクリームを塗り、いちごのスライスをのせ、いちごの上にもう一度クリームを塗ってサンドしていく(写真f)
美容	クリーム	キズなど肌の欠点部分をカバーしてくれるクリームという意味で、これを塗るだけでナチュラル感のある肌をつくることができ、すっぴんのようでありながらしっかり欠点の抑えられたメークができるアイテム
その他	クリーム	そのような人のために食材をクリーム状にして食する調理方法も ありますが、それでも受けつけないほど弱っている場合は、残念 ながら改善は困難になってしまいます
菓子	クリーム	かっぱ♀がチョコレート系が苦手なので、買うときは、単なるタルトと果物の組み合わせのものばかりですが、間のカスタードクリームの柔らかさや甘さが絶妙で、フルーツの裏方に回りながらもこれがないと絶対ダメという感じなんですよね・・・
その他	クリーム	他社でバラの香りのハンドクリームを使用したことがありますが、とっても癒されるし、なんせバラの香りって女性ホルモンに作用する働きがあっていいらしいですね
その他	クリーム	部屋を間違えて“今日唯一”の客を取りそびれたと知ったキャンディが、そのまま亀田を相手に商売をしようと挑発してくると、亀田は逆に美容クリームを売りつけようと企てる
その他	クリーム	たまたま真夜中市場を見た時、この時とばかりに紹介されてる化粧品や美容クリームとかを 塗りたくってるハイヒールの二人を見て「結局視聴者はこの方が買いたくなるんだな」と思った
菓子	クリーム	普通の靴磨きはクリームをブラシを使って全体に染込ませ、布などでゴシゴシ磨くのが一般的だがこのスリ込み式は布等のカラ拭きで磨いたりせず、湿った布で丹念にクリームをスリ込んでいくだけ
菓子	クリーム	抹茶ロールケーキは中のクリームにお砂糖を加えずに一緒に巻き込んだゆであずきの甘さのみなので抹茶の苦みもきいてかなり大人味なのですが、渋好みの次女の大好物です
その他	クリーム	前後してますが・・・ みなさんお待ちかねのあの小顔クリームの体験レポレポ 顔のたるみ専用リフトアップクリーム お姉ちゃんからもらった1包 大切に使っ
菓子	クリーム	これは、ビスケットにホワイトチョコレートと北海道産生乳100%のバター、そしてカリフォルニア産のレーズンをあわせたクリームをサンドした、北海道で有名な六花亭さんのロングセラー商品なんです(*^m^*)
