# 菓子: 「アイス　クリーム」の略。, 美容: おしろい下などに使う、クリームに似た化粧品。, 菓子: 牛乳から作る、薄黄色のどろどろした食品。, 菓子: くつずみ。, 菓子: クリーム色。薄黄色。
美容	クリーム	最初の実験で、Wager博士らは、スキンクリームの塗布前後に右手首に一連の疼痛性および非疼痛性の電気ショックを与えた24例の被験者における脳活性を検査するために、機能的MRI
菓子	クリーム	ねぎとろのスパゲティー、アツアツのかに味噌クリームをパンにつけて食べるかに味噌グラタンや、食後のデザートにアップルパイ・アイスクリーム添えもおすすめです
菓子	クリーム	【9】 ケーキ上面の真ん中に残りのショコラクリームを落とし、パレットナイフの先をケーキの中央部分にあて、時計のように回しながらショコラクリームをじょじょに薄くのばしていく
その他	クリーム	あのクリーム(エリック・クラプトンが在籍)のプロデューサーであり、マウンテンのベーシストであったFELIX PAPPALARDIをプロデューサーに迎え、全米ツアーを行うなど海外でも活発に活動
その他	クリーム	ここらでも色白が美人とされているのだろうか{実質色白は皆無だが}、女は顔に何だか白いクリームのようなものを異様な程コテコテ・テカテカに塗りたくって家から出て来た
菓子	クリーム	中世初心者の形成 クリーム色:王領地黄色:封建諸侯の領地茶色:氏族または王の支配に浴さないと考えられている地域初心者の王朝は、統一アルバ王国の成立によって始まる
美容	クリーム	9月14日(金)「ビオテルム」から新登場する「タッチモイスト ファンデーション」は、クリームを塗った時のようなうるおいのある心地よさを実現したパウダーファンデーション
菓子	クリーム	チョコクリームが甘そうに見えるかと思うんですが・・・、生クリームとブレンドされたチョコクリームなので生チョコみたいな感じのビターでお上品な味がしてとても美味しくて気に入りました
菓子	クリーム	誰かの「コロッケ食べたい」宣言で急遽みんなでコロッケ作り♪足りない材料を買いそろえ、今夜のディナーは「手作りクリームコロッケ&タルタルソース」に決定☆みんなで仲良く作り、20時いただきま~す♪♪♪掛かった時間は約2時間↑↑3分COOKINGならぬ2時間COOKING
美容	クリーム	単純に安いから他のBBクリームを使っていた方々がエバーBBに出会ってその明らかな違いを感じるのは本来のBBクリームの目的に従って作られたものか、そうでないものかの違いでもあります
その他	クリーム	・殺菌クリームを塗り、マッサージを毎日行う、・弾性ストッキングをマッサージ後に着用する、・日中、上肢は長く下垂させない、下肢は起立時間を 短くし、軽い運動を行う、・外傷に注意し、傷したら消毒を直ちに行う、・入浴時にマッサージを行う、・就寝時、足の太さを計り記録し、太くなっているなら弾性ストッキングの着用、更にその上に弾性包帯をする、・肥り過ぎないようにする
その他	クリーム	朝起きていきなり大あくびでもしようものなら、下唇に地割れのような亀裂がピシッと入り、リップクリームを塗っても効果がないくらいの深い傷を負います
菓子	クリーム	他に、ビスケット生地の中にチョコチップを入れてチョコチップメロンパンにしたり、パン生地の中にメロンクリーム(カキ氷シロップと牛乳で作る)を入れたりして作ってみました
菓子	クリーム	アボカドレアチーズケーキの方は、やはりアボカド自体が元々クリームっぽい食感であるが故か、意外にもほとんど違和感なく酸味の利いたデザートとして美味しくいただけました
菓子	クリーム	プリンクリームは、プリン味のクリームが入っているのかと思ったら、生地にバニラエッセンスが練りこまれた感じで、パンの真ん中には薄くしたカラメルソースが入っていました
菓子	クリーム	軽い味わいの抹茶クリームの上に、ブルーベリー、フレッシュラズベリー、ストロベリーコンフィチュール、ラズベリーコンフィチュールを並べて・・・巻きこみます
その他	クリーム	「愛すクリームとMYプリン」の大阪イベントでは「ドラゴンボールのDVDを見てる」って言ってましたけど、最近そういうアニメのDVDは見てないのですか
菓子	クリーム	この「まあちゃん」には10年の歴史がありまして、初代はクリーム色、一時期クリーム色&赤のダブル「まあちゃん」時代があって、最後は緑「まあちゃん」でした
その他	クリーム	神々の朝食;ショコラ—その魅力にとりつかれた人々;種の起源—チョコレートの誕生と進化;チョコレートと七面鳥;ほろ苦い町ハーシータウン;チョコレート海岸;プリンシペ島のクラウディオ;チョコレートの殿堂ヴァローナ;フランスの名ショコラティエ;ベルギー—ホビットのチョコレート;女王の召し物—ゴディバ社の謎;バラのクリームと代替油脂;伝統のスイスと新生ロシア;ヌテッラをさがせ
美容	クリーム	「モイスチュア リポソーム」の保湿美容液とクリームをはじめ「マジー デコ」シリーズで人気のフェイスパウダー、美白化粧水まで一度に試せるお得なキットです
その他	クリーム	クリームの中のコーンフレークも入ってます音♪でも、カロリーが一個322Kcalもあるとは、タスケテー〜〜・・・(ちなみにポン・デ・黒糖は208kcal)
美容	クリーム	商品概要:形状を記憶させるようになじませる二つの高機能クリーム誕生内側からあふれ出すようなハリと弾力で満たします肌再生理論のオバジから、ファン待望の高機能アイクリームが誕生
美容	クリーム	一方で、ベースメイク市場の過半数を占めるモイスチャー&カバーは、「コフレドール」(カネボウ化粧品)の発売やBBクリーム、ミネラルファンデーションのヒットなど好材料に恵まれたものの、モイスチャー&カバーからアンチエイジングへ訴求機能を移行したブランドがあったことや、ドラッグストアを主力チャネルとする中価格帯ブランドへの需要が低迷したことで、実績を落とした
菓子	クリーム	チョコレートの香りと生乳、クリームの香りがとってもマッチしているアイスです☆こちらのアイスクリームも乳脂肪分12%と高めですが、コクがあってまろやかです♪
その他	クリーム	若い方や皮脂分泌の多い方におすすめの汚れ落とし用油性クリーム(メイク落とし)ゼノア化粧料本舗のコールドクリームトゥエンティは、角栓になりにくく汚れを溶かして落とす力が優れている無水型コールドクリームです
菓子	クリーム	箕面のアンリ のポテトは下がタルト 後はカスタードクリームが少しとたっぷりのお芋のペースト 十分お菓子ととして通じるのに 158円はお値打ちです
美容	クリーム	日焼け止めクリームを選択して使用することができて、厳しい日差しの下でもし比較的に長い時間を暴露しなければならないならば、SPFの25~30での製品を選択して使用することができます
菓子	クリーム	すると、相手は眉間に皺を寄せて、おまえら日本人はそういう奇怪なものを食べるのか、という顔でこちらをしばらく見たあと、「自分はマッシュルームのクリームソースにする」と宣言した
菓子	クリーム	というような定番メニューから、クリームシチューうどんや肉つけうどん、クリーム明太子うどんなどのオリジナルメニューまで豊富なうどんがズラリと並んでいます
その他	クリーム	そんなとき一番身近で働いてくれている自分の「両手」に、ありがとうの気持ちを込めてハンドクリームで栄養を与えたり、ときにはきれいにお化粧したりはどうだろう
菓子	クリーム	デザインはそれぞれ、はちみつレモン味にカミナ、チョコクリーム味に「劇場版グレンラガン紅蓮篇のキービジュアル第2弾」、粒々イチゴ味にはヨーコを使用している
その他	クリーム	クリーム時代やD&Bとやってた頃が好きなので、アンプラグドになってからは興味が薄れてしまい、来日の話を聞いても、また来てるんやくらいに思ってい た
菓子	クリーム	チョコクリーム御注文でクール(冷蔵)宅急便でお届けのお客さまの場合、トラックで揺られてケーキが崩れてしまいますので、当店でマイナス40°Cで急速冷凍したものをクール(冷凍)宅配便での配送になります
その他	クリーム	ふつうのキャリアオイルだと肌にすぐ浸透してしまうので、長時間肌の上に精油が残るように、蜜ロウをゆるめに溶かして作ったクリームに精油を混ぜて使った
美容	クリーム	なめらか肌に導くクリーム【ミドリ アクアクリーム】化粧水【ミドリ アクアローション】でお肌を整えたあと、パール1粒分を顔全体または顔と首になじませます
菓子	クリーム	クリームは冷たくてクリーミーで美味しい〜〜( ̅m ̅*) フランボワーズはクリームの真ん中が甘酸っぱくて甘さがちょうど良い感じ〜〜 塩キャラメルは塩生キャラメルです
その他	クリーム	クリームは、実は主人公(玉木宏くん)が常用してる化膿止めの薬で、あおいちゃんがそういうやらしいことに使うもんだと勘違いして言ってるんですけど、なんか、うまく言えないけど、雰囲気とか、展開とかそういうのが、ホントやらしいよ、この映画
その他	クリーム	指先でクルクルと円をえがきながらメイクとなじませると、軽いクリームのようになるんです 浴槽につかって温まりながらクレンジングすると、顔の血行もよくなって、睡眠不足になっても クマができにくい のですよー その話は置いておいて
菓子	クリーム	チョコを使ったケーキを買うことが多いのですが、今日は“期間限定”という表示にひかれて、ミルクティーロールケーキと、もうひとつイチゴクリームにパイが乗ったケーキ(うまく表現できない)を買いました
その他	クリーム	ケシミン クリームc 30g ★商品説明: 「ケシミンクリームc 30g」は、ビタミンC誘導体が集中的に角質層のすみずみまでじっくり浸透して、メラニンの生成を抑える薬用美白クリ
その他	クリーム	しかし、このクリームこそが、後にインターネットの口コミで広まり、多くの美容ブロガーさんたちの心をわしづかみしてしまった、『ヴォイッジ スキンコンセントレート』の原型のクリームだったのです
美容	クリーム	お財布を盗まれた、パスポートを無くした、英語ができないから航空券の予約確認をしてくれ、安いツアーを教えてくれ、良心的な宿を教えてくれ、郵便局が閉まってしまったがどうしてもトンガから手紙を出したいから、出しておいてくれ、国際電話のかけ方を教えてくれ、日焼け止めクリームを塗らなかったから火脹れになってしまったから助けてくれ、レンタルした自転車がパンクしたから助けてくれ、などなど、きりがありません
その他	クリーム	このクリームは、表参道ヒルズにあるスパ「le bois(ルボア)」でのトリートメントでも使っている「羅漢和」のものを使っていますので、東京でも買うことができますよ
その他	クリーム	今日の公演もお疲れさまでした写メかっこいいです面白いとり方は、リップクリームを手につけてカメラのレンズにつけて撮ると、ちょっとぼやけがでていい感じになると思います明日の公演もがんばってください
その他	クリーム	毎日全部は出来なくても、水仕事の後は必ずハンドクリームを・・・お風呂上がりにはボディークリームを・・・ヘッドマッサージ・フェイスマッサージ・ハンドマッサージ・足のマッサージをして、足のむくみ取り・・・健康の為のウォーキングやストレッチ・・・等々頭の先から足の先まで、「これでもか、これでもか・・・
菓子	クリーム	クリーム、脱脂濃縮乳、ラズベリーソース、砂糖、チョコレート、卵黄、ココア、香料、安定剤(ペクチン)、植物レシチン(大豆由来)、(原材料の一部に卵白を含む)
その他	クリーム	それから、使うときなのですが、私は付属のツールではなくて手持ちのアイブロウブラシとクリーム系用のナイロンブラシ(アイブロウ用の形)を利用しています
その他	クリーム	※整髪料など髪に汚れがついている場合は、シャンプーで洗髪し乾かしてください/クリームが固くて使いにくい場合は、50°Cぐらいの湯せんに5~10分くらいかけて再度よく振ってからご使用ください
菓子	クリーム	昭和2、30年代に味覚の刷り込みを受けた身としては(^_^; コロッケ、アイスクリーム、カスタードクリームにやたら生クリームぶち込んでるような気がしてならないんです
その他	クリーム	その都度、マッサージに挑戦してみたり、フェイササイズで百面相してみたり、ハリの出るクリームでケアしたりしているものの、少し良くなると今度はお手入れが面倒に
その他	クリーム	一昔前はひび割れ部分に、ふうふう言って熱で溶かした膏薬を詰めたりしたものですが、今はこういう療法は少なくなり、ひどくなるまでに保湿成分のはいったハンドクリームを塗って皮膚の硬い部分を乾燥から守ります
菓子	クリーム	そうこうしているうちに、こどもたちが学校から帰ってきて、 お友達も続々と遊びに来る中、 スコーンにクリームとジャムを塗り、一口食べて、フムフム、 ミルクティーを飲んでフムフム
菓子	クリーム	祈願を終えた後は、甘党・岩崎会長がお気に入りの屋台で「鯛焼き(あんこ・クリーム)」を買って帰り、家族全員で頬張るのが”ひとつの楽しみ”になっております
その他	クリーム	そのメーカーのクリームを使用した一部の女性が皮膚のトラブルを訴え(※黒皮病)、結果としてメーカー側が賠償金を支払うというかたちで和解したのですが、それは社会問題にまで発展しました
菓子	クリーム	クリーム、カラメルソース、卵黄、砂糖、脱脂濃縮乳、カスタードコーチング(植物油脂、砂糖、全粉乳、卵黄粉末)、粉あめ、洋酒、バニラビーンズ、バニラ香料、安定剤(ペクチン)、植物レシチン(大豆由来)、(原材料の一部に卵白を含む)
その他	クリーム	「ジェノーマ」はナイトアップクリームを使ったことあるのですが、シーラボのゲルに慣れてしまったせいか・・・やはり、クリームなのでテクスチャーはべとつく感じは否めないかと思います
その他	クリーム	街で売っているケーキはバタークリームのものしかなく、租界時代からの老舗で、何軒か生クリームのお菓子を出す店があったが、まだ、配給制が残っていた当時は、そのような希少な商品を、幹部と縁故のない人間が手にいれることができなかった
菓子	クリーム	府などによると、7年6月24日、同工場で製造されたカスタードクリームを使った生洋菓子を食べた同府守口市内の住民3人が下痢や嘔吐(おうと)などの食中毒症状を訴えているという通報が地元の保健所にあった
菓子	クリーム	カスタードクリームのことをパティシエールというのですが、入りたてのころは「パティシエールたいてくれ」と言われても頭の上にクエッションマークがでてましたし、やり方が分かってからもスクランブルエッグいりクリームに何回もしてしまったことがあります
菓子	クリーム	デザートは、サンプルでは、かなりな大きさの抹茶クリームケーキみたいなものを確認していたのだが、実際には、消しゴムくらいの大きさのグレープフルーツゼリーだった(;O;)
菓子	クリーム	大判焼きの小さい感じのものだったけど、これを口に放り込んでガブリ・・・アツアツもアツアツのカスタードクリームがお口の中でジューと飛び出て燃えたぎる悪魔と化して暴れまわる・・もうホント死んだかと思いましたよ・・
美容	クリーム	歩きやすい服装と靴で起こしいただくのはもちろん、帽子・日傘・日焼け止めクリーム・ペットボトル飲料などを持参して、しっかりと熱中症対策をしてください
その他	クリーム	たとえば、クリームの 『素晴らしき世界』 (2枚組み) の2枚目に収められた 「クロスロード」 などは、もうそのレコードのA面を使い果たすかのように、延々とギターとベースのインプロビゼーションが続く
菓子	クリーム	さらにインサドンイヤギ(「インサドン物語」と日本語で書いている)という名の喫茶店に入って韓国風のかき氷「パッピンス」と、パフェというよりクリームソーダに近い「パルフェイ」を注文し、冷房で涼をとる
その他	クリーム	肌の柔らかさがアップするフェイシャルオイル、代謝機能を促進するクレンジング&マッサージクリーム、カール・ロング・ボリュームの効果を併せ持つウォータープルーフマスカラ、ハリと弾力に満ちた素肌を目指すスペシャルな化粧水、1本で色選びが可能な驚きのファンデ、赤ちゃん肌のうるおいに着目したスキンケアシリーズなど新作コスメをプレゼント付きで紹介
菓子	クリーム	枝豆・アロエ・杏仁豆腐をブレンドしたアービーアイスクリームを食べたり、デパチカでずんだもちを試食したり、喜久福とゆー抹茶クリーム大福をkazちゃんにごちそーになったり
美容	クリーム	年のせいかけっこういい化粧水やクリームなどを使用していましたが、肌が慣れてくりと成果がでなくなりはりもくすみの目立っていた頃にDHC薬用Qシリーズの宣伝が目にとまり試しに購入したところすぐにはりつやがもどったのには驚きです
その他	クリーム	イミキモド5%クリーム、基剤クリーム及び無塗布(空パッチ)部位での皮膚反応は、治験薬除去30分後及び24時間後、全例においてすべて「反応なし」(−)であり、いずれの部位も皮膚刺激性は0であった
その他	クリーム	チョコラザーネプラス(医薬品) 尿素20%+ビタミンE+グリチルリチン酸二カリウム チョコラザーネプラスは、尿素(20%)、ビタミンE、グリチルリチン酸二カリウムの働きにより皮膚の水分を保持しながら皮膚をやわらかくするとともに、適度の油分を補なって荒れた皮膚の症状を改善する医薬品のクリームです
菓子	クリーム	この度は、『カスタードクリームたい焼き』のコピープロテクトに関する注意文及び、シリアルキーコードの書かれたマニュアルが同梱されていなかった件で、大変ご迷惑をおかけしております
美容	クリーム	比較的リーズナブルなラインの乳液やクリームをぬるのだけど、最近気になってるのがアロマオイルとマッサージ専用のベースオイルを混ぜて使う、というもの
その他	クリーム	このお菓子の中には、バタークリームと キャラメリゼしたアーモンドをしのばせており ダクワーズ生地と、バタークリーム、アーモンドの 三拍子の食感がとっても美味しいお菓子です
その他	クリーム	小顔のクリームはアタシぐらいなので(ドルチェはデカイし、娘シュクレはラブラドール顔だし)この被り物が有る限り、小顔の女の子が仲間入りしてくれないと
菓子	クリーム	パッと見はドライフルーツと極似ですが、トッピングはブルーベリー、クランベリー、レーズンそして、中にはブルーベリージャムとフランス産クリームチーズから作る「特製ブルーベリークリーム」がイン♪
その他	クリーム	だからこそ、外的なダメージと向き合うことの多い昼間のケアにおいては“美肌の大敵である紫外線や乾燥からお肌を守る”ために昼用クリームがおすすめです
その他	クリーム	そこにジャムを、それこそ桑の実のジャムなんかを入れたものとか、そのほかコーヒーだとか、チョコレートなんかを少しまぜて、ちょうどクリームのお菓子みたいにしてチーズを売っているんです
菓子	クリーム	それにも増して日本人のバターの香りに対する慣れに大きな役割を果たした食品はアイスクリーム、クリームたっぷりのショートケーキやデコレーションケーキであった
菓子	クリーム	(見事に着崩した制服の上にクリーム色のやや長めのコートを羽織り首には黒のマフラーを巻き充分に寒さに対策を練った格好で凛と胸を張って颯爽とした足取りで夜道を歩いてコンビニに辿り着き
その他	クリーム	塗っていても、かさかさがなかなか治らない方は、保湿剤やリップクリームにかぶれている場合もありますので、使用を中止し、早めに皮膚科専門医をご受診ください
菓子	クリーム	しかも今日の食事です 朝ごはん:生キャラメルクリーム、しっとりバターチョコブレッド、サラダ(海草類、キャベツ、にんじん、たまねぎ、きゅうり)、ヨーグルト、紅茶 昼ごはん:うどん 間食:スタジアムの食事、小枝1袋 アイス大好きな私
菓子	クリーム	しかし肝心のハンバーグは中からチーズのようなコーンクリームがでてくるサプライズの他は肉の旨みをあまり感じず、ドゥミグラスソースも緩いものでした
その他	クリーム	あーぁ、どこをどう探してもハンドクリームがなくなってしまい、職場では今週からお隣り席の同僚がデスク常備してるハンドクリームをチビチビモラって過ごしてました
その他	クリーム	親油性は親水性に比べ、約半分の油分で調整されていて、水で洗い流せるマッサージクリームなので、使いやすいと評判ですが、マッサージの高い効果は油分の多い、親油性の方です
菓子	クリーム	カラダが温まる根菜とゆばのミネストローネ、菜の花のソテー、フレッシュトマトソースとアスパラガスの色鮮やかなパスタ、デザートはいちごのヨーグルトクリーム添え
その他	クリーム	塗ってみてちょっと驚いたのですが、クリーム状のやつを掌で伸ばしたとたん、全く水のような感触になってもう少し手をこすりあわせるとクリームのような感触に戻ったこと
菓子	クリーム	ホイップクリームの格差 [編集]日本では牛乳が比較的高価なため、植物油を泡立て、クリームと似たような形状と色にした“ホイップ(クリーム)”という代替品ができている
菓子	クリーム	外皮カステラ部分生地の材料は小麦粉・卵・砂糖で、中に餡子が入ったものが原型ですが、最近はチーズ(クリーム)、チョコレート(クリーム)、抹茶等々が入ったものもあり、多くの方に愛されるお菓子を目指しているようです
