# 菓子: 「アイス　クリーム」の略。, 美容: おしろい下などに使う、クリームに似た化粧品。, 菓子: 牛乳から作る、薄黄色のどろどろした食品。, 菓子: くつずみ。, 菓子: クリーム色。薄黄色。
美容	クリーム	首すじや耳元などのリンバをこのクリームを使ってマッサージし、リンパの「めぐり」を若かった頃のように蘇らせ、フェイスラインの引き締め効果につながる
菓子	クリーム	トイカメラで撮った花とかね、ほっこりカフェのカフェオレカップ(クリームでリーフ模様)とかね、屋上からの眺めとかね、そういうの必須なんでしょうね
菓子	クリーム	だんだん回復してくるとやはりちょっとは甘いモノが食べたくなり・・・ 禁断症状が出た時はコレ☆ 黒ゴマクリーム 栗みつ 生キャラメルクリーム 生キャラメルクリームはケン兄から
美容	クリーム	クリーム状のものはべたっとするのであまりおすすめしてなかったそうですが、これはクリーム状より発色がきれいで、しかも軽い仕上がりなので、普通のファンデが合わない方などにおすすめしているとのことです
菓子	クリーム	クリーム煮カレー風味 シャンパンのグラニテ じゃがいもとエスカルゴのグラタン 生うにと人参のムースコンソメゼリーよせ 鶏スープ 乳のみ仔羊のロースト(3260
菓子	クリーム	有害物質のメラミンが混入した疑いがあるとして丸大食品が回収を始めた商品のうち、業務用の「クリームパンダ」が熊本県内の病院など92の施設に1万210袋が納められていた
菓子	クリーム	ちなみに昨日発表になりました、同率第三位の残り三つはクリームシチュー、サバの竜田揚げ、そしてお餅の入ったぜんざい、昆布付きということで、皆さんに贅沢を言って頂きありがとうございました
菓子	クリーム	小林シェフの自信作☆黄色いマロンクリームをたっぷり絞ったモンブランは、黄色いマロンクリームと言うだけではなく、その手間隙かけて作る製法にも所以があったのですね♪
菓子	クリーム	クリームを加えたソース、ソース・シャンティイ(Sauce Chantilly)や、鶏料理によく使われるソース・シュプレーム(spreme)と同じもので、鶏の煮汁を煮詰めてクリームを加えたソースです
菓子	クリーム	わたしたちが食べたのは大きい方)とチョコクリームも美味しかったし、スパゲティ(単体だと主食としてやや少ないのでパンとの合わせ技になってしまう)も、麺とミートソース分かれた状態で作られ、バットの中で混ぜて盛り付けるようになっていて、あんまりべたべたになっていない
美容	クリーム	【innisfree】イニスフリー モイスチャー ファーミング クリーム 50ml x1貴重な韓方薬を煎じ、一滴一滴絞り出すように心をこめて作り上げた、美白専用エッセンスです
菓子	クリーム	確か、真っ白なクリームが、間にイチゴを見えかくれさせつつ、ケーキ全体をたらーっと流れ落ちている挿絵があって、私と妹は、そこに参ってしまった記憶があるのですが
美容	クリーム	(約10日間分)】男の肌に必要不可欠な基本の洗顔とローションに、つやとはりを保つ高機能クリームをセットにした約10日間分のスキンケアキットです
その他	クリーム	「チョコレイト甘し」「シュウクリーム危し」「アイスクリン強し」「ゼリケーキ儚し」「ワッフルス熱し」 と、スイーツ絡みの題名がついた連作なのだが、スイーツな小説じゃなかった
美容	クリーム	「クイックビューティ薬用消臭AFクリーム」は、15種類の天然エキスと薬草が、臭いの原因となるバクテリアを分解し臭いを元からなくす、世界初の薬用消臭クリームです
菓子	クリーム	想い出の一皿を描きながら向ったブレスで、それを教えてくれたシェフのいらした店とは知らず入り、そのクリームソースの原点をホロ酔いで口にしていたなんて
菓子	クリーム	その結果パンは、スイートロールの上にケシの実や抹茶などをまぶした3種のミニパンをセットの「カラぷちパン」と、次点の区長賞にタッチー(イタチを描いた栄区いたち川のマスコット)をかたどったクリーム使用の「秋のタッチーパン」、弁当に「タッチーのごうか具だくさん弁当」の計3点が選ばれ商品化されることになった
菓子	クリーム	寒い冬の人気メニューであるクリームソースのパスタや煮込み料理の主菜に合わせて、少し重ための赤ワインをグラスで、というようなときにピッタリだと思いますので、ぜひお試しください
菓子	クリーム	1kgカラーシルバー&クリームベージュ素材・材質本体:スチールパイプ、スチール部品・成型部品:pp樹脂、abs樹脂、合成ゴムネジ:鉄(メッキ)仕様耐荷重:全体で12kgまで(フック1個あたり1kgまで)付属品フック4個製造国中国圧着取付けでキズがつきにくいパーテーションにもなる優れもの
菓子	クリーム	見た目には少量なのだけど、ナッツやドライフルーツがぎっしりで、そこにカスタードクリームを加えるとかなり濃厚な味となるので、普通のケーキ一切れを食べたのと同じくらいかも
美容	クリーム	パレットに含まれているブラシは、ミニ・クリーム・シャドー・ブラシと、ミニ・ウルトラ・ファイン・アイライナー・ブラシが両端についた、デュアル・エンド・ブラシ
その他	クリーム	キャラカードに「ヴァニラ・アイス」と「暗黒のヴァニラ・アイス」の2枚、スタンドカードに「クリーム」、さらにヒーローカードにも「ヴァニラ・アイス」と、一気に4枚が追加された
美容	クリーム	■ ビューナ フラーレヌーディ Wクリームご注文後3日~4日後の出荷となりますビューナ フラーレヌーディ Wクリームご注文後3日~4日後の出荷となります
菓子	クリーム	その漂えるクニをつくりかためるべく、イザナギとイザナミのカップルは、天の浮き橋に立って天のヌ矛を突きさし、クリームシチュー、もしくはフルーチェのごとくかきまぜる
菓子	クリーム	大阪新阪急ホテルのバイキングレストラン「オリンピア」―チョコクリームの表面にコーヒーリキッドで焼き色を付け、内側は木イチゴとカシスのムースで本物そっくりに(橋本 義一パティシエ)(N)
菓子	クリーム	昨日2時間くらいかけて作ってたバーニャカウダと牛乳(普通は生クリームらしい)のだったんだけど・・・うち、クリームパスタって苦手だったんだけど、これは食べれた
美容	クリーム	株式会社ウィズチサ(本社 東京都渋谷区、代表取締役 荒木智佐)では、今までにない新感覚の固形クリームファンデーション【ナチュラルカバーファンデーション】を6月15日から発売いたします
菓子	クリーム	セミドライいちぢくのロールケーキ セミドライのいちじくと赤ワインを混ぜ込んで焼いた生地は、 いちじくの種のプチプチした食感が楽しく、カスタードクリームと 生クリームのとろけるようなおいしさが引き立ちます
菓子	クリーム	椎迫でスウィーツ♪Carrot coffeeカプチーノにコーヒー色でクリームの泡に絵が・・・♪カプチーノ500円、ワッフル500円、ケーキ500円・・・パフェ500円(手前はチョコレート、奥はキャラメル)大分ICにい向かう途中、椎迫の鳥越橋交差点の左側に看板あり近代的なデザインの建物
菓子	クリーム	【特典】■ウェルカムドリンクサービス■女性には嬉しいお好み浴衣のサービス有り■部屋入れ茶菓子は、八幡平市で採れた山葡萄を使ったクリーム大福■朝食前のモーニングコーヒー 6:30〜8:00 無料(ロビーにて)☆ ゚・*:
美容	クリーム	エヴァトーンの使い方は簡単で、普通のクリームのようにクレンジング後、完全にお肌が乾いて、お肌のコンディションが整ったら顔全体から首筋胸元までエヴァトーンを伸ばせばいい
美容	クリーム	目の下のしわが消えるような治療方法などもありますが、自分でできる目の下のしわ対策としてはマッサージや化粧品やクリームなどを工夫してみるということが考えられます
菓子	クリーム	小さい頃、ママのともだちがはじめて手づくりケーキをプレゼントしてくれたのをきっかけに、私もケーキづくりの器具をいろいろ集めて、スポンジを焼いたり、カスタードクリームをつくったりしました
その他	クリーム	相変わらず、K君とはそれぞれ決められたアーティストのLPをダブらないで買おうと約束してましたので高校時代はクリームや、デレク&ドミノスや、その後のソロ関係やジェフ・ベック・グループヤウイッシュボーン・アッシュやバニラ・ファッジやハンブル・パイやエリック・クラプトンがらみでデイブ・メイソンに特に夢中になりました
菓子	クリーム	こちらの商品はバンホーテンココアをたっぷり使ったスポンジと、クーベルチュールチョコでつくった特性がナッシュクリームを2層に使用した贅沢なザッハトルテとチョココトルテがセットになっています
菓子	クリーム	シックな茶色に真っ白なクリームが添えられた姿は、ガトーショコラのようだけど、一口食べるとカステラならではの柔らかで、しっとりとした口どけの良さ
菓子	クリーム	たいていがクレーム・ムースリンヌを使わず、カスタードクリームと生クリームを合わせたクレーム・ディプロマットを使っていたり、バニラのババロアを使っていたり、ひどいときには単なるショートケーキのときだってある
菓子	クリーム	抹茶チョコと甘納豆、イチゴチョコとフラボワーズ、アーモンドシュガーで飾りつけ、生クリームとカスタードクリームをはさんでいるとても美味しいシュークリームです
美容	クリーム	水泳帽、タオル、バスタオル、水着、ゴーグル、ベビースイマー、水泳帽、耳詮、石鹸、メイク落とし、あかすり、ひげそり、薬用クリーム(医薬部外品)、ブラシetc
美容	クリーム	「お肌の汚れを翌ニす=洗顔」、もしくは「洗顔の後にマッサージをする」というイメージが強いと思いますが、いきなり洗顔から始めたのではなかなか古い角質は剥がれてくれませんし、無理に落とそうとするとお肌を傷つけてしまいますので、刺激が無く、油分を含まないマッサージクリーム(当社のマッサージクリームもこのタイプです)を使って汚れを表面に浮き立たせるようにしてマッサージをします
菓子	クリーム	簡単にいうとアイスクリームが融けた液状のクリームを飲んでみた経験がおありの方はご理解いただけると存じるが甘すぎてとてもじゃないが飲めたものではない
菓子	クリーム	店内では、プレーンマラサダにフレーバー(シュガー、シナモンシュガー、チョコレート、ココナッツ、ホワイトチョコ、きなこ)をまぶした6種類のマラサダ(1個150円)ほか、カスタードクリーム入りの「マラサダパフ」(200円)、ミニマラサダにキャラメルソースとバニラアイスを合わせた「マラサダカップ」(380円)を販売
菓子	クリーム	クリームあんみつの到着後いつもの如くデジカメやiPhoneでとりあえずバシバシ写真を撮り、満足したところでバクバクとクリームあんみつに食らいつく
菓子	クリーム	今回のイチオシは[アビット]で、スポンジロールの中にはバナナ風味満点のチョコレートクリーム、さらにドカッと容赦の無い生クリームがのしかかるという、なかなかの強敵
美容	クリーム	水溶性軟膏やクリーム剤としては、ユーパスタ軟膏、カデックス軟膏、ゲーベンクリーム、オルセノン軟膏、アクトシン軟膏、ブロメライン軟膏、リフラップシートなどがあり、フィブラストスプレーやアルギネート材なども併用できます
その他	クリーム	私も初めての革張りシート(純正だけど)でクリームを購入し、一生懸命塗り塗りしてたけど、例の磨き屋さん曰く、革シートは表面がコーティングしてあるので、クリームは不要とのこと
その他	クリーム	ウニがクリームみたいな感じに味わえて、ウニ嫌い・ほうれん草嫌いの人も、これなら両方食べられるんじゃないか・・・という絶妙なハーモニーでしたよぉ
その他	クリーム	60年代は、1963年のヤードバーズ加入を皮切りに、ブルース・ブレイカーズ〜クリーム〜ブラインド・フェイス〜デレク&ザ・ドミノスとバンド遍歴を重ねながら、ブルース・ギタリストとして自らのスタイルを追求
その他	クリーム	朝起きて洗面所にレッツゴー洗顔洗顔洗顔クリームをとってゴシゴシ・・・ヒヤァ〜・・・顔が・・・スースーするぅってこれってもしかして歯磨き粉やぁぁぁんスースーして目開けられないしぃ(笑)洗い流した後も顔面スースー冬だったのでなんとなく顔がしばらくミントのせいかなんなのかスースーして顔だけかなり寒かった
美容	クリーム	ビタミンAクリームは使用に際して若干の肌の赤みや表皮のはがれを引き起こしますが、弱い濃度のものから使用を始めて徐々に肌を慣らしていくことで、不快感や刺激を最小限に抑えることができます
菓子	クリーム	“南国の香り豊かなクリームサンド・太陽の光いっぱいバナナ風味” “「ミスケイト」ビスケットシリーズは、清潔な緑の楽園シンガポールで製造されたもので、国際食品展で金メダルを始め数々の賞を獲得し、世界各地の人々に愛好されております
その他	クリーム	DLM法(ヴォデール式リンパドレナージュ)15750円→12600円(60分)国内では2店舗でしか受けられない技術オイル、クリームなどは一切使用せず深層部のリンパに働きかけます ヨーロッパでは美容目的だけでなく、代替医療としておこなわれているメソッドです
菓子	クリーム	表面はココアパウダーのかかったチョコレート、中は下からチョコスポンジ、生チョコクリーム、プレーンスポンジ、生クリーム、チョコスポンジ、ガナッシュクリームの6層になっています
菓子	クリーム	表面(子実層面)は白色、クリーム色〜黄褐色で、多角形〜円形の小さな穴(管孔)が1mmの間に3〜5個見られるが、穴はしばしば崩れて歯牙状〜迷路状になる
その他	クリーム	しかし気になったのは、そうなると見慣れている白やら緑やらのクリームソーダ飲料というのは・・・もしかしたら、ものすごい量の合成着色料を使っていたりするのだろうか
その他	クリーム	そのお兄さんからよく聞かされたのは、クリーム、マウンテン、バックターナーオーバードレイブ、グランドファンクレイルロード、ELP、フリー、デープパープル、レッドツェッペリン、キングクリムゾン、などなど、
美容	クリーム	特に、クリームなどに配合されているビタミンC誘導体「VCIP」を配合した化粧品でケアすることで、バリア機能が強化はもちろん、乾燥肌、敏感肌にも効果を発揮します
菓子	クリーム	家々はほとんど水性白色塗料(石灰)で仕上げられるか、淡くやわらかな人目につかない黄色、クリーム色、青、ピンク等の静かな色(subdued colours)で塗られている
菓子	クリーム	桜色のモンブランはクリームの部分が桜の風味がしてウマウマでしたよ♪ 今の時期は桜をテーマにしたお菓子が多くて、見つけるとついつい心引かれてしまいます(^^;
菓子	クリーム	特製の美味しいチーズクリーム【お宝スイーツやまだ屋】【送料一律常温便】【送料別】チーズクリームもみじ 8個入り(お取り寄せ期間:約4営業日)※代引不可価格:640円特製の大変美味しいチーズクリームを中に入れ、洋風のお菓子としました
菓子	クリーム	1892年までは郵便局として使われ、長距離馬車の発着地点でもあったというクリーム色の建物で、1966年から現在のように博物館として生まれ変わった
美容	クリーム	しっかり紫外線対策をして下さいねお顔だけでなく首手にもクリームをしっかりのばしてお肌をガードしましょうリーフのショッピングサイトでは安全で効果的な紫外線対策のクリームが揃っています是非チェックして下さいねーリーフショッピングサイト しかし女性にとって要注意なのが紫外線です月の真夏よりこの時期特に月は年のうちで最も紫外線が強くなります紫外線は日焼けだけでなく
菓子	クリーム	パスタは、カルボナーラ、明太子、鮭のクリームソース、ツナとほうれん草のクリームソース、アサリ、和風キノコ、ペペロンチーノ、ピザは、アップル、シーフード
その他	クリーム	『クリーム 2002年 3月号通算116号』200円 野本春香・安西えりか・白鳥ゆか・葵かなみ・内山あみ・岩崎美緒・加藤友香 並~並下、濡れ、裏表紙紙が剥がれた跡あり、表紙少汚れ、ページくっつき跡あり
菓子	クリーム	剥いて暫らくはタマゴの黄身というより銘菓「萩の月」の中に入っている、カスタードクリームのような色(って言っても誰もわからないか・・・)をしておりましたが、最近なんだか全体に緑がかってきました
菓子	クリーム	春のバイキングメニューは、「三ヶ日牛サイコロステーキ」「ズワイガニ」「鰻蒲焼・鰻白焼」の定番メニューに、「春野菜豆乳蒸し」「豚肉と筍の甘酢餡かけ」「帆立と春きゃべつのクリーム煮」「鮎子フリッター」「蛍烏賊のマリネ」「筍の土佐煮」「竹の子御飯」などなどでバイキング台を彩ります
その他	クリーム	プロクター・アンド・ギャンブル・ジャパン株式会社からモラタメさん経由でいただいた ウエラトーン ツープラスワン シリーズ クリームタイプ A剤・B剤・混合用トレイ・輝きエッセンス・コームブラシ・ナイロン手袋が入っていました
美容	クリーム	単品の方は定形外/メール便なら送料無料※ 肌の感想が気になる場合には、オバジC、オバジK+、オバジパフェクトリフトAAの後に、 乳液・クリーム等をご使用ください
その他	クリーム	「クリームバス」とは、アジアのハーブやフルーツなどをブレンドしたクリームを用いて頭皮、肩、背中をしっかりほぐし、古い毛穴の汚れを完全に除去、神経の集中する頭部の血流をスムーズに整えることで、髪や肌の美しさを助ける、ヘアエステ&ヘッドマッサージです
菓子	クリーム	日本でもご存知の方が多いと思いますが、スコーンにジャムと作りたてのクリームでいただくクリームティーはここデヴォンが産地として知られていまして、
美容	クリーム	実際触ってみるとモッタリとしたかなり重たいテクスチャー」と評しているところを見ると、メーカーに関係なくどのBBクリームも伸びが悪いのかもしれません
菓子	クリーム	最近は、「キャラメルナッツパウンドケーキ」のキャラメルクリームを参考にして、生キャラメルを作ったんですよ♪正直、某有名生キャラメルより断然おいしかったです
美容	クリーム	某化粧品会社のシミ取りクリームや、化粧品セット等を買って使用してみましたが、何ら効果がなく年のせいだと半ばあきらめかけていたところ、知人からホホゴールドの事を聞き、ワラにもすがる思いで使用してみたところ、毎日見て分かるくらいに薄くなっていくではありませんか
美容	クリーム	しかし、酸化チタンなどは粉末状の細かい金属の粒子ですので、水と混ぜても混ざらず、油と一緒に混ぜることによりクリーム状の日焼け止めを作っているのが現状です
その他	クリーム	措置の7:少し力を入れて血管とリンパの集中する頚部をマッサージしてもしマッサージ・クリームが再度の補充が足りないならば、全体の手の平で下から上へ持って、首の中央はそっと力を入れて、両側は少し力度を少し加えます
菓子	クリーム	砂糖、でん粉、クリーム、食塩、全粉乳、バター、酵母エキス、野菜ブイヨンパウダー、玉ねぎエキス、チキンブイヨン、乳化剤、増粘剤(キサンタンガム)、香料、香辛料
菓子	クリーム	小さなセルクルの一つ一つにジェノワーズやクリーム、ムースを重ねてきっちりと組み立てるものが主流と思っていた当時の自分に、「焼いて詰めただけ」のこのお菓子は拍子抜けするほどシンプルに映りました
その他	クリーム	【0004】しかしながら、通常のクリームを使用すると物理的には軽くなるがクリームの油分が餡の風味を損ない且つ油っぽい食感となり、フイリング本来の風味を損なってしまう
菓子	クリーム	欧米の伝 統的な料理というのは、香辛料や調味料、その上にクリームやソース、油等をたっぷり使った大変手 の込んだものが多く、この点で中華料理も類似してます
その他	クリーム	純粋なヘヴィメタルキッズとしては、ツェッペリンやヘンドリクスやクリームやドアーズに傾倒したりはしても、ビートルズはただのビートルズだと思ってやり過ごしてきたね(笑)
その他	クリーム	問題は「ブンビーのクリームを指摘したのに後で擁護した」とか「メルポの手紙についていたクリームを『セレブ堂のケーキのだ』と指摘した」など、のぞみの言動がぶれまくっていることですね
美容	クリーム	「ナチュラル プロゲステロン スキンクリーム」は、高品質なUSP(米国薬局方)グレードのワイルドヤム由来の天然プロゲステロンを1プッシュあたり20mg含みます
菓子	クリーム	ショートケーキのように見えるイチゴの乗ったシュースは、キリッシュのシロップがたっぷり、バガテルのバタークリームのおいしさと酒の強さのショック、サバランにはこれでもかと、ラム酒のシロップが染み込ませてあり、どれも生まれて初めての経験でした
菓子	クリーム	A6:個人差はありますが、大体の目安として、クリーム120gはたっぷり使用感で約2~3ヶ月、コンセントレート美容液30mlは顔中心に、毎日約ワンスポイトで、約2ヶ月です
菓子	クリーム	ドルチェ:ババレーゼ アル ヴィンサント(クッキー生地の上にクリームのムース、ヴィンサントの味付けでかなりデリケートな物、久々に感動したドルチェ)&ヴィンサント93+エスプレッソ
その他	クリーム	2005年1月の発売以来大好評の、ボディへの極上スイーツ「ココア トリート ボディ コレクション」に、待望のボディ クレンザーとクリーム バス(入浴剤)が数量限定で登場します
菓子	クリーム	中のチョコレートクリームが余ったときは、他の耐熱型に流し込み、170°Cで30分ほど焼いていただくと、ガトーショコラとして召し上がっていただけます
