# 菓子: 「アイス　クリーム」の略。, 美容: おしろい下などに使う、クリームに似た化粧品。, 菓子: 牛乳から作る、薄黄色のどろどろした食品。, 菓子: くつずみ。, 菓子: クリーム色。薄黄色。
菓子	クリーム	甘くないクリームのつまったシュークリームやイチゴのタルト、おいしい紅茶、レディーボーデンのバニラアイスのような濃厚なクロテッドクリーム、奥の席にいた優雅なマダームたち、食べきれずにテイクアウトを頼んだら、噂どおり不器用に包まれたホイル
菓子	クリーム	南阿蘇・高森産イワナのマリネとアスパラガスのサラダ/キャベツのクリームスープ/南阿蘇・高森産ヤマメの海老のムース詰め/阿蘇あか牛のブロシェット/マンゴーのムース
菓子	クリーム	その上から、さらにチョコクリーム(なぜか赤とか緑とか色が付いてる・・・)を塗って屋根に色を付けたり、砂糖菓子のツリーやリースをくっ付けたり、粉砂糖を雪のように散らしたり
菓子	クリーム	↓↓私の鶏の香味焼き、ブラウンシュガーブレッド、レフアママさんお持たせのピーナツバターとチョコレートクリーム、カノママさんからの素敵なアレンジメント
美容	クリーム	今は皮膚科で薦められた、セラミドたっぷりのローション&クリーム+ナノケアで、だいぶ生き返ってきたものの、バリア機能の低下で、目に見えて水分が蒸発してる感じです
その他	クリーム	半信半疑でしたが、マッサージが終わりクリームをふき取って鏡で顔を見ると、本当に目元がパッチリして顔の輪郭が引き締まってる実感が湧きましたわ・・・
その他	クリーム	抗生剤配合の外用薬として、リンデロンVGクリームなどをとびひにこれまで使っていましたが、これよりもアクロマイシン軟膏の方が効くということを、同僚の三上先生から聞き、試してみたら確かにそうでした
菓子	クリーム	ほうれんそうは、アカザ科の植物(しょくぶつ)で葉は繊維(せんい)も少なく舌触(したざわ)りも良いため、おひたし、バター炒(いた)め、クリーム煮(に)など和風・洋風・中華(わふう・ようふう・ちゅうか)のいずれの食材(しょくざい)としても用(もち)いられています
菓子	クリーム	中にはフルーツがたくさん詰まっていて、クリームもさっぱりしているので、5号サイズ(直径15cm)もあるにもかかわらず朝から二人で完食してしまいました
菓子	クリーム	モンブラン味のクッキー(マロンクリームがサンドしてあって、クッキーがチョコ味のもの) チーズケーキみたなクッキー(カントリーマアムみたいにしっとりしたもの)
その他	クリーム	乾燥対策市場は、一般用医薬品だけでなく医薬部外品の尿素10%のハンドクリーム発売を皮切りに、1999年の新指定医薬部外品ののど清涼剤、2004年の新範囲医薬部外品の口腔咽頭薬、あかぎれ用剤等のカテゴリーが登場して、市場全体を支えた
その他	クリーム	グリコのお菓子が¥750分入っている(ポッキーチョコレート、プリッツサラダ、キティランドチョコレートビスケット、クリームコロン、コメッコホタテ味、ワンタッチカレーレトルトチキン中辛など)
菓子	クリーム	どの製品も冷やすとチルドデザートのような味わいになり、冷凍対応の菓子3種については凍らせても硬くならないタイプのクリームを使用したことで食感の変化を楽しめる
菓子	クリーム	地上の暑さから逃れ、ちょっと一休みに地下鉄長堀鶴見緑地線 長堀橋駅のすぐ横、地下街クリスタ長堀へ行きました~そして美味しそうな甘味処を発見~(*^_^*)甘党 まえだ さん見本がめちゃうまそうだし店頭で売ってるダンゴもたまりませ~ん嫁さんが頼んだ、宇治金時クリーム 600円かき氷好きの嫁さんが氷がふわっとして、抹茶の苦さ加減もちょうど良いと絶賛
菓子	クリーム	続きを読む: フレッシュ生クリームとまざあぐうす特製カスタードクリームのハーモニー【クール冷凍便】【お取り寄せスイーツ】京都まざあぐうす プレーンロールケーキ
菓子	クリーム	由紀夫の、充血知らず、エネルギー常にフル充填のくっきりまなこが、泣きながらラセーヌの星を飛び出していったエースが置いていったクリームソーダをつついていたマスターを見た
菓子	クリーム	同社は「サクッと塩焼き、引き立つおいしさ」と銘打ち、伯方の塩を使用した焼き菓子の中にクリーム(チョコ、バニラ)が入った「ショコリ」も売り出しており、「塩系」に力を入れているようだ
菓子	クリーム	また、小豆とクリームの優しい食感がやみつきになる「DORA(ドラ)」は、伝統を踏まえた上で、新しいチャレンジを続ける若き五代目のこだわりがつまった商品です
菓子	クリーム	で、パスタメニューに関しては明太子クリームパスタ、あさりときのこの和風パスタ、鉄板焼きナポリタン、ポロネーズ(ミートソース)、チーズのクリームパスタ、アアトリチャーナ、カルボナーラと7種類から選択可能です
菓子	クリーム	で、あとの3種の方は、ケーキをイメージしたような取り合わせになっていて、表面にぱりっとしたチョコ、中には柔らかめなクリームと小豆ソースやブルーベリージャムがくみ合わさっていて、これひとつでケーキを食べたような満足感がありますよ
菓子	クリーム	昭和60年に可児市内に警察署が新築され名称も御嵩警察署から可児警察署に変更となり、 警察署は可児市中心部を南北に走る主要地方道可児・金山線沿いで可児市役所の北部に位置し、 外観はクリーム色の鉄筋3階建てで、JR可児駅又は名鉄新可児駅から徒歩で約15分、車で5分ほどの場所です
菓子	クリーム	うぃーす(^ω^)題名なんなんって話だよね(^皿^)あれはねーディズニーランドのジャングルクルーズで覚えさせられたやつだよぅなことは置いといて今日ねーめちゃ美味しいクリームパンくった糞上手いからね(^ω^)なんか秘密の県民SHOWに出たらしいね(藁うち思ったんだけどさー明後日成績くんぢゃんヤバイかも予想は国語3社会3理科2数学3英語3体育4技家3美術3音楽3かな理科授業態度死んでっから篠Tは
菓子	クリーム	ふんわりとしたスポンジケーキで、苺のつぶつぶカスタード、プレーンのカスタードの2つのクリームを包んだ、ほのかに甘酸っぱくクリーミーな苺のケーキです
その他	クリーム	子供の靴だけを集め山のように積み上げた部屋(下の左の写真)、女性の靴だけを集めて山のように積み上げた部屋(下の中の写真)、男性の靴だけを集めた部屋、 櫛を集めた部屋、歯ブラシを集めた部屋、クリームなど化粧品だけを集めた部屋(下の右の写真)などがあり、いずれもその量の多さに驚きます
菓子	クリーム	綿100% クリーム地に花とさくらんぼ柄 ボリュームのあるスカートは3段に裾のレース、中にペチコートが縫いつけてある 袖口、前にリボン 襟や袖にもレース
菓子	クリーム	本学では、開学時より学内実習(給食経営管理実習I)で活用しており、野菜炒め、あんかけ焼きそば、魚の煮付け、鶏肉のクリーム煮、紅茶プリンなど多くの料理をスチームコンベクションオーブンで作っています
美容	クリーム	とくに、BBクリームは、ユンソナさん使用の「HANSKIN(ハンスキン)」のもの・オネエMANSでメイクのカリスマIKKOさんが紹介した、「エチュードハウス」のものを中心に販売しております
菓子	クリーム	この日、7000円のディネの内容は、アミューズ+イシガニと赤座海老のコンソメスープ(伊万里葱風味)+佐世保産チヌのキャベツ包み(香草風味)+仔牛のフリカッセとフレッシュフォアグレのポワレ(カレー風味)+サラダ+デセール(米粉で作ったクルートにマスカルポーネのクリームと長崎とよのか苺を添えて)というものでした
その他	クリーム	最近特に白髪がめだってきました私の場合はこめかみの上あたりが酷いのです今回ちょうどモラタメさんでウエラトーン ツープラスワン シリーズクリームタイプをいただきましたそれで試してみましたクリームタイ
その他	クリーム	クリームは本の通りですと5ミリ短くないので、縫い合わせの部分でクリームの部分も5ミリ重なって少しボリュームが出てしまう感じなのですが、クリームは5ミリ短くないんでしょうか
菓子	クリーム	毛色はゴールド、レッド、クリームなどのほか、目の上に丸く、まゆ毛のように違う色が入るブラック&タン、まだら模様となるダップル、2色の毛が混じって縞模様が出るブリンドル、白のベースカラーに色が入るパイボールドなどバリエーションが豊富です
美容	クリーム	素肌メイクとしてベースクリームの後に直接乗せたり、ファンデーションの後の抑えとしてのご使用もできます」は素肌メイクができると共に、皮脂吸収ができる商品として開発しましたので、:てからへん」が一般的です
菓子	クリーム	【うーじばたけ】最近発売された新顔です☆多良間島の黒砂糖を使用したスイーツ☆今人気のキャラメルタイプにしていますが、食べた感じは、クリームに近い感じです
菓子	クリーム	ここのクレープは薄い生地の間にクリームを挟んで、それを丸めた1口じゃ食えないけど、頑張れば2口で食えるよクレープに仕上がっています(伝わるかな 笑)
菓子	クリーム	(4)できたクリームから仕上げ用に一部を取り(100g程度が目安)、 残りのクリームにイチゴとビスケットを加えて軽く混ぜ合わせ、 チョコレートムースを作る
菓子	クリーム	グレーズは軽くて何個もいけそうな勢いがあいますが、やはり甘いクリームやジャムのフィリングやチョコがコーティングされていては、さすがの私もギブアップです
その他	クリーム	ジョサイア一世の時代のウェッジウッド社は、優れた陶器やストーンチャイナ専門のメーカーとして経営され、パール・ウエア、ドラブ・ウエア、クリーム・ウエアなど、ユニークで採算性のよい新素材の特許を取得し、またジャスパー・ウエアのように装飾的で高級な素材も開発して、会社は順調に発展した
菓子	クリーム	でもってこのロブスタージェリーとカリフラワークリームがとてもよくマッチしていて、一緒にいただいた白ワインと最高に合っていたのですが、、あまりに濃い味なので、量はこの半分以下で良かった
その他	クリーム	通りを隔てた直ぐ近くのスーパーマーケットで食品を中心に仕入れて、次はアウトドア用品店でレインギア、料理用ストーブ他、飛行機キャビン内に持ち込み禁止の液状薬品(サン・スクリーン、虫除けクリーム等)や刃物類などキャンプ道具の買い足しを済ますと時間は既に昼頃になってしまいました
その他	クリーム	レイディの好きな香りは、クロワッサン、ココナッツプディング、アップルシナモン、ハーゲンダッツのクッキー&クリーム、マスタードチキン、フレンチフライ
菓子	クリーム	クリームコロッケ、グラタンライス、ステーキどんぶりなどのレギュラーメニューと特製アイスクリームや パフェなど新鮮な牛乳を使ったデザートも充実している(これは宣伝)
菓子	クリーム	ホタテのテリーヌ サラダ添え/野菜のクリームスープ/鯛のソテー トマトバジルソース/ヒレ肉の網焼き 赤ワインビネガーソース/季節のサラダ/デザート/コーヒー
美容	クリーム	「アクアティークエムディー(AQUATIQUE MD)」は、これ1本で化粧水・乳液・美容液・クリーム・化粧下地の5役の働きがあるオールインワン化粧品
菓子	クリーム	大どらやきと抹茶クリーム大福、写真のスィートポテトとポテコロ、アイス(を大皿に乗せデザートプレート) 極めつけが、まさかのトルティーヤにバナナチョコアーモンドでクレープもどき
美容	クリーム	ただ、素肌の健康を真面目にかんがえていくと、保湿力の高い美容液やクリームなどをいろいろ塗って一時的に潤わせるという、化粧品に頼ったスキンケアを続けていると、何年かすれば、素肌の再生工場の労働意欲はすっかり低下してしまいます
その他	クリーム	でもべたべたするクリーム類は苦手で、素肌が気持ちいいと思える納得のいく製品、そしてしみや美白にも効果があって手頃なお値段でホームページが楽しくて(季刊誌があったらもっと好き)・・・なんて理想を追い求めていました
菓子	クリーム	詳細:のびがよく、軽いつけ心地で、毎日のスキンケアに欠かせない、ノーマル/ドライスキンの方に特におすすめの、若々しさを保つフェースクリームです
その他	クリーム	メンズクリームは米国の「メンズ・へルスマガジン」誌上で、“ヘルス製品・オブ・ジ・イヤー”という年間最優秀賞を獲得した男性用マスターベーションクリーム
菓子	クリーム	皆の想像はどんどんふくらみ、お山の中はケーキのスポンジでその上にチョコがかかっていて、白砂で雪のクリームをかけトンネルはストロベリー味にして、山の周りにプリンをたくさん並べて隣の湖はオレンジジュース
菓子	クリーム	トラバ練習です 喫茶店のココア クリームがふわふわのっているココア あの甘さとこくが疲れをとってくれます あとは梅昆布茶 渋くお漬物といっしょにいただきます
菓子	クリーム	まんじゅうは一般的なようですが、あんぱんは山陰だけの風習のようですね(最近ではクリームパン、ジャムパン、チョコパン、メロンパンなど種類が豊富です)
菓子	クリーム	ベースとなるスポンジケーキ(市販のものを購入)に、電動泡立て器で素早く作った生クリームを、左官職人よろしく塗って、間に果物(この日に購入した苺とバナナ)をはさんで、さらにスポンジに生クリームを塗り、残ったクリームをチューブでひねり出してデコレーション
その他	クリーム	また、「しもやけおててがもうかゆい」とある2番の歌詞に着目した化粧品会社が、子供用クリームの宣伝にこの作品を使いたいと、巽のもとに依頼がきたこともある[2]
その他	クリーム	ストッツィキーノは有機野菜のチップス→ムール貝のマリネと季節野菜→沼津産 赤海老とアーティチョークのオレキエッテ→フレッシュポルチーニ茸を詰めたニョッキ イタリア産仔うさぎのラグー トリュフ を添えて→小鳩のロースト→なすとチョコレートの小さなドルチェ→カスタニャッチョと柿のクリーム入りネッチ、柿のジェラート
菓子	クリーム	さすが母体は老舗和菓子屋らしくしっかりとした大粒の小豆を使用したきんつばですが、甘さはかなり抑えられており、それを包んでいる少量の生クリーム(このクリームの量が絶妙)の甘さときんつばの小豆が絡んで口の中ですごくいい感じになります
美容	クリーム	BBクリームと言えば、それさえぬっときゃ終了と思っておったんですが、日焼け止めと、それ以外の機能が入っているという場合、日焼け止めとしての成分は100%ではないので、日焼け止めは日焼け止めで塗れとおっさる
美容	クリーム	開発当時、基礎化粧品の保湿といえば、クリームなどオイル(y油分原料)が当たり前の時代に、油分が肌にとってダメージとなり、肌の上で酸化した油分が、紫外線などの影響で結果的にシミ、くすみの原因となる
菓子	クリーム	白味噌は、大豆を蒸さずに煮て作るために褐変の原因となる糖などの水溶性成分がお湯に溶け出すこと、ほかの味噌に比べて米の使用量が多く、その米も十分精米してあること、などから、ごらんのようなクリーム色に仕上がるのです
美容	クリーム	●話題のクリーム美容液「SPONE」のサンプルプレゼント♪植物由来のアミノ酸系洗浄成分(ラウロイルグルタミン酸Na)は、低刺激でお肌の弱い方にも安心♪キメ細やかでやわらかい泡が、心地よくお肌を包んでくれます
その他	クリーム	アロマ スクール・ラヴァーレのアロマ コーディネーター講座では、精油を使って、化粧水やフェイスパック、 クリームなどの化粧品作りを実習で学んでいただくことができます
美容	クリーム	特に混合肌で、均等にスペシャルクリーム「S」のクリームを塗っていた最初の2〜3日のうちにおでこにニキビのできてしまった私には、この使い分けだと、デイリークリーム「D」で顔全体を
菓子	クリーム	中でも、キャラメルシフォンは中にキャラメルクリームがたっぷり入っていて、独特の苦さがやみつきになりそうでした(*^∀^*)ようやくシフォンケーキを作れるようになったので、真似してみようと思っているところです♪♪♪
その他	クリーム	今風の、と言っても、これ'73年作品ですし、作ったのはもっと前でしょうから、ここでいうモダンタイムス・ロックンロールとは、60年代末から70年くらいにかけてブレイクした音楽、ジミヘンやクリーム、レッド・ツェッペリン、そしてグラムロック――そんな感じでしょうか
菓子	クリーム	抹茶クリーム大福といえば、四国中央市(旧新宮村)の「霧の森大福」が有名なんですが、それに近い感じで、もっと甘みが強いかな(霧の森の方はお茶の味が濃いめ)
菓子	クリーム	明治32年8月、森永商店がクリームチョコレートの製造販売を開始し、次いで大竹商店や後藤商店等も加工販売したが、当時売れ行きはいずれも僅少であった
その他	クリーム	あとミネラルウォーター1本、化粧水・リップクリーム、あと自分目が悪いのでその昔視力矯正用のアイマスク(裸眼でも映画なら見られるし、寝る時は暗くてグー)ノートのPCにCDも
菓子	クリーム	カレー類(ビーフ、チキン、ポ−ク)、シチュー(クリーム、コーン、トマト)、ハヤシ、スープ(コーン、ポタージュ、チキン、野菜)、パスタソース(ミートソース、クリームソース、ペペロンチーノ)、料理用ソース(ドミグラスソース、ホワイトソース、中華あわせ調味料)かまめしの素、八宝菜、マーボー豆腐、丼類の素、おでん
その他	クリーム	このあいだなんて部活の帰りに、普段なら絶対いかない大戸やにいって(家の米がきれてて、米の禁断症状がでてた笑)、そのあとマツキヨでクリーム玄米ブランを3袋も買い、すべて間食し、しかも帰ってからアイスとチョコたべるとか、頭のおかしいことをしてしまいまして・・・・
その他	クリーム	しかしクリーム時代までの彼は「ブルース好っきゃねん」の一念で押し通したのみで、ギタリストとしての評価は得たものの、音楽を構成する要素としてはそれはひとつのパーツに過ぎず、自らの来し方を顧みた時にその表現としての薄さ、深みの無さに愕然としたのだ
その他	クリーム	かといって、クリームべったりのものでは仕事が出来ませんし(紙を使うので)ベタベタ甘えっ子ばかり居る我が家では、舐める手におかしなものも使えませ んでした
その他	クリーム	商品説明肌の衰えの原因となる顔のミクロ単位収縮を最低限に抑え、衰えるまえにストップさせます容量50ml◇ ナイトクリーム◇ カテゴリデイ・商品名クレームリスアンタンス◇ ブランド名カリタ◇ ◇ :【あす楽対応_九州】:【送料無料】カリタクレームリスアンタンス50ML
菓子	クリーム	前評判で調べた時にもおいしいと絶賛されてたりしたので、クリームパン好きのT君にお土産で買うことは決まってたんですが、焼きたてだったので、思わず自分でも食べちゃうことに
菓子	クリーム	デザートのチョコわらび餅はわらび餅にチョコレートの苦味が加味された感じでよかったし、クリーム水晶、すぐり、いちごなど全体的においしいデザートといえます
その他	クリーム	キラキラのラインストーンや、ケーキのホイップにそっくりなシリコンクリーム、クッキーやチョコレートのパーツを使って、小物をデコレーションするスイーツ デコのお店Dolce Decoは、2008年1月にネットショップを開店して以来、デコ系の雑誌や、「あっぱれさんま新教授」などTV番組でも紹介されている人気スイーツデコショップです
美容	クリーム	パウダーでありながら、クリームのようにしっとりと肌に広がる独自のテクスチャーなので、さっとひと塗りするだけでパールのように上品な光オーラを実現します
菓子	クリーム	黄身の濃い平飼い赤玉卵を使用したスポンジに、地元で採れるイチゴと北海道産純生クリームで作ったイチゴのクリームをたっぷりロールした、お店で一番人気のロールケーキ
菓子	クリーム	御前崎産伊勢海老のカルパッチョから始まり、駿河湾で捕れたカワハギとフレッシュポルチーニのフリット、トリュフとフォアグラの自家製フェットチーネカルボナーラ、ポルチーニのクリームソースの自家製ほうれん草のニョッキ、カシス風味の猪の煮込みアーモンド入りマッシュポテト添え、最後にデザートという料理を白のスパークリングワイン、赤のスパークリングワインで頂いた
菓子	クリーム	株式会社おたべの求肥ときなこクリームをサンドしたランチパックきなこもち(京都銘菓おたべ)食べてみるとパンの間に おたべときなこクリームが均一にまんべんなく敷き詰められる
その他	クリーム	雑貨屋を模した店頭では、ライオン、サンスター歯磨き、ウテナ化粧水、レートクリーム、花王フェザーシャンプー、牛乳シャンプー、ライオンシッカロール、マダムジュジュ、ハブラシセット、シボレーセットローション、八重椿ポマードなどが300から500円で買える
その他	クリーム	実は、これを買ったのは、友達がロクシタンで買い物をするということだったのでついていって、「そういや母の日だったなー」と思って、お母さんにハンドクリームとソープをプレゼントしようと思って、買ったわけです
菓子	クリーム	写真上、一番左はクリーム・カラーにブラックのトリミングとボタン、バックルがコントラストを成しているマノーロ・ブラーニックのスリングバック・ブーティー
その他	クリーム	ただ試供品がなく、元々肌の弱い私には合うか合わないかの判断においては、必須のもでしたので少し悩みましたが、まずはクリームソープ(洗顔石鹸)を購入しました
