# スポーツ: 競走路・競泳路など、競技での定められた通路。インコース, 学校: （学科）課程。速成コース, 食事: 西洋料理で、一定の順序で出される一組の料理。ディナーのコース
その他	コース	福袋弐万円洗えるブランド着物(お好みコースでブランドは変わります)+半巾帯+福袋何が入っているかは、あけてからのお楽しみ♪◆今年1年の感謝の気持ちを込めて、皆様に福袋に”福”を
学校	コース	同コース中に武漢FAマーケティングエグゼクティブのシー・カイレイ氏と青島市の同職、ジン・ジャン氏がスポーツマーケティング、マネジメント、コマーシャルストラクチャー、コマーシャル戦略、TV放映権、そのほかのメディアの権利、ライセンスとマーチャンダイズ、チケッティング、スポンサーシップ、ブランディング、サクセス評価など、多岐にわたる関連項目のフィロソフィーを学んでいく予定
その他	コース	その後もコース上の状況を私や園田さんが指示しなくとも相賀君や高橋君、鈴木さんまでもが聞いてくれ、安心してオフィシャルを任せられることがとっても嬉しかったです
その他	コース	又、朝市サイクリングで走るコースは、朝市サイクリングに参加される皆さんがよく練習でも走ってるコースでもありますので、朝夕だと誰かに会う可能性が高いです
学校	コース	飛鳥日本語学校では、9月から全日制の日本語コースを立ち上げ、本格的な日本語教育を目指すということで、カリキュラム等の支援が今回の私の役目であった
学校	コース	本コースは、厚生労働大臣の指定を受けた養成施設において、介護に関する学科及び実技の訓練を 行い、介護の専門職である「介護福祉士」の資格取得(国家資格)を目指す2年間のコースです
スポーツ	コース	どこのパークゴルフ場も間もなくシーズン終わりとあって ここでも前日 このコースのチャンピョン大会が行われたとのこと、ピンの位置が難しく設定したそのままの状態でしたので OBゾーンに何度も入り泣かされた人も多かったようです
学校	コース	全ての学年課題試験の合格を経て、最終学年(3ヵ年は第8学年、1ヵ年は第3学年、2ヵ年は児童・体操教程)の課題まで合格した者のみに日本校の各コースの卒業を認めます
スポーツ	コース	●抵抗トレーニング:泳者の背中側にロープをつけ、もう一方のロープの先端を補助者に持ってもらうか、コースロープのフックに掛け、反対方向に泳ぎます
その他	コース	名古屋はミニッツに冷たい街というより、近郊にコースがある(小牧とか)し、もしかしたらコースを持っていてサークル的な活動している人達も多いんじゃない
学校	コース	アナウンス学院お笑いコース第1期生だったはなわは「当時は学校に通っても全く意味なかったなあ」と笑わせながらも、「芸人はつらい職業だけど、お笑いメンバーも増えてきたので、もっともっと我々で盛り上げていこう」と意気込んでいた
学校	コース	日本におけるコース(4月2~8日)は平成12年度労組指導者招聘事業の一環として、(財)国際労働財団が実施し、M・ベランジェーILO国際研修センター労働者活動局上級プログラム担当官随行のもと、日本カニゼン東京工場、東京労働安全センター、情報労連、連合、中央労働災害防止協会を視察、講義受講
その他	コース	立川→伊東市富戸(ぼら納屋で昼食)~ハイキングコース~砲台跡~門脇岬灯台とつり橋~半四郎落し→蓮着寺~石食いモチの木~やぶつばき群落~奥の院~お経岩~俎板岩→大室山→立川
スポーツ	コース	コースで打った時、出だしの弾道は中々勢いがよく、高さも悪くないのですが、途中から、前に伸びるよりも、上昇していく感じで、球が落ちてからは、ランがほとんどなく、ひどい時は、ランが1ヤードって時もあります
スポーツ	コース	水森亜土のキャラクターを前面に押し出し、レディースゴルファーが練習場・ゴルフコースに気軽に持って行ける今までにないカテゴリーを狙ったかわいくて、おしゃれなゴルフバッグです
スポーツ	コース	多くの人々でにぎわうボストンマラソンだが、他のマラソン(ボストンマラソンはコースに起伏があり、なかなかいい記録がでない場合が多い)がほとんど同時期に開催されることや、ボストンマラソンが大衆化しすぎているという理由のために日本陸連はトップランナーを派遣しない傾向にあり、日本選手の優勝者は1987年の瀬古利彦が最後
学校	コース	国際化時代を迎えて、JABEE認定教育プログラム(学部、学科、コース、など)の修了者を諸外国においても国際的レベルの技術者として認めてもらおうというわけです
食事	コース	バイキングも良かったのですが、しゃぶしゃぶコースと言っても並んでしゃぶしゃぶした肉をもらって食べるので自分でしゃぶしゃぶするんではなかったです
スポーツ	コース	「アウトバーンで、セルシオでベンツをブっちぎった」「テストコースでレガシーの試乗車でドリフトかましたら同乗の外人がビビって騒ぎ出したw」とか自慢してるウザいおっさんだったな
その他	コース	【平日1/3貸切】飲み放題付ソフトドリンクコース 2000円 女性に嬉しいスイーツ充実コースソフトドリンクコース 2300円+690円でアルコール飲放もOK
食事	コース	大枚をはたいてコース料理なら食事時間は長く取れますが、カロリーは必然と高まるでしょうし、偽装の無い自然派食品を求めていると財布は長続きしません
その他	コース	お弁当コースは550―600キロカロリーで塩分は控えめにしてあり、地産地消にこだわった食材と定期的な品質検査により安全・安心な食を提供していく
その他	コース	特集は「春マラソン攻略〜大会ガイド付き〜」ということで、全国主要市民マラソン コース攻略ガイドの紹介と、東京マラソン他4月までの主なフル・マラソン5大会のコース紹介
その他	コース	コース:(朝)近鉄大和八木駅~(バス)~昆虫館~万葉の森~香久山山頂(弁当)、(昼)藤原宮跡~耳成山~近鉄百貨店でティーブレイク~近鉄大和八木駅、翌日泊まって、橿原神宮鎮守の杜のコンサートを聞いてもよい
その他	コース	現在までに提供しているドキスポはプロ野球コース・Jリーグコース、地元千葉を応援するというコンセプトのもと、マリンスタジアムでは千葉ロッテマリーンズ、フクダ電子アリーナではジェフユナイテッド市原・千葉の応援を実施しました
学校	コース	英語力の向上により、併設の旅行観光、IT、ビジネスなどの専門コースにそのまま進学することもできますので、英語プラス資格を身につけてキャリアアップを目指している人に最適です
学校	コース	放送大学の設立を具体化するにつきましてはなお検討すべき問題として放送大学の設立主体、放送の実施形態、放送大学に設置すべきコースの数及びその内容、入学者数の推定、並びにこれに伴う必要経費の算定等が残されており、目下これらの問題について検討を進めております
その他	コース	3人用」「低温」コースにおいて、 運転音をさらに抑えて洗います●高温除菌※モード:洗浄時に約80°Cの水温を約3分間保つことにより 、まな板や包丁などを除菌※できます 低温コースと庫内洗浄コースを除く各コースに付加して運転できます●※財団法人日本食品分析センター 第303080032
その他	コース	お受験コースが一番いい人生だとは思わないし、必要とも思わないし、私達の頃は団塊ジュニアで受験も就職もいつも倍率が高かったけれども、普通の大学に入れたし、今は少子化だからそんなムキにならなくてもそこそこのところには行けるんじゃないの
学校	コース	クリエイティブエンジニアリングコースは、少人数教育を行い電気・電子工学の基礎から応用までの学力を着実に身につけられるコースであり、幅広い知識を持つ創造性豊かなエンジニアになることを目指します
その他	コース	散歩コースとしてはたまにしか来ないし、この階段は二カ月に一度ぐらいしか昇らないのですが、ななは体で覚えていて(工事用のフェンスに囲まれ目の前にその階段は跡形もないのに)階段があったその場所をぴたりと当てていたのでした
食事	コース	☆★今月もお得な企画が満載⇒クーポン・コースをチェック★☆■厳選されたお肉&お野菜のしゃぶしゃぶが美味しく味わえると評判の【しゃぶしゃぶ 温野菜】☆☆★ゆったり寛げる雰囲気の店内は、テーブル席・掘りごたつなどそれぞれ趣が異なる空間が楽しめます
その他	コース	【熊野いや市いちの主おもなウオーキングコース】((1)、(2)は有馬ありま地区ちく地域ちいきまちづくり協議きょうぎ会かい選定せんてい、(3)は市いち選定せんてい、消費しょうひカロリーは同どう協議きょうぎ会かい、市いち調べしらべ)
学校	コース	東京海洋大学では「食品流通の安全管理システム専門技術者養成コース」を設け、生産段階から消費段階にわたる食品流通における安全確保の問題に対応できる専門的技術者の養成に取り組んできた
学校	コース	たいていの学校は、日常生活に必要な英語を学ぶ「一般英語コース」のほか、英語検定試験の対策を学ぶ「検定準備コース」、ビジネスに必要な英語を学ぶ「ビジネス英語コース」など、コース内容も多彩に揃えている
その他	コース	コース 新松田⇒寄→登山口→栗の木洞→後沢乗越→鍋割山(12:35着予定)昼食は鍋割山荘または山頂にて→小丸→金冷やし→堀山見晴茶屋→大倉⇒渋沢(4:38発に乗車予定)
食事	コース	5月10日に開催される、ホワイトハウス記者協会による夕食会では、コースメニューのうち、デザートは無しとなり、その分が慈善団体へ寄付されるようです
その他	コース	ショップジャパン/デコメ×デコメ/KNT 近畿日本ツーリスト/OZの恋愛占い/きせかえマイメロディ/Rオンライン★萌ゴルフ学園3D マジカルゴルフ こるぽ/愛しの懐メロうた(315円コース)/売切ファンタジーSLG
その他	コース	時代が違うとはいえ、我々が子供の頃はセットしてくれるコーチもいなく、コースも貸してもらえず、自分達で金テコを使いチャンピオンコースでやっていたものです
スポーツ	コース	各参加者は、Aコース、Bコースに分かれて十八ホールの得点を競い、男性の部の昨年度優勝者の松崎 稔さんはHC2を背い、上位入賞にいたりませんでした
学校	コース	★幼児を育てるコースは幼い子供達の無限の可能性を引き出し、しっかりと根の張った大きな木に育って欲しいと願い、リトミックとベビーサインを展開しております
その他	コース	心配していた弟孫君 夜中に電話連絡も無くホッとしました ごんちゃんは蒸し暑い中を元気に幼稚園コースでした・・・玄関先のヒャクニチソウのカマキリ君は少し大きくなったようです
スポーツ	コース	ハーフコース部門男子部では李ボンジュ氏(現代マラソン同好会)が1時間11分10秒で優勝しており、女子部ではハ・ユスク氏(釜山マラソン連合会)が1時間25分22秒で1位を占めた
スポーツ	コース	その中、なんとか結果を出そうとするプレッシャーからか、予選2回目、ミハエル・シューマッハがコースを外れるというまさかの失敗により、14番グリッドからのスタートとなってしまい、今回も重い雰囲気が漂うフェラーリ陣営
学校	コース	この専科初級コースは、雪上技術やアイスクライミング技術、ラッセルから幕営技術などの総合技術を学び、最終的に自分たち(生徒同士)の力でアルパインルートの登攀を実践します
学校	コース	ハワイアンロミロミで日頃のお仕事、家事の疲れ、ストレスを癒し明日への活力を又資格取得希望者にはハワイ校、神戸校にて資格取得コースもご用意しております
学校	コース	※基礎コース及び精神科介護士コースのレポート用紙につきましては、毎号テキストの最終ぺージにあります指定のレポート用紙を切り離してご使用ください
学校	コース	マタニティスイミング教室、ベビーママスイミング教室とご紹介してきましたが、本日は水泳の競技力の向上に役立つ、「マスターズ競技力向上コース(第1期)」をご紹介いたします
その他	コース	コース設立後しばらくは、富山県内の祭礼を実習調査の対象として次々と調査報告を公刊したので、大学内外から「お祭り研究室」という異名で呼ばれることになりましたが、この伝統も脈々と受け継がれ、最近の実習調査でも祭りを調査対象としてとりあげることが多く、また、富山県外の祭りを対象として書かれた卒業論文も少なくありません
食事	コース	我々に食べきれないコースなどない、と半ばたかをくくっていたのだけれど、本当に、これでもかといわんばかりに、台の上がいっぱいになるほど料理が運ばれてくる
食事	コース	ここでも、昼食カニコースのお客さんが大勢で食事をしていたが、このときを逃すとお風呂が混雑することは分かっているので、早速、碧翠御苑の男女別風呂へ突き進むことに
学校	コース	TRAITコース(旧有名人コース)や体育コースなど、全日通学が困難な有名人(一部の私立高校では校則で生徒の活動は禁止されている)やスポーツ選手などに対応したカリキュラムを設置しており、日出高校やクラーク記念国際高校、明大中野(定時制=現在は廃止)などの学校と並んで多くの有名人が在籍し、また輩出することで知られる
スポーツ	コース	『金沢の四高(現金沢大学)漕艇部は、大正から昭和にかけて琵琶湖瀬田川コースで開催される全国高校(旧制)大会(当時インターハイと呼称)において優勝回数を誇る強豪であった
その他	コース	16日は熊野川町赤木川清流沿い、 17日は熊野市、 南牟婁郡の山岳、 18日は下北山スポーツ公園を周回するコースでプロや実業団選手など約200人が参加して開催される
学校	コース	現時点で、履修漏れが判明している県内の高校は、聖望学園(世界史と日本史を2、3年次に分けたうえ3年次を数学に振り替え)▽東京成徳大深谷(特進コース生徒44人が日本史か世界史を未履修)▽川越東(世界史を理数系の授業に振り替え)▽本庄第一(現代社会を日本史に振り替え)——の4校
食事	コース	うちのサイトでも、上海のホテルやレストランがいろいろなコースメニューを企画して、早くから予約がいっぱいになったという話題が書かれていましたが、このアンケートではロマンチックなディナーを予定している人は約20%、一般的なレストランで食事と答えた人が47
その他	コース	コースは、長居陸上競技場~大阪城公園~天満橋~北浜~大阪市役所~(御堂筋)~新橋折り返し~淀屋橋(土佐堀通り)~天満橋~大阪城公園~ 長居陸上競技場の42
その他	コース	二週間もすると毎日歩くいつものおさんぽコースは覚えきり、納得いったらしく、いくつかのポイントを除けばちゃんとふつうに歩けるようになってきました
学校	コース	前期再編校やコース制実施校で、1人の教員が自分の専門科以外の科目も含む5・6科目を担当し、授業準備と会議に追われ生徒と過ごす時間がない実態がある
その他	コース	朝里・長峰を中心に21コース、最長滑走距離4kmのスキー場は9基のリフト・ゴンドラを備えており、初心者から上級者まで誰でもアフタースキーが楽しめます
その他	コース	帰りは市が原までいったん戻り、六甲山全縦のコースを通って途中から再度公園、牛の背、鈴蘭台駅に戻ってきましたが、神鉄ハイカーはどこに消えてしまったのか、私一人で歩いていました
学校	コース	東医コースも賛否両論あり、6年間東大や医学部に邁進できるというメリットがある一方、中1からの大学への過剰なプレッシャー、クラスが6年間同じメンバーという閉鎖性などが問題となっている
その他	コース	どのコースを選んでも時間内ならご料金は同じ(リコネクティブヒーリング・リコネクション以外) 豊富なメニューの中からあったものをお選びいただけます
その他	コース	大原町にあるビゴさんのサンドウィッチと業平寿司のお巻き(巻き寿司)をお弁当に持って山芦屋町からヨドコウ迎賓館、芦屋川駅、阪神のアンリシャルパンティエ、打出の図書館迄、約二時間のコースです
食事	コース	写真はコース料理のメインディッシュ、特製車海老のマンゴーマヨネーズソース ベビーリーフ添えと 和牛フィレスライスと七種野菜の炒めブラックビーンズ醤油風味
スポーツ	コース	三井住友VISA太平洋マスターズの太平洋クラブ御殿場コースや、日本シリーズJTカップの東京よみうりカントリーなどはぼくも知っているが、1ラウンドして食事をすると、平日で約3万円、週末だと4万円かかる
学校	コース	だれがやっているかというと、看護教員でございますが、これも一つの学校に、三年のコースでございますと四人いればいいというふうになっているわけでございまして、実際にはもうほかの学校は四人ではとてもできないものですからどんどん多くなっているんですが、国立だけは相変わらず四人
食事	コース	皆はコース(サラダ、ボルシチ、自家製パン、海老巻きカニクリームコロッケ、キャベツロール)でしたが、私はもう4回は同じコースを食べているので、アラカルトにしました
スポーツ	コース	また今大会よりハイスピードコースからテクニカルコースに変更もあり、更に初の予選も開催され、予選アタックでは各チーム代表ドライバーが真剣にアタックしポールポジション競いを行った結果ポールポジションは「No 2 エンタメいちばん」が獲得しました
その他	コース	行者山は「中田富士」とも呼ばれ、山頂からは柳井市や田布施町の市街地が眼下に広がり、瀬戸内海国立公園の島々も一望できるため、ハイキングコースとしても格好の山とされています
その他	コース	Cコースは、「自家製パン」、「本日のシェフ特製前菜盛り合わせ」、「本日のパスタ(5種類の中から選択、一部追加代金要)」、「本日の肉・魚料理(5種類の中から選択、一部追加代金要)」、「本日のデザート(3種類の中から選択)」、「ドリンク」
学校	コース	また大学やTAFE、専門学校進学希望者対象の進学者(EAP)コースの授業の内容は評判が高く進学の為の集中英語力補強や大学さながらの模擬授業を受講出来る点で進学希望者には最適な、また短期在学よりは長期在学で真剣に勉強する環境が整っている学校だろう
スポーツ	コース	ついでに近くにあるゴーカートの乗れる遊園地についても、夏休みにも関わらず人はそんなにいなかったので、「ゴーカートでコース20周にチャレンジ」とか、「アーチェリーで隣の隣の的を狙う」とかやって怒られた記憶がある
学校	コース	香川県特産のさぬきうどん店の開業を支援しようと、県立丸亀高等技術学校(丸亀市)は、職業訓練コース「さぬきうどん科」の受講生を24日から12月7日まで追加募集する
食事	コース	レストランは「メインダイニング(朝食と夕食のバイキング)」「エピキュリアンルーム(夕食のみのコースとアラカルト)」「プールサイドレストラン(昼食は軽食、夕食はバーベキュー料理)」の3つで、朝食は宿泊についているが、他は別料金
その他	コース	私は、何度かグアムに行ったことあるんですが、いつもタモンのホテルロードあたりか、Kマート、マイクロネシアモール、アウトレットという、観光お決まりコースしか、行ったことがありません
スポーツ	コース	ゴルフ場(本コース)は、ゴルフ練習場(打ちっぱなし)と違い、ライが平たんでなく、「左足下がり(上がり)」「つま先下がり(上がり)」等さまざまなケースに対処する必要があります
その他	コース	三陸沿岸随一の高峰五葉山の赤坂コース沿いに標高1000m付近の畳石まではツツジ、標高1200m付近から頂上にかけてはシャクナゲの群落がみられる
食事	コース	コースでも単品でもオーダーできるようで、今回は腹具合から単品でチョイス♪「甘エビのソースだけパスタ」や「バイ貝のバターソテー」などなど魚介料理中心に食べましたが、どれも美味です写真は最後に頼んだ、「焼きおにぎりの鯛茶漬け」締めの一品に最高でした
その他	コース	沼尻コースは、以前、尾根を歩く胎内コースと、お鉢を歩くコースとあったのだけれど、数年前の亜硫酸ガスの事故以来、お鉢は立ち入り禁止になったという
その他	コース	この大会は町ぐるみでサポートがされ、コースの途中のエイドステーションには地元の中学生が飲み物やバナナをくばり、会場では農産物や参加賞の「たこ 飯や いころ鍋」を地元の人たちがつくり配っていました
スポーツ	コース	グループで既設のゴルフ場を8コース保有し、建設中ゴルフ場1コースの建設を支援している(株)アーバンコーポレイションは8月13日、東京地裁に民事再生法の適用を申請した
食事	コース	ホテルのコース料理から、家庭ではマネ出来ない手の込んだメニュー、一流シェフが作る親しみ深い家庭料理、パン・ワイン・デザートまで全部で約200種類も多彩に取り揃え、1品からでも購入できるため、特別な日はもちろん日々の食事にも気軽に利用できる
スポーツ	コース	信和ゴルフグループの中核企業で、「信楽カントリー倶楽部田代コース」や「同杉山コース」(滋賀県甲賀市)、「瑞陵ゴルフ倶楽部」(岐阜県瑞浪市)をはじめ、計7ヵ所のゴルフ場の委託運営を行っていた
その他	コース	多摩川沿いに全長約50キロにわたってサイクリングが楽しめるコースとして「たまリバー50キロ」の名称で遊歩道・サイクリングロードが整備されています
スポーツ	コース	ラップタイムにレーサー名とコース名を記録することができ、ダウンロードキットを使用してWindows PCにラップタイムデータをダウンロードすることもできます
スポーツ	コース	ゴルフコース、テニスコート、ホテル、レストランなど充実したリゾート施設の東急別荘地・管理事務所近くの分譲地内一等地・バス停徒歩4分・まっ平な東南角地
