# スポーツ: 競走路・競泳路など、競技での定められた通路。インコース, 学校: （学科）課程。速成コース, 食事: 西洋料理で、一定の順序で出される一組の料理。ディナーのコース
食事	コース	今週はおさんぽがてら、近所でおしょくじしましたまずは、時々お食事する Restaurant La lionne コースも気になったのですが、今回はワンプレートランチ自家製デリカの盛り合わせ
その他	コース	八方尾根の近くまで来て、歩くスキーなんかする奴はいないだろうと思っていたが、さすが有名なコースだけあって、僕らのグループの他にも何組か滑っていた
食事	コース	お食事の締めくくりにはディナーコースのデザートとしてご用意している日向夏のトリコローレや桃のコンポートなどアガペ特製のドルチェをお楽しみ下さい
学校	コース	その結果開講されたコースを選択したのは二十人足らずの生徒であったが、受験勉強の弊害など全く見当たらぬ井草であれほど真剣に全員が勉強したクラスは異例であった
その他	コース	もちろん、人それぞれ好みの違いはあるとは思うのですが、どちらのコースの方がより人気で、たくさんの人がそのコースを選ぶという、オーソドックスな方を、もしお分かりになる方がいらしたら、どうか教えて下さい
学校	コース	本コースでは上記の審査機関の審査の観点を理解し、ISO14001のシステム規格とISO19011の監査の規格を、講義(理解する)、演習(考える)、ロールプレイ(実践する)の3本立てで解説していきます
学校	コース	日本コースは、世界各地に設置されている日本文部省認定の在外教育施設「日本人学校」の一校として、日本文部省の学習指導要領に準拠し、日本と同等の教育を推進している
学校	コース	特定看護師は、自ら診療ができる資格として米国などで普及し、日本でも一部大学院に養成コースがある「ナースプラクティショナー(診療看護師)」とは異なる
スポーツ	コース	こうした中、平成13年5月から同GCのコース設計者でもある川田太三氏が代表を務めるゴルフ場運営会社(当時はグリーンソリューション(株)、その後(株)ゴルフプラン)に、成田GCの運営を委託して、営業を継続してきた
学校	コース	また、昼間コースで必修となっている卒業研究は、教員の個別指導のもとに、はじめて自分で一つのテーマに取り組んで研究を行うもので、4年間の学習の総仕上げとして極めて重要な意義を持っている
学校	コース	日本語学科の開設が決まったため、日本語コースは2003年度の1年生を最後に学生の募集をやめ、その学生が卒業する2007年に閉鎖されることになっている
食事	コース	お料理はコースのみで15皿が前菜、その後に6種類ぐらいのお料理とデザートが運ばれ、高価な食事であるだけに、食材が素晴らしい上に丁寧な料理は驚くばかりであった
スポーツ	コース	高原コースならではの打ち上げ・打ち下ろしのホールを組み込み、適度な戦略性を持たせたレイアウトは、コースデビューの初心者からベテランゴルフアーまで幅広くゴルフの醍醐味を味わっていただけます
学校	コース	今回このコースの参加者は3つのクラスに分かれていますが、あるクラスでは、あまりにも天気がイイので、レッスンの最後の方で、学校の目の前に広がる大きな公園(ANZAC PARK)に、先生が皆を連れ出してくれました
学校	コース	本年1月に策定した「大阪の教育力」向上プランにおいて、支援学校における職業コースの計画的な設置をお示したところであり、今後とも、職業教育の充実に努めてまいりたいと存じます
その他	コース	ちゃんこ鍋/広島グルメ/宴会コース/カラオケ付き宴会/鍋/飲み放題/合コン/歓迎会/送別会/忘年会/新年会/広島市/中区/宴会場/八丁堀/雷電/本格鍋/個室/大部屋/相撲
学校	コース	ボーカリスト養成コースを持つ専門学校や音楽大学の声楽科、芸能プロダクションやレコード会社が経営するミュージックスクールなどでトレーニングを積む方法もあります
学校	コース	それに伴い、人文社会学類現代教養コースを設置し、夜間主コースの1年次の授業は福島駅近くのサテライトキャンパス(まちなかブランチ)での開講となる(一部授業は金谷川キャンパスで行う)
食事	コース	コース料理の用意が整っているから前菜が出るように、神の愛の計画が整っているのだから、ギブアップしないで天国のデザート(いやもっと最高のものだが)まで、シッカリ楽しみつつ生き抜いて行こう
食事	コース	に味わえるという事で、それはそれで満足であったが・・(笑) コース内容は、 ・ベルーガと吉良町・加藤農園のフルーツトマト「きわめ」の冷製カッペリーニ ・氷見産サクラマスとフランス産アスパラガス ういきょう風味のラヴィコットソース 師崎産石鰈と沖縄産スーナ(麒麟草)とか
学校	コース	基礎コース修了者を対象に、アニマル・シンキングの“7ステップ”の応用・実践方法や、ブレインストーミングの手法等を習得し、アニマル・シンキングを利用したグループディスカッションをリードできるようになることを目指します
スポーツ	コース	鈴鹿のコースを熟知し上りに強い馬場選手がホームストレートを担当し、フラットなコースと下りは馬場選手が担当するという分担で、勝利をおさめたフィトンチッドRT
学校	コース	Aコースのカヌーでは、初心者ながらインストラクターの指導によって自由自在にカヌーが操れるようになり「とっても良かった」という声が聞かれ、Bコースの水上バイク・バナナボート・セーリングでは、普段ではなかなかできない体験をし”海の楽しさ””マリンスポーツの面白さ”を満喫していました
学校	コース	2006年のプロジェクト成果および実施コースの状況に関しては、マラダナ技術短大校長から報告があり、技術教育訓練局局長からは他の援助機関の活動進捗状況等を踏まえつつ、2007年に向けて、当プロジェクトに期待する成果に関し提案がありました
スポーツ	コース	米セントピーターズバーグタイムス紙などによると現地時間2月25日、フロリダ州のゴルフ場で、 人生初めてゴルフコースでプレーした62歳の女性が、スタートの10番ショートホール(100ヤード、 パー3)でホールインワンの快挙を成し遂げた
食事	コース	鮑付きコースにして事前に料理方法を指定したのに、出てきたのは、ご飯も味噌汁も頂いたあとで、今作ってますと言われた時にお腹いっぱいなので断っても、塩振ってあるから大丈夫ですと、半ば押し売りの様でした
スポーツ	コース	4種目目の新種目8m幅の大回りですが、コースコンディションはザクザクの雪質でたくさんの選手が滑った後だったので端に雪が溜まっていたので、スキーを取られないようにしっかりとコントロールして重心をうまくスキーに乗せていこうという意識でスタートしたところ、まんまと溝にはまってしまってスキーが抜けてバランスを崩してしまいました
スポーツ	コース	3コースに約1000人 あさぎり町球磨川マラソン大会 (9月1日掲載) あさぎり町「球磨川マラソン大会」が先月30日、須恵文化ホール前広場をスタート・ゴールとする3キロ、5キロ、10キロの3コースで開かれ、約1千人の選手が球
スポーツ	コース	コース内はオールフラットでアップダウンはほとんどなく、平成期オープンのコースではこれだけの好条件を満たしたロケーションは稀有と言える都市近郊型の理想的なゴルフクラブです
学校	コース	· 中央アジア諸国は、カザフスタン、キルギス及びウズベキスタンに所在の日本人材開発センターが、日本の経験に基づく戦略的企業経営、生産・品質管理、企業人材育成、産業政策等に係るビジネスコースを実施し、中央アジアの行政官及び企業人の育成に貢献してきたことを高く評価した
学校	コース	全日本監督引退を決めた氏は、引く手あまたな中、本学が臨床教育学部 教育学科に「スポーツ教育コース」を新設、また学園として ‘新しく変わろう’とする姿勢に大きく共感し、ともに新たな(更なる)出発をすることになりました
学校	コース	投稿者:きよし (2010年2月13日 20:57投稿) この評判・クチコミを支持する人数:29人中20人 教室長は色白で、ヒョロっとしていて、一見たよりなさげでしたが、学習プランはうちの子の性格を理解してくれていて、比較的厳しい環境のコースを進めて頂きました
その他	コース	それで今朝はいつのコースからちょっと足を伸ばして、栄盛川まで足を伸ばし、旧星陵中学校の通学路を通って、白山から199号線に出て、歩道橋を通って久岐の浜団地の中を通りいつものコースに出て、若松体育館裏の公園で折り返し戻ってきました
学校	コース	FIFA/AFCトップコーチインストラクターのコッ・カミン氏(香港)が、中国におけるコーチインストラクターの増加を目的とした9月15日から26日までの同コースのインストラクターを務めている
スポーツ	コース	18:40 花火会場に到着する、コースの最上流地点のマーカーブイの内側にアンカーを打ち、そのまま後退し50mのロープいっぱいに引っ張りマークの外側に出た
食事	コース	女のほうが 「子供の送り迎えに車がほしいが、生活保護もらってるから資格を打ち切られるから買えない」とグチっていた 話の内容から在日同士 食ってたのは一人前7000円はくだらないステーキコース こっちは転職活動中のアルバイトの身、 なんでこんな奴に日本人の血税で生活保護やらにゃあいかんのだ
食事	コース	ディナーコースもあり、パスタを中心としたコースが4800円、パスタとロブスターのグリルのコースが6300円、パスタとロブスターのグリルに加えて牛リブロースのグリルも付いたコースが8400円
食事	コース	そちらは本日、こちらのコースをご注文して頂いたお客様にのみご提供させて頂いておりますものでございまして、調理の際に英国の『オレノ』というメーカーが1977年に製造して一大ブームを巻き起こしました非常に変則的な形をした包丁を使用しております
学校	コース	育成コースでは個人の演技を作って次の発表会で披露するんだったんだけど、受験と重なったり始めての個人の演技だったのでうまく作られないで先生に怒られてばっかりだった
学校	コース	4週間以上の英語コースに12週間フライトアテンダントコースがセットになっており、ス チュワーデスに必須の英語教育とフライトアテンダント(スチュワーデス、スチュワード)として働くための実際的な知識を学べます
スポーツ	コース	そのスキー場へ行くことを考えれば、ネットであげたりするのが、当然と思うが、サイトのないスキー場もあるし、突然コースを閉鎖しないときもあるので、リフト券売場での掲示でしかたないと思う
スポーツ	コース	蓼科高原別荘地は、八ヶ岳連峰最北端、蓼科山の南西山麓に広がり、本格的ゴルフコースを始め、テニスコート、温泉浴場、蓼科湖畔のレジャー施設など様々なスポーツ・レジャーを楽しむことができる、国内有数の高原リゾート別荘地です
スポーツ	コース	ただいずれもこのコースとしては距離が短いホールなので(ブルーティーから16番は328ヤード、17番は155ヤード、18番は530ヤード)特に難しいというわけではない
学校	コース	1909年、スイス連邦工科大学のコースプログラムを実際の大学は、その初期の、非常にschoolish議題からは、再編されたスイス連邦工科大学賞を受賞の博士号を受ける権利を付与されました
その他	コース	コース上の28か所のエイドステーションにはパワーバーやメロン・スイカ・オレンジなどの果物、コーラ・水・Gu2Oなどの飲み物、ときにはアイスクリームもある
食事	コース	でまぁコースメニューなので、サラダ、パコラ(カレー風味の天ぷら)3品、タンドリーチキン2個、カレー(今回はチキン入りほうれん草カレー)、チーズナン、シュリカンド、チャイの順に次々出てきたわけだが、堪能した
食事	コース	結局、どれも斬新な美味しさを堪能させていただきました~ フュージョン、と言ってしまうと大味な感じに聞こえてしまうかも知れませんが、非常に繊細な食材やソースの折り合いが、フレンチ調^^ こんな感じで始まったコースですが、
学校	コース	まず、できるだけ該当(がいとう)の高校(こうこう)を退学(たいがく)いたしましても、他(ほか)の高校(こうこう)あるいは通信(つうしん)制(せい)などのコースの方(かた)に転学(てんがく)ができないかということについて、まず教員(きょういん)の方(ほう)ではアドバイスを一般(いっぱん)的(てき)には行(い)っております
学校	コース	上空基本練習 ・・・月/8、000円(上空練習コースから 自分の機材を揃えるか レンタル機を使用し“ソロフライト”の練習になります、約1〜2 年程度の練習で“MPGパイロット証”を取得し卒業となります)
学校	コース	今年度より指導を実践(年長主体)と育成(年中少主体)の2つのコースに分け、実践は幼児にしては長いと思われるかもしれませんが2時間(120分)の集中練習で行い、反復の中で技術を取得してもらい、育成は75分の指導でボールに慣れ、楽しみながら基礎を覚えることを主体にしています
学校	コース	司書教諭や学校司書が用意したそれぞれのコースの本の中から3冊ずつ選ばせ、その後15分じっくり読ませ、一番おもしろかった本を選び、感想をカードに書かせました
学校	コース	ものにするコース (特進(学習塾連携)コース・大学連携コース・専門学校連携コース) ★ものづくりを応援するコース (匠・職人コース・企業連携コース) ■6月29日京都府京田辺市学校説明会 ↑申し込みの方はクリックしてください
その他	コース	ナントどの日に行っても、軽井沢の3日間コースでお1人様25000円ご夕食は人気の和洋中のバイキングで食べ放題浅間山から湧き出る源泉の湯でリフレッシュ
その他	コース	まぁ、それでも1つのステージに7つのコース×8ステージ+αですんで、結構多いとは思いますし、エンディング後もスタピー(=スタフィーの妹)ステージや、ボスオンパレード(=戦ってきた各ステージのボスと連続で戦いクリアタイムを競う)なんていうのが追加され、このクリアタイムが9分以内なら、更に10番目のステージが出現ということで、ぼちぼちやり込み要素もあります
学校	コース	また本校上級コースの先生方が一度ずつ、それぞれの得意分野についてレクチャーする特別講義も組み込まれていますから、将来の進路を決める上でも必須のコースです
スポーツ	コース	ちなみにコースは、200mトラックを一周したあと、学校の隣の県立公園のサイクリングロード(1km)を回って再び学校に戻ってトラック一周の1500m
学校	コース	本日の知財授業をさせていただいたクラスは、大学連携コース(関西学院大学への進学を目指すコース)ということで、後で聞くと、1年生からクラス替えなしで3年間同じ仲間だそうです
その他	コース	大学でうちの学科は2コースに分かれるのですが、去年僕の所属してない方のコース(電気電子系)が凄く忙しそうなのを横目に笑っていたら見事にツケが来ました
その他	コース	病院を徒歩で出発し東谷山を登ってフルーツパークに入る「健脚コース」、同じく病院を徒歩で出発しフルーツパーク北門から園内に入る「一般コース」、そして車で移動して園内を歩く「園内散策コース」です
スポーツ	コース	小生がテヘランに赴任した90年代初めの頃は、イラ・イラ戦争の終結直後でコースの手入れもままならず、ビギナーの悲しさ、ラフからラフへの旅のためクラブは傷だらけ、ボールはなくし放題、スコアは天文学的と何一つ良い所のないゴルフでしたが、それでもエルブールズの真っ白な山に向かって思いっきりショットをしたときの、あの爽快さはテヘランならではの素晴らしい気分であったことを覚えています
学校	コース	コースはパチンコパーラーのオペレーション部門の「シニアビジネスマネジメントコース」「ビジネスマネジメントコースA」「同B」、遊技機開発コースの「商品企画・開発昼コース」「同夜コース」、それに液晶演出に関するプログラムを学ぶ「CGデザインコース」の全6コースで、同日は半年間の修了課程を無事終えた第一期生の修了生一人ひとりに吉田学校長から修了証書が手渡された
スポーツ	コース	厚狭ゴルフ倶楽部のゴルフコースは、ゆったりと自然を抱擁し、ゆとりのレイアウトを呈しながらそこにはビギナーからシングルプレイヤーまで、あらゆる挑戦者を満足させる戦略性に満ちています
学校	コース	JOBAの通信添削コースでは、添削指導をもとに書き直された答案の提出を何度でも受け付けるなど、これらの問題を克服し帰国枠入試で出される課題に対応する力を身につけるための学習プログラムをご用意しております
その他	コース	トクする料金コースの選び方から一歩進んだ検索サービスの使い方、ネットオークションや、ヒット曲のダウンロード、掲示板やICQ、圧縮と解凍など、便利で楽しいインターネットの活用法が満載
学校	コース	学部は特色ある7コースからなり、理系のコースには時代のキーワードである環境・生命・ナノテクノロジーに応えられる斬新な教育内容を含めた「環境生命コース」と「基盤科学コース」を新設しました
その他	コース	5日間の主任審査員のコース中のある日の昼食後、私たちはコインを投げて、だれが graveyard session(悪夢のセッション) をやるという不運を引き当てるか試したものです
スポーツ	コース	3回目のスノボーは北志賀竜王スキーパークへ行ってきましたコースは19コース、リフトは14本あります★竜王は私が初めてスノーボードをやった場所なので想い出があるところです竜王にはロープウェーに乗ってス
その他	コース	設定コースは最後の登りがキツイ清水ヶ丘公園、そして今日は新コース開拓ということで、15人ぐらいが更に足を延ばし野毛山公園の方まで試走してきました
その他	コース	【コース】 鏡山公園→下見峠→下見八幡宮→石井家住宅→下見小学校跡→明顕寺→広島大学(総合博物館→ぶどう池周辺→生態実験園→山中池)→鏡山公園まで・・・・・約8キロ歩きます
スポーツ	コース	7月2日、日本ゴルフ振興の法律管財人である木内道祥弁護士は、今年2月にGSとの間で締結されていたスポンサー契約を合意解約し、新たにLSとモルガンスタンレー証券を共同スポンサーに、そして実際のコース運営はLSグループのパシフイックゴルフマネジメントに決めたことを発表した
その他	コース	このコースにおいて生徒は、英文テキストの読解方法、ノートのとり方、英作文など、IETLS受験・大学進学時に必要とされるスキルの習得を目指します
その他	コース	授業内容は学校やコースの種類によっていろいろだが、一般英語コースの初級レベルでは、基本文法をしっかり押さえるとともに、テープやビデオなどを使ってさまざまな英語表現を学んでいく
食事	コース	での食事し慣れているんだなー 自分が20歳の頃はコースのフロマージュの出され方食べ方なんて無縁だったわww まあ、社会人の彼女と違って貧乏学生だったからだけど・・
その他	コース	さて今回のコースである群馬サイクルスポーツセンターですが、峠みたいにアップダウンありウネリありでフルで使用すると6kmととても走りがいのあるコースです
その他	コース	正月早々、野崎観音から四条畷神社までの飯盛山ハイキングコースを歩いて来ましたが途中の山中で、ガサゴソという音に振り返ると、迷彩服の青年が2人ほど立っていました
スポーツ	コース	オリンピックでマラソン競技が実施された当初、大会ごとの競技距離は一定ではなく(同じコースを全選手が走ることが重要とされていたため)、約40kmで行われていた
スポーツ	コース	各チームの監督・コーチも、「釣り針をコースに捨てていく者もおり、転覆した学生がケガする恐れがある」(鈴木崇司・一橋大学端艇部総監督)として、今年度から見回りなどの監視強化に乗り出した
学校	コース	Bコースは「なぜジェネリック医薬品の導入が大変なのか・経営改善するにはどうしたらよいのか」と題して、国立病院機構釜石病院長土肥守先生より自院での取り組みをとてもパワフルにご講義いただいた
食事	コース	尚、白子筍コースは天候にも左右されるデリケートかつ希少な食材を使ったコースのため、一週間ぐらい前までには予約されておくことを推奨します(価格は時価)
その他	コース	この日のSS597kmは山岳地帯、パンパスなどバラエティに富んだコースが設定され、パジェロ、シュレッサー・バギーともそれぞれが得意とする路面が随所に見られた
食事	コース	(いただいたもの) ランチコース(ワインは別料金です): アミューズ: ・ポテトチップスのようなシャンパンスナック ・姫サザエ、バイ貝などの一口冷製スープ
その他	コース	混雑の山頂から離れて南側の丸沼高原コースを回って火口原を一周するとコマクサが咲いていた~11:40避難小屋、小屋手前で鹿を見た~11:57【五色沼】、沼の畔でのんびりと白根山を仰ぎながら昼食12:28~水場プレート方向に行く、10分ほどで冷たい美味しい水場に着く、この先尾根までの急登です
学校	コース	神大の海外研修はコースごとに希望者を募り、生徒たちが中学時代から積み上げた成績や生活態度、行事や部活動への取り組みなどを総合的に評価して参加者を選抜します
学校	コース	第21回セミナでは、教育コースとして(株)ITプレナーズジャパン・アジアパシフィック柳沼克志氏よりいち早くITIL® V3の認定教育の応用コースである「サービス提供と合意(SOA)」(仮称)の中よりサービスポートフォリオ管理やサービスレベル管理といったプロセスに焦点をあてて解説いただきました
