# スポーツ: 競走路・競泳路など、競技での定められた通路。インコース, 学校: （学科）課程。速成コース, 食事: 西洋料理で、一定の順序で出される一組の料理。ディナーのコース
その他	コース	3000円のコースではキムチ、枝豆、肉の3種盛り合わせ、カキとホタテのバター焼き、野菜バター焼き、好みのもんじゃ2点、お好み焼き1点、牛または豚の焼きそば、アイスまたはシャーベットと大食の男性でも十分満足なボリューム
学校	コース	個に応じた指導を徹底させていくために、習熟度別のコース選択の際には学級便りや「TAMARIかわらばん」等の各種通信を活用し、児童のコース選択の支援をしたり、保護者からの意見を吸い上げながら学習指導を行ったりした
スポーツ	コース	シルバーストーンは1/12中京地区予選が開催されるコースで常連さんにはチーム川田の福岡選手や石川選手、昨年CRCワークスのヤッキーさんもいます
食事	コース	日本庭園が望める和食の老舗「なだ万」での懐石料理または、地上144mの摩天楼レストランで本格イタリアンとグリル料理の「ベルヴュー」でのコース料理のいずれか
スポーツ	コース	同署の調べでは、車を横滑りさせるドリフト走行を披露するイベント「1JZドリフトミーティング」が開かれており、参加者や観客がコース外側の空き地で食材や道具を持ち寄って食事をしていた
学校	コース	現在、アメリカのコロンビア大学、デューク大学、カナダのヨーク大学のロースクールと協定を結び、法科大学院開設後の交流が約束されていますが、将来的にはアメリカのみならずヨーロッパやアジアの大学の法曹養成コースとも提携関係を強めていく計画です
食事	コース	豊後水道から日向灘にかけた海域で獲れた、新鮮ピチピチプリップリの伊勢えびのコース料理では、伊勢えびの刺身、濃厚な味噌汁はもちろん、地元でとれた豊富で新鮮な海の幸が堪能できます
スポーツ	コース	さて、今回はTamTam名古屋店ドリフトコース開設記念として行われます、「ドリフト初心者講習会」と「ウィークアップセール」について告知させていただきます
学校	コース	株式会社フォーワンファースト コミュニケーションスキルを高めるエンジニア育成を目的とした 実践型教育コース「オープンソースアカデミー」6月よりスタート エンジニアリングの現場では『ビジネスマナーの欠落』として「つまらないミ スの連発」「できると言ったのに出来ない
食事	コース	このコースには、新鮮な水菜をレモン果汁とミキシングした「水菜のレモネード」、自家製ベシャメルソースとラーメンのスープで炊いたお米の「リゾットのコロッケ」など森住氏が野菜を楽しんでもらおうとアイディアあふれる独自のメニューで構成されていて、「かわり野菜のサラダ」には、コリンキー、水ナス、紅芯大根、空芯菜のスプラウト、グラパラリーフ、マーシュなど珍しい野菜を日替わりで取り入れている
食事	コース	店内は、前菜やパスタなどのアラカルト料理を気軽に楽しめる「トラットリア」と、シェフのおすすめコースをゆったりと堪能できる「リストランテ」に分かれています
学校	コース	生活学科(服飾専攻(服飾文化コース、服飾デザインコース)、生活文化専攻(食生活コース、国際文化コース、生活造形コース)、生活情報専攻)、栄養科、英語科が設置されています
その他	コース	【縄文杉トレッキングコース付】★JALで行く♪マイルがたまる★民宿フリープラン屋久島5日間★鹿児島港〜屋久島間高速船往復(燃油サーチャージ込)付★夕食&朝食付
スポーツ	コース	(インターバルは約15分)コースメンテナンスには特に気を配り、ゴルフをスポーツとして楽しむことを念頭に、グリーンコンディションの維持を最優先に作業を行なっています
その他	コース	そして、そこから下だって行くコース・・・・本当に何処まで続くのかと目を見張るようなツツジ群落が、アーチを描いてハイク道の上下左右を飾ってくれているのです
その他	コース	冷え込みの厳しく、雪の多い冬場の生活は想像を絶するものがあったそうですが、そういう意味で幌加内から朱鞠内を抜けるこのコースは自分のルーツが生活していた地でもあり、感慨深いものがあります
食事	コース	コースメニューは菜(さい)コース2800円(季節の野菜を中心とした料理)、 旬コース4200円(季節の野菜と旬の食材、魚や肉料理をおりまぜたコース)、 蓮コース5500円から(料理長、厳選素材のおまかせ料理
スポーツ	コース	1954年F1オーストラリアGP(コース名:サウスポーと市街地コース)に使用された以外に、サーファーズ・パラダイス・インターナショナル・レースウェイとして1966年から1987年にタスマン・シリーズ、オーストラリア・ツーリングカー選手権などが開催された
その他	コース	その後、GSグループ以外のスポンサーを擁立した4社(スポーツ振興新阿波CC、高松スポーツ振興CC、矢部GC、愛媛ハイランドGCの各経営会社)が、スポーツ振興グループから切り離され、14社(国内既設26コース経営)での更生計画案となった
その他	コース	幼年学校から陸軍士官学校と言う、戦前のエリートコースを歩んだ安藤大尉は、昭和10年に歩兵第三連隊の中隊長となり、当時の青年将校の指導的な役割を果たします
学校	コース	(大学教授で心理学、経営学の素養を持つ女性カウンセラー)面接と言えば、ビジネスコース(起業家育成コース)の受講者を新聞広告、テレビのテロップ広告で募集したところ、110名の応募があり、これも全員面接しました
学校	コース	ジョギングコース、テニスコート、クロケット、ファミリーボクシングトーナメント、卓球、ビーチバレー、サッカーやラグビー、ヨガやボディストレッチのクラス、バティック絵画のクラス、タイボクシング、ロッククライミングなど(一部有料)
スポーツ	コース	後で判った事ですが、麓一帯は、日本一のゴルフ練習場を含むゴルフコースが、そして中腹には、春、色とりどりの花が咲き競うと思う湿原があり、その湿原の先には頂上まで見渡せる草原が広がっていました
学校	コース	卒論というのは必ずしも厳密な言い方ではなく、現在のウクライナの大学は、ソ連時代の5年制大学から、欧米の大学の制度に適合するように改革されつつあり、4年卒業時点で「学士号」が授与されることになって、5年生では「専門家(スペシャリスト)」のコースと「マギストル(学士と修士の中間的なもの
スポーツ	コース	走り慣れたコースで、走り慣れないライバルをやっつけたところで、彼らのような育ち盛りの選手にとってそれを実力というのはいかがなものかと疑問に思い続けてきたが、今年の上位選手は、どうもコースを選ばず成績を残している気がする
学校	コース	文化人類学コースでは、異文化理解に関心を持ち、本やインターネットではなく、実際に自分が現地で調査(フィールドワーク)することに楽しさを感じることができる人を受け入れています
食事	コース	夜ご飯は和食のコースを頂いたんですが、デザートの桜プリンというのが、なめらかようかんというか、なんか和菓子の味なんだけど、洋菓子の味もするし、滑らかだし、今まで食べた事のないデザートで、悶絶
スポーツ	コース	コースサイドに置かれた「ポスト」と呼ばれる小屋に待機し、競技前はコースの清掃を行ない、競技中はフラッグにてコース状況をライダーやドライバーに知らせたり、動けなくなったマシンの移動・撤去を行う
その他	コース	コースは尾根を流れるクルージングコースやチャレンジングなコブ斜面、短く狭い初級者コースといった感じで決して万人向けではないが、今シーズンから名称を「スキー場」から「ウィンタースポーツパーク」と変更したことからも分かるように、すべてのスノースポーツを積極的に取り入れていこうという姿勢は明快なスキー場である
その他	コース	1947年にいわゆる「逆コース」が始まるまでの時期は戦後改革が実施された時期と見なされているが、それは日本国民にとって一体どのような時代だったであろうか
その他	コース	宝ヶ池と言えば、昔よくデートした思い出があります 高校生のころ、当時付き合ってたかなり年の離れた彼と、駐車場に車を止めては、2kmちょっとの池の周りを手をつないでゆっくり歩くのがお決まりのコースでした
スポーツ	コース	コースは1年がかりで1全国的にも珍しい常設コースの「パンプトラック」2全長約300メートルの「ショートダウンヒル」3一周約1200メートルの「クロスカントリーコース」の三つが完成
スポーツ	コース	ゴルフの全英オープン選手権は17日、英北西部のターンベリー・エイルサコース(7204ヤード、パー70)で第2ラウンドを行い、初出場で初日21位につけていた17歳の石川遼はボギーを連発して8オーバー、通算6オーバーで予選落ちした
スポーツ	コース	臨海部に位置し、かってのゴミ戦争の戦場となった夢の島、今は、若洲ゴルフリンクス(ゴルフコース)など、江東区に新しい領土を提供し、工場地や宅地が拡大し、人口も50万人に近づきつつある、文字通り福の島となった
学校	コース	このコースでは組込み技術者を養成するため、3年間のうちにこの技術分野について幅広く深く、バランス良く学ぶことができるようカリキュラムを組んでいます
食事	コース	コースはSELANの前菜(通常メニューの太刀魚のカルパッチョをセレクト)、フォッカッチャ、デザート(通常メニューのココナッツとビターチョコレートのパウンドケーキアボガドアイスのせをセレクト) 、それにネスプレッソがついてくる
その他	コース	それは、パワーリハ施設で3時間以上4時間未満や4時間以上6時間未満の短いコースで1日2回転させているうちのデイサービスセンター小林や学術大会でも発表のあったデイケアセンター野の花さんのようなところです
その他	コース	コース途中でのブルーベリージュース、ゴールでのマザー牛乳等のおもてなしがあり、さらにマザー牧場入場料が無料になるというオマケ付きでサービス満点でもありました
スポーツ	コース	種目は、2キロ(小学校低学年/中学年対象)、3キロ(小学校高学年/中学生)、5キロ(高校生〜一般)、10キロ(高校生〜一般)、ウォーキング10キロの6コースがあり、各種目3位まで、ナンバーカードによる「ラッキー賞」や「遠来者賞」「高齢者賞」などが準備されています
その他	コース	博多もつ鍋コースは、季節野菜のサラダ、牛たたき、博多もつ鍋(味噌・醤油・塩・炙りから選べる)、博多焼きとん、宮崎チキン南蛮、博多焼きとん、ちゃんぽんor雑炊(もつ鍋のスープを利用)、デザートから成り立っている
スポーツ	コース	坂本選手が野口みずき選手に続いて残り2枚のうちの1枚を手にする可能性が高いと思われるが、高速コースといわれる大阪でのタイムとしてはいくらスタート時点の気温が大会史上最低(3
学校	コース	教育学部ではない学部で教職コースを選択する場合は、就職する際に教員になるしか選択支がなくなりますので注意(教員資格のみほしいと言うのは無理らしいです)
学校	コース	96期生は合唱コンクール・沖縄研修旅行・演劇コンクール・Cコースの中期留学など各種の留学や交流活動など、軸となる大きな行事はすべて大きく成功させることができました
学校	コース	いくつかの教育コースや対応する資格を、職種とレベルごとに定義していくことにより、情報セキュリティ対策に対応した人材育成ロードマップができ上がる
学校	コース	先ほど話があったように、公募の段階では川本高校とか、それから邑智高校といった応募もあり、現在の校名に愛着があることは十分理解をしているが、両校の歴史と伝統を引き継ぐということとともに、普通科コース制・総合選択制の高校として新たに出発するに際して、本県を代表する高校の一つとなってほしいという思いから島根中央高校と決めた
学校	コース	そうした中で、梶原岐阜県知事がマンガとIT教育の両面を進めたいという事で、多治見市在住の県会議員から、本校でマンガコースを開設出来ないかというお話がございました
スポーツ	コース	大会コースとなったファンコートCCは世界屈指の難コースト言われ、世界的な名プレーヤーで黒豹と呼ばれた南アフリカのゲーリー・プレーヤー選手が、ゴルフ場のオーナーから『金に糸目を付けない世界一難しいコースを作って欲しい』と依頼され、00年11月に開場したコースだそうで、難しい上に風が強く吹く事でも有名だそうです
スポーツ	コース	そんな見所満載のコースで開催されるこのベルギーGP、実は2003年にも、F1の最も大きなスポンサーであるタバコがらみで、EU圏のタバコ広告禁止により開催中止となったことがあったんですか、その次の年には復活
スポーツ	コース	今年度初めてスティックを持った人 もう何度かコースを回った人とそれぞれでしたが なかなか思う様にボールがカップに決まらず この日の為に練習した人はこんなはずでは
スポーツ	コース	浜寺コースは、浜寺公園と泉北一区臨海埋立地とに挟まれた巾200メートルの 浜寺水路を使用し、浜寺大橋より高石漁港に至るまでのうち1000メートルをコースとして利用しています
その他	コース	って練習だと何とかコースを狙えるけど、いざ試合になると(^^;) コーチからは「良い球を打った後の次が大事」と今後の課題〜空港図書館でリクエストしておいた本を借りて帰宅 午後は店の仕事夕方家にいたら、店の買い物を頼まれ外に出たら、北側が朝みたいに薔薇色夕飯は湯豆腐
食事	コース	食前酒、3コースのディナーでエビとホタテの前菜を Merlot の白ワイン、ラムと温野菜には赤ワインの Chardonnay、そしてデザートとして果実酒とシャーベットにコーヒー
その他	コース	今回は縦走前のトレーニングのために60リットル級のザックに荷物を多めに詰め込み、また、傷みの激しいブーツを新調したので履き馴らしのために色々とコースを模索していたが、小菅の湯の食卓気に係り、飛竜山か唐松尾山と言う、ただの日本百名山キラーが見向きもしない山を標的に絞っていた
食事	コース	カニのコースの天ぷらですが、事前におっしゃっていただきましたらかにちり・焼きガニ用のカニを天ぷらにすることも可能でございますので次回ご希望でしたらおっしゃってくださいね
学校	コース	■ 本コースは、日本商工会議所、全国商工会連合会の指定通信講座になっており、修了後、スクーリングに出席すると、「販売・経営管理」の科目免除が受けられます
食事	コース	・今回のコースには、あわびの磯焼き、鮎そうめん、東京X・アグー豚・みちのく豚の一口串カツ、 活き穴子の刺身の炙りなどなど、それぞれ、ちゃんと仕事をした日本料理が味わえます
その他	コース	5日はオープニングイベントとしてチームバスクトレイルランナーによるコースクリニック、スライドトークショー、夕食は運営スタッフが作ってくれたダッジオーブンでのアウトドアクッキング
学校	コース	そのためMatriculationコースを選択するブミプトラ学生はだんだんと増加し、現在ではマレー学生の選択の中でこれが最大になっているのです
その他	コース	代表戦は常に、有名選手の顔を見に来た観客で満員となり、普段はサッカーを見ない層でも、話の種に、物見遊山で、接待として、デートコースとしてスタジアムを埋める
その他	コース	義歯作り47年、咬合と全身のコース作りで28年で見えてきたものを、東京歯科研究会会長として私が、伊禮先生、松原先生と一緒に形にしたコースのご紹介
食事	コース	メインコースの前に出された料理はすべてオードブルといえるが、一般にはオードブルという呼称は調理された小品に限定され、クルディテ(ディップを添えた生野菜盛り合わせ、 Crudités)、チーズや果物はオードブルとは呼ばない
食事	コース	いつもコースで頼むのですが、今回は4000円のコースで、野菜と豚肉のしゃぶしゃぶ、お刺身、胡麻豆腐、魚の煮付け、モズクと蛸の酢の物、天麩羅、お寿司、デザートは柚子のシャーベットでした
その他	コース	自宅最寄りの駅前居酒屋で忘年会を執り行ったんですが4人からの宴会コースを無理矢理3人にしたためかどうかやたら食料豊富で飲むより食う方で精一杯というか腹一杯になってしまいました
食事	コース	初めてのお店なので天神橋コースというヒレステーキセットをオーダー、前菜2種からいきなり衝撃に美味しいんです♪もちろんお肉も満足させて頂きました
スポーツ	コース	河川敷の平坦コースで簡単なはずなのだけど、フェアウェイ両サイドにある1ペナの黄杭が自分にはかなりのプレッシャーで、受け場所のある丘陵コースの方がよっぽど楽な気がする
学校	コース	ジェイエスエスグループでは選手育成コースで培った指導能力を成人、レディースコースにも生かし水泳での練習で健康で明るく生活出来る様に日々泳法技術の向上や健康の源である持久力の向上のための日々努力してまいります
スポーツ	コース	期待の日本勢はというと、2週目に土屋圭市が駆るIDCサード・スープラがコースアウト、長時間ピットに張り付きっばなしになり、コース復帰は果たしたものの順位を大幅に落としたほか、チーム国光のレイブリックNSXも最初のピットイン直前にエンジンブローでリタイヤするなど散々な成績でした
食事	コース	料理は22時まではコース主体、それ以降の時間帯は単品オーダー可能となりますが、初めて訪問される方なれば絶対にコースで全ての料理世界を存分に堪能されることを推奨します
学校	コース	テニスコース入学動機:テニスをして打つ喜び、楽しさ、悔しさ、最後まで諦めないコトなど、イロイロなコトをテニスから学べて、より多くの人、幅広い年齢層の人々にも、テニスの楽しさやテニスを通じていろいろなコトを伝いたいと思い、テニスコースに入りました
学校	コース	この9月末にスエーデンから寿司学校に来て、1週間のコースを取った人は、事前にわたしたちの寿司学校が制作したDVD「ジャパニーズ・トラディショナル・マスター・スシ・スキル」(1時間31分)と「ジャパニーズ・プロフェッショナル・フィッシュ・アンド・クラム・プリパレーション」(1時間21分)を見て、このロサンゼルスの寿司学校に来ることを決めました
食事	コース	しかし、ここのレストランは安い上にコース料理もなかなか美味しくて、我々はいつも利用していたのですが、今回はフェリー到着が遅い便でしたので夕食は船内で済ませてきました
食事	コース	、コース料理をウリにしているお店にしたら少し寂しく思ってしまいました(ーー; 量はたっぷりとあるので、5000円ならばリーズナブルかとは思うのですが、よく言えば優しいお味
食事	コース	そして、このオードブルを食べて感じたことは、ここはパスタランチではなく、コースを食べた方がこのお店の力量が正確に理解できるかも知れないということだ
学校	コース	コースによりますが、1回の授業時間が長く、カリキュラムの中に言語、発表、行動観察、巧緻性クラスなど組み込まれておりますのでいくつものクラスを取る必要がありません
学校	コース	各コースの中でもレベルに応じて組み分けをし、1人1人の能力に合わせて、マット、跳び箱、鉄棒、トランポリンの器械体操種目4種目を中心に基本的な動作を身につけていきます
食事	コース	3800円コースの平凡で万人受けする料理を否定はしないが、私はレストラン、特に30代の若い料理人が営むレストランには何か一つでも自分だけのオリジナルを求めたい
スポーツ	コース	ある日、その頃ゴルフをやり始めたばかりで、安いパブリックのゴルフ場ばかりへ行っていた頃、都民ゴルフという河川敷のコースへ行ってその周囲の風景を見ていたら、何とこの中の「工場と微笑み」のフレーズが突然浮かんできたのです
その他	コース	コースとしては、、水辺の森の公園を出発し、去年参加した長崎ベイサイドハーフマラソンのコースを一周し、諏訪神社へお参りに行き、ゴールのミナトサウナへ行きました
その他	コース	夜、寝るとき・・・ふくらはぎが、しびれて、なかなか眠れなかった・・・このコース、よく4年もまわれたなぁ・・・と、自分でも関心したけど、たまにまわったら、ほんまに足がこたえるなぁ・・・
スポーツ	コース	その後、コースが少しずつ乾いていくに連れてライバルもタイムアップし、2台のZとガライヤ、そしてランボルギーニなどが競り合いながらトップタイムを更新する
スポーツ	コース	27 □ブータンロータリーゴルフトーナメント 国王のティンプーゴルフコースで週末に開催された、ブータンロータリーゴルフトーナメントのでBahadur Tamang(19歳)が優勝
その他	コース	コースはと、秩父から雁坂トンネル、河口湖、山中湖と通って御殿場まで、 目的地を地図で調べたけど、ブルスカが行われるFISCOのすぐ側なんだよね
その他	コース	カタログギフト アズユーライク 20500円コース【洋風】、【和風】【シャディのカタログギフト お返し・出産祝い・結婚祝いなど各種お祝い なんと 誰にでも一攫千金のチャンス
学校	コース	[挿話2]私は日本科学技術連盟の「品質管理ベーシックコース」(工場の技術者に統計的手法・品質管理を教えるコース、240時間の長期教育)の講師をつとめていましたが、あるとき森口繁一東大教授から品質管理技術者にはこれからはコンピューターの知識が必要になるだろう、これを講義せよとのご指示がありました
