# スポーツ: 競走路・競泳路など、競技での定められた通路。インコース, 学校: （学科）課程。速成コース, 食事: 西洋料理で、一定の順序で出される一組の料理。ディナーのコース
スポーツ	コース	場所によってコースが自由に設定でき、ゴルフ気分も味わえ、手軽に楽しめることから、近年人気が上昇し、高齢者のコミュニティスポーツとしてはもとより、ファミリースポーツや職場のレクリエーションとしても、全国的に普及してきています
その他	コース	切っているコースにパスを出されるべきではありませんが、出された場合の対応(Alaとのポジションチェンジ等)については、ポジショニング次第なので、練習で身につけます
その他	コース	コース的には常に行く手にカーブがあるため、そこを曲がらないと先の様子は分かりませんが、その分、その先にどんな景色が現れるのかと期待感が高まります
その他	コース	今回のコースは島後の隠岐の島町を見て西郷で宿泊し、島前の海士町から国賀海岸を見て西の島に入り浦郷の国賀荘で宿泊、翌日は知夫里島を見て帰阪の予定でした
学校	コース	どこの予備校の募集要項を見ましても、大学受験コース、国立大学理料系あるいは文科系コース、あるいは私大歯医科系、薬科系、理工コース、いろいろコースをこう実は明記をされております
スポーツ	コース	平成18年3月 更生会社株式会社カントリークラブ ザ・ファーストの会社分割により、ゴルフ場1コースを連結子会社であるスポーツ振興株式会社が承継
その他	コース	とりあえずマウンテンバイクを体験したい方、他のアクティビティー(ラフティング、カヌー、パラグライダー等)と組合わせて1日楽しみたい方に最適なコースです
食事	コース	コースのほうにするつもりだったのですが、オードブルの盛り合わせが生の魚を使ったものでデザートもちょっと私には無理っぽかったので今回はパスタランチに
スポーツ	コース	50km地点の小海中学校へ行く途中、松原湖入口交差点に走っているランナーが見え、そこからマラソンコースを逆走する、5km程行ったところでジャーマンの中村さんで出会い、すぐ後ろを伊藤さん、しばらく遅れて比屋定さん、ちょうどフルマラソン距離の辺りでした
学校	コース	このほか、短期集中コース(週末2日間)、合宿、中国での研修など様々なイベントもあり、楽しく練習しているうちに気功が上達し、健康 になることができます
学校	コース	夜間主コースの学生が昼間コースのいくつかの指定した講義を履修して、単位にすることはできますが、その逆はできません(昼間コースの学生が夜間主コースの講義を履修して、単位にすることはできません)
その他	コース	このコースは、鳥取県側仙ノ谷コース('98/05/23)を登ったとき、仙ノ谷コースの途中から真新しい遊歩道が分岐 していたコースからも登れるようだ
スポーツ	コース	発売前からアペンドディスクの発売を匂わせていたボトムアップの「ゴルフしようよ」ですが、今回、正式に、「ゴルフしようよ ゴルフコースデータ集」が発表されました
スポーツ	コース	とにかく全英オープンの特徴は、コースはすべてリンクスコースを毎年使い、朝早くからお昼過ぎまで世界中から集まった選手達で構成される、多数の組み合わせがスタートして行き大変盛んな伝統的雰囲気のあるメジャー競技です
その他	コース	富士山の裾野にあるこのゴルフ場は 大きな木にセパレートされ コースも長く アメリカ・コロラドのゴルフ場を思い出させてくれる とてもきれいなコースです
学校	コース	私立に通えない、公立高校進学希望者は昼間部希望者は昼間部で単位制希望者は単位制で通信希望者は通信制でハンディキャップのある者も希望するコースに帰国子女や外国人生徒も希望者は全員公立高校で受け入れてください
スポーツ	コース	この練習を開始してからはコースでも練習のように考えながらクラブを振らねばならないラウンドを続けてきたけれど、月曜日のラウンドではだいぶスイングも落ち着いてきて、頭で考えないといけないことが減ってきた
スポーツ	コース	当日は同時に早朝から、スタジアムやコースの草刈りや、駐車場から競技場に上がる法面に「手作りの階段」作りに地域の方々やスキー関係者が汗を流しました
食事	コース	「生誕100周年記念 ダリ展 ―創造する多面体―」開催を記念して、ホテル総料理長 谷岡 隆氏がダリの芸術をイメージしたお料理の数々を特別コース仕立てに提供
スポーツ	コース	初めてのコースですし、心肺に負荷が長くかかる練習なんてしていないので、1時間30分、まぐれで25分ぐらいで走れたらなぁ、なんて思いながらスタート地点へ
食事	コース	カジュアルフレンチがメインのお料理ですが、 幅広い年齢層にも対応した和洋折衷のコースも取り揃えて、 シェフがお客様のニーズにもお応えいたしております
食事	コース	東心斎橋にある洋食で有名なカツイにランチタイム いつもいっぱいで入れない事が多いので昨日から予約コースランチは品数が多くて食べきれない程 いつ食べても美味しいわ (^~^) 美容の事仕事の事子供の事これからの事 お互い母であり経営者同士強く
学校	コース	≪対話重視コース≫と≪匿名希望コース≫の両コースとも、同じ日に中間試験と期末試験を受験する(但し、形式及び問題及び解答方法が違います)ので、仮に試験日の変更があっても≪匿名希望コース≫の人は共通教育掲示板を普通に見ていれば変更に気付くでしょう
学校	コース	このコースでは、CCNA取得をサポートするためにCisco認定コースであるICND1とICND2をアレンジし、5日間の講義/演習を通して効率的に資格取得に必要なスキルを速習することができます
スポーツ	コース	安芸太田町横川の「国設恐羅漢(おそらかん)スキー場」で、スノーボードをしていた男性7人がコース外に出て遭難し、救出された問題を受け、同スキー場は7日、山頂付近に、コース外の滑走禁止を知らせる立て看板を設置
学校	コース	ベビー・ジュニアコースや成人・レディースコース・育成選手コースの水泳指導や公共プールの水中ウォーキング・アクアビクス・リハビリ教室の水中運動教室を担当しています
その他	コース	首都圏自然歩道「関東ふれあいの道」のコースにも指定され、北側には眼下に下久保ダム(神流湖)を有し、春から秋にかけてたくさんの花々が咲き誇り、観光客の目を楽しませる
その他	コース	私がよく練習する河川敷のサイクリングコースでも、ここまで酷くはないですが、同じような現象が・・・特に週末、バーベキューの後、お花見シーズンの宴会の後、山のようにゴミが積まれています
その他	コース	でも、たまに、ものすごく仕事が速いヤツがいて、そいつが何日か同じコースに行くと、店もセンターもそいつの時間を基準にしてしまうから、定時前に入っても怒られたり、センターに電話入られる
学校	コース	更に大学進学、またユニークなコースで『English for Professional』という弁護士や会計士、大学教授等の特別職に従事する人達への集中専門コース等幅広い、且つ質の高い授業を展開している
学校	コース	広島大学では西条地区への統合移転を契機として大学の改革準備を進めておりまして、総合科学部の創設、工学部の改組に引き続き政経学部の分離改組を行い、機能的な履修コースの設定等とあわせて教育研究体制の充実整備を図ろうとするものでございます
スポーツ	コース	京都マラソンのコースを見下ろせる病院に、ともやさんの長女の田鶴ちゃんが入院していたんで、ともやさんは京都マラソン完走を諦めなかった、と聞いた事がある
スポーツ	コース	初心者コースは、ホントに誰でも、初めてでも出来るので、今まで何度かやったけど、その上のコースはやってみたいと思いながら、まだやった事はありません
その他	コース	この6月ごろからと言うのは完全夏休み期間で、大学でのアクティビティが一切無かったのだけれど、9月からは新学期が始まるので、いくつかコースを取ろうと思う
その他	コース	富士山の覆流水を集める白糸ノ滝や、田貫長者の古い伝説を伝える田貫湖、家族連れなどに人気のある花鳥山脈の遊園地など、多くの観光地に囲まれた山域ですが、その明るい尾根道は春の好日を過ごす絶好のハイキングコースと言います
その他	コース	「入選協(検)」の答申=学区縮小の目的とされ、神奈川の主体性を全国に示すものとされた「地域に根ざした高校づくり」は「特色ある高校づくり」という言葉にとってかわり、「コース制」における「入試の多様化」をはじめ、よりいっそうの「高校教育の多様化」の促進を提言する形となった
その他	コース	キムチコースと韓国代表料理コースのプログラムの内から選ぶことができます^^ 韓国旅行の際にはぜひご利用いただき、お友達に手作り韓国料理をごちそうしてあげて下さい☆ 他にも韓国について色々な情報を提供させていただいているのでぜひ遊びに来てください^^ エプロン、即席写真無料のおまけ付きです^^
食事	コース	伝えして了解をいただいてます コースでの料理です 一口サイズのアミューズから始まってムール貝&赤座海老のポアレ フォアグラのソテー&ロケットサラダ風味、パンプキンの泡立ちスープ、 スズキ
スポーツ	コース	今シーズンにお目見えした新しいアトラクション「スノーランド」は、コース内に設けたアーチやモーグルコース、エア台、ボックスなどを通して楽しく上達できる仕組み
その他	コース	お子様用コースやソフトドリンク[飲放]もございますのでお子様連れでも安心です♪そしてお店で人気のメニューを揃えたお得なセットが新登場♪詳しくはコースページへ
学校	コース	CCNA講習会が、1週間コースを一回あたり4人づつで4回実施(全16人)、しかも5日間で1週間、だったことを考えると、研修スケジュール担当は少人数制のメリットも判らず、経済観念もないアホウということが判る
学校	コース	本学科には、幼児教育コースと、保育心理コースがあり、いずれのコースでも幼稚園教諭二種免許、保育士資格が取得できますので、幼稚園や保育所・施設などへの就職が可能です
学校	コース	カーリングの体験コースに申し込んだ人、単純にスキーに出かけた人、とりあえず履歴書を書いた人、気持ちだけ前向きになった人、オリンピックからいろいろもらってる人がたくさんいるんでしょうね
学校	コース	この日は昨日に1ポイントコースを受講した4人が峠スクールを、昨日に峠スクールを受講した4人が1ポイントコースを、そして残る1人・オーナーの重安さんは昨日に引き続きウェイクサーフィンです
食事	コース	蟹漁が解禁となる11月から3月20日までの期間限定の蟹コース料理は、カニ刺し、茹でカニ、カニ鍋、焼きカニ、カニ味噌入り茶碗蒸し、茹で香箱カニ、雑炊もついた蟹好きにはたまらない蟹三昧
その他	コース	投稿者:きよし (2010年2月13日 20:57投稿) この評判・クチコミを支持する人数:33人中23人 教室長は色白で、ヒョロっとしていて、一見たよりなさげでしたが、学習プランはうちの子の性格を理解してくれていて、比較的厳しい環境のコースを進めて頂きました
その他	コース	参拝コースは432号線の別所地区から旧参道を徒歩で登るコースと、車なら藤原地区経由で舗装された道を一気に境内まで登るコースがあり、標高は450米である
食事	コース	バイキングや仏蘭西料理のコースなどなら兎も角一体ラーメン専門店で22時前から一時間も粘る輩がどれ程居ると言うのだ)為、深夜に帰宅して自炊する気力も無い、さりとて備蓄のカップ麺類を食するのでは物足りぬという時には宅配ピザが非常に重宝するのだ
食事	コース	たくさん食べられない私はコースの魚料理を抜いてもらったのだが、だんなとペースをあわせて出てくるので、前菜とスープのあと1時間近く間があいてやっと肉料理にありつけた
食事	コース	通常のフレンチコースディナーに伊豆ならではの新鮮な魚介類の刺身盛り合わせ(2名様用)が付き、さらに天然温泉露天風呂はお部屋毎に貸切で御利用いただけます
スポーツ	コース	帯同キャディーとハウスキャディーでどう違うのか、ということにもなりますが、123ともにそのコースに詳しいハウスキャディーの方がそのコースにおける経験も豊富ですので、むしろ良いのかもしれません
その他	コース	また、プラモデル人口の減少、シャシ価格の急騰、シャシ構造の複雑化により、コアなマニア向けの競技となり、競技人口が減少、現在では1/24の商業コースは第二期最盛期の2/3(第一期60年代の最盛期には100ヶ所以上あったので、現在は2/3をはるかに下回る)になってしまっている
学校	コース	当コースでは学科で骨・筋肉・神経の解剖学・生理学など一応行いますが、カイロプラクティックは日本では医療、そして代替医療でもないので必要以上の専門的な医学知識は授業で行いません
スポーツ	コース	本格的チャンピオンシップコース「グランディ那須白河ゴルフクラブ」、愛犬と共に過ごせる「エクシブ那須白河 ドギーヴィラ」をはじめ、福島県でも有数のスキー場「グランディ羽鳥湖スキーリゾート」などが充実
その他	コース	高校まではアメフトの選手で、某有名大学を卒業と典型的なエリートコースを突き進んできたが、就職後は突然の派遣に見知らぬ業務、そしてアイラの破天荒ぶりを前に迷走の日々を過ごす
スポーツ	コース	これだけ計画を立ててもらったのに、ジャイアントのコースは傾斜が急だったので私が降りる自信がなく、時間もなかったのでロープウェーを使ったり、高天ヶ原は明日のリフト券でも行けるので素通りしたり、スキー場とスキー場の間をぐるぐる廻っているシャトルバスに乗ったりして最初とコースは随分変えて廻りました
学校	コース	10週間のIELTS勉強コースは傾向や対策を詳しく教えてくれるので日本で受けたときの結果よりもかなり高い点数が取れ、Trinityへの入学に向けて自信がつきました
学校	コース	私が教鞭をとっている聖徳大学音楽学部 作曲・音楽研究コースコンピュータスタイルは、音楽の初心者からプロ養成まで、コンピュータミュージック(DTM)を徹底的に学べるコースです
その他	コース	もうお腹も空いたし、そろそろお弁当を食べようと思っていた時に、コース地図では昼食場所になっている林道出合まで来たので、やっと弁当を食べることにしました
スポーツ	コース	ホテルのすぐそばには丸池・蓮池スキー場があり、冬ともなれば丸池スキー場からはサンバレーに、蓮池スキー場からはジャイアントスキー場に連絡コースで滑り込める
その他	コース	合格祈願コース:御茶ノ水駅より孔子を祀る日本の学問の聖地、湯島聖堂へ徒歩5分、湯島聖堂よりへ徒歩5分で平将門を祀る神田明神で学業勝守、合格守を取得、神田明神より徒歩15分で学問の神様菅原道真を祀る湯島天神へ
その他	コース	シューレ大学は、一人一人が自分の教育計画をたて、卒業年からコースワークはもちろん、講座も講師の方と相談しながら作っていくオルタナティヴなNPOの大学です
その他	コース	★3%OFF&ポイント2倍&送料無料★温泉宿泊&レストランでの食事も贈れるカタログギフト【100600円コース】〜スーパーギフトチェック ルナシオン
その他	コース	帰りのコースとしてこのルーとを使いますと、高尾駅南口バスターミナル周辺には、ファミレスが多く有りますので、打ち上げ場所としては最適ですし、途中の狭間町で下車すれば、薬草温泉フロッピーも利用できます、帰り便は、高尾駅南口まで無料送迎バスを利用できます
その他	コース	また、 ハイキングコース天城縦走路の中間地点にあるため、休日にはハイカー達の憩い の場所として賑わい、畔には木造の休憩舎や、展望所下に循環式の水洗トイレな ども設置されています
学校	コース	日本の漫画やアニメはヨーロッパでは現代のジャポニズムとも呼ばれているが、こういった日本の漫画やアニメを専門とするカリキュラムを大学における正式なコースとして設置する動きは、既に京都精華大学、東京造形大学、神戸芸術工科大学、宝塚造形芸術大学、デジタルハリウッド大学などに広がっている
その他	コース	このコースは長野市の山学スキー同人「山我楽巣」(やまがらす)の丸山晴弘氏によって開拓されたルートで、氏の経営する「okスポーツ」のガイドツアーにしばしば登場する
食事	コース	そしてゴージャスな照明☆美食の国であるフランスに思いをはせて、ワインと共に楽しむコース料理はもちろん、主役の2人がシェフと一緒につくり上げるこの日のためだけの完全オリジナル
学校	コース	今まで、幅広く番組を見るためには月額5985円の「ベーシックパックオール」というコースに入らなければならなかったが、これがほぼ同じ内容の「よくばりパック」(月額3500円)に代わり、実質4割以上の値下げになった
学校	コース	たとえば、ホテルマネージメントのコースのカレッジで2年学ぶとディプロマ(卒業証書)がもらえ、3年学ぶと大卒の学位がもらえるという形になっているところが多い
スポーツ	コース	スキーパスモンブランはシャムスキーパスよりも利用できるスキー場や観光コースが増え(レズーシュスキー場やモンタンベール鉄道など)行動範囲が広がります
スポーツ	コース	2年前からフジサンケイ・レディスクラシックが行われている富士コース(泊まり客専用18ホール、パー72)と大島コース(18ホール、パー70)があるが、いずれも海岸の絶壁に位置している
その他	コース	経営会社のアラン・チャールズマージェリソンゴルフアンドリゾート(株)(本社=コースと同)の株式を韓国系の北星ゴルフグループ(ソウル)が取得し、同社の代表には亀川東祐氏が就任するとしている(代表者は変更登記中)
スポーツ	コース	スキー場事業につきましては、スキー愛好団体の意見を取り入れながら起伏や変化のあるコースづくりを行うとともに、生涯スポーツとしてのスキーPR、陸上自衛隊第6師団の訓練や小学校または子ども育成会のスキー教室の誘致により利用拡大を促進してまいります
その他	コース	大ガラスを発見し、ホビット暦に気づいてワクワクし、1回休みだということをすっかり忘れて、ちゃっかりうさぎシチューコースに応募していた私・・・うぅぅ恥ずかしい
スポーツ	コース	開催期間は例年に比べ短めだが、主催者は初心に帰ることをテーマに難易度の高いステージを設定しており、コース説明に立った篠塚選手も「2カ所のループSS(競技区間)ではGPSが使えず、ミスコースのリスクは非常に大きくなる
スポーツ	コース	第17回パークゴルフ国際大会(国際パークゴルフ協会主催)が、22日午前8時半からパークゴルフ発祥地の町運動公園内「つつじ・サーモンコース」で開かれた
その他	コース	コースは阪神武庫川駅で降り、武庫川の右岸を通って北上⇒JR鉄橋下⇒阪急鉄橋手前の上武庫大橋を渡って左岸に行き⇒西武庫公園⇒武庫工高⇒笹原公園⇒我家
食事	コース	のコースをチョイス まずはほろほろ鳥のテリーヌとイチジクのトースト トリのテリーヌでしたがフォアグラが入っておりとてもしっとりしておいしいく イチジクの甘みがテリーヌによく合います 前菜、ほたてのロワイヤル
学校	コース	それに加え、小学生には洛北・西京中学などの「中学入試対応のコース」、中学生には80点以上または20点アップを約束する「成績保証制度」や5教科全て勉強できる「5教科セットコース」、高校生には大手予備校トップ講師の映像授業と個別指導をドッキングさせた「超大学受験コース」等スペシャルなコースもあります
その他	コース	幅36mから63mのコースは、山の斜面に作られるためおよそ50mの高低差があり、急傾斜や緩傾斜のゲレンデなど微妙に傾斜が調節されているため、千葉県習志野市の人口スキー場など平地型スキー場とは「リアルさが違う」と関係者は話している
学校	コース	CARRICKの英語コースの授業はリスニングやスピーキングを中心とし、コミュニケーションのスキルアップを図りやすくする為に、少人数生となっている
食事	コース	本日はグラッパとイタリアンのコースディナーのマリアージュという、異例の組み合わせだったのですが、流石に年間400万本のグラッパを世界100カ国に輸出している蔵元さん(ZANIN社)だけあって、合わせるお料理もすばらしく、終始優雅な雰囲気の中で会は進んでいきました
食事	コース	お寿司も食べ放題ですが、コースで出して頂いたにぎりの他にはトロとエビしか頼めず(笑)おいしそうなのがいっぱいあるのに、もったいない気がしてしょうがないです
その他	コース	は参加選手所属会社や大会スポンサー会社と同様、コース沿いに「びっくりドンキー」名義の看板を出している)、またトリノ五輪で一気に増えた及川のファンやマスコミに対しても冷ややかで他の選手と比べて情報が入り
その他	コース	コメント:稜線は高山植物で百花繚乱 登山日:2007年8月16日 登山コース:みやぎ蔵王白石スキー場~水引入道~屏風岳~南屏風岳~不忘山~みやぎ蔵王白石スキー場
食事	コース	コースでは、前菜に「羽黒の仔羊カルパッチョ」、パスタに「アマトリーチェ」、ドルチェには「地卵のプリン」、飲み物には「櫛引のりんごジュース」をチョイスした
学校	コース	2006年11月17日に物質生命工学コース、秋のスポーツ大会として、BIG BOX茨木店にて「ボウリング大会」が開催され、研究室メンバーのアベレージで競う「物生杯」を、130越えというハイアベレージで、見事獲得しました
