# 映画: 映画を映す幕。銀幕。転じて、映画・映画界。, ビデオ: テレビ・レーダーなどの画面。, カメラ: 写真製版に使う、黒色・網目状の線を引いたガラス板。, インテリア: ついたて。間仕切り。
映画	スクリーン	スライド映写機が一般的に使われていた時代では、家庭内で白いシーツなどを壁に貼り付けて簡易スクリーンとするなどの行為も見られたが、映画館など専門の施設や近年のホームシアターでは、より機能的なスクリーンも登場、利用されている
その他	スクリーン	また、ミノルタ707siと異なり液晶パネルをファインダースクリーンと重ねることを廃止しているために逆光でもすっきりと見やすいファインダーに回帰している
ビデオ	スクリーン	(5)『Forever Love』がバイオリン主体の演奏で始まり、正面スクリーンに唐草模様のような絵柄の照明、両脇には青色の照明が映し出された
映画	スクリーン	UK FILM COUNCILは、企画から配給・マーケティングまで製作の各フェーズを支援し、製作や撮影協力については、各地方のスクリーン・エージェンシーがフィルム・コミッション的な役割を果たし、情報提供やロケ地の選定等のコーディネーションや支援を行い、ポスプロの協力体制も備える
カメラ	スクリーン	シルクスクリーン印刷、カッティングプロッターやフォトレジストと組み合わせると、ロゴやサインの製作、ブライダル商品やメモリアル商品へのエッチング、ウェルカムボードの製作やフォトエッチング、ホール、パーテーション、エレベーターや家電製品などのへのエッチング装飾もできます
映画	スクリーン	・・・・・・乳幼児が一緒なので、座席の前が広く(フライトアテンダントが座るイスの真向かい等)・スクリーン前の席(ただし、ここは車椅子の方が優先される)・オムツ替えに便利な、トイレに行きやすい席・隣の席に他人が座らなくても済むような席(後部なら二人だけのシートもあるよ
ビデオ	スクリーン	スクリーンショットになっても、下の写真のようにメイン表示部分にSSの名称のみ(英大文字三文字+数字と英小文字)が出ていて、サムネイル(縮小画像)が出ていなかったら、ファイル管理という文字のすぐ下にある円形クリック部分が6個並んだ場所に移動
映画	スクリーン	この放出したすべての光電子を静電場によって加速し、特殊なスクリーンに投影する手法を使って、時々刻々と変化する光電子の散乱画像を撮影し、運動エネルギー分布と放出角度分布から電子状態の高速な変化を可視化した
映画	スクリーン	城咲あいさんは、これまで彼女がやってきたヒロインの中で一番彼女にあったキャラで良かったのではないかと思うのですが、彼女は映像向きではないので、撮影シーンでドアップでスクリーンに映し出されたのを見たとき、ウームと思ってしまった次第
インテリア	スクリーン	☆かわいいパーティションでごちゃついた場所の目隠しに♪部屋の間仕切りにも☆サイズ変更も可能♪☆日本製☆3連スクリーンM・パーティション【ディスプレイ◆パーティション★間仕切り★ゲージ★隠す◆癒し★カントリー家具■カントリー雑貨■カントリーファン■輸入家具■アメリカンカントリー家具】
その他	スクリーン	SIMロックフリーの海外iPadについても国内技術適合基準はクリアされているため使用できる 可能性があるが、技適マークのスクリーン表示は今のところ確認が取れていない
その他	スクリーン	V603SHからテレビチューナー機能を取り外し、カメラのスペックなどを変更し、カスタムスクリーンやテクスチャーパネルを装備できるようにしたと考えれば、わかりやすいだろう
インテリア	スクリーン	簾(すだれ)、ウッドブラインド、ウッドスクリーン、ウッドカーテン、麻スクリーン、バンブースクリーン、バンブーカーテン、紙スクリーン、スモークスクリーン、パーティション、天然すだれ、御簾、その他オーダーメイド各種
カメラ	スクリーン	お楽しみイベント・山口智己さん( ヤマタカ捺染工場 )による、 『シルクスクリーンによるTシャツプリント実演・展示・販売』の詳細が決定しました
カメラ	スクリーン	小ロット生産によるコスト高が一番の原因ですが、4000円以上の商品は、さらに京都のスクリーン印刷業者に一点一点手作業でプリントをしてもらっていますので、そのコストも高くかかります
映画	スクリーン	82年にはトニー賞の13部門ノミネート、6部門受賞の快挙を成し遂げ、日本を含む世界各地で上映されたミュージカルが本作品でスクリーンに甦ったでも、とことんミュージカルに疎く、そのことを全く知らなかったので、つくづく映画にしてくれてアリガトウって思いました〜
ビデオ	スクリーン	xにアップグレードするという希望を持つことはかなり厳しい状況なので、個人的には、んーむと考え込んでしまうところだけど、今度配備されたこのiMacくらいスクリーンがでかければ、Captureone4
映画	スクリーン	わたしがスクリーンに認める「現実」の精確な反映(映画ほど「現実感」に満ちた表象物も他にないだろう)とわたしの得心のいくように物語を展開する虚構世界の連続性の論理(これがカット割りやカメラの移動による視点のたえまない変更を回収する)とが、わたしをひとつの特権的な視点に位置づけ、フィルムの首尾一貫した意味の生産者にしたてあげる
インテリア	スクリーン	【楽天市場】玄関網戸カーテン 網戸カーテンで虫やハエ等が入らない開放している玄関からの土埃や虫の進入を防ぐ 玄関網戸 カーテン すだれ、スクリーン、網戸カーテンワンタッチで簡単に取り付けできます:マツカメショッピング
インテリア	スクリーン	木製建具作成・取り付け工事・調整手直し(障子・欄間・戸襖・格子戸ガラス戸・トイレスクリーン・開き戸・引き戸・吊り戸・間仕切り・折戸)その他木製家具作成・取り付け工事
ビデオ	スクリーン	また、「1」で制作した場合(バアイ)、テレビに映す(ウツス)430インチのスクリーンで放映(ホウエイ)する映像(エイゾウ)の制作(セイサク)案件(アンケン)を頼ま(タノマ)れました
カメラ	スクリーン	加工は例によりJTrimで、新規作成(色付)、超新星(中心から2回)、 シルクスクリーン、シャープ、渦巻3回、ブラインド、パンチ2回、塗りつぶし、コピー、 ブラインド、合成、エンボス等
映画	スクリーン	特に効果を発揮したのが“3S政策”で、国民をスポーツ・セックス・スクリーン(テレビや音楽を含む)に夢中にさせ、政治に関心を向けさせない愚民化政策です
ビデオ	スクリーン	ファインダーを付けずにファインダースクリーンでピント合わせをした事がある人ならお分かりだと思いますが、像が小さくてジャスピンなのか判断が難しいです
ビデオ	スクリーン	そして、曲終盤、スクリーンには、それぞれに歌うユーミンの姿が映り、ユーミンは、歌い終わると、上手に移動して、階段から上ステージに登り、バックステージに姿を消していきます
ビデオ	スクリーン	シアターハウス(福井市) 横と縦の画像の長さが異なるハイビジョンテレビやDVDのどちらにも対応するスクリーン「ハイブリッド型電動スクリーン」の販売を開始
インテリア	スクリーン	デザイン性に優れ、プライバシー保護と防犯への配慮を両立させた完全クローズド外構を可能にする「開き戸」や「つり引き戸」、「スクリーン」などを用意した
映画	スクリーン	映像メディアというのは、「スクリーンの中ではなんでも起こりうる」という、映画を作る人にとってはあまり面白くない約束が、観客と製作者の間に成立してしまっている
ビデオ	スクリーン	5Sレンズで、ズームの望遠側かつ至近距離で撮影した場合、ファインダースクリーンのマット面の像とオートフォーカスの合焦表示が合致しない場合があります
ビデオ	スクリーン	直接マーカーで書き込めるスクリーンを使って、スクリーンに直接字を書くという方法も験してみたことがありますが、このスクリーンが小さいというのと、いちいちパワーポイントの図を送るたびに消す必要があって、これも面倒
映画	スクリーン	」という父のひと言が放たれるシーンが、スクリーンに映し出されると「3人が初めて揃ったのはこのシーンですね」と言おうとした西野の言葉が終わる前に、「違いますね
映画	スクリーン	今は、テレビやDVDなどでいつでも観ることができますが、やはり、大きなスクリーンに映し出される映像と音響で楽しむことが映画の醍醐味だと思います
映画	スクリーン	この「「キン肉マン」スペシャルナイト」では、大スクリーンで84年の劇場映画『キン肉マン』とファンが選んだTVシリーズ『キン肉マン』ベストバウト第1位作品を鑑賞する
ビデオ	スクリーン	昨年は前もって歌を覚えてくるよう課題が出されていたのでほぼ完璧だったのですが、今年はそういう準備期間がなくて、スクリーンに映し出される歌詞のハングルも難しくていまいち歌に参加できず
ビデオ	スクリーン	バーゴは、かなり大きな店で巨大スクリーンとフロアーに2カ所のせり上がるお立ち台が有り、フロアー周りにもお立ち台が有り、テクノ最盛期には踊り狂う女の子達が素晴らしい景観でした
ビデオ	スクリーン	映像夜間中学とは、特殊漫画家にして渾沌の翻訳者である根本敬秘蔵の映像とその解説を通しスクリーン越しに宇宙の「見方」「聞き方」「捉え方」等々を学ぶという、大変真面目かつスリリングなトークショースタイルのイベントです
インテリア	スクリーン	立川ブラインド工業は、新商品のプリーツスクリーン「ペルレ」の発売を記念して、5月6日から6月30日の期間、タチカワ銀座ショールーム(東京都中央区銀座8―8―15)で『ショールームへGO
その他	スクリーン	樗谿には、鳥居をくぐって石橋がありますが、あれに詰まって、要はスクリーンに入る以前に道路溢水するということですので、その辺、今後のごみのとり方というのですか、その辺に配慮したいと思っていますけれども、もともと点検が足らないということありません
映画	スクリーン	プロジェクションテレビ内の投射レンズ部(映像をレンズで拡大してスクリーンに投射する部分)に、従来の屈折型レンズに加えて新たに凹面ミラーを組み合わせた投射光学系を搭載し、当社従来比約1
その他	スクリーン	肉眼では見えないがデジカメには写る赤外線ノイズ光をスクリーンに重ね、盗撮した映像を使い物にならなくする技術を、国立情報学研究所とシャープが共同開発した
映画	スクリーン	座り心地の良い椅子に身を任せながら、大きなスクリーンを観ているととても贅沢な気分――と、何故かあの天井桟敷の固い椅子が懐かしく思い出されてきました
映画	スクリーン	それに最近ではシネマ・コンプレックスッて云う複合映画館が増えてきて収容人員はそんなに大きくはないけどスクリーンの数は増えてきているって云いますね
ビデオ	スクリーン	て載せるつもり だったんですが、プリントスクリーン押し忘れましたorz ちなみに私のライムスターは4着でした リダ、おめでとうございます^^ 以上です^^ ちなみに今日の+αというのは王様ゲームのことです^^
ビデオ	スクリーン	そして最後の曲、911での出来事を追悼し、平和を願った曲が始まるとスクリーンには赤い薔薇が映し出され、一人は白、もう一人は赤の衣装に着替えたダンサーの二人が旋回を始めました
ビデオ	スクリーン	私たちの研究グループは、証拠とされる写真をすべてデジタルカメラを使ってパソコンに取り込み、スクリーンに大映しにして、写真に改ざんの跡はないか、季節に誤りはないか、影の方向や長さに奇妙な点はないかなど、科学的に詳細に検討してきました
ビデオ	スクリーン	これらの新モデルは、 iPhoneのようなフルタッチスクリーンは持たないが、iPhoneの音楽インターフェース機能の一部を搭載し、現バージョンよりも薄型だがスクリーンは大きいというのが、大筋の見方のようだ
ビデオ	スクリーン	aiko(アイコ) 【ボーイフレンド】PV動画視聴をもっと大きな動画で見たい場合は、だいたいの動画サイトで右下の「□」のような記号をクリックするとフルスクリーンになるので、大きな画像で aiko(アイコ) 【ボーイフレンド】PV動画視聴できます
その他	スクリーン	(ハ) 細目スクリーンは、目幅の有効間隔をおおむね20mmとし、スクリーンに付着した汚物等を除去することができる装置を設け、スクリーンから除去した汚物等を貯留し、容易に掃除することができる構造とすること
インテリア	スクリーン	☆お子様サイズのスクリーン♪子供部屋の間仕切りにGOOD☆サイズ変更も可能♪☆日本製☆スクリーンW・MB・レース【ディスプレイ◆パーティション★間仕切り★ゲージ★隠す◆癒し★カントリー家具●カントリー雑貨●カントリーファン●輸入家具●アメリカンカントリー家具】
インテリア	スクリーン	近年カーテンやブラインド、スクリーン等が普及する中、使い勝手の良さや見た目の良さにより現在でも根強い人気を持ち、「洋風たてす」と呼ばれるものも販売されている
映画	スクリーン	チェンジリングが母性愛を示すならば、本作はイーストウッドが全世界に向けて発信する「究極の良心」をスクリーンに押し当てた、映画の中の映画、本物の映画なのだ
ビデオ	スクリーン	単純だけどマッキンリー、スイスアルプス、南米パタゴニアの氷河なんかの30年前の写真と現在の写真を交互にスクリーンに見比べるだけで背筋の凍る思いをしました
映画	スクリーン	また映像的には、映画の全編に渡って岡田くんのクロースアップが満載で、あのドでかいスクリーンに映るどのお顔も美しく、また非常になまめかしく、ストーリーやセリフに集中できなかった事もしばしば
映画	スクリーン	映画館で宮崎作品や大友作品以外にアニメ作品を観るなんて、子どもの時にいった、おっすおら┣ ̈┣ ̈┣ ̈┣ ̈リアさんなドラゴンボール以来でしたまぁしかしなんでしょ、初めてバルト11の一番大きなスクリーンで観ちゃいましたww(仁義なき廣島に住んでる人じゃないと分からないかと思いますが
その他	スクリーン	スクリーンで検索を行いながら高解像プリントできるリーダプリンター機能に加え、 「PCインターフェースキット」(オプション)により高解像スキャンデータをPCへ 取り込み、電子データとしてのファイリング、画像加工など、活用領域をさらに拡張
ビデオ	スクリーン	この後まだUOに入って無いので断言はできないが、上の画像が白過ぎる感じに見えるほどになったので、その暗さ明るさもかなり改善されているかもしれない(私の輝度調整以前の場合では、攻略HPのスクリーンショット画像がどれも真っ暗で何が何やらさっぱり分からなかった
映画	スクリーン	ユイス展が終わりしだい、杉臣くんや涼ダラちゃんたちに二次会会場にスクリーンと杉スツールとアルバムを持ってきてもらい、ユイス展を宣伝するという設定で、二次会会場にきた温ダラの後輩である杉臣くんのユイスのプレゼンが始まると「それではスライドでユイス展の様子をごらんください」といって、温ダラのスライドを上映
映画	スクリーン	朗読のあいだ、背後のスクリーンには、オランダ語訳と英語訳のテクストが映し出され、また同時に、「詩人の眼」と題した写真のスライドショー(あらかじめ参加詩人に撮らせてある)が展開します
映画	スクリーン	現在、市内にはシネマハーヴェスト(8スクリーン)、シネマロブレ5(5スクリーン)の計13スクリーンが存在し、映画好きには恵まれた環境になりました
映画	スクリーン	遠くが見え難いからメガネをかけてるのですから、そのメガネをはずしたら、いくらスクリーン上にピントがあった画像を結像させてても「ぼやけて」見えるのです
その他	スクリーン	おうおうにしてそんな時、キャメラのレンズはカットが変わった時点で広角レンズに変わっているのだが、そのことはスクリーンの端の方に目をやると事物の姿が微妙にゆがんでいるので辛うじて確認できる程度である
ビデオ	スクリーン	前のリヒターの壁紙、すごく気になってしまって、えろげフルスクリーンでやらないから(さすがにそんな勇気ない)どうしても、どうしても気になるため壁紙変えてたんです普通の奴に
ビデオ	スクリーン	先日行われたシアトルマリナーズのホームゲームで、日本デーというのがあって、みんな漢字で野球と書かれた野球帽をもらいスクリーンには日本のプロ野球の映像が流され、「一番ライト、イチロー」と日本女性の場内アナウンスまで演出されていました
映画	スクリーン	このサウンドトラックで、スクリーンに映し出されたヒマラヤの素晴らしき自然と、我々が失いつつある(しかし決して失ってはならない)人間同士の「絆」に、思いを馳せてほしい
映画	スクリーン	個人的には第1部・第2部ともスペシャル・エクステンデッド・エディションDVDを所有していますが、やはり映画は大きなスクリーンで観るものですので劇場に行きたいと思っています
ビデオ	スクリーン	もちろん、リージョンフリーという本来の目的の他に、レンタルビデオ屋さんで借りたDVDや、日本製のDVDなども、高画質ハイビジョンTVの大型スクリーンに映し出して楽しんでおりました
ビデオ	スクリーン	そして掛け声の後すぐに会場が真っ暗になってOVERTUREが流れはじめ、ドーム横のスクリーンにはコンサートタイトルと会場とその日の日付けが映し出された
インテリア	スクリーン	ついたて/パーテーション/目隠し/間仕切り/屏風/折りたたみ/スクリーン/洋風/仕切り/衝立/和風/オフィス/和室/家具/雑貨/突っ張り/つっぱり/アイアン/木製/木目/パーティション/国産日本製/ウッド/木/しきり/スクリーン/日よけ/麻/おしゃれ/収納/インテリア/パネル/天然木/無垢/
ビデオ	スクリーン	アンプマイク、テレビ(27インチ)、VHSビデオデッキ、OHP、スライド、移動式スクリーン、固定式スクリーン、プロジェクター、ホワイトボードなどをご用意しております
映画	スクリーン	・・・レスやアクセサリー、全体の細かな場面や風景・場所・・・部屋の家具やインテリアなどなど、見逃してしまうので隅から隅まで大きなスクリーンで、全部見たいんです
その他	スクリーン	昨夜の寒さがウソのような暖かさとなりスクリーンテントの中でのんびりしていたが、10時近くなってしまったのでテーブルとイスを残して後片付けを始めてみると、みなさん慣れているせいかあっという間に何もなくなってしまった
映画	スクリーン	もちろんコスト的には贅沢と言って良いのかもしれないが、それでもやっぱり家でテレビやパソコンの画面で見るのと、映画館の大スクリーン、そして音響にあの映画館な雰囲気で視聴するのとは全く違う
ビデオ	スクリーン	ソフトレザーのシート、26cmの座席収納型ビデオ・スクリーン、設置場所の調節ができる大型テーブル、独立したオットマン・タイプのフットレストなど、最上級のラグジュアリーをご提供します
ビデオ	スクリーン	大スクリーンの方はコントラストはなかなかいい感じですが若干画質が粗く、サブモニターは映像はキレイ(滑らか)に見えるものの直上にあるライトが当たっているため見づらい、とそれぞれに利点と難点があります
その他	スクリーン	MRAVの大きな特長は、音の距離制御ができるアレースピーカーをスクリーンの裏側に規則的に並べて、3D映像と連動しながら再生することができる点です
インテリア	スクリーン	ウィンドスクリーンについてはゼムクリップ等を細工し、径の固定+持ち上げるハンドルのような部品を自作すれば、着脱~火力調整の作業が簡便になるだろうし、ひょっとすると調整レバーにZ型のアングルを持たせスクリーンと地面の隙間から調整、なんてことは出来ないであろうか
ビデオ	スクリーン	お華束の型抜きも終わり昼食ですが、住職から「庫裡建設ブログ」をスクリーンに写し、厨房コンセプトを説明し調理台ご寄進してもらえないかと願いしました
映画	スクリーン	17日には、「あなたの大切にしている大学生活の一場面」をテーマにした写真を大夜祭ステージのスクリーンに映し出す『ワタシ×今×大夜祭』という写真コンテストがおこなわれます
その他	スクリーン	そのためには、施設は基準性能を備えた撮影機器を使用し、X線装置、スクリーン/フィルム・システム、自動現像機などの適正な選択と処理、ポジショニング、乳房圧迫などの撮影技術を最適化しなければならない
映画	スクリーン	先日、春の写真教室を開催しまして11名の参加者と渓流、ツツジの撮影会や100インチのスクリーン、ビデオプロジェクターを使っての写真教室を行って大変好評でした
ビデオ	スクリーン	Joostは世界で初めて高品質のフルスクリーン映像を、インターネットを通じて配信する新しい時代のテレビ局であるが、配信コストを抑えるためにP2P技術を活用する
カメラ	スクリーン	また、Citéはアトリエの他、共同スペースとしてビデオ、スタジオ、リトグラフ工房(工房には大きなプレス機も)、シルクスクリーン工房、写真スタジオ、ギャラリーなどがあります
カメラ	スクリーン	当社はスクリーン用・グラビア用写真製版に始まり、現在では、メタルマスク・ガラス乾板・フォトエッチング加工・基板用フィルム作成まで行っております
映画	スクリーン	22歳で、新人で、しかも映画の試写会で、なんと、スクリーンの前で歌うということは、さぞかしプレッシャーもかかり、かなりの緊張を強いられたことでしょうね
