# 映画: 映画を映す幕。銀幕。転じて、映画・映画界。, ビデオ: テレビ・レーダーなどの画面。, カメラ: 写真製版に使う、黒色・網目状の線を引いたガラス板。, インテリア: ついたて。間仕切り。
映画	スクリーン	毛利ライブラリーから当時の動画を編集して上映しましたが、琢磨君の弁舌に思わず会場からスクリーンにヤジが飛び、それはさながら弁論大会のようでした
映画	スクリーン	遥か頭上から足もとまで広がる大スクリーンに、雄大な風景が映写され、しかもそれが立体的な映像として見えるんですから、映画の内容以前にこれは一見の価値あり
ビデオ	スクリーン	スクリーンには、バシャバシャという盛大な水しぶきの中で、片手バタフライを左右交互に繰り返しているがごとく、エントリーのたびに頭と手を水中に押し込み、身体もそのたびにグラグラ動いている、という『ザリガニ泳法』が映し出されているのだ
映画	スクリーン	324スクリーンで封切られる日本では、ジャパンプレミアが東京・六本木ヒルズアリーナで行われ、マイケルさんの盟友として知られ来日中のライオネル・リッチー、伊藤由奈、黒木メイサ、松下奈緒、加藤ミリヤ、CHEMISTRYらが出席した
映画	スクリーン	アトラクションは3つのスクリーンがあり、そのスクリーンでメガネをかけることで3Dの立体映像としてみることができるムービー(アニメのオープニングともう1本)を見る、5分程度のものであった
映画	スクリーン	それにしても、列車の周囲を映す映像だが、誰が見てもお世辞にも本物には見えず、それが映像スクリーンであるのは明白であるが、それを出演者が本 物と思って演じているのは、皮肉にも滑稽である
映画	スクリーン	約7万m2という広大な敷地に、本格的な品揃えを展開する西宮阪急、12スクリーンを擁する阪神間最大規模のシネマコンプレックスTOHOシネマズ 西宮OS、デイリーユースに対応するイズミヤを核とし、大型7店舗を含む268の店舗が一同に揃う西日本最大のショッピングセンター「阪急西宮ガーデンズ」
インテリア	スクリーン	お客様だけのオーダーメイドですから、カーテンだけでなく、ローマンシェード、ロールスクリーン、プリーツスクリーン、ブラインドなどの 様々なウィンドウトリートメント(窓の装飾品)からトータルコーディネートもOKです
その他	スクリーン	アカデミー賞短編アニメーション部門を受賞したパテル、シュールなテーマをフィルムに傷をつけて映像化したリーフ、ピンスクリーンという独特の手法でモノクロームの映像世界を作るドゥルーアンの3人の作品を収録
映画	スクリーン	スクリーンなど、大画面で鑑賞すると画面の揺れが気になるかもしれないが、画面の一部を意識するとより気になってしまうので、変に意識せずに鑑賞するとそのうち気にならなくなってくる
インテリア	スクリーン	これ、ぱっと見で何のことなのか判らず、プリーツスクリーンという製品はブラインドと言われていたものが差別用語か何かで使えなくなって、そう呼ばれるようになったのかなートカ思っていたのですケド、違うようですー
その他	スクリーン	日本に輸入された当初は、直径2インチの大きな丸型のウィンドスクリーンに、「テレビ放送の画面上では、体格の小さな日本人ボーカリストへの利用に違和感を覚える」と評された時期もあったが、現在では放送局・視聴者・技術者ともに広く受け入れられ、「定番」機種として普及している
ビデオ	スクリーン	今回は日常的にスクリーン・リーダーを使用している辻の協力の下、alt属性値に半角スペースや全角スペースを指定した場合のユーザーエージェントによる変化を下記のような条件で検証し、何故スペースが推奨されるのか、そして実際にはどうするべきなのかを考えてみました
映画	スクリーン	主演の仲根かすみはセリフがなく、登場時間は余り長いものではないが、逆に恋人を失った青年の断ちきれない想いの象徴としてスクリーンを飾り、人間っぽく見えないように気をつけたという演技で、若手演技陣がぶつかり合う作品の中で存在感を示している
映画	スクリーン	ティム・バートン監督、ジョニー・デップ出演のディズニー映画『アリス・イン・ワンダーランド』が、4月17日から全国855スクリーン(3D:459スクリーン、2D:396スクリーン)で公開され、オープニング2日間の観客動員が82万8149人、興行収入が13億1653万9200 円を記録する大ヒットとなっ
映画	スクリーン	映画化された兄慎太郎の芥川賞作品「太陽の季節」において、チョイ役としてスクリーンを横切っただけであったが存在感を見出され、「狂った果実」に主役出演し、戦後の大スター石原裕次郎は誕生した
インテリア	スクリーン	ショップ外観は、レンガ調タイルで甲子園球場の伝統感を表現しながら、大型ガラススクリーン等でモダンにアレンジし、内装は、スケルトン天井の空間のなかに、淡色系カラーや木目を多用し、「ダイナミック」かつ「ナチュラル」で「軽快」なイメージを演出しているという
その他	スクリーン	スクリーンの前に椅子を動かしてラクスとバルトフェルドが座る、ラクスの隣にアスランが立ち、イザークとディアッカは並んでいる椅子の好きな場所に各々座った
映画	スクリーン	観たい映画が自由に選べる9スクリーン、最先端の映像・音響設備でハイクオリティな映像体験をお楽しみいただけるまったく新しいエンターテイメント・スペースです
映画	スクリーン	急にライトハウス・ビーチ(Lighthouse Beach)で見たアンナさんのヌードが思い出されてきて、スクリーンのシャーロット・アレクサンドラに重なったのですよう
インテリア	スクリーン	そしてこのTOEX「プラスG」スクリーン縦格子は1974年に東洋エクステリア株式会社を設立し、 アルミのエクステリアメーカーとしてゼロから再スタート
ビデオ	スクリーン	(アクアさん) 壁紙に掛け時計(然会さん) てけつつうらい(響わたるさん) 青自動的に名前付けをする機能、ホームスクリーンやロック画面、壁紙のカスタマイズなど様々な機能が用意されている
インテリア	スクリーン	ミツマタ、コウゾ、ガンビなどの植物繊維を原料として作られている、 日本古来の紙で、建築の分野では、襖紙や障子紙、壁紙として使ったり、 照明のシェードや、窓まわりのプリーツスクリーンなどに使用されます
映画	スクリーン	全国100スクリーンで封切られた2月20日、行定監督をはじめ主演の藤原竜也、香里奈、貫地谷しほり、林遣都、小出恵介が、東京・渋谷シネクイントで行われた初日舞台挨拶でファンに報告した
映画	スクリーン	好きな映画にインスパイアされた場面を入れる、好きな映画・または物語に関連のある作品を登場人物が (スクリーンやテレビで) 観ているシーンを入れる、好きな作品のポスターが登場人物の部屋などに貼ってある
その他	スクリーン	DOFアダプタっていうのは35ミリ写真レンズなどをスクリーンを間にはさんでビデオカメラに装着するものようはレンズが取り込んだ光をスクリーンに投影してそれをiPhoneで撮影するというものです
映画	スクリーン	スクリーンから伝わる不思議な乾いた空気、そしてこの映画の最大の魅力は "舞い降りた天使"のような無垢な主人公ベティ・サイズモアのキャラクターだ
映画	スクリーン	ちょうどその時ディクトでは「スターウォーズ」のデジタルリマスター版を上映していて、自作の上映前に、それも見た監督は、この映画を高校のとき見て映画監督になろうと思った一本だそうで、そのスターウォーズを映しているスクリーンに自分の「キュート」が映ることにとても感激していたことを憶えている
ビデオ	スクリーン	上記以外にも、サーバ集約・統合のためのサーバ室整備、活発なディスカッションを実現するための壁面にスクリーン兼ホワイトボード素材の採用や照明制御を可能とした会議室整備、情報セキュリティとビルセキュリティの本人認証をICカードに一本化など、建築と融合化したIT基盤整備を実施している
カメラ	スクリーン	写真の上にスクリーン・トーンを貼りこむように、さまざまなパターンをフィルム上に合成する作業は、彼のキャリアにとっては特殊なことではなく、ごく自然ななりゆきといえよう
映画	スクリーン	正直内容や細かい点でツッコミどころがないといえば、まぁうそになりますが、TVの前後編や、2時間スペシャルとはやっぱり作りが違って「スクリーン」を意識した画面作りで、「相棒」という作品でそういったものが観られただけで、結構大満足でした
映画	スクリーン	私はこの映画のスクリーンに映し出された方全てが大好きです、そしてこの映画を愛している方々、このMBの方々もこの映画に出演された全ての方を好きになられたと信じています
ビデオ	スクリーン	)ことから、民生用(~200インチまでのスクリーンサイズ)の製品に対してランプ単体価格で4倍、使用電力で2倍以上のキセノンランプを導入するメリットはないという判断で、高圧水銀ランプの採用に至ったとのことでした
ビデオ	スクリーン	映画は、劇場で見るだけの娯楽商品から、DVD、ゲーのベース、ライセンス商品、そしてパチンコのスクリーン画像へと、年々様々な進化を遂げながら、姿を変えて世界中の人々と触れ合ってゆくのでしょう
ビデオ	スクリーン	開氏らは、4〜10ヶ月の赤ちゃんに、おのおのの足を撮影したリアルタイムの映像と、同じ映像でも2秒遅らせて実際の足の動きとはズレがある映像を、スクリーン上に並べて同時に見せた
映画	スクリーン	井上さんと應矢さんがコラボレーションで制作した作品で興味深かったのは應矢さんが制作した映像をスクリーン(井上さんが制作したもの)に映したら前から見る映像と裏から見る映像が全くと言っていいほど違うのだ
映画	スクリーン	スピーチのさいちゅうに思い出のしゃしんをながしながらはなそうとおもっていたのですが、昨日かんじのこがお店側にきいてみたところ、スクリーンでしゃしんは流せないとのことでした
映画	スクリーン	スクリーンに画像を映し出すために撮影しているカメラマンを、乱入者が押し倒しているところ(カメラマンが必死に倒れながら取り押さえているところ)を、ジョンが見てしまった直後に怒ったのですから・・・
カメラ	スクリーン	アンディー・ウォホールを初めとしたポップアーティストが多用したのもシルクスクリーンで、現代芸術を代表した明快で力強いその色面表現は、グラフィックデザインの分野にまで影響を及ぼしています
映画	スクリーン	確かに数万パーツが一瞬にしてトランスフォームするシーンや、「スクリーンで何が起こっているのか分からない」というクレームが出るほど猛烈なスピードの戦闘シーンなど、ストーリーよりも特殊効果やカメラワークの斬新さが話題になった前作ではあったのですが・・
カメラ	スクリーン	光の粒がスクリーンに滲み、それが消えては光り、を繰り返していくのですが、この光源がさまざまな写真のフィルムを透過してきていることを知ると、そこに収められたさまざまな光景がすべて一様に「光」へと還っていくようなイメージが沸き起こってきて、不思議な感慨が心のなかに広がっていきます
映画	スクリーン	まったく魅力を失ったスーパーX2 、ゴジラのテーマがドラクエ2のシドーと同じだったすぎやまこういちの音楽、そして破壊兵器の笑顔がスクリーンを凍らせたラストで心底ガッカリして帰ってくる
カメラ	スクリーン	一般に印 刷版は導電性のスクリーン版を用い、被印刷物を介して対向電極間に電圧を印加し、スクリーン版上に供給したトナーインキを被印刷物に転写させる
映画	スクリーン	東京タワーが完成した昭和33年の東京・下町を舞台に大人と子どもの心温まる交流を描いた作品で、スクリーンにはテレビや冷蔵庫が初めて家に来たときの感激ぶりを活写した場面など、人びとの郷愁を誘うシーンが次々と登場する
その他	スクリーン	例えば、スクリーン上で1m先の被写体にピントを合わせているけれど、実際には90cm先にピントが合っている状態は前ピンの状態ですが、それを解消するためには、被写体からスクリーンまでの距離を短くすべく、ネジを緩めて表面鏡を前に迫り出すようにします
映画	スクリーン	リモコンの操作一つでスクリーンが降りてきて、照明がだんだんと落ち、スピーカーなどの機器類の電源が入り、煩雑な準備なくリビングはホームシアターに早変わりします
映画	スクリーン	鍋等の煮炊きができますし(食堂以外での焼き肉は厳禁)、大広間にはテレビやスクリーンもありますので、そこを借りてスライドショーやビデオ上映をしている人達も多いです
インテリア	スクリーン	スクリーンを設置しない例では、放流流量が24%低下したが、スクリーンを設置した例では、放流流量がほとんど低下しなかった、だからスクリーンを設置すれば問題は解決するというものである
映画	スクリーン	このシーンは、女生徒 が相手の女生徒に腕を回して、ただ優しく抱いてあげるだけのシーンなのだけど、そんな想いがスクリーンに溢れてきて、観ていてとってもヤらしく感じたの だった
その他	スクリーン	寝返りを打つと漆黒の闇の果ての、その又果ての地平線から忽然と甦ったのが東田町の従姉の家の一室の、読書していた昔のわたしの姿と、道玄坂を歩いていた友人との二人の姿だが、その前後の記憶がしかしいつまでも思い出せぬまま、この二つのわたしの姿は闇のスクリーンに暫く映っていた
ビデオ	スクリーン	すべてのデータが消えたかに思えたが、動画や写真、スクリーンショット画像などが「証拠品」として他のユーザーに保存され、インターネット上に公開された状態となっている
その他	スクリーン	高級フィルムカメラの交換式ファインダースクリーンには、精密合焦用に例えばニコンならFシリーズ用のM型(十字線透過型)やC型(十字線マット型)というタイプがあります(同じニコンでもデジタルのDシリーズには全面マット型しかないようです)
映画	スクリーン	この、スクリーンに映し出された映像を、偏光フィルターに対応した、偏光レンズのついたメガネで見ると、右目用の画像は右目のみに、左目用の画像は左目のみに入ってき、映像がよりリアルに、さも具現化されたような迫力を楽しめるのです
ビデオ	スクリーン	960 x 640ピクセルのバックライトLCDディスプレイは、1インチあたり326ピクセルの高密度を持ち、これまで存在した携帯電話のスクリーンの中で最も高い解像度を誇ります
映画	スクリーン	大型スクリーンを使った演出もできるので賑やかで楽しいパーティーになること間違いなし♪ホットペッパー読者限定で15名様以上でパーティーコースご利用で『2名様分無料』or花束プレゼントの特典も付けちゃいます
映画	スクリーン	うちに立派なホームシアターがあるのなら話は別だが、14インチのテレビデオで見る映画のビデオと、暗い映画館の大きなスクリーンで見るほんものの映画は似て非なるものだと思う
その他	スクリーン	ここではテーブルの上にあるカメラで自分の顔を撮影すると、前のスクリーンに自分の顔をひとつの素材としてシルクスクリーンのようにしたり、MUSEUM1のらせん階段の窓を全部自分の顔にしたりと遊ぶことが可能です
その他	スクリーン	アキレスの建築・土木用 内装材 壁紙 「ロータリースクリーン製法」は円筒状のスクリーンを用いペースト状の樹脂を印刷発泡させる製法で、「グラビア・エンボス製法」は壁紙ベースの上にグラビア印刷とエンボスで意匠を施す壁紙を作る最も一般的な製法です
その他	スクリーン	さらに、ファインダースクリーンが交換可能な一眼レフであれば、大判カメラのピントグラス(ファインダースクリーン)がそうであるように、全面マットのファインダースクリーンに交換するなどの工夫もしてみてください
映画	スクリーン	映像の方はすぐに大きなスクリーンに映写できるようになったが、真空管による電気的増幅が可能になるまで、観客席全体に響くような大音量を出すことはできなかった
ビデオ	スクリーン	オンラインゲームなどの中には、特定の操作でスクリーンショットを撮影し、自動的に指定されたフォルダに画像データとして保存する機能を持つものもある
映画	スクリーン	DVDの解説によれば、フランスコープという撮影方法の違うシネマスコープが用いられたワイドスクリーン作品であり、出演者が歌わないミュージカル映画としても知られた作品です
インテリア	スクリーン	立川ブラインド工業(株)では、今年3月に発売した全30色の高機能でカラフルなファブリック「マカロン」について、これまでの「ロールスクリーン」、タテ型ブラインド「ラインドレープ」に加え、「プリーツスクリーン ペルレ」「クレアス ローマンシェード」「クレアス カーテン」での対応を9月14日(月)よりスタートした
ビデオ	スクリーン	シンプルに大画面のビジュアル空間を実現する壁掛け型スクリーン【送料無料】WAV−110HDC 壁掛け型スクリーン幕面ホワイトマットアドバンス仕様 110型ハイビジョンサイズ★全品ポイント10倍
映画	スクリーン	そのあとは、写真家の望月宏信氏、現代美術アーティストの奈良美智氏が相次いで登場し、自身の作品をスクリーンに投影しながら、写真との関わりや「GR DIGITAL II」の印象などについて語った
映画	スクリーン	ひろあ様、6月公開のこの映画、あまり宣伝を観ないんですよ〜・・・映画会社の小さな試写室よりも、やっぱり大きなスクリーンで音響設備も整っているところで観たい映画のひとつでした
カメラ	スクリーン	スクリーン印刷の場合は、粘度が低すぎるとスクリーンにインクを保持しにくいので、むしろ粘度がある程度高い方が好ましく、インクに含まれる粒子の粒子径は大きくても特に問題はなく、また、粒子径が小さい場合は溶剤量を低減することが好ましい
映画	スクリーン	会話がアニメの話題になったところで、ニトロプラスとGONZOがコラボレートしたTVアニメ作品『BLASSRETTER』(現在好評放送中)のプロモーションアニメをスクリーンで上映
映画	スクリーン	この他にも、エプソン・ホームプロジェクター「ドリーミオ」はゲーム機やPCとの接続も簡単ですので 大画面でゲームを楽しんだり、インターネット経由でPCからTV放送や映画や音楽などを楽しむ事ができますし USBメモリやデジカメなどを接続してPCなしで写真をスクリーンに写してスライドショーを見ることもできます
映画	スクリーン	◆ベッドは大きめセミダブルサイズのツインこれはシモンズ製、 そしてシーツは肌触りのやわらかな【パーケル素材】 〜ベッドに横たわれば、2m×3mの窓が大スクリーンのパノラマが・・・〜 天気の良い日には朝日を浴びながらのモーニングコーヒーを
その他	スクリーン	2009F/Wでは、写真家ジェラルド マランガの作品からインスパアされ、60年代にアンディウォーホルを中心としたファクトリーで撮影していた『スクリーンテスト』をマランガ本人とともに続編ともいうべき観点で再現し、コレクションを披露した
カメラ	スクリーン	」と思うような大胆なレタッチを原稿写真に施してあるのに驚いたが、それに粗いスクリーンをかけて写真製版したものが見事に現実味ある仕上がりになっているのを見て舌を巻いたものだった
ビデオ	スクリーン	【従来の技術】従来より、映像を表示する映像表示装置には種々あるが、大別すると、例えば、陰極線管(CRT)や液晶ディスプレイ(LCD)等の表示面に映し出された映像を見る直視形の装置(直視形映像表示装置)と、投写管(CRT)や液晶表示デバイス等に表示された映像を投写レンズや反射ミラー等からなる光学系を介してスクリーン上に投写する投写形の装置(映像投写装置或いは投写形映像表示装置)とが存在する
その他	スクリーン	このカメラは、インスタントリターンミラーではなかったが、ペンタプリズム交換式、ファインダースクリーン交換式、電気式モータードライブ、ぜんまい式ワインダー、250枚撮りマガジンなど世界に先駆けたシステムカメラだったのだが、今ではまったく省みられていないと言うか、不思議なほど陽が当たっていないカメラで不思議
その他	スクリーン	弊社「ストックバイオリアクターシステム」は前処理装置で多段型傾斜スクリーン分離機、加圧スクリュー分離機等の固液分離装置を採用しており、排出される排水に合わせて処理を行うことによりスムーズな排水処理を可能にしています
映画	スクリーン	この分科会そのものが、スクリーンの位置、聴覚障害の参加者の座席、机と椅子の配置、通訳者の立ち位置と向き、発表や質疑の際にどちらを向くか、どのくらいの速度で喋るのか、当然手話の出来る者は手話を極力使う、といった様子で情報保障の小さな実践の場になりました
映画	スクリーン	ぴあで紹介されていたから行ってみたのだけれど、入ったら暗い部屋にスクリーンがあって、5分くらいの長さの「パフォーマンス・ビデオ」がループ再生されていた
映画	スクリーン	また、ドーム状大型スクリーンへのプロジェクタ投影画像のコントラストシミュレーションの実例を紹介し、さらにBRDFを考慮した色再現シミュレーションの方法について説明を行う
映画	スクリーン	また、1曲ごとにアニメーションや実写などオリジナル・イメージ映像が後方スクリーンに映し出され、音と映像のハーモニーを生み出していく様も、映像喚起力豊かな彼らの音楽性にはぴったりだった
