# 映画: 映画を映す幕。銀幕。転じて、映画・映画界。, ビデオ: テレビ・レーダーなどの画面。, カメラ: 写真製版に使う、黒色・網目状の線を引いたガラス板。, インテリア: ついたて。間仕切り。
映画	スクリーン	そこに小さな三点セットを入れ、机をはさんで、椅子を向かい合わせて並べた机の上には、スライド・プロジェクター、その反対側の壁には、黒板を一つ、その半分を白く塗りつぶし、スクリーンの代わりにし、黒い部分は、説明用の黒板にした
ビデオ	スクリーン	■ 帰りがけ、バンダイとサンライズの共同ブースを覗いたら、大スクリーンで昔のアニメのダイジェストムービーが流れてて主題歌も流れてたのでしばし観賞
ビデオ	スクリーン	彼は、まだ文字が見えましたので、パソコンの画面を大きくしてやれば目が不自由でも教える事ができるのではないかと思いまして、パソコンの前にスクリーンを用意して画面を大きくしたのです
映画	スクリーン	うらぶれた少々トイレ臭漂う館内とスクリーンに映る香港の猥雑さは奇妙にシンクロし、まるで空間と映像が混ざり合ってしまったような不思議な感覚を覚えました
ビデオ	スクリーン	当社は米国RGBスペクトラム社の代理店として、最大3X4の配列に12個のスクリーンを構成し、その上に最大30のグラフィックス画像とビデオ動画を同時表示出来るMediaWall 4500、および最大2X4の配列に8個のスクリーンを構成し、その上に最大12のグラフィックス画像とビデオ動画を同時表示可能なMediaWall 4200を同時発売開始しました
映画	スクリーン	「映画の日」の発表では、閉館したシネコンの具体名は挙がりませんでしたが、これはワーナー・マイカル・シネマズ高岡(1月12日/6スクリーン)、シネマックス足利(2月27日/8スクリーン)、橿原シネマアーク(4月30日/5スクリーン)の3つのはずです
映画	スクリーン	コンパルホールの車椅子スペースは一番後方でスクリーンからかなり遠い為、車椅子ごと階段をスタッフの方々に上げ下ろしして貰ってホール中央の通路で拝見させて戴きました
ビデオ	スクリーン	これによると、フルスクリーンのコードが記述されたWebアプリだと、Safariのインターフェースをまったく表示せずに、Webページの配信ができるようになります
ビデオ	スクリーン	マウスボタン長押しでメニューをポップアップさせると、その後スクリーンのコーナーにマウスをもっていってもスクリーンセーバーが起動しなくなってしまうという不具合を修正した
映画	スクリーン	3D作品なので凶器や飛び散った肉片が飛んでくるのだが、面白かったのは3D映画を観ている観客が、その映画内の爆発シーンと同時にスクリーンの向こうが本当に爆発
ビデオ	スクリーン	スクリーンに映し出されたアームストロング少佐によるイベント注意事項の後、カウントダウンが開始され、カウントが0になった瞬間、ステージ上の幕に出演者達のシルエットが浮き上がり、会場のテンションはいきなりマックスへ
その他	スクリーン	ミラーもピントスクリーンもペンタプリズムもないから、「レフ」じゃないことは確かだけど、「一眼じゃない」と言えるのか、一眼とは撮影用レンズを通して見ている画像をそのままファインダーで見られるという意味なら、間違いなくそうです
ビデオ	スクリーン	ザ・レギュラーを歌う前にみんなで最後の円陣を組んでるのを見てジーンときて京介君たちが泣いてるのをスクリーンのアップで見てついに泣いちゃいました
映画	スクリーン	この写真集は2003年1月(奥付は2月になってるけど)、オードリー没後10年に近代映画社から追悼出版された「スクリーン特別編集 永遠のファッション・リーダー オードリー・ヘプバーン スタイル」という写真集です
ビデオ	スクリーン	ステージ上のスクリーンに、妻のクラウディアさんが趣味のフラダンスを踊る姿や、娘のアンナさんの小さいころの写真、孫娘の写真などが映し出されると、「家族に支えられている」と顔をほころばせた
映画	スクリーン	特にコング村はそのまま観光コースと化し、スクリーンではパブとしてお馴染みになった雑貨屋は、中では雑貨屋を続けながら外にはパブの看板を掲げて観光客の記念撮影に貢献しているそうだ
映画	スクリーン	スクリーンに映し出されたスライドの写真に、「これは○○さん」「あっ、道場や」など養気園時代のことを知る養気園職員のOBが皆無な中にあって貴重な証言が聞けました
映画	スクリーン	ファッション・雑貨・レストランなど180の店舗や、10のスクリーンを備えた映画館、アミューズメント施設などのテナントを集積し、今秋のグランドオープンを予定している
ビデオ	スクリーン	SONYのαマウントに全て対応してますので、純正のマウントアダプターを用いて装着して、フルスクリーン解像度の360x180°フルスクリーンパノラマ撮影は可能でしょう
ビデオ	スクリーン	今回は試しに全部、見えているものを、「わざわざ」カメラを通じてスクリーンに映し出すと、その拡大され、そしてフレームのある映像は、舞台全体のなかでどんな具合に見えるかを試してみたかったのだ
映画	スクリーン	また、再びスクリーンに過去の2人の映像が映された時には、そこに映画『卒業』のシーンが織り込まれ、アン・バンクロフト演ずるミセス・ロビンソンのアップで映像がフリーズして1969年のグラミー賞受賞曲“ミセス・ロビンソン”(映画のサントラにも使われた)に入るという凝った演出もあった
ビデオ	スクリーン	2009年10月01日BMW Osakaが2周年を記念したプロジェクトを始動谷町筋のショールーム・ウィンドーを巨大スクリーン化10月からショールームを映像媒体として活用開始
インテリア	スクリーン	また、スクリーンやアルミ・木製のブラインドなどを「ハード・トリートメント」と言い、窓まわりをすっきりと見せ、クールでモダンなインテリアになります
インテリア	スクリーン	ここで一つ一つ詳しい紹介はできないが、たとえば、トーネット家具の場合、一列に並べた椅子の前に白いスクリーンを立て、裏から光をあてて曲木家具特有の曲線をシルエットで見せる展示が行われていた
その他	スクリーン	きめ細かさこそ画素数で上位モデルに負けるが、画質の捉え方、割り切り方、それにコントラスト(ガンマ)の作り方、いずれも確かな考えでまとめられている点をスクリーンが引き出すのだ
ビデオ	スクリーン	できればスクリーンショットを添付してより詳しい状況を説明したかったのですが、スクリーンショットのやり方を忘れてしまい、添付することができませんでした
ビデオ	スクリーン	ところが、日本の場合は平和教育のためにスクリーンの中で戦争のまねごとをしているのであって、本職の軍人から見るとありえない設定や奇妙な映像が氾濫している
映画	スクリーン	オビ賞を受賞したロジャー・グァンバー・スミスによるオフ・ブロードウェイでの一人舞台に1960年代当時の記録映像、様々なブラック・ムーヴィーからの場面をスパイク・リーが編集してスクリーンに映し出す
その他	スクリーン	会社名:大連好利維尓科技発展有限公司資格書:国家建築部より「甲級知能化システムインテグレーション專項工程設計単位」認定、公安部指定された「専門的なセキュリティー工事設計、施工のハイテク企業」主な業務:LEDスクリーン、ソーラー式小型LED照明灯、太陽エネルギー製品など主な事業所:全国各省の省都に弊社はお客様の立場より、実際状況と結び、新事業に踏み出し、企業発展に適宜な数おくの項目を導入しました
ビデオ	スクリーン	ウィンドウをスクリーンのぴったり上端に置きたい理由はたんとあるが(それはスクリーン上の不動産を最大限にするから)、スクリーンの上端とウィンドウの上端を2ピクセルだけ空ける理由というのはないからだ
映画	スクリーン	講義では、岩手・宮城内陸地震でひっくり返ったピアノや寸断された道路などの写真をスクリーンに映したほか、地域住民が協力して家具の固定を進めている事例を紹介、「一人暮らしのお年寄りの家などは地域で家具の固定を [続きを読む]
映画	スクリーン	2階になっている映画館なんてどこにでもありますが、バルコニー席などもあって、メインスクリーンはなんだかゴテゴテにデコレーションされたゴージャスな様相
インテリア	スクリーン	他にウッドブラインドやプリーツスクリーンと組み合わせてもいいし、それをレース代わりにしてカーテンと組み合わせてもいいし、いろいろできちゃいますよね
映画	スクリーン	創刊1号の表紙に当時の夢のホームシアター(リビングシアター)の写真が掲載されているのですが、正面にスクリーン、3管式プロジェクター、手前のデスクの上にカセットデッキ、5インチFDドライブ、そしてAppleIIが鎮座ましましています
ビデオ	スクリーン	6インチ液晶ワイドスクリーンで最新の映画を含む100本の映画、180番組以上のテレビ番組700枚のCDならびに20をこえるラジオチャンネル、3Dゲームをお好きなプログラムを好きな時にお楽しみいただけます
ビデオ	スクリーン	普通のスクリーンショットなので隠れている部分を撮ったりはできないですが、表示されている部分でよければコマンド+シフト+4なんて結構便利だったりします
ビデオ	スクリーン	ファーレントゥーガの更新が望めないのは残念ですが、スクリーンショットの掲載、拡張シナリオの配布などを快く許可してくださったのは有り難いことですね
映画	スクリーン	刺激的な著作を上梓された梅原賢一郎先生をお招きして、新著にインスパイアされた写真がスクリーンに写し出される中、松井利夫先生を聞き手にお話をしていただきます
ビデオ	スクリーン	しかし、贅沢な編成と豪華なゲスト・プレイヤー、更には背後のスクリーンいっぱいに展開する映像・・・と、プロセスしないといけない情報が多いステージにも拘らず、主役の存在感を放っていたのはデーモン
ビデオ	スクリーン	でも今日、ボクにもわかる彼の一言によって、ボクの頭の中は一瞬にして過去へとさかのぼり、ボクの頭の中のスクリーンには偉大なアフロのボクサーが映し出されたのです
インテリア	スクリーン	プリーツスクリーンの20ミリ巾の商品は実はヨコタ製だったとか、桐のウッドブラインドはひじょうに軽い木材だけど操作は軽くないとか、このウッドブラインドは国内初で防炎商品の認定を受けているけど価格は4割ほどアップするとかいろいろ書いておきます
ビデオ	スクリーン	1回生のころは、週に1回は映画館に行くという目標を掲げて、ほぼ実行していたが、2回生以降、そのパワーはなくなったので、せめて家でスクリーンと音響を映画館なみにして映画をみようというのがここ数年の目標だった
映画	スクリーン	(会場内にスクリーンが1つ&テレビが3台あるのですが、場所によっては画面がみれないので、プラズマテレビを借りてくるという方法もあるよといわれました・・・
ビデオ	スクリーン	県広報の意味も含めて、ロビー等にスクリーン(テレビ等)を設置する県内外の公的機関等に季節毎に「旬の映像」の季節バージョンを作成・配布し、日常的に富山の映像を流してもらっている
映画	スクリーン	映画芸術科学アカデミーは賞を贈る理由として、『スクリーンにおけるポワチエの優れた演技と独自の存在感に加え、その品位やスタイル、知性をもって映画界に貢献している』ことを挙げた
映画	スクリーン	Kazuneが奏でる音楽と、スクリーンやモニターに映し出された映像が創り出す独自のサブリミナルな空間は、ココロに焼きついた記憶を呼び覚ます・・・
ビデオ	スクリーン	計画では、戦艦「大和」の甲板や艦橋内部を再現したオリジナルCG映像のほか、宇宙航空研究開発機構(JAXA)の技術を紹介する映像などを大型スクリーンで放映するそうです
映画	スクリーン	写真を大きなスクリーンに順番に映し出すスライドプロジェクターは学校、会議などで活躍しましたが、今では軽量化が進み、B5サイズの家庭用のものまで登場して、以前に比べると使用範囲が広がっているようです
インテリア	スクリーン	道路交通庁JPJは、こういったカーカーテンやスクリーンは法律で禁止しているとして、「そういうカーテンをしていて捕まった者には罰金RM300を科す
インテリア	スクリーン	カーテン・ブラインドの単体使用はもちろん、バーチカルブラインド+カーテン、ベネシャンブラインド+カーテン、スクリーンボックスなど用途に応じて選べる製品を多数ご用意しております
インテリア	スクリーン	トーソーのブラインドと低価格良質のバーチカルブラインド、プリーツスクリーン、ロールスクリーンの商品である「コルト」が10月1日より発売されます
映画	スクリーン	季節に合ったテーマで“星”を存分に楽しむ「プラネタリウム番組」のほか、 ドーム型のスクリーンに360度に広がる迫力のCG(コンピューター・グラフィックス)映像で子どもにも人気の「CGプラネタリウム番組」、星空と香り(アロマ)と音楽に癒される「ヒーリング番組」、その他特別番組といったプログラムを1日にローテーションで上映する
その他	スクリーン	一眼レフカメラによっては、絞り込み(プレビュー)機構搭載の機種もあり、この機能を使えば、事前に絞りを絞った状態のファインダースクリーン上の像を観察できます
インテリア	スクリーン	カーテン以外にも窓まわりの装飾品としてロールスクリーン、プリーツスクリーン、ブラインド、バーチカルブラインド、ウッドブラインドなど各種取り扱っております
その他	スクリーン	常々、武藤は「お客さんがチケットを買って会場に入った瞬間からスクリーンが回ってドラマがスタートしている」と言っているから、DDTの8・23両国の中澤マイケルの肛門爆破によるオープニングの映像を観てもらい、さらには本屋プロレス、花やしきプロレス、新ブランドの『BOYS』(今後はBOYZに名称変更)、両国のメインのHARASHIMAvs飯伏の映像を観てもらった
その他	スクリーン	奇妙なもので、私のもう一台のバイクであるRF900Rではわざわざスクリーンをロックハートのモール無しのものに交換しているのですが、XN85では手間をかけてモールを復元しています
映画	スクリーン	(名古屋)中部東宝(株)(志知雄二社長)は、岐阜県本巣市に12スクリーンのシネコン・TOHOシネマズモレラ岐阜を4月27・28日ソフトオープン、4月29日 グランドオープンの予定で準備を進めている
インテリア	スクリーン	☆シーンを選ばないスクリーン♪ごちゃついた場所の目隠しにもGOOD☆サイズ変更も可能♪☆日本製☆5連スクリーン・H1700mm【ディスプレイ◆パーテーション★間仕切り★ゲージ★隠す◆癒し★カントリー家具■カントリー雑貨■カントリーファン■輸入家具■アメリカンカントリー家具】
映画	スクリーン	BMW Osakaが2周年を記念したプロジェクトを始動谷町筋のショールーム・ウィンドーを巨大スクリーン化10月からショールームを映像媒体として活用開始
映画	スクリーン	効果的な音響のためには、部屋の広さは少なくとも、8畳以上、スクリーン以外にも、さまざまなAV機器やソファーや、テーブルなどを配置することを考えると、10畳ぐらいのスペースはほしいものです
映画	スクリーン	映画製作大手4社でつくる日本映画製作者連盟によると、ピーク時の1960年に7457館あった国内の映画館(スクリーン数)は、93年に1734館まで減ったが、シネコンの隆盛で、05年末時点で2926館に盛り返している
映画	スクリーン	指を動かしたり、手を自由に動かす映像が、平面的なスクリーンに投影されるのではなく、両眼で三次元にモノを見ているようになるまでイメージカを高めてください
ビデオ	スクリーン	集中線やスクリーントーンなどは使わず、フォトショップでの単色色付けだから絵描き作業は楽だが、修正でせりふの長さが変わると 噴出しの場所と大きさを何度も調節しなくてはならない
ビデオ	スクリーン	中島美嘉 【一番綺麗な私を】PV動画視聴をもっと大きな動画で見たい場合は、だいたいの動画サイトで右下の「□」のような記号をクリックするとフルスクリーンになるので、大きな画像で 中島美嘉 【一番綺麗な私を】PV動画視聴できます
映画	スクリーン	スクリーンの光点は裏の壁に反射した映写機の光だと思うけど、フィルムの劣化とスクリーンの劣化だけでプロジェクター上映と見紛うばかりのクソ映写になるんだろうか
ビデオ	スクリーン	ところで、スコス・オリジナルグッズを作る際にスクリーントーンを使いたくて、スタッフに買ってきて〜と頼んでいたのですが〜月日も流れ流れて〜現在に至ります
ビデオ	スクリーン	THE イナズマ戦隊 【応援歌】PV動画視聴をもっと大きな動画で見たい場合は、だいたいの動画サイトで右下の「□」のような記号をクリックするとフルスクリーンになるので、大きな画像で THE イナズマ戦隊 【応援歌】PV動画視聴できます
映画	スクリーン	スクリーンを見ると二人に背を向けてしまうので(最前のブロックだったので)ずっと後姿を見つめていたのですが、逆光の二人をスタッフとして舞台の奥から見守っているような、不思議な気持ちになりました
ビデオ	スクリーン	トップページが別のに変ってしまわないうちにいちおうこそこそスクリーンショット保存:2004年1月末現在の映画秘宝のサイトのトップページの画像(PNG画像、780*574px、約110KB)
映画	スクリーン	14もの主演女優賞を総なめにしたイメルダ・スタウントンは、悲しい運命に打ちくだかれる姿を圧倒的な演技力で演じきり、観客をスクリーンに釘付けにする
映画	スクリーン	ホーム・ムービーといえば、 今やビデオテーブに記録するのが普通ですが、それ以前は写真同様、フィルムに映像を焼き付け、テレビモニタではなく、現像したフィルムを映写機にかけて、スクリーンに映し出して様々な思い出を再現したのでした
ビデオ	スクリーン	特許文献1には、これらの複数の画像を合成した画像を大規模スクリーンに表示させるとともに合成画像に基づく動画ファイルを生成する講義ビデオ作成システムが記載されている
映画	スクリーン	また11スクリーンを備えた映画館(CGVカンビョン)、ディスカウントストア「ロッテマート江辺店」、ショッピングモールなど多種多様なショッピングスペースがそろっていますのでみなさんも是非一度来てみてくださいね
映画	スクリーン	リビングスペースはソファベッドとコーヒーテーブル(ちゃぶ台として使用)がぽつんと置かれているだけで、広大な壁面は何も飾らずプロジェクタ用スクリーンとして確保されている
映画	スクリーン	会場内のスクリーンで、そのきのこさんチョイスによるすてきなキノコ写真たちのスライドショーが映される中、スパークリングワインなど傾けていると、トークショーがスタート
その他	スクリーン	アンビエントオクルージョンは、スクリーンの1ピクセルに対してレイを飛ばし、その交差した交点位置(交差位置X、法線N)より半球上に複数のランダムな向きのレイを飛ばして背景にたどり着いたか物体にぶつかったか、の割合を最終的なピクセル色にかけて影をやわらかくする手法です
映画	スクリーン	「映画はスクリーンで見なきゃ」というハードコア志向の諸兄から、「映画作ってるよ」という未来の大物監督まで、皆さんに活用してもらえるサイトを目指します
その他	スクリーン	で最近は技術的に煮詰まってきた上PCの高性能化のおかげでフォトショップ上での処理である程度回避が可能ときいておりますしそれ以上クオリティの高い物が要求された場合フィルム刷版では管理が難しかった高精細度やFMスクリーンで対応すれば良くなってきたからでは、
ビデオ	スクリーン	舞台を観客席の一点からずっと観ているよりも、数台のカメラがこれぞ見せどころというところを撮り、編集した映像を巨大スクリーンで観ることができるうえ
ビデオ	スクリーン	このように、今後、エンタープライズIT市場で一大勢力となりうる潜在能力を持ちながら、グーグルはこれまで“レーダーのスクリーン”に映っていなかった
ビデオ	スクリーン	スクリーンで写した写真は、広島WSイベントの際のスナップ(街角で)、コトブキの舞台稽古(一色さんとか村上さんとか、椿さんとかと一緒)、CDのプロモ撮影シーン、大東建託のCM撮影(吊られてピースサインしてるやつ(笑))、などなど各種
ビデオ	スクリーン	FIFAは、より多くの人びとに3Dの試合映像を観賞してもらうため、世界26カ国の デジタルシネマ を含む会場に大型スクリーンを設置し、試合を3Dで上映する計画だ
映画	スクリーン	ただし、この投写角を大きくする場合、スクリーン上に投写された区分映像は、中心部から周辺部へいく程フォーカスが悪くなったり、幾何歪みを伴う等、区分映像間の繋ぎ目が目立ち易くなる虞れがある
ビデオ	スクリーン	だってイベントの最初の方なんてスクリーンに映したDVDの映像を見ながら3人+MC2人(やまけん氏&ジョイまっくす)がダラダラと感想を述べてただけですからね
その他	スクリーン	試作の方針は比較的粗粒子高銀濃度のノースクリーン型X線写真型を目標とし、全量アンモニア法沃臭化銀乳剤(A)、中性法沃臭化銀乳剤(B)、中性法臭化銀乳剤(C)の3種の基礎乳剤処方を元とし、フィルムベースは可燃性セルロイドベースの使用をさけ、三酢酸繊維素の不燃性ベースを用いた
その他	スクリーン	プロパンガスの燃焼によって発生した二酸化炭素を、さらに特殊スクリーンを用いて「蚊の好む二酸化炭素」にして放出口より拡散させて、蚊をおびき寄せます
