# 映画: 映画を映す幕。銀幕。転じて、映画・映画界。, ビデオ: テレビ・レーダーなどの画面。, カメラ: 写真製版に使う、黒色・網目状の線を引いたガラス板。, インテリア: ついたて。間仕切り。
その他	スクリーン	カッティングフイルム・・・・・カットフイルムは 無伸縮のポリエスターベースにカッティング性 耐溶剤性の強い乳剤を塗布されたもので スクリーンメッシュへの転写は容易に行えます
映画	スクリーン	フラウンホーファー通信研究所(ハインリッヒ・ヘルツ研究所、HHI)が開発したこのスクリーンは、2種類の光線を左右の目それぞれに向けて発射することで、3D用のメガネを不要にした
ビデオ	スクリーン	スクリーンに映るのは早回しで現れては消え、消えては現れる雲の画像、「青い空に出会ったら よろしくとつぶやいて・・・」それに時おり、歌うユーミンの画像が重なります
ビデオ	スクリーン	試合はきっこーまんがボコボコにされると、会場のスクリーンには後楽園ビル内の床屋でヒゲをそっているナットーマンが映される(店員がヒゲ剃りクリームをこねてると思いきや、納豆をかきまぜてる小ネタも)
ビデオ	スクリーン	学校のホームページから昨年の取り組みの様子をスクリーンショットで撮った画像やデジタルカメラで撮った歓迎のポスターやメッセージ等の画像を、iMacのiPhotoに読み込んで、スライドショーを作成
映画	スクリーン	映画館の大スクリーンへの投影を前提に収録されたステージ映像は、これまでの舞台録画とはまったく異なる、今までにない新しい映像エンタテイメントとして見る人の心に語りかける
映画	スクリーン	全員に1年生の頃の写真(赤ちゃんの頃でやった時もあります)をもってきてもらい、それを写真屋さんに頼んでスライドにしてもらい、スクリーンに映しました
その他	スクリーン	真っ白の画面に布地のスクリーンプリントがモノクロで配され、そこに、まさに衝動を詰め込んだかのように、ヴィヴィッドな色彩の絵の具の線が弾けるように走ります
映画	スクリーン	4月21日(火)、中村橋之助が織田信長を演じる映画 『GOEMON』(紀里谷和明監督作品)の"天下統一試写会"が40都道府県190スクリーンで一斉に行われました
その他	スクリーン	【解決手段】 三次元画像表示装置100は、発光ダイオードユニットを含みテーブル3とともに回転させられる表示板と、画像投影機30から画像が投影される投影面27を含むスクリーン25とを備える
映画	スクリーン	また、アルゼンチン共和国杯は昨年のスクリーンヒーロー、一昨年のアドマイヤジュピタなど、隠れた出世レースになっているんだけど、両馬ともに先行して2分30秒台で勝利していた
映画	スクリーン	2月には話題の映画「チーム・バチスタの栄光」にも出演し、キーマンとしての存在感と既存のイメージを凛とした演技で心地良く裏切った姿がスクリーンの中でも注目を集めています
映画	スクリーン	でもスクリーンで流した「けちゃっぷmania」の曲「Your World」という曲はテレビ東京系のアニメ「韋駄天翔ーイダテンジャンプ」の主題歌なんだよなあ
映画	スクリーン	そんなヒューイの哲学・人生が、スパイク・リーとオビ賞受賞のロジャー・グァンバー・スミスの7年にわたる共同制作の末、ロジャーによるオフ・ブロードウェイでの一人舞台に、1960年代当時の記録映像、様々なブラック・ムーヴィーからの場面をスパイクが編集してスクリーンに映し出すという、彼らにしか成し得ない手法で表現された
ビデオ	スクリーン	前面スクリーンでのプレゼンテーションとスピーカーの表情を編集によりマルチ画面で見せることで、他社セミナーコンテンツではなかなか見られない高い品質感のセミナー映像となっています
ビデオ	スクリーン	ちなみに、PS3をネットに繋ぎ、Saymoveのちょい画質のいい動画をテレビのフルスクリーンで見ると、ガチで尋常じゃない良画質で見れるので、お持ちの方はお試しを
ビデオ	スクリーン	綺麗なスクリーンショットを撮りたい時は話は別ですが、マシンが動いていると、低解像度でも気にならない場合がほとんどですので、このような感じで、「 フレームレート重視 」 で行くのも、ひとつの選択としてアリでしょうか
その他	スクリーン	間の2フロアのスクリーンも単なる建築作品のムービーではなくて、彼の建築の建ち方や住まわれ方を映し出していて、彼の建築へのアプローチの独創性をしめしていたように思う
ビデオ	スクリーン	千葉ロッテマリーンズは新シーズンから、メインスクリーンでライブや録画の映像を出す一方、帯状映像装置でメッセージやゲーム展開にあわせたコンテンツなどを別に表示して、多彩な演出を行います
ビデオ	スクリーン	Windowsの画面効果設定で、「スクリーンフォントの縁を滑らかにする」 オプションが有効になっている場合、MMSSTVのテンプレート画面で文字フォントの縁にテンプレートの背景色が漏れる場合があります
ビデオ	スクリーン	「世界遺産」でHBCが制作した「知床」を220インチの大型スクリーンに投射し、ハイビジョンの迫力と「世界遺産・知床」の映像クオリティを体感していただきます
映画	スクリーン	【0017】また、このとき上記漸減形投写角度制御手段によって光学的に明るさを漸減させる上記スクリーン上の隣接する投写区分映像の重なる領域は、上記1画面分の全映像に対して存在するものとすることができる
カメラ	スクリーン	印刷における色指定とか、製版スクリーンを通して網分解された写真といった、一般にはあまりなじみのない視点が、フィルム製作の重要なモチーフとしてとり入れられている
その他	スクリーン	「BM883F」の登場で益々充実するコマツの自走式スクリーンシリーズは、土木、解体・リサイクル、処分場から砕石現場まで幅広いお客さまのニーズにきめ細かく応え、満足いただけるものと確信しています
ビデオ	スクリーン	おしめをつけてヨチヨチ歩く姿や、大泣きのシーンなどレストラン備え付けの巨大スクリーンに写し出されると新郎は赤面の連続でしたがゲストの方々は写真と違い動画でリアルな場面を見ることができ大喜びでした
映画	スクリーン	で、この作品は原作を読んだこともないけど、原作のノリが彷彿とさせられそうな「まんま」なものになっちゃって、しかも多分、原作の荒唐無稽&美形キャラコミックという屈折した世界観を実写相似形にスクリーンに描くんだから、作り手の想像力欠如に愕然としてしまう
映画	スクリーン	これからスクリーンに写る映像を楽しみにしているのはもちろんのことですが、どうやら16ミリ映写機が珍しくて、どんな仕組みで映像が写し出されるのか、会場を出入りする度に、16ミリ映画フィルムがセットされている映写機に興味津々のようです
ビデオ	スクリーン	本日オープンした公式サイトでは、キャラクターイラストやゲーム中のスクリーンショットなどが掲載されているほか、各キャラクターのボイス、ゲームに収録される楽曲なども併せて公開されている
映画	スクリーン	プロジェクターは方式に大きくわけて2種類あって、一つはスクリーンを壁などにつって、正面から映像を照射するタイプ、そしてもう一つが一見はテレビのような感じなのですが、テレビの画面の部分にスクリーンがあって、その背後からプロジェクターで照射するリアプロジェクションテレビです
ビデオ	スクリーン	また、何度も言っていますが、たとえフォントのアンチエイリアスが実現されても、多くのスクリーンフォントを備えて欲しいと思います(現在の解像度ではうまくデザインされたビットマップフォントの方がきれいなため)
ビデオ	スクリーン	スキャナによってはカスタム解像度が設定できない機種もあるので、その場合はスキャナのプリセット解像度でスキャニングを行い、印刷解像度と画像ピクセル数がリンクするグラフィックスエディタでスクリーンdpiに設定し直すか、画像ピクセル数を直接変更するしかありません
映画	スクリーン	内容は、アジアの雰囲気たっぷりな会場で ガムランやインドネシアの音楽などをBGMに 巨大スクリーンにバロンダンスやケチャを映し出し、 協力いただいている雑貨ショップのアジアン雑貨を 見て触れて感じられるようになってます
映画	スクリーン	これはショッピングセンターなどに隣接・併設された複合ビル内に複数のスクリーン(6~18程)を持ち、入場券売り場・売店・入り口および映写室などを共有し、特定の上映系列に属さず配給作品の選択が自由で、かつ館内どのスクリーンでも上映可能である事を前提に配給を受ける映画館である
インテリア	スクリーン	建築に携わる方々のニーズにお応えするために、木・アルミ複合カーテンウォール、木製スクリーン、木製サッシュなどを駆使して、建築開口部のデザインをより美しくするためのお手伝いをしている会社です
映画	スクリーン	イングロリアス・バスターズ 《ネタバレ》 映画館の火災シーンでは、本当にスクリーンから炎が上がってくるような錯覚を覚えて 寒気がするほどでした
映画	スクリーン	現れては消えていく日々の出来事を紙の上に残すことに違和感を覚え、現在のスライド・ショーのスタイルに至ったトヨダは、 "スクリーンの上に写真が現れることよりも、そこから消えてゆくこと" "「日々」の掴めなさ、立ち止まれなさ、留めておけなさ" を大切にし、 "多くの撮れなかったこと、撮らなかったことの存在" を無意識にでも受け取れるようにイメージとイメージの間に黒い時間を残しています
映画	スクリーン	【請求項3】 上記漸減形投写角度制御手段は、上記隣接する投写区分映像の重なる領域のスクリーン上での明るさを光学的に漸減させることを特徴とする請求項2記載の映像表示装置
映画	スクリーン	ステレオ録音が一般化した今では、テレビ番組でもこのことは常識になっているが、劇場用アニメで、しかも津軽三味線がテーマの「NITABOH」ではよりリアリティある音響空間を作るため、スクリーンに左右中の3つ、客席後ろの左右2つ、そして劇場全体の音空間を作り出すサブウーハーの、全部で6つのスピーカーを利用して音の設計をする(これが5
インテリア	スクリーン	内部光源式以外の光源から非常口標識に照明を与える人工照明灯には、25平方インチ以上の面積をもつ半透明なスクリーン、ディスク、またはレンズをつけて、アプローチ側が赤色またはその他の指定された表示色となるようにしなければならない
映画	スクリーン	これらの個室からはガラス越しにスクリーンを眺めることができ、自宅の居間にいるような雰囲気で、食事をしたりビールを飲んだりしながら映画を楽しむことができた
映画	スクリーン	あんな写真やこんな写真・・・(笑)ブログでも写真を紹介していきますが、あまりにも写真が多すぎてすべて紹介できませんので・・・m(_ _)mでも、今日だけは全部の写真をノーカットでスクリーンに映します
映画	スクリーン	私達はタイ山地で日本の生活様式を村の人々に紹介しようと、電気もない山の村に小型の発電機を運び、白いベッド用シーツをスクリーン代用に、スライド映写会を開いた
映画	スクリーン	序曲が始まるとともに舞台前面のスクリーンに近代的なビルの映像が映 されたため、一瞬、また最近流行の「現代化演出」かと思ったが、幕が 上がると抽象化された舞台ではあったが、一応、メルヘンの世界が出現した
映画	スクリーン	ここでは、映画館で公開されていた時のスクリーンサイズが、(1)DVDで発売される時の映像の種類、(2)Playstation2での映像出力設定、(3)あなたが持っているTVの種類の3点から、実際にどのような映像で見えるかを検証してみましょう
インテリア	スクリーン	また3号線17駅全体に、全国最初で乗り場スクリーンドアを設置し、架上無線電送設備システムを通じて機関士が駅進入500m前に、乗り場状況を予め見られるようにして、事故を阻むことができるようにした
その他	スクリーン	一眼レフではレンズ交換をはじめとするさまざまな原因でどうしてもスクリーンにわずかなゴミがつくのが避けれず、そのゴミの影がファインダーを通すと小さな黒い点に見えます
映画	スクリーン	暗闇の中でスクリーンの光景と対峙する行為は、見聞きするというより体験に近いというけれど、いつだってファインダー越し、レンズ越しにしか追えない自分にとって、それは詭弁に過ぎなかった
映画	スクリーン	誕生日・記念日には世界にたった一つの【似顔絵ケーキ】で盛り上げる☆照明・スクリーンやBGMを使ってスタッフ一同も感動演出のお手伝い♪ハイバックソファーでゆったりと寛げ、ついつい長居してしまう
ビデオ	スクリーン	『Halo』シリーズに関する情報の発信源として、インタビュー映像やトレーラー、スクリーンショットなどのコンテンツに加え、「Halo Waypoint」でのみ配信される独占映像やコミュニティ機能などの配信も予定しています
ビデオ	スクリーン	後日、郵便によって送られてきたエロビデオを父親が受け取ってしまい、家族会議の席で正座させられながらお茶の間のワイドスクリーンで延々と再生され、「こんなのが観たかったんか
ビデオ	スクリーン	次は開いた状態のカーテンの収まり幅が結構あってスクリーン面との余裕があまりなく、カーテンの下側が広がって、スクリーン面にかかってしまうという問題がおこりました
ビデオ	スクリーン	その後観客席とMC・ゲスト席が入れ替わり、MC・ゲスト席のバックだけは変わり、スクリーンが複数設けられた(スクリーンには番組のロゴやコーナーのタイトルが映る)
映画	スクリーン	画質が元々最近の映画ほどはよくない上に3時間超と長い映画を、スクリーンに近すぎる席で見てしまうという愚のせいで途中ちょっと身体の方が辛かったけど、描かれる貴族文化も、奏でられるイタリア語も、語られる近代イタリア史、そして匂ってくるシチリアの歴史も、全てが一体となって流れてくる
カメラ	スクリーン	最新のデジタルカメラとスキャナー技術を駆使して作成した版画で、スクリーンを通さずキャンパスや版画の紙に専用のインクジェットプリンターから毎秒4百万以上、インクのミクロ粒子を噴射して7万色以上の繊細な発色を可能にしているそうです
映画	スクリーン	さすがディズニー作品のアニメ映画で、色彩鮮やかなスクリーンに圧倒されっぱなし、“夢”いっぱいでまさにディズニーの真骨頂といえる作品だと思います
映画	スクリーン	昨日完成披露試写会に参加された知人によりますと、映画がとても良いらしいです 大きなスクリーンで亮ちゃんが見られるなんて、夢みたいですよね 嬉しすぎますね
映画	スクリーン	私達観客は、概ね、映画を「作る」のでなく「見る」という受け身の体制ですから、スクリーンの向こう側で制作者たちはどのようなコンセプトによって作品を作るとか、その映画ができた社会的背景はどうかということを考え、調べ、学ぶことが「日本学」の講義のように思います
映画	スクリーン	また、投射型表示装置を用いて立体画像表示を行う場合には、右目用の画像と左目用の画像をS偏光画像とP偏光画像として作成し、これらを重ねてスクリーン上に投影して、左目と右目にそれぞれS偏光フィルタとP偏光フィルタを用いた偏光メガネをかけて見ることが行われている
ビデオ	スクリーン	パソコンを使う時間と休憩時間を設定したあとに、システムトレーからバルーンを出したり、スクリーンを暗くしたり、といった方法で強制的に目を休ませるようにカスタマイズできます
その他	スクリーン	水槽からの揚水を平面衝突物体に衝突させ該物体を中心にして開散放射方向へ拡散させ再度水槽へ薄膜曲面状に落下させることにより循環持続的に水膜スクリーンを形成させるように水膜スクリーン形成装置を構成する
ビデオ	スクリーン	また、(2) 立体画像を用いる為に、一般に、左右両眼に視差を有する別々の画像を提示する方法が用いられるが、スクリーン位置と立体画像の存在位置は一致しないため、観察者に負担がかかる
ビデオ	スクリーン	この作品は、VRMスクリーンショットを鉄道写真的なアプローチで撮影したときの一つの完成形であり、同時に、そうしたアプローチの限界の象徴でもあるからです
その他	スクリーン	計測対象を単眼カメラのズーム機能により移動する焦点におけるスクリーン上に結像させて視差による三角測量法の原理により前記計測対象の位置を計測するズームによる位置計測方法であり、特に、自律ロボット等の、動き等が画像計測によって自動化される機械への適用を狙ったもの
映画	スクリーン	テラマックは、展示ブースのスクリーンや壁紙、カフェの椅子生地、マスコットガールERICAのウェア、コーヒーのカップフォルダーなど、さまざまなカタチに加工
ビデオ	スクリーン	カメラ上部のペンタプリズム部分が取り外しできるようになっていて、さまざまなファインダーやファインダースクリーンを取り替えられるようになっている
映画	スクリーン	鑑賞するからには、往年の大スターの面影を確かめたいという想いのほかに、日本映画全盛期の勢いを、スクリーンを通して是非とも感じ取ってみたいというのもありました
ビデオ	スクリーン	ブース中央に270インチの超大型スクリーンを設置し、両社製品による効率的な加工方法のご提案や、超高速カメラが捕らえた迫真の切削映像、TES※による両社共同のコンサルティング活動の様子などを、高精細なハイビジョン映像を通してご紹介します
映画	スクリーン	2001年にドラマ『学校4』(KBS第2テレビ)でデビューした コン・ユは、その後『乾パン先生とこんぺいとう』『ある素敵な日』『スクリーン』などの人気ドラマや、『Sダイアリー』『恋の潜伏捜査』『彼女を知らないとスパイ』といった映画に出演
映画	スクリーン	深作監督に追悼の意を・・とのコメントもスクリーンに登場するだけあり、PART1は日本に向けてのサービスかなと思えるくらい、オリエンタル色が濃い
ビデオ	スクリーン	約2時間位もかかったがこの間30分位はまた帰って再度スクリーンショットを取って毎度死ぬ度に走ったうえでずっと効果の切れた祝福を塗るのに消費した
ビデオ	スクリーン	内部はメカメカしい——北には壁の半ばから上にかけ、スクリーンのようなものが貼り付けられ、周囲の壁には大型の色々なものを組み合わせた奇妙な機械のようなものがある
その他	スクリーン	従来とはタープの下にスクリーン2ルームハウスを張り残った半分のスペースに椅子やテーブルをセットしスクリーン2ルームハウスのリビングは天気の悪い時のリビング及びキャンプ場から長く出かける時の収納スペース
ビデオ	スクリーン	「ふしぎなミクロ生物シアター」では、様々なミクロ生物たちの幻想的で躍動感あふれる姿や、ミクロ生物と自然環境や人とのかかわりについて、大型スクリーンや4面のディスプレイを用いた迫力の映像で紹介され、「ふしぎなネイチャーラボ」では、専門職員の指導のもと、自分で顕微鏡を操作して思う存分ミクロの世界を堪能できる
ビデオ	スクリーン	ノートパソコン、マイク、スクリーン、空調、暗幕、照明の調整、受け付け用の 長いテーブル1、椅子3完備:定員 180名(今回S402から足りないものの調達はできません)
ビデオ	スクリーン	2/9画像変更、前のはノーマライズで処理したが今回は明るさとコントラストをいじって同じような明るさになるように調整、スクリーンサイズがわかるように大きさも調整
その他	スクリーン	機材、コンテンツともに3D製品(CGではなく、立体視のほう)がかなりの盛り上がりを見せた今回のNABShowだが、ホワイトスクリーンが注目したのは、今だかつてない映像体験を可能にしてくれるスローモーションカメラだ
映画	スクリーン	ゴージャス♪★80インチ電動スクリーン内臓★■究極のAVリビングボード■自宅で映画館の迫力が味わえる♪【AVボード】【テレビボード】【テレビ台】♪
ビデオ	スクリーン	中に入りだだっ広いドームは徐々にひとで埋め尽くされ、30分遅れで照明が落ち、キース・リチャ−ズの歯切れの良い変なリズムのカッティングの音が耳に入り、ステージ上は照明に照らされ後ろのスクリーンは徐々にステージ上のメンバーの姿を映していく
映画	スクリーン	【0022】なお、上記メモリ回路に記憶される区分映像信号のサンプリングは、上記スクリーン上に投写される上記隣接する投写区分映像の重なる領域が上記1画面分の全映像に対して存在するようになすこと、或いは、上記スクリーン上に投写される上記隣接する投写区分映像の重なる領域が上記各投写区分映像の周辺部のみに存在するようになすこととする
ビデオ	スクリーン	とにかく、リキッドルームと比べて一番感じた違いは、映像がWHITE STAGEいっぱいに映し出されていたため、リキッドルームの小さいスクリーンではさほど強く感じられなかった、「映像と音との融合」というのが、このWHITE STAGEのステージでは、見事、実現していたと思います
ビデオ	スクリーン	そこで写真の色をリモート操作で4bitにまで落とし、スクリーンの解像度をかなり低くして見たわけですが、それでもその写真は驚くべきもので、私が繰り返した侵入の中で、最高の瞬間でした
映画	スクリーン	教員が操作するノートPCやPDAからは、プロジェクターの電源制御、映像ソースの切替え、スクリーンやブラインドの昇降、照明制御などが行えるAWK(ActiveWorkKit)を使って実現している
