# 乗り物: 交通機関が多く集まり、人の乗り降りが多い所。鉄道の終点。バスターミナルターミナルデパート, コンピュータ: コンピュータの端末（機）。, 空港: 空港で、種種の事務のための施設が集まっている場所。
空港	ターミナル	さらに、12月3日から5日まで、「羽田空港観光プロモーション」が羽田空港第1旅客ターミナル フェスティバルコートで行われ、本場ならではの大迫力のなまはげが再登場します
乗り物	ターミナル	特に、今回初めての試みとなった駅周辺における「応急救護訓練」や、帰宅困難者の「避難誘導訓練」は、大規模集客施設を持つターミナルの地域特性を反映して、極めて実践的な訓練となりました
空港	ターミナル	2社はハバロフスク国際空港ターミナルを建設・運営する「キヤマ・アビア」と、本道資本が参加して「ホテルさっぽろ」を経営するアムール・トレーディング
乗り物	ターミナル	屋外型の広場で、外周部と中央部にバスバースが、南寄りにターミナルビル「つくばターミナル」やタクシープールが、外周部の北西寄りにつくば駅の出入口(A3、A4、エレベーター)がある
乗り物	ターミナル	静岡県最大の人口を持つ浜松をターミナルとする鉄道で、全線単線ながら12分間隔の運転を行っており、CTCもかなり早い時期に導入、車両も新車両が多く入線しており、地方民鉄としては非常にレベルが高い路線です
空港	ターミナル	本船積み出し月の約1ヶ月前、特定された農家に受け渡し通知を入れ、ターミナルエレベーターもしくはリバーサイドエレベーターまで農家所有のトラックで持ち込む
コンピュータ	ターミナル	SQL 2005サーバー搭載の最新バージョン8シリーズでは、WindowsCEが搭載されたモバイルハンディターミナルとの連携も強化され、より使いやすく、より高機能に
乗り物	ターミナル	アスンシオンはターミナルのインフォで聞いて、市内はずれにある植物園に行くといいです、市内バスがくねくねと町中を走ってから植物園に着くので市内観光にもなります
乗り物	ターミナル	でも、2000年問題が騒がれ始めた同じころ、その杉原さんを含め敏腕フロア長などがごそっとダイエーに転職したり、YKKと呼ばれるヤマダ、コジマ、K’sなどの郊外型大量展示、最低価格保証を売りにした家電量販店や、駅前の再開発に伴ってターミナル駅前進出を広げたヨドバシカメラなどの攻勢により、秋葉原で「物品を買う」という必然性が下がっていったようです
コンピュータ	ターミナル	データは暗号機経由でDTS(データ・ターミナル・セット)に入力され、デジタル・アナログ変換、プロトコル管制、エラー検知がなされた後、無線通信機で送信され、逆ルートをたどって受信される
乗り物	ターミナル	平成18年6月、りんくうターミナル(大阪府)内で輸入生花を専門に取り扱う「りんくうフラワーセンター」を開設、同7月、第4原木ターミナル(千葉県)で医療機器製造業・化粧品製造業の許可を取得し、販売の体制を整えた
空港	ターミナル	三重県警捜査2課は7月3日、同県四日市市の発注した四日市港ターミナル周辺整備工事を巡り、現金数十万円を受け取ったとして、国土交通省中部地方整備局港湾空港部付、芳野昇容疑者(52)を収賄容疑で、現金を渡したとして土木・道路舗装会社「井上組」社長で、中部国際空港(セントレア)と四日市港を結ぶ空港アクセス航路の運航会社「YAL」社長でもある井上峯夫容疑者(64)を贈賄容疑で逮捕した
乗り物	ターミナル	現在、公共交通機能の強化による利便性向上、並びに利用促進による交通の円滑化を図るため、路線網再編に基づく機能の適正分担を基本とした、福山駅前広場及び複合交通センターのターミナル整備が推進されている
その他	ターミナル	ターミナルピンはカシメ直せないため、電線を切ってつなぎ変えたのですが、1番端子に接続されていた[白]ビデオ信号(+)の電線が非常に細いため、電源として5Vをかけたとき十分な電流値が流れなかったのかうまく動作しませんでした
空港	ターミナル	大阪南港フェリーターミナルと大阪南港かもめフェリーターミナルからは、西日本各地と結ぶ大型フェリーが就航しており、日本一の中・長距離フェリーの拠点となっています
空港	ターミナル	フランスの有名建築家ポール・アンドリュー氏設計{パリのシャルル・ド・ゴール国際空港ターミナルビル、グランダルシュ[新凱旋門]、他}・1階の「海の映像館」や「海の冒険館」や美術ギャラリーも)も
コンピュータ	ターミナル	これに対し、kterm 等のターミナル内でコンピュータを操作する場合はキーボード入力と画面の文字表示のみでコンピュータを操作することになります
コンピュータ	ターミナル	使用と共に徐々にもっさりしていってしまうFirefoxをきびきびとした動作に蘇えらせるTipsとして、ブックマークや履歴など様々なユーザ設定を保存しているプロファイルをターミナルからSQLiteのvacuumコマンドで再構成する方法がありますが、それをAppleScriptで代わりにやってくれるソフトです
空港	ターミナル	同協議会が来年3月の同空港新国際線旅客ターミナルビル供用開始に向け、より多くの人々に海外旅行に興味を持ってもらい、同空港をさらに利用してもらお
空港	ターミナル	【ロンドン3日時事】英スカイテレビなどは3日、ロンドンでの自動車爆弾テロ未遂事件とグラスゴー空港ターミナルへの車突入事件は、同じ2人組による犯行だったもようだと報じた
空港	ターミナル	最後は東予からオレンジフェリーにて大阪南港に戻ったが、今治糸山サイクリングターミナル到着が20:50だったので、さっさと自転車を輪行袋につめ、タクシー2台に分乗し、21:30に出発
乗り物	ターミナル	JR京葉線/武蔵野線 舞浜駅下車、東京ディズニーランド®・バス&タクシー・ターミナルよりパートナーホテル・シャトル(無料シャトルバス)にて約15分
乗り物	ターミナル	JR姫路駅・北の駐車口(姫路城側)を出て、姫路市営バス北ターミナルより”日の出車庫”行きバスに乗車、”北条口5丁目”(10分)または”神屋町6丁目”(11分)下車後、徒歩1分
空港	ターミナル	◯久保田港営部長 まず第一に、港湾振興協会は客船誘致やみなと祭の実施など、晴海客船ターミナルにおいて事業活動を展開しており、その事務所が晴海客船ターミナルの中にある、こういう事情にございます
乗り物	ターミナル	2時間くらい居座って、最後、駅前で写真を撮って、ターミナルに行くバスが少し来るの遅かったんですけど、みんな一緒に待っててくれてて本当にありがたかったです☆見送り、本当に感謝です( ́∀`)最後バスが来てみなさんとお別れ
空港	ターミナル	空港到着時にはターミナルビル外に相当のヒトヒトがまっておりますので、はじめはびびりますが、ターミナルエリア内は旅行客以外は入れませんので、運転手がどこにいるのかきちんと探してください
空港	ターミナル	JR長崎駅から徒歩すぐの長崎駅前電停→路面電車正覚寺下行きで3分、大波止電停下車、徒歩5分の長崎港ターミナルから長崎汽船伊王島経由高島行きの高速船で19分、伊王島港下船、海水浴場行きバス(シーズンのみ)で5分、終点下車
乗り物	ターミナル	地下鉄については、都心と周辺のターミナルを結ぶ路線として11路線が示されていたが、これらは2路線を組にして都心を通過して両端で近郊路線のターミナルを結ぶというものであった
空港	ターミナル	このような中、鳥羽港には、中核的リゾート拠点、かつ、海上交通の要衝として観光、交通、産業等の重要なターミナルとしての環境づくりが求められるようになりました
乗り物	ターミナル	屋外型の広場で外周部と中央部にバスバースが南寄りにターミナルビル「つくばターミナル」やタクシープールが、 外周部の北西寄りにつくば駅の出入口(A3、A4、エレベーター)があった
空港	ターミナル	なお、2004年12月1日の第2旅客ターミナルビルの供用開始以前は西側出口のみで営業していたが、東側出口も設置準備工事がなされており、当初から第2旅客ターミナルビルの供用開始を考慮した設計となっていた
コンピュータ	ターミナル	ビジネスコミュニケーションのメインツールである電話とパソコンを連携させたCTIからPHSデジタルコードレスターミナルを活用したモバイル環境まで、円滑なビジネスシーンを提供します
コンピュータ	ターミナル	ハードティスクを持たず、高い信頼と低コストを実現するシンクライアント端末の基本性能のほか、Windows CE 採用による優れた起動性、さらにWindowsターミナル、インターネット端末としての能力がユーザやSIに評価されている
乗り物	ターミナル	ただ、バスターミナルが必要かどうかという議論については、中長距離路線においては神姫三ノ宮、JRターミナル、阪神前の東西両方向、交通センター前と分かれていることや、市バスや阪神バスといった近距離路線についても(いちおう)メインのバス停とされる阪神前と地下鉄三宮駅前に限っても停車と通過が分かれたり、位置が微妙に異なるわけで、軸になる停留所がほしいところです
乗り物	ターミナル	99年11月28日、町田ターミナルパーキングのループ上り中、突然ホーンが鳴りっ放しになり、エンジンを止めキーを抜いたが鳴りやまず、ボンネットを開けホーンの配線を抜き、駐車場所へ移動
乗り物	ターミナル	また、「他のホテルを探す」ボタンをクリックすると、三宮ターミナルホテルの周辺ホテルの地図が表示されるので、お隣りのホテルの料金もチェックできます
空港	ターミナル	飛行機が空港の都合で、予定していた乗り換えのFターミナルではなくCターミナルに 着いたので、乗り換えなのに入国して出国審査も受けなければならなかった
空港	ターミナル	馮氏の行動がかつてハリウッド映画「ターミナル」でトム・ハンクスが演じた役柄と似ているうえ、今回の中国からの「強制送還」に日本の航空会社・全日本空輸(ANA)が関わったことから、中国国民も日本側の対応に注目している
その他	ターミナル	ビデオ=ターミナル・ライト=ペン・描画タブレット・マウスといった近代的に見える付属品でさえも、1950年代・1960年代・1970年代にペンタゴンから資金提供された研究から発展したのだった
コンピュータ	ターミナル	でスペースバーをポンポン押して受信メールを読むときに、LAN上でもWinVNCではイライラしてとても毎日使う気になれないのに、ターミナルサービスではローカルかリモートかはあまり意識せずに使えます
その他	ターミナル	この会社では、予約をコンピュータ管理しているだけでなく乗客専用のエアコンのついた待合室や荷物のX線検査機を備えており、バスも新しくてきれい(特にVIPバス)なものが多いようなので、バスを探す時はメインターミナルだけでなくこちらもあわせてチェックした方がいいかもしれない
乗り物	ターミナル	関係機関とも協議しながら、鉄道とリムジンバス等の適切な機能分担を踏まえつつ、施設計画において、鉄道駅と新たに整備する旅客ターミナルビルとの円滑な歩行者動線の確保等により、公共交通機関の利便性向上に配慮するなど、公共交通機関の利用促進に向けた取り組みを行います
コンピュータ	ターミナル	ハンディーターミナルを活用する事による棚卸時間の短縮や他店舗の在庫をリアルタイムに確認する事が可能となり、今まで逃がしてしまっていたお客様の獲得ができるようになるなど、効率化が図れるようになった
空港	ターミナル	その後、1988年4月の瀬戸大橋開通に伴う宇高連絡船の廃止などに伴い置かれている状況が変化、これに対応するため宇野港再開発が主要な課題となり、1994年以降フェリーターミナルの拡充整備、大型旅客船ターミナルや緑地などの港湾再開発事業が行われ完成した
空港	ターミナル	21時頃から激しい雷雨となっていた兵庫県南部では8月22日21時20分頃、神戸新交通ポートアイランド線ポートターミナル~中公園間走行中の三宮発神戸空港行列車(旅客約50名)が突然停止した
空港	ターミナル	さらに、第1・第2旅客ターミナルビル間の旅客数や運航回数が35対65の比率で第2旅客ターミナルビルに偏重し、今後その差がさらに拡大していく傾向となっています
空港	ターミナル	況して、2010年に羽田空港の国際ターミナルがオープンしてアジアのゲートとなる多摩川下流域において、そのことは責務といえるのではないでしょうか
その他	ターミナル	Jerryさん、新ターミナル(ターミナルE)は我が家が行った9月下旬に「ひと月ほど前にできたばかり」と言われてましたので、Jerryさんが行かれた時には未だ使われていなかったのかも知れません
空港	ターミナル	三重県四日市市発注の四日市港ターミナル建設工事に絡む贈収賄事件で、収賄容疑で逮捕された国土交通省中部地方整備局元課長、芳野昇容疑者(52)が三重県警の調べに対し、贈賄容疑で逮捕された井上峯夫容疑者(64)の土木会社が随意契約で受注した3件の工事について「井上容疑者のために用意した」と供述していることが4日、分かった
乗り物	ターミナル	アクセス/JR夕張駅からバスで5分、または札幌から夕鉄バス・中央バス、岩見沢から中央バス「石炭の歴史村行き」に乗り「石炭の歴史村ターミナル」下車
乗り物	ターミナル	また、主要ターミナル駅の乗り場案内図・神奈川県内発着の高速バス・空港連絡バス・深夜急行バス情報のほかに、コミュニティバス情報も収録いたしました
乗り物	ターミナル	バスに乗っているときより、発着するバス・センター/ターミナルが場所によっては郊外にあるため、深夜地下鉄や市内バスで移動する時に土地勘があっても「これはちょっと危ないな」と感じたことが何回かあります
空港	ターミナル	ご好評いただいております、羽田空港第2ターミナル(国内線)での保安検査場から搭乗口までの移動に便利な「電動カートサービス」に今回、新型の4人乗り電動カートが導入されました
空港	ターミナル	美崎町の石垣港離島ターミナルビル向かいにある通称「大鷲公園」は3年前から八重山高校17期卒の「八重山となき会」(安室義教会長45人)「おはようジョギングクラブ」(崎浜ハツ会長・58人)「美ら花グループ安全衛生委員会」(山田貴巳委員長・15人)らが定期的に公園や周辺道路の美化に取り組み、海の玄関口として市民や観光客に親しまれるようになった
コンピュータ	ターミナル	c2cbd アイコンの”情報を見る”項目を表示させてから、”このアプリケーションで開く”項目で、”その他”を選んでから、”アプリケーション” → ”ユーティリティ” で、”ターミナル”を選択して入力してください
空港	ターミナル	職員が滑走路に向けて歩いていく様子、それにターミナルのガラス越しに文句をぶつけている乗客達、乗客が映したそんなビデオもTVのニュースで放映されていました
コンピュータ	ターミナル	事実上、本書では説明されたオプションは、明白な指示に応じて使用しているホストにリモート(給仕)ホストからローカル・ターミナルプリンタを慎重に調整させることを伴います
その他	ターミナル	APACSのサンドラ・クインは、「以前はターミナルを上から撮影できるようにピンホールカメラを設置して、データを盗むケースが多かったが、現在はチップ&ピンのターミナルになんらかの操作を加えて情報を盗み出している」と状況を説明する
空港	ターミナル	一方、「万景峰92」号の入港に反対する日本の団体側が、同胞らがターミナルに旗ざおを持ち込んだことと人員について抗議した問題で、総聯側は、「旗ざおについては新潟港湾事務所を通じて事前に許可を得ていた
乗り物	ターミナル	この他、近代交通システムの影響を受けた都市は、空間の拡張の中で終始近代交通システムの影響に束縛され、鉄道・自動車道路の中枢都市は多くが鉄道あるいは自動車道路のターミナルを中心として展開した
乗り物	ターミナル	採用された事業には、東京スカイツリーを中心とした施設開発や大阪・阿倍野橋の高さ300mのターミナルビル開発、東京・渋谷の地下駅周辺の高層複合施設の開発など、注目プロジェクトに伴う取り組みが目立った
空港	ターミナル	●関西国際空港、旅客ターミナル1階国際線到着ロビー前3番のりばより、リムジンバス「南港コスモスクエア」行きに乗り、到着後、 タクシーで「フェリーターミナルのりば」まで約5〜6分です
乗り物	ターミナル	【解決手段】 貨物コンテナ輸送の速達化システムであって、高速コンテナ鉄道貨車ターミナル4と在来コンテナ鉄道貨車ターミナル1における荷台の高さを等しくし、前記高速コンテナ鉄道貨車ターミナルと前記在来コンテナ鉄道貨車ターミナルとの間のコンテナのスライド積替え手段を具備することを特徴とする
空港	ターミナル	5月1日からオープンのフェリーターミナル【浜の母さんお食事処】団体ツアーや釣りのお客様・奥尻島へ渡るお客様など色々な方々が御来店下さいます♪人気メニューは海鮮そばや海鮮カレー
空港	ターミナル	リムジンバスに乗り、羽田空港(第2ターミナル)へ到着したまでは良かったんですが、なんだかしっくりこなくて、そのまま電車とバスを乗り継ぎ、久々の城南島海浜公園へ
その他	ターミナル	電話機(携帯電話、PHSを含む)やファクシミリ、モデム、ターミナルアダプタ、携帯情報端末(PDA)などで、ガイドラインに沿った機能を備え、アクセシビリティを考慮したと認められた製品は、このシンボルマークを表示することができます
乗り物	ターミナル	地下鉄東西線 大谷地駅下車→バスターミナルより中央バス(大69番乗車)→桂台団地下車(病院のすぐ前のバス停です) 地下鉄東豊線 福住駅下車→バスターミナルより中央バス 千歳線(桂台団地経由)乗車→桂台団地下車(札幌駅前ターミナルからも乗車できます)
乗り物	ターミナル	なお、鉄道駅前の地下鉄ターミナル駅「モスコフスカヤ」 Московская から「マクシム・ゴーリキー広場」への地下鉄延長工事が計画されて久しいが、未だ開通には至っていない
乗り物	ターミナル	やっとバスに乗れたと思ったら、違うターミナルから乗ってきた100kgを超えるであろうおじさんに俺っちがせっかくリクライニングした席を奪われ、汗くさいし、股開いて俺っちの席まで侵食してくるし、肩身の狭い思いをしたわ
乗り物	ターミナル	この法律の主旨は「高齢者・身体障害者等の公共交通機関を利用した移動の利便性・安全性の向上を促進するために、1交通事業者によるターミナル施設と車両のバリアフリー化、2市町村による駅及びその周辺の面的整備、の2つである
乗り物	ターミナル	【請求項8】 請求項5記載の貨物コンテナ輸送の速達化システムにおいて、前記高速コンテナ鉄道貨車ターミナルと在来コンテナ鉄道貨車ターミナルにおける高速コンテナ鉄道貨車と在来コンテナ鉄道貨車との荷台の高さを等しくすることを特徴とする貨物コンテナ輸送の速達化システム
その他	ターミナル	現在、ホームターミナルご加入のお客様には誠に勝手ながら、弊社の設備が整い次第、随時ホームターミナルからセットトップボックスに変更させていただきます
空港	ターミナル	スカルノハッタ空港ターミナル1・2のチェックインカウンターは航空会社別割当システムになっているが、乗客の待ち行列が頻繁に発生して非効率であるため共通使用方式に変更する、とアンカサプラIIが表明
乗り物	ターミナル	バスが到着するのは、行きと同じターミナルなので危ない地域でないとはいえ、日が落ちてから到着すると、そこに待ち構えるタクシー運転手が善人ばかりとは限らない時間になる
乗り物	ターミナル	LAZO=つながり・結びつき、ZONA=エリアという意味のスペイン語からなる「LAZONA」という名称が象徴するように、東京と横浜という都市を「つなぐ」ターミナル駅において、大規模商業施設と集合住宅とを豊かな緑で「つなぐ」ことで、交通・生活利便性と安らぎ・潤いとをも「つなぐ」街として、新しい暮らしを提案する
乗り物	ターミナル	■交通/「芦別」バス停(芦別駅から徒歩2分の国道38号線「アシントンホテル」前)から中央バス「旭川ターミナル」行き乗車、「3線」下車、徒歩35分
空港	ターミナル	・ローカルな質問ですいませんが、愛知県蒲郡市の名鉄西浦マリーナ付近から愛知県田原市の伊良湖フェリーターミナルへは、どのルートがスムーズに到着出来るでしょうか
空港	ターミナル	多様な附帯施設も充実しているコモドホテルは釜山駅、国際旅客船ターミナル、国際市場、ジャかルチ市場などと徒歩距離に位置し、最近の改善補修作業で新たに生まれ変わりました
空港	ターミナル	途中、米子空港駅は、本当に米子空港のそばを通り、飛行機も間近に見えるのだが、ターミナルビルまでの連絡通路がなく、仮通路の状態で、空港アクセスという点では今一歩である
乗り物	ターミナル	これらのことから待合わせ場所は、多少混雑はしていてもみんなが集まりやすいターミナル駅の、改札口か有名な待合わせスポット等のわかりやすい場所にする人が多いと言えます
空港	ターミナル	タクシー運転手や警備員、周辺の住民らによる空港内でのデモも度々起き、昨年11、12月 には数千人の反政府デモ隊が旅客ターミナルを占拠し、空港が10日近く閉鎖された
空港	ターミナル	はケアンズ空港の国際線、国内線ターミナルから離れた「ヒンターランド・ターミナル」というところから出発しますが、無料でケアンズ空港の国際線・国内線ターミナルと、ヒンターランド・ターミナル間のシャトルバスをご利用いただけます
