# 乗り物: 交通機関が多く集まり、人の乗り降りが多い所。鉄道の終点。バスターミナルターミナルデパート, コンピュータ: コンピュータの端末（機）。, 空港: 空港で、種種の事務のための施設が集まっている場所。
空港	ターミナル	現在、香深港には立派なターミナルがあるが、その当時は建設前で、仮ごしらえの小さな建物しかなく、その後ろにはこれまた小さなお土産店が立ち並んでいるだけで、利尻島に比べるとずいぶん地味な印象を受けた
空港	ターミナル	◆ なんかもうバスは乗る気がしないので(第2ターミナル始発になって第1からでは窓際に座れない、連休最終日で渋滞がすごそう、自腹なので電車の倍近い運賃(鉄道780、バス1400)はちょっと
乗り物	ターミナル	新宿駅はJR中央線・総武線・山手線・埼京線、私鉄小田急線・京王線・西武新宿線、地下鉄メトロ丸ノ内線、都営新宿線・大江戸線が乗入れる、 「TOKYO」のコアターミナルであり、副都心線の開通、湘南新宿ライン・成田エクスプレスの便増等、更なる利便性向上と進化を続ける「新宿」は、生活・ 文化・情報を含む一大情報発信地区でもあります
空港	ターミナル	チャンギ空港第1~第3ターミナルの商業スペースに入居している小売業者、飲食店の売り上げが、昨年第4四半期と今年第1四半期は前年同期比で増加に転じた
空港	ターミナル	カンボジアは人口約一二〇〇万人とASEANでは小国で、国家予算の数分の一を海外からの援助に頼っており、たとえばプノンペンの国際空港はフランスの援助でターミナルビルを拡張中である
空港	ターミナル	空港に車で来る時には、運転手にあらかじめどちらを利用するか伝えておいたほうがいいだろう(たいていの運転手は、空港に着くとどちらのターミナルに行くか聞いてくる)
コンピュータ	ターミナル	kawa0513 ハンディターミナルには「確定されませんでした」と表示された車両に、無線室側では予約配車が確定していて、配車時間直前に「現着報告は
空港	ターミナル	世界最大ターミナルの一つであるターミナル3(T3)が北京首都国際空港で既に稼働を始めており、北京は空港都市ともに、 ACE開催の最適な会場である
乗り物	ターミナル	営業所の所在は当然ながらJRの駅前や至近が多いが、中には天橋立駅(京都府:北近畿タンゴ鉄道)の駅前に立地したり、佐渡両津(新潟県:両津港)、つくばセンター つくばターミナル(茨城県:JRバスつくばセンター駅)、草津温泉(群馬県:JRバス草津温泉駅)、日光(東武日光駅 東武日光)(栃木県:東武鉄道)や鬼怒川温泉駅 鬼怒川温泉(栃木県:東武鉄道)など、JR駅のない場所に立地することもある
乗り物	ターミナル	何故だか太田道灌の銅像があって、バスやタクシーのターミナルが発達しているが、その他はパチンコ屋にしろ中華料理屋にしろ、どうも山手線の駅前らしくない
乗り物	ターミナル	[フォト]キャリーバッグを持った乗客が目立つJR新大阪駅 一昔前は空港やターミナル駅でしか見かけることがなかったキャリーバッグが、続々と街中に進出している
乗り物	ターミナル	路線バス発車場を一元化、ターミナルを利用している郊外12路線のバスは中央大通りの市内バス乗り場から発車、ビルが完成した1966年から43年続いたターミナルでの営業が幕を閉じる
乗り物	ターミナル	そして、この“空中ダイバー施設”の川上「終点」には、竜東観光交通の拠点としての観光バス等のターミナルを設け、更に、ホテルと半加工のみやげ物を客の希望の形で完成品にする作業広場の建物の設置なども考えている
乗り物	ターミナル	第一面には「立地面 (池袋ターミナル)の利便性」の都市メリットを大きく打ち出し、周辺の都市と網の目で結ばれた各路線図(黒円内)とその各拠点へ短時間アクセスというメリット訴求、4路線4駅を使いこなせるというメリット訴求、そのうちのひとつが新路線新駅で、まさに開発されている地域であるという点を訴求していきます
空港	ターミナル	次に、港湾・漁港振興についてでありますが、港湾・漁港振興ビジョンのフェリーターミナル関連施設整備に関しては、整備実行委員会から、昨年9月9日に答申を受け、現在地域の活性化、地場産業の振興につながる施設整備の具体化及び関連施策の立案に向け、市役所内部で検討作業を進めているところであります
コンピュータ	ターミナル	だもんで、UnixのGUIって機能の○×では出てこないものの一般的なWindowsユーザーにはどこか使いづらいイメージを与えるのではないか・・・というか正直ターミナルで生活した方がUnixは楽しい気がします
コンピュータ	ターミナル	パソコン通信の一般的な設定は、大型計算機センターにつなぐときの設定とは違っていて、ターミナルソフトも、パソコン通信ではWTERM注4、計算機センター向けは専用ターミナルソフトを利用していました
乗り物	ターミナル	また、月1回から2回にかけまして大阪駅の風防とか、例えばバス停留所の路上付近の水洗いというものも実施いたしまして、大阪駅ターミナルの美観維持と衛生維持に努めておるところでございます
空港	ターミナル	かつて島東部のフェリーターミナルのある梅窩を始点に島内各地へ路線が延びていたが、地下鉄東涌線が開通して以来東涌駅と梅窩の2地点がバス路線の集結地となった
空港	ターミナル	調査目的とした空港ターミナルビル改築について中島智一委員長は、ビル経営方式を単体の民間企業経営方式から第三セクター方式に改め、増改築を進めるよう町側に提案した
乗り物	ターミナル	五所川原からJR五能線の本数が少ないのでバスで弘前まで移動しましたがバスの弘前ターミナルはJRの駅までけっこう離れていて、乗車予定の列車まで思いっきり早歩きでギリギリセーフ
乗り物	ターミナル	立山で見つけた立山そば @室堂ターミナル一応、4〜5年前ほどは3年続け毎年登っていた時期があったので過去の快晴時の写真(ケータイ)を載せておきます
空港	ターミナル	2010年秋に全面的に供用が始まる敦賀市の敦賀港多目的国際ターミナルを管理運営する第3セクター会社「敦賀港国際ターミナル」の設立総会が11月17日開かれ、社長(非常勤)に河瀬一治敦賀市長、常勤の専務取締役に福井県産業労働部の桑原信二企画幹の就任を決議
空港	ターミナル	高松港旅客ターミナルビル地下2階と地上4階に四国電力が整備した地熱供給システムやコリドーの屋上などに設置している太陽光発電システムを導入し、環境に優しい街づくりを目指している
乗り物	ターミナル	熊本駅前~熊本空港(熊本方面ゆきは自衛隊前)間、および米良バイパス入口~金池ターミナル(大分方面ゆきは県庁正門前)間の各停留所のみの相互利用はできない
乗り物	ターミナル	北仙台はかつて仙台鉄道の始発駅があり、廃止後は仙北鉄道と合併して宮城バスとなった後、宮城交通本社および北仙台ターミナルが置かれたため、始発のバスが多数設定されています
乗り物	ターミナル	札幌駅前ターミナル〜西町北20丁目間(円山経由便・望洋台経由便)、札幌ターミナル〜地下鉄北34条駅前間(北大経由便)は、共通ウィズユーカードで両社の便とも利用可能
コンピュータ	ターミナル	富士電機は、シャープと共同で受注した物流システムを構築する際は、ハンディ・ターミナルなど情報端末やパソコンを、富士通ではなくシャープ製のものを選んで組み込む
乗り物	ターミナル	利用者数世界一といわれるターミナル新宿駅と神奈川県西部地方の小田原駅を短絡する路線で、同駅からは箱根登山鉄道線に直通し、有料特急「ロマンスカー」も頻繁に運転されている
空港	ターミナル	(1)ご出発当日に羽田空港第2旅客ターミナル1階到着ロビー内「ANAスカイホリデーカウンター」にて、旅程表をご提示の上、3日目の信濃大町以降のJR・路線バスの乗車券・特急券および、「立山黒部アルペンルート時刻表」をお受け取りになってからご旅行にお出かけください
乗り物	ターミナル	美容室 赤羽 までは監視カメラ および五日市街道沿いの村落に過ぎなかったが、明治以降、鉄道が敷設され市域南部の立川駅がターミナル駅となり、さらには1922 年(大正11)陸軍立川飛行場が設置されたことによって商業・工業の集積が進んだことが、今日の繁栄の礎となっている
乗り物	ターミナル	今度の衆院補選の自民党敗北の理由は、第一には選挙戦最終盤に現地入りしなかった小泉のやる気のなさ(最後に松戸駅のターミナルあたりで一発演説をぶっていれば、1000票くらいは逆転できたはず)、もさることながら、さすがに「小泉劇場」に、典型的な「浮動票」である私も含めて、「飽き」が来てますよね
空港	ターミナル	函館発展に空港ターミナル建設・拡充は欠かせない」として地元経済界主導で函館空港の拡充、本格的な新しい空港ターミナルビルの建設を指導し、昭和45年6月に現在の函館空港ビルデング(株)を第3セクターとして創業・設立、初代社長に就任した
空港	ターミナル	当時の仙台空港はすでに国際化こそしていたが その実はプレハブ同然の"仮ターミナル"という情けない外観で、 現在の超モダンなたたずまいと比べてしまえば まったく隔世の感を禁じえません
乗り物	ターミナル	●北バスターミナルは、空港並みに広いので、ターミナルに着いたら、どの窓口でもいいので、「チェンライ VIP」と二言、言えば、係員がチケット窓口の番号を教えてくれるので簡単です
コンピュータ	ターミナル	(2)新加入者が、旧加入者の加入契約に定めるホームターミナルの設置場所においてHICATのサービスの提供を受けることについての旧加入者の権利義務を継承する場合
乗り物	ターミナル	バスターミナル方向に走るタクシーらしき車(この国では車の上にのっかているべき「タクシー」の表示がほとんどないのだ)に向かって手をあげて声をかけるが、3台目までは、どうやらターミナル行きではないようだった
コンピュータ	ターミナル	Spartan3E Starter Kitを使用して、LCDをステートマシンで実装し、シリアルインターフェースを作って、パソコンのターミナルソフトからLCDに文字を表示する過程をブログに書こうかと思っている
空港	ターミナル	コインロッカーに入る大きさの荷物ではないので、第一ターミナルの地下一階北ウィングの一番奥突き当たりの手荷物預かり所に一個210円で二個預けました
乗り物	ターミナル	老朽化した施設の建替えと公共交通ターミナルとの一体的な再開発による中心部の新しい魅力づくりと共に、計画敷地内中央等に地上の公共的通路を整備することで鉄道・バスの相互乗り継ぎ等に対するバリアフリー化を推進することで、公共交通の利用促進に貢献できます
空港	ターミナル	(都)第二東名自動車道などの高規格幹線道路や、(都)国道1号バイパス線などの主要幹線道路といった多様な陸上交通 と、国内外との航路が構築されている海上交通とが結節する地域として、コンテナターミナルとの連携を強化し、道路交通 機能の強化を図ります
乗り物	ターミナル	●シャトルバスが「リーガロイヤルホテル」(会議場東隣)と各ターミナル(JR「大阪駅」中央出口、地下鉄・京阪「淀屋橋駅」西詰)の間で運行しており、ご利用いただけます
コンピュータ	ターミナル	ターミナルサーバーにインストールされている全てのアプリケーションまたは特定のアプリケーションの画面情報だけをクライアントPCのデスクトップ上に転送することができます
乗り物	ターミナル	南郷通り沿いのバスターミナルビル東側 (南郷通19丁目南、地下鉄駅3番出入口の「タクシー乗り場」そば)の降車専用の停留所には、北海道中央バス札幌ターミナル(大通東1丁目)・札幌駅バスターミナル行きの都市間高速バスが停車します
乗り物	ターミナル	一日おいて8月31日の夕刻モスクワ市内の鉄道ターミナルのリガ駅の地下鉄入り口でチェチェン人の婦人が身に付けた爆弾を破裂させ、通行人ら10人が死亡、51人が負傷した
空港	ターミナル	新ターミナルオープン後のお客様の評価も、65%以上のお客様が旧施設に比べ新ターミナルの方が良いと回答された他、75%の方は新ターミナル及びスター アライアンスの便の利用を好むと回答されるなど、お客様の高い評価をいただいております
乗り物	ターミナル	サービス開始当初は山手線や中央線など、首都圏のJR主要125駅の構内・ホーム喫煙場所の情報や、新宿や渋谷、池袋などのターミナル駅の周辺喫煙スポット情報が配信される
その他	ターミナル	さて次はジャンパー線としての加工ですが、ターミナルピッチ6cmにこの太いケーブルをYラグを使って接続するのは大変で被覆のある状態ではとても曲げられないのでターミナルピッチ分弱を被覆を残して素線を曲げてコの字型になるようにしました
空港	ターミナル	空港も昭和中期に開港して以来、滑走路の延長やターミナルの整備が進められ、ジャンボジェット機などによる定期便やチャーター便の就航により国内はのみならず、近年は台湾など国外からの観光客の入れ込みが増えている
空港	ターミナル	JAS塗装のままのJAL機はあっという間に羽田空港(HND)に着陸し、ターミナルを横目に見ながら延々とタキシングし、臨時便らしくかなり離れた駐機場(地図)に停止
コンピュータ	ターミナル	誰か、UDの管理者にW2K Serverのターミナルサービスで解析すると中途半端に宿題提出されるってバグを指摘して使えなくしてやってくれ・・・・
乗り物	ターミナル	かつて京都線が梅田乗り入れを果たす以前の、大阪方のターミナル駅として栄えましたが、現在では千里線~大阪市営地下鉄堺筋線の途中の地下駅と化しています
その他	ターミナル	特に単身赴任や独身者に関わるガールフレンド、現地妻や婚約者など派手派手に着飾った女性達が、この際基地を見てみたいと言う親戚知人を伴って押し寄せ、狭いターミナルのホールは立錐の余地も無い
空港	ターミナル	マカオからホンコンへ渡る際、ほぼ100%外港フェリー・ターミナルを利用してきたが、時間にも金銭的にも余裕があったので奇をてらって珠海の九洲フェリー・ターミナルからホンコンの上環までの航路を利用してみた
空港	ターミナル	新ターミナルの空港東側移転に伴う公共交通アクセスについては、盛岡方面の特急バス、花巻・北上市内方面の路線バスを運行している事業者に対して、現行路線を基本とした新ターミナルビルへのアクセスについて、空港利用促進協議会とも連携しながら、働きかけを行うなど二次交通網の維持・充実に努めていきます
乗り物	ターミナル	当社はターミナル駅である小田急線町田駅にあり、新宿方面へ向かう小田急線と横浜方面へ向かうJR横浜線の2線を中心に豊富に物件を取り揃えております
乗り物	ターミナル	千歳空港→JR千歳空港駅から札幌行き約36分札幌駅下車→JR宗谷本線稚内行き約240分音威子府駅下車→バス天北線浜頓別行き約80分約2分浜頓別ターミナル下車→徒歩約2分
その他	ターミナル	◆iPodの音楽をデジタル転送◆USBメモリーからの接続にも対応◆FM/AMラジオチューナー付き◆リアルサウンドラボ社のオンキョウ技術を採用◆バナナプラグ対応スピーカーターミナル
乗り物	ターミナル	『秋葉原への出店について同社広報担当者は「秋葉原は各線のターミナル拠点であることと、電気街で世界的知名度が高く話題性があることと、また『メガネ男子・女子』のブームを背景にアジア圏からの観光客も多く訪れる街であるため」と話している
空港	ターミナル	また、この日、成田空港の旅客ターミナルビルの預託手荷物仕分け場でカナダのバンクーバーから到着したカナダ太平洋航空のジャンボ機に積まれていた荷物コンテナが爆発して、作業をしていた日本人従業員2人が死亡し、4人が重傷を負った
空港	ターミナル	第1ターミナルには福岡市営渡船(西戸崎・大岳・志賀島ゆき、玄界島ゆき)、安田産業汽船の「うみなかライン」(海の中道ゆき)、西鉄シティホテル(西鉄の子会社)が運営する博多湾クルーズ船「マリエラ」、九州郵船の壱岐・対馬航路ジェットフォイル「ヴィーナス」などが発着する
空港	ターミナル	また、現代物流の要所である空港、港湾鉄道、トラックターミナルの模型のほか、物流に関する映像、クイズ、インターネットなどを通して、暮らしと産業に欠かせない物流のしくみをわかりやすく紹介しています
乗り物	ターミナル	整備の目的は「市や県の玄関口として広域交通のターミナル機能を強化し、交流人口の増大や高齢者、障害者などの移動の円滑化に配慮した基盤整備を目指す」などとしている
空港	ターミナル	乗車前に、「便指定乗車券」・「時刻指定券」を空港各ターミナル1階到着ロビーにあるバス乗車券取扱いカウンターにてお求めいただき、のりばにお越しください
空港	ターミナル	映画『 ターミナル 』は国際色豊かで、ターミナルで働く人達やターミナルを闊歩する旅行者達は、フランス人、中国人、アラブ人、ケニア人、インド人、キューバ人、エルサルバドル人、オランダ人、スペイン人等が入り乱れて登場する模様
乗り物	ターミナル	同署の調べによると、運転手は昨年1月14日午前9時40分ごろ、庄内交通が 運行する酒田ターミナル(同県酒田市)発山形駅行きの高速バスを運転中、 鶴岡市内の国道112号のトンネル内で意識を失い、ハンドルから手を離したまま 走行した疑いがもたれている
空港	ターミナル	フェリーターミナルの隣の敷地には、今っぽいカンジのお土産物屋とレストランが併設され、これまでの国道の景色とは似つかないファミリー連れや観光客でごった返しているが(ほとんどの人たちは国道ではなく、比較的最近整備された高速道路の方を使って来ているのだろう)、私はそっちの方には目もくれずに(笑)フェリーターミナルの自販機で缶コーヒーをGetし、海岸を散策する
乗り物	ターミナル	[アクセス]長崎空港→バス諌早線長崎空港から諌早行き約40分諌早駅前ターミナル下車→バス雲仙線雲仙行き約80分西入口バス停下車→徒歩約0分MAP
空港	ターミナル	国際ターミナルは利尻・礼文行きターミナルと800mくらい離れており、そこまで重い荷物を引きずって歩いてゆくのは大変なので、車を用意してくださったのは本当にありがたかった
空港	ターミナル	市バス+鉄道:第2ターミナルから200E系統(空港バス)でフェリヘジ空港第一ターミナル駅まで行き、ハンガリー鉄道に乗り換えブダペスト西駅へ行くことが出来ます
空港	ターミナル	長い間、高い空港利用料と混雑で有名であった大都市空港のLoganが、新滑走路、ターミナル、駐車場を増設し都心から新たな湾岸トンネルを建設して、LCCの誘致に積極的になっている
乗り物	ターミナル	さらに岐阜大学病院跡地はLRTとバスとの結節ターミナルとし、長良橋通りを長良橋から岐阜駅に向かうバス路線と忠節橋通りを忠節橋から岐阜駅に向かうバス路線を引き込みます
その他	ターミナル	※Windows 95のダイアルアップネットワーク設定を行う前に、アナログ回線の場合はモデム、ISDN回線の場合はTA(ターミナルアダプタ)をパソコンに接続しておく必要があります
コンピュータ	ターミナル	ルータに LOGIN するには、CONSOLEポートからターミナルソフトを使用する方法もあるが、これは最初の設定時(なにしろ最初はIPアドレスがふられていない)等に使い、通常は telnet する
空港	ターミナル	東京航空局は、2008年に着工予定の新千歳空港国際線ターミナルビルへの雪冷房導入に向けて、12月にも産学官による「雪を利用した環境施策検討会」を設立する
空港	ターミナル	来月の羽田空港第2旅客ターミナル併用開始に対応して、東京モノレールでは羽田空港第2ビル駅への延伸を予定しているが、これに伴うダイヤ改正の詳細が発表された
空港	ターミナル	BD本部は東京で「ティーズ原宿」、「ワイ・エム・スクウェア原宿」を総合プロデュース、海外でも「香港オーシャンターミナル」のリニューアルに伴う商業企画を受託した実績があります
乗り物	ターミナル	このほか、遊休地となっている旧昭和ターミナル(美原3)に複合施設の建設を計画している函館バスが、市から10年間の無償貸し付けを受けている昭和営業所(昭和1)について契約期間終了後も延長して借用したいとの申し出があり、同協議会で対応を協議することを申し合わせた
乗り物	ターミナル	1966〜1968年には、十三駅南東の現・淀川区役所付近に、阪急バスの出資会社である日本急行バス等の名神ハイウェイバスが停車する「十三阪急前」停留所ターミナルがあったようである
空港	ターミナル	JAPAN WEEKS 2007(1月20日から2月28日)の開催に伴い、成田空港を訪れた外国からのお客様をもてなそうと第1旅客ターミナルビル北ウイング到着ロビーおよび出発ロビーにおいて歓迎・見送りイベントを行いました
乗り物	ターミナル	* 21系統 姫路駅前~市民会館(→のみ)~京口駅前(←のみ)~市川橋~御着駅前~別所~曽根~鹿島神社:JR姫路別所駅開業時に別所駅前ターミナルに乗り入れがありましたが今は乗り入れていない(最寄バス停は別所)
その他	ターミナル	ところが、このターミナルには、マイカルの商品搬送車両の出入り口も設置されており、1日平均の利用台数はバス約150台に対し、トラックなどの搬送車両はそれより多い170~200台
乗り物	ターミナル	まず首都大学東京の秋山哲男教授から『公共交通のユニバーサルデザイン』と題して、交通バリアフリー法と施設やターミナルの整備の義務づけ、地方自治体の基本構想による駅とその周辺のバリアフリー化、また住民提案に対する自治体の協力の必要性について伺いました
