# コンピュータ: パソコンやワープロで、フロッピー　ディスクを差し込む穴に対応する通信路。, 卓球: テニス・卓球などで、ボールに順回転を与えるように打つこと。ドライブをかけるまた、ゴルフなどで、ボールを遠くへ飛ばすこと。, 自動車: 自動車で遠出をすること。
自動車	ドライブ	長崎 出島 ワーフ長崎ペンギン水族館でかわいいペンギンの姿を楽しんだ後、まっすぐ自宅へ帰ろうとしたのですが、ドライブ大好きな相方君が、「せっかく長崎まで来たんだ
自動車	ドライブ	やっぱり勇気がいるので(笑)パッソなら都内を安心して走れると思ったので、都内をショッピングしながらドライブしてみたいですね」と今後のカー・ライフについての夢も話していた
自動車	ドライブ	道は空いていて、快適なドライブだったのです が、京都を出る際に、タイヤの(後輪の右側)一部に亀裂が見られたため、念のためにいつもより2割程度速度を落としての運転となったのです
自動車	ドライブ	F1・音楽・コーヒー・紀香様・チョコ・犬・サービスエリア・こたつ・写真・懐かしいもの・栗山千明・柴咲コウ・ムーミン・百人一首・パン・白米・DS・散歩・新品のノート・京都・正月・漫画・卓球・雑貨・ドライブ・旅行・サザエさん
その他	ドライブ	ジローはボレーに早さを見せたが、リョーマがドライブBでそれを切りくずす恰好となり、その後、ツイストサーブにジローは追い付いたのだが、遅すぎたのだった
その他	ドライブ	問題のファイルはローカルドライブの中ではなく、他人の共有フォルダの中だったので(個人的には他人の共有フォルダの中身を直接開くのは消えるとまずいからやりたくないが
コンピュータ	ドライブ	たまたま再起動したら、Cドライブに「あるはずのネスケが壊れていて立ち上がらない、するとWindowsはCドライブだけでなくDドライブまで探しに行って「ショートカット先が見つかりませんでした
自動車	ドライブ	「昼から、どこへいくやぁ」と秀爺 「雨も降っているすけぇ、遠くへ行っても、しょうがねぇしのう」と私 「また、高速乗って、ドライブするか」と秀爺 近頃の秀爺は、高速がお気に入り
自動車	ドライブ	アンティークショップがたくさんある、というわけではないので、また長時間ドライブの時間との戦いになりそうですが、また時間を見つけて、ちょこちょこ様子をご報告できたらいいな、と思っています
卓球	ドライブ	斎藤は、全盛期を彷彿とさせるバックハンドサービスでチャンスを作ってフォアハンドドライブで仕留める得意のパターンでポイントを重ねて、3−1で快勝
その他	ドライブ	最初なぜだか、ドライブが感じられませんでしたが、最近乗り馴れてきたのか、ボトムからトップへのグゴーンて感じでのドライブが出る様に扱える様になりました
自動車	ドライブ	html 2滋賀県警甲賀署は4日、ドライブ中の車を止めさせ運転者らに暴行し現金を奪ったとして、強盗致傷 の疑いで同県湖南市のトラック運転手(18)ら少年2人を逮捕した
自動車	ドライブ	テンポがあってかつちょっとエッチなシーンもあるけれど、僕は横須賀の山手をドライブしていたときのコンバーチブルトップをあけたときの星空のシーンがとても好きです
自動車	ドライブ	昼くらいから雨がポツポツと降ってきたんですが、タープ・テーブルなどを撤収して、琵琶湖沿いの国道をドライブして、大和の湯という温泉へ行ってきました
コンピュータ	ドライブ	また、解職が不当だと主張した前社長の野副州旦(のぞえ・くにあき)氏が、富士通のHDD(ハードディスクドライブ)事業の売却などの施策を通じて大規模構造改革を進めてきた人物だったことから、「急激な改革路線を良しとしない院政側が巻き返した」(あるITコンサルタント)とのうがった見方も広がった
その他	ドライブ	《商品説明》●ドライブ攻撃用●ドライブがしっかりかかるカーボンラケット●薄めのカーボン材を中芯材と2層目との間にはさむことにより、ドライブ時の引っ掛かり具合を損なうことなくスピードアップに成功
自動車	ドライブ	屋外でロケが行われる時には、山口は訪れた先の飲食店で供される料理を食べたり、街をブラブラしながら道行く人と話をしたり、スポーツをしたり、ドライブをしたり、大型自動二輪車の免許を取得してツーリングしたりとその内容は至ってシンプルで、バラエティ番組らしい企画は少ない
自動車	ドライブ	今回のイギリスのドライブ旅行は僕のアイデアであったにもかかわらず、実際は飛行機の到着時刻も、当日の宿泊地がロンドンではなくオックスフォードであることもあまりよく認識していなかった
自動車	ドライブ	ところで話は変わるが、この夏帰省してたときに徳島にぶらっとドライブに行ったのは独り言に書いたとおりだが、その帰りに国道の道端で本格的なロードタイプの自転車のパンク(「本格的」の割にはチューブだった)を直してるウェアもばっちりな人と、それを眺めてる普段着のおばちゃんと、なぜかカメラを回してるおっさんという変ちくりんな組み合わせの人達を見た
その他	ドライブ	ドライブスルーが混雑ぎみのマクドナルド、ハイオクキャンペーン中のセルフのガソリンスタンド、クルマ好きのオニイサンでにぎわう洗車場—— の肩越しで、さっき見てきたはずの景色たちがビデオテープを巻き戻すかのように、つぎつぎと通 り過ぎていく
自動車	ドライブ	普段のドライブで、日常的にカーナビを使っているだけなのに、裏では高度なリアルタイム情報のやりとりがおこなわれ、カーナビにそのときの最新情報が反映されている
コンピュータ	ドライブ	修正法と称して、コマンドプロンプトからCドライブをフォーマットする方法や、ドライブ内の全ファイルを削除する方法などを紹介する悪質な書き込みや、ブラウザクラッシャーやトロイの木馬のURLを「対策ページ」として貼り付けるなどのケースも
自動車	ドライブ	前回マウントクックに行ったときは自分でレンタカーを運転して行きましたが、大雪に降られてヒヤヒヤ・ドキドキのドライブだったので、今回はクイーンズタウンからフィヨルドまでツアーに参加してきました
コンピュータ	ドライブ	一応、CドライブもDドライブも一つのハードディスクなんですが、ハードディスクをそのまま使うと大きすぎて整理整頓に不便なので、便宜上Cドライブ、Dドライブと間仕切りをつけて区別しています
卓球	ドライブ	フリスタテックはフローターサーブ(無回転サーブ)のときの予測不能な不安定な動きを抑えられますが、ドライブサーブのときは、回転して起きる空気の流れや物理法則によりボールは変化します
自動車	ドライブ	海辺を歩くわけではなく、ドライブとレストランに行くだけですので、敢えてカジュアル感の強いヨットシューズではなく、ドレス度の高まるホールカットにしたわけです
その他	ドライブ	まず、交通渋滞緩和策の策定、それから、エコドライブの推進、こちらにつきましては、市バスの利用、それから、自動車の使用抑制ということで、これは対応しております
卓球	ドライブ	家の卓球マシーンで社長のループドライブやサービスを8割り方再現できたので、毎日練習すると、1ヶ月ぐらいでスマッシュができるようになり、サービスも3分の1ぐらいは返球できるようになった
その他	ドライブ	電圧検出・ドライブ用の2SA1015の部分はドライブ電流も大切ですが結局はカット電圧付近での電池電池圧から各経路を通ってスイッチング用トランジスタのベース電流をどれだけ流せるかですので、トランジスタのhfeだけ高くしても大元の電圧が低いのでなかなかうまくゆきません
自動車	ドライブ	ベトナムでも繁華街に行くとクリスマスイルミネーションが見られますし、家族全員でサンタクロースの帽子をかぶって、ドライブを楽しむ様子を目にすることもありました
その他	ドライブ	単なるドライブルートや渋滞情報の案内の域を超え、ショップやアミューズメントスポットの情報、駐車場の空き情報などもリアルタイムで取得できるカーナビ
その他	ドライブ	【課題を解決するための手段】上記目的を達成するため、本発明の1つの可搬型電子コンピュータは、コンピュータの機能を管理する電子装置を備えた本体と、読取り/書込みディスク記憶装置用で、外部電源から給電されうるディスクドライブを収容するハウジングとを含み、前記ハウジングがディスクドライブの代わりに前記外部電源の少なくとも一部を収容しうることを特徴とする
その他	ドライブ	粘着性裏ソフトラバー(ドライブ攻撃用) 次世代粘着性ラバー 柔軟性の高い(ボールの食い込みが良い)トップシートが従来の中国製粘着性ラバーをしのぐグリ
その他	ドライブ	(今回はとりあえずサービスを入れることが目的なのでこの位置ですが、ドライブサービスやカットサービスなどを打つときには、ラケットの位置や角度は多少変わります
自動車	ドライブ	温暖化は寒冷化よりまし: 高速道路を無料化した場合、長距離ドライブのコストの大半がガソリン代となるので、より燃費の良い自動車への買い換えインティブとなると思います
その他	ドライブ	財団法人運輸低公害車普及機構は、ドライブレコーダーの搭載がドライバーの燃費改善意識を高めるとして、運輸業者などを対象に機器導入費用の3分の1を補助する事業を毎年行っている
コンピュータ	ドライブ	磁気共鳴断層撮影装置)、コンピューターのハードディスクドライブ、通信衛星発信機、手術用レーザーメス等数多くのハイテク産業で目覚しい活躍をしています(I特異な原子構造を持つものが多く、強力な磁性、誘電性、光信号増幅性などの特性を利用し、MR」と名づけられました
コンピュータ	ドライブ	・ アバターに加えて、カスタマイズ可能なプライベートスペースにおいても、家具や美術品などをユーザーの好みに合わせてパーソナルに演出したり、スペース内でPS3のハードディスクドライブに保存されたユーザーが作成した個人の動画や写真などのデジタルコンテンツを公開することも可能
自動車	ドライブ	母は今回が初めての北海道旅行で、姉も学生時代に一度来ただけらしく、ドライブ中に座席後方から聞こえてくる北海道に関するおぼこい会話を聞いているのが面白かったです
その他	ドライブ	そういった意味では、時流にあらがったかも知れないように見えるし(本作の後にもトップビュータイプのレースゲームは発売された)、大ヒットするという要素が欠けていたように思えるし、ドライブゲームではアウトランを越える作品が無かったように、本作もその例外から漏れることが無く、更に大ヒットできず、短命に終わり、その意味では凡作になってしまったようです
自動車	ドライブ	毎朝の彼とのドライブも悲観的でなく、楽しくやっていこうと考え、毎日学校へ行く道を変えたり、今日はパン屋さんに寄って店のおばさんに元気な顔を見せようとか、今日は仲の良い友人の家の前を通って通学路を少し覗いてみようかなど、毎日目標を決めて少しずつ学校に近づき、彼の登校に向けての自信に繋がればとの思いでした
コンピュータ	ドライブ	私のパソのハードディスクはCドライブ(約14GB)とDドライブ(約37GB)に分かれているんだけど、iTunesの音楽データが容量の小さいCドライブに入っている
自動車	ドライブ	水加減を見て釣り人と一緒に出かけて見るつもりですが、鮎釣の皆さんも連休ですので赤穂の方面にドライブでもされる様でしたら、覗いて見るのも楽しみかも知れません
卓球	ドライブ	ちょっと通常のラバーと異なるのは硬いと弧線が直線的になってドライブを打つのに弧線を上目にしますが、G3では自然と上向きになるので打ちにくさはありませんでした
卓球	ドライブ	軟らかいラバーで、ミート打ちもやりやすく回転もよくかかる、なおかつスピードも出るのでスピードドライブ、ループドライブ、ブロックもなんでもできます
その他	ドライブ	今後はカーナビゲーションシステムと連携をとることが想定され、カメラだけ外付けで設置し、ドライブレコーダーのHDD機能をカーナビに持たせる動きが活発化する可能性もある
自動車	ドライブ	彼は、電車・バスを積極的に使うと言ってたので、オレなんかよりずっと先に行ってるかと思ってたら、最近はレンタカーを借りてドライブを楽しんでるとのこと
卓球	ドライブ	孫飆教授は紹介して、私達がドライブをかける動作を学ぶ時、ラケットを振ってドライブをかける姿勢をして、繰り返し数十数(何)百の下で甚だしきに至ってはをして、毎日このように練習して、動作がマスターした後に、出場する卓球をすること時、引き出すボールに適して、すぐに条件反射ができてラケットを振って引き出しますとまったく頭を使って思う必要はありません
自動車	ドライブ	前々から嫁さんにタイヤ換えろタイヤ換えろと言われていたのだが、普通に走っている分には支障がないのでなかなか交換する気にならなかったが、ボーナスも出たし、来月は長距離の高速ドライブをするということで、渋々交換することにした
自動車	ドライブ	ドライブ途中で車がパンクしてしまった為、森の中で一夜を過ごすことになったジョン(ジョナサン・フラニガン)とジェニファー(ビヴァリー・ハインズ)
その他	ドライブ	挑んだらボッコボコにされてたんだろうな(汗)桃太郎チーム、、、なかなかやりおるY左シェークのドライブマンにイボイボラバーのカットマン、普通のカットマンに表ソフトのカットマン、ペンの速攻、、、むぅ、、、今度から混ぜてもらうべきか、、、
卓球	ドライブ	夢野まりあ法を使うことも戦型であるブロック相手のスマッシュやドライブに対して前〜相手でバウンドの頂点で上がるとに採用する守備技術裏ソフトで攻撃する打球を打法に確認する相手が返す裏面打法の球の変化をかけてあるそのまま返す選手の力を大別して返すにスイングされる馬琳日本を用いて応
コンピュータ	ドライブ	さらに、BIOS、PC基板、ハードディスク、液晶パネル、光ディスクドライブなど、主要コンポーネンツを自グループで開発する、単なる部品組み立てメーカーとは違うノートPC作りの豊富なノウハウと差異化技術を持っています
自動車	ドライブ	ドライブ時、光が眩しくてとてもフロントガラスにUVカットが入っているために、一般的な調光レンズではほとんどレンズカラーが変化せず、調光機能は効きませんでした
自動車	ドライブ	ゆうちゃんリッチだから途中タクシー拾ってったんだけど、そしたらタクシーの運チャンが道分かんなくて、4人で30分くらい迷子状態(笑)とりあえずドライブを楽しみました☆
その他	ドライブ	◆ゲーム:アクションエディター4本体が存在するドライブとは異なるドライブからステージファイルやリプレイファイルをロードしようとすると強制終了したりフリーズしたりするバグを修正
自動車	ドライブ	洲の崎から白浜までの、美しい平砂浦ぞいの道路はフラワーラインと呼ばれ、関東でも最も早く咲く一面のお花畑の中、散策やドライブを楽しむことができます
卓球	ドライブ	そして決勝でも後輩の水野(東京アート)に今大会4回目のゲームオールに持ち込まれたが、懸命に動いて裏面とフォアハンドドライブの連係で粘り強く戦って優勝を果たした
コンピュータ	ドライブ	実際には、1スピンドルといえばハードディスクだけを内蔵したノートPCのこと、2スピンドルといえば、ハードディスクとDVDドライブなどの光学系ドライブを内蔵したノートPCのこと、3スピンドルといえば上記の2スピンドルに加えてフロッピーディスクドライブを内蔵したノートPCのことを指すのが一般的だ
自動車	ドライブ	チェックイン時間の午後3時までどこかで遊んだりドライブしたいなーと思っているのですが、みなさんオススメの滋賀スポットを教えていただけると嬉しいです
その他	ドライブ	が、ドライブ選手もすぐに上達して逆回転ボールをバシバシ打ち返してくるようになるので、ある程度のレベル以上になると途端に勝てなくなるというのが、素人カットマンの多くが辿る道です
その他	ドライブ	このドライブレコーダーというのは、安全面であるとか環境面であるとか、そういう面から装着は極めて有効になってくると思いますし、これからますますその必要性が出てくるかと思います
その他	ドライブ	船体や船底塗装工事は、船体各部の傷・亀裂等がないか年1回ないし2回上架し、船体の清掃・修繕及び船底・外板の塗装、又、機関・ドライブユニット等の整備点検を行っている
自動車	ドライブ	それか先日、無事に車検から帰ってきました 145 なんだかんだで、 約3週間ぶりのドライブを楽しんだのですが、車検のついでに イジッた箇所は次の機会にご紹介するとして、とりあえずは、 約半年ほど前に実施した
自動車	ドライブ	今日はドライブにでも行こうと思っていたのに、思いっきり昼寝をして過ごしてしまいましたorz 今週は、昨日床屋に行くのにちょこっと運転した以外に運転していませんから、いつもどおりお台場あたりまで流そうかなあと考えていたのですけどねぇ
卓球	ドライブ	ヨーロッパの女子選手のトップにいる世界ランキング7位のボロスと、長身のアガノビッチが繰りだすパワードライブにたいし、日本ペアの前陣でのカウンタースマッシュが小気味よく決まる
その他	ドライブ	ドライブ・バイ・ワイヤ方式は、実際のアクセルの“踏みしろ”を、電子制御(ワイヤ=電線)により、スロットルを制御するモーターに信号を伝えますので、アクセル操作を従来より軽くしたり、メーカー側では右ハンドル・左ハンドル車に対応するパッケージングの自由度事が高まる事もあり、近年急激に普及しています
その他	ドライブ	同じようにメガドライブのユーザーがこのソフトウェアーを開封せずに知らんぷりを決め込んでいれば、なんぼかましなメガドライブライフを得ることができたのではないでしょうか
自動車	ドライブ	後半はレンタカーで行動範囲を広げ、海岸線はBUNBURYまで、内陸はKukerinという、行けども行けども牧場続きの、ヤビーという沼えびの養殖場まで走り、日本では体験できない快適なドライブと、広大なオーストラリアの台地、美しい海岸、素晴らしい道路網を見ることが出来ました
自動車	ドライブ	今日は、昼から旦那とドライブに出かけようと出発したのはいいんだけれど、出てみると、アウトレット行きの車で今まで見たことないくらいに道が混んでて大渋滞でビックリ
卓球	ドライブ	スマッシュの方がドライブより返しにくい、と言うことは攻める方もやっぱりドライブだけではだめで、スマッシュを打たないといけない、と言うことになりますね
コンピュータ	ドライブ	通常は、デジカメでは、特定のディレクトリーに画像ファイルがありますので、「その他の画像を取り込むドライブ」のところで そのディレクトリーを指定して、ID入力、検査選択 をしてファイリングします
その他	ドライブ	ドライブユニットは、互いに咬み合う爪と溝とによって動力を伝えるドグクラッチ式と称するクラッチが入力軸の嵌脱クラッチ及びクラッチ軸の前後進クラッチとしてそれぞれ1組ずつ備えられていた
自動車	ドライブ	大宮駅⇒長野新幹線(自由席)⇒長野駅⇒レンタカーでドライブ⇒湯めぐりの宿 清風荘宿泊 2日目:自由行動 3日目:湯めぐりの宿 清風荘⇒レンタカーでドライブ⇒長野駅⇒長野新幹線(自由席)⇒大宮駅着 ◆ご注意事項
自動車	ドライブ	ということで、そんな季節の真っ只中、6月24日、八雲町にオープンしたばかりの道内10番目となる道立公園「噴火湾パノラマパーク」にあるオートキャンプ場「オートリゾート八雲」に行って、おいしい空気、おしい景色、おいしい地元の食材をたっぷり味わってきたゴーゴードライブ
コンピュータ	ドライブ	ネット上の情報では、DVDドライブなどを先に外す方法が書かれていましたが、それをパスできそう(要するに外す必要は無い)なので、一気に本丸に攻め込みます
自動車	ドライブ	また、車山高原周辺には、家族で楽しめるレジャー施設やアウトドア、雄大な大自然を間近で体感でき、 ビーナスラインをドライブやツーリング、またはゴルフやテニスなどアクティブに動いた後は日帰り温泉でゆったりと・・・
自動車	ドライブ	北陸道から上信越道に乗り新井パーキングエリアで休憩した後、 あまり走らない関越自動車道を走ってみようと言うことになり、そのつもりで走っていましたが、更埴の先で渋滞ありの表示を見て、 急遽長野道へ予定変更となりました(私のドライブではしょっちゅうあることです)
自動車	ドライブ	さらに所沢市街での渋滞にも関わらずこの日の平均燃費が20km/lを超えたのに、燃費の良さという点についてはやっと手応えを感じるドライブでもあった
自動車	ドライブ	友人から首都高速運転は無理といわれました・・カーナビ着いてるから・・道は大丈夫ですけど 東京の新宿からの東京近郊のドライブスポットはどこですか
その他	ドライブ	低音を増強するバスレフダクトの形状を一般的な丸型ではなく、スリット型にして開発された独自の低音技術「AERO(エアロ・) ACOUSTIC(アコースティック) DRIVE(ドライブ)」を搭載
自動車	ドライブ	最近は早起きドライブして、インター出口の渋滞に長時間並んで駐車場入庫するのもしんどくなってきたので、金沢に一泊して小松航空祭を見に行くことにした
