# コンピュータ: パソコンやワープロで、フロッピー　ディスクを差し込む穴に対応する通信路。, 卓球: テニス・卓球などで、ボールに順回転を与えるように打つこと。ドライブをかけるまた、ゴルフなどで、ボールを遠くへ飛ばすこと。, 自動車: 自動車で遠出をすること。
卓球	ドライブ	横回転や下回転のかけやすいラバー探してます 少し前、フォア面を[Nittaku ハモンドX 厚]に変えたのですが、ドライブはいい感じに入ってくれますが、サーブの際、横回転、下回転もろもろ、全然回転してくれません
卓球	ドライブ	またアイバーソンのアシストについてなのですが、彼は本数自体は多いのですが、その大部分はドライブしていってディフェンスが小さくなったのをみての外へのパスで苦し紛れのパスが結果的にアシストとなっているように思えます
その他	ドライブ	9のエアロアールシー基板流用記事ではに誤解があって、「推進モータとステアリングモータを左右のモータに使用すればよい」様に書いてありますが、ステアリングのモータドライブは1
その他	ドライブ	〇前田参事 エコドライブと申しますのは、地球温暖化要因の一つでありますCO2や大気汚染の原因でございますNOx、PM等を減らすために、環境に配慮して自動車を運転することでございます
卓球	ドライブ	森薗はカット打ちはうまいほうじゃないかもしれないけど、日本のカットマンと同じやり方では難しい、ストップしてドライブしてスマッシュというセオリー通りのやり方では勝てないと感じました
その他	ドライブ	エコドライブは、きゅうかそくをさけたり、ぜんぽうしゃりょうとのしゃかんきょりをじゅうぶんにとることでむだなブレーキやさいかそくをなくし、じどうしゃのねんぴをこうじょうさせるうんてんしゅほう
卓球	ドライブ	しかし何度かやり取りをしてみるけどどうも向こうの人にも原因がよく分からないらしく、ああだこうだと一週間ほど続いた後に、向こうの人がドライブを変えてみてはどうかと
卓球	ドライブ	ドライブを打ちながら前へ詰めては決め、また仲尾選手のつくったチャンスには力強くスマッシュをコートに突き刺し、1本を決めるごとに大きな声で気合の入ったガッツポーズ
その他	ドライブ	じっくり話をお聞きすると、エコドライブを意識するがあまり、周りの車の事も考えず、ノロノロ運転で渋滞を作ったりする事で逆にCO2の排出を促進してしまうケースが有るんだそうです
その他	ドライブ	駐車場やガソリンスタンド、ドライブスルーなどの店舗の出入り口に設置したアンテナと、車載機器との間で、駐車料金やガソリン代などを瞬時に決済できる
卓球	ドライブ	フォアドライブの打ち方をH川さんに教えてもらったが、要点は(1)テイクバックは体と平行まで(2)ラケットを振り上げると同時に左足を前に踏み出す、の2点
その他	ドライブ	BMWのXドライブはまだ投入されていませんが、フォルクスワーゲン系の4モーションかアウディのクワトロ仕様・・・、結局ドイツ車になってしまうかなあ
コンピュータ	ドライブ	コンピュータはモニタやキーボード、CDROM ドライブなど手元におきたいものにつながっていたので、MIDI やオーディオカード、サンプラーとの SCSI ケーブルとかが「びよーん」と双方をつないでいたんです
自動車	ドライブ	他県からの石川県の観光といえば金沢の兼六園や地震でもがんばる能登半島のドライブ、和倉温泉の宿泊など、そんなお決まりコースオプションとして七尾城跡にナビを設定して行ってみましょう
卓球	ドライブ	得意技は、ドライブボレー、眼力(インサイト)、ジャックナイフ、破滅への輪舞曲(ロンド)、タンホイザーサーブ、フロントフットホップ、氷の世界など
その他	ドライブ	ドライブは、基本的にブラボーワンと同じ物で、エンジン2基と共に、今年のシーズン前点検では大きな不具合も無く、オイル漏れや冷却水漏れは見当たりません
自動車	ドライブ	さてと、とか何とか憂鬱な書き込みから始まったけど、今週末はどこかへドライブに行こうかなぁ~GWが終わったから、そろそろ本格的に一人ドライブに行こうかと思う 去年は新車効果もあって、ものすごい距離この時期に走った気がするなぁ~ものすごい、ガソリン代が掛ったような
コンピュータ	ドライブ	株式会社 アーク情報システム(本社:東京都千代田区、代表取締役社長:藤井 悦郎)は、Windowsパソコン上のハードディスク内にDVDやCDを仮想化させて、物理的なドライブがなくてもDVDやCDのデータが利用可能となる仮想化ソフトウェア(ユーティリティ)「CD革命/Virtual Ver
卓球	ドライブ	食い込ませるドライブは、やわらかいスポンジの高弾性ラバー(ハイテンションラバー)を使って、ボールを厚く捕らえることでラバーに「ひきつれ」を起こさせて、それが戻る力を利用して回転をかけます
卓球	ドライブ	青学と立海の決勝戦でリョーマと真田の試合を見たことで奮起、トレーニングと特訓を重ねた結果、「ドライブC」と同じくイレギュラーバウンドを利用した跳ねない「タンホイザーサーブ」(初出はアニメで、原作に逆輸入された)、リョーマの「サムライゾーン(不完全)」の回転を見抜くほどの「眼力(インサイト)」、相手の死角を的確に捕え、真田の風林火山(山)をも破った「氷の世界」などの技をあみ出した
その他	ドライブ	そういう意味では、このドライブレコーダーは、少なくとも一助にはなる機器なので意味はあると思っているんだけど、現場状況の記録=ドライブレコーダーという図式になりそうな風潮には少し疑問を感じているのです
その他	ドライブ	例えば、ある外資系コンピューター関連企業では、社員がお米を自宅から持ち寄るというライスドライブを行ったり、別の会社では2HJのボランティアが社内でフードドライブを主催したりといったこともありました
卓球	ドライブ	坂本のバックハンドショットとドライブサーブ、宮本の的確なパス、キルショットの応酬で1点を争う展開となったが坂本のバックハンドキルショットが決まり1セット目は逃げ切り
コンピュータ	ドライブ	同社では、編集の素材となるオーディオ・ファイルを複数のハードディスク・ドライブに分けて保管していたが、社内ネットワークが貧弱であったために、そこに格納されたファイルをリアルタイムで実行させることは不可能であった
その他	ドライブ	従来の親会社"シナノケンシ"と子会社"プレクスター"の関係は、シナノケンシが開発・製造した光学ドライブをプレクスターが販売・サポートするという形でしたが、今回の全業務移管によりシナノケンシが製造・開発・販売・サポートを行う事になります
自動車	ドライブ	は海外旅行先でのドライブ、海外での運転は結構怖いものですが、行動の幅を広げるためにレンタカーで走り回ってます、観光地だけでなく普通の住宅街なんかも走っちゃいます、現地の人の生活を覗いてみるのも面白いですよ(笑)
コンピュータ	ドライブ	暗号化ファイルが存在するドライブに対し、HardKey/EGProを接続したままデフラグを行うと、処理終了後、暗号化ファイルが破壊されてしまいます
コンピュータ	ドライブ	本センサの具体的な用途としては、落下する瞬間に電源をOFFにしてデータを保護するハードディスクドライブや、患者の活動レベルの監視を行う医療機器などで利用できる
コンピュータ	ドライブ	うちのPCもそろそろ限界なので(内蔵ドライブが壊れた、XPがおかしくなってるのにリカバリディスクを失くした(T▽T))、新しいのが欲しい今日この頃
自動車	ドライブ	これまで同様、長距離ドライブでもできるだけICから外にでなくなり、高速道路会社関連のレストランや売店だけが繁盛するという図式が維持されることになります
自動車	ドライブ	気に入った女の子とドライブしたり、付き合っていた女の子と別れ話をしたり、男同士で朝まで騒いだり、初めて東京に出かけたときも名神~東名を駆け抜けた
その他	ドライブ	ただし、EOTを研究して開発されたテスラ・ドライブは、ドライブそのものにはEOTを使用していないという理由でヴァイスリッター以降の機体に標準搭載されるようになった
その他	ドライブ	書き込みかのうでスロットインのドライブもあったんだけど、2ばいそくかきこみはまあしょうがないとして、ポータブルでもrayのよみこみとかきこみじに電源が必要というのが納得できなかったので、このてのポータブルドライブはバスパワーで駆動してなんぼというかちかんのもちぬしたる筆者としては、さいせいだけでもいいからバスパワーでうごかなきゃダメのダメダメですぅ
卓球	ドライブ	前陣で、回転ドライブ中心で粘るドライブマンや、回転・コントロール重視のオールラウンド、コントロール、回転量が欲しいというカットマンにおすすめです
自動車	ドライブ	帰りは会津若松から再び磐越自動車道に戻り、郡山JCTで東北自動車道を南下し都内に戻ったのですが、悪天候にも係らず渋滞は全くなくスムーズなドライブを楽んで、まだ明るい夕方には都内に戻ることができました
その他	ドライブ	OCRソフトウェアメーカーのメディアドライブ株式会社(代表取締役:松村 博 本社:東京都目黒区)は、7月14日(水)から16日(金)の3日間、東京・有明の東京ビッグサイト(東京国際展示場)にて開催されます「国際モダンホスピタルショウ2010」に出展いたします
自動車	ドライブ	現地ではドライブなども楽しみたいのですが、まだ免許をもっていない為、早く取得する為 夜行バス を使用して 合宿免許 茨城 で免許を取ることも考えております
コンピュータ	ドライブ	Windowsの通常の操作でショートカットを作成すると、フォルダへのショートカットやその時点でオンラインになっていないネットワークドライブなどへのショートカットの作成は面倒(場合によっては不可能)です
自動車	ドライブ	ミハエル・シューマッハのすごさは、車の運転の速さだけではなくて、沈没しかけていた“かつての名門”フェラーリを組織として蘇らせたことにもある、と私は思っていますが、今年からフェラーリをドライブするライコネンとマッサがどこまでシューマッハの跡を継げるのか、それもまた興味深いことではあります
コンピュータ	ドライブ	起動するとタスクトレイに常駐するとともに、現在パソコンに接続されているCD/DVDドライブやUSB/IEEE 1394接続デバイスといった、ドライブを示すアルファベット文字が付加されたボタンが横並びで表示される
卓球	ドライブ	その評価の通り、三田村の持ち味は、多彩なフォアハンドドライブとそれを支える速いフットワークだが、ことバックハンドをみたら、153位という世界ランキング(03年2月発表)は不釣合いに思えてしまう
その他	ドライブ	ドライブ→ドロップの試合→クリアの試合→スマッシュの試合→ヘアピン→フォアシングル→バックシングル→チェンジシングル→端ヘアピン→全面ドロップ→半面シングル→スマッシュの試合→スマッシュの試合
卓球	ドライブ	今回は、前陣・中陣・後陣ドライブ、ミート打ち、ショート(裏面も含む)、カウンター、ツッツキ・サーブ等を試打しましたが、使いやすく違和感はなかったが、中陣〜後陣ドライブは他のテンション系ラバーや高弾性ラバーの方が威力のあるドライブが打てると思います
卓球	ドライブ	スマッシュがきたら頭の上で止めてドライブリターンで攻守逆転、ドロップがきたら、打っても置いてもほぼ勝のパターンになる(うまくすると1発できまる)
卓球	ドライブ	ドライブ主戦 攻撃用裏ソフトラバー 100%洗練された天然ゴムにkokutaku独自の製法で摩擦性をいかに長く持続し、その特性をいかんなく発揮させることが、このラバーの最
コンピュータ	ドライブ	ページファイルのフラグメントを改善する方法はいくつかあるが、十分にメモリを搭載しているか、起動ドライブ以外にも論理ドライブが有るかという条件が加わってしまい、例えばノートPCではこの条件を満たせない場合も多いだろう
自動車	ドライブ	そうした中、 高速道路料金の値下げもあり、ドライブを中心にレジャーを楽しむ人も多 いと思われ、8月にはガソリン需要は盛り返すことが期待されます
その他	ドライブ	■ 遠近両用めがねと読書&遠近両用メガネとドライブ&遠近両用眼鏡/パソコン、遠近両用めがねとゴルフ、遠近両用メガネとショッピングなど、遠近両用眼鏡は用途によって作製する事が重要です
その他	ドライブ	PC開けてHDを付けたり取り替えたり、ネジがどこかに飛んでいったり、パーティションマジックだのドライブイメージだのを使ってパーティションを設定してみたり
その他	ドライブ	翌1989年にはホンダエンジンを失い、中嶋とともに非力なジャッドV8エンジンを搭載した101をドライブすることになったが、戦闘力が前年以上に落ちたこともあり、ランキングは8位と更に下降
その他	ドライブ	(株)天草自動車学園(天草市亀場町、田中正友社長)が経営する大矢野自動車学校(上天草市大矢野町、金澤昭彦校長)は1月30日、交通エコロジー・モビリティ財団(東京都千代田区、井山嗣夫会長)からエコドライブ講習機関としての認定を受けた
自動車	ドライブ	先日のドライブの際、足を痛めてしまったチャッピー・・・昨日まで様子見をしていたのですが一向によくなる様子もなかったので今日出勤前に病院に連れていきました
その他	ドライブ	(2) 交通(こうつう)事故(じこ)発生(はっせい)概況(がいきょう)、死亡(しぼう)事故(じこ)等(とう)の重大(じゅうだい)事故(じこ)発生(はっせい)状況(じょうきょう)と今後(こんご)の対策(たいさく)、交通(こうつう)安全(あんぜん)大会(たいかい)の開催(かいさい)予定(よてい)、「島根(しまね)安全(あんぜん)ドライブコンテスト2009」への参加(さんか)呼び掛(よびか)け
卓球	ドライブ	ドライブに移行したら初めから筋力を爆発させようとするとブレードが戻るしせっかくのレンジが短くなるので、オール・艇・水をしっかりコンタクトさせたら後は体幹周りやアウトハンドの広背筋で強く支持し、その上で脚を使って水平に加速を与えていこう
自動車	ドライブ	◇府警とホンダ配信「ドライブに役立てて」 府警や警視庁など全国14都府県の警察とホンダ(東京都港区)は今月から、同社のカーナビに車上狙いなど車関連の犯罪の多発地域を表示するサービスを始めた
自動車	ドライブ	車で岐阜県養老町へドライブに行ってきました旦那さんの乗っていたカムリグラシアから自転車が親子3台分積めるセレナへ☆これから自転車を車載してサイクリングに出掛ける機会が増えそうです♪ヾ(@°▽°@)ノ←養老山脈早い人は今日から帰省ですかね
卓球	ドライブ	ドライブ→ドロップの試合→クリアの試合→スマッシュの試合(7点)→スマッシュドライブ→半面シングル→フォアシングル→バックシングル→ヘアピンの試合→端ヘアピンの試合
自動車	ドライブ	ドライブ旅行経路:千葉鎌ヶ谷→長野県佐久平→新潟県妙高高原→富山県氷見市→石川県金沢市→福井県小浜市→京都府大原→奈良県大和郡山市→愛知県蒲郡市→千葉の自宅へと、全工程1672Kmの長距離ドライブでした
その他	ドライブ	無事に念願だったドライブスルーに入り、最近全然そんな素振りも見せませんでしたが、意外にもビッグマックのセットと、それだけでは飽き足らない小生はベーコンレタスバーガーの単品にも浮気してみました
自動車	ドライブ	会見で初デートに関し、モンキッキーは「2人ともドライブが好きなので、車で出かける約束をしていたのですが、2人ともタクシーで来てしまい仕方なくご飯を一緒に食べて帰宅しました
その他	ドライブ	自動車保険を採用、契約や、つの案内、ドライブ情報保護方針お客様の特長、医療保険の自動車保険サービス内容をフリート契約も人身傷害・ドリフト・安全装備が運営自動車保険はほける
その他	ドライブ	現在のドライブ・クラブというのは、百条の準用と申しますか、貸し自動車業に準用し得るような形態の商売をやっておるものと、もう一つは自動車自身を借り入れることを商売にしておるものと、二つあるのです
その他	ドライブ	エアロドライブでは2つのレギュレータを使用して前後を別々に車高変化させていましたが、レギュレーターのダイヤルを回転させるのに手間取るため走行中など瞬時に車高を上げるのは非常にむずかしいです
コンピュータ	ドライブ	原因は日立製のDVDドライブだと思いますが、それ以前にRAIDカードを取り付けた事と、ATA/100カードを取り付けて大容量のディスクを接続してしまった事に端を発しています
卓球	ドライブ	ドライブを気持ちよく打てている人が、40mmになって、「やっぱりスマッシュを打てなくちゃ」といった気持ちでスマッシュを練習するのは感心できません
その他	ドライブ	SunRaceのカセットスプロケットの件を話したら、彼は「これを使っているのはすべてコスト面 からで自分だってドライブトレインに信用がおけないものを使う気はしない
自動車	ドライブ	新レッドブルジュニアチームは来季コスワースエンジンを使うことが決定していますが、2007 年以降のホンダとのエンジン契約を前提に 2006 年に佐藤琢磨をドライブさせる可能性がある、とか
コンピュータ	ドライブ	周辺機器(キーボード、フロッピーディスクドライブ、ハードディスクなど)アクセスプログラム(ドライバ)やアプリケーションソフトウェアの動作に関する設定情報を記録したファイルです
自動車	ドライブ	交換したタイヤだが、当サイトはドライブ好きだが走りには興味が無いし、 自然豊かな田舎道をゆっくり流すのが好きなんで ハイグリップ高性能タイヤまでは必要がない
自動車	ドライブ	自動車生産・国内販売の低調に加え、消費支出削減で行楽の長距離ドライブも控えられ、タイヤの更新もギリギリまで使ってからという傾向が影響しているのかもしれません
自動車	ドライブ	日本にお住まいの外国人の方向けの新サービスとして、英語を中心とした外国語対応スタッフによるレクサスの商品説明・試乗などの購入のサポートに加え、日本の交通法規・免許取得および首都圏周辺のドライブ情報など、車両保有に関する一般的な情報も提供します
自動車	ドライブ	勿論ただ単にドライブをする訳ではなく、松原さんが譲り受けたHUMMERのオマケのスタッドレスが鹿島に置いてあるのと、那須PSガレージに展示してあるXR311のタイヤ2セットとランボルギーニLM002のタイヤもついでに(こちらの方が本数は多い)運ぶためです
卓球	ドライブ	時おり高く上がってきたロブに対して、充分な体勢から打ち込むスマッシュは高い決定率を誇るのだが、 そこに至るまでのドライブ戦、ネットプレーに富山ペアの巧さが光る
自動車	ドライブ	と言っていたので、スノードライブを楽しもうと早起きをしてみたのですが、雪は全然降っておらず普通にドライブしてAM6:00に会社に着いてしまいました
その他	ドライブ	また、免許の更新時に使用されます「人にやさしい安全運転」という冊子がございますけれども、その冊子の中にエコドライブの項目が本年七月から記載されるようになってございます
コンピュータ	ドライブ	以前から、DVDドライブが「カタ カタ カタ カタ ウィーン」という動作の繰り返しで、作業も進まず、中のメディア(CD等)も取り出せなくなるという不具合は起こっていたのだが、まだ新しいこの機械に、何か機械的なトラブルがあるというのだろうか
自動車	ドライブ	原告は、そのような心境の下で、平成14年7月、栃木県那須地区へのドライブ中に立ち寄った雑貨店で聞いた被告倉渕の癒し系の音楽に心ゆさぶられ、 CD販売場所として教えられた被告ホームオブハートの施設である那須高原の松田賀江ふるさとの木美術館(以下「那須美術館」という
自動車	ドライブ	レイトイン(22時まで)OKですので、夕方まで遊んで、近くで夕食を済ませ、 夜景のドライブを楽しんだり、夜の海岸で涼んだりしてから、 ゆっくりホテルへチェックインしてください
卓球	ドライブ	パワードライブに必要なのはスイングスピードですので、ひざの屈伸運動と腰の回転運動を十分利用し、インパクトの瞬間にぎゅっと指先に力を入れると良いと思います
自動車	ドライブ	スタバのジンジャーブレッドラテ♡小田原に向かう途中に、ドライブのお供を買いにスタバへ♡ここのドライブスルーお気に入りです~大好きなdropさんのブログで紹介されていたジンジャーブレッドラテが飲みたかったのです(^o^)丿ドライブスルーの窓もクリスマスっぽい飾り付けに変わってました~そして・・・もちろんカップもクリ
自動車	ドライブ	海や山のレジャースポットとして、また、各種工芸家の工房めぐりや、遺跡・文化財などをめぐる歴史探訪のドライブコースとしても糸島の魅力を楽しむことができます
自動車	ドライブ	その後、のんびりと伊香保Green牧場までドライブしていたら、お目当ての、シープドックショーに間に合わず、急遽軽井沢に行き先を変更して、アウトレットで買い物をして帰りました
卓球	ドライブ	ゲームで勝てるようになるためには、カット、ドライブ、プッシュ、ハイクリアー、スマッシュ、ヘアピンなどなど、多彩なショットから始まり、34平方メートルにもなるコートを完璧にカバーできるような俊敏なフットワークも必要になってきます
コンピュータ	ドライブ	初めは、音源ボード搭載IDEコネクタの使用が原因と思われたのですが・・・ その後の調査で、CDドライブによって、某APIを使うと、別のAPIの動作が変わる事が判明☆☆☆ 某APIを使用しない事により、解決出来ました☆☆☆ 御迷惑をおかけした方々、済みませんでした・・・
