# コンピュータ: パソコンやワープロで、フロッピー　ディスクを差し込む穴に対応する通信路。, 卓球: テニス・卓球などで、ボールに順回転を与えるように打つこと。ドライブをかけるまた、ゴルフなどで、ボールを遠くへ飛ばすこと。, 自動車: 自動車で遠出をすること。
その他	ドライブ	目次の オートローダー・ファームウェア・レベル及びドライブ・ファームウェア・レベルの確認 の項目に戻り、更新したドライブ・ファームウェア・レベルが正しく表示される事を確認します
コンピュータ	ドライブ	シスレムの復元をしたところマイコンピューターのハードディスクドライブ、ウインドウXP(C)の下部にリムーバブル記憶領域があるとの表示が出ました
その他	ドライブ	ドライブは、MCM製アルファーワン2機共ドライブを含む機関部の整備は、マリーナにて整備しており、各部定期的点検を行って不具合や気になる部分が出るとその都度整備しているとの事で、チルトを含め不具合有りませんでした
その他	ドライブ	そこで、ドライブ段にはプレート損失の大きい、力のある双三極管12BH7Aを採用し、カソードフォロア直結回路を構成させ、強力なドライブ回路としています
自動車	ドライブ	ドライブの目的地(道の駅)が残念ながら定休日だったものの、ミニラ的には三輪車も乗れたし、アピタのキッズコーナーで遊んだし、パパのお隣に自分専用席がある状態でドライブだし、立ち寄った先の店員さんは優しいし、ママは普段連れてってくれないマクドナルドで好物のポテトを買ってもらったし・・・色々楽しかったようだ
自動車	ドライブ	和歌山の自宅から約80キロの下道ドライブ☆8時半に出発です☆このルートだと五條市までのほとんどの道のりが国道24号線でしたので、快適のんびりドライブでした♪途中高野口
自動車	ドライブ	リッターカーとはいえ、800kmドライブも難なくこなすVitzは相当に出来がいいとは思うが、さらに上を求めるなら、本来は軽で何とかならないものかという気にもなる
自動車	ドライブ	それにしても、のんびりした山梨と比較するために余計にそう思われるかもしれませんが、ドライブ中に見かけた久々の新宿・池袋は、なんと落ち着かないゴミゴミした街でしょう
その他	ドライブ	さらに、ドライブギアも上級モデルと同じジュラルミンCF(冷間鍛造)ドライブギアや、耐久性の高い高強度真鍮マシンカットピニオンギアなどを使用し、上級モデル並みの耐久性能を持たせたという
自動車	ドライブ	今回はなんかT市いけないとかで、K氏もよーわかんなくて、Y氏はドライブかなんかでさすがに一人でいくのもなーとおもいつつちょい用事もあったしまーパスしとくか的におもってたのだが
コンピュータ	ドライブ	PBG4もこういうのを使って持ち歩いたらかっこいいんでしょうけど、ハードディスクドライブとかのことをを考えると耐衝撃性はあまり改善しないんでしょうか
自動車	ドライブ	県警の発表によると、吉本容疑者は6月14~21日の計4回にわたり、広島市内に住む高校1年の男子生徒(15)をドライブに誘うなどして、同市内の路上に駐車中の乗用車内で、わいせつ行為をした疑い
コンピュータ	ドライブ	(それと、ほかのサイトで聞いたのですがWindows 2000内蔵のバックアップシステムを使って起動ドライブをバックアップするとバックアックされる大きさは本来の三分の二になるとのはウィルスに感染しているからだと教えられました)
その他	ドライブ	大哺乳類展に特別協賛、屋外展示では、「燃料・パワートレイン戦略」など、様々な革新技術やフォルクスワーゲンが推進している「エコドライブ」が紹介されていた
卓球	ドライブ	ドライブやプッシュでも、利き手の逆側に上がったシャトルは、よほどでないかぎり、当てるだけになりがちなバックハンドではなく、ラウンドザヘッドストロークで「ひっぱたく」
その他	ドライブ	フィルム上に音声が記録される光学式トーキーシステムの台頭と軌を一にしてシアターサウンドを支えた86アンプをさまさざまな前置アンプと組み合わせ、ベスト言えるドライブ方法、本来のサウンドを探求します
その他	ドライブ	の燃料高騰に伴い、燃費削減(エコドライブ講習月一回)・アイドリングストップ(装置を付けモニター)をし、ドライブレコーダーによる事故防止対策を含め、各管理者側と営業社員側の双方でチェック体制を整えつつある
コンピュータ	ドライブ	とか思ったりしたし、デザイナーがよく使っていたMOドライブなんかも「MOってなんかクリエイティブな匂いもするし、インテリジェンスだよね」とか思ってたんだが、その頃は財布の事情ですぐには導入できなくて"zipドライブ"なんていう微妙な規格のメディアを使ってみたり・・・・デジカメ用の媒体だってどんどん変わってきたし、キリがない
コンピュータ	ドライブ	最初にパーツを買ったのは半年も前(たしかハードディスクドライブだった)、最低限のパーツが揃ったのでさえ4ヶ月前だから、パーツの仕様を全然おぼえていない
卓球	ドライブ	基本打ちを極めていこうその2ドライブ、スマッシュ編でしたぁ ビュンっと速い球なのでうまく打てるようになると相手を追いつめることができちゃったりするんです
その他	ドライブ	サスペンションもジャグァーのパーツを使い、Cタイプのスタイルを再現することはむろん、ドライブフィーリングまで近づけようとしているところが愉しいじゃないか
コンピュータ	ドライブ	※ フルクライアントパッケージからインストールする際には、テンポラリフォルダの存在するドライブに、一時的に5GBの空き容量が必要になる場合があります
自動車	ドライブ	6年間つとめたマツダオートトウキョウを退職して、辞めた翌日からいきなり「単身ご褒美沖縄旅行」に1ヶ月行ってしまった帰り道、本当は九州までフェリーで渡って当時、沖縄まで一緒に持ち込んでいた唯一新車で購入した愛車「カペラヨーロッパセダン」でドライブして帰る予定が、手持ち資金3万円しか無くなっている事実に気がつき、急遽車載せればただで乗れた貨物船にて東京目指すことになったのでありました
自動車	ドライブ	日曜日はあまりにお天気がよくて暑かった(最高気温33度以上(げんなり))ので、上の写真の撮影時以外はオープンにはしなかったが、それでも楽しいドライブであった
その他	ドライブ	ドライブ・バイ・ワイヤとは、ブレーキやらアクセルやらハンドルやらといったヒューマンインタフェースを、自動車のメカ構造と断ち切り、まるでゲーム機のように全てデジタル方式のセンサに置き換えてしまうものだ
自動車	ドライブ	報道によると、広州のある旅行社が企画した青島ドライブツアーに参加した香港からの13台のフェラーリが各地の高速道路を速度超過をしながら北上、各地の監視カメラで速度超過を監視されながら、速すぎて交通警察隊が追い付かなかったが、4月10日、杭州湾跨海大橋上にて寧波交通警察隊に捕まりうち6台が減点と罰金200元、3台が免許証を差し押さえられた
自動車	ドライブ	また、ドライブ用にということで検討されるかたも多いのですが、最近の車のガラスは紫外線カットされているものがほとんどですし、車内の温度もそれなりにありますから、運転中の眩しさよけとしては物足りなさを感じるかもしれません
自動車	ドライブ	僕も探すのが楽しみでドライブとかしてたが、せっかく行ったのに知らなかったってのが多かったから、ある程度は計画して、現地でいいのを見つけたらGetしたいなって思うよ
その他	ドライブ	2 システムドライブのどこかにファイル破損をしている様な箇所が存在しているか、HDD自体が何らかのクラスター破損箇所が多数存在していたりするとかは考えられませんか
卓球	ドライブ	越前のツイストサーブをまったく返せず、逆に返せるレベルでサーブを打ってもらったり、ドライブBに手がつけられず次々とポイントをとられたりとへたれっぽい日吉ですがさりげなく4ゲームとっています
コンピュータ	ドライブ	でもマザーボードの起動ドライブの設定に SCSI が無い場合は HDD から起動するように設定してプライマリー側に何も繋がないようにしたらいいんでしょうか
コンピュータ	ドライブ	インストールしたフォルダ(デフォルトインストールの場合はCドライブのBESTフォルダ)を削除し、デスクトップやスタートメニューに作成されたショートカットのアイコンを削除下さい
コンピュータ	ドライブ	リムーバブルケース(通称がっちゃん(笑))を使いはじめてしばらく経つのですが、こいつの何が不満かというと、ドライブを差し替えるたびにいちいち電源を落とさなくてはいけないという点
卓球	ドライブ	大友梨奈ク側に岸川聖也ラバーを打ちそれにする相手やコースの守備力で影響のミスを出すたいていフォア側には裏ソフトラバーや表ソフトラバーを打ちフォアに来たは返球する目的に多い有名前陣攻守型の打法相手が有名ペンドライブ主戦型通称ペンドラ主にフォアハンドドライブに与えてある回
卓球	ドライブ	40mmだと、ツッツキやスマッシュのスピードは遅くなったが、ドライブのスピードはほとんど落ちていないので、それらのスピード差からドライブは速く感じる
コンピュータ	ドライブ	一方、UBTCのRFIDセキュリティ機能付き外付ハードディスクドライブ NETCOM NCE08は、RFID(無線)キー2個付きの外付ハードディスクドライブで、 固有のRFIDキーを持った人がドライブにかざすことでデータへのアクセスが可能となります
その他	ドライブ	・徹底的な情報共有がドライブする新しい組織とは、自発性の発露による個の没頭を引き起こし、それにより大きな達成をした人たちが自然に浮上してくる世界なのである
コンピュータ	ドライブ	まず、登録したいアプリのショートカットを作成しておいて(以前説明したアプリ フォルダに入っているものでもOK)それからエクスプローラーでCドライブの 一番上に”start”というフォルダを作成して下さい(場所、フォルダ名はどこで も構いません)
自動車	ドライブ	私の家は愛知県にあり、なかなか頻繁には来店することはできませんでしたが、あまりにおいしかったので、ゴールデンウィークにドライブがてら、家族でもう一度、来店しました
卓球	ドライブ	彼は両面テナジー05を使用していたのですが、サーブ、レシーブ(特にツッツキ)、ドライブと、全ての技術において私が過去ボールを受けたことのある相手の中でもトップクラスの回転量でした
自動車	ドライブ	My Way 電話があった でも自分の車持てたら、いつでもデートに使えるし、ドライブにいつでも行けるし、超いいよ~~ 車の中は、自分色に染めるのだー でもH舎は本命じゃないの
その他	ドライブ	低公害な車の使用、エコドライブの実践、自動車使用の合理化、公共交通機関の利用促進、不要不急の乗用車の使用自粛、不要なアイドリングの停止、大阪府の流入車規制などについての啓発を行う
その他	ドライブ	また、鉄鋼や造船などが輸出ドライブをかけることで海外との競争力を維持していき、技術的にも新たな投資を行うことによってかなりの成果を上げたものの、次第に途上国からの追い上げによって競争力を失っていき、化学などに取って代わられることになった
自動車	ドライブ	岩手県八幡平市安比高原のサンテミリオンの近くには、安比高原スキー場や十和田八幡平国立公園ドライブコースのほかに、田沢湖&十和田奥入瀬渓流などがあります
自動車	ドライブ	7年前に当時高校生の娘が担任の先生からご馳走になった店で、娘の話ではとても美味しかったとのことで、早速、家族で自宅から小田原までラーメンドライブに出かけました
自動車	ドライブ	その他の趣味はTVゲーム、卓球、ドライブ、日帰り温泉巡り、立ち読み、お絵かき、近隣のショップのゲームの価格調査などなど・・・だが、持病のうつ病のためか気力が萎えがちで最近は卓球・ゲームの価格調査以外はあんまり活動していない
コンピュータ	ドライブ	「世界最軽量のドライブ内蔵モバイルPCの開発」を命題に挙げた瞬間から、パナソニックのスタッフは、軽量・タフのLet'snoteシリーズに適したドライブをさまざまな角度から検討し、試行錯誤の末生まれたのがこのドライブ構造なのである(別掲のコラム参照)
その他	ドライブ	お正月といっても普段と変わりないんだが、母の買い物にお供したり、弟と物欲系ドライブしたり、雑誌をめくりながらiPodがシャッフルしてくれる曲を聴きつつぼんやりとしたり
その他	ドライブ	2009年10月末(つい先日)に船底&ドライブ清掃、塗装、インペラ交換、ベロ交換、アノード交換、エンジン、ギアオイル交換など各定期点検、交換部品新替済みです
その他	ドライブ	ペンホルダーのドライブで中学3年になって西宮市の大会で優勝、その頃、中国の前陣速攻のスターが世界を席巻し、ドライブ主体の日本卓球はあえなく敗れた、そのショックで卓球をやめた
自動車	ドライブ	33 秒) 日本語のページを検索検索結果道道639号上士別和寒線 ドライブ&ツーリングのネタ帳ORR道道639号上士別和寒線は、道央自動車道が和寒まで延びた現在でも何事もなかったかのように未舗装路に手が加えられない
自動車	ドライブ	黄色い看板が目印の当店は、ドライブスポットA&W屋宜原店向かいにあり、各種中古車、車検、DVDコンポ、カーAV機器、エアロパーツ、人気アルミホイルタイヤセット等の販売を行っております
自動車	ドライブ	昨年11月、神奈川県大和市内の国道で飲酒後のドライブ中にバイクと正面衝突する死亡ひき逃げ事故を起こし、危険運転致死や道路交通法違反の罪に問われていた24歳の男に対する判決公判が8日、横浜地裁で開かれた
自動車	ドライブ	4日は帰って来ていた息子がたまに乗る自動車運転のナビゲータとして以前私が蜂に刺されて到達できなかった氷ノ山山系の吉滝と言う所へドライブしてきました
自動車	ドライブ	ある冬の日に2番目の子供とドライブ中、地鉄立山線の本宮あたりの雪道の緩 い下り坂で、スノータイヤを履いていましたがスリップし左の雪の中の突っ込みました
その他	ドライブ	エンジン、ドライブトレイン、シャシー、ボディ、試験、設計開発、生産技術、デザイン、環境/社会/法規、モータースポーツ、略語の11項目を各カテゴリーに分けて解説、巻末に項目索引、アルファベット略語索引、英文索引、国産乗用車社名索引が付く
卓球	ドライブ	1セット目は柳がドライブをきっちり止めてもぎ取るが、 2・3セットは平林の下回転ロングとナックルロングサーブ、 そしてフォアハンドでのバックストレートドライブに押され止めきれなかった
その他	ドライブ	アイ・オー・データ等から発売された単体ドライブや富士通・ソニー等のパソコンは松下電器(パナソニック・コミュニケーションズ)製ドライブをオープンプライスで発売、店頭予想価格は4万円前後
その他	ドライブ	シェークドライブ型のバック面(弾みませんからラケットを弾む物に)ペンドライブ型の方でも良いと思いますが、従来のラケットよりも1ランク弾むラケットをお勧めします
その他	ドライブ	これはTIPSですが、この一時ファイル・フォルダを別の高速なドライブに設定してやると、インターネット・エクスプローラの起動や切り替えが心持ちはやくなります
卓球	ドライブ	関東大会までのリョーマをビデオで研究し尽くし、技を使えるまで特訓したので、「ツイストサーブ」、「ドライブB」、「ドライブA」を使用、日吉戦で使った「零式ドロップショット」まで使った(しかし決勝のデータは取れなかったので「サイクロンスマッシュ」は使えない)
自動車	ドライブ	マップはかなり広く、街中がレース場という特性上様々なショートカットを知っていればいるほど有利ですので、ただのドライブ(探索)にも意味があるのがいいですね
その他	ドライブ	会場では低公害車約90台の展示を行うほか、自分自身のエコドライブ度がわかるエコドライブシミュレーターの体験やエコドライブの効果を体験できる装置を装着した車両の試乗や展示、燃料電池自動車、水素自動車、電動二輪車などの試乗、エコカーや環境問題への理解を深めるイベント、アトラクションが実施される
その他	ドライブ	ごく簡単な (HDD 上の画像を表示する) プログラムを作り、Web サイトやネットワークドライブに置いて、実行してみたところ、セキュリティ例外で止まってしまいました
卓球	ドライブ	また、[S]、[D]、[A]でそれぞれドライブ、ボレー・スマッシュ、ロビングでボールを返すことができ、長く押すほど画面上部のゲージが伸びて強いショットになる
自動車	ドライブ	20年ほど前の松山勤務時代に訪れた時は道も細かったのにと思いながら走ると、所々にショートカット前の旧道があったり新しいトンネルがあって快適なドライブコースになっていました
その他	ドライブ	また、企業による環境EXPO、低公害車試乗会、エコドライブコンテスト、来場者全員が参加できる「CO2排出量診断」、自転車発電機による「発電競争」など、自動車・環境問題、CO2削減について考える機会を設けています
自動車	ドライブ	結婚前の嫁と良くドライブに使いましたが、嫁が隣に乗るときに限って、クラッチからの異音(焼き付き)とか、エンジンのクランクベルトからの異音などの故障にみわまれました
自動車	ドライブ	その後、その夫妻は新潟までロングドライブに出かけたらしいのですが、何度もエンジンがかからないという事態に陥ってしまい、止めるのも怖いからと暑い中エアコンもかけず、食事もせず早々に帰ってきて「見てくれ」と言ってきたんだそうです
卓球	ドライブ	ドライブのブロックに対しても同様で、回転の影響を受けすぎてオーバーしないように、ラケット面の角度はボールの真上をこすってブロックするくらいの気持ちで出せば丁度良いですし、ナックルブロックも効果的に出せます
コンピュータ	ドライブ	この後は、インターネットの一時ファイル、ATOKのユーザー辞書、Thundebirdのアドレスと、メールファイルもDドライブに移したいと思っています
自動車	ドライブ	仲間との車を連ねてのドライブでは他車の割込防止が可能となるが、見知らぬ車から一定のスピード以上で背後から迫られると不安感をいだくとともに、加速して車間距離を取りたくなる距離
その他	ドライブ	エコドライブ講習の運営をしながら、自分自身もエコドライブをマスターしてきた太田も、発売4年目を迎えたTIIDAで、お客さまを迎える準備をしています
卓球	ドライブ	松原は、鋭いフォアハンドドライブで水谷を攻めるが、水谷はこれを落ち着いてブロックし、自分の形でゲームを進めると、松原にもミスが目立ち始め、水谷が完封
コンピュータ	ドライブ	1年ぶり、いや、もっとでしょうか、久しぶりにデータを発掘しなければならないという事で何枚かフロッピーディスクをドライブに入れましたが、結局目当ての物は見つかりませんでした
自動車	ドライブ	朝ぼんやりとテレビを見ていたら、北海道医療大学の温室で咲いている、北海道ではここだけという青いお花が「日曜祝日はお休みだが今日だけは開園」とのニュースを見て、ドライブがてら見に行くことにした
自動車	ドライブ	レジャーなどで長距離ドライブをする人々が増え、女性や高齢者のドライバーも増加するなか、一般道路にも高速道路のパーキングエリアのような「ドライバーが自由に利用可能な快適な休憩施設」が求められるようになりました
コンピュータ	ドライブ	元来CDには読み取りエラーが起こった時の為にエラー訂正符号が入ってるんですが、CCCDではこのエラー訂正符号を意図的に狂わせておいて、ドライブが親切にエラーを訂正しようとすればする程おかしな挙動が表れる、という悲惨な仕様になっているそうです
その他	ドライブ	Biosでドライブの順番をかえたりすると7のブートマネージャーが出てくることもあるんだが、また元に戻ったりもしてどうすればでるのかいまいち確定出来てない
コンピュータ	ドライブ	x86: 特定の ATA ハードディスクドライブを搭載したシステムが、Solaris 9 ソフトウェアのインストール後にリブートするとハングアップする
自動車	ドライブ	一方、技術的な面には他のボルボでは体験できないドライブを可能にする最新のソリューションが含まれ、衝突回避安全システムから、インフォティメント、そして世界最高クラスのオーディオにまでわたっています」と新型S60プロジェクトディレクター、トーマス・アルボルグは語ります
その他	ドライブ	★ゲーム『龍が如く』で採用された、「12月17日」ですね☆まだ季節が違いますが、クリスマスイブの一週間前の別れ話の曲ですね☆これからの季節には「タオル」「太陽のプレイメイト」「流星ドライブ」あたりが・・・・
自動車	ドライブ	社長が心配して俺に着いて行くよう言い 嫁と初めてドライブした車がかっこいいセダンやスポーツカーじゃなくて まさかのいすゞFORWARD、14t車で片道1200kmのドライブだった (大型車の車名言っても分かる人は多分少ないだろうなぁw) 車内で
その他	ドライブ	しかしラバーが柔らかく弾きも良いため直線的な弾道になりやすく、他のテンション系ラバーに比べ回転を掛けた重たいドライブやループドライブをするのは少し難しいと思う
その他	ドライブ	またメモリーの増設、プリンタ、スキャナ、MOドライブ、グラフィックボードと買いそろえ、現在でもCPUの速度以外は十分満足の行くマシンであるといえます
