# 音楽: 音楽で、半音下げる記号。変記号。♭と書く。⇔シャープ。, 家庭: 共同住宅で、各戸が同一階内に収まる形式のもの。, スポーツ: 競技で、タイムに秒より下の端数がつかないこと。ジャスト。一〇〇メートルを一一秒フラットで走る
その他	フラット	もうちょいそれをフラットに見た時に、本来ステレオでつくった曲をモノラルで聴かれただけでも「もう、オレの音楽じゃない」って言うのと同じことになっちゃう気がするんだけど
音楽	フラット	フラットもシャープも無いように移調したもの、すなわち子供の頃、普通のハーモニカ(半音なしの)で、いろんな歌を吹くために移調した状態(長調、短調の区分は不要)の呼び名は、無さそうですね
その他	フラット	板をフラットにすると、雪面に対し垂直に立つことができニュートラルポジションが作れるようになって、後傾防止にもなるし、ニュートラルポジションが作れるようになると急斜面でも体が遅れる感覚がなくなるので恐怖感がかなりなくなります
その他	フラット	2000年に大型4社は先の「人にやさしいバス技術検討委員会」で示された中長期モデルバスに範を取り、3扉・前~後扉間フルフラットのノンステップバスを試作した
その他	フラット	まず、画面表示で言うと、最近は液晶ディスプレイが普及してきた、液晶ディスプレイは表面がフラットというか平面的であり、構造上もちゃんと四角い画素を表示してくれる、つまり「これほどQRコードにとって良い表示環境はない」、わかりやすいので、液晶モニタベースで話を進めてみよう
その他	フラット	コースは重信川河川敷を走るフラットなコースで、景色は単調であるが、沿道に設置したラジカセから流れる音楽やアマチュアバンドの演奏もあり、気分良く走れるアットホームな大会であった
その他	フラット	彼は、トーマス・フリードマンの「フラット化する世界」(一昨年読んだ本では一番良かった)に対して、現在の金融の世界は先に何が待ち受けている予見できないない、不確実なねじれ曲がりの連続で、世界はカーブ化しているというのである
その他	フラット	バーンは、フラットボトム規制の及ばないフロントタイヤの後端より前の部分にラジエターを内蔵した巨大なベンチュリーを構成することで、フロントでダウンフォースを得ようとしました
家庭	フラット	長期にわたる留学を希望されるなら、現地の英語・生活に慣れるまでまた現地の文化・慣習を学ぶために1から2ヶ月間だけホームステイにし、残りの期間は気の合う仲間を見つけて一緒にフラットに住むという方法をすすめます
音楽	フラット	演奏された曲はBフラットと同じく ディキシーランドジャズの曲が殆どでしたが、休憩時間に入る時に1曲ピアノ弾き語りで、It's only paper moonを聴かせて頂きました
音楽	フラット	中島さんと言えば、クォーター・フラット(歌の音程が半音の半分だけ常に低い)という、日本人には希有なダークな音程が、そのルックスや声質と奇跡的にマッチングした好例として、初期の宇多田ヒカルさんと並び、数百万の人々を魅了(同じく、或いは逆に、クォーター・シャープ
その他	フラット	サーブも強力、全盛期のラフターに匹敵すると言われる恐ろしく高くキックして弾むスピンサーブをセカンドサーブに持ち、なおかつ、そのスピンサーブと同じフォームで打つフラットサーブをファーストで打つ
その他	フラット	あと、購入時についていた片踏みペダル(新車はペダル付いてなかったらしいのでノンオリジナルだろう)は同じく初心者には使いづらかったので、シンプルなロード用フラットペダルに交換
その他	フラット	ただ前回のカキコで書いたようにデニスを使っていた期間が長くかつ自身もリムがフラットなマウスピースが好きなのでリムの細い(薄い)レミントンに慣れるまで時間が必要に思います
その他	フラット	障がい児者及びその家族の地域生活が豊かになるように、当事者家族間、各事業所間、当事者家族と事業所間の連携を強化するために、フラットな立場で知り合える交流会を開催
その他	フラット	フラット・レートというのは、後でも述べますが、当時の電話産業の費用構造から見ると、ほんとうに合理性があったかどうか問題になるところだと思います
音楽	フラット	時々フラット気味になるヴォーカルが少し気になったりしますが、総じて安定したパフォーマンスを聴かせるアルバムは、キング・ダイアモンドを彷彿とさせるソリッドなギターとタイトなリズム隊が、ヴォーカルとキーボードを圧倒するような存在感を見せて微妙に居心地の良くないバランスになっているような
その他	フラット	そのときクラブのヘッドが外側を向くように投げる方法をアウターフラットといい、クラブのヘッドが内側を向くように投げる方法をインナーフラットと言う
音楽	フラット	この間、ご自身のHPの日記コーナーに、リアレンジの模様や、E♭m、つまりフラットが6つもついた、この演奏しにくい曲にメロディオンを載せる様子を楽しげに書かれていた
その他	フラット	メインエントランスからお部屋までフラットでいけます、管理体制良好、陽当り・眺望良好、インターネット光対応、地デジ対応済、楽器演奏可、敷地南側に公園
その他	フラット	まあ、前回の元祖を含め4回目ともなれば深く考える必要もないでしょうし(^^;それにしても、数メートル先、目線の高さではほぼフラットな距離でみゆきさんの生の歌を聴くとはなんと贅沢な事でしょう
その他	フラット	高原のフラットな地形をそのままベースにし、枝振りも雄大な松の古木を活かして、大胆かつ繊細に造形された18ホールは生まれながらのクラシックコースです
その他	フラット	今回の仕様組合せは、両柱セットのセンターブロック上下用、センターブロック上は照明付き・インターホン用、センターブロック下、インターホンカバーB、フラット横型ポストは前入れ後取出し、サインはクリアガラスのパターン集選択タイプ、デザインパネルは縦格子です
その他	フラット	ここで、パラメトリック増幅素子は、光ファイバ(例えば、分散シフト光ファイバ、分散フラット光ファイバである)であり、パラメトリック増幅素子は、非線形光学材料(例えば、KTiOPO4、KTiOAsO4、β−BaB2O4、LiNbO3のいずれか1種である)を備えた光導波路素子であり波長選択素子は、光フィルタである
その他	フラット	↓ついに、偽物が出ましたね ^^; 遠泳の件だけど、ちょっと調べたら平は競技用と遠泳用の2種類の泳ぎ方があり、さらに競技用には水のうねりを利用するウエーブ型と水のうねりをできるだけつくらないで直線的に泳ぐフラット型とがあるみたいです
その他	フラット	フランス系監督は、もともとの路線に戻ることを意味し、おそらくフラット・ラインディフェンスを導入、コレクティブでコンパクトなサッカーは日本に合うだろう
その他	フラット	上記フラット35の技術基準に加えて、以下の4つの基準のうちいずれか1つ以上の基準を満たす住宅を取得される際に、お借入金利を優遇する制度(優良住宅取得支援制度(愛称:フラット35S))です
その他	フラット	こんなカンジです トロピカルな色で楽しむ方 透明感をだしてキラキラで楽しむかた フラットアートでオリジナルな柄で楽しむ方 皆さんはどんなのがお好きですか
その他	フラット	当初は『ボウルバック・タイプ』の『マンドリン』を作っていたのですが、音量・音質共に充分なものを得られないという理由から、厚い板を削り出して作る方式を提案、結果『フラットバック・タイプ』の『マンドリン』が誕生しました
家庭	フラット	フローレンス・ブーツで半年過ごし、その後大学所有の自炊のフラットに引っ越したクラスメートで韓国人のテイによると、朝、バスルームに行った際、パンツ姿の男子学生と鉢合わせしたこともあったという
その他	フラット	既存の「アルティプラノXL」はフラットなムーブメントを収めるため、無駄な脂肪を一切削いだシンプルな2針時計だったが、新作では10時位置にスモールセコンド、3時位置にブランドのロゴマークを配し、ケース径を38mmから40mmへと僅かにサイズアップ
音楽	フラット	当初はGのキーで作曲され、ポールはファルセットで歌ってみたがうまくいかず、最終的に、アート・ガーファンクルがリード・ボーカルで、キーもEフラットに下げた形で発表
その他	フラット	今までは、片面SPD/片面フラットだったので、フラット面を踏んでしまってスムーズに加速出来ない時が有ったのですが、ペダル交換後はどちらの面を踏んでも装着出来るので、ペダルの方に気を取られる事も無くなり、加速に [続きを読む]
家庭	フラット	市中心部のフラットだと週400~600豪ドルくらいが中心で、郊外の学園都市だと300~400豪ドル、郊外のアジア系住民が多く住む地域で200~300豪ドルというのがおおよその賃貸相場です
その他	フラット	SBIグループ独自の金融手法やインターネット、コールセンターを活用し、「スーパー【フラット35】」や「グッド住宅ローン」をはじめとして、住宅ローン業界において最低水準の金利をお客様にご提供しています
その他	フラット	哀愁帯びたフラットなメロディを唄い上げていく煽情性の強いパワーヴォーカルは、かなりネヴァーモアを意識しているようですが、全体的にはあれほどアクの強くないマイルドな仕上がりになっています
その他	フラット	安齋氏は、「現在、多くの企業が、ヒエラルキー型の組織からフラットな組織へ、そして、自社ですべてをまかなう組織から、外部パートナーと連携できるコラボレーション型組織へと変貌しつつある
その他	フラット	フラット35S・一戸建て・墨田区・葛飾区・日比谷線・都営浅草線・平井で納得のフラット35S・一戸建て・墨田区・葛飾区・日比谷線・都営浅草線・平井ならここがおすすめ
家庭	フラット	イラン人のフラットメイトによると、昼過ぎに彼がフラットに戻ってきたら、電子レンジから白い煙がモクモクと沸いていて、キッチン中に煙が充満していたとのこと
その他	フラット	杉板くんの京町家改修用語集 住宅金融支援機構(旧住宅金融公庫)が、提供している金融商品に、フラット35、フラット35Sが、あるが、この商品に、合う住宅かどうかを、判断すること適合証明といい その証明書を、適合証明書という フラット35は、中古住宅の金融商品です フラット35Sは
その他	フラット	ボールを真後ろからフラットに捕らえるため、打球の感覚がつかみやすく、ボールに回転を与えないのでスピードが出るが打球は直線的に飛ぶため高い打点で捕らえる
その他	フラット	また最近のクロスカントリー競技では乗車ポジションの多様性よりも車体の制御を意識してバーエンドを使用せずライズバーまたは大幅(10°前後)に湾曲させたフラットバーを使用する事も多い
その他	フラット	通常のリザードとは違い、リザードの特徴である斑紋を残しながら、絶妙に計算された圧力と温度の「ハイドリックアイロン」で鏡面のようにフラットに加工されていました
その他	フラット	欧米では、脳波がフラットになることは脳死の基準には入っていないようで、移植の成功率を上げることが問題になることは目に見えていることを考えると、この基準も変わって行くと思われる
その他	フラット	沢尻 今回は監督にすべてまかせていたところがあって、監督のディレクションを受けて、それを私が受け止めて芝居の中で返していくという、凄くフェアでフラットな関係でした
その他	フラット	「フラット35」や民間金融機関住宅ローンの他に、三井ホームオリジナル住宅ローン「三井ホームローン」をご用意しておりますので、全国の有力金融機関との提携による各種優遇金利をご利用いただけます
その他	フラット	同じくマイノリティである黒人の伝説的なブルースマンと悪魔のギターを導火線に使い(悪魔との契約 "treaty" はいうまでもなく、白人がインディアンと結んだ多くの "treaties" を象徴している)、その一方で「コヨーテ・スプリングズ」というダイナマイトを準備し、さらにフラットヘッド族の美女というガソリンを用意したあげく、不発に終わらせ、物寂しい銃声を一発響かせて、すべてをばらばらにしていく
その他	フラット	7メートルのフラットエリアを魚探で細かくチェックし、フラットの中でもより硬いハードボトムの上に乗っかっているベイトを狙い、すぐに反応はかえってきましたが、サイズが小さい↓↓時間もなく焦りが
その他	フラット	「川口パブリックゴルフ場」は、河川敷のフラットな地形を活かしつつ、ゴルファーに戦略性を楽しんでもらおうという意図の感じられる全12ホールのゴルフ場である
その他	フラット	人間、集団生活をする際に指導者をたてると話がまとまりやすいと思っていましたが、環境に恵まれ、何一つ不自由のない生活であればこんな風にフラットな生活もできるのかもしれません
その他	フラット	フラットな広場を行ったり来たりという前半は、なかなか抜き所が無く、ライン取りと立ち上がりトラクションを生かし短距離ダッシュで並んで何とか前走車を抜いていく
その他	フラット	外国人選手と違って日本人の身長ではフラットサーブでも下から上に振り上げて縦回転を意識しないと入らないなど、選手ならではのアドバイスが印象的でした
その他	フラット	新品のスキーやボードも滑る前にフラットな滑走面を作ったり、エッジのビベリング、サイドエッジの研磨、雪質に合ったストラクチャを入れる等をすることにより、本来のスキー、ボードが持っている滑走性、回転性等の性能を100%引き出すことが出来ます
その他	フラット	秀峰大山を望む自然を最大限に活かした【ワイド・フラット・ノーブラインド】の豪快なチャンピオンコースは、ビギナーから上級者までゴルフの楽しさ・醍醐味を満喫できる
その他	フラット	BuyMaトップレディースファッション靴・ブーツ・サンダルシューズ・サンダルその他【横ロゴがお洒落】CHANEL バイカラー フラットシューズ
音楽	フラット	要するに調子記号としては、普通のCの楽器よりフラットを一つ多く、シャープだったら一つ少なくして、 出して欲しい音の4度上に書けば良い訳だが、移調楽器の相互関係と云うのは、実際に楽器に触れた人でないと、結構分かりにくいものの様で、 ベテランの作曲家、アレンジャーでも、時々これを勘違いして、間違える事が有る
家庭	フラット	フラットの部屋は個室orダブルなので居心地は良かったし、キッチンやシャワールームも週に2回ほどクリーニングが入っていたのできれいだったし、寮を選んでよかったと思いました
音楽	フラット	後藤芳子の招きで日本にも度々来訪し、東京の「ボディ&ソウル」で佐藤充彦のピアノで歌い、「Bフラット」で、寺下誠(ピアノ)や大山秀男(アルトサックス)と共演して好評を博し、浅草ジャズ・コンテスト2003年に応募して金賞を獲得し、注目を集めた
その他	フラット	政府の「明日の安心と成長のための緊急経済対策」(平成21年度第二次補正予算)に基づき、住宅金融支援機構による【フラット35】S(優良住宅取得支援制度)の金利引下げ幅が、当初10年間について0
その他	フラット	このお店は、自分が高校生の頃からの行きつけで、愛用のマーチンD28をはじめ、ケンタッキーのフラットマンドリン、オスカーシュミットのオートハープは、この店で購入した
その他	フラット	堀の内駅から平坦地で徒歩8分、カースペース有、住宅保証機構10年保証住宅、フラット35S利用可、各居室ペアガラス、1坪ユニットバス暖房換気乾燥機能付、モニター付インターホン等、現況:建築中、平成22年9月上旬完成予定、内見可能です・お気軽にお問い合わせ下さい
その他	フラット	このほか、モデル事業を創設してSI(スケルトン・インフィル)住宅へ助成する仕組みづくりや、住宅金融支援機構の[フラット35]の融資期間を最長50年とする金融システムなども検討されている
その他	フラット	学校や職場の事情でピアスができない、サウナやスキー場など温度変化の激しい場所で、スポーツ時の外傷予防として、大活躍のシリコンピアスが16本セットになってこのお値段★ トップがスター型とハート型、ボール型、丸フラットのタイプが各4本入っています
その他	フラット	特に、パット・メセニーが参加している6曲目の「レヴランス(奇跡の物語)」は、メセニーのアコースティック・ギターにボナのフラット・ベースが絶妙にからんだ美しいインストゥルメンタルの名曲だと思います
その他	フラット	【0008】また、ゴミを捕獲するためには床などの掃除対象面に器具などにより押しつけた際に、既存の掃除用シートでは掃除対象面に比較的フラットに接触するため、獲得する効果が低いが、掃除用シートに穴を開け、あるいは凹凸を付与することで捕獲性が大幅に向上する
その他	フラット	それに2007年4月1日より住宅金融公庫が組織替えして住宅金融支援機構になり、マーケットシェア40%超を占めていましたが公庫融資が中止となり、業務として証券化支援で民間金融機関をバックアップする(フラット35)ことになりました
その他	フラット	(特にフラット選手は先シーズン、何故かスケートアメリカで二位、世界選手権でもクリーンに見えたジャンプはDGで、実力に対して正当な評価がされていないように感じます
その他	フラット	攻撃時こそ自在なポジショニングにドリブル、パスで魅せてくれたが、守備時には中盤を両サイドからフラットにブロック形成し、各々のゾーンをきっちり守ってきた
その他	フラット	お客様の年収とご希望のご返済期間、他社でのローンのお借入れ状況から、住宅ローン【フラット35】のお借入可能額とその金額に基づいた毎月のご返済額を算出いたします
その他	フラット	マンション」とは、「フラット35登録マンション」のうち、事業者のみなさまが工事の施工過程の情報を記載した『工事施工レポート』をお客様に提供し、かつ、管理規約及び長期修繕
音楽	フラット	参考のために、この「フラット2つのキー(調)」は、長調の場合ドイツ音名でB(ベー)ドゥアー、英語音名でBフラットメジャー、短調の場合G(ゲー)モール、Gマイナーと言うキーです
その他	フラット	オアフ島には6箇所の市営ゴルフ場がありますが、アラワイゴルフ場が特に人気がある原因は、いろいろあるでしょうが、他の市営ゴルフ場に比べてフラットなコースで、便利な場所にあることが一番の理由と思われます
音楽	フラット	同時期に音楽教師から高度な作曲理論を学び(「私の音楽に対する勉強は、GフラットとFシャープの違いを学んだことからはじまった」という言葉は有名)、1916年にピアニストとしてデビュー
その他	フラット	「フラット35を除く、民間住宅ローン貸出の全期間・10年超の長期固定金利は、1割程度」ということが、住宅金融支援機構がまとめた民間住宅ローンの貸出動向アンケート調査で明らかになった
その他	フラット	根本的に解決するには、アンプ自体に相当なパワーが必要とされるはずで、Picoはポータブルアンプの限られた出力の中で、音の味付けによるフラットな特性をあえて選択せず、自然な音を生かした結果として中音域が強調されているのではないかと思える
その他	フラット	また、歴史学研究者・教師・生徒・その他一般の人たちができるだけフラットな形で話し合える場も必要だろう(こういう時、大学にも本当の意味での世界史の専門家がいないということは、逆に強みになるかもしれない)
その他	フラット	第1に人体内の整理活動は常にフラットではなく、おおよそ24〜25時間周期をもって光を入力したことによって、運動周期はリセットされて1日の活動が始まり
音楽	フラット	一生懸命それを楽譜に起こすところから始めて、そのうたっている方のキーなので、楽譜にするとフラットやらシャープやらいっぱいあってすごく大変だったのです
その他	フラット	車中泊とキャンプ:MV:イレクターパイプ仕様フルフラットにしたシートの段差を埋めてみたりクッションを使って微調整したりしてもやっぱりそれは車のシートでしかない
その他	フラット	Qの厚いほうのターンテーブルシートを切り抜いて作った、CDトランスポート、CEC TL51Xのスタビライザー、これも、不要な共振を排し、結局、その上に、最終的に、フラットアンプの追加で、鬼に金棒、虎の褌、向かう所敵無し状態、正に、自画自賛で7月は終わるのでした
その他	フラット	「フラット」「レター」「傘唄」他、人や街、自然や時の移ろい、そんな日々の出会いのヨロコビや感謝の気持ちを、丁寧な描写で綴るスタイルが特徴の楽曲を収録
その他	フラット	フラット3を一から教える手間を省く為に手っ取り早い手段を取った訳ですが、中盤から後ろならどこでもこなせる器用な中田浩二くんなら間違いなくお役に立てるでしょう
その他	フラット	中山選手の"復活"は、同じ磐田の高原選手の離脱など、フォワード陣の相次ぐ故障などの要因があるものの、秋田選手の場合は、トルシエ監督の戦術"フラット3"に適さないということで、長らく代表から外れていただけに、唐突感は否めません
その他	フラット	フラット35は、融資条件が全国一律で、それをクリヤすれば、融資額は8000万円を限度に融資率90%、返済期間最長35年、低利な長期固定金利のほか、住宅金融支援機構が定める技術標準に適合してはじめて借りられるので、旧公庫融資よりも借りやすく、安心できる住宅取得が可能となります
