# 音楽: 音楽で、半音下げる記号。変記号。♭と書く。⇔シャープ。, 家庭: 共同住宅で、各戸が同一階内に収まる形式のもの。, スポーツ: 競技で、タイムに秒より下の端数がつかないこと。ジャスト。一〇〇メートルを一一秒フラットで走る
その他	フラット	これは何もフラット型組織が問題なわけではなく組織の規模や段階によってはメリット/デメリットがあるということに過ぎないが、少なくとも弊害を見る限り、トップダウン/ボトムアップを実現できる(もしくはできない)ためのポイントは「マネジメント
その他	フラット	様々なシーンに活躍できて1足は欲しい「パンプス」、これからの季節にぴったりな「サンダル」、今年らしさを求めるなら「フラットシューズ」、夏こそ履きたい「サマーブーツ」、オン・オフ充実の「メンズシューズ」
その他	フラット	さらに、原作本を買って、DVD発売決定前だというのに発売された時のためにプレステ2買って、テレビも21型モノラルから25型ステレオフラットに買い替えるやらで10万以上吹っ飛びました(爆)
その他	フラット	俺も昔はフラットまんせーだったが、今のラケットじゃ単にスピードがあるだけの球は簡単に返せてしまうので、スピンもスピードもあるボールがテニス全般でいいんじゃないかと思うようになった
その他	フラット	A3:当社では住宅金融支援機構 財形住宅融資は取り扱っておりませんが、お客様のお申し出があれば、MCJフラット35・MCJフラット20と【他金融機関取扱の住宅金融支援機構 財形住宅融資】の併用が可能です
その他	フラット	これはフラット35では、公庫が民間の住宅ローンを買い取って、これを機関投資家に転売する仕組みになっており、債務者の返済リスクは機関投資家が負担することになっているからです
その他	フラット	フラットなエリア、中層域といった絞りにくいエリアと800kHzの超解像度で、ベイトとバスの区別が非常に簡単ですので、バスだけを記録していくと地図上に示される記録ポイントがバスがいたポイントになりバスの濃いエリアとレンジを魚探がけで割り出せることになります
その他	フラット	フラット35をご利用いただくためには、購入される中古住宅について、住宅金融支援機構が定める独自の技術基準に適合していることを証明する適合証明書の交付を受けていただく必要があります
その他	フラット	次に3点目ですが、管理職の割合は、本市は他団体より高いと聞いていますが、神奈川県がやっているように組織のフラット化を図るなど、管理職の職員数を削減することによって、人件費を削減することは考えられないのかあわせて伺います
その他	フラット	【0005】本発明における水平面部および脚部は、クリンプド金網、トップフラット金網、溶接金網に限らず、他の基材例えば多数の孔が開けられている板、孔のない板等のいずれかで構成しても良く、また前記の金網と板を適宜組み合わせた態様としても良い
その他	フラット	“ビアンキ ミニベロ”や“ミニベロ8 フラットバー”などのキーワードで検索すると、ここは上位に表示されますので、それらのキーワードで来られる方も結構多い(1/3ほどが自転車関係のワード)のですが、現状は自転車生活にはほど遠い生活だったりします
その他	フラット	これに対しMCカートリッジを使った音楽再生では、MCヘッドアンプ、イコライザーアンプ、フラットアンプと3個ものアンプを経由してパワーアンプに出力されます
その他	フラット	「ちばリサーチパーク」内北西側に位置するゴルフ場計画地は、箱崎ICより車で約50分、JR東京駅より電車で約60分と交通利便性に優れ、高低差のないフラットな地形に、開発面積は約94ha、トーナメントの開催要件を満たす本格的なチャンピオンコースが誕生します
その他	フラット	会社に勤めていた当時、廃盤商品だからと大量に貰った紙製のフラットファイル、型紙作成にとっても重宝していたのに、引越以後処分してしまったのか何処を探しても無い~っ
その他	フラット	今年は、ロードでの輪行も少しチャレンジしたいと思ってまして、もうひとつWellgoのQRDシステムのSPDペダルがあれば、Tikitとロードで用途に応じてフラットペダルとSPDを交互に使えると考えました
音楽	フラット	いま私の耳には「シ・フラット」は「シーナチュラルー」と言いながら飛び込んでくるわけですが、「うそつけこのやろう」とピアノの鍵盤を叩いて修正します
その他	フラット	08年度は、賃貸住宅融資が前年度に比べて1割以上増加しているものの、マンション需要の低迷と金利先安感などでフラット35の買取申請が1割程度落ち込む見通し
その他	フラット	【0120】メモリコンテンツメニュー1700は、ゲームタイトルおよびそれらの対応する保存されたゲーム、サウンドトラックおよびそれらの関連トラック、および選択されたメモリデバイス上に格納されているビデオクリップの、フラットなリスト1702を示す
その他	フラット	そういう中で、フラットな形でお話をする中で、地域の要望につきまして取り入れていくような形での努力をしていまして、またユニバーサルデザイン、このワークショップ、1回目、2回目はユニバーサルデザインというのはどういうものかというところから始めておりますので、そういったところでも意識啓発が若干できたのかなと考えております
その他	フラット	このコースは25km〜30kmの間にアップダウンがあるそうで、その他はほとんどフラットのようですが、ラップを見るとそのアップダウンの影響はないようですね
その他	フラット	◇W杯に夢中のジョニデ、撮影現場にテレビを設置 ハワイで『パイレーツ・オブ・カリビアン』シリーズ最新作を 撮影中のジョニー・デップが、南アフリカで行われたサッカーの ワールドカップを観戦するため、撮影現場のあらゆる場所に 大型フラットスクリーンTVを設置したそうだ
その他	フラット	五輪では、ロシェット選手、コストナー選手、フラット選手、レオノワ選手、キム選手、レピスト選手、鈴木選手、みんな2nd3Toを飛んで来るだろうなぁ
その他	フラット	イコライザー段、トーンコントロール段、フラットアンプなどは、それぞれ独立したエポキシ系のプリント基板に分割してユニットアンプ的手法が採用されており、電源トランスは、磁束のリーケージを抑えるためトロイダル型オリエントコアを使っている
その他	フラット	国家情報センターがこのほど発表した「2008年上半期国内重点都市フラットテレビ市場分析報告」によれば、中国国内メーカーの液晶テレビのシェアが前年に比べて大きくダウンしていることがわかった
その他	フラット	・フラットタイプ→カバー周りにゴムが入っていないタイプ ・ボックスタイプ →カバー周りにゴムが入っているタイプ いずれも敷き布団カバーにレースやフリルが付いていないタイプが対象 になります
その他	フラット	安全なフルフラットの二重床を始め、プライバシーを守る180mm厚の戸境壁、子供が伸び伸びと遊べる1階のプレイロットなど細やかな気配りに加えて、24時間常時接続のインターネットも完備した、新世紀にふさわしいインターネットマンションとなっている
その他	フラット	住宅金融支援機構提携住宅ローン「フラット35」Q&A 改訂 住生活月間中央イベントの開催概要や関連行事など、住生活月間に関わる様々な情報を紹介します
その他	フラット	次に腰痛体操としては主に腰弯増強(反り腰)を痛みの原因として捕えるウイリアムス体操と腰椎のフラットを痛みとして捕えるマッケンジー体操の処方について(腰部後屈の痛みでは前者を、前屈の痛みでは後者をそれぞれ取り入れた形で)述べられました
家庭	フラット	ただ今日見学したフラット(10数階建ての巨大な集合住宅)は廊下の両側の壁はまるで公衆トイレの内壁のような白いタイル張り、廊下の床に敷かれているグレーのカーペットもあちこち汚れて紙コップや新聞紙などのごみが落ちており、換気が悪いのかあたりに食べ物の匂いが満ちている、すれ違う住人の多くはおそらくは私たちの祖父母の世代、建物の全体的な雰囲気が"施設"を連想させました
家庭	フラット	友人の中にはフラットをインターネットや掲示板で探し、7人くらいで家をシェアしている人もいたがイギリスでそういう物件を探すのは結構難しく、また高額なものが多い
その他	フラット	粟賀ゴルフ倶楽部(兵庫県神崎町) 丘陵コースだが高低差が少なくフラットであり、谷越えやドッグレッグも少なく第1打落下地点付近のフェアウェイの幅は平均60~70mとゆったりしていて、思いきりの良いショットが楽しめる
その他	フラット	その後King of Ground(BMXのフラットランド競技全日本選手権)エキスパートクラス、シリーズチャンピオンとなり、プロライダーに昇格
音楽	フラット	彼の音は当世流行りの、唇を緩めにして意識的に低めに音程をとる(フラットな)吹き方ではなく、美しい音と繊細な表現で、聴いた途端に「私の好きな歴代クラリネット奏者」の上位に入りました
家庭	フラット	住環境についていえば、国民に安価で良質の住宅を提供する政府の住宅政策により、国民の8割以上がHDBフラットと呼ばれる高層の公営住宅に居住するようになったが、生活水準の向上とともに、きめ細かな環境整備、住宅管理が求められるようになった
家庭	フラット	シドニーの場合、一握りのシティ中心部や観光エリアのアパートメント(コンドミニアム)系以外は、フラットや商店街などに時々3~4階建があるくらいで、大多数は2階どまり
その他	フラット	北京五輪に出場するカヌー代表の壮行会が31日、東京都内のホテルで開かれ、2大会連続出場となるフラットウオーター女子カヤックフォアのエース北本忍(富山県体協)は「メダルも不可能ではない
その他	フラット	フェンスに肘を付いて中年男2人を眺める、フォームはめちゃくちゃだしエッジはフラットだがホッケーをやっていただけあって安定感とスピードは中々のものだ
その他	フラット	フラットアンプは、DCサーボなどを利用してカップリングコンデンサーを省いているものもありますが、フラットアンプ出力にまでコンデンサーを使用している機種も結構あります
その他	フラット	3(フラット・ピックキング):ブルーグラス系に最も用いられる、フラットピックでアップ・ダウンを巧みに使いメロディラインとリズムを絡ませるスタイル
その他	フラット	一体化されたバンパーと空力装置は、出走状態の車両(すべての公式車両検査に提示された車両)のフラットボトム上方250mmより下で、車輪回転軸の中心より前に取り付けなければならない
その他	フラット	そのメッセージの出どころがどこであろうと、元々の形式がフラットファイル(パイプラインでXMLに変換)であろうと、まずメッセージボックスDBにXMLで保存されます
その他	フラット	先立って米空軍とエンジンメーカーであるアメリカフラット&ホイットニー社は1993~94年に製作されたエンジンのカバープレートを2004年まで入れ替えるよう指示していた
音楽	フラット	49小節からの部分は、フラット系の曇った音色をピアニシモのニュアンスに充て、音量よりも、左手にあるメロディーを浮かび上がらせることを優先させるべきだと思います
その他	フラット	そのものの考え方は、まず価値観にはフラットな視点で客観的な状況把握の外在化を行い(どういう立場から観ても共有しうるような情報の位置づけの仕方)、その後で、一つの「価値観」を選択し、その視点で見ると、その情報はどういう形で捉えることができるか、という推論を行うというスタイルをとります
家庭	フラット	同調査によると、世帯収入によって所有率が異なり、一戸建て民間住宅では78%、民間コンドミニアムでは64%がパソコンを所有する一方、公共住宅(HDB10フラット)では所有世帯が37%に留まっている
その他	フラット	ちなみに「フラット35」という住宅ローンの概要を述べさせていただくと、フラット35は、住宅金融公庫がバックアップする、民間金融機関の長期固定金利型住宅ローンのことです
音楽	フラット	KMDさんのブログでエリック・ドルフィーのCD『アウト・ゼア』 が紹介されていて、その中で、「ロン・カーターは、大きく吹いたときのドルフィーのフラット気味になる音程に違和感を持っていたという話を聴いたことがあ る」と書かれている
その他	フラット	まるで手品でもするように、その器用な指遣いで、ある時はフィンガー・ピッキング、またある時はフラット・ピッキングの早弾き、更にはボトルネックまで駆使して、フォーク、カントリー、ブルース等を聴かせてくれる
その他	フラット	公庫買取型の住宅ローン“フラット35”の優良住宅取得支援制度“フラット35S(読み方:ふらっとさんじゅうご・えす)”は、一定の要件を満たす住宅を取得ために同ローンを利用する際、融資金利を優遇する制度です
その他	フラット	フラットサーブと同じですが、振り出されたインパクト時のラケット面は打つ方向に対して少し斜めに当たり、手首はリバースしますがラケットは右へ振りぬける感じでスイングします
その他	フラット	ダウンウインド時にはボードトリムもイージーなので、風波から風波に乗りつなぐことが簡単で、フラットウォーターはもちろん、ダウンウインドでも速いボードで、
その他	フラット	(社)全国宅地建物取引業協会連合会(藤田和夫会長)会員の出資により設立された公庫証券化ローン「フラット35」取扱の住宅ローン会社「全宅住宅ローン(株)」(代表取締役:藤田和夫氏)の開業披露が、28日の全宅連通常総会終了後の懇親会と併せて行なわれ、全宅連役員、全宅住宅ローン株主のほか、国土交通省など関係官庁、国会議員など多数の来賓が詰め掛けた
その他	フラット	中古マンション市場は、住宅ローン減税やフラット35の融資基準緩和など各種経済対策の効果に加え、今年に入って新築マンションの供給が大幅に減っていることも手伝って活況を呈している
その他	フラット	そのタイプのものは俗にクラシックマンドリンと呼ばれるものなんですけれども、一方、このフラットマンドリンは背面がまったいらでギターを小さくしたような感じです
その他	フラット	懇親会冒頭で岩沙理事長は「今年度も不動産協会活動を通じて、国民生活の向上と日本経済の持続的成長に貢献したい」と述べた後、住宅市況について「住宅資金贈与の非課税枠の拡大、フラット35S、エコポイント、ローン減税などの政策効果もあって、首都圏では回復軌道に
その他	フラット	インソールの米国No 1ブランド、ソフソール《スパイクプラス》は、ソフソール独自の設計とフラット形状でスパイクシューズのポイントから 受ける衝撃を緩和するインソールです
その他	フラット	“Black Mountain Rag”は恐らく、全てのブルーグラッサーの憧れる、フラットピックの往復による、あたかもブルーグラス・フィドル(バイオリン)のフレーズが怒濤の如く押し寄せるフラットピッキングの名曲です
その他	フラット	4)ドイツではこの「2つのサイドがフラットにされたシリンダーを持つリボルバー」のパテント申請がチューリッヒ在住のフロイライン(頑住吉注:英語のミス)Valerie Schlapalによって行われている
その他	フラット	さらに09年度政府予算について、フラット35S(新築・既存住宅を問わず)の金利優遇期間が5年間から10年間に延長されることとされ、5月1日より実施される予定です
音楽	フラット	また、長3度と長7度の音程をフラットさせる範囲は完全な半音間隔ではない場合も多く、長3度と短3度(あるいは長7度と短7度)の間にある、クロマチックスケール上にない中間的な音程になることが主流で、それも特徴的な要素となっています
その他	フラット	ただ、この場所は水道の蛇口が出ていたり、雨どいが邪魔をしたり、底面がフラットでなかったりといろいろ制約があり、図面化までに考えることが多く苦労した
その他	フラット	耐震性を大幅に高める免震工法の採用、高齢者に優しいフルフラット設計や逆梁ハイサッシュを採用した採光性の向上や通風性の高いプランニングなど、住む人の立場にたった商品企画に努めています
その他	フラット	今年7月に同じ吉備津彦をめざして 総社から歩きましたがその時はほぼフラットな道ばかりでしたが、今回は出発から山道で距離は短いけれど最初で体力を奪われたとおっしゃってました
その他	フラット	過去、名古屋を率いていたアーセン・ベンゲル(現アーセナル監督)は選手を立たせ、ボールを転がすところから始めてフラット4のリアクションサッカーを教え込んでいた
その他	フラット	順番は前後しますが・・昨日は 内閣総理大臣杯 日本社会人ゴルフ選手権予選で大宮ゴルフコース でした 初めてのコースです、ええっとフラットで短いと聞いてたんですが、距離も6910ヤードとしっかりあり コース間は完全に林でセパレートされて
その他	フラット	IOCはローザンヌの会議で、カヌーのフラットウオーター男子カヤックペア1000メートルで4位となったアダム・セロチンスキ選手(ポーランド)もドーピングで失格とすることを決めた
その他	フラット	これは捉え方でしょうが、フラットに光が充満する部屋と、少ない窓から差し込む光、どちらが美しいかというのは難しいところですし、また近接する部屋との対比等に依って、部屋、或いは光の人間に及ぼす作用というものはまるで違って来ます
その他	フラット	「すり鉢状に観客席がある武道館と違い、フラットな客席なのでより出演者の観客が一体になって盛り上げることができると思う」というメリットを明かし、同時に名物のチャリティマラソンのゴールシーンについても演出が若干変わる可能性を示唆した
音楽	フラット	2次系の特性の生成は簡単なので、いったん歌声を完全にフラットにしてしまったあとで、完全に合成された動特性を付加しても音楽制作用ソフトウェアとしては十分じゃないだろうか
その他	フラット	こうして登場してくるNW機構=「場の創作者」の役割は、徹底した情報(共有)公開と、それにもとずく単位企業間の評価共認の場づくりにシフトしていき、フラット化した各単位企業内では、どのような闘争(共認)原理と生殖(共認)原理を形成していくかが、評価を決する最重要課題になるでしょう
その他	フラット	戦術のねらいはDFラインを高く保ちフラットに並んだ4人の中盤で高い位置でプレスをかけボールを奪取し、少ないパスの本数でトップ下の「天才」サビチェビッチのひらめきからセンターフォワードのラドチョウがシュートまで持ち込むプレッシングサッカーです
その他	フラット	また、GEコンシュマー・ファイナンスは、全宅住宅ローン・フラット35の融資基準に適合しない案件について、顧客の希望により他の金融機関の住宅ローン商品を紹介する
その他	フラット	フラットパネル・デザインのプレーヤー本体部とアンプ/トランス部、液晶テレビ・AQUOS、そしてスマートなトールボーイ・スピーカーの美しい融合は、新しいホームシアター・システムの可能性を感じさせます
その他	フラット	北京オリンピックは22日、カヌー・フラットウオーター各種目の決勝が行われ、女子カヤックフォア500メートルで日本チーム(北本忍選手、久野綾香選手、竹屋美紀子選手、鈴木祐美子選手)は1分36秒465で6位となり、同種目で初の入賞を果たした
その他	フラット	イメージとして、フラット・ドライブめに打って、相手がボレーするとすれば、僕は少しだけ、ドライブ目にスイングする、ボールはネットを越えてから、相手が、「えっっ
その他	フラット	金色のコルダ「ステラミュージカル」フラット組の千秋楽公演に行って来ました(^^) 大ラス公演の前公演だったんですが、フラットチームの香穂子・岡本あずさちゃんとリリの山内亜美
その他	フラット	ジャンルはアクションゲームで「夢の国」を舞台にマイメロディがクロミやバク達の妨害をかわしながらマリーランドのフラット君やピアノちゃんたちを助けると言うストーリーになっている
その他	フラット	コース全体に、大小の池が点在し、またフラットの中にも小さなうねりがあり、戦略性に富んだレイアウトはゴルファーたちのチャレンジスピリットを刺激しています
その他	フラット	引用・日刊スポーツ 北京五輪第15日の22日、フラットウォーター男女6種目の決勝があり、女子カヤックフォア五百メートルで日本(北本忍、久野綾香、竹屋美紀子、鈴木裕美子)が、1分36秒465で6位と
その他	フラット	スポーツ科学関連の情報をふんだんに盛り込み、あくまでフラットにゲームを描きながら(例えば「ケガを隠して頑張り続ける選手」なんて絶対出てこない)、凡百のスポ根とは比較にならないくらい感動的な野球漫画はまだ始まったばかり
その他	フラット	美しい三草山の裾野に広がる関西地区でも有数のフラットな「サンロイヤルゴルフクラブ」、雄大でなだらかな丘陵地に身震いする様なコースを設計されましたのは、かの有名な加藤福一氏で、手がけた数多くのチャンピオンコースの中でも屈指の自信作です
音楽	フラット	モラレスの場合は真ん中に合わせてもしばらく針がちょっとフラットしたりシャープしたりブレながら動くのでチューニングがちょっとやりずらい感じがします
その他	フラット	駒ヶ根高原スキー場にて1 中央自動車道駒ヶ根インターからすぐ近く、中央アルプス駒ケ岳の山麓にある駒ヶ根高原スキー場 適度な斜度と広くは無いけれどフラットなゲレンデ、子供連れには最適なスキー
