# 音楽: 音楽で、半音下げる記号。変記号。♭と書く。⇔シャープ。, 家庭: 共同住宅で、各戸が同一階内に収まる形式のもの。, スポーツ: 競技で、タイムに秒より下の端数がつかないこと。ジャスト。一〇〇メートルを一一秒フラットで走る
音楽	フラット	(例・フラットが二つ、シのフラットとミのフラットの順にある→拍子側から二つ目の音はシのフラット、だからシのフラットを日本音名に直して、長調ならば変ロ長調)
その他	フラット	一見スタンダード風のハンドルは幅を若干詰め、エンド部分は約30mm手前に、下に向かずフラットな形状のタイプに変更し、スポーツ走行時にはライダーの上体にゆとりを持たせ、押さえの効くポジションをつくりました
その他	フラット	上海体育 場をスタートし、新しく開発された外環路を通って、上海の副都心といわれる虹 橋路などを望みながら同体育場に戻る高低差のあまりないフラットなコースを走 る
その他	フラット	フラット35は土地を買って、注文住宅を建てる場合でも使用できます(土地を住宅銀行の住宅ローンで借りて、フラットの融資時に土地のローンを繰り上げ返済する方法)ので、当社では、フラット35を利用するお客様が多いです
その他	フラット	H:フラット走法というのはあとからついた名前で、高橋尚子選手の動作を分析して、当時、短距離の世界でも、カールルイスとか一流選手を分析していく中で、膝・足首を固定したままでどちらかというと股関節を中心に動かしている〜といわれ始めた頃だったんですね
その他	フラット	PHASERシリーズは、直動アクチュエータとして評価され、自動生産設備の駆動軸として実績を築いてきたが、近年、市場からは製品の小型化、フラット表示パネルに代表される比較的重さと大きさがある物のハンドリング、生産設備のさらなる高効率化、小型化、低価格化への要望が高まってきた
その他	フラット	「フラット35」の融資を受けるには、住宅が一定の技術基準に適合しているかどうか物件検査(1設計検査、2中間現場検査、3竣工現場検査、の3種類)を受け、「適合証明書」の交付を受ける必要がある
その他	フラット	カヌーの国際大会出場権を懸けた府中湖レガッタは26—30の5日間、坂出市の府中湖競技場で男女年齢別のフラットウオーター29種目(1000、500メートル)を行い、一般12種目の1位が北京五輪アジア予選(5月・石川)の出場権を獲得した
その他	フラット	52Darling社のセクシー&デリケートなローライズサイドストリングショーツのご紹介☆ストレッチコットン&フランス製ストレッチレースだからいつでも快適サラサラ♪サイドストリング部分はフラット・シームレスだから着心地最高
その他	フラット	フラット35は 米大統領が住宅ローン救済策住宅ローン 方がスムースにすみ 住宅ローン控除・確定申告 住宅ローン控除の確定申告は、最寄の税務署で行ないます
その他	フラット	辺戸岬の入口にあるトンネル、宜名真トンネルまではほぼフラット、風の影響も無く快適で負荷のかからないサイクリング、暫くすると先導のオートバイ、それに続くサイクリングリーダー、の後には5名ほどのチーム・ひぐちの面々が占めるようになった、皆ピンクゼッケンだ
その他	フラット	ティピ・ポール酒場での演奏で出会ったフラットヘッド・インディアンの姉妹、温水のチェスとチェッカーズの二人が加わり、彼らはバンドで食っていこうという目的を持ち、努力する事に目覚めていく
その他	フラット	雁木の軒並みを揃えるということも大事ですが、「あいぼ」歩こうという趣旨からすると一番大事なのは道路面をフラットに平らにして歩きやすい道にしなくてはならないのではないかと思います
家庭	フラット	私の借りているフラット(英国式一軒家のアパート)は、私の学校まで徒歩5分、子供たちの小学校へも徒歩5分、商店街、鉄道やバス駅にも近く、便利な場所にあり ながら、静かな住宅街に位置しています
その他	フラット	また高慣性モーメントヘッドでは、ヘッドの回転が少なくギア効果が小さいためトウ・ヒール方向のフェースラウンドをフラットにした「フラットバルジ」を採用し、ボールの打ち出し方向とサイドスピンを適正化し、ボールがセンターに戻る
音楽	フラット	あいかわらず、音程の細かいブレや、音域が極端に狭い(ソプラノと大差ない軽いメッゾなのに、Bフラットが一杯)など弱点の多い人ですが、その枠のなかで順調に成長が感じられました
その他	フラット	露光機構は、内面ドラム方式、外面ドラム方式、フラットベッド方式等の何れでもよいが、総出力20mW以上となる様な、マルチビームの露光装置が好ましい
家庭	フラット	フラット(アパート)を借りる場合、日本と同じようにオーストラリアに住む保証人が必要なことがほとんどですし、定職がない場合は、借りられるフラットが限られてしまうからです
その他	フラット	(独)住宅金融支援機構は3日、長期固定金利住宅ローン「フラット35」の金利優遇制度である「フラット35」Sの受付を、4月14日より開始すると発表した
その他	フラット	これらの特徴は楽器用アンプを音作りの一環として用いるエレクトリックギター用アンプに著しく、楽器本体である程度音が完成されているキーボード類では比較的フラットで低歪率のものが用いられる
音楽	フラット	このペダルが上がっている状態がフラット、一段押し込んでナチュラル、下に踏み込むとシャープ・ポジションになり、たとえば一番左のペダルを下まで踏み込むと全音域のHが一斉に半音上がりHisすなわちCになります
その他	フラット	設計図書がない中古住宅の構造(耐久性基準、準耐火構造等)を検査するための提出書類 「中古マンションらくらくフラット35」でHPに掲載しているマンション
その他	フラット	ペンプロッターには、記録紙を平らな台に固定し、ペンを縦横に移動する「フラットベッド型」の他に、両端に連続穴の開いた記録紙をスプロケットの付いたドラムで移動する「ドラム型」、記録紙を上下からローラーに挟み、摩擦で移動する「ペーパームービング型」といった形式があるんや
その他	フラット	80年代的なオタク女子のような、フラットな会話のやりとりがなじめなかったし、久留里とハルだけの関係がクローズアップされすぎていてそれはそれで貧弱なものを感じたのである
その他	フラット	北京五輪第14日の21日、カヌーのフラットウオーターの女子カヤックペア五百メートルは、予選で上位6組に入れなかった組による準決勝があり、北本忍(富山県体協)、竹屋美紀子(山形・谷地高教)組が1分43秒541で1位となり、9艇で争う23日の決勝に進んだ
その他	フラット	シンセサイザーをはじめとする電子楽器はもちろん、CD、MDやマイクなど、多彩な入力に対応し、フラットな周波数特性で最高のサウンドを出力するKCシリーズのハイ・パワー・モデル
その他	フラット	周波数応答がフラットではない閉鎖された部屋の中で、空気の振動の源であるSPをどこにどう置くか、そのSPを駆動するアンプが100%の力を出せているか、そのアンプにどれだけの情報を送り込めるか
その他	フラット	【0079】また、育成中、貴金属二重るつぼを回転させることで、供給した粉体原料45と融液41との均質化と同時に、結晶成長界面を融液面に対して強制的にフラットまたは凸になるよう融液41の対流を制御した
その他	フラット	呼吸気流は外鼻穴近くに留置されたサーミスタと圧センサーで測定されていますが、頻回にフロー曲線がフラットになり、呼吸が停止・低下していることが分かります
その他	フラット	また、園内は全てフラットな地形で、障害者対応トイレ・救急室・授乳室などもバリアフリーになっていますので、車椅子やベビーカーの方でも十分にお楽しみいただけます
その他	フラット	マンドリン族では所謂ラウンドボディなら、楽器ボディの共振はかなり押さえられるのでしょうね、、、我が藤丸フラットチェロでは・・・でも感じたことはない
その他	フラット	地方によって、バンドリン、バンドリーナ、マンドリン、マンドリーナなどと呼ばれることがありますが、フラットボディ、2コース8弦でヨーロッパのものと同じ調弦です
家庭	フラット	新しいマンション・ビルには、サービスアパートメント97戸、分譲フラット64戸が予定され、テムズ対岸に移転する予定の国際法律事務所や会計事務所などが2寝室または3寝室フラットの物件を購入するとみられている
その他	フラット	それでも日本は守崎悠、田所聡、そしてフラット3の梅田準、冬月黒衣、水無月瑠璃が気迫の守備を見せたが、ロスタイムになって2度のコーナーキックを与え、その2本目を低空でうたれると、ワンバウンドした所にミクーがあわせてボレーシュート、同点にされてしまう
音楽	フラット	フラット2つで、上のシ以上の音がばんばん出てくるわ、その上、ポジションとか指とか弦の指定の無い楽譜なんて見た日にゃあ・・・速攻タブ譜におこしてました
その他	フラット	部の雰囲気も体育会所属の武道の中では珍しい、フラットなやり易い環境で、先輩後輩の仲も非常に良いのが自慢です 僕は主将という立場ですが、合気道は大学から始めました
家庭	フラット	学生は、ホームステイ、学生用ホステル、学生用アパート、下宿、個人で借りるアパートやフラットなど、さまざまな宿泊施設から住居を選択することができます
その他	フラット	「フラットハンドル」でスポーツサイクルが初めてでも安心して乗れて、 「舗装路を走りやすいタイヤ」でロードレーサーほど細くなくマウンテンバイクほど太くなく ほどよい感じで、街中・サイクリングロードはもちろん鴨川の河川敷も走れます
その他	フラット	春の柔和さを連想させるフラット系で統一したオケといい、いかにも日本的な「ももくり」の歌といい、とにかく音楽が素晴らしい(唯一、主題歌がじゃまだったが)
その他	フラット	★駐車場2台分のスペース有り(車種によります)●システムキッチン(人造大理石使用)●TVモニター付インターホン●トイレ1、2階共ウォシュレット機能付●洗面化粧台1Fシャンプードレッサー●照明器具(玄関外、キッチンの手元灯、風呂場)●床下収納●浴室換気暖房機 ☆フラット35対応住宅
家庭	フラット	そのため家賃補助がなくなるので最高で週250ポンドで夫婦2人が暮らせるフラットに引越しをしなくてはならないのですがどの辺が住みやすく、買い物も便利で通勤(シティ)も楽でしょうか
その他	フラット	住宅金融公庫は、証券化支援住宅ローン「フラット35」の技術基準に加えて、優良住宅取得支援制度の基準に適合した住宅について、当初5年間の金利を0・3%優遇する制度を6月1日借り入れ申し込み分から適用する
その他	フラット	・長期優良住宅に申請する メリット、デメリット教えてください新築 「木造・35坪・3LDK」 「長期優良住宅仕様」 建築場所「静岡の田舎」仕様は建物+諸経費1800万~2000万位です(HMの見積もりにより違い有)1長期優良住宅仕様のみでフラット35S(20年)利用可能でしょうか
その他	フラット	さらに、住宅金融支援機構の長期固定ローン「フラット35」融資の 上限額を、マンション・住宅購入資金の10割(現行9割)に引き上げ、頭金なし でも住宅ローンが組めるようにすることも盛り込む
その他	フラット	タンゴヴァイオリンの名手でもあるバンドリン(フラットマンドリン)奏者近藤くろ、サンババンド「バランサ」の7弦ギタリスト阿部浩二、そしてカヴァキーニョ奏者稲葉光による『トリンダージ』
その他	フラット	環境意識の高さはもちろんだが、アルプス地方を除けば、国土全体がフラットで山坂が少ないこと、広々した幹線路で自転車専用レーンなど設けやすいのだろう
その他	フラット	フロントフォークには、ARES bykes 得意の0度フォークがチョイスされ、初心者から上級者まで、ショートステムも同様に、ハンドルの回転においても違和感が無いようにフラットライダーの好みに上手く設定されていますね
その他	フラット	キャビン内は、通常のキャビンレイアウト上に、フラットになるように特注で造作されていますので、広々としていて、大人2人程度は比較的ゆったり仮眠もとることができるでしょう
その他	フラット	200mと400mの世界記録保持者であるマイケル・ジョンソンや陸上界永遠のスーパースターであるカール・ルイスも傾斜がフラットなスパイクを使用していました
スポーツ	フラット	百メートルを11秒フラットで走る元陸上部員は「もらった瞬間、追いつかれない自信があった」と相手ディフェンスを完全に置き去りにして約30メートルを独走した
その他	フラット	多くのクルマが波打つ路面に負けて上下する中(外から見ていてもはっきりわかる)で、これまで乗ってきた、ルノー・メガーヌ、ゴルフIV、そしてノーマルの147はけっこうよくこの波打つ路面を吸収し、乗員をフラットに保ってきました(波を足を伸ばしたり縮めたりで吸収する)
その他	フラット	フラット、ダイヤモンド、限りなくディフェンシブ、運動量の違いなどを考慮したであろう不均等な配置などにくわえ、相手フォーメーションに応じて選手カードを移動させる監督が増えたことで、前回大会以上にバリエーション豊かな内容となっていた
その他	フラット	クイズ正解者から抽選で、パナソニック デジタルハイビジョン液晶テレビを1名、ビクター 29型フラットテレビ付きDVDデジタルシアターシステム、キヤノンビデオカメラを各3名、折りたたみ自転車を5名、抱きつきモンキーを100名に
その他	フラット	ジーコは、前任監督のトルシエが「フラット3」を軸に選手を軍隊のように命令どおりに動くように強制したのに対し、それではいつまでたっても命令されたこと以上のサッカーはできないといって、選手自身に考えさせる「自由と創造性」のサッカーを目指した
その他	フラット	ゴルフ本来の魅力を満喫できるフラットなコースを基本に、自然の地形を巧みに生かした戦略性の高いレイアウトで昭和59年には、日本プロゴルフ選手権を開催したチャンピオンコースです
家庭	フラット	子供達のいない間に用事を済ますことの多かった私は、よくフラットの二階の窓からグラウンドを見下ろすようにして、子供達の学校への行き帰りを眺めていた
音楽	フラット	その結果、DとEの間、及び、GとAの間にある音で、それが短三和音を作る場合、そして又、CとDの間にある音で、それが長三和音を作る場合、それにフラットがつくこともあればシャープがつくこともあるが、ちがった方法で演奏しなければならない
その他	フラット	ある一定の「お約束」(より効率的たれ、の合理主義とか)のもとに作られていたかつての住宅が「機能」概念に対する違和感によって失墜し、全くフラットな空間の配置のみが住宅にまつわる問題になったことを指して社会性フリー、批評性フリーといわれているのだったらあまりにも表層的ではないか
その他	フラット	そこでは、フラットラインを構成する選手たちが、ラインを下げたり、最終勝負のために「ブレイク」してマンマークへ移行するタイミングをしっかりと判断できるために、中盤での「攻撃の起点(ボールを持つ相手選手)」に対する効果的なチェックがキーポイントになる
その他	フラット	昨年12月のさくら大会では2−0で勝ったものの、決して楽勝とは言えず、今回もある程度苦戦を覚悟していたが、開始早々相手の弱点がフラットなラインを高く上げすぎる事にあることを見抜いたコーチからはすぐにドリブルで抜いていくか、そのラインの裏にパスを出すようにとの指示もあり、この後の展開は殆ど危なげなかった
その他	フラット	フラット選手が意図的にしたかどうかはさておき、ジャネットリンから始まりビールマン・コーエン・スルツカヤなど日本選手に限らず歴代の名花たちに声援をおくってきたものとしてこの表彰台の中央にたつ某選手にはもういい加減うんざりです
その他	フラット	中盤とディフェンスの4人をフラットに保つことにより、8人でピッチのスペースを最も効率良く消すことができ、前線から中盤、ディフェンスまでの距離を均等に保ちやすい為、隙の少ないプレッシングを行うことができるからです
その他	フラット	(続きを読む)妙高高原ゴルフ倶楽部 新潟県 上信越自動車道・妙高高原 5km以内黒姫、妙高山麓の下、樹齢30年以上の雑木林や針葉樹に囲まれた、超フラットなアーリーアメリカンスタイルの優 (続きを読む)
その他	フラット	・【フラット35】S(優良住宅取得支援制度)とは、【フラット35】のお申し込みの際に、省エネルギー性などに優れた住宅を取得される場合に、【フラット35】の金利を一定期間引下げつ制度です
その他	フラット	そのため、フジエの遮光1級裏地をフラットにして、あとから取り付ける方法で取付け、家具屋がつくったカーテンの丈を3センチのばして床ギリギリにしました
その他	フラット	ゴルフの上達には、ボールの正しい打ち方、コースに出たときにライのアンジュレーションや見える景色など多様に変化する状況に惑わされない打ち方、そしてコースマネジメントが必要であり、今回の企画はまず練習場でフラットなライからボールを正しく打てるようにし、すぐそれに続いて3ホールをプレーして石河プロからのラウンドレッスンで実際の状況でのスキルの上達を図るものです
その他	フラット	これまで、三味線、フラットマンドリン、バンジョー、ウクレレと様々な弦楽器を手にとり、ステージでの演奏を試みてきたが、いずれもわがバンドの顔となりうる楽器には至っていない
その他	フラット	ランフラットを脱ぎ去ってしまった方はもとより、暖冬とはいえウィンタースポーツシーズンですので、普段はランフラットでもこの時期だけはスタッドレスなので心配という方にも良いかもしれませんねっ
その他	フラット	フラットサーブ 〜 意味の無いドライブボレー 〜 確実性の無いリターンそしてサーブ&ボレー 決められたら凄いよな〜・・・こんな気持ちでしたから
その他	フラット	サッカー用品情報サイト フラットスリーでは各国代表チームの特徴、注目のプレイヤー、ナショナルチームのユニホーム紹介など【2010年 W杯 南アフリカ大会】出場32カ国について掲載中
その他	フラット	第1クォーター3分、互いにパントを蹴りあったあとの鹿島オフェンスのセカンドシリーズのファーストプレー、ラインをずらりと並べたフォーメーションから投げたフラットゾーンへのパスを関大ディフェンスバックが見事インターセプト
家庭	フラット	当日も厄介な子供たちを何とか電子キーボードの前に座らせて、だだっこの我がままに付きあい、夕方いったん住居(フラット)に戻ると、薄暗い黒カビだらけのシャワー室で水浴びをした
その他	フラット	)にひき続いてイントロが流れはじめ、フラットマンドリン(これがいい味出してます)やアコーディオンを交えたジャグバンドの雰囲気を漂わせた演奏を聴くことができます
その他	フラット	その中でもっとも大きいのが、県営田沢湖スキー場で、はやりのキラキラした施設はほとんどありませんが、そのぶんゲレンデは本格的で、フラットなバーンでの高速ターンもよし、こぶ斜面あり、38度で4kmの新雪バーンありの比較的すいてるスキー場です
その他	フラット	ブルーグラス・コンテストでは、初心者フィドル・コンテストからマンドリン、バンジョー、フラット・トップ・ギター、オールド・タイム・バンド、ジュニア・フィドル、セニア・フィドル、バンド対決等でした
その他	フラット	夜中からはじまる圧雪作業で一番最初に作業を行い、その後の降雪によってできるベースがフラットで滑りやすくなった新雪を楽しむことができるイージーパウダーコース
その他	フラット	続いて生産基盤の整備についてただしたのに対し、園地のフラット化、圃場整備などの生産基盤の整備については高品質生産、低コスト・省力化を推進し、将来に向けた力強い農業を切り開いていくため非常に重要と考え、UR対策も取り入れ今後とも積極的に取り組んでまいりたいとの答弁がありました
その他	フラット	そのうえで、「短い年限の需給が不安視されれば利回り曲線にはベア・フラット(平たん)化の圧力がかかりやすく、とりわけ実際に増発される7月以降が正念場となる」との見通しだ
その他	フラット	レニーやシノーポリ先生のようなアホいきなダイナミックレンジが本盤ではフラットに聴こえるのは、おそらくマイクが歌手のあたりに設置してあり、オーケストラが遠く聴こえて閉もうとるんやなあ
その他	フラット	総集編」日にち 8月23日(開場開演時間未定)場所・新宿V1(新しい会場)MC・髭男爵出演 はまこ・テラこ、みつまJAPAN、セクシー寄席他サンミュージック、フラットファイブ、石井光三オフィス、太田プ
その他	フラット	元々一卵性双生児である2人が合体した者のため外見は普段とほとんど変わらないが、融合した影響でその力は単体のセイアとフラットに匹敵するほどまでに強化されている
その他	フラット	現在では、住宅金融支援機構(旧 住宅金融公庫)と銀行が提携して融資を行うフラット35と、財形住宅融資や各企業の財形融資の、どちらかを利用することが主流になりつつあります
その他	フラット	さて、KYさんのご質問のフラットスピンですが、JHFパラグライディング教本NP証課程39ページNP6−11にスピンのメカニズムや対処方法が記載されています
