# 音楽: 音楽で、半音下げる記号。変記号。♭と書く。⇔シャープ。, 家庭: 共同住宅で、各戸が同一階内に収まる形式のもの。, スポーツ: 競技で、タイムに秒より下の端数がつかないこと。ジャスト。一〇〇メートルを一一秒フラットで走る
その他	フラット	では、どうすればいいかというと、さすがにフラット3を採用しろとは言わないけれど、試合運びに緩急をつけ、タメを作れる選手、タメて攻撃を組み立てられる選手が必要だと提言している
その他	フラット	しかし、彼女の傷の─死後に加えられた傷の─ほとんどは、病理学者の言うところによると、靴の爪先でやられたものだそうです」警部は玄関に歩いていってフラットのドアを開けた
その他	フラット	雄大でフラットな新緑のコースを舞台に、校友会長杯(団体戦)・理事長杯(個人戦)を目指し、併せて親睦の実を挙げていただきたく、多数ご参加下さいますようお願い申し上げます
その他	フラット	これは昔の住宅金融公庫・・・今はその名を住宅支援機構と換え、一般直接融資をやめ、直接は特殊な融資だけにしたが、住宅の長期ローンとしてフラット35なる銀行経由の融資を行ったいる政府系金融機関である
その他	フラット	実は、フラットフットというと英語では、べた足のことになってしまうので、あまり良い言葉ではないんですが、日本語英語ということで、足の裏をフラットにつく、上半身の上下動もなくてまっすぐに進む
その他	フラット	CBSの方は最新技術で料理されただけあって、所謂昔風のどこかくぐもったかまぼこ形の録音特性ではありません、従って今の最新の装置で聞けばフラットな特性になります
その他	フラット	具体的に言いますと、「フラット35」と言って、民間金融機関が貸し出し住宅金融公庫がその住宅ローンを引き受ける商品がありまして注目を集めているようです
その他	フラット	この物件の最も悪い点は、 1)2重床ではないため、将来の間取り変更などへの対応が困難となる可能性が考えられること(フラットフロアー設計にはなっている)
その他	フラット	アメリカのカントリーミュージックのルーツともいえる音楽で、ギターはもとより、バンジョー、フラットマンドリン、アコーディオン、ダルシマーなどが入ったサウンドは、のどかで明るくて、時には特有の憂いのある曲などもあります
その他	フラット	奥様の使い勝手を考慮して配置された水廻り動線や家事コーナー、ご家族みなさまで楽しめるホームシアター、無落雪のフラット屋根をいかした広いバルコニーなど、見どころの多いデルハウスです
その他	フラット	また、政府の「明日の安心と成長のための緊急経済対策」で、住宅版のエコポイント制度の創設や優良住宅取得支援制度「フラット35S」の金利の大幅な時限的引き下げが盛り込まれることとなった
その他	フラット	ボールをラケット面で直接叩くイメージの「フラット」、ボールに対してナナメ横の回転を与え、滑って落ちるように飛ばす「スライス」、タテの回転を与えて鋭く落として弾ませる「スピン」です
その他	フラット	結局、会場販売でシューズを売ってるところは無く、せめて通常のフラットペダル売ってるところが無いか探して回っていたところ、ゼータトレーディングさんから試乗車用のフラットペダルを貸していただけることに
家庭	フラット	イギリスでは学生同士、又は社会人同士、日本のようなワンルームマンションに住むのではなくて【なかなかそういう一人暮らし用の建物自体がありません】例えば独身の3人が3部屋ベッドルームにリビング、バス、トイレ共同といったフラットで一緒に生活、いわゆるルームシェアをして生活するのがごく一般的です
その他	フラット	リフォーム費用はかかるのに、フラット35などの住宅金融支援機構が提供するような非常に有利な融資は、残念ながらリフォームローンには適用できません
その他	フラット	フラットで打つストロークのように打点の真後ろ近くからラケットをボールにぶつけ、インパクト後もそのままボールが飛んできた方向へそのまま押し返す振り方をすれば、インパクト時の打感は相当なものになります
家庭	フラット	そういう時、細田はよく二十四番住居(フラット)に住むやよいに電話をして、途上国で暮らすということの気構えとか、力強く生活していくためのアドバイスを垂れていた
その他	フラット	が、アパートは玄関と部屋の境がハッキリと区切られておらず、脱いだ靴は靴箱などにしまわない限り、フラットな床の上にずーっと置いておくことになるんですよね
その他	フラット	その点「フラット3」はアウトサイドからの攻撃に対処しにくいし、3バックの選手が、サッカーで言うところの「門」になって、間にスルーパスを通される危険も大きい
その他	フラット	お互いに4−4−2のフラット気味の中盤だけに、ポジションごとに選手が噛み合うので、どちらかが積極的にリスクを冒すか、大きなミスをしない限り、お互いに崩れないしチャンスは生まれにくいからだ
その他	フラット	フラットロッカーの方が、ビンディングの間がフラットで、より普通のボードと 違和感無く乗れるって聞くんでフラットロッカーが欲しいと勝手に思ってるんだけど実際どーなのよ
音楽	フラット	21小節では、変イ長調に突然転調し、さらに変ハ長調などのフラット系の和音が出てきますから、22小節にかけて音色を徐々に曇らせていくと良いでしょう
音楽	フラット	デューク・エリントン楽団の演奏などを聞けば感じることができますが、管楽器がもっとも美しく響き合うのは、やはりフラットの調ゆえというところがあります
その他	フラット	フラット35S(20年金利引下げタイプ:省エネルギー性)については、別途「住宅事業建築主基準に係る適合証(住宅省エネラベル)」、若しくはエコポイント対象住宅証明書が必要になります
その他	フラット	いわゆるツアーバスのシートは普通の貸切バスとものと変わらずリクライニング機能は申し訳程度にしか動作しないはずだけど、控えの運転手が寝ていた運転席のすぐ後ろのシートは 160° くらい (ほぼフラット状態) に倒れていたので、貸切バスのシートのリクライニング機能には裏技があるに違いない
その他	フラット	本大会のコースは、世界的にも例がないほど高低差の少ないフラットなコースとして知られ、マラソンランナーの登竜門と言われ、大分県を代表する競技大会となっています
その他	フラット	100名くらい入るフラットのサロンでフルコンサートグランドピアノで、モーツァルト、ベートーベン、ブラームス、ショパン、リストの曲を順番に演奏しいろいろ意見も出し合って2時間があっという間に過ぎた
その他	フラット	今でも100万円のプリ、100万円のパワーアンプは売られているでしょうが、たかがCDを聴く為のフラットアンプ(プリアンプ)に何故100万円払うのか
その他	フラット	ブルーグラスはギター、バンジョー、フィドル、フラットマンドリン、ベース、ドブロ、オートハープ、ハーモニカ等のアコースティックの楽器で演奏し、テンポが早く、単純
家庭	フラット	デザイナー何とかと呼ばれる物件ほどには、フラット内も共用部分もさして凝ってなぞいない分譲マンションのそれにしては、少し広めのお廊下を急ぎ、自宅の前へと到着すると、鋼の扉の傍らに据えられてあったドアチャイムを押してみたが、
その他	フラット	新築一戸建て 町田市高ケ坂★1号棟★フラット35S♪エコポイント対象★浴室テレビ・食洗機・ミストシャワー・浄水器他設置★指紋認証キーでお出掛けも安心
家庭	フラット	夫婦2人の予算で、住居を比較的リーズナブルなフラットにした場合には光熱費と合わせて約900豪ドル、食費は時々日本食を外食した場合約1000豪ドル、交通費や趣味の遊行費、生活雑費が1100豪ドル、合計3000豪ドルとなり約25万円強で比較的快適な生活ができます
その他	フラット	【仕事内容】 住宅金融支援機構『フラット35』の審査基準をもとに、融資実行業務全般を担当していただきます 【具体的には】 ・融資審査後の住宅ローン融資実行業務全般 ・担保保全 ・登・・・
その他	フラット	ポゼッションの基本は「トライアングル(三角形の形=パスコースが常に2つ)」を作ることにありますが、中盤がフラットなのでこのトライアングルを作ることが難しいわけです
その他	フラット	周りに山が無いのと、フラットでひさしがない為夕日が殆ど天井まで当たるくらい低くなっていますがそれでもまだ明るく未だ30分くらいは日が沈みません
その他	フラット	ハ 土地整備(フラット型家賃減額による特定優良賃貸住宅で住戸の平均床面積が65平方メートル以上のもの又は再開発型特定優良賃貸住宅供給促進事業に限る
その他	フラット	ここグランデコはスノーモト全面滑走可能なスキー場で、初心者に嬉しいフラットな緩斜面から大小様々なキッカーやウエーブ等のアイテムも充実しており、どんなレベルの方が滑りに行っても満足出来るゲレンデでした
その他	フラット	札幌の最終ラインは4人がフラットに並んでゾーンディフェンスをするのだが、その人と人の狭間に東京Vの3トップが上手くポジションを取ったため、必然的に平岡康裕、吉弘充志というセンターバックは常に2人の選手を同時に見ながらのプレーを強いられ、苦しんだ
その他	フラット	新築一戸建て 藤沢市長後★フラット35S♪エコポイント対象★駐車2台可★浴室テレビ・ミストシャワーでゆったりバスタイム♪★最寄駅から江ノ島・新宿へ直通
家庭	フラット	何部屋かあるアパートや一軒家を何人かで借りて共同生活をするフラットシェアまたはハウスシェアと、アパートの1部屋を親しい友人などと共同で借りるルームシェアがある
その他	フラット	わたしの愛車スウィフト(軽自動車のような普通自動車)の後部座席は、クラシック・ギター2台、フォークギター1台、バンジョー1台、フラットマンドリン1台の計5台の弦楽器のほか、譜面台などの小物入れの籠でぱんぱんになった
その他	フラット	別にハイテンションでいる必要はないが、あんまりにも暗かったりテンションがフラットだったり低かったりすると女性はちゃんとそういうにおいを察知してくる
その他	フラット	装着して触ってみるとわかるのですが、フェンダー(外側)とインナーをビス止めする部分にフラットに横に伸びる箇所がありそこをタイヤショルダーで擦ります
家庭	フラット	2ヶ月分の家賃(1ヶ月分はフラットを出る時に戻ってきます)、政府へ納めるお金、そして不動産屋を通した場合は不動産屋へのコミッション、合わせて家賃の大体2
その他	フラット	TTポジションではハンドルのフラット部分に前腕をのせて走りますが、それと同じポジションで走るときはシフトワイヤーを掴むと上体が安定するんですね(もちろんDHバーのようにはいきませんが)
その他	フラット	フラットから谷落としに入ったら、スキーの先端内側から雪面を切り込んでいくようなイメージで舵取りにうつる→スキーのカーブに逆らわずしっかり圧を加え、切り込むように乗り込んでいく
その他	フラット	雄大な阿蘇外輪山の麓に広がる、「阿蘇大津ゴルフクラブ」は設計者・服部彰氏の手による、フラットで広いフェアウェイと、高い戦略性を兼ね備えた本格的チャンピオンコース
その他	フラット	年齢間の収入がフラット化した場合、我々は比較的若いうちから高給を得るチャンスが期待できる一方、学齢期の子どもを抱え最も生活コストのかかる時期に収入が期待できなくなるリスクを同時に抱える
その他	フラット	とりあえず浦和でPK戦といえば懐かしき04年チャンピオンシップを思い出すわけですが、そのときは不思議に「あ、勝ったな」という感覚があったのですが今回はまったくフラットな感覚
その他	フラット	日本住宅ローン株式会社(MCJ)は、公的機関である独立行政法人住宅金融支援機構が実施する証券化支援事業(フラット35)を利用することで、長期固定金利型の住宅ローンを安定的に提供し、より魅力ある商品の設計やお客様へのサービスをご提供するためにつくられた、個人向け住宅融資専門の金融機関(モーゲージバンク)です
その他	フラット	フラット35買取型フラット35(保証型)埼玉越谷sbi住宅ローンsbiモーゲージりそな銀行みずほ銀行日本住宅ローンジェイモーゲージ住宅金融支援機構すまい・るパッケージキャッシング
その他	フラット	中でも注目なのは住宅金融支援機構がバックアップする「フラット35」と、土地購入などを含めた住宅資金の総費用を全額カバーする民間金融機関の「ミックスローン」でしょう
その他	フラット	基本は「ソフトスパイクタイプ」の50tiと30tiですが、より高い効果をお求めの場合は、デュアル・インシュレータシステムとして「ソフトスパイクタイプ」と「フラットタイプ」を2段重ねで使用していただくと効果絶大です
その他	フラット	まあ、俺なんかは了見の狭い人間で、若干の僻みと共に学生なんざに週休二日など100年早い贅沢だなんて思ってるので、「ゆとり教育」がどうなろうが知ったことじゃないが、とりあえずフラットに今回の騒動を見ていると、そういう議論もどうだかな、と思うわけだ
その他	フラット	クレディセゾン (8253)[終値655円]住宅金融支援機構と提携し長期固定金利の住宅ローン「フラット35」の取り扱いはじめる ・2009年1月景気動向指数速報 一致指数89
その他	フラット	しかし、昨今のジャム系バンドのようなナチュラル感やフラット・ピッキングによるルーサー・ディッキンソンの浮遊感のあるギターは、新世代ブルースの典型となり得る
その他	フラット	機構についてのよくある質問(旧公庫融資) 機構についてのよくある質問(【フラット35】) 機構についてのよくある質問(つみたてくん/マンションすまい・る債) 財形住宅融資についてのよくある質問
その他	フラット	DOOR賃貸の物件DBでは、アーバンライフ柘植の賃貸情報以外にも、最寄りのエミネンス、フラット立石服部町B、ワシントンコーポラス、グリーンゲートコート伊賀、ディッチポンド、コアクレスト、サンヴェルデ、ヴューパレス緑ヶ丘といった多数のマンション・アパート情報を掲載しています
その他	フラット	男の新習慣「マユ・フェイスケア」 ◆手軽に使えるペンシルタイプ ◆ウブ毛用刃・マユ毛用刃の2WAY◆フラット&ナチュラルの2種類のアタッチメント付 ◆掃除用ブラシ ◆アタッチメント収納ポーチ ◆電池式:単4アルカリ×1(別売)
音楽	フラット	遅い(オソイ)曲(キョク)や小節(ショウセツ)に音符(オンプ)が少な(スクナ)ホルン(ト音記号(オンキゴウ)、フラット2つ)の楽譜(ガクフ)をトランペット、トロンボーン、アルトサックスで吹く(フク)には楽譜(ガクフ)をどのように直し(ナオシ)たらいいでしょうか
その他	フラット	さらにそれを越えれば16800円M−フラット抵抗線にからむ一目均衡表先行スパンの雲の出口で有り、16755円で横推移が長い先行スパン2が行く手を阻む
その他	フラット	アンプ部は、録音・再生フラットアンプを全段左右ツインモノ構成とすることで相互干渉を抑え、信号の流れに沿ったコンストラクションとすることで前段、後段の干渉を抑え、同時にDCアンプ構成を採用しています
その他	フラット	本市は内陸住宅地の面積6平方キロメートルに6万市民が住まわれる小さな町ですが、山や坂がないフラットな地形のため、元来バリアフリーで子どもたちも高齢者の方々も住みやすい町だと感じています
その他	フラット	青の「ATA フラットケーブル」のコネクタは、比較的簡単に外れると思いますが、赤の「電源ケーブル」のコネクタは、通称「根性コネクタ」と呼ばれるモノで、ものすごく固くて外しにくいです
その他	フラット	ただ、私たちがフラット35を起用したいのですが、住宅性能試験を受けていない物件のためこれから金額は買主負担で試験を受けてもらい合格した場合のみ購入、不合格であれば契約白紙撤回の文言を契約書に載せた上で契約を結ぼうかと思っています
その他	フラット	わざわざテレビで報道するくらいのことですから、フラット化した社会システムというのが、アカデミアの現場でさえも一般的ではないということなので しょうか
その他	フラット	ニッティ・グリティ・ダート・バンドが2曲、そして以前来日したこともあるヘザー・マイルスなど注目だが、フラットマンドリンが印象的に奏でられるスコアがいくつかあった
その他	フラット	トルシエ ジャパン時代はフラット3 と呼ばれる3バックの右サイドで不動のレギュラーであり、2002年 の日韓W杯 ではベスト16入りに貢献した
その他	フラット	DOOR賃貸の物件DBでは、グリーンピア大枝の賃貸情報以外にも、最寄りのフラット、ロイヤルむらかみ、サンセット藤、グラシューズ桂、エクセレンス、ルミエール桂、リジョイス桂、ウエスト ヒルといった多数のマンション・アパート情報を掲載しています
その他	フラット	譜面に添えられた文が面白く、たとえば「50年代はセンチメンタルな10年間で、12/8のバラッドはスロウ・ダンスに欠かせないものでした」とか「ロッカ・ブギから最初に派生したストレート(フラット)なエイト・ビートは~~このスタイルは、カンサス・シティのブギ・ウギに初めてその姿を現したのです
家庭	フラット	みんな知ってると思うけど、僕は11日から住むところがなくて、ホームレスだったのですが、いろいろその前からフラットを探してたのですが、12日に行ったところが一番よくて、3人でシェアして住むことを決意し、13日に契約を大家と結んで14日に俺一人移ることになってました
その他	フラット	会社がフラット35の窓口をおこなっており、そこの窓口経由で新築マンションの購入のために融資を受けることになり、申請書類を提出し審査も通りました
その他	フラット	*2につき妹尾さんの補足アドバイスとして「一人目が内側に走り込みディフェンスを引き付けた場合、二人目へのパスはフラットではなくリアサイドへのポップぎみのパスが有効」
その他	フラット	まず、はやりのキーボード分離型とするため、 キーボードと基盤の間をつないでいるフラットケーブルを、何のノイズ対策もせず、 そのまま延長しました
その他	フラット	それを2作続けたので、今回はちょっとフラットな感覚で、自分たちから出てくるいい部分をもっと大切にしながら、新しいことにもチャレンジしようという意識で作っていきました
音楽	フラット	ア○ネス・○ャンさんの曲で、フラットが4個の明るい曲だったが、もし楽譜のオクターブ上でやる、と云う事になったら、わざわざ取りに帰らなくても良かった事になるので、どうかな、と思ったら、やはりアルトが無いと出来ない実音記譜だったので、タクシー代と労力は無駄には成らなかった、と云うわけ
家庭	フラット	今はまだホテル暮らしで、フラットを借りた後も、データカードが利用できるなら、家にADSLをひかずに、それを利用してもいいかな、と思っているのですが
その他	フラット	それぞれのグリップはボールにスピンやフラット、スライスといった所望の回転を与えるためにあるのではなく、打点の高さに合わせるために適したグリップがあると考えるのが妥当ではないかと思うのです
その他	フラット	基礎テクニックから実践的なモーグルテクニックはもちろん、フラットやオフピステ、そしてファーストトラックの経験を通じてスキー全体のレベルアップ向上を目指すスーパーキャンプです
その他	フラット	桧原湖、野尻湖におけるスモールマウス狙いでは、スプリット、ライトキャロでのフラット攻略やダウンショットのシューティングに、琵琶湖では北湖の数釣りに圧約すること間違いなしです
その他	フラット	しかも、フラット3の戦術で相手に攻め込まれた場合、サイドバックが最終ラインに 吸収されてしまいますが、その際でも中村は前線へロングパス1本で戦況を変えるこ とができる選手です
その他	フラット	トルシエはフラットスリーとオートマティズムを重要視し(自身のサッカー観として、オートマティズムなど組織的な面が60%で占め、30%が個の力、10%が不確定要素と発言したことがある)、ボールの位置や状況に応じて選手が自動的に動けることを理想とした
その他	フラット	●「フラット」金利50年固定の新型・・・住宅金融支援機構は2009年4月をメドに、金利を最長50年間固定する新型の住宅ローン「フラット50」を発売する方針を固めた
その他	フラット	フラット35S(優良住宅取得支援制度)とは、SBI住宅ローンをお申し込みのお客様が省エネルギー性や耐震性、バリアフリー性などの要件を満たす住宅を取得される場合に金利の引下げを受けることができる制度のこと
その他	フラット	今回は、レベリングシンナーにフラットベースを加えて塗ってるんですが(理由:前に衝動買いで特大ボトルを買ってしまったため)、ちょっとフラットベースが足りなかったか、やや半光沢気味です
その他	フラット	競技方法:指定コース(フラットバーンで一部ポコジャンあり)内で、スノーボードによるグランドトリック(板を使って擦る、搾る、弾く、回るなどして自由に滑走する技術)を競う
その他	フラット	最近のラケットは反発力が優れているため、フラットに打つと、ボールが飛びすぎてしまうため、トップスピンを用いることが多く、フラットで打球するのは、ごく限られた場面のみになっている
