# 福祉: 保護収容施設。老人ホーム, 野球: 野球の本塁。ホームベース, 家庭: 家庭。また、故郷。, 鉄道: 「プラットホーム」の略。
鉄道	ホーム	駅員が、ホームにいた乗客に終電を知らせると、突然殴られたり、けられたりした例や、無理やり自動改札を通る乗客を注意したところ、鼻骨を折られたケースもあった
鉄道	ホーム	やがて列車は鄭州駅に到着し、上海駅から乗車してから未だホームに下りていないので、10分程度の停車時間の間に駅の売り子から紅茶とビールと摘まみのピーナツを買うことにしました
その他	ホーム	ちなみに、ドキュメントホームの画面で「共有者別」として表示される人々は、Googleのアカウントを表したものと直感的には思えるが、下の図のように、Googleアカウントが存在しない「Test3」が表示されており、これはそういうものではないことがわかる
家庭	ホーム	目下めした2位いのジーコ監督かんとく率いるひきいるフェネルバフチェ(トルコ)は、ホームでCSKAモスクワ(ロシア)に勝利しょうりすれば自力じりきでベスト16への切符きっぷを手てにできる
家庭	ホーム	昨日は、FC東京がホームで通算100勝できるよう、石川くんにはがんばってほしいなぁ(前節でああいう顔をみてしまうと)・・・などと願いながら、お茶室の掃除をしていたら、携帯がなり、会社に向かった
野球	ホーム	バッティングホームといい花岡を思い出した 宮本は力んでたね ノースリーからセオリーでは1球 見送る所を強引に打ちにいってたしね これも相手が相手だけに四球で出るよりはホームランを 狙ってたのでは
福祉	ホーム	介護老人福祉施設とは、特別養護老人ホームであり、入浴、排泄、食事等の介護、その他の日常生活上の世話、機能訓練、健康管理、及び、療養上の世話を行うものである
福祉	ホーム	「不適切と思われるケア」の多いサービスは、老人ホームの長期入所、グループホーム、老人ホームの短期入所、老人保健施設の入所、老人保健施設の短期入所、入院に「不適切と思われるケア」が多く見受けられており、実数としては入院に多く認められました
その他	ホーム	稀代の"ホームランキング"を描いた作品は、ジョン・グッドマンがルースを演じ1992年に上映された『夢を生きた男 ザ・ベーブ』と、1948年に製作されたモノクロ作品『ベーブ・ルース物語』である
野球	ホーム	ど真ん中といっても、極端にホームベースから離れて立つウッズには、アウトコースといったほうがいいかもしれないが、完全に打撃のリズムを崩していることが分かるシーンだった
福祉	ホーム	夫妻に子どもはなく、2002年2月、老人ホームに入居するのに先立ち、2001年6月に土地と建物(2億7千万円相当)を、同7月に現金1億円を日赤に寄付した
家庭	ホーム	HDDの低価格化が進んでいるのでPCをホームサーバー的に使うのであれば、シングルチューナしか無い第1弾モデルでは物足りず、複数枚同時利用をサポートしている機種が無いのもコアなPCユーザーには不満でしょう
福祉	ホーム	)であって、当該特別養護老人ホームに入所する要介護者に対し、施設サービス計画に基づいて、入浴、排せつ、食事等の介護その他の日常生活上の世話、機能訓練、健康管理及び療養上の世話を行うことを目的とする施設
野球	ホーム	マウンドはぐちゃぐちゃで、ホームベースは泥だらけで見えず、バッターボックスに立つ打者のくるぶし付近まで水が浮く最悪のグラウンドコンディションの中で、試合は行われた
家庭	ホーム	減築リフォーム、平屋リフォーム、バリアフリーリフォーム、手すり、洗面、お風呂キッチン、ホームエレベーター、段差解消自動昇降機など暮らしに安心の介護総合リフォームも無料でお見積致しますのでお気軽にお問い合せください
福祉	ホーム	1998年にデンマークの生活支援法が廃止されていた(119頁)、有料老人ホーム経営とは「超」長期戦であり、しかもオーナー経営者の方が有利(120頁)、有料老人ホームにはチェーン展開のメリットはないが、スケールメリットはある(126頁)、「民営化」政策と「消費者保護」政策とは車の両輪(126頁)、福祉の民営化は全ての役所にとって権限を拡大できる草苅場となっている(128頁)
その他	ホーム	20:02の高蔵寺ゆき(カボチャ)普通電車を乗り逃し、ああ次はホームライナーかよと20:14の次の普通電車を待っていると、向かい側の東海道線下り線に貨物列車の気配
鉄道	ホーム	もう少し早く、ホームに立っていたら、私は死んでいたのだろうが、こうやって生きているということは、なにものかが、まだ生きておけと助けてくれたような気がした
鉄道	ホーム	地下鉄御堂筋線の梅田駅ですが 地下鉄御堂筋線の梅田駅ですが、なぜ、あんなにホームが広いんですか 開通時からあんなに広いホームだったのですか もし、そうだとすれば、大阪の方って、ほんま凄いですね
鉄道	ホーム	駅のホームで友達とツボにはまるぐらいの大笑いをして、まだまだおかしいのに電車が来てしまい、電車に乗ったはいいものの、どうしてもふいてしまいそうになり、「いやっ、我慢ガマン」と思うものの、「ふっふっ」と
家庭	ホーム	ロンドン近辺でアウェイのユナイテッドを見る機会はしばしばありましたが、ホームでの試合は、ファン・ニステルロイの移籍が決まった直後だから5年くらい前
福祉	ホーム	この攻撃ではNATO発表のウソが次々に発覚した他、住宅街、路線バス、アパート、病院、ホテル、老人ホーム、結核療養所、などが爆撃され、老人や女性、子供、病人も含めて膨大な死者を出した
福祉	ホーム	調査の対象となるのは、特別養護老人ホーム、通所・短期入所介護施設、有料老人ホームなどの福祉・介護事業と、高齢者や障害者等の居宅で介護や日常生活のケアを行う訪問介護事業
家庭	ホーム	「物体の運動」をテーマにした最近の物理の授業では、札幌ドームで行われたプロ野球・日本ハムのホーム開幕戦を取り上げ、西武・松坂投手の150キロの速球とそれを好打した打線を紹介し、速さについて分かりやすく説明した
野球	ホーム	最終コーナーからホームストレート260kmから一気に175kmに減速してピットへ入っていく際に、その入り口がかなりきついシケインとなっている為、ドライバーは脇のガードレールぎりぎりをかなりのスピードで抜けていかねばならないのだそう
家庭	ホーム	ホームでの第1戦を1−1の引き分けで終えたCSKAモスクワは前半26分、トップ下で先発出場した本田が、ネチドとのコンビネーションから左足でシュートを放つも、これはGKパロップにセーブされ、こぼれ球に反応してもう一度シュートを打つがゴールならず
家庭	ホーム	ジム通いやホームヨガにも重宝しちゃう♪ヒザの曲げ伸ばしも突っ張らないから、 立ったりしゃがんだり、ひんぱんに膝を曲げ伸ばしする 介護士やケアマネージャーさんのまとめ買いもしばしばです
福祉	ホーム	2006年度の老人福祉法改正で、有料老人ホームの定義が「1人以上入居し、食事、介護、家事など何らかのサービスを提供していること」に変わり、いわゆる宅老所など民家を活用した小規模施設にも当てはまるようになった
家庭	ホーム	チャンピオンズリーグ予備戦2回戦のホームゲームではAstanaを7−1で撃破し、 3回戦に進んだローゼンボルグの相手は、フィンランドのタンペレ
福祉	ホーム	就職分野/特別養護老人ホーム・介護老人保健施設・デイサービスセンター・グループホーム・ケアハウス・養護老人ホーム・身体障がい者施設・児童養護施設・保育園・知的障がい者施設・知的障がい児施設・重症心身障がい児施設・肢体不自由児施設・救護施設・社会福祉協議会・病院など
家庭	ホーム	■ホームプロの鈴木隆氏は「利用実績・1リフォーム仲介サイトのビジネスモデル」(23日午後2時半)で、優良なリフォーム事業者とお客さまをweb上でマッチングさせる高顧客満足度のビジネスモデルを紹介する
福祉	ホーム	全国の自治体が06~08年度に、特別養護老人ホーム(特養)など介護保険施設の定員を約15万2千人分増やす計画を立てていたのに対し、実際は計画と比べて半分以下の約7万5千人分にとどまったことが、朝日新聞社の集計で分かった
家庭	ホーム	ホーム「シャイニング・フェローズ」の先発は「奥村」投手、ビジター「Monroe」の先発は「いしい」投手と、昨年秋季リーグと同じ状況で初回の攻防を迎える
その他	ホーム	また、去年この舞台でホームスチールを成功させ、話題を独占した”スター”新庄も、ン百万(一説には一千万)のダイヤモンド入りスパイクを用意したものの、故障のため出場機会は限られ、一度の代走と代打のみしか見せ場を持てなかった
家庭	ホーム	その他に外出支援情報や在宅生活支援情報として、世田谷区内の移送サービス・タクシー、福祉車両のあるレンタカー、世田谷区内の非営利有償ホームヘルプ実施団体 (Coming Soon)、世田谷区の介助料制度 (Coming Soon)などの紹介がされています
家庭	ホーム	うつ、統合失調症などの精神障害を経験した当事者が、3級以上のホームヘルパーの資格を取得し、ピア・ヘルパーとしての講習を受けた後、精神障害者などのホームヘルプを行う
鉄道	ホーム	実家の最寄り駅に電車が到着し、下車した我々がホームを出口目指して歩いていると、ちょうどその駅が終着だったので、「この電車はどちらへもまいりません」というアナウンスとともに列車が走り去っていきました
鉄道	ホーム	■ホーム寄りではない路線側に止まった時も、そこで長時間の調整(待ち時間)が生じる時は隣の列車にハシゴをかけ、とにかくホームに降りられるようにしてくれるので悲観的にならないようにする
家庭	ホーム	ホームファンの面白いという反応に、フォックス放送のスポーツキャスター、テッド・ロビンソン氏は、「8歳以後、初めて打席に立ったはずだ」と言って、アジアの指名打者制度について説明した
野球	ホーム	実はホームへのダイレクト返球は内野手の中継を入れた場合と比べて稼げる時間はわずかだし、距離が長いから送球がそれるリスクも大きく、肩を痛める危険もある
鉄道	ホーム	またJR甲子園口駅駅舎はホームの幅がせまく現行のままではエレベーターの設置は難しく、改築には多額の経費を必要とするため、なお時間を要するが、JRも具体的計画案を作成したい意向だとの趣旨でした
福祉	ホーム	本要望書では、特別養護老人ホームの待機者45万人の解消や医療的ケア・重度認知症ケアの問題等に合ったサービス体制の整備が必要としたうえで、介護報酬アップ、介護従事者の処遇改善を求めている
家庭	ホーム	2004年4月1日: 児童ケアセンターおよびホーム・デイ・ケア(デイケアマザー)労働者、および精神ケアセンターの労働者の賃金を5%引き上げる(1カ月850クローネ)
家庭	ホーム	その一方で一般家庭にも、着実にコンピュータネットワークとの接続を意識した情報家電は普及を見せており、将来的にはホームオートメーションが目指した、家電製品を含めた住宅内の環境を一括管理できるシステムの発展も期待され、
福祉	ホーム	受け皿とされている老人保健施設や老人ホームなどでは、人的、設備面でもこうした重度の障害者への医療や急変時の対応が困難であり、介護施設にも受け入れられず行き場を失う医療難民・介護難民が増加することは必至です
福祉	ホーム	ケアワーカーを増員するに当たり、現在運営している特別養護老人ホームのサービスの向上を図ることはもちろん、次のステップとして考えているのが、地域社会の福祉のさらなる充実です
野球	ホーム	1番 西山 レフト前ヒット、来條はホームに突っ込む、タイミングは完全にアウトだったが、うまくタッチを避けてのセーフ、西山はその間に2塁へ、後1点
家庭	ホーム	横浜ベイスターズ戦の中継は大洋(後に横浜大洋)時代は「YOKOHAMAベイサイドナイター」、1993年に横浜ベイスターズとなってからは「ベイスターズナイター」として巨人戦を除く横浜スタジアムや平塚球場での試合を中継している(草薙球場といった地方でのホームゲームの中継は近年なくなった)
家庭	ホーム	予選リーグを突破した16チームはこれからホーム&アウェイのトーナメント方式へと移り、手で持つ部分が耳に似ていることからビックイヤーと呼ばれる栄光のカップを目指して戦いを始める
福祉	ホーム	※上記とは別に当ホームの看護スタッフが、ご入居者または身元引受人等の同意のうえ、協力医療機関又は主治医に対して、ご入居者の健康状況について、月に1回以上情報を提供した場合には、84円/月加算いたします
家庭	ホーム	タンパベイは12日、ホームのトロピカナフィールドで行われた米プロ野球アメリカンリーグチャンピオン決定戦第2戦で、延長11回裏、BJアップトン(写真)のサヨナラ犠牲フライで9—8、1点差の痛快な勝利を獲得した
鉄道	ホーム	土曜日の夜は飲んじゃって、幕張駅のホームに上がったところまでは覚えているのですが、どうやら電車には乗らなかったらしく、気がついたら、メッセの近くのインターネットカフェで朝を迎え、「ここはどこ
福祉	ホーム	ケアホーム、レスパイトを実現させたいのは、親の私だけではなく、家族みんなの願いでいぶきに通っている息子が生涯お世話になれたら・・・安心して預けられる場所ができると思うだけで本当に嬉しく思います
その他	ホーム	今年3月14日(土)・15日(日)に以前のモデルホームで『ガーデニングイベント』を開催した際、『実は、知り合いで家の計画を考えていらっしゃる方がいるんだけど
鉄道	ホーム	私が駅のホームに立って電車を待っていると、まるまるとしてかわいらしい小学3〜5年生くらいの男の子が、大きな声で鼻歌(すでにふつうの歌声レベル)を歌いながらやってきました
福祉	ホーム	淑徳大准教授の結城康博氏はこのほど、日本医学協会が主催した医療問題懇談会で講演し、スウェーデンの介護施設と日本の特別養護老人ホーム(特養)を比較した上で、「単にスウェーデンの良いところをまねるのではなく、日本型の介護システム構築を意識する必要がある」と主張した
家庭	ホーム	本研究はU市のホームヘルプサービス(以下HHSと略す)を週に3回以上利用する在宅痴呆性老人(以下老人と略す)を介護する家族介護者13名を対象に1996年8月末~11月末までの4ヶ月間に及ぶフィールドワークを実施した調査結果の一部である
家庭	ホーム	また、犬山市羽黒稲葉東の不動産情報~ホームふどうさん 犬山店に限らず、全国の賃貸物件・売買物件・不動産会社・不動産鑑定所・貸主売主登録物件・マンション・アパート・戸建・別荘・土地・店舗・事務所・テラスハウス・工場・倉庫・駐車場・ペット可・デザイナーズ・田舎暮らしの不動産情報が検索できます
家庭	ホーム	SOHOと一言で言うが、日本のとくに首都圏での住宅事情を考慮すると物理的な住まいの狭さに起因するホームオフィスの困難さは問題であり、その意味からも近隣にある(駅前立地はとくに好都合)オフィスの需要は高いのではないかと思われる
野球	ホーム	青田は著書(侍たちのプロ野球)で、実際に見たときの沢村は晩年で130キロ程度だったが、本人が全盛期にはホームベースの手前の縁を目がけて投げるとちょうどよくミットに収まったと言っていたと書いている
福祉	ホーム	ビラの内容は、毎回テーマを変え今回は、福祉をテーマとし少子高齢化、保育園特別養護老人ホーム待機者ゼロ、2007年団塊の世代大量退職問題、障害者福祉についてまとめました
家庭	ホーム	プロ野球球団のホームゲームをすべて観戦できる年間シートは今年、大阪近鉄バファローズが全席種で値下げし、阪神タイガースと福岡ダイエーホークスが一部の席を値上げした
福祉	ホーム	しかし、実生活上は、彼ら彼女らがホームの主人公で、利用者なんていう消極的なものではなく、どんなに重い障碍があっても、自らの意思で主体的な暮らしを営む住人と位置づけられるべきだと考える
鉄道	ホーム	ホームにいた駅員のおっちゃんに聞くと、振替輸送をやっている、タクシーでも可と言うので池袋で降りて他の手段で目的地に向かうことにした(後で思ったことだがおっちゃんも適当な回答はしないでほしいものである)
家庭	ホーム	そこには、バットマンやおさるのジョージなどのキャラクターグッズや、ホームパーティー用のナプキンや紙皿や風船や、結婚式用のカード類や引き出物やキャンドルなどなど、本当にものすごい量の『パーティ関連に必要っぽいもの』があります
福祉	ホーム	またデイサービスや医療と連携した介護付き高齢者アパートの設置や介護保険外の高齢者福祉施設として養護老人ホームやケアハウス、生活支援ハウス、さらに、宅老所なども研究して、低年金、無年金など所得の少ない方々も住み慣れた荒川区で最後まで過ごすことができるよう、安全性で多様な入所施設や利用施設の検討を求めます
福祉	ホーム	高齢者専用の住宅のタイプとしては、有料老人ホーム、軽費老人ホーム、養護老人ホーム、特別養護老人ホーム、老人保険施設(介護老人保険施設)、グループホーム、ケアハウス(介護利用型)、高齢者マンション、シニア向け住
鉄道	ホーム	また、これまで島式ホームである野田駅・福島駅・西九条駅・新今宮駅・天王寺駅のみホーム番号が振り当てられていて、相対式ホームにはホーム番号が振り当てられていなかった
その他	ホーム	(有)誠光ホームの周辺地図・電話番号・住所・位置情報・ホテル予約・格安航空券・アパート・マンション・アクセス・周辺の天気・最寄り駅・インターチェンジ・土産をお探しならMAPPLE 地図 「ちず丸」が便利
福祉	ホーム	この署名は、介護保険料の減免制度の拡充や介護利用料の助成制度の新設、特別養護老人ホームの増設、介護保険にかかわる苦情を調整する第3者機関の設置を求めたものです
野球	ホーム	中央広場の位置関係を考える時は「あそこが一塁であそこがホームベース」とか、住んでいる人(かつ子ども)にしかわからない座標軸みたいなものがあった
福祉	ホーム	日本でも、このグループホームの良さが認められ、各地で「宅老所」「託老所」「ケアホーム」「ケアハウス」「デイホーム」「グループホーム」など、さまざまな名称で呼ばれるものが(以下、本稿では、これらを総称して「グループホーム」という)開所され始めた
鉄道	ホーム	ホームにある駅名看板一部の駅で新しく なってるけど、例えば岡場は新開地ホームは新しい看板やけど三田行きホームの看板は古いままやし、田尾寺は片面は新しいけど裏は古いまま
野球	ホーム	ホームベースを基準としたストライクゾーンを変更しないで、バッターボックスの線の位置を今の15センチから、22センチに離すだけで、ストライクゾーンがわかりやすくなると思うんです
福祉	ホーム	養護老人ホーム:とりかい白鷺園、介護老人福祉施設:祥雲館(豊能郡豊能町)、診療所:桃林会診療所、保育園:とりかい保育園・第2とりかい保育園、老人集合住宅:とりかい老人ホーム
福祉	ホーム	有料老人ホームの調査をしている横浜市の消費者団体「横浜コンシューマーズ・クラブ」代表の忠内真須美さんは、「施設の利用者はなかなか本音を言わない
その他	ホーム	ユニバーサルホーム(本社=東京都港区、加藤充社長)は1日、既存商品である地熱・太陽光利用の住宅商品「SOLA・IRO(ソラ・イロ)」のバージョンアップ版を発売した
福祉	ホーム	これまでの老人ホームは、「設備が悪い、汚い、サービスが悪い」というイメージがありましたが、これからの高齢化社会を担う新しいタイプの高齢者マンションとして安心して有意義なシルバーライフを楽しめる居住空間として、ますます需要が増えるものと思われます
福祉	ホーム	しかし、それをやると、ホームの採算が合わないという問題がありますけれども、そういうことについてもキチッと援助して、やれるような整備を国がちゃんとやる
鉄道	ホーム	上記の者は、たつの市神岡町東觜崎507番地1JR姫新線東觜崎駅上りホーム内において平成18年8月31日午後6時29分当駅発のディーゼル機関車に跳ねられ死亡したものです
その他	ホーム	球場の形状(方向)も先週の現地測量で当初の山の方にホーム〜センターへ向かう予定が球場入り口付近をホームにする事に変更したのですが、今日の作業で一つ問題点が浮き上がってきました
家庭	ホーム	3LCDブースでは、最新の3LCD方式プロジェクターを数多く展示したほか、ホーム向けプロジェクターを使ったレンズシフト機能のデモンストレーションでは、来場者が操作してレンズシフト機能を体感する場面もあり、大きな盛り上がりを見せた
家庭	ホーム	※札幌ドーム・宮城球場・西武ドームではホームチームが三塁側、それ以外の球場では一塁側ベンチを使用する(但しホームチーム以外の球団同士の試合開催時にはこの限りにない)
鉄道	ホーム	この騒動の後、ホームを直進し、さらに階段を上って南口改札付近まで行き、不良外国人による山手線ジャックの予告のあった21時過ぎの外回り電車到着までしばらく待機しました
福祉	ホーム	3 厚生大臣又は都道府県知事は、第1項の規定により、養護老人ホーム又は特別養護老人ホームにつき、その事業の廃止を命じ、又は設置の認可を取り消す場合には、あらかじめ、中央社会福祉審議会又は地方社会福祉審議会の意見を聞かなければならない
鉄道	ホーム	大阪駅のホームで列車を待っていたら、いつものボンネット型特急電車ではなく、EF58が客車を牽引して入線してきたので、かなり面食らった覚えがあります
