# 福祉: 保護収容施設。老人ホーム, 野球: 野球の本塁。ホームベース, 家庭: 家庭。また、故郷。, 鉄道: 「プラットホーム」の略。
家庭	ホーム	西川リビング株式会社と株式会社三宅デザイン事務所が共同開発する、寝具とホームウェアのブランド「mayu+(まゆプラス)」から、これからの寒い季節をあたたかく暮らすための新しい「うちエコ」ホームツールが登場
野球	ホーム	返球がカットまできっちり来なかったケ ースがあったり、カットに入った内野手がクイックでホームに送球し なかったりとか、相手に余計な点や塁を与えたシーンが何度か見られ ました
鉄道	ホーム	午後2時に東京駅を出発して、東海道線で横浜駅まで行き、次に京浜東北線で関内まで乗った・・・つもりであったが、横浜駅の乗換えでホームに上がると、すでに電車が発車間際であり、飛び乗ったのが災いし(笑)乗った電車は、次の桜木町止まりであった(T_T)
その他	ホーム	アイフルホームの家には、契約した住まいの完成、引き渡しを100%保証する「完全引渡保証」が付いていますので、夢を詰め込んだ住まいを安心してつくることができます
鉄道	ホーム	そういえば先日、トワイライトが停車しているとなりのホームで老夫婦が「昔はよく夜行列車で旅したものだねぇ・・・」と話をしているのを思い出しました
鉄道	ホーム	とはいうものの、大きな通りの横など、車の騒音の大きい町中、放送などの騒音がすさまじい駅のホーム、当然走っている列車の中などでは、その良さも半減どころか、四半分になるくらいの感じはあるが、それでも「だから、再生品質がよろしくないプレーヤーでもいっしょ」とは言い切れないくらいの差はある
その他	ホーム	「よりよい家を、より多くの人に、より合理的に」住宅メーカーと工務店のメリットを併せもったアイフルホームは、抜本的に住宅供給システムの全プロセスを見直し、
福祉	ホーム	今まで、特別養護老人ホームなどの公共施設しかなく、老後の生活の場を選べなかったところから、自由に自分の好みに合うホームを選んで入居することができるようになったのです
福祉	ホーム	住宅型有料ホームだが、自宅感覚で在宅サービスを利用しながら住み続けてもらうシステムは、国土交通省が新たなビジネスモデルとして推進する「安心ハウス事業」でもある
その他	ホーム	ミサワホームの鉄骨系賃貸併用住宅『ハイブリッド・ホームプラス』が、(財)店舗システム協会が主催する「ジャパン・ショップ・システム・アワード2010」で優秀賞を受賞した
福祉	ホーム	しかし、既にその「実家」は自分とはなんら関係が無く、両親がいなくなれば畳んでしまうだけのことだ、ついこの間も、ホームへ行くなりなんなりして、さっさと自分たちで処分してくれと言ったばかりだ、と答えました
鉄道	ホーム	今日はまた朝から五反田に用があったので、満員電車にゆられながら行ったのだが、途中横浜駅の東海道線のホームに、真っ青な顔をして倒れている女性がいた
鉄道	ホーム	樫村恵理子さんらクルーの5人が新幹線ホームで、「甘く実った福島のモモはいかがですか」と新幹線の利用者に呼び掛けながら「暁星」の3個入りパックを500円で販売した
福祉	ホーム	由紀と敦子のような女子高生像は、「そんな理由のために病院や老人ホームに行く人間は常識的にありえない」という不謹慎さは感じますが、周囲の人物に対するドロドロした感情は、現実にありそうなリアルさは感じました
その他	ホーム	w 08:11 ホーム画面のアイコン達がなんか、ジャギってるというか、小さい画像を拡大したみたいに見える 08:10 さすがにディスプレイきれいやなぁ〜
福祉	ホーム	系列に特養は勿論、老健や訪問看護、リハビリなどの介護保険事業適用から有料老人ホームまで、これと思った利用者を医師の判断というお墨付きで飲み込んで行く
その他	ホーム	【参加企業】 パナホーム/三菱地所ホーム/住友林業/スウェーデンハウス/積水ハウス/大成建設/旭化成/新日本製鐵グループ レスコハウス/三井ホーム/野村ホーム/城南建設 計11社が出展している展示場です
福祉	ホーム	老人福祉施設は、軽費老人ホーム・老人デイサービスセンター・老人短期入所施設・老人介護支援センター・特別養護老人ホーム・養護老人ホーム・老人福祉センターとされていて、施設によって対象となる高齢者が違っています
鉄道	ホーム	〈「鶴川」駅からバスの場合〉 小田急線「鶴川」駅5番のりばから 「多摩センター」行き・「聖蹟桜ヶ丘」行き・「永山駅」行きバス12分、「湯船」下車 バスの進行方向と逆の「湯船」交差点を右折(坂道を登る)し、左手側がホーム
野球	ホーム	ホームベースの上に、ストライクの高さの支柱が置かれ(もちろん、走者が戻ってくるときには、すばやく移動させられます)、その上に置かれたボールを、自分で持ったバットで打つという感じで、打者の任務を理解します
野球	ホーム	09】(試合中に)監督またはコーチはいかなる場合においても、ホームプレート、ブルペンその他の場所で、投手のウォームアップの相手をしてはならない
鉄道	ホーム	駅舎前のホームに線路が1本、一番上の写真でアジサイの植えられている向かい側ホームの両側に線路が1本ずつ、合計3本あった線路は、今では駅舎前1本だけしか使われていません
家庭	ホーム	また久保主将も「トップリーグの試合が3つも磐田であるので是非、市民の方々にラグビーを知っていただけたらと思います」とホームでの試合を心待ちにする思いをを市長に語った
鉄道	ホーム	」と声をかけられたりして、堀内駅ではしばらくホームから掘内の港や家々の様子を眺め、そのうちに北の方からやってきた三陸リアス鉄道に乗りました(下写真)
その他	ホーム	あと最近ホームコースの月例でAクラスで回って仲良くしているシングルの人たち(その中で優勝するようなレベルの人)の練習が大体週に2~3回程度200~300球、コースに週に1回はでるというリサーチ結果からです
野球	ホーム	よく、ホームベースの手前でワンバウンドするようなフォークボールを空振りするシーンを見るが、落ちの鋭いフォークボールはそのようなワンバウンドするボールでも打者は手を出してくれるのだ
鉄道	ホーム	週刊じゃないほうのプレイボーイ(表紙・忠雄)と、TITLEとを新幹線のホームでまとめ買いし、最終ののぞみ車内でうなぎ弁当をあっためながらのけぞったのが先週の日曜
家庭	ホーム	5倍、ヤンキース選手の本塁打数は、他チームの選手と比べて、25%ほど「かさ上げ」されているとみなしてよいだろう(ちなみに、昨季は、ホームとロードの本塁打量産率に差はなかった)
家庭	ホーム	私達はペットのホームドクターとして、ご家族がより良い生活を送るために、日頃の健康食餌管理から、しつけのご相談、病気の予防と治療まで皆様をサポートさせていただきます
福祉	ホーム	2010/03/05 23:51に 社会福祉法人福寿会特別養護老人ホーム福寿園、医療法人福慈会福西胃腸科外科介護老人保険施設ふくにし、などを追加
福祉	ホーム	高齢者の生活とひとくちでいっても、老人ホームなどの施設を利用されている方、高齢者住宅、自宅などで独居、高齢者夫婦で生活をしている方、家族と同居でも生活時間が合わず独居状態の方など、いろいろな生活があると思います
家庭	ホーム	松坂は23日フェンウェイ・パークで行われた米大リーグ、カンザスシティーとのホーム試合で、5回3分の1イニングを6安打3失点で抑え、チームの11—8の勝利をけん引した
家庭	ホーム	ホームセキュリティは、365日24時間ご自宅やご家族を見守り、いざというときにはガードマンが駆けつけますので、長期不在時だけでなく、日常のお出かけや在宅時も安心ですね
福祉	ホーム	「身体障害者福祉ホームの設備及び運営について」(昭和60年1月22日付け社更第5号)別紙(身体障害者福祉ホーム設置運営要綱)9に規定する利用者の生活及び自立に関する相談、助言その他必要な援助を行う職員として相談援助業務に従事した期間を含む
福祉	ホーム	住宅型有料老人ホーム「ブリスイン野田」では看護師の365日夜勤体制(平成20年7月1日現在 常勤換算5名 夜勤看護師1名)で夜間も安心して過ごせます
その他	ホーム	ホームコース西コースのPAR4は、2打目が池越え、ティーショットを1Wで打つとその池に入る可能性があるとかドッグレッグで突き抜ける等の理由から、ドライバーを使うのは1番(460Y PAR4)、あとはPAR5くらい
家庭	ホーム	監督のスティーブ・マクラーレンへの批判の声も、「(ホームで0−0に終わった)昨年10月のマケドニア戦直後に解雇されているべきだった」というものから、「そもそも代表監督に選ばれるべきではなかった」とするものまで、「それ見たことか」といったトーンで統一されている
鉄道	ホーム	かおるはお父さんにほんとうに会えるのかどうか心配でドキドキしてしまうのですが・・・終点の駅に着いた時、向かい側のホームに止まっている電車の中にお父さんを見つけた時涙がすーと頬をおちました
その他	ホーム	しかしその中でも、ホーム頁は個人が他の媒体に比べて圧倒的に手軽に広く素速く情報を発信しやすく、かつ受け取りやすい媒体であり、それだけに情報量も非常に豊富です
鉄道	ホーム	下関と言えば漁業の町、高架駅のホームでうどんをすすりながら下を見ると漁港、漁船、魚市場が見えます、鮮魚特急「とびうお、ぎんりん」も実質の始発は下関でした
鉄道	ホーム	更に愛知環状鉄道から来た車両が、在来の車両より大型で、プラットホームと車体が干渉するのか、ホームを削り取ったあとがあり、以前にも増してホームが狭くなっているようです
鉄道	ホーム	ホームで電車を待っていて、線路までの高さがとても低いことにビックリし、レールの間にあるリアクションプレートに感動し、やってきた車両の小ささにビックリする
福祉	ホーム	□グループホーム利用者のヘルパー利用にかかる経費は、報酬の中に組み込まれたというが、 ホームの報酬の1日単価とヘルパーの1時間単価がほぼ同じでは、ホームの報酬から委託費 用は出せない
鉄道	ホーム	高齢者が公共交通を利用する機会が増えると予想されるため、同一ホームでの乗り換え、余裕のある乗り継ぎダイヤ、駅内のバリアフリー化、バス・私鉄各社・JRとの共通ICカード乗車券など、高齢者にとって使いやすいサービスの試みが始まっています
家庭	ホーム	古平郡古平町の外科内科には、病気の治療以外にも、検診、予防接種などを行うところがあり、家庭医(ホームドクター)としての役割を担う外科内科もあります
家庭	ホーム	前半は城福東京がどう戦ってきたかを、ホワイトボード上で選手に見立てたマグネットを実際に動かしてよっちさんが戦術を解説し、後半はホーム対名古屋戦の映像を使って得点に到るまでのポイントを青赤ノートさんが解説した
その他	ホーム	その間に自宅があり波乗りのホームポイントもあり、更に遡れば高校も平塚で、結局海沿いと共に生活していく道を自然と選択している自分に嬉しく思います
福祉	ホーム	2 この規則の施行の日の前日までに、徳山市老人福祉法施行細則(昭和62年徳山市規則第15号)、新南陽市老人ホーム入所措置等に関する規則(昭和62年新南陽市規則第22号)、老人福祉法施行細則(平成5年熊毛町規則第15号)又は鹿野町老人福祉法施行細則(平成5年鹿野町細則第2号)の規定に基づいてなされた処分、手続その他の行為は、それぞれこの規則の相当規定に基づいてなされた処分、手続その他の行為とみなす
鉄道	ホーム	確かに本線と分断され上野方面への直通は走らなくなるし、押上・浅草線・京急方面へも同じホームでの乗換はできなくなるのですが、一方本線の市川・船橋・千葉・八千代方面から見ると乗換の手間が軽減されるのがメリットとなるので果してそう言った面でプラスに働くのかマイナスに働くのか注目したい所です
福祉	ホーム	株式会社イトクロ(本社:東京都港区、代表取締役:黒岩 剛史、山木 学)は、2月3日、入居希望者と介護施設をつなぐ優良老人ホーム紹介センター『介護ホーム』(http://www
鉄道	ホーム	主要駅には、ホーム上にキヨスク、駅弁屋、そば屋が充実している東海道線や、在来線にも数多くの優等列車が残っている北陸線などは、きわめて食糧事情に恵まれた路線とお考えください
家庭	ホーム	これまでは、マリンの風を生かしきれないピッチングですが、ホームである以上ここで良いピッチングができるように、そして風と上手く付き合えるようにならないといけません
福祉	ホーム	●介護保険制度は、個人の自立した日常生活を支援するため、質の高いサービスを提供するものであり、 「生活の場」である特別養護老人ホームにおいては、これまでの集団処遇型のケアから個人の自立を尊重 したケアの転機がもとめられている
野球	ホーム	ホームスチールを試みた走者に対し、投手が本塁へ送球し、捕手の触球によって走者はアウト⇒投手が投げたボールが打者への投球ならば補殺は記録されないが、投手が走者をアウトにするために投手板を外して本塁へ投げた送球であれば、投手に補殺を記録する
鉄道	ホーム	店員が駅のホームで車販で使われるバナナ饅頭と私のために用意した『十勝牛ワイン漬ステーキ弁当』を手に持っていたので、店員に声をかけて弁当を手に入れました
家庭	ホーム	6回も2つのホームでのクロスプレーがマリーンズに良い方向に転がってくれましたのでビッグイニングに繋がりましたが、ともすれば暴走2つで本塁憤死の場面
福祉	ホーム	メデカジャパン(同、埼玉県)やセントケア・ホールディング(同、東京)、ベネッセコーポレーションの完全子会社で有料老人ホーム最大手のベネッセスタイルケア(東京)なども前向きな姿勢を示している
その他	ホーム	私たちヨシダホームでは、安価なものを集めての家づくりではなく、品質のパナソニック商品で統一した、安心で安全そしてリーズナブルな価格の家を皆様にご用意させて頂いております
家庭	ホーム	ホーム球場での初先発を応援しようと、純雄さんと松崎投手の弟で東北福祉大野球部の捕手として活躍する潤平さん(二〇)らがバックネット裏から、充枝さんは三塁側の内野スタンドから声援を送った
鉄道	ホーム	列車が完全にホームから出ていってしまったあとでシンジは、自分がまんまとレイにはめられて、この駅のホームに一人取り残されてしまっていることに気がついた
鉄道	ホーム	昨日駅のホームで浴衣姿の20代前半の女の子が電車の中で、中年夫婦にぶつかって謝らなかったのを因縁つけられ、わざとやったんじゃないかと濡衣着せられ中年夫婦に脇腹を膝でこずかれたり暴行されてたよw浴衣娘は泣きながらもいやらしい声出してて興奮した
家庭	ホーム	●ディミトリー・パネオトポロス(Dimitri Panayotopoulos、55歳)、現グループ・プレジデント−グローバル ファブリックケア)がブルース・L・バーンズ(取締役会副会長−P&Gハウスホールドケア)の後任としてバイス・チェア−グローバル・ハウスホールドケアに就任し、ファブリックケア、ホームケア、ファミリーケア、ベビーケア、デュラセルを統括し、引き続きシンシナティで勤務する
その他	ホーム	光洋一級建築士事務所、徳島、香川、兵庫、岡山、愛媛、高知、四国、納得の住まいづくり、新築、住宅、工事費、価格、適正、高性能住宅、長期優良住宅、見積り、ローコスト住宅、タマホーム、ハウスメーカー、工務店、経費、利益
福祉	ホーム	有料老人ホーム入居者基金制度は、入居者保護のために、「入居者の終身利用権に係る金銭保証事業」を主たる事業目的として、全国有料老人ホーム協会に設けられているものです
鉄道	ホーム	その後、新幹線ホーム建設のために19・20番線が使用中止(後に廃止)となったほか、18番線は長野新幹線の開業後、信越方面への特急「あさま」・「白山」が廃止されたため不要となり廃止(そのまま欠番とされた)された
福祉	ホーム	この時点での日本の高齢者介護施設には、身体上もしくは精神上著しく欠陥があるために常時の介護を必要とする特別養護老人ホーム(特養)のほかに、主に経済的理由で高齢者を収容している養護老人ホーム、軽費老人ホームおよび有料老人ホームを含んでいるが、特養が全体の2/3を占めている
福祉	ホーム	なお、未届有料老人ホームに譲当する1施設についでは、今回の点検の結果、5月20日に東村山市内に移転予定で小平市内での事業は絡了することが判明している
福祉	ホーム	老齢人口の増加に伴い、宮野浦地区においても、常時の介護を必要とする寝たきり老人が増加しているが、これら老人を収容する施設が不足し、地域住民からも早急な施設の設置が強く望まれていたが、本事業により、特別養護老人ホームを建築したことは、これら恵まれない老人を収容して健康回復と老後の安定を図り、もって老人福祉の増進に資するところ大なるものがある
家庭	ホーム	ホームでのクロスプレーや、体育館2階に直撃する大ホームランも飛び出すなど、児童らが汗びっしょりになりながら一生懸命ボールを追いかけ、バットを振り、走る姿が感動しました
家庭	ホーム	フリースケールは、今後もNEC社と協力し、新しいデジタル・ライフスタイルを可能にする次世代のホーム・メディア・サーバ・プラットフォームやパソコンへ技術を提供できればと思います
福祉	ホーム	2003年1月24日金曜日午前6時17分、義父は老人ホームのショートステイ、義母は大学病院の治療室、母は静岡県清水市の自宅、妻は童謡詩人金子みすゞの生まれ故郷、そして僕は義父母の住まいで留守番
野球	ホーム	これは、ポー(paw)は手を、サウス(south)は南を意味していて、野球のホームベースが 東南向きで、左ピッチャーの腕が 一塁の南側から出ることに由来しているそうです
鉄道	ホーム	岡山駅の5番線は駅舎に隣接したホームで、 線路の向こう側には不細工なコンクリートの壁がならび、 ホームの天井の上には新幹線の乗換え口のコンコースが、 さらにその上には新幹線のホームが横たわっていて、 ホームの中ほどに並ぶ無骨な太いコンクリートの柱どもが黙ってその重みを支えている
その他	ホーム	紛失したのは、ホーム社の顧客300件とホームイング社の顧客210件の氏名、住所(市区まで)を含むスケジュールノート1冊と、ホーム社の顧客16件の氏名、住所、電話番号等を含むアフターメンテナンス関連書類2種13部
家庭	ホーム	例としては2003年第1戦(大阪ドーム)の先発投手は、全セが阪神(当時)の井川慶、全パが近鉄(当時)の岩隈久志だった(この年の主管球団は大阪ドームを本拠地にする近鉄だったが、2002年のオールスター開催条項改正で2試合開催の場合のホームゲームはセ・パ各1試合とする取り決めとなったため、セ・リーグのホームゲームとなった)
鉄道	ホーム	「ふっつ・とみうら」の二人は、ホームを降りてすぐ、「近くの青い丘の裾に、ぽつんと一軒建つ、瓦屋根の洋館とも日本風ともつかない、白い家が映じ、短かな煙突から、ひと筋灰白色の煙が、まっすぐ上っている」のを見つけ、「屍体を焼く」ような「へんな匂い」を嗅いで、その家が火葬場であると推測した
家庭	ホーム	「(ライオンズのホームで完封なんて)KYだぞ」と冗談めかしたメールを送ったというが、内心では、自分も絶対それに匹敵する投球を見せてやると意欲をかき立てられたはずなのだ
鉄道	ホーム	秩父署はきたダンプカーにホームなどに登校中だった市立原谷小3年、前田美怜さん(8)が、左折して建築塗装業を見つかったのは、渋川市で中学1年、卓人さん(13)とで逮捕された無職、小川和弘容疑者(46)に17日、群馬県高崎市でうち約20匹が、焼けたり廃材などがいた犬約40匹のなく、東京消防庁に出火、木造2階建てのよると、17日午前1時15分ごろ、東京都新宿区西早稲田1の出火した
福祉	ホーム	ハートフルスタッフは特別養護老人ホーム・老人保健施設・民間介護会社・医療施設・病院等で必要となる介護・医療のスキルを持った人材を安定的に派遣いたします
その他	ホーム	「今後さらに携帯機器でのWebブラウジングが進み、NGNのような次世代ネットワークとホームネットワークが実現したときには、単にコンテンツプロバイダーのサーバに依存するだけでなく、ホームサーバのような個人向けサーバと連携するといったWeb 2
鉄道	ホーム	帰路の東京駅でも、押し寄せたファンの為に新幹線ホームからの移動すらままならず、時には郵便物の搬送などに使われる業務用通路を通って駅から「脱出」するという有様であった
鉄道	ホーム	京急のホームに着くと、午後8時45分発の特急浦賀行きがまだ発車前だったが、既に座る場所がないので、思案した末、20分後に発車する次の浦賀行き特急を待つ事にした
福祉	ホーム	・入居者様の日常生活全般の援助食事、入浴、排泄他の介助・食事の支度 ・ホーム内の上記に付随する業務 *就業時間4)16:30~9:30 月に4~5回の夜勤勤務です *就業時間1)~4)の勤務が可能な方
家庭	ホーム	西武・日本ハム・ロッテのホーム球場の7回裏の応援は他球団とはいえ、応援マーチあり、風船飛ばしがありとホームチームだからこそまとまりのあるラッキーセブンの応援をしているなあという印象はあります
その他	ホーム	アイフルホームが取り組むキッズデザインは、「子ども目線、子ども基準でつくる家は、全ての人に安全で住みやすい家」というキッズデザインの考えに基づいています
