# 家庭: 転じて、家計。やりくり。台所を預かる台所が苦しい, 食事: 食物を調理する場所。炊事場。
食事	台所	半そでで帽子をかぶって散歩へ行く 台所の棚を作り直す だらだらとやっていたらもう夕方になっていた 子供達は楽しみにしていたジムキャリーの(マスク)を見ている 父はいつのまにか居眠り
食事	台所	台所もいつもきれいで、汚れるから家で揚げ物はしないのだという妹さんの言葉をきいて、さいとうさんは、家はちょっとくらい汚れているほうがかわいいものだと思った
家庭	台所	委託費については、町としても最大限の財政支援をしてあげたいところであるが、町の台所事情も大変厳しい状況にあるので、彼らへの委託契約も非常に厳しいものとなった
食事	台所	このフィルターは、もともとはナイロンのネットがあったのですが目が細かくてすぐ詰まるので、ステンレスの切りくずのようなたわしと台所のごみネットを使って自作したものです
食事	台所	五分くらいして揺れが収まると、離れにいたおばあちゃんが様子を見に来て「余震があるかもしれない」というので、今度は台所の大きなテーブルの下に隠れました
食事	台所	狭い台所のすみっこにおいてあるそれはいつも所在無さげに見えて、毎朝使っているものなのだからもっと待遇のいい場所に移してやりたいのだが他に場所が無い
食事	台所	よーし、これでおウチの台所仕事手伝っちゃうぞー、とかね、「小学校の授業なんぞくだらん」とかクールぶることが多かった時期なのに、こん時だけはすんげー夢中だった
その他	台所	東御門の前が安藤帯刀の屋敷であったことから「帯刀(たてわき)前御門」、また、台所奉公であった松下浄慶にちなんで「浄慶(じょうけい)御門」とも呼ばれ、 主に重臣たちの出入口として利用されました
その他	台所	台所の闇(台所の闇;シベールの日曜日;青山のえんど豆;まざるまざらない ほか);なんとなくな日々;平成の蜜柑(平成の蜜柑;春が来る;春の憂鬱;新緑の夢 ほか)
食事	台所	他には、台所石けんには肌への使用を連想させることは記載しないが、浴用石けんは肌への使用が目的で作られた石けんなので、当たり前ですが肌への使用を連想させる「お肌しっとり」のような言葉をパッケージに記載できます
食事	台所	私もそんな話題になっているのを知って、興味を持ったのでキッチンでつくる美白水&美髪水—台所漢方 (主婦の友生活シリーズ—台所漢方)を買って読んでみました
食事	台所	使い込まれた台所で作る健康にも環境にもいい食事、愛用しているナチュラルコスメや洗剤、大切に使いつづけている台所用品や手作りしている保存食など、暮らしの中のこだわりやご自宅のインテリアも公開しています
食事	台所	このように、下水道などが整備されていない地域でトイレの水洗化をするときに設置が義務づけられる浄化槽ですが、この働きを一言でいうと、「水洗トイレからの汚水(し尿)や、台所、ふろ場等からの排水(生活雑排水)を、微生物の働きなどを利用して浄化し、きれいな水にして放流するための施設」ということができます
食事	台所	一階の台所で水と氷をのせた盆をもった彼があがってくるまで、二階の彼の部屋でさっさと布団にもぐりこんで、そこいらに あった本をとって読みふけった
家庭	台所	ただ、なぜこういったことをやらなくちゃいけないかという部分では、区全体の台所といいますか、そういったものを親御さんたちに知っていただきたいというのがあったわけでございまして、そういった中でこのチラシの中にここをうたわせていただいたというものが大きなことでございます
食事	台所	出口容疑者は今年2月ごろから9月ごろまで連日、西隣の主婦(53)の家に面した台所の窓を開け、ラジオとラジカセ計6台、目覚まし時計9台から大音響をたれ流しにしていた
食事	台所	台所にある古いTVは今やwiiチャンネル専用に近い感じになっているんだけど、それでニンテンドーチャンネルみてたら「おいでよ どうぶつの森」がwiiで出る事を知った
その他	台所	その後、大阪夏の陣で焼け荒れてしまったのを、徳川家康が伊勢亀山五万石の城主であった松平忠明を大阪城主として大坂の復興に当たらせ、復興支援特別政策を実施していったおかげで、船場は再び降盛し、江戸時代を通じて天下の台所として全国の富の七割が集中したほどに栄えたのであった
食事	台所	やっちゃん家と石村さん家とは、猫一匹がやっと通れる位の隙間しかなく、やっちゃん家の玄関に近い方の部屋の窓と、石村さん家の台所の窓とが接していた為、やっちゃんの様な子供でも足をちょっと余分に開いて跨ぐだけで、石村さん家に行けた
食事	台所	以前はアルフィーやいろんな男性を渡り歩いたのですが(笑)、この3〜4年は博堂ばかりで、車の中でも台所でも寝室でも博堂曲で・・・娘から“もういい加減にしなさい
その他	台所	日本最古の本格的な首都として、日本の歴史に大きく貢献した天下の台所として、今もこれからも日本第二位の経済圏として栄え続けてきた魅力ある大阪の歴史、文化を再発見することを目的とした検定試験
その他	台所	香港の至るところにある街市・・・ 小さくても大きくても、中はどこでも同じの街市“香港の台所”・・・・ここにくるとスーパーではない、 香港の昔からの台所が垣間見えるそんな場所です
食事	台所	「典座教訓」は、「日常生活すべてが修行である」という道元が、「典座」すなわち台所を務める料理当番の心得を記したものであるが、著者が指摘するように「禅の道、人の道をきわめられた方が、いわゆるお料理の本を出すはずはなく、私の人生の今、ここを、どのように運べばよいか、どう取り組んでいったらよいかということを、具体的に典座をつとめるときを例としてお示しになった」書である
家庭	台所	政権の枠組みが代わったところで、中国の過大評価を改めようというのは、他面で、アメリカの台所事情が苦しいことも背景にあるわけですから、そのあたりは素直に歓迎できない問題でもあります
家庭	台所	とは言うものの、惣次郎(藤原竜也)や歳三(山本耕史)らが食客として居座っているため、ふで(野際陽子)の機嫌はますます悪くなる一方で台所事情も火の車になっていた
食事	台所	1階台所の電磁調理器(長時間未使用であるが、待機通電状態となっていたもの)のトッププレート上に電子レンジが置かれており、その付近の物を取る際に、誤って電磁調理器の作動スイッチに体が接触し、加熱状態となり、約10分程度、電磁調理器のトッププレート上の電子レンジの樹脂部分から出火し、自動火災報知設備のベルの鳴動により、家族が火災に気づき、初期消火(消火器及び水)した
食事	台所	今までに、食卓を共にするなどということは絶対になかったのだが、この時は私と三人で快く会食せられたのである――会食後、夫人は後片付けに台所へ退られ、先生も鳥渡中座されたので、私は何心なく机の上に置いてあった先生の著書を取上げて、バラバラと頁を繰っているうに[#「うに」はママ]、その間からパラリと畳の上に落ちたものがあった
食事	台所	例えば台所で調理中、彼女は私を床にしっかりとつけて体を支え、その一方で右足をつまさきだけ床に触れ、鼻歌にあわせて踵を左右にリズミカルに揺するのである
家庭	台所	こうして江戸の後半には、日常の食材を購入しなければならなかった庶民の台所事情がさまざまの食べ物商人を育て、そのことがまた新しい食べ物を生んで、人々の旺盛な食欲を充たしていったのである
その他	台所	○川や堀川を活用し天下の台所として栄えてきた大阪の舟運を体験することで、多くの人に、「水の都大阪」の魅力を広くアピールするとともに、大阪のまちや川への愛着心と水都再生への気運を高めるためのイベントを大川等周辺で行った
食事	台所	温室メロンは、明治天皇の台所を賄っていた新宿御苑の福羽子爵が、イギリスから導入したのがはじまりですが、それ以後、大隅、岩崎(三菱)などの大富豪の農場にのみ広がり、栽培されるようになりました
食事	台所	1Kの賃貸アパートを契約しましたが、台所と部屋の間に扉がなく、冷暖房の効率を考えて開口部をできるだけきちんとふさぐ間仕切りをつけたいと思っています
食事	台所	家の中の調度品も大変立派なもので、ここには写っていませんが、台所もガスレンジをつけるなど、農村にいながらにして近代的で都市的な生活が出来るわけです
食事	台所	数日前、米びつをあけた時、数匹の穀象虫を見つけたので退治したのですがそれから数日経って、台所から6〜7m離れた別の部屋でPCをいじっていると壁に米の中にいた虫が這っていました
食事	台所	もちろん、アウトドアレジャーがお好きな方に言わせれば、家庭の台所で料理するのとはぜんぜん別物だとか、まあいろいろ楽しみはあるんでしょうけど、これは個人的な好みの問題なので
家庭	台所	市場の管理運営については、出店者で組織する協同組合と民営化の方向で協議を続けており、今後とも、市民の台所を支える市場として運営していただくため、来年4月1日に建物を無償で譲渡したいと考えております
食事	台所	「中世庭園文化史」の南殿光照寺地形実測図には、濠(ほり)・築山・園池(おんち)・持仏堂・山水亭・遣水(やりみず)・台所・南門・土塁(どるい)など、室町時代中期の庭園としてよく保存さている貴重な遺構です
食事	台所	いや、なんか、風呂をキレイにしたとか、台所の洗い物を高づけたとか、なんかそういう意味のことかと思ったというか、正直よく意味がわからなかったのである
食事	台所	この排水設備は宅地や私道内に排水管・汚水ますなどをつくって、ご家庭から出る台所・洗濯・洗面・風呂・水洗トイレなどからの汚水を、すみやかに公共下水道に流す役割を果たしています
食事	台所	台所に血の付いた木刀が落ちており、そばに立っていた長男が「自分がやった」と話したことから、同署は殺人未遂の現行犯で長男を逮捕し、殺人容疑に切り替えて捜査している
食事	台所	「堕地獄仏法」「48億の妄想」「台所にいたスパイ」「脱出」「露出症文明」「メンズ・マガジ ン一九七七」「月へ飛ぶ思い」「活性アポロイド」「東京諜報地図」「ヒストレス ヴィラからの脱出」
食事	台所	テーブルを置いたり、食べ物を取りに台所に行ったり、冷蔵庫を開けたり、テーブルをふいたり、そして皿に食べ物を乗せたり、皿の食べ物をかき混ぜたり、大人は食事の準備のためにいろいろなことをします
食事	台所	ただ、100枚ほど刷った”再加工チラシ”の威力と云いますか、熟女の方々への受けは予想に反し良く、さすが聡明な兼業主婦の皆様におかれましては、御家庭での少々重ためな台所仕事を少しでも軽くできるかも、みたいなちょっとテンション上がり目の内容があちこちで評判(でもないですが)になり、まず、主婦層を狙うのが意外に近道なのかと今更ながらオバサン、いや失礼、熟女の方々のパワーを垣間見た瞬間でした
食事	台所	山道を歩き上へ 途中城についての説明板がありました 鉄板が敷いてある雨でとっても滑る坂を登り更に上へ 西櫓門跡 馬立・台所・海老櫓跡 こんなとこに馬を繋ぐっていうことはここまで馬で来るってことですよね
食事	台所	○ 夜中に夜食が欲しくて台所をうろうろし、キムチ以外何にもなくて仕方なくキムチをぽりぽりやっているとなんと「韓国ロッテのお菓子のプレゼント」ですって
食事	台所	台所にいると、綾波と、アスカと、僕で料理したことを思い出すし、学校も、何処でも、綾波の想い出が染みついてるし・・・アスカを見ても、綾波と仲が良かったなとか、綾波と喧嘩してるんじゃないかと心配したことや・・・」
食事	台所	現在、一般家庭の台所周辺の洗浄や車の洗車から外食産業及び食品加工業、貴金属、ビル管理、宿泊施設、スポーツ・保養施設、船舶・機械・自動車産業等のあらゆる分野で活躍しています
食事	台所	1泊5000円で、台所にはコーヒーセット、シャワールームにはシャンプーや歯ブラシ、歯磨き粉、洗濯機や洗剤や物干し、10枚以上のタオル、など完備されているので、2日分の着替えがあれば何ヶ月でも暮らすことができます
その他	台所	私どもも、これ、2000年度につくりました台所白書で、借金はどれぐらいあって資産はどれぐらいあるんだというような概要をお示しをしておりますけれども、いろいろな評価の方法というのは非常に種類が多くあるんですけれども、この台所白書で出しましたのは、国が示す一つのマニュアルに従って算出をしておりますから、また、町の財務規則で試算する金額とは若干差があるわけであります
食事	台所	当店では日頃のお掃除では、なかなか取れない水あかやカビ、トイレの尿石そして台所の油汚れなど、お客様のお困りの点や気になる箇所をお聞きした上でスピーディかつ適正な時間でとことん仕上りにこだわったサービスを行っています
食事	台所	たとえば、ごみ袋、台所の三角コーナー用ごみ袋、フローリング用の掃除用具とその取り換えシート、傘、洗濯用具、 生活に必要だけど自宅からなかなか持って来れないものはほとんど揃っていました
食事	台所	「なにしているのかしら・・・あなた達・・・」 台所に行った霊夢が見たのは荒らされた食料、それを貪り食う幽々子と謎の男 「あら、いただいてるわよ、このたくわん美味しいわね」 「その辛味噌は俺が飲み込んだ、ところでこれ食っても良いかな
食事	台所	タカギ ●台所等の泡沫蛇口にホースをつなぐ時に使用する ●別売りのコネクターとセットで使用する タカギ マンションの蛇口がグローエ製で、おしゃれなのはいいが、ホースをつなげない
食事	台所	公共下水道が整備された区域内では、処理開始の告示がされてからすみやかに排水設備工事を行い、台所や風呂場からの生活排水を公共下水道に排出しなければならないことが下水道法により定められています
食事	台所	台所洗剤ジョイのCMで、油に指先についたジョイでチョンとつつくと、あっというまに油が分解されてしまうというのがありましたが、あんなモンだと解釈していいのでしょうか
食事	台所	〈1〉イメージで選んでもいい/〈2〉食品の裏ラベルを見ましょう/〈3〉台所にないものは添加物/〈4〉顔を知らない他人が作ったものを疑う/〈5〉自分が作った場合と商品を比べてみる/〈6〉言葉遊びに気をつける/〈7〉素朴な疑問を抱く
食事	台所	ジェトロは、中国の大手ネット企業と共同で、ことし秋をめどに日本の中小企業の製品を販売するサイトを立ち上げ、台所用品などの日用品を試験的に販売する計画で、参加する中小企業を来月から公募することにしています
食事	台所	■包丁の「包」はもともとは台所(調理室)を示し、「丁」は釘のことで、一点に打ち込む人・事に当たる人・専門職を示すことから、包丁とは「台所の専門家」=料理人、調理士という意味の言葉として使われていました
食事	台所	ベッド、窓枠、背の高い椅子の「背」(泣)、そして普段は乗らないけど欲しいものがあれば飛び乗ることができると発覚した、台所の調理台(ベンチトップ)(汗)に、今では余裕で飛び乗ることができる筋肉がついて、普通の猫の重さになったんだと思います
食事	台所	台所の万能選手「もね」を焼いていた白石焼の陶器、あいがも農法による無農薬・無化学肥料の酒米づくりや市民向けの「お米とお酒の学校」などに取り組む天吹酒造の酒、長い歴史をもつ名物「綾部のぼたもち」、野菜・果物と手づくり加工食品、軽食・飲み物、福祉施設の手づくり作品などの販売、薬用茶の試飲と薬相談などブースが並び、フリーマーケットも開かれました
食事	台所	138ページに「台所に現れたクロゴキブリ」という、食卓の上にいるゴキブリを写した写真があるのですが、生活感のある背景は今森さん宅の台所なのかな
食事	台所	「台所ごはん ばんざい 手豆や」は、JR神田駅北口から徒歩7分、都営新宿線の小川町と丸の内線の淡路町駅双方から3分の外堀通り沿いに8月5日開店
食事	台所	彼の場合は居間に豪華なシャンデリア、日本製高級オーデオセット、景徳鎮の大きな花瓶、台所は大きなシステムキッチン、風呂はTOTOのジャグジー風呂、トイレはもちろんTOTO
食事	台所	ここ何年も1シーズンごとに台所(2階)で1~2匹巨大なクロの大人を見るか見ないか、そしてそれらは数日以内にホイホイにて捕縛、というわりかし恵まれた
食事	台所	今までキッチンと食卓の間に壁があり、台所で料理を造っている時は孤独感があり、壁がある為、お互いの部屋が狭く感じるとの事で、出来る限り開放感がある明るい空間を希望しました
食事	台所	台所に目の細かいこし網を付けたり、油は新聞紙等で吸い取って可燃物として処理するか、廃食用油の収集日に処理をしたりして、下水道に流さないようにしましょう
食事	台所	自動的にでてくるという感覚で「ご飯だからこっちへ来なさい」と言われ、食卓を囲むのと、台所で親が作るのを見てる、一緒に参加することで、プロセスを感じて食卓を囲むのとでは、子どもの中に「残るもの」の大きさが違うと思います
食事	台所	巧妙な灰の罠(わな)を失敗に終わらせた翌日、アンナが台所にはいっていって、第一に眼についたものは、前夜素足の足跡を消すために用いた小さな箒(ほうき)が、ザーミの手にもたれてることだった
その他	台所	市民の台所として戦後沖縄を支えてきたが、1972年の本土復帰を境として本土資本の大手百貨店やスーパーマーケット進出のあおりを受け、徐々に客足が減退していくこととなる
食事	台所	中学生の頃、塾に通っていたが、夕方行く用意を整えて腹ごしらえを台所でしているとき、ラジオから決まって流れていたのが『三菱ドライビングポップス』という番組だった
その他	台所	オレスカバンド「ピノキオ若槻千夏楽譜春のワルツ 韓国ドラマ情報304韓台所川崎303入江紗綾のこといろいろ など動画テニスの王子様ゲーム占い占いリロスティッチ壁紙デコメアニメairアイドル動画集airお笑い動画集air入江紗綾画像掲示板1669入江紗綾あとこないだは、1日停部だしピンクのどくろがチャームポイントのやんちゃな「クロミ」の応援よろしくねクロミ
食事	台所	台所や洗面所、浴室などの水まわりの補修、取り替え、雨樋の取り替えや屋根の葺き替え、網戸の張り替え、手すりの取付け、畳の表替えなど、身近な修理から家全体の大がかりな工事まで、まずはお気軽にご相談ください
食事	台所	合成界面活性剤でつくられた台所洗剤、シャンプー、洗濯洗剤などは、手が荒れるだけでなく、川や海、生き物たちも弱らせてしまうことを知ってから、それらの使用を一切やめました
食事	台所	「娘がいたら嫁入り道具に持たせてやりたい」「台所に立つ回数が増えた」 「料理するのが楽しくなる包丁」 堺屋の包丁をご愛用いただいている皆様に、ご愛用の包丁の推薦状を書くとしたら
食事	台所	合併浄化槽は水洗トイレからの汚水(し尿)や台所・風呂・洗濯水などの、生活雑排水を微生物の働きなどを利用して、浄化しきれいな水にして放流するための施設です
その他	台所	北前船は北の海産物を天下の台所大阪へ運ぶ為に発達した輸送手段で、従来あった若狭湾から琵琶湖経由で機内に入る内陸水運ルートより、大量輸送が可能で大幅なコストダウンとなった
食事	台所	気を良くして、台所の引き出しの中で眠っていた菜ばしを一本取り出し、これに処分するつもりでゴミ袋に入れておいたナイロン性の風呂敷を使い、もう一本ミニばたきを製作
その他	台所	(株)チバ、萬珍楼、ひらまつ、ジュアン・レパン、美濃吉食品、メティウス・フーズ、Bingo、リゾートトラスト、テイク・アンド・ギブ・ニーズ、ルシャルの台所、La楽リゾート、ホテル王将、鵜渡幸、ラ・マンマ、季園、洋食割烹花月、さくら亭、割烹志幡、ママの台所、ル・ポットフー、グランドエル・サン、ピーターパン、ホテル小松、松屋菓子店、レストラン欅、香梅咲、 ベルナール酒田、セルクル、千寿 ほか
食事	台所	今になって母も台所は自分ですると言い出し、入浴は一人で入らないようわかったし、シャワーの使い方も良く知っているのでシャワーだけ使うことに納得したこの頃です
家庭	台所	慢性的な渋滞が著しい国道4号及び455号のバイパス道路としても機能するようになり、このため沿道住民の間で県道昇格運動が小規模ながら展開されているが、県の台所事情が苦しいため当面は市道のままとなる見通し
食事	台所	台所には、たぎった湯や熱い油もあるのだ」と、裸火がないことでガスコンロに比べた安全性を強調する宣伝には根拠が薄い事と、更にもっと根本的な問題として調理器具として安価で十分な性能を発揮するガスコンロと比べたIHヒーターの存在そのものへの疑問を投げかけています
その他	台所	敬子が御台所におさまった暁には斉彬は将軍の御台所の養父として発言力が増すし、斉昭も御台所敬子が頑張ってくれて慶喜が将軍になれれば、将軍実父として立場が強くなる
その他	台所	やしが、カマや台所(しむ)んかい降(う)りてぃ行(ん)じゃあに、生芋(なまんむ)、大根(でえくに)、人参(あかでえくに)そうなむん、かしがあんかい入りてぃ、なあひん、入りいびちいやる食み物お無えらんがやんでぃち、目(みい)やとぅざなてぃとぅめえとおたん
家庭	台所	大企業はバブル期を上回る空前の利益を上げる一方で、国民は賃金抑制と負担増で景気回復を実感できないばかりか、原油高騰の影響による物価上昇などでさらに苦しい台所を強いられている
