# 家庭: 転じて、家計。やりくり。台所を預かる台所が苦しい, 食事: 食物を調理する場所。炊事場。
食事	台所	自宅居間に薪ストーブを導入してからは妻の料理アイテムに薪ストーブ料理(ダッチオーブンをメインにピザや焼き芋まで)のジャンルが加わり、台所の電気コンロの使
食事	台所	結局それに付き合う羽目になったので予定より時間を取られた(途中で帰ってきて洗濯しながら台所の最後の片づけをしようと思っていた、のが出来なかった)
その他	台所	ここから そのまま口に入れてくれっちゃ'`ァ'`ァ'`ァ'`ァ(● ́д`●)'`ァ'`ァ'`ァ'`ァ'`ァ'`ァ 今日は小倉の台所の旦過市場と黄金市場に正月用の買い物に行ってブリを買おうとしたけど、あまりにも高かったので・・・ ブリもなかで我慢したっちゃ(
食事	台所	■この商品の関連キーワード ≫ パイレックス・把手付きメジャーカップ6個セット500ml BT500T 台所用品・調理小道具・パスタ・容器・食器
食事	台所	クールな長兄ファンの方には、申し訳ないのですが(笑) ポップがスティーヌに甘える図、個人的に好きなシーンですっ♡ もし、筆者があの場でジャンクの店にいたら、邪魔よばわりされても台所に居座って間近で見物します
食事	台所	しかし、よく考えればヘルパー・ガールが商品である以上、台所に立った経験がないのは当たり前で、僕が小学生の時初めて家庭科で調理実習をしたのと同じ状態なわけだ、時間はかかるが気長に教えていけばそのうちレシピを読んだだけで何でも作れるようになるだろう
食事	台所	あれだけ弱っていたら掃除機から出てくるとは思えないですが、もう早いとこゴミを出して、今度はいつでも反応できるように『某近代兵器スプレー』、『懐中電灯』、『火ばさみ(G専用)』の三種の神器を部屋と台所の中心あたりに設置しておこうかな
家庭	台所	それと同時に、本年は特別版として、6月、7月号で西予市の苦しい台所事情と題しまして、事細かな財政事情を市民の皆様に周知をしていますが、ここに改めまして概要を申し上げたいと思います
食事	台所	二、三人くらいならば同時に調理が出来るほどの広さを持つ台所は、基礎的な作りはさすがに古めかしいものであったが、水回りはリフォームされて使いやすくなっており、大きめの冷蔵庫やオーブン、いくつかの調理器具が歴史のある洋館の内装と対照的であって面白い
食事	台所	下谷町《したやまち》二丁目の小間物店、古河屋政兵衛《こがやせいべゑ》の立ち退いた跡には、台所の隅の蚫貝《あはびがひ》の前に大きい牡の三毛猫が一匹静かに香箱《かうばこ》をつくつてゐた
その他	台所	あい│あまん│お台所たわ和│くつろぎダイニング傳│ちごゆり│のぶこ│ひこえん酒処│ふくろう│やきとりでん助│やきとり丸大│やすらぎ居酒屋│やまだ屋│ダイニング菜々│一ツ谷のやきとり│串焼くん五所川原店│
食事	台所	当時は、釣瓶で井戸から汲みあげた水を天秤棒でかついで自宅まで運んだり、手押しポンプになってからも水瓶から風呂場まで水を運ぶ仕事は主婦や子供たちの日課でしたから、直接台所や風呂場まで水が来るということはまさに画期的なことでした
食事	台所	6日午前10時半ごろ、神奈川県二宮町山西、ロルタ・ジャコブ・イクヨさん(94)=フランス国籍=が自宅台所で焼死しているのをロルタさんのめい(78)が発見し、119番通報した
その他	台所	そやけど、正確な用語としては、大阪市史料調査会主任調査員の野高宏之によると、江戸時代の文献に大坂を「諸国之台所」「やまとの賄い所」と評する記述は存在するが、「天下之台所」と直接記述した文献は存在せへんし、大正時代に幸田成友が『大阪市史 第二』等の叙述中で用いた用語が、一般に広まっていく過程で、江戸時代から存在した言葉と誤解された事が分かっておる
食事	台所	寝室からでてくると、階段を駆け降りて玄関の間のクロゼットにはいり、それから台所へメイ夫人を呼びにいって連れてくると、クロゼットからコートをとりだして戸口へむかい、外でチャールズ卿とビアズレーに挨拶して、メイ夫人といっしょに車に乗りこんだ
食事	台所	しかし、午前6時頃、台所に続く炭小屋に隠れていた上野介に、勘十次郎が一番槍、武林唯七が一番太刀をつけ、小屋の外へ曳き出し、合図の呼子笛で一同が集まった
その他	台所	●グリーンカレーラーメン15袋(タイの台所)●トムヤムクンラーメン15袋(タイの台所) 【グリーンカレーラーメン】 コクのあるココナッツミルクとグリーンチ
食事	台所	6 5月27日の「6時半頃妻が私を名谷駅へ送った後家に戻ると、いつも午前10時半頃起きてくるAが珍しく早起きし、二階の部屋から台所に下りてきていたそうです
食事	台所	ええ出汁がたまたまとれる確率は限りなく低いが、ええ出汁とはなんぞやっちゅうことを知ってる前提で、そのイメージ(味覚と知識)、物理的実行力(調理のスキル)、調理自体のイメージ(調理の計画性)、ある程度の体力と環境的要因(台所はあるか)などをしっかりわきまえておけば、自ずとええ出汁がとれる確率がどどーんと上がる
家庭	台所	20番森山哲夫議員 病院の移築問題についてでありますが、これについては病院側の台所事情というか、そういったものについては情報開示を町としても要求していきたいということですので、これについてはひとつ基本的な問題ですので、ぜひやっていっていただきたいと思うのです
食事	台所	ところが、台所にいた嫁さんと母親が『生そば』のゆで時間を、はっきりと確認しないままゆで始めたため、指定されたゆで時間がきていたのに気が付き、慌てて・・・結局、そば湯になるはずの『ゆで汁』を流してしまいました
食事	台所	せっせと接客をする旦那さんを見て、奥さんも「「これまで台所にも入らなかったお父さんが、縁側お茶カフェが始まってから自分でお茶を淹れるようになって」と嬉しそう
食事	台所	対策としては、「台所用」または「住宅用の漂白剤(次亜塩素酸ナトリウム含有)」を水で表示濃度に希釈したものを2リットル用意して、トイレタンクへ投入しよう
その他	台所	2010年5月1日より5月5日まで、北海道中央高速道有珠山サービスエリアで、ゴールデンウィーク期間限定で、【カツおばちゃんの台所】「カツおばあちゃん直伝南ばん味噌」を直販します
食事	台所	掃除も料理も決して嫌いではなく、共働きのときには、私は一度も掃除機をかけたことはなく、今でも、二人で家にいるときは私が台所に立つと「手伝おうか
家庭	台所	また、苦しい台所事情の中から捻出(ねんしゅつ)した事業費である以上、これらの支出の効果を一過性に終わらせず、将来の経済発展につながる継続的な効果を発揮するよう努めてほしい
食事	台所	10月10日、地区の芋煮会でのこと、公民館で準備をしていると台所の窓の上にスズメバチの大きい巣を見つけ、後で写真に撮ろうと悠長に構えていたのだが・・・
食事	台所	台所用石鹸や洗濯用石鹸等の場合には薬事法の適用を受けない (ただし野菜、果実の洗浄を用途とする台所用洗剤については、食品衛生法に基づき成分等の規格基準が定められています) ため、そもそも浴用や洗顔用としての使用は認められていません
食事	台所	この場合の二次汚染とは、元々食中毒菌に汚染されていなかった食品に、食中毒菌に汚染されてしまった手や包丁・まな板などの台所用品が触れることで食品が汚染されてしまうことを言います
家庭	台所	ヤクルトより台所事情の苦しい楽天で、 それでも先発枠を確保できなかった一場はせいぜい、中継ぎがいいところというのが、多くの球界関係者の見方である
食事	台所	という電話がかかってきますが、 いつも停電した時に 全て電気だと困るからと言って断わるのですが、実際 実家で電気でないのは、台所のコンロだけです
食事	台所	ペットのいる部屋、台所のゴミ箱、トイレや玄関などニオイの気になるところにしばらく放置して、本当にニオイが消えるかを検証する、という当たり障りのない企画を提出していれば、厳正なる審査を勝ち残ったライフスタイル賞受賞者5名の内の1人に選ばれていたかもしれなかった
食事	台所	そやつが5年後、こうしてテキパキと台所で働いているのを見ると、やはり何かにつけて「俺んちで三日も食らいやがって」と小さなことをいつまでいつまでもグチグチと言いつのることって計り知れない教育効果を持つのだと、自らのたゆまぬ日常的努力の成果に目頭が熱くなった
食事	台所	同じく台所を主題にした他の画家たちの風俗画も数多く出品される本展は、《牛乳を注ぐ女》の特質、それが生み出された背景、その後の風俗画に与えた影響などを明らかにする、またとない機会となるでしょう
食事	台所	近頃では生活様式が、前々とは全然違い、冷暖房も効き、台所では給湯器、瞬間湯沸かし器があり、冷たい水で炊事をすることも無くなり、洗濯もね、昔のように『たらい』にまたがって、一生懸命にするということ
食事	台所	出勤前に撮影したバニバニを見ながら、、、「かぁ〜いぃなぁ〜」デレッてます( ́〜`;)これね、台所に居る私に「ちょっと、でんちゃんのアホ毛、取ってください」そう、言いに来たんですよ(思い込みだけど、多分そう
食事	台所	そこにお島を落着かせてから、壮太郎が荷物運搬の采配に、雨のなかを再び停車場へ出かけていってから、お島は晩の食事の支度に台所へ出たが、女がおりおり来ると見えて、暫く女中のいない男世帯としては、戸棚や流元が綺麗に取片着いていた
食事	台所	卯太朗は、玄関−リビング間だけでなく、台所、脱衣所、風呂場、そして廊下を通って玄関に出てまたリビングに帰ってくる一周コースを満喫できるようになったらしい
食事	台所	丹後保健所では、所内設置の備蓄倶楽部を中心に新型インフルエンザ発生時の外出自粛に備えて、食料、台所用品、日用品、医薬品など備蓄物品について、検討しています
食事	台所	ターちゃは、昔からの漆喰もいいといってくれたが、建具屋さんも「台所の壁は、真っ白な漆喰の壁で、一部分にグリーンの色がある配色が、食欲を一番そそるそうだ」と、また「木の木目が一番目の疲れないデザインだそうだ」とも、以前テレビでやっていたと言っていた
家庭	台所	今の台所事情では難しいですが、アメリカ圏では独自のロードサービスや、アジア圏では整備学校などの設立させるなどソフト面を充実させる事が「トヨタ本来の商売」ではないかと思います
食事	台所	TOTO(北九州市)は2月3日から台所の生ごみを水と混ぜながら粉砕し、専用の排水処理装置で浄化・排水する「TOTOディスポーザシステム」の手動給水タイプを発売する
食事	台所	それから今度は下へ降りて、宿屋の台所へ行って塩を沢山と、物置へ行って六尺棒を一本と、大きな鋸(のこぎり)を一梃と、縄の束を一把と取って、又二階へ帰りますと、何も知らずに寝ているヒョロ子と豚吉にシビレ薬を嗅がせ初めました
食事	台所	まず台所の中で使用する物には饌(チャンジャン・食器棚)や饌卓(チャンタッ)などがあって、これらは鍮器や磁器のような重い器を重ねておく家具なのでとても頑丈に作られています
食事	台所	実際には、お風呂や台所などの生活廃水などと一緒に下水道などのインフラを経由し、汚水処理場で環境に問題ないレベルまで浄化した後、川などに放流されています
食事	台所	ちょうどお店に着いた時、店の奥のキッチン(つか普通に人んちの台所)でデコレーションケーキをお店のご主人が作ってるところで、その盛りっぷりにすげー見惚れたね
食事	台所	、「神様をお迎えした新年に台所を騒がせない」、とか「女性が正月三が日に休めるよう」とかいわれてますが、なにはともあれお正月の雰囲気を盛り上げてくれますね
食事	台所	著者の平松さんは「台所エッセイスト(←今、ワシが勝手に命名)」なので、書かれているのは食べ物や料理、あるいはそれらに対する心構え、みたいなもんについて
食事	台所	たとえば「正門に首を置いたのは五時以降というのは、五時には台所に立つ母に見つかるので僕には不可能だから、それは嘘です」といった類のものが、その典型です
食事	台所	さて今夜はどのように攻めようかと考えつつ嫁の動きを見張っていると、すぐ寝ると思われた嫁は台所に立ち寄り、僕が少し前に夕飯を温めたフライパンと空になった炊飯器のカマを洗い始めた
食事	台所	女中はちょうど、台所の何かの湯気に隠れたから、その時は誰も知らなかったが、知れずに済みそうな事でもなし、またこれだけを切取っても、主税の迷惑は隠されぬ、内へだって、新聞は他(ほか)に二三種も来るのだけれども、そんな事は不関焉(おかまいなし)
食事	台所	予算オーバーをするのであれば、和室はそんなに使っていないので、よく使うトイレ、浴室、台所、リビングの4~5箇所くらいをリフォームできればと思います
家庭	台所	中央政府は農民収入の5%以上の費用徴収を禁止しているのですが、なにせさしたる産業を持たない農村政府の台所事情には厳しいものがあり、公務員への給与支払いにも事欠くありさまです
食事	台所	大隈邸の台所は板敷とセメントの土間が半々、そしてガス竃を備え、当時あまり調理用には使用されていなかったガスの利点を大きくアピールし、岩崎邸でもやはりすべて板敷で立式の清潔な台所の様子を美しい挿絵で紹介しています
食事	台所	忙しいので全部をじっと座って見ることはできなかったのですが、見たところは偶々お菓子の家でお菓子を食べるところと、最後、台所で魔女がグレーテルを扱き使い、ヘンゼルに美味しいものを食べさせ、太らせようとしているところからです
食事	台所	19日午後5時ごろ、岐阜県恵那市大井町、無職稲川順造さん(79)方の台所で、いすに座った稲川さんが燃えているのを帰宅した小学6年生の孫(12)が発見した
食事	台所	したがって、結婚した順番より最も左翼から台所に近い中央部にそれぞれの部屋の持ち主は移動することとなり、女性は再生産の年齢を過ぎると使用していた部屋を娘に譲渡し、母親は広間あるいは台所の片隅で過ごすこととなる[6]
その他	台所	将軍家から十三代徳川家定の御台所に相応しい娘はいないかと打診があったが、島津斉彬には年頃の娘なく、そこで、篤姫が候補にあがって、藩主斉彬の養女とし迎えいれられた
食事	台所	今までは、いつもリビングの机で宿題をやり、家でのほとんどの時間を台所横のリビングで過ごしていましたが、入学式を前にした春休みのある日、突然「二階行くわ」と自分から言い出し、荷物を自分の部屋に移動し、大整理を始めました
食事	台所	また台所や洗面所などで専用に使う4~5号のものを小型ガス湯沸かし器といい、配管して2か所以上に給湯できる6号以上のものを大型ガス湯沸かし器という
その他	台所	公文書では、天保13年(1843年)に天保の改革による株仲間廃止論に異論を唱えた大坂町奉行阿部正蔵の意見書(「諸色取締方之儀ニ付奉伺候書付」)の中に「大坂表之義は諸国取引第一之場所」「世俗諸国之台所と相唱」ちう文面が見られはる
食事	台所	私の近くにも沢山の名水が有ります、一番評判の良い所の水を汲んできています、20リッタ3缶常温で台所にほったらかし、数ヶ月何ともないです、同じ水でも、緑の藻が付くと言う人もいます、この違いが分かりません
食事	台所	(4) ごみよけ装置 台所、浴室、洗濯場その他固形物を含む汚水の流出口には、固形物の流下を有効に防止できる目幅をもったごみよけ装置を設けること
食事	台所	ツタさんはお茶でも淹れますねとそのまま台所へ向かい、膳の上のお飾りや短冊を大きめの紙箱へと収めつつ、ルフィは何かしら思い出してか くすすと笑った
食事	台所	商品分類第21類の家庭用又は台所用の器具及び容器は、貴金属製又は貴金属を被覆したものを含むべきであるので、第21類の見出しの括弧内、「貴金属製又は貴金属を被覆したものでないもの」の文字を削除する
食事	台所	「アトピック台所用食器洗剤400ml」は、手肌に刺激を与える添加物(香料・着色料・防腐剤)を取り除く事で、手肌への負担をやわらげた食器洗剤です
食事	台所	むしろ労働後のビールをおいしく飲むために、 わざと暑いときを狙って労働してるとも言いますが(笑) 台所の窓を開け放って、思いっきり風を取り込みながら、 おいしくギョウザとビールをいただきました
食事	台所	台所へ出て水瓶のなかをのぞいてみると、そこにはまだあの醜怪な動物がぶきみな肌に底光りをみせて、まるで冬眠でもしているかのようにぴたりと静止してうごかなかった
食事	台所	正面の建物は、母家(ウフヤ)で、向って右の部屋から「一番座」「二番座」「三番座」と呼ばれ、次に台所があるのが一般的ですが、「中村家住宅」ではその間に板の間が設けられています
その他	台所	金沢の台所「b近江町市場/b」でお昼ごはんを食べました たくさんあるお店から選んだのは 市場に入りスグにある「bこてつ/b」 カウンター9席の小さいお店です
食事	台所	(まるで広島の惨劇に遭ふために移つたやうなものだつたが、)それからも絶えず他所の家で厄介になりつづけてゐたので僕はもう台所のことを忘れかけてゐた
家庭	台所	12年7月の設立前から、ナビー社とは深く関わってはいたが、昨年9月27日の株主総会で出資企業からの緊急動議で社長に担がれるまでは、同社の本当の台所事情を知ることはできなかったという
食事	台所	ひとつはフラマンの食器などを集めた大人っぽいシックな部屋、もうひとつはキッチン雑貨をおいてある本物の台所、サンルームはガーデニンググッズ(アンティークも多し)がたくさん
食事	台所	台所の洗ったものを入れるシンク用のカゴ、風呂で使用する椅子、ガスレンジの汚れ防止用アルミを固定する磁石用の鉄の小片、ゴミ箱、ラック類の転倒防止用の棒、壊れたキッチンタイマーに代わって丸洗いの出来るもの等を購入
食事	台所	プレイヤーのほとんどはきっと、ゲーム専用の部屋があったらいいなあ、と思いながら台所のテーブルの上でゲームをしているはずだから、その大きさのテーブルでもプレイできるくらいのゲームにしなきゃ、って考えていたんだよ
食事	台所	あまり大声でえげつないこと しゃべるので、一人で台所で洗い物などしていたまじめが堅物のよろい着て生活してるような望月に「控えめにしたら」と忠告を受けました
食事	台所	境内には推定樹齢3000年の巨杉群(天然記念物)がそびえ、社務所には狩野派の極彩色の杉板襖があり、社務所、台所とも国の重要文化財に指定されている
食事	台所	この時期は台所に立つ時間短縮の為に惣菜が良く売れるらしいよ(数日前にニュースで見た)凝った料理は涼しくなったら幾らでも作れる(と言うことにしとく)
食事	台所	めんどくさいので「県警方式」で適当に捜査したふりをして、事件性なしと回答していたが、台所の食べかすや風呂場の石鹸を齧った跡が確認され、さらに山の神が台所でその姿を見るにおよんで、ついに立件せざるを得なくなった
その他	台所	浜郷村、四郷村、二見町などのむしろを船で積出し行き先は熱田(名古屋)、桑名、四日市、吉田(豊橋)、半田、岡崎、碧南、小田原、東京などで、帰り荷は宇治山田の台所である河崎の問屋街に荷物を持ってきた
食事	台所	前から気になってた、台所の置物机(元は机で、今は普段使う物や私の雑貨を色々収納している場所)の周辺と、乾物棚に、ちょっと手を付けてみたらですね、そのまま止まらなくなってエライことに
食事	台所	素朴で実直な性格で、武士としての出世欲には乏しく、戦場で武功を挙げようという考えはあまりなかったものの、坂戸城の薪炭奉行(台所や城中で使う薪や薪を調達する)という役職から算勘の才ひとつでめきめきと頭角を現し、魚野川舟運、銀山経営、青苧売買といった財政の舵取りを一手に任されるようになり、遂には家老にまで抜擢された
食事	台所	また、防衛のため、玄関ドアの裏側に計数器を設置し、玄関と台所の境にのぞき穴付きのカーテンをつっていたほか、浴槽に水を張り、台所に水を入れたポリバケツを置いて、いつでも水溶紙書類の廃棄ができるようにしていた
食事	台所	例によって母親が送って来たという、なにか巨大な柑橘類を一緒に食べましょうとか言いながら、台所でこちらに背を向けて真剣に切り分けていた、若い刑事の動きがふいに止まったのが分かった
食事	台所	いつもこの時間なら料理をす るはやてとシャマルが台所にいて、ザフィーラが床で寝ていて、ヴィータと自分がテレビのチャンネルを取り合っていて、シグナムがそれを呆れながら見てい て、ミヤが『喧嘩はだめです
食事	台所	たまたま通りかかった東急ハンズで「太田さん家の手づくり洗剤」が目にとまり、台所洗剤にしては高価だと思ったのですが、ためしに700gのものを購入してみました
食事	台所	それでもIHに変わる前の電気ヒーターは、ビルトイン式の調理台すらも基本的に昭和の電気コンロと同じ構造だったわけで、それを思うと、つい最近まで台所のテクノロジーは大阪万博前と大差なかったことになる
食事	台所	宗助は五六日前伊藤公暗殺の号外を見たとき、御米の働いている台所へ出て来て、「おい大変だ、伊藤さんが殺された」と云って、手に持った号外を御米のエプロンの上に乗せたなり書斎へ這入はいったが、その語気からいうと、むしろ落ちついたものであった
