# 家庭: 転じて、家計。やりくり。台所を預かる台所が苦しい, 食事: 食物を調理する場所。炊事場。
食事	台所	台所の煙を送りだす通管(房管)を下に通す必要上、地面よりも少し高く建てられているが、しかしソウルでは、必ずしもこの方法が一般的とはなっていない
食事	台所	シックハウス対策は勿論のこと、寝室には抗菌で通気性のある物、台所には汚れ防止、子供部屋にはキズ付きにくい表面強化など、安全性、機能性を考えアドバイスさせていただきます
その他	台所	豊かな食文化を背景に「東海の台所」と言われる"桑名"に、全国で店舗を構える選りすぐりの人気ラーメン店を集結させ、桑名を中心とする東海地区の方々に、全国ご当地ラーメン"本店の味"を食べ比べていただく、言わば「全国ご当地ラーメンの殿堂」を、「マイカル」と「ナムコ・チームナンジャ」が共同開発いたします
食事	台所	EtherとMiddleIsland は2年前にコラボレートしたCD「無始無終」が個人的にとても気に入ってて、今さっきも台所で皿洗いながら聴いてたんだけど、やっぱり良いよ
食事	台所	そんなわけで選挙あけて梅雨もあけてだるだるで休日(まる一日オフ)の14日は、汚れまくっている台所をちょっとだけ整理清掃して溜飲を下げ、夕方涼しくなってからの短時間は「梅雨明けの庭仕事」に精を出す
食事	台所	おせち料理は元々、年中家事で忙しい主婦がお正月3が日だけでも食事の支度をせずゆっくりできるようにと日持ちのするものを詰めたことも含まれているそうですが、神様を迎えている間は台所で煮たきものをして騒がしくしないということからきているのだそうです
食事	台所	その日は父が在宅で、その方に対応して居たのですが、話の内容は私には分かりませんが、父が奥の台所に行って何か袋に入れた包みを手渡して上げると女性は、涙を流して何度も何度も父に頭を下げて居るのが未だに私の記憶からは消える事が無い
食事	台所	今はまだアイランドキッチンが台所や居間にポツンとおいてあるような設計が多いのですが、今後アイランドキッチンを盛り立てる設計が、徐々にでてくると思います
食事	台所	最近、光太郎の家の裏庭の盆栽やばけつが倒されているのはおかしい、そこで裏庭のずっと見渡せる台所で編み物をしながら見張っていたら、おもちゃのモータボートのような音がしたので外を見たそうである
その他	台所	全行程を歩き終えて思ったことは、昔は40kg〜60kgもある魚荷を背負って80km近い道を夜通し駆けて翌朝京の台所、錦の朝市に魚を並べたという人たちのご苦労は、負い縄一本あれば生活できると言われた時代でも大変な仕事だったのだろうということでした
食事	台所	台所のテーブルにはきつね色に焼(や)けたリンゴのパイが大きなお皿にもりつけられていて、焼けたリンゴの良いにおいが部屋(へや)いっぱいに広がっていました
食事	台所	トイレから長らく出て来ない彼女をベットで待とうと寝室に戻ろうとした時、彼女はトイレから出ると何やら小さな買い物袋を手に持って台所へ入ると「パタンッ
食事	台所	なお婚礼の際花嫁が婚家に初めて入るとき、台所から入家し、その折カマドに一礼したあと座敷などに上がるという習わしがあったが、これはその家のカマド神(火の神)に家族の一員となることを告げる大事な儀礼であったのである
食事	台所	オヤジは自分の鼻を頼りに、匂いの発生場所を特定しようと、台所中を探しまわったものです(笑) *** 「醤油料理 天忠」の母体は「岡直三郎商店」
食事	台所	台所以外の水回りは比較的新しいので(トイレ、風呂場、洗面台は10年ほど前に改装済)汚れ方も大したことはないものの、やはりタイルの目地や、浴槽の蓋や石けん受けや洗面器や椅子の裏にはカビがけっこう出ている
食事	台所	また、地域保健医療を改善する意味での台所のかまど改善、安全な飲み水を確保するための井戸掘り、かつ女性への支援を通しての夫婦間のコミュニケーションの円滑化を図った
食事	台所	カビを清掃するために、色々な薬品(レンズクリーナ、ハイパークリーン6310、アセトン、エタノールetc)を使用しましたが、最終的には台所用洗剤が一番簡単で良くとれることが分かりました
食事	台所	そして人が生活を営む家であるのに、原節子が台所へ歩み去って行く廊下の壁と床板はハッとするほど影を帯びていて、息を詰めたような静謐さの、あまりの侘しさが恐ろしいほどです
食事	台所	一階は張見世、その奥は従業員の部屋や台所など生活空間になっており、客は張見世の横にある入り口から二階に通され、遊女と対面する『引付け』と言う部屋で遊女を待つ事になる
食事	台所	台所の床下収納の蓋を開けっ放しで、電話などがかかり、電話が済み元の場所 に戻ったとき蓋の開けっ放しを、すっかり忘れて床下収納の所に自分が、落ちた 時
食事	台所	22日午後10時15分ごろ、ワンルームマンション1階の自室で、台所の床下収納スペース(約60センチ四方、深さ約50センチ)に、大阪府内の女性(19)を監禁
食事	台所	美味しそうなアテいいなぁ〜 今夜は旦那がいないから飲み放題だけど食べる物が・・ こんな時間から台所で調理もなんだし、 仕方なく海苔をラー油と塩に付けてハポー酒だっ
食事	台所	通常の居住室はもちろんですが、例えば採光計算上では居室とはならない(計画の仕方により居室扱いをされる場合もありますが)台所や厨房等に関しても、24時間常時換気の規制上では「居室」となります
食事	台所	そうそう、野鳥の話で思い出しましたが、今朝望月と台所でニュース聞いていて(最近はラジオでテレビニュースを聞いてます)、「アカハラ」と聞こえ、今度はテレビ画面で「アカハラ・・・」とみたのですが、「アカハラが問題となって」というので「アカハラが増えてって、あれって害鳥なの
食事	台所	オレはオヤヂの晩酌の相手なんてしないので、話し相手が欲しかったようだが、オレに料理をさせて置いて、その上台所の片づけも全部させて置いて、自分だけ逃げるとは許せないぞ
食事	台所	包丁が出ている間は台所に入らないとか、人の食べ物は食べたら駄目とか、コンセントは齧るなとか、いろいろと「我が家ルール」を決めていますが、テーブルの上にあがるなという項目を出すのを忘れていました
その他	台所	近年、急増している"化学物質過敏症"も食生活の急激な変化と農薬や添加物だらけの食品を食べざるを得ない現在の台所事情とまったく無縁ではないでしょう
その他	台所	さかんに御台所(政子)の嫉妬が怖いから嫌だと云いましたが、頼朝様の愛情は益々激しく求めてこられるので(近くに居るように望むので)仕方が無くお言葉に従いましたとの事だとさ
食事	台所	プレスデーの初日、GMのワゴナー会長が、「GMは台所のごみ、木くず、草、都市ごみなどに熱を加え、出てきた一酸化炭素と水素のガスに特別なバクテリアを使ってエタノールを生産する技術に取り組んでいるCoskata社を全面的にバックアップ、1ガロン1ドル以下の実現をめざす」と発表した
食事	台所	名称を直訳すると「台所の流し台」であるが、この技を受けた選手は前屈みの姿勢となり、この「凹型の形状が流し台に似る」説や、流し台は台所の中で動かしようのない設備である事から「台所の流し台のように相手を動けなくする技」説など諸説あるが、由来についての詳細は不明であるべきです
その他	台所	振り返れば、天下の台所として大いに栄えた近世から大大阪と呼ばれるほどに発展した近代へと、大阪はまさに住・職・遊が一体の都市に住み・暮らす生活文化が見事に息づくまちだったはず
食事	台所	ノーリツ「ユコアGT」 設置フリータイプの屋外据置型です☆フルオートタイプ♪ ■台所と同時使用でもパワフルシャワーが可能(スーパーターボ給湯) ■ぬるさを感じる前に追いだきしてくれる(ごきげんオート)
その他	台所	若槻千夏楽譜春のワルツ 韓国ドラマ情報304韓台所川崎303入江紗綾のこといろいろ など動画テニスの王子様ゲーム占い占いリロスティッチ壁紙デコメアニメairアイドル動画集airお笑い動画集air入江紗綾画像掲示板1669入江紗綾あとこないだは、1日停部だし私に佐藤綾
食事	台所	で、台所で『オリーブの首飾り』を、ちゃらららら~ん♪と口ずさみながらギロチンで遊びつつ、テーブルに方眼紙広げて『ともゑという名で十八で(仮)』、ラフ組みというか、登場人物の動機とか葛藤とかハードルとか目的とかの再検証
食事	台所	それが現在では、耳がよく聞えるようになり、腹の痛かったのがなくなり、また一人でヒザを立てて便所へも行けるようになり、台所の手伝いもそろそろする位になりました
食事	台所	それから、いただいておりますこの消防年報の数値によりますと、ご答弁の中にも若干ありましたが、発生原因はやっぱりご承知のとおり、今述べていただいたように台所関連が多いように思います
その他	台所	沖縄の台所 ぱいかじ 銀座8丁目店のアルバイト求人の詳細を見る このお気に入りアルバイト[沖縄の台所 ぱいかじ 銀座8丁目店]を気になるリストに追加
食事	台所	あの日は、うちのほうの大掃除だったので、台所直しさんや、畳屋 さんもはいっていて、お母さんも箪笥(たんす)のものを整理して、そのときに、この風呂 敷が出て来て、私がもらった
食事	台所	新聞、宮崎駿アニメの「千と千尋の神隠し」を連想してしまったのでした、水野真澄氏が「 香港」「水野商務諮詢上海有限公司」に加えて、誰もいない台所から椅子を引きずる音が聞こえたり、 [建築家設計事務所] 大阪府大阪市城東
食事	台所	料理(「料理; 割烹; 台所」; フランス料理から、結局、「料理する」ためにラテン語からcoquereする)は伝統と習慣を料理する特定のセットです、しばしば特定の文化に関連しています
食事	台所	台所の出入り口は網戸はないから網戸にくっつかないけど、ゴミを出し入れするだけなのに虫に襲われそうになるし、戸をあけたときに部屋に入ってきちゃうから出入りするのはいやになりました
その他	台所	というのも「台所」(キッチン)渓谷は厳しい自然の要害として知られ、中でも「母」(マザー)と呼ばれる自然現象は特に甚大な被害をもたらすことで恐れられていた
食事	台所	ドイツ家庭の台所管理者(もちろんたいがい女性)は、夕飯は基本的に切って盛り付ければいいものしか出さない、そしてそんな夕飯のあとですら執念深く台所を磨き上げ、翌朝までは何人たりとも使用を許されない
食事	台所	すごく汚い長屋みたいな家の台所の横を通り、裏口を開けて、そこから2階に上がっていったら、この部屋の半分ぐらいの部屋全部に、にせ物ブランドが所狭しと置いてありました
食事	台所	台所の灯に寄ってくる蛾を待ち伏せて一晩がんばっているのだが、たまにパクリとやるところに出くわすことがあって、思わず「やったー」と叫ぶのでカミサンが驚いていた
食事	台所	その頃澪がくだんのオムレツを真帆宅の台所で焼きながら「お父さんが生きていた頃は、卵は貴重品だったわね、万平おじさんが持って来てくれるたびに、私食べたくて食べたくて」と意味深に微笑むなど、“卵”というベーシックかつアットホームな食材を、心かよい合い物質的にも満ち足りる平和な家庭生活の象徴のように使った、なかなかワザありの今作の創作料理プレゼンでした
食事	台所	しかし、本来、自分が座っているはずの台所に近い席に陣取り、炊飯器からよそった御飯の食器を、手を伸ばして受け取ろうとする明日香へ、こちらも一杯にうでを差し伸べ、渡そうとする『奈津子』の満面の笑み──苛立たせることにまたあのエプロンをしている──は、食べ盛りの子供を頼もしく思う母親の幸福なそれと同じなのだった
食事	台所	「この辺に台所があった」と指さす敬子さん(右)=加茂郡八百津町八百津 県内で死者、行方不明者合わせて6人の大きな被害をもたらした15日の豪雨災害
食事	台所	【作用】本願請求項1の厨芥水切り移送装置は、台所の流し台の下方位置において、ドラムが横向きになる姿勢で設置され、且つ流し台の排水通路をドラムの厨芥通路の入口に導いておく
食事	台所	即バルサンをした後G2の死亡を確認、そして床は台所用の除菌スプレーで拭いたものの、クローゼットの中にも、シンク下にも、そしてなぜか冷蔵庫の中にも奴の排泄が多数あり、もう精神的に死にそうです
食事	台所	家にたどり着くまで何度も電柱に行く手を阻まれたり溝に落ちそうになったり実際落ちたり風呂に入ってそのまま寝込んでしまったり食べた記憶の無いお菓子を台所に撒き散らして翌朝家人に激しくののしられてみたり
食事	台所	秋には、台所の三角コーナーのネットに入れて、カーポートの下で、 日陰天日干しを1ヶ月くらいしてからジップロックなどの密封の袋に入れて保存します
食事	台所	店の奥行きを大きくした分は、あの4畳半をつぶしてすませることができたが、幅も敷地いっぱいに広げようということで、それに連れて、台所とバス・トイレも移動させ、2階を全く新しくしたわけだから、この洋間もいじらざるを得なくなった
その他	台所	たとえば、大阪人の気質は、秀吉時代から天下の台所として栄え近年では近江商人に代表される商業の町として発展してきた背景から「したたかで人なっつこい」「ルール嫌い」「イラチ(せっかち)」「食道楽」等の特徴である
食事	台所	シミ自体はアルカリ性の台所用漂白 剤により洗い流せますが、下地の状態により効果が出にくい場合や、漂白剤により下地を脱色してしまう場合がございますのでご注意下さい
その他	台所	また、大阪は、これら良質かつ新鮮な食材に恵まれた地の利に加え、諸国の台所として長きにわたり市場流通の拠点として栄えたことで、独自の料理文化が醸成され、今日の日本料理の礎となる料亭料理や割烹料理を生み出してきました
食事	台所	壁の向こう――台所――から響いてくる人形たちの叫びを背景に、縛られたシンジは何時もの貼り付けた薄ら笑いではなく、引き攣った泣き笑いの表情で青褪めていた
その他	台所	著書に『うおつか流台所リストラ術』『うおつか流生活リストラ術』『今夜の魚 呑む銘酒』『古道具屋さんの経済原論』『食べ暮らしダイエット』『魚柄仁之助の楽膳のすゝめ』など
食事	台所	食器、台所用品、玩具類、幼児用品、学用品、電気製品、小型の家具類、自転車(目録で表示)等で、新品又は日常十分に使用できるもの(修理を必要とするものは除く)で管理に支障のないものに限る
食事	台所	用途:ガラス類・床・家具・トイレの便器やタイル、洗面所の陶器の汚れ、ワイシャツ等 のエリソデ汚れ、衣類の洗剤補助、浴槽・浴室の汚れ、洗面台・台所のシンクの廻り、
食事	台所	次に台所タワシ(真鍮製切り屑状)を即乾ゴムボンドで貼り付けた、使い易く曲げたピアノ線や竹の皮を残した細い棒のブラシで隅々迄擦り、汚れを落とし、再度水洗いを数回します
食事	台所	日用品、置物、額縁、食器、台所用品、食品(味噌、しょう油、パン、細うどん等)、衣類(作務衣、甚平等)、文房具、履物(紳士靴、婦人靴、下駄等)、かばん、アクセサリー、アウトドア用品、寝具、園芸用品など
食事	台所	町田市では、台所(だいどころ)からでる生ごみを少なくすることをすすめたり、リサイクルできるしなものを持(も)ちこめる場所(ばしょ)を開(ひら)いたり、また、市内から集めた木の枝(えだ)を細(こま)かくして、野菜(やさい)などを栽培(さいばい)する材料(ざいりょう)を作っているんだよ
食事	台所	我が家は台所と風呂・洗面所が遠いので、台所のお湯はガス、風呂・洗面所のお湯は電気給湯器と分けて使っていますが、電気給湯器のお湯の勢いが思ったよりも(かなり)弱いのです
食事	台所	[ パン工場、特に大手メーカーの工場は、家庭の台所とは比較にならないくらい清潔な環境のもとで、配合や発酵方法などに工夫を凝らして作っているからです
その他	台所	堂島川への土砂流入で 船渡御が中止になったこともありますが、天下の台所と呼ばれた元禄時代(17世紀後半)以降、天神祭は浪速の繁栄のシンボルとして 隆盛をきわめ、享保年間(18世紀前半)には「講」という祭りを支える組織が誕生し、新たにお迎え人形も登場し、祭りの豪華さは全国 に名を馳せます
食事	台所	この間なんて、いつのまにやら、台所に転がっていた殻つきのぎんなんを拾って口に入れ、ごろごろさせていたんだけど、しばらく誰にも気づかれなかったほどである
家庭	台所	男児2人が死亡 青森でアパート火災(2010/08/09) 7日午後、青森市三内稲元、会社員長内俊一さん(34)方アパート1階の部屋から出火、台所兼居間にある冷蔵庫の背面を焼いた
家庭	台所	ほんとはマルコポーロ(マリアージュフレールのフレーバードティー)あたりを水出しで飲みたいんだけど、私の台所事情とうちの冷蔵庫事情からいって無理っぽい、いや無理すればなんとかなるんだけど無理するのがめんどくさいだけです
食事	台所	テレビのホーム・ドラマに出てくるパパたち、ママたち、そして子どもたちは、たとえば台所に棚を吊ったり、行方不明の飼犬をさがしまわったり、ハゲたペンキを塗りなおしたり、バラの剪定をしたり、要するに家という建物とその周辺を美しくすることに余暇をささげているかのようである
その他	台所	【カツおばあちゃんの台所】かつおばあちゃん直伝南ばん味噌は、平成17年に100歳で亡くなったオーナーの母が毎年作っていたナンバン味噌を忠実に [続きを読む]
食事	台所	食事の支度の時はいっしょにキッチンで、子どもには危なくない台所用具、ボールとかおたまとか、泡立て器とか缶詰とかをおもちゃに与え、いっしょにお料理をしているような気分で遊んでいました
食事	台所	台所ではまな板などの除菌、お部屋のカビ発生予防、トイレの便座、車内のたばこ等の消臭、枕、靴の匂い、傷の洗い流し、お年寄りや小さいお子様のいるお部屋の除菌、生ゴミ、ウィルス感染予防のうがいや手洗い、ペットの消臭、梅雨時の洗濯物の部屋干し、剣道の防具、ワキガ、加齢臭、口臭予防、水虫予防、生花等、あらゆるところの除菌・抗菌対策
食事	台所	夕方裏の畑へ出て、明朝《あした》のお汁《つゆ》の実にする菜葉《なっぱ》をつみこんで入って来ると、今し方帰ったばかりの作が、台所の次の間で、晩飯の膳に向おうとしていた
家庭	台所	しかし、靖国神社に関係する団体の発行物などの資料から、同神社の収入が年々減少傾向にあることは読み取れるし、台所事情が悪化しつつあることは間違いないところだ
食事	台所	その頃から母も時々起きて、台所へ顔を出すことがあったが、自分で働くほどの気力はなかったので、台所仕事は依然として、自分が主としてやらない訳にはいかなかった
食事	台所	21日、UNHCRの支援チームはセナキ(Senaki)に逃れた500人の国内避難民を訪れ、毛布や台所用品、給水用ポリタンクといった必需品を配布しました
食事	台所	例えば、家族で食事をする楽しい時間、食事の準備に台所に立つ私を見なが ら、父はテーブルの決まった席に座りまして、ビールを飲みながらいろいろな話をしてくれました
食事	台所	最近、料理をしても、後片付けしない、後片付けしても、洗い方、しまい方が良くないと難癖を付けられ、台所に入れてもらえず、少々欲求不満だったので、鬼(
食事	台所	早々、試供品で頂いたアルカリウオッシュを水でうすめてスプレーに入れ、台所まわり、ガスまわり、冷蔵庫とふきつけて拭くだけで、油汚れからみんな落ちるのにびっくり、ピカピカの台所になりました
食事	台所	津波の被害と惨状が最も甚だしいのは雄勝湾一帯であるが、同湾から牡鹿半島沖合まで無数の家財道具や台所用品に交じって屋根畳などが漂流しているのは悲惨である
食事	台所	ムスクそして大人が抱えれも足りないほどの胡楊樹の林(日本でも神社・寺院には大木が植わっている)を抜け、巡礼者の食堂・台所(300人の調理が出来る)のあるところを見学した
食事	台所	そんな 2 人が 2 人だけになるコトなく、他のヒロイン達がしっかり絡んで来るトコロも良い感じ♪ 保奈美はみんなのお姉ちゃんで、毎朝主人公クンを起こしてあげる役目を渡してあげるシーンとか、一緒に台所で料理を作っているシーンとか、主人公クンも茉理も、愛されているんだな〜って
食事	台所	この時、台所が、居間や居間と一体のダイニングと壁で仕切られた独立した部屋となっている場合(壁の一部が出入り口のための開口になっている場合も含む)や、台所とダイニングが、居間と壁で仕切られている場合(上記括弧内に同じ)は、一体的空間とは扱いません
その他	台所	下関では「逞しき谷間」ということで、下関の台所といわれる長門市場で庶民生活を撮り続けたり、綾羅木郷台地(現:綾羅木郷遺跡)が産業と農業政策で壊されようとしているときは、文化財保護という立場から取り続けてキャンペーンなどを行っていました
その他	台所	200g阿蘇のいずみ 薄力粉 :私の台所 )商品説明文(※商品によってはそれ以上かかる場合もございます返品交換不可※10日前後の発送目安となります変更・※ご注文後商品を発注するため、キャンセル・※28AUG09P10返品交換不可※ご注文後商品を発注致します変更・[受注発注]※5250円以上送料無料※キャンセル・:【私の台所薄力粉阿蘇のいずみ200G】
食事	台所	沖縄では、女性の名前として「カマドゥ」、「カマド」、「カマ」などの名前がつけられたことがありましたが、このことからも、昔の人の生活にとって台所と竈の存在はとても大きなものだったに違いありません
