# 軍事: 戦闘の最前線。交戦の区域。, 政治: 政治運動や社会運動で、闘争の形態をたとえて言う語。労働戦線
その他	戦線	そこで井戸を確保するべく、メイド達の戦線のすぐ近くにある井戸を奪うための作戦が開始されたが、水輝はいまいちやる気がしないのでこうして森の中一人散歩していた
その他	戦線	そんなスザクが自らの傷に折り合いをつけ、そして作中でも髄一ゼロと共同戦線を張るキュウシュウでのくだりはこの作品とは思えないほどに熱くて、アニメでも大好きな場面でした
軍事	戦線	この機体によって、日本解放戦線の塞とも言える藤堂鏡志朗、そしてコーネリアの騎士であるギルフォードをも退け、ブリタニア軍の機体を25体程破壊し、戦場を狂わせた
軍事	戦線	福田赳夫首相は要求(クアラルンプール事件と同じような内容)に応じ、「超法規的措置」として拘束中のメンバーら6人(日本赤軍・奥平純三、東アジア反日武装戦線・大道寺あや子と浴田由紀子、赤軍派・城崎勉、獄中組合・泉水博、仁平映)を解放し、600万ドルの身代金を支払った
軍事	戦線	しかし、この「第二次欧州大戦」は、もともとのゲーム自体が「War in the EAST」という東部戦線専用のゲームとして作られたものであり、しかもそれ自体かなり歪んだ形のシミュレーションであったために、これを拡張してヨーロッパ戦争全部を再現できるゲームにしようと言う企図自体にかなり無理があったものと思われます
政治	戦線	一方、菊戦線の先頭をひた走るメジロライアンは、トライアルの京都新聞杯でレコードタイムで順当に差し切り勝ちを演じ、主役の地位を明け渡すことなくいよいよ菊本番を迎える
政治	戦線	テロ特措法で対アフガンへの作戦のために始まったとしても、アメリカが対イラクにまで戦線を拡大させたなら当然イラク戦用として石油が利用されることは推測されたはず
政治	戦線	5月10日に予定されている東部州の州議会選挙において、旧カルナ派(ピッライヤン派)の兵士が、武器を携行したまま選挙活動をしていることについて野党の批判が強いことが大きな理由である、ピッライヤン候補は、州政府の首相を目指しているが、統一国民党や人民解放戦線は、選挙の無効を主張する可能性が強い
政治	戦線	ドイツに対してもまた、三月十七日、社会民主党と労働組合にたいする統一戦線を決定したが、すでに混乱の極にたっした共産党は、これを決定的な決戦の指令とすることができなかった
軍事	戦線	そもそもヨーロッパ戦線での帰趨がまだはっきりしない1943年時点で 日本に対して原爆使用を決めたこと自体、人種差別以外なにものでもないのだが、なぜ京都がAA級に選ばれたのだろう
政治	戦線	これに対し与党側の人民解放戦線(JVP)は、大統領の方針はLTTEの分離独立につながるものとして与党連合から離脱をほのめかし、また、与党を支持している仏教徒の政党も大統領の方針に反対している
軍事	戦線	1937年:日本軍が杭州湾北岸に上陸(上海戦線の背後を突き南京進軍が可能に、9日に日本軍は太原を占領し11日には上海を占領、19日には蘇州・嘉興を占領)
政治	戦線	日本共産党が、高い政治的、理論的な力量と、労働者をはじめ国民諸階層と広く深く結びついた強大な組織力をもって発展することは、統一戦線の発展のための『決定的な条件』となる
政治	戦線	次いで孔子批判キャンペーンがはじまるや、文革初期には”毛沢東の忠実な学生”として劉少奇追い落としに共同戦線を張ったはずの江青等「四人組」から儒教復活を目論んだ封建主義者と侮蔑され、さらには「資産階級軍事路線」を歩んだとまで糾弾されたることになる
政治	戦線	例えば、韓国国内のあるサイトには、韓国国民の名前で「逆賊牌党(集団)がでっち上げた、北朝鮮による哨戒艦『天安』攻撃説の真相について語る」という書き込みがあったが、その内容は、北朝鮮の対南工作機関である祖国統一民主主義戦線部傘下の「6・15編集社」が、北朝鮮のインターネットサイト「わが民族同士」に掲載した国防委員会報道官声明とまったく同じものであることが分かった
軍事	戦線	実のところ第二次世界大戦型の戦線を引いてどうこうというゲームはあまりプレーしないんだけど、久々にエル・アラメインをプレイして、相手の攻勢をどう防ぐか、あるいは、相手の防御をいかに突破するかを考えるのも、久々にやると面白かったです
その他	戦線	通常、競合他社の製品に欠点を発見した場合、直ちに営業戦線の中で他社製品の攻撃材料として用いるものであるが、被告はそのようにせず、慎重に行動したのである
軍事	戦線	ソ連が撤退した理由は、一つにはムジャヒディンたちの抵抗があったからなのだが、それよりも、戦線の維持ができないほど困窮していたソ連国内の経済が破綻寸前だったからだ
政治	戦線	宇佐の産地研修と合同参加、そして安心院町までその戦線範囲を広げ日本地豆腐倶楽部唯一の働き者・関東地区の渋谷、たかちの都会コンビが宇佐から安心院へと転戦
政治	戦線	党はかれらがいまだ大衆を獲得せねばならないこと、攻撃は多少とも長い準備活動の期間によって先行されねばならないことを考慮に入れる統一戦線の時代、すなわち過渡的要求にもとづいて大衆を融合せしめる戦術の時代がはじまる
政治	戦線	【バンコク=野沢康二】タイのタクシン元首相支持派団体「反独裁民主統一戦線」(UDD、通称「赤シャツ隊」)は27日、バンコク中心部で9万人以上が参加する反政府のデモ行進を行い、首相府前で国軍などとにらみ合いとなった
軍事	戦線	生存を望むべくもない東部ニューギニア戦線を生きぬいた末端兵士が描く悽惨な戦場の実態—飢餓に、傷病に、次々と戦友たちが斃れる中で、なぜ自分は生き残ることができたのか—自らのおかれた「運命」をふり返り、戦場における残虐性、そして人間の尊厳を赤裸々に綴り、戦争の愚かさを素朴に伝える感動の記録
政治	戦線	(2) 勤労諸階層の闘争を結合して、党の指導力を強め、さらに反独占国民戦線を結集するためには、大衆に対する思想教育と宣伝活動がきわめて重要である
政治	戦線	ルーデンドルフは1916年8月から実質的に参謀本部を牛耳ったが、1918年3月からのカイザー戦まで1年7ヶ月全く東西両戦線で攻勢のイニシアチブをとらなかった
軍事	戦線	このように本来は軍事用の恐ろしいゲームで、洗脳訓練された軍人が戦線に送り込まれれば大きな戦果を上げられると期待されたが、冷戦の終結により、遂に本来の目的で使用されることはなかった
政治	戦線	その後「やまと労働党」、「やまと共産党 (左翼派)」、「やまと共産党革命左翼派神奈川県委員会」、「やまと共産党 (マルクス・レーニン主義)」(後の労働者共産党)、「やまと共産党 (解放戦線)」、「やまと労働者党」やらなんやらを結成したちうわけや
軍事	戦線	フランス国民戦線党首ルペンは、「殺人ガス室」は第二次世界大戦の歴史の中の「些事」にすぎないと発言した咎で、有罪判決を受けたが、彼の趣旨は、ナチスの「犯罪」はソ連や中国の収容所における共産主義者の「巨悪」と比べると不当に誇張されているというものであった
軍事	戦線	そのため、中国戦線における捕虜の取り扱いは任意で実行されることとなり、結果として捕虜の処刑や政治活動の強要など、国際法上違法とされる行為が日中両軍ともに多発した
軍事	戦線	しかもあのナルヴァ戦線の話を読むと、どうもこれはぼくらが考えていた戦闘とは違うやり方が行われていたらしいので、なんとかして自分がわかりたいというのが大きかったんです
軍事	戦線	ユタ州ボンネビル乾燥湖を舞台に絶対速度記録の更新を目指す男達の姿を描いた「サンダーボルト」、泥沼化した戦線のなかで生き抜く第51突撃ヘリ中隊、コードネーム“コブラ”所属のケン日向を描いた「コブラ11(イレブン)」、将軍とモサク、2人の陽気なトラッカーを中心にしたアクションコメディ「ダブル・ニッケル」シリーズを収録
政治	戦線	ハビャリマナ=ウィリンジイマナ政権は依然フツ主体であり、ツチ主体の反政府勢力であるルワンダ愛国戦線(RPF)との和平協定締結を如何に成功させるかという難題を抱えていた
政治	戦線	だから、そういうことを前提にしてですが、私は最後的にはこの状況のもとでは壮大な戦線をつくること、そして国民の大多数が当面している橋本政権、支配層と闘っていくというために全力をあげること、この状況下では、それが政党にとって最も大事なことだと思います
軍事	戦線	そこにはあの東京軍事法廷で連合国により「A級戦犯」などという汚名をきせられて、絞首刑にされた七人の国家指導者のかたがたの遺骨や、大東亜戦争における各戦線で無念のうちに戦死された多くの英霊のかたがたが祀られている場所であるからだ
その他	戦線	単行本も2巻は、かなり厚くって、出すの躊躇したくらいなんですが、『ポップコーン戦線』は、未成年のかたでご覧いただけないかたもいるってことで掲載しました
軍事	戦線	レジェンド・オブ・フォール、アンザックス、ジョニーは戦場へ行った、ツェッペリン、ブルー・マックス、武器よさらば、突撃、ヨーク軍曹、西部戦線異状なし、担え銃、
軍事	戦線	そして、後のモスクワ戦線では激烈な戦闘の結果、最終的にロシアが勝利を収めたのだが、そのときには、ようやく世代交代がなされ、次世代の優秀な軍人たちが指揮をとっていた
軍事	戦線	ナレーション (N) : (大盾を構えた部隊が脇から流れ込んだり、あるいは後方から開いた空間に牽制の射撃を打ち込んだりして、ゆっくりと相手の戦線を引き込んで——)
軍事	戦線	しかし決定的な能力不足と言う問題は残ったままで、1号戦車と同じく急速に戦線からその姿を消していく事になる筈だったのですが、1号戦車よりも僅かにパワーがあり車体が大型だったのが幸い
政治	戦線	東ティモール出身のフランシスコ・フェルナンデス・ダシルバ議員(ゴルカル党)は、「独立というが、国連から東ティモール独立革命戦線(フレティリン)へ独立を委譲するだけだ」と語り、新政権指導部がフレティリン出身者で占められていることを批判した
政治	戦線	【タイ】バンコク救急センターによると、バンコク都心部で13日夜に始まったタクシン元首相派団体「反独裁民主戦線(UDD)」と治安部隊の衝突で、14日午後10時までに、死者8人、負傷者120人以上が確認された
軍事	戦線	西部戦線も独ソ戦もアフリカ戦線も放り投げて、太平洋戦線に主力投入して参加するドイツ軍という架空シナリオのある第二次世界大戦のゲームというものを想像してみなよ
政治	戦線	このような連邦政府の傲慢な政策は、再びスペースノイド全体の反感を買い始め、廃棄される予定だったものの予算が足りなくなり、放置されていたスウィート・ウォーターの旧ネオ・ジオン軍事施設が革命軍に制圧された後、これを拠点に、宇宙世紀0107年、[ロード革命戦線]が地球連邦軍に宣戦布告し、反旗を翻した
その他	戦線	日本人拉致問題をテーマに、東京都内で12日に開かれたシンポジウム「北朝鮮の現状と拉致被害者の救出」(家族会、救う会、拉致議連主催)に、北朝鮮の朝鮮労働党の対南工作機関「統一戦線部」出身で現在、韓国の情報機関、国家情報院傘下の研究機関で北朝鮮分析を担当する張哲賢氏が参加した
政治	戦線	ベトコン(ベトナム解放民族戦線)兵士による残虐な行為を描いたことに対しては、その後ベトナム側から反発もあったようで、もちろん私にはそのような行為が行われたかどうかなどということはわかりませんが、戦争というのはそういったこともあり得る状況にさせてしまうのは確かなのでしょう
その他	戦線	【バンコク共同】バンコク最大の繁華街を占拠し反政府デモを続けるタクシン元首相の支持団体「反独裁民主統一戦線(UDD)」に対し、タイ政府が5日、退去を命じるよう民事裁判所に申し立てた
その他	戦線	全国政治協商会議副議長であり、中国共産党中央統一戦線部長の杜青林氏はこのほど北京で、ダライ・ラマの特使であるロディ・ギャリ氏とケルサン・ギャルツェン氏の一行と会談を行った
その他	戦線	そして、いきなり首位戦線に踊り出たものの、いままでの10年間、万年最下位、万年負け犬、万年「開幕から1ヶ月でシーズン終わり」だったチームが、いきなり毎試合、全力プレーのフル馬力で突っ走ったのだから、息切れするのは当然である
政治	戦線	同じ学園に通う天才魔術師の遠坂凛と共同戦線を張り、他のマスターに対抗する士郎だったが、凛のサーヴァント「アーチャー」から、なぜか激しい敵意を向けられる
政治	戦線	そして、国民経済を守る政府を求める広範な戦線を形成することが可能であり、そのために国民運動とその先頭に立つべき労働運動の前進が重要であり、それらのために奮闘すると訴えた
軍事	戦線	これなどは近代の航空機が発達した時代の戦例、中国戦線でのゲリラ戦の例や、三国志演義に代表されるような大陸での戦例から想起したと思われるものなのですが、日本の戦国時代にはほとんど実例がみられないものです
政治	戦線	事実、黒田をはじめとする反革命の卑劣な頭目ども、学生戦線や労働戦線のこまっちゃくれた小官僚どもは、うわべの空威張りとはうらはらに、開始されんとする春期大攻勢のまえに完全にビビリはじめているのだ
政治	戦線	1947年には人民政府保護法が制定され、更に同党の権力が強化されるとともに、農民同盟を除き、連合組織「祖国戦線」を構成していた他の政党は労働党に吸収されるか解散することになります
軍事	戦線	中でもアフリカ戦線の主役である戦車や対空戦車といった装甲車両のモデリングは、砂漠戦特有の錆やテカりなども含め、抜群のディテールで描かれており、戦車ファンにも納得のクオリティに仕上がっている
その他	戦線	右ひじの疲労骨折で戦線を離脱していた錦織圭君自身のブログおよび所属事務所が試合復帰を報告ホノルルで行われるチャレンジャーツアー大会にエントリー10か月ぶりの公式試合復帰をぜひ白星で飾ってほしい怪我には十分注意してねテニス肘をしっかり治す7つの秘密結果を出
軍事	戦線	学生を戦線に出さねばならないほど戦局は窮迫していたのだが、「学徒出陣」というりりしいことばで飾りたて、若者の多くは使命感に酔って新しい世界に入っていった
政治	戦線	それでもヨーロッパ連合について取り上げる時、ヨーロッパ連合をすべての悪とみなす国民戦線の指導者達にとって、ヨーロッパ連合の悪を語る絶好の機会である
政治	戦線	組織部、宣伝部、統一戦線工作部、対外連絡部、弁公庁、政法委員会、政策研究室、台湾工作弁公室、中央党学校、人民日報社など20の部門に分かれている
政治	戦線	とりあえず今のところ表に出ているのは、ロシアとドイツぐらいですが、このゲームでは 1941 年から 45 年までの欧州戦線がテーマになっており、いずれ英米仏といった国についても順次用意がされることになるようです
政治	戦線	01 北朝鮮3紙が共同社説、「主攻戦線は農業戦線である」とし、「すべてのことを農業に服従させ、農業部門に必要な労働力と設備、物資を最優先的かつ無条件で供給すべきだ」と訴える
政治	戦線	ポリサリオ解放戦線はアルジェにサハラ・アラブ民主共和国の亡命政府を作るとともに、アルジェリア領内の難民キャンプと内陸の砂漠の「解放区」を出撃拠点にしてゲリラ活動を続けた
その他	戦線	第1次大戦を描いた文学作品として、ドイツ側の『西部戦線異状なし』に並ぶ作品として評価されているそうですが、日本での知名度は余り高くないように思います
政治	戦線	この国会議員候補者名簿は、ベトナム祖国戦線が中心になって、あらかじめ割り当てられた枠に従って政府各機関、軍、社会団体等から推薦を受けた者及び団体の推薦を受けない個人の立候補者の申請に基づいて作成することになっているため、侯補者名簿の作成時に実質的な候補者の審査が行われることになり、場合によっては候補者名簿への登載が却下されることもあると言われている
政治	戦線	更に、共産党は、労働組合員の政党支持の自由を名分に、「特定政党支持の義務づけ」の枠をはずすことを主張しつつ、労働者・労組への勢力の浸透に努めるとともに、「一工場一労組、一産業一産業別組織、一国一中央組織」の原則に基づく労働戦線の統一を目標にして、総評や主要労組への党の影響力の拡大を狙う諸活動を推進した
政治	戦線	発表の日を決めたんだったらその日までは絶対個人は出さないとか、また、討論会というものの位置づけを重くするんだったら事前には出さないとか、討論会にどうやってエネルギーを集中するかというところ、そういうのも統一的な何か戦線を組めてなかったですね
軍事	戦線	超大国に加えインドシナ半島の周辺国にまで見放され、「クビまで泥まみれ」になって抜け出せなくなった戦況下で、米国はさらにカンボジアでのロン・ノルのクーデターを支援し、北ベトナムと解放戦線の補給路となっていたホーチミン・ルートやシアヌーク・ルートの寸断と兵站拠点の攻撃という、さらなる深みへと進もうとしていました
軍事	戦線	かってヴィットリオ・デ・シーカ 監督「ひまわり」にてソ連戦線ウクライナで行方不明になった夫マルチェロ・マストロヤンニを探し求める女ソフィア・ローレン の執念を画いた名作がある
政治	戦線	この結果を受けて、本命馬不在と言われた4歳牝馬戦線はようやく収束に向かうと思われたが、オークスはコスモドリーム、エリザベス女王杯(現在の秋華賞にあたる)はミヤマポピーが制し、混戦のまま同世代間のバトルは幕を下ろすことになる
政治	戦線	そして、地方から始まった革新統一戦線の運動が、国政にもおよび、日本共産党と日本社会党との党首間で、3回にわたって革新統一戦線をめぐる合意が結ばれるまでにいたりました
政治	戦線	当時トルコのプリンキポに亡命していたトロツキーは、一九三〇年九月国会選挙の直後、押し迫るファシズムの危機にたいして警鐘を乱打し、ドイツ共産党はコミンターンの第三回、四回大会によって決定された方針に立って即時社会民主党と労働組合に統一戦線を申込まねばならぬと叫んで、その実際的な綱領をはっきりと示した(トロツキー「コミンターンの転換とドイツの情勢」)
政治	戦線	これらの課題について、一致できるテーマで統一戦線、政治戦線を結成する、労働党の皆さんが中心になり、われわれもいくらかの力を発揮して、国民連合の皆さんと同じように、全国にこのような政治戦線の統一をつくっていきたいと思います
政治	戦線	メキシコ真正労働者戦線(FAT)は、地理的に遠く離れていようとも、大会代議員の皆さんが我々からの連帯を感じることができるよう、大会にその心は出席しているつもりです
軍事	戦線	日本帝国軍がビルマ戦線において敗退した要因の一つにカレン族による勇猛な戦いがあるが、戦後大英帝国はカレン独立国家を認めず、また大英帝国から独立したビルマ国のネウインやアウンサンもカレンの独立を認めず、為にカレン独立戦線やシャン独立戦線が未だにビルマ政府に対する武力抵抗を続けている
政治	戦線	当時、共産党は「共存可能」と判断する勢力を陣営内に取り込む「統一戦線」づくりを重視しており、傅作義も1949年9月に設立された中国人民政治協商会議の第1回全体会議で、全国委員(議員)に選ばれた
軍事	戦線	実はこの作品は以前に国内でも『ジャングル・ヒート/戦慄のベトナム解放戦線』(84)のタイトルでリリースされていたようなんですが・・もしそれが事実ならこれは日本語字幕付きのビデオを是非ゲットしたいですねー
その他	戦線	普段はハッスルダンスなんだが、作戦命令をいのち大事にで行かなければ無理なので(呪文使うなだと半分切るまで回復しないため死人が多数出て戦線が崩壊する)時々使うベホマやスクルトの消費すら地味に痛い
政治	戦線	1996年、モロ国民解放戦線(MNLF)はフィリピン政府との和平協定を締結して武装闘争を終結し、フィリピン政府はミンダナオ地区にモロ国民解放戦線(MNLF)のイスラム教による自治を受け入れ、現在はミンダナオ・イスラム自治区の与党として活動している
政治	戦線	帝国への備えを怠れないルフェニア王国、国内の反乱への備えにまだ気が抜けないクデナ王国、同盟海軍を王都に抱えるカルディア王国、そしてさらにはアルザス皇国との戦線
政治	戦線	インド人進歩戦線IPF党は明日から5000人ほどの大議員を集めて党大会を開きますが、開会式のあいさつをUMNO副総裁のアブドラ副首相ガ去年に引き続いておこないます
政治	戦線	リッチ・フランクリンとマット・ハミルは、聴覚障害のあるハミルと人気のフランクリンという注目の試合で1R押していたハミルが2R途中のローブローから失速、最後は3RミドルキックでKO負け、”数学教師”フランクリンもタイトル戦線に浮上した
軍事	戦線	それがドイツを破滅に導いたのであるが、それ以前のナチスによる経済政策は、いまの日本にも参考になるという著者の意見にはうなずけるし、欧州戦線に加わることに消極的だった米国が参戦したのは、1940年半ば、ドイツが占領地域をマルク通貨圏とし、欧州経済新秩序を構想したからだとの指摘も鋭いと思う
政治	戦線	1日、北朝鮮事情に詳しい消息筋によると、昨年11月、開城(ケソン)で2度開かれた南北首脳会談開催を話し合う統一部と統一戦線部の秘密会談が決裂した後、12月に北朝鮮が与党重鎮A氏と接触し、首脳会談の開催を求めた
