# 軍事: 戦闘の最前線。交戦の区域。, 政治: 政治運動や社会運動で、闘争の形態をたとえて言う語。労働戦線
政治	戦線	【バンコク西尾英之、矢野純一】タイの首都バンコクで激しい反政府抗議行動を続けてきたタクシン元首相派組織「反独裁民主戦線」(UDD)は14日、抗議デモの中止を決定
政治	戦線	南部ミンダナオ島マギンダナオ州で反政府勢力「モロ・イスラム解放戦線」(MILF)の一部部隊と国軍の間で26日から2日間、戦闘があり、MILF側20人、国軍側7人の少なくとも計27人が死亡したと発表した
政治	戦線	2009年11月、ファラブンド・マルティ民族解放戦線(FMLN)の、マウリシオ・フネス大統領が就任することによって、米州人権委員会(CIDH)の、ロメロ事件の真相解明をエルサルバドル政府の責任とした勧告を受け入れることになった
政治	戦線	」と社説に書き(小心中国対台的両手策略)、李登輝率いる「台湾団結連盟」は「これは台湾を分断するための戦術だ」と批判し、国民党も「統一戦線のために使い古された手口にすぎない」と一蹴した
政治	戦線	コードギアス 反逆のルルーシュ 1ディートハルトよりもたらされた情報・・・日本解放戦線の本拠地がある成田連山にブリタニア軍による襲撃があるとのこと
政治	戦線	2月28日、東アジア反日武装戦線の3つのグループが、東京都港区北青山の間(はざま)組本社ビルと埼玉県与野市(現・さいたま市)の間組大宮工場を同時に爆破
軍事	戦線	太平洋戦線ではソロモン戦線前期すでに、攻撃機・爆撃機、船団上空の掩護を担当する戦闘機隊は空戦戦闘に入ることは許可されず牽制(けんせい)し蹴散らすまでで、空戦戦闘に入って離れたため攻撃隊や船団が被害を受けた際の行動評価は低く評点された
政治	戦線	しばらくの安定の後1970年には新米のロン・ノルがクーデター決行し政権を奪取しましたが、中国に脱出していた国王が結成した「カンプチア民族統一戦線」とともに共産主義勢力「クメール・ルージュ」との5年間に及ぶ内戦に発展し、多くの人々が都市部から避難する事態となりました
政治	戦線	1945年の6月、根こそぎ動員(1941年当初、旧満州の日本軍は70万人に達していたが、1945年までに主力部隊は南方戦線に転出させられ、6月には旧満州にいる成年男子35万人は、行政・警備・産業に携わる10万人を除く、25万人が現地招集された)により、入植地に残った27万人は、村の指導者を除けば、老人や女・子供だけだった
政治	戦線	1969年、68年に三派全学連から中核派が離脱した後のいわゆる反帝全学連が機能停止に陥っていた中、「プロレタリア統一戦線の一翼としての全学連運動」をかかげた第二十回定期全国大会を開催し、ここに解放派系全学連が誕生した
政治	戦線	2月2日、国務院新聞弁公室主催の記者会見に出席した中国共産党中央統一戦線活動部の朱維群(ジュー・ウェイチュン)常務副部長らは、ダライ・ラマ14世の個人代表との交渉状況について報告した
政治	戦線	さらに時をおかずエル・ファラド解放戦線を名乗る謎の団体から、身代金の要求が─┌錯綜する情報に挑むシャヒーヌ管制官は背後により大がかりな陰謀の臭いをかぎつけるが─┴
政治	戦線	この動きは3、4年も前からあって、昨年11月に岡山でやった広島∨S岡山解放戦線の広島版にあたるが、このシーンはかなり前から何かを起こし時代を作りたいという有志だちが交流し出来上がっていったように思う
軍事	戦線	(1)クチトンネル 南ベトナム解放戦線(ベトコン)の作戦本部が置かれていたクチには、1948年から20年間かけて手で掘り進んだ地下トンネルがあり、現存している
政治	戦線	それからマグリットではないんですが、ディオとサ(ウ)ンドマンが共同戦線を組むくだりで背景になっていた階段は、赤瀬川原平いうところの「超芸術トマソン」ではないでしょうか
軍事	戦線	時は第1次世界大戦の戦線拡大でドイツ軍との中国・青島(チンタオ)での攻防で日本軍が勝利し、ドイツ人捕虜を日本国内の収容所に分散収容した徳島県鳴門にあった収容所での話しである
その他	戦線	初日全勝を果たした黒田正城、そして決勝ラウンドまで勝ち進んだ鹿田暢亮と森田雅彦らが共同で調整したバージョンの完成度の高さは今後のPTQ戦線を占う上では特に注目だろう
軍事	戦線	柴田勝政軍は多くの犠牲をだしながらも佐久間盛政軍と合流し、権現坂まで引き返そうとしたその時に、その権現坂の防備を後方を固めていた前田利家の軍2000が突然戦線を離脱します
その他	戦線	『噂の真相 91年9月号』200円「証券大スキャンダルの真相」「週刊テーミスが突然の休刊」「解禁日には採用決定のマスコミ就職戦線」「フジVS TBS怨念の視聴率戦争の断面」並
政治	戦線	情報筋の情報によれば、2001年夏、タリバンと直接接触に入ったウズベキスタン・イスラム運動の軍事指導者は、タハール州のいわゆるタルカン戦線司令官に任命され、自分の支持者、並びにアラブ人、パキスタン人、チェチェン人を含む傭兵から成る「国際旅団」を集めた
政治	戦線	アメリカの政財界のお偉方の視点からすれば、石油の確保やら米ドルの圧倒的な優位性と言った、二〇世紀にアメリカが世界の帝王であった事の源泉力であったことがらの確保やら権力を維持するためには、無謀な軍事力と戦線の拡大を息絶えるまで続けるしかなくなっている
政治	戦線	制定と実戦配備は日本が守勢にまわった後のため、常に戦線の先端に配備された二式水戦に比べると「強風」の実戦でのエピソードは少なく、むしろ紫電、紫電改の母体となったという点で記憶される機体となりました
軍事	戦線	中内氏は戦争中に飢餓戦線を戦ったトラウマから兄弟も信用できないほどの人間不信だったといわれ、ダイエーのトップ退任前は2人の息子(潤、正)と娘婿らで要職を抑えていた
政治	戦線	この年、ロッテは小宮山悟、黒木知宏、武藤潤一郎といった先発陣が活躍していた一方で、それまでダブル看護師 転職として活躍していた成本年秀、河本育之がいずれも故障により戦線離脱し、リリーフ陣が弱体化していた
政治	戦線	元チェス世界チャンピオンで統一市民戦線のガルリ・カスパロフ、人民民主連合代表のミハイル・カシヤノフ元首相、ロシア共和党のウラジーミル・ルイシコフ党首らのような自由主義者、国家ボリシェヴィキ党のエドワルド・リモノフ党首のような極右・民族派、赤色青年前衛のような極左・急進的共産主義者に至る野党指導者が参加している
軍事	戦線	アメリカは50万の地上軍を投入し、韓国・タイ等の派遣軍も加わり、北ベトナムも正規軍を南下させて、解放民族戦線を援助し、国際紛争に発展したのでした
政治	戦線	2週目は仲間を全員集めるためにグレンを仲間にせず、スラッシュも入れずにアルフを仲間にしてたんですが、クロノクロス入手後めでたくグレンとスラッシュが戦線に復帰しました
軍事	戦線	それはムッソリーニがパルチザンに捕らえられて処刑され、その二日後にヒトラーがベルリンで自殺し、第二次世界大戦のヨーロッパ戦線が収拾するちょうどひと月前のことでした
政治	戦線	それ以降、西部戦線を指揮されておられるアサノ大総統閣下は、連合軍が空軍マーカーを敷き詰めるのが終了する度に、下に味方ユニットが潜んでいないかを確認するために、いちいちマーカーをめくり直す羽目に陥ったのであった
その他	戦線	スキナーの行動主義を拒否したことがあったが、いま再び政治・人間関係における行動主義を基礎とする「科学」に挑戦する(そして、事実、国防長官マクナマラのコンピューターによる作戦は、北ベトナムや民族解放戦線の鉄の意志の前に敗退したではないか)
その他	戦線	それが一転、95年にランサーエボリューションIIIを投入すると一気に優勝戦線に絡むようになり、翌シーズンはトミ・マキネンがドライバー部門で優勝を挙げた
その他	戦線	このことで最初はゼロでも根気よく積み重ねれば、必ず結果がついてくることを学び、ジュニア戦線で活躍したのちには、冷遇から一転、長州氏の配慮で一気に年俸を上げてもらったという
政治	戦線	中国国営新華社通信によると、中国共産党統一戦線工作部の杜青林部長は1日までに、チベット仏教の最高指導者、ダライ・ラマ14世の特使と会い、ダライ・ラマ側が求める「高度な自治」を憲法違反と断じ、党の指導でチベット経済が発展
政治	戦線	イスラム最大組織であるモロ民族解放戦線(MNLF)の分派であるミスアリ(前MNLF議長で現在拘束中)前議長派を支援しているイスラム過激派アブサヤフが「アロヨ大統領へのバレンタインのプレゼント」と犯行声明
政治	戦線	チェウシェスクを処刑した反政府・革命勢力=救国戦線=後に政権を掌握=は、チャウシェスクは6万人にも及ぶ大量虐殺を犯し、10万ドル以上の不正な蓄財をしていたと大々的に宣伝しますが、後に冷静に調査してみると事実無根に近かったりするそうです
政治	戦線	かれは抗日民族統一戦線についての毛主席の輝かしい思想に気違いのように反対し、階級投降主義をさかんに実行して、共産党が統一戦線にたいする指導権を放棄しそれを国民党反動派に譲り渡すよう公然と要求した
その他	戦線	少なからぬ同輩友人知人縁者達が、脳梗塞、心筋梗塞、肺癌、肝臓癌、静脈瘤、業務不振、蒸発等々で戦線を離脱してゆくなか、「網膜剥離後遺症」を抱えるものの、何とか無事に、マアマア無事に誕生日を迎えることができる訳である
政治	戦線	昨年3月の総選挙ショック以降、マレーシア人民は、それまでのように簡単には民族分断政治を受け入れることはなく、UMNOが民族問題を持ち出したとしても、マレー系住民の支持を得ることはできず、国民戦線に参加する華人政党によるイスラム党に対するデマでたらめを信じる中国系住民もいない
政治	戦線	全解連が発行した『21世紀をめざす部落解放の基本方向』で、統一戦線・革新統一戦線の用語の出てくる箇所は、○「解同」は統一戦線勢力でない、○部落問題の解決は運動が統一戦線の一翼を担うことで可能である、○当面の課題である国民融合の促進、独占資本と反動勢力に対する民主的規制は、民主的な政府によって完全におこなわれるが、その政府を築く革新統一戦線の強化をめざす、という部分です
軍事	戦線	南方戦線従軍体験をお持ちの方に『ミュージカル南十字星』を是非ご覧いただきたく、東京公演期間中にご招待申し上げますので、どうぞ下記までご一報ください
軍事	戦線	真珠湾攻撃から当初の半年間、破竹の進撃を続け、東南アジアから西太平洋を席巻した帝国陸海軍は、四二年六月のミドウェーにおける敗戦から三年間、一度も勝利の可能性をもつことなく、太平洋における戦線は徐々に縮小していった
政治	戦線	「祖国統一民主主義戦線(祖国戦線)のスポークスマンは4月1日、米国と南朝鮮当局が最近、平沢米軍基地建設を2011年までに終え、ソウルの竜山にある米軍基地と米第2師団の移転、平沢米軍基地建設に必要な資金およそ100億ドルのうち、半分以上の56億ドルを南朝鮮が負担すると「最終合意」したことを非難する談話を発表した
政治	戦線	丁度その頃、高度経済成長政策の綻びが各所で生まれ始めており、これら諸要因に呼応して、丁度団塊の世代が青春を迎えており、この世代が遂に全共闘と云う日本左派運動史上初の共同戦線運動を創出しました
その他	戦線	等々)そのものについて触れられるでもなく、戦線を構成する個性豊かな愛すべきメンバーも此処の事情については、ほとんどフォローされる事もなく、さっさと成仏させられてしまっていました
軍事	戦線	それにしても、パキスタンは、インドと牽制しあったりアフガニスタン戦線の壁になったりと、お隣さんに悩まされたり、イナカの方では保守派が「女子が学校行くのイクない
軍事	戦線	大国から外注先に指名されて下請けで軍人・軍隊を日本列島から外に出すとすれば(韓国がベトナム戦線に軍を派遣したように)、先人の犠牲の上に作り上げた62年間の日本人の武器を用いない国の運営という近代史に初めての人類の体験を自らすてることになる
軍事	戦線	第2次大戦前には米・財務省に勤め、ルーズベルト大統領のニューディール(政策)に従事、若手花形官僚として活躍、開戦後、歩兵将校としてヨーロッパ戦線に参戦、南フランスでは落下傘部隊として従軍、中佐となり、日本降伏時は、米・陸軍省民政部に勤務していた
政治	戦線	メガフレアを通したらこちらの戦線が崩壊してギャストリが使いづらくなってしまうし、フランを落として確実に行きたいと思っても、やはり盤面的にかなり不利になってしまうといった状況で、殴り勝つ可能性(今引き輝夜、永琳砲+木の葉隠れ)と3枚目の除去を引く可能性(猶予4ターン+ディゾのドロー
政治	戦線	1970年代からクメール・ルージュの革命運動に参加していたが、ポル・ポト派が主流となったことからベトナムへの亡命を余儀なくされたカンボジアの政治家で、1978年、ヘン・サムリンらのカンボジア救国民族統一戦線に参加してヘン・サムリン政権の発足に尽力し、85年には首相兼外務大臣、93年6月には暫定国民政府においてラナリット第一首相とともに第二首相となったのは誰
軍事	戦線	ヘッドスカーフ・ヘッドリングなどアフリカ戦線仕様の制服に、ジェリカン、スコップ、つるはし、ゴーグルなどのアイテム他、装備武器にトンプソン・サブマシンガンが付属
政治	戦線	12:29 7/19「革命記念日[ニカラグア]」1979年のこの日、サンディニスタ民族解放戦線が武装蜂起し、独裁政治をしていたソモサ大統領を亡命に追い込んだ
政治	戦線	ところで、やはり二面性をもった民族ブルジョアジーに対するマルクス主義政党の立場は、自らは大衆的基盤に依拠しつつ、政治的局面によっては統一戦線を形成するというものであるべきであった
政治	戦線	北部はイサク氏族によるSNM(ソマリア国民運動)、中部はハウイエ氏族によるUSC(統一ソマリア会議)、南部はマレハン氏族によるSNF(ソマリア国民戦線)の3つの支配地に分裂する
政治	戦線	現在の条件下では、党をしだいに発展させながら、他勢力との連携を模索することが実際的で、自民党的政治と闘う広範な戦線を構築する上からも必要なことである
その他	戦線	“一度、敵味方に分かれて戦線をひらいて後の戦線離脱”は「二心」にあたるという批判があったとして、おそらく頼政は、信西の独裁政治への叛乱の段階(クーデター)と、清盛が六波羅に入って二条天皇を保護した段階とは、同じ戦線とはいえない
政治	戦線	人による最大規模春闘スト70年労働戦線統一を目指す産別横断組織、全国民間主要労組委員長懇話会発足73年54単産、350万人が参加で年金制度の改善を求めた全国統一スト74年統一戦線促進労組懇談会結
軍事	戦線	作戦計画はシュリーフェン・プランに沿ったものであったが、ベルギーでの飛行機墜落事故で作戦計画が連合軍に漏れてしまい、第一次世界大戦中に西部戦線で悲惨な塹壕戦に従軍し、シュリーフェン・プランに内心不満を抱いていたヒトラーの後押しで、エーリッヒ・フォン・マンシュタイン マンシュタインの作戦計画が採用された
軍事	戦線	田中先生が徴用となった第二班と較べ、この第一斑目の派遣はまさしく戦線の伊吹とともにあった訳で、現地における熱烈な歓迎も、その時点では全く大東亜共栄圏の趣旨に違ふところのない「解放軍」に対してであったもののやうです
軍事	戦線	差出人の「東アジア反日武装戦線」という組織(各反日団体の集合組織)は、過去東京丸の内企業連続爆破事件で300名以上の日本国民を殺傷したテロリスト集団です
軍事	戦線	1973年の和平協定の後、アメリカ軍が撤退を続ける一方、その後北ベトナム軍と解放戦線と民族統一戦線軍との三つが主体となって、南ベトナム軍やロン・ノルのクメール共和国軍との戦闘を開始した
軍事	戦線	ギャツビー(ロバート・レッドフォード)には、青春時代に心から愛した女性デイジー(ミア・ファロー)がいたが、彼がフランス戦線に従軍し戻って来た時には、彼女は大富豪のトムと結婚してしまっていた
政治	戦線	バスから降りてその件はどうやら片を付けたのだが、そのあと待っていた会議は、医者が次々辞めていく病院がどうしたら戦線を縮小し、次の飛躍までを耐えてやり過ごすことができるのかという、なんとも気の重くなるテーマを抱えたものだった
政治	戦線	チェンマイ県内においては、アピシット首相の来訪に反対する反独裁民主戦線(UDD)が11月29日に大規模な集会・デモ等を予定するなどの動向が見られ、また、11月26日には、チェンマイ県内において、爆発物等を所持しているUDDメンバーが警察に検挙される等の動きがありました
政治	戦線	憂うべきこのような風潮に厳正に対応するために、われわれ自身の「理論戦線」の構築および言論手段を確保することの切実さを、殊のほか痛感させられる昨今である
政治	戦線	13 北ベトナム代表団を向かえた南側代表は、ファム・フン南部委員会書記、グエン・フート解放戦線議長、フイン・タン・ファト革命政府首相、チャン・バン・チャ上将、グエン・チビン革命政府外相など
政治	戦線	意味することはご察しいただけると思うが、とりあえず参院選では自民党(与党)の議席減のための選択的投票をおこなう、同時に、つぎなる段階での改憲阻止統一戦線的なものの形成への展望を探るということである
政治	戦線	祖国統一民主主義戦線中央委員会は、ハンナラ党の根であり、元祖である歴代ファッショ独裁政権が働いた反人権、反民族、反統一犯罪を再度全世界にことごとく暴露し、ハンナラ党の醜悪な正体を正しく知らせるため、この告発状を発表する
政治	戦線	このツァーにツーヅー病院のタンさんほか3名も同行して、南ベトナム解放戦線当時の前線基地を再現した場所も見学、戦争当時の説明を聞いて困難な戦いに感銘を受けたのである
政治	戦線	拉北者のなかで、南で活躍していた有力な政治家たちは、1946年7月に結成されていた「祖国統一民主主義戦線」や、1956年7月に結成された「在北平和統一促進協議会」に組み込まれて対南工作活動に従事していた
政治	戦線	西アフリカ諸国を転々と移動した後、1987年にリビアで革命のためのゲリラ養成訓練を受け、1991年には主に、黒人イスラム教徒を中心とした反政府勢力RUF(統一革命戦線)を組織、シエラレオネを内戦に巻き込むこととなった
政治	戦線	これがGMに追いつけ追い越せと躍起になって国際企業として拡大を焦ってきた結果の失敗だとしたら、同社に限らず、世界に戦線を拡大していかざるを得ない多くの日本企業にとっては、今回の問題は多くの問題を提議しているように思えてなりません
政治	戦線	)ル・ペンは国民戦線から国民運動連合に支持を変えた人に対して、サルコジは経済不振に責任があり、極左派なのだという論拠を用意していることを明らかにしている
軍事	戦線	【マニラ共同】フィリピン政府と、同国南部の反政府武装勢力モロ・イスラム解放戦線(MILF)は2日、昨年8月に決裂した和平交渉を今月8日に再開するとの共同声明を発表した
その他	戦線	また太平洋戦争において東南アジアは資源確保が大きな目的であったことを認め、戦線、戦略的に必要だったとしている言辞こそ国防の域を越えた侵略肯定とも受け取れる
その他	戦線	最近のDグレは、アクマが全く出なくなって「アクマの魂の救済」というテーマが霞んでいますけど、この巻でいう「戦線の内で愛を掲げるいとも可笑しい道化の姿」こそがDグレの真のテーマなのかな、と思いました
政治	戦線	(3)われわれは、資本と政党からの独立、一致する要求にもとづく行動の統一という原則を堅持し、相互の自主性・主体性を尊重し労働戦線の真の統一をめざすとともに未組織労働者の組織化に奮闘する
その他	戦線	幸いというか何と言うか、加藤が真意を述べてJUDAとの共同戦線を申し入れした際に、浩一達はともかく加藤機関の面子も承服しかねる描写だったのは良かったと思います
政治	戦線	「反差別」や「介護一辺倒」のドブ板選挙に没入してきた諸戦線の活動家にとって、「どんな困難があろうとも労働運動・労働組合運動に入っていく」などと中野一派がいくら号令をかけようとも、まさに馬耳東風でしかないのだ
政治	戦線	アジア諸民族の独立を促したとの異論もあるが、帝国主義の植民地体制を打破する重要な契機となったのは占領地域の民衆が抗日のための民族的な統一戦線を結成、武装抵抗を行ったところにあるのであって、日本は「帝国主義的植民地体制」の元締だったのである
軍事	戦線	中国戦線/警察庁装備課長時代/第一次安保騒動/警察機動隊整備 三ヵ年計画/第二次安保騒動 大学紛争/第二次安保と京都の状況/激化する第二次安保情勢/京大時計台の封鎖解除
政治	戦線	中国では共産党中央統一戦線工作部や国務院国家宗教事務局などが宗教活動を統制、管轄しており、公認組織のプロテスタント系信者が1600万人、カトリック系が530万人とされる
政治	戦線	35年に共産党は「抗日救国のために全同胞に告げる書」(通称、「8・1宣言」)を発表して内戦停止と統一戦線の結成を呼びかけ、北京の学生を中心とした愛国運動が次第に全国に広まった
政治	戦線	父の開いていた祈祷会では、みんなポロポロという言葉にならない祈りをさけんだり、つぶやいたりしていた――表題作「ポロポロ」の他、中国戦線での過酷な体験を描いた連作
