# 軍事: 戦闘の最前線。交戦の区域。, 政治: 政治運動や社会運動で、闘争の形態をたとえて言う語。労働戦線
軍事	戦線	第二次世界大戦の欧州戦線を舞台とし、連合軍によるノルマンディー上陸作戦の後、主人公のミラー大尉に課せられた危険な任務と8人の部下を失いながらも軍の命令に従う葛藤が描かれる
政治	戦線	党指導部の建設とその指導の質の強化、党の指導系統の建設と、それをとおしての党の中央集権的な統一性の強化、非合法態勢の本格的な建設、労働戦線・学生戦線における党組織の建設とそれをとおしての党の政治的基礎の強化など、党建設のたたかいの重大な前進
政治	戦線	このように日中共産党の関係が悪化し、日本共産党の自主独立路線に反発するという名目で西沢隆二、安斎庫治、原田長司、大隈鉄二、福田正義ら親中共派が離脱、「日本労働党」、「日本共産党 (左派)」、「日本共産党革命左派神奈川県委員会」、「日本共産党 (マルクス・レーニン主義)」(後の労働者共産党)、「日本共産党 (解放戦線)」などを結成した
その他	戦線	そこで軍部は全力でギルドラドをせん滅、そして政治では外交で辺境銀河連合と交渉し不可侵条約の延長を締結、最終的には辺境銀河連合とは共同戦線を張る
その他	戦線	これまでロングヒエンの手綱を握ってきた河内騎手は、現時点での最強マイラーのニホンピロウイナーで秋のマイル戦線を戦うことにしており、今回は村本騎手がロングヒエンの手綱を取る
軍事	戦線	――先ず第一に、万人がアルキビアデスに等しい者となったら、将軍たちを必要としなくなるだろう(何を指図しても守り得ないだろうから)ということ、第二に、彼らは戦線を離脱する者たちを告発する方が、こういった連中のために弁明することよりもはるかにふさわしいのだということを
政治	戦線	カンボジアへ戻れなくなったシアヌークは、周恩来の斡旋で今まで宿敵だったクメール・ルージュと手を結び、カンプチア民族統一戦線を結成し議長に就任してしまう
政治	戦線	共産党支配期(1945年~1989年): 1944年9月9日の軍事クーデターで政権を得た祖国戦線政府は、1946年9月に国民投票を実施し、王政を廃止して人民共和国を制定しました
政治	戦線	阿部記者は韓国で死刑判決をくだされた辛光洙工作員の日本での活動をスクープするが、この記事をきっかけに第三の立て役者、朝日放送の石高健次氏が戦線に参加する
政治	戦線	そして、今後の展望を拓くために、「戦争と貧乏をなくす国民統一戦線的な運動が求められる」とのべ、そのために労働組合運動においても、地域・地方の運動が大きな役割を担っている
政治	戦線	1970年4月23日、北京において彼は、文化大革命と毛沢東にめちゃくちゃ影響を受けた共産系組織、クメール・ルージュとカンボジア民族統一戦線を結成する
その他	戦線	その生データが、アッテンボローさんにどう感じられたか、もしくは、最近の統一戦線の状況とで、関連があるのか、リンケージがあれば、その生の体験が活きると忖度します
その他	戦線	最初の文通/都ローマから/母国フィレンツェからの誘い/友情の危機—詩人のミラノ居住をめぐって/古典の探索と収集/自著の交換/ダンテをめぐって/キケロからホメロスまで—文芸復興のために/中世文化の継承/精神的危機—ボッカッチョの苦悩と詩人の助言/ペストの猛威のなかで/自由をめぐって/牧歌的なひととき/共同戦線/最後の文通—文学的遺言状
軍事	戦線	これはある程度事実で、42年、ドイツ陸軍が東部戦線のスターリングラードで大敗を喫したとき、連合軍と対等に戦っていたのはUボートだけだったのです
政治	戦線	これはまた、アメリカ帝国主義に反対する国際統一行動、統一戦線の強化、発展をかちとり、国際共産主義運動のマルクス・レーニン主義的強化と真の団結をかちとるためにも、さらに、日中両国共産党間の革命的連帯の伝統を守り、日中両国人民の真の友好の伝統を擁護するためにも、今日では、避けることのできないものとなっています
軍事	戦線	備後の鞆にいた足利義昭(実質的には毛利氏)に頼り朝倉家を再興しようと奔走した朝倉宮増丸、及び家督後継者と擬せられていた朝倉景忠がいるが、中国戦線の悪化により不成功に終わった
政治	戦線	MPDはかつて「日本学生戦線」という中国派新左翼セクトで、新左翼のクセに「北方領土返還運動」をやったために82年に全国で他の左翼から放逐され、行き場がなくなったのでMPDに改組して83年の参院選に出馬
政治	戦線	さらに、100人強の無所属議員のうちのかなりの数が「統一」に合流し、第7党のチェルノムイルジンの「われらの家ロシア」はもともと大統領与党、第5党のジリノフスキーの自由民主党は隠れ与党とよばれるほど与党に接近、「祖国・ロシア」は「統一」と共同戦線を張れないこともない、つまり第一党のロシア共産党を抑えてスムーズな法案・予算案通過が可能となる情勢が発生しました
政治	戦線	すでに国共合作(*第一次)が成立し、国民会議促進運動で統一戦線を形成しつつあった民衆は、5・4運動の経験を踏まえて、一致して様々な形で運動を展開し、各地で列強の軍隊あるいは軍閥軍隊と衝突して多くに流血事件が起こった
その他	戦線	回復に入るタイミングを謝っていた彼の耐久力全てを奪い去る、強烈な一撃は遼をも戦闘不能へと追いやり、ガタガタであった戦線はここにきて完全に崩壊する事となる
その他	戦線	「国内戦線弁護側はガザ地区の30km以内に生きている人々のために行動計画を作成しました、それらの地域に住んでいる人々には爆弾保護で射程内のままでいて、大きなグループで屋外で集まらないようにという厳しい指示があります」と、彼女が言いました
政治	戦線	一方、10の政党の連合体である野党側は「国民にとっての勝利だ」(民主戦線のズラビシビリ氏)、「7日の衝突前に大統領は決めるべきだった」(共和党のウスパシビリ氏)などと多くの指導者が評価、統一候補擁立を探る動きも出ている
その他	戦線	鍛え上げられた肉体と恵まれた身体能力で大日本のレスリング部門を牽引してきたが、2005年からはデスマッチにも積極的に参戦、タッグ戦線で存在感を見せつける
その他	戦線	▽(チベット自治区成立以降、特に中国共産党第13期中央委員会第4回総会以降の目を見張るような業績を高く評価し)目下のチベット情勢はきわめて良好だ、経済・社会発展の成果は顕著で、人民大衆の生活水準はたえず向上しており、さまざまな社会事業は全面的に発展し、社会は安定・団結を保ち、統一戦線と民族、宗教活動はたえず強化され、党の建設は新たな成果を収めた
その他	戦線	皆さん買いましょう、そして次の『東部戦線』も再版させましょう、さらに予定されていたはずのイタリア軍関連もこのさい作らせましょう(それは無理か)
その他	戦線	思えば昨年7月7日、蘆溝橋における一触が、正義の聖戦をおこしてより1周年、皇軍の進撃きわめて神速にして、すでに北支5省を完全に手中におさめ、中支にあっては江蘇、淅口、河南、安徽の主要都市を掃討しまして凱歌実に全戦線を圧し、意気すでに敵の中心地漢口を呑むの慨があるのであります
政治	戦線	パレスチナ民族戦線に対する強硬姿勢としてしばしば語られているのは、彼が、前にネタニヤフ政権では外相を務めながら、和平交渉の相手であるアラファト・パレスチナ自治政府議長との握手を拒否したことである
その他	戦線	レマルクの「西部戦線異常なし」にありましたが、走りながら銃を撃ったときの精度は、10メートルだったか30メートルだったか、大分近付かないと上がらなかったようです
政治	戦線	そして、共産党と社会民主主義政党との共同を軸に、広範な人民を民主主義的な共同綱領のもとに結集して反ファシズム人民戦線を樹立することをめざす統一戦線政策をうちだしました
政治	戦線	ダーレー大佐を指揮官とするダル・フォースという四百人ぐらいの部隊で訓練された共産党員百五十五名は、やがて中核となって各戦線のゲリラを指導することになります
その他	戦線	そして「われ戦線にあって、君馬と共に倒れたるを見て、既に戦死したるものと思ひ、この遺物を君の親かまたは縁故ある人に記念のために贈与せん考えなりし」と、人見さんに渡した
その他	戦線	わたしが会った厚生省の係官は、もと職業軍人で参謀本部にいたひとですが、戦線を離脱したら銃殺されるのが当り前じゃないか、譬えばゲバ棒を振回す学生を前に機動隊員が逃げたら免職されても仕様がないのと同じだなどと言っている
その他	戦線	皮肉なことに、その変身頻度の低下により「ディケイド」内でもレア化し始めた感のあるDCDクウガだが、これがシンケンジャーとの共同戦線で登場となると、良い意味での違和感が引き立つ
その他	戦線	ジャニーズの「中山優馬プッシュ」にテレビ局戦々恐々 大みそかに行われる「NHK紅白歌合戦」にジャニーズ事務所所属のユニット「NYC boys」の 出場が決定したことに、民放各局が戦線恐々としている
政治	戦線	第1章 諸前提(大衆政党への転成/党組織の概要)/第2章 ドイツ共産党の統一戦線運動の構造—1921年後半から1922年を中心として(労働運動内の統一戦線運動/統一戦線運動における政府構想—「労働者政府」論)/第3章 ルール闘争期のドイツ共産党—統一戦線運動の展開と挫折(危機の進行/1923年夏のドイツ共産党/10月の「蜂起」)
軍事	戦線	続いて、9月11日、陸軍3個師団 (九、十三、百一師団) 及び台湾満州の重装備部隊1個旅団と独立3個大隊が、上海市北方に増派されて戦線に加わった
政治	戦線	1 労働組合が経済合理性を持つとき(利益団体としての労働組合;政治経済と労働組合);2 連合誕生の光と影(改革の九〇年代;団体リーダーの見た労働政治);3 戦後史のなかの労働組合(「統一と団結」を求めて—一九四五〜六〇年代;第一次労働戦線統一運動の挫折—一九七〇年代1;民間労働組合の覇権—一九七〇年代2;中曽根行政改革と連合の誕生—一九八〇年代;利益団体政治と労働政治)
その他	戦線	UFCライト級戦線でホニ・トーレスが思ったような結果が残せていないこともあり、名門ノヴァとしても、その名に懸けてバラォンをバックアップするに違いない
政治	戦線	非常事態宣言の発令や、多くの死者と負傷者を出した10日のタクシン元首相派団体「反独裁民主戦線(UDD)」と治安部隊の衝突にもかかわらず、バンコクでも外国人旅行者が多いカオサン通りや歓楽街のパッポン通りを中心ににぎわっている
政治	戦線	2006年9月20日、大日本帝国の極右の首魁・安倍晋三が、神聖ヒロシマ共和国は東アジア反日武装戦線や日教組などのテロ組織を支援していると非難し、各国に波紋を呼んだ
軍事	戦線	これに対して、フランス・イタリアは、対独ステレーザ戦線を結成して警戒するも、宥和外交に走るイギリス保守党は、英独海軍協定によって、ドイツの再軍備とヴェルサイユ体制の崩壊を自ら認めてしまった
政治	戦線	(政務官を増員できる)肝心の内閣法の改正は見送られ、国家戦略室の局への法案も見送られ、土台ができない内に政務三役がドタバタと戦線を拡大し、始末におえなくなっているのが、現状ではないかと考えています
その他	戦線	射撃用豪と言うのは、射撃時に射点が発見されるのを防ぐためと攻撃されるのを防ぐために戦線が膠着した昼ごろにかけて作った深さ2メートルの円形の穴である
政治	戦線	チェチェン問題は、もはや民族の独立という悲願を離れ、住民の信仰するスーフィズムと全く相容れないワッハーブ派が外国から流入し、原理主義の拠点をつくることを目指して失敗し、北コーカサス一帯に戦線を広げた観が強くなっている
軍事	戦線	あまりに広範な地域に散開している戦線は、規模と苛烈さで目が眩みそうになるほどもの大きなものから、ここを死守することにどういう意味がある作戦なのか、直接配備された者にはさっぱり判らないものまでと千差万別
政治	戦線	第十回党大会にたいする中央委員会の報告案が強調しているように、今日わが党とそのすべての党員が、日本革命に責任を負う自主独立の立場を堅持し、現代修正主義と教条主義、セクト主義に反対する二つの戦線での闘争を強化することはいよいよ重要になっています
政治	戦線	米国の支援と中国国民の強い抗日運動に戦争は泥沼化し、加えて国際連盟脱退、南方への戦線拡大等の行為により米英のみでなく国際世論を敵に回すことになったが、この間でも日ソ関係は比較的穏やかであった
政治	戦線	と同時に販売戦線の爆弾勇士である配達の給与も最低一ヶ月四拾圓位は得るようにし、新聞社においてこれを保証することが至難とすれば、各販売店にこれだけの給料を支払い得る程度の収入与えるべきである
その他	戦線	昨年の桜花賞、エリザベス女王杯で2着して牝馬のG1戦線を賑わせたフサイチエアデール(牝5歳、栗東・松田国厩舎)は有馬記念(9着)の後、山元トレセンに放牧に出されていたが、3月1日に栗東トレセンに帰厩する
その他	戦線	3作目にあたる「重力戦線」が完結した今のタイミングだからこそできた、「1年戦争秘録」「黙示録0079」「重力戦線」の全てを網羅した設定資料集が
その他	戦線	前回シーズン準優勝の『KONTA』がまさかの戦線離脱、その名代として登場したパチスロ全国行脚を達成した男『よーへい』、スロマガ攻略軍団『源悟郎』、さらにはパチテレに久々登場、オレ勝PRO黄金期を支えた男『ぎるびい』の三名が準決勝へのイスを争います
その他	戦線	ソンサン氏は六十二年の政治キャリアを持つ、同国を代表する政治家のひとりで、大虐殺を行なったポルポト派に対しクメール人民民族解放戦線を結成し徹底的に抗戦したことで有名
その他	戦線	米男性週刊誌「プレイボーイ」現地語版の発刊が社会問題となっているインドネシアで12日、イスラム過激派「イスラム防衛戦線」(FPI)の構成員ら約300人がジャカルタにある同誌の発行元を襲撃した
軍事	戦線	1947年、ビルマ戦線から生き残って復員して、瀬戸内海で母親(中村玉緒)と二人、鬱々とした漁師をやっていた宗重左衛門、通称重左(真田広之)は、女郎屋で、同じビルマで戦っていた戦友鬼松庄一、通称鬼庄(佐藤浩市)と出くわす
政治	戦線	【バンコク共同】タイのタクシン元首相が2006年9月にクーデターで追放されてから丸3年となる19日、元首相の支持団体「反独裁民主統一戦線(UDD)」が首都バンコクで反政府抗議デモを行い、地元警察によると、約1万5千人が集まった
政治	戦線	ロストフ南方(コーカサス地方)に枢軸軍は第1装甲軍を派遣していて、ロストフをソ連に奪回されるとこの軍の退路を断たれることになるので絶対に死守しなければならないのですが、枢軸軍には全戦線を支える戦力はなく、特にイタリア第8軍のところは崩壊しかかっています
政治	戦線	タイのアピシット首相は11日、バンコク都心の繁華街を占拠し反政府デモを続けるタクシン元首相の支持団体「反独裁民主統一戦線(UDD)」に対し、12日までにデモ隊が撤収しなければ治安当局が新たな対策を講じるとの方針を示した
軍事	戦線	南部では、1975年の北部ベトナムと南ベトナム解放民族戦線による旧サイゴン政権の打倒、北部との統一を経て、1980年代に土地の共有化、農業合作社(生産協同組合)建設が進められ、それに先立ち、平均より多くの土地を有していた者は土地のない者、わずかしか所有していない者へ土地を分与させる土地改革がおこなわれた
その他	戦線	まいどのことで管理人様には申し訳ない長文になりましたが、私はトロツキーの提唱した「別個にすすんで同時に打つ」統一戦線を支持する立場から、多少の細部にわたっての認識の違いや、立脚点の違いは理解するように心がけています
その他	戦線	かろうじて安全な後背地である関西において戦線を再構築することに成功したものの、同地を勢力下に保つのが精いっぱいで、今夏のこれ以上の進撃はもはや不可能であった
政治	戦線	ジャン=マリー・ル・ペンが国民戦線と国民運動連合の間の“新しい時代”について語り、“2度サルコジと会見し選挙方法の問題点について話し”“その会見の度にサルコジに非常に丁重に迎えられた”ことを自慢に思っていたのは昔のことだ
政治	戦線	だがこの対話を支えるために集結した市民たちとEZLNの間に生まれた絆が、CND(全国民主会議)、あるいはFZLN(サパティスタ民族解放戦線)といった両者の橋渡しとなる機関を生み、市民のサパティスタ運動、さらに国際的サパティスタ運動へとつながっていくのである
政治	戦線	また、「テロリスト」が突如としてドイツ占領軍からの解放の英雄となったり、〔1962年に〕エビアン協定が締結されたことで「テロリスト」〔アルジェリア民族解放戦線〕が対等のパートナー国になったりすることを、さらに近年で言えば、アメリカ軍の戦略上の見解が急変するに合わせて、かつての「テロリスト」がイラク警察となり、「穏健なタリバン」となることを、どのように説明すればよいというのでしょうか
政治	戦線	また、同記事は中国の「人民日報」ネット版、「中国評論新聞」、「中共中央統一戦線工作部」などでも引用され、中国で幅広く報道されたほか、台湾紙「自由時報」が7月14日と15日にこの問題を取り上げたため、国民党は「統一」発言の火消しに躍起となった
政治	戦線	近年の高校就職戦線の早期化・生徒の就職に対する意識の低下・他校との求人競争激化・企業側の求人数縮小など、生徒にとって就職活動する上での負の影響を考え、より一層の早期・徹底・強化対策のニーズを迫られている
政治	戦線	小沢一郎氏と小沢派に期待していれば何とかなる状態はなくなり、国民自身が、小沢氏と国民新党、社民党と共に政治改革を目指す共同戦線を構築し、自らを多数派にする行動が求められているのです
その他	戦線	片寄みつぐ(漫画史研究家)からの聞き取り(1977年7月27日)によれば、賢二は1946年(昭和21年)10月から産別会議の美術顧問をしており、機関紙『労働戦線』に漫画やカットを描き、職場美術サークルを指導し、漫画の選者などをし、片寄はその助手のような立場であった
政治	戦線	同氏はさらに、サンディニスタ国家評議会、および、サンディニスタ民族解放戦線(FSLN)の最高意思決定機関である政治委員会のメンバーでもあります
その他	戦線	「サンプリング・ミュージック解放戦線」(なんか、KLFみたいだね)なんて紹介されてたから、Prefuse73みたいにいびつな感じにネタを解体しまくったものかと思ったら、大ネタ小ネタ(70年代のファンクからNASやビースティ・ボーイズまで)をふんだんに取り込んだオールド・スクール風味の強い、真っ向真剣勝負のヒップ・ホップでした
軍事	戦線	シェリーフェン・プランの誕生とモルトケ、東部戦線と西部戦線の戦略的な違い、ドイツの海軍力の増強がイギリスとの緊張を引き起こしたこと、カフカスやアフリカ戦線とそれらがもたらしたもの、日本では知る人が少ない過酷なセルビア民族の戦争、王朝体制から国民国家体制への移行にこの戦争が果たした役割
その他	戦線	19時からのTAKUIのFCチケ先行に電話をかけるために、一時戦線離脱(=会場外に出て電話)していたので、19時出演のナナは、まるまる見られませんでした
その他	戦線	蒋介石と宋美齢は日本との全面戦争は覚悟していたようですが、場当たり的で、中国北部の対日戦に対する陽動作戦としての上海第2戦線の創設などという戦略的作戦構想が特にあったわけではありません
政治	戦線	こうした状況の中で社会党と共産党は反ファシズムの共同戦線を協約し(1934)、翌1935年6月、これに急進社会党が加わって人民戦線(ファシズムと戦争に反対する全勢力と組織を結集した反ファシズム人民統一戦線)が結成された
軍事	戦線	もし、その論で行ったらWWIのヨーロッパ戦線で義勇兵として戦った日本人兵士や、フランス外人部隊で戦死した日本人まで祀らねばならなくなる恐れが出てしまう訳で
軍事	戦線	第二次大戦の欧州・アフリカ戦線において、敵味方の軍隊が共に同じ歌を違う言葉で愛唱し、毎日21時57分から「今夜は『兵士たちの唄』をお送りします」で始まる、ベオグラードのからの放送に耳を傾け、その間は戦闘が停止したと伝えられる、世にも稀有な歌である
その他	戦線	インドシナのラオタイ国の愛国戦線に奪われた二名の科学者を救出するため、海外進出企業の会長は政府首脳の協力で日本人庸兵部隊を現地に送り人質奪還作戦を開始した
軍事	戦線	マレー・シンガポール戦線 ハワイ真珠湾攻撃とほぼ同時刻の一九四一年十二月八日未明、日本軍の第一八師団(司令部・福岡県久留米市)などが英領マレー半島に上陸して始まった戦闘
その他	戦線	今後の具体的な予定は未定だが、「これだけ強いのでダート戦を進ませたい」と松元茂樹調教師も言っており、砂のニューヒロインがダートグレード戦線をにぎわしてくれそうだ
その他	戦線	そのゲームで負傷し長期で戦線を離脱したが、最終戦の東京ガス戦に復帰し、スピードに乗った相手バックスに次々とアオテンタックル(相手を仰向けに倒す)を見舞った
政治	戦線	金部長の訪韓には、統一戦線部の崔承哲(チェ・スンチョル)副部長、元東淵(ウォン・ドンヨン)室長、カン・スリン室長、リ・ヒョン参事と2人の実務スタッフが同行する
軍事	戦線	イギリス本土防衛戦、モスコー郊外、史上最大の作戦・ノルマンディー上陸反攻、など第二次世界大戦の主戦場であるヨーロッパ戦線に6度訪れた決定的局面の実相に迫る
