# 空港: 航空機の翼。, 軍事: 本隊の左右にある部隊。, 空港: 鳥のつばさ。虫のはね。飛行機のはね。, 動物: 鳥類の（本来は）空中を飛ぶための器官。はね。, 鳥: 親鳥がはねでかばう。力をかす。たすける。
その他	翼	また、どうしても、〈ヴィークル〉を用いて車両で体当たりするように、〈飛刃〉や〈魔翼〉WAZで〈アスレチック〉による体当たりを行いたいというので在れば、〈飛刃〉ならば、乗っている武器、〈魔翼〉、WAZならば「生身」を用いるのが宜しいかと思います
その他	翼	今日もいろんな人がいて、むちむちしている女性の腕を摘む剛ちゃん、シュワッチされてむっとする博さん、剛ちゃんと同い年の子供っぽい女性の声に大笑いする二人、散歩していた剛ちゃんのモモ(背中に翼つけられてかわいかった)と一緒の犬を見て「モモだ」「かわいいね~」の剛ちゃん(そんな剛ちゃんがかわいいー)、「バカ犬だよ、ここ(森田)の家」と言う博さんに「おいっ
その他	翼	心臓がどの様に進化してきたか、四肢になる前の魚の鰭(ひれ)、翼になる前肢、必要に迫られる度に在り合わせの器官を変形し組み合わせて新たな器官に進化させる行程の説明は、殆ど私の知らなかったことばかりで、へぇー、そうだったのかと一々感心する
空港	翼	花の蜜を吸う密林の宝石、ハチドリも長くとがった翼や細長いクチバシ、自在に伸びる管状の舌を持ち、蜜をとりやすい飛び方ができるよう進化してきました
動物	翼	ていうかだね、最初にドラゴンのそばにいる実は大きな動物の陰に隠れて弱そうに見えるけど本当はこっちが黒幕なんだよ、的なひとつ目玉のコウモリの翼がついててふよふよ浮かんでる様なヤツ、名前忘れたよ(笑)を先に倒したんですけど、
その他	翼	ただ、攻撃の基本になる尻尾回転はステップの無敵時間で比較的簡単にかわすことが出来るので、足踏みがあたらず、尻尾回転も避けられる位置で翼や脚を突く感覚で戦えば、ある程度慣れればノーダメージで討伐する事もそれ程難しくない
その他	翼	〔第四回山本周五郎賞受賞作〕稲見一良の物語の翼は奔放に羽ばたく——ハードボイルド風のマンハントから不思議な漂流記、絶滅する鳥、孤独で勇敢な少年の魂へと
その他	翼	大会名は「為虎添翼」(いこてんよく=虎に翼を与えれば叶わないものがないということから、強いものがさらに勢いをつける意)という故事から得たもので、昨年9月に古巣・全日本プロレスの至宝であった世界ジュニアヘビー級王座を獲得し、ノアMVPにも輝いた丸藤の勢いを象徴するような大会となった
その他	翼	」データベースより)吉原理恵子:BOOK(:【著者情報】しかし、哲史を護ろうとする翼や龍平、上級生の気持ちとは裏腹に、校内はその衝撃的なニュースに再び騒然とし始めて
その他	翼	その他、エクスブレイカーにジルハルコンを使用したジグルドブレイカーや、空間歪曲技術により圧倒的な機動性を得た翼のような形状を持つヴァリアントスラスターなど、各種の装備が一新されているが、中でも特徴的なのは切り札ともいえる武装だろう
その他	翼	日常世界を離れて自由に空想の翼を飛翔させることが、児童文学——その中のファンタジーといわれるものでは、おとなの文学より、はるかに大きく可能である
その他	翼	光の翼はその大きさを増し輝きを増しアースラメンバーを包み込んでいく140の乱れ撃たれたサイドワインダーも存在が無かったかのように消えうせていく
その他	翼	さらに、羽ばたき運動では翼のしなり、風の乱れなど不確定な要素が多く、また羽ばたき時の推進力発生原理が不明確で、有効な解析やそれによる制御が大変困難となる
空港	翼	その上で、墜落事故は当時強風波浪注意報が出される中、事故機が後方から強い突風を受けた際、右席の乗客が操縦桿を急激に引いたとみられ、傾斜した主回転翼の一部が尾翼部分にぶつかり、回転数が低下して墜落したと結論づけた
その他	翼	全国を細かく回るツアーを定番化させ、「新しいタキツバワールドを生んでいきたい」と意気込む滝沢に、翼も「来年もそれぞれの活動で培ったモノを2人の活動に生かしたい」と話す
空港	翼	釣竿じゃないんだからいくら炭素繊維で補強してもプラスチックで飛行機の翼が作れるはずがないと言った航空自衛隊の幹部もいたそうだが、それでもあの配線ミスによる墜落事故の映像を見ると上昇しようとした後、急に頭を下げて何度も滑走路に機体を叩きつけているのに機体には目立った損傷はなく修理も可能と言うことなので相当に丈夫に出来ているようだ
その他	翼	シーダ様方が“翼人の休息所”の建物に来られたことは御承知のことと思われますが、その折わたしと数名の護人達とで、調査をしておりました建物の中を御案内しておりましたところ、“小さな翼”をお目に止められ、一度是非乗せて貰いたいとのお申し出がございましたので〉
その他	翼	人間魚雷回天/野火/戦場にながれる歌/戦争と青春/太平洋の翼/花の特攻隊 あゝ戦友よ/ひめゆりの塔/日の果て/戦艦大和/連合艦隊/雲ながるる果てに/ムッちゃんの詩/ビルマの竪琴(1985)/黒い雨/流転の王妃/日本敗れず
その他	翼	ディケーターは大砲でその生物を砲撃し、翼の膜に穴を空けたが、生物は飛び続け無傷の様子であり、見物人たちは驚きの声を上げた[7][8][9][10][11]
その他	翼	ハイテクとアマンダを中心とする恋愛ドラマが並行する本シリーズだが、今回はハイテクはコンパウンド・ヘリと呼ばれる固定翼と回転翼のハイブリッドヘリぐらい
その他	翼	ロックオンとデュナメスの二本の指が二つの引き金を引き、GNスナイパーライフルから放たれた光線は、回避の暇を与えずに、照準を着けられたオーバーフラッグの翼を撃ち抜く
その他	翼	猫(ねこ)のような声で小さく呼びかわすこの海の砂漠(さばく)の漂浪者は、さっと落として来て波に腹をなでさすかと思うと、翼を返して高く舞い上がり、ややしばらく風に逆らってじっとこたえてから、思い直したように打ち連れて、小気味よく風に流されて行く
その他	翼	今回は「ワギャンランド」「がんばれゴエモン ゆき姫救出絵巻」「クロックタワー」「仮面の忍者 花丸」 「マドゥーラの翼」「チェルノブ」「ゆうゆのクイズで絶対ないと言い切れると思います
空港	翼	ベローウッドをはじめとするタラワ級汎用強襲揚陸艦は上陸上陸部隊を支援する固定翼機と舟艇、ヘリコプターによる上陸作戦を目的としており、揚陸艦でありながら空母的な運用を可能にしているワスプ級多目的強襲揚陸艦には一歩譲るものの、高い汎用性を示すのが特徴である
その他	翼	金色の翼のnowでヤングな話 晴れはなまるマーケットアンパンマンゼロの使い魔ドリームズカムトゥルー火垂るの墓機動戦士ガンダム金色の翼銀魂結界師嵐7対1看護かんかん
空港	翼	空母エイブラハム・リンカーンに、米軍に三台しかない最新鋭の機体、タロンと呼ばれる可変カナード翼のステルス戦闘機とともに、三人のパイロットが配属される
その他	翼	『緯度ゼロ大作戦』ってタイトルだけは覚えてる作品があって、体はライオン、頭は虎、背中に翼といったような、とても貧弱な怪獣が出てくるんだけど、すっごいインパクトあんのよ
空港	翼	私たちの研究室では「ゆっくり」飛行できる飛行体の実現を目指して、低レイノルズ数領域の翼のまわりの流れの解析技術の研究や、流れ場の制御技術、人力飛行機や小型飛行船などの研究を行っています
空港	翼	なわち、プロペラ回転作動中に、各プロペラ翼の翼端から翼端渦が発生するとともに、プロペラボスの後端からはハブ渦が発生し、このハブ渦の渦核内に発生するキャビテーションは、プロペラ放射雑音を増加させ、海洋調査船等に搭載する水中音響機器の使用の妨げとなる、という点についてである
その他	翼	『らんま1/2』のシャンプー、『ああっ女神さまっ ああっ女神さまっ それぞれの翼』のペイオース、『おねがいマイメロディ』シリーズのマイメロディ、『機動戦士ガンダム0083 STARDUST MEMORY』のニナ・パープルトンなどの様に、一癖ある配役を演じることも多い
空港	翼	04年8月13日午後2時15分ごろ、沖縄・宜野湾市の同大学1号館本館に米軍の大型輸送ヘリCH53Dが衝突したのは、同機のローター(回転翼)を建物に衝突させて衝撃を和らげ、乗組員を救うための緊急措置だったことが、このほど開設された同大学の「米軍ヘリ墜落事件関係資料コーナー」を担当した武田一博図書館長の説明で明らかになった
空港	翼	あなたがもし、コンチネンタルの機上の人で、デンパサールに向けて着陸態勢に入り高度を落とし始めたころに、急に機体が揺れだしたり、窓の外に稲妻が光ったり、翼の辺に人の顔が見えたりしたら、それはマジックの仕業ですから、くれぐれもご注意してくださいね
その他	翼	アンジャッシュは、先月5月23日に放送された特番「話題のシーンを再現 ミラクル実験SHOW」(フジテレビ・関西テレビ系)にて、キャプ翼の必殺技"ツインシュート"の不規則な軌道を最新マシンの力で実現させた
その他	翼	主な作品に、『コンセント』『アンテナ』『モザイク』の3部作のほか(コンセント・アンテナは劇場映画化された)、エッセイ『根をもつこと、翼をもつこと』など
その他	翼	最初期に造られたディスクアニマルのため録音機能などは持たず重い、あくまで戦闘補助専用のディスクアニマル、装甲の硬さや初速、稼働時間の短さ、翼のブレードなど特徴的な機能が多く鬼を直接サポートする
空港	翼	足を痛めて逃げられなくなったシュウジの前に迎撃された爆撃機の翼が迫って来たその刹那、間一髪で救いの手を伸べたのは、背中から翼を生やした見覚えのある少女
軍事	翼	いっぱい話せた翼友さんにも感謝v・・まぁ、時間はかなりオーバーしてしまいましたが・・今度はグッズちゃんと確保してから トーク~の流れでいきましょうw
軍事	翼	折りたたみ翼やそれに順ずる機構を持つ機体は、その機構のため翼の強度がおおむね低く、翼下に重たいものを乗せることができないことや、生産工程が複雑化するため高コストになるといった弱点がある
空港	翼	前から順に長い翼と短い翼、それに後ろに沿った翼を備えた戦闘型でその背には自己主張するかのように高く三角帆—ラティーンセイル—が立ち上がっている
その他	翼	赤い鳥の「翼をください」は、今もサッカーの大会で歌われますし、ズー・ニー・ヴー「白いサンゴ礁」は、グループ・サウンズの中では少し毛色の変った名曲ですし、ビリー・バンバンの「白いブランコ」は癒しの原点のような曲ですし、五つの赤い風船
空港	翼	要するに、アスペクト比が大きいと言うことは、主翼の機体と直角方向の幅が長いことであり、このような形状を持つ主翼では、翼に当たった空気が翼の縁に沿って流れ、翼端から流れ去ってしまう割合が少なく、同じ抗力に対する揚力は大きくなる
空港	翼	4時間半で夜のモスクワ空港にて給油したが外は粉雪が降っていて、翼に雪が積もって飛び立てず、除雪車が来て約1時間除雪したが翼には明確ではないがドロッとした透明の液を吹き付けていた
空港	翼	65メートルの首を持つ巨大機械「スタック レクレーマー」、新幹線を運ぶ巨大トレーラー「新幹線やっこ」、飛行機の翼を運ぶ「ドリームリフター」、さまざまな消防車、街角トロッコ、「動物バス」の誕生物語など、身近で働く乗り物から滅多に見られない特殊な乗り物まで、30種類を紹介
その他	翼	読んだ本:十二国記シリーズ・月の影影の海/風の海迷宮の岸/東の海神西の蒼海/風の万里黎明の空/図南の翼/華胥の幽夢/黄昏の岸暁の天・魔性の子・屍鬼
その他	翼	男の場に翻ったのは紫色の皮膚に背中に翼を生やしたまるで悪魔の様な姿の黄金の剣を持ったモンスターが、緑色の皮膚をした棍棒を持った人型の魔物に襲い掛かっている様が描かれたカードであった
空港	翼	翼・中央胴体にコクピットと前方射撃固定銃兵器を配置、左右翼の2本ブームの前部にエンジン・中央にターボチャージャー・後部に垂直尾翼と水平尾翼を結合した独特の体形が特徴
動物	翼	四葉のクローバー、コウモリの翼、家畜豚の鎌、肉、黄金の毛玉、黒水、ポーション、ハイポーション、ウルトラポーション、豆乳、豆の頭、甘い豆、クマさんのレバー、銅魚、銀魚、金魚、小麦粉、ミルク、きのこ、ウサギの肝、千年キノコ
空港	翼	航空自衛隊の救難ヘリコプターや地元消防署員らが現場に向かい、31日午前6時15分、山中で大破・炎上したCH―47の回転翼などとみられる機体の残骸(ざんがい)を発見
動物	翼	○ 「ボルネオの生きもの」の「鳥類 (ムクドリ、タイヨウチョウ、ハタオリドリの仲間) 」のキュウカンチョウの項目に、翼の白斑の写真を追加しました
その他	翼	具体的には、噛む刺激が下顎骨を支える顎関節やその付近の筋肉(側頭筋、咬筋、内・外翼突筋)など口を開閉する筋肉群の感覚受容器(筋紡錐=錐内繊維という)に情報を送り、大脳皮質を刺激し、また、覚醒中枢である脳幹網様体というところに伝わり、脳の活動を活発にします
空港	翼	尾翼付きの通常形態機では充分なモーメントアームを持った垂直尾翼がそれを抑止してくれるのですが、全翼機の場合にはそれが期待できないので 配慮が必要になります
その他	翼	風水力機械における代表的な流体騒音である、「翼通過周波数音」、「翼列干渉音」、「舌部干渉音」、「ポンプ脈動音」、「キャビテーション騒音」、「配管系はく離流れ騒音」、「消音器気流発生騒音」などを解説する
その他	翼	二 補給支援活動 テロ対策海上阻止活動の円滑かつ効果的な実施に資するため、自衛隊がテロ対策海上阻止活動に係る任務に従事する諸外国の軍隊等の艦船に対して実施する自衛隊に属する物品及び役務の提供(艦船若しくは艦船に搭載する回転翼航空機の燃料油の給油又は給水を内容とするものに限る
その他	翼	従来より短期間で事業用ライセンスが取得でき、就職率も素晴らしいとの評価を頂いておりました、航空学科(回転翼)日米一貫コースに加えて、訓練の全てを日本国内で行う航空学科 国内訓練コースを新設致しました
その他	翼	翼君はご飯を食べる時も学校へ行くときもずっとボールを離しません(笑)さすがにそこまではできませんがマイボールは一生のうちに何個も買うものでは有りませんので大切にして欲しい
空港	翼	機体は木製で秋水と同じ全幅、全長を、翼面積を持ち、12月26日に海軍三一二航空隊の犬塚大尉により初飛行、秋水の練習機として使えると判定され、更に2機が製作、 その内の1機は陸軍審査部の荒蒔少佐により陸軍審査にも合格しています
その他	翼	しかしファンタジックなのはヴィジュアルだけではなく、「Animal Arithmetic」でジャングリーにクラッシュした音の破片が霰のごとく降る中、高揚するメロディを歌声の翼が空高く飛翔させていく様はそのものが夢だ
その他	翼	カナードどデルタ翼を組み合わせたクロースカップルドデルタ翼を持つタイフーン、無尾翼デルタ機のミラージュ2000、可変翼を持つトーネードとラインナップも豪華です
その他	翼	翼スパンの小さな機体に合わせたぺらサイズなのでスピードもあり、同じような大きさで機体を製作した鳥羽機はうまく飛んだのですが、翼面積を2倍にして、しかもV尾翼をそのまま使ったクリタ機では、ペラが小さすぎてマッチングしませんでした
動物	翼	コウモリは哺乳類の中で唯一、闇夜を完全飛行できる動物だそうで(安全で)、昼間に空を飛んでいる鳥たちとも競合しない(共存する)生き物なので『蝙蝠の翼』を思いついたそうです
動物	翼	紀元前2300年頃に古代メソポタミアで栄えた都市国家のラガシュの紋章は、2頭のライオンの上に鳥の王者である鷲が両翼を広げて立っている図案でしたが、この2種類の動物が、後の時代になると融合し、翼を持つライオンのデザインへと変わっていきます
その他	翼	無事親子席ゲットですタキツバコンでは、親子席初参戦です今から楽しみだ~タッキー&翼がWii「ファミリースキー」で対決 タッキー&翼が出演するWii用スポーツゲーム「ファミリースキー」のCMが、明日からオンエア開始されるということでどこかへ行くと
その他	翼	補助翼が水平尾翼の代わりも務めており上に22度、下に27度可動になっており、その内側には離着陸用のフラップを下ろした際に縦の振動が起きない様に安定させるフラップが付いていた
その他	翼	ヴァラキアカの刃によって残されたルルイエは縦に一刀両断され、それぞれの断片はそれまでよりもやや大きめなクトゥルーに変化し、翼を広げ、触手を蠢かし、両腕を振り上げて襲来する
その他	翼	その結果、CX、PXの試作機の組立冶具や試験装置の一部とか、B−787次世代航空機の主翼や中央翼の組立装置のある範囲を提案しながら受注に結びつけることが出来ました
その他	翼	足を痛めて身動きの取れなくなったシュウジの前に、迎撃された爆撃機の破片が迫ってきたそのとき、間一髪で救いの手を差し伸べたのは背中から翼を生やし、肉体の半分が兵器と化した恋人・ちせだった
その他	翼	出演者:渋谷飛鳥、田口トモロヲ、小林翼、清水萌々子、紗綾、前田愛、かでなれおん、今井春奈、根岸季衣原作:楳図かずお監督:金子修介脚本:松枝佳紀楳図かずおの恐怖漫画作品「ビッグコミックスピリッツ」に1986年から1989年に連載
その他	翼	ネコ火事場が出たので、火事場にしようとすると、見事自爆死・・装備によって、その火事場にするときの見極めが難しいですwネコ火事場なので、バリスタもいらないだろうと思っていたのですが、1戦目より集中力が切れてて、さらにギリギリでしたw翼は破壊できたのがせめてもの救いです^^;
その他	翼	アーリマンがトドメを刺そうとした時、彫像にヒビがはいった、ヒビは一気に広がっていき隙間から光を放ち、中から人の姿が現れ獣戦士の登場した、あまりの閃光にアーリマンの目は潰れ翼を広げのたうち回っていた、その身体に獣戦士が投げつけた槍が突き刺ささりアーリマンは即死した、傷を負った彼女が復活した
その他	翼	1)エピローグの最後の伸ばすとこを、滝が翼の方をむいて一緒に「〜♪」って、歌いたかったようなカンジだったのに、翼は滝の方に行ったかと思ったら全然気づいてなくて「間違ってごめんなさい
その他	翼	不適切な咀嚼・顎運動や精神的ストレスにより咀嚼筋(側頭筋や下顎周囲の筋肉)の異常緊張状態が続くと外側翼突筋が付着する関節円板が前方転位を起こしやすくなり、顎関節症に特徴的なクリック音や開口障害、咀嚼筋の筋肉痛が起こります
空港	翼	姫路じゃなくて相生のほう(有年)なんですが、ただのドライブインなんですが、なんか、ゼロ戦のエンジンとか、大砲とか魚雷とか戦闘機の翼とかミリオタが泣いてよろこびそうなものがたくさん展示してあります
空港	翼	能力制限が多いへりを主戦力と算定する考えは私には無く、主戦力は現在の技術水準では固定翼機のみであり、あくまでも艦艇搭載機は艦艇自体の能力として、地上配備分は補助部隊として勘定したいと考えています
空港	翼	’59年型ビアリッツは、戦闘機からインスパイアされた翼のような巨大なテールフィン、砲弾型テールランプ等、革新的なスタイリングが特徴的なモデルです
その他	翼	太平洋戦争中には各マスメディアによる報道や、1942年(昭和17年)10月公開の映画「翼の凱歌」、1944年(昭和19年)3月公開の映画「加藤隼戦闘隊」といった両ヒット作を通じ、「隼
空港	翼	この法律において「航空機」とは、人が乗つて航空の用に供することができる飛行機、回転翼航空機、滑空機及び飛行船その他政令で定める航空の用に供することができる機器をいう
その他	翼	次に、幅広い保育ニーズへの対応につきましては、総合施設の整備と幼保の定員増を目標に、平成18年度において、社会福祉法人清心会が建設した園舎に対する補助を行い、平成19年4月1日に認定こども園翼幼保園が開園し、園児の受け入れを開始されました
その他	翼	夕空に飛びかふ小さい黒い影を見て、あれは何かと兄の方が尋ねますから、蝙蝠(かうもり)だと教へますと、子供等はめづらしさうに眼を見張りました、瓦斯(ガス)や電燈の點いた町の空に不恰好な翼をひろげたものの方を眺めて居りました
その他	翼	筋肉の障害:顎関節症に関係の深い筋肉は咀嚼筋(そしゃくきん)で、咬筋、こめかみにある側頭筋、そして内側翼突(よくとつ)筋、外側翼突筋の4種類からなっています
動物	翼	体の換羽は、翼の換羽の前後2ヶ月くらい、および翼の換羽中にかけて行われ、夏前に非繁殖羽(メスと同じような色の羽:この状態を「エクリプス」といいます)になり、冬前には繁殖羽(ハデハデな羽)になります
その他	翼	JAS39はカナード(先尾翼)とデルタ翼の組み合わせ(クロースカップルドデルタ)という、近年の欧州戦闘機でよく見られる形状となっている(例:ユーロファイタータイフーン (戦闘機) ユーロファイター)
空港	翼	悪名高いことで有名で、翼が日本刀の戦闘機が、敵機をぶった切ったり長嶋茂雄が戦国時代にタイムスリップして、巨人軍が虐殺したり、諸葛亮孔明の霊が、山本五十六に乗り移って、日本がアメリカに勝ったり(中国の味方してやれよ
その他	翼	「ザトウクジラ」は、クジラ目ナガスクジラ科の哺乳類の動物で、学名に大きな翼という意味の「Megaptera」と付けられるほどの長い胸ビレ(体長の3分の1近い
