# 空港: 航空機の翼。, 軍事: 本隊の左右にある部隊。, 空港: 鳥のつばさ。虫のはね。飛行機のはね。, 動物: 鳥類の（本来は）空中を飛ぶための器官。はね。, 鳥: 親鳥がはねでかばう。力をかす。たすける。
その他	翼	まずはシュリー翼のルーヴルの遺構を見て、ギリシア・ローマ彫刻のあいだをすり抜け、ドゥノン翼1階(日本の2階)のルネサンス・バロック期のイタリア絵画を堪能
その他	翼	その外観は巨大であり頭部はタコのようであり、顔面には無数の蝕椀を生やし、胴体はゴム状で鱗に覆われ、手足には鉤爪をもち、背中には蝙蝠のような細長い翼を生やした存在
その他	翼	前にも書いたように、コミックス版を読むことでかなり『リーンの翼』の理解は助けられるのですが、こうやって見るとけっこう細かいところで違いはあるんですね
その他	翼	今回名作として特集されたのは大きなサファイヤを羽が取り巻く米倉涼子さんがジュエリーデザイナー役を演じたテレビドラマの記者発表会で使用された「アリダンジェラ」(天使の翼)
空港	翼	飛行機の窓から翼を見ていると乗ってみたい気分になる人は多いと思うが、ホントにジェット旅客機の翼の上に乗って目的地のモスクワまで2時間のフライトを耐え切った少年がいるそう
その他	翼	平成17年10月 ユーエフジェイつばさ証券株式会社との合併により、UFJつばさビジネスサービス株式会社、株式会社UFJつばさ研究所、UFJつばさハンズオンキャピタル株式会社(現商号はエム・ユー・ハンズオンキャピタル株式会社)、日聯飛翼証券亞州有限公司(現商号は三菱UFJセキュリティーズ(香港))が子会社となる
その他	翼	労働者階級の戦闘的翼は、社共の議会主義路線、カクマルの組合主義、経済主義路線との真の対決なしには、労働運動の革命的、戦闘的前進をかちとることができないことを、七四春闘ゼネストの生きた経験をとおして実践的、理論的に学びはじめたのである
動物	翼	何故、私の意識に、鳳凰が卵を産み落としたり、両腕の翼を拡げて、全てを支えたりする感覚が訪れたりするのか、其の原因は、私の意識自体に、鳳凰の存在が繋がっているからなのだろう
空港	翼	(1)嘴が太くて会合線は白っぽく、特に基部では白色部が三角形にやや膨らみ目立つ傾向がある、(2)頭部の黒色部は光沢がある(喉も同様とされるが野外での確認は困難)、(3)足(ふ蹠)が太い、(4)趾がささくれだっている(野外では確認が困難)、(5)翼を畳んだ時は一様な色に見え、次列風切部が特に白っぽくは見えない、(6)尾は角尾で先が丸く見えない(ただし摩耗などにより丸く見えることもある)
その他	翼	」という言葉に本人の自覚はなかったけれど、読む人が、ページを繰っていくうちに自然に自分の翼に気がつくような、捕らわれから解き放たれて自由になるような、そんな画集にしたいと企画
空港	翼	機体デザインも、下翼機の主翼の上に二機のエンジンナセルを搭載するという空力的タブーに挑戦したばかりでなく、それによって通常より効率の良い空気の流れを実現、結果として燃費の良さを招いている
その他	翼	太陽の王子 ホルスの大冒険、ルパン三世(TVシリーズ第1作)、ルパン三世 カリオストロの城、宇宙戦艦ヤマト(TVシリーズ第1作)、ガンバの冒険、機動戦士ガンダム(TVシリーズ第1作)、未来少年コナン、風の谷のナウシカ、AKIRA、王立宇宙軍 オネアミスの翼、機動警察パトレイバー(OVA、劇場版第1・2作)、トップをねらえ
空港	翼	電動機の回転数の減少、制振機構の多重化、7翼ハイスキュード・スクリューなどの採用により、海上自衛隊の潜水艦にとって積年の課題であった静粛性は大幅に向上し、うずしお型に始まる日本の対潜潜水艦の技術及び運用のレヴェル(とりわけ静粛性)は、本級の整備によって、ようやくNATO軍潜水艦部隊の水準に並ぶに至る
空港	翼	主翼は可変後退翼を採用しており、外翼部分の後退角を20度(離着陸用)、30度(巡航用)、50度(低空高速飛行時)、60度(高空超音速飛行時)の4段階に調節できる
その他	翼	翼さんといい、ミッチェル、さらにベイリーといい、このゆったりとした中にもうねるような強いグルーブ感のある演奏に思わず自然に身体を揺らしてしまう
その他	翼	いつ頃からかは定かではないが翼による人格更正用プログラムを受けさせられていたらしく、その兆候が「かれんビー」では顕著に見られ翼のことを恐れている節がある
空港	翼	2006年9月に米軍が発表した「グアム統合軍事開発計画」に、海兵隊航空部隊とともにグアムに移転してくる最大67機の回転翼機(ヘリコプター)などのための格納庫、駐機場、離着陸地(ヘリパッド)を建設すると書いてある
動物	翼	その姿は赤い毛皮、コウモリのような皮膜の翼、サソリのような毒針が無数(24本と数がはっきりしているものや、太い1本というものもある)に生えた節のある長い尾、そして3列に並ぶ鋭い牙を持つ人面のライオンの形態をした怪物である
その他	翼	国最古の地理書『山海経』では、「西山経」四の巻で、ハリネズミの毛が生えた牛で、邽山(けいざん)という山に住み、犬のような鳴き声をあげ、人間を食べるものと説明しているが、「海内北経」では人食いの翼をもったトラで、人間を頭から食べると説明している
その他	翼	昼夜を問わず時速300キロ飛行でき、目標を見つけると目の前に降り立ち、相手を翼で押さえつけながらもう片方の手の鋭い爪で腹部を貫き、更にその際相手の内臓を消滅させて死亡させるアンノウン犯罪能力を持つが、外観からはその異様な状況が見えないのでイマイチインパクトが薄い
その他	翼	その時のメンバーは、戦士系が前田、現戦士鍛錬所教官の大島 清吾、元13期生戦士の飯島 桜、罠解除士が現罠解除士鍛錬所教官の森下 翼、僧侶が元11期生の内田 佳奈美、そして魔術師が本田という部隊構成であった
動物	翼	私の場合、鳥みたいに羽ばたくのは、感覚的に何となく納得できるんだけど、翼で浮くというのは、例え科学的に納得できても観念として納得できそうにありません(笑)
空港	翼	世界初の前進翼ジェット機 高速爆撃機として開発されたが1944年に連合軍の爆撃で試作機が失われ、45年には再び作った試作機もソ連軍の手に落ちた
その他	翼	個人的には「十三翼の戦い(ダラン・バルジュドの戦い、またはクルテンの戦い)」という呼び方がかっこ良くて好きなのですが、2つの戦闘を組み合わせてしまったため、この会戦の呼び名を決めがたくなっていたのが残念
軍事	翼	「我々は、憲法に忠実な二つの派閥の存在が政権の助けになっていると信じている・・・(二つの派閥、つまり保守派と改革派は鳥の)二つの翼のように機能し(政権の)飛行を可能にしている・・・互いに競争し、かつ進歩的な雰囲気の中で・・・我々は憲法を信じない者たち、また国民の指導にあたる政権を信じない者たちを許さない・・・適切な中庸のアプローチは改革主義者の保守主義である」
空港	翼	コクピットは777と同様にCRT6面の完全なグラスコクピットとなっており、主翼、尾翼は翼面責を増大、特に主翼は新設計の主翼となり、翼端にはオプションで燃費の向上と離陸性能のアップをはかることができるブレンデッドウイングレットを装着可能
空港	翼	この回転翼安全装置一個には約五百マイクロキュリーのストロンチウム90が含まれておりまして、未発見の一個は墜落した機体の燃焼、溶解で気化した可能性が高く、識別が不可能である
その他	翼	あるいは、神明町の町内会長以下96名をもって平成13年6月4日付けで提出いたしました、翼小学校南の農業用排水路暗渠化の要望の件も、着手時期は未定ながら、なんとか平成15年度中の完成を目指す方向
その他	翼	「ユニオン、AEU、人類革新連盟が協力してソレスタルビーイングのガンダム4機を鹵獲する為に砂漠に誘い出す」「機動戦士ガンダム00第15話折れた翼」「
その他	翼	ちなみにクトゥルフの姿形は「タコに似た頭部、イカのような触腕を無数に生やした顔、巨大な鉤爪のある手足、ぬらぬらした鱗に覆われた山のように大きなゴム状の身体、背にはコウモリのような細い翼を持つ
その他	翼	広島東洋カープの中谷翼選手(元愛媛MP)と千葉ロッテマリーンズの角中勝也選手(元高知FD)が、7月19日(木)松山・坊っちゃんスタジアムで開催されるフレッシュオールスターゲーム2007「ウエスタン・リーグ選抜対イースタン・リーグ選抜」の出場候補選手に、選出されました
空港	翼	自動車のサージの解析、無線アンテナとルーフの電波伝搬特性、航空機機体外の翼の構造解析、機内での電波伝搬特性、RFマイクロ波回路、導波管、フィルタ、MEMS回路、EMC/EMI、リフレクタ・アンテナ、アンテナ・ビーム・ステアリング等の電磁界解析が高速で計算処理が行える
その他	翼	正式な発掘調査が昭和26年から28年にかけて行われ、その結果、洞窟内の凝灰岩の壁に、角・翼を持った動物の仮装をした人物像、舟と漁師、狩人、魚、四足獣や海獣のようなものなど、なんと609点に及ぶ彫刻が発見されたのです
その他	翼	・・でこれはですね・・例の掛け声なのですが・・一応つばサンタ裏ビデオ後なんで・・ まぁ・・翼くん的には「タッキー」と言ってほしかったみたいで・・2回めの時2階の方みながら いったのですが・・結果は9割「翼ぁ~っ」で1割が「タッキーっ」と・・聞こえました
その他	翼	PTAと飛翔の会、これ、おやじの会ですが、で翼小学校区家庭教育推進協議会をつくり、翼地区公民館を仲立ちとして、学区町内会や子供会、そしてNPO高浜翼会と連携して、子供が健やかに成長するために、「子育て十か条」を作成をいたしました
その他	翼	細身の人間体型のドラゴンにソレワターセ(植物)が巻きついて融合したような不気味な姿をしており、胸部にソレワターセ素体の目、背中にコウモリのような翼、後頭部と腰にそれぞれ太く長い尻尾がある
空港	翼	オーストラリア・シドニー発フィリピン・マニラ行きの「カンタス航空」機は2日、離陸直後に翼から油圧系統のオイルが漏れているのがわかったため、空港に引き返して緊急着陸した
動物	翼	ただし実施に関しては、除草、害虫防除効果が必ずしも安定しない場合があり、また野犬等の外敵対策、アイガモが逃げないように翼を折ったり柵で囲う、またアイガモの飼育に手間がかかるため、実施には技術が要求される
その他	翼	分_神q有点细雨扯牛毛明天你还记患上无敌魔法师够亚群1班GXD哓哓的犯险岛回转眼睛小P阶级姊妹天使de甜品风ぁ之ぁ翼狐狸种葡萄メ猫猫の喵喵妖精づ凯文伪伱蕉萃四海偷心犯险岛网管へ火影忍者女皇雪碧若斯紫衫水龙游龙天下熬头我只劫色天际家族の风无敌神手迦罗什飞机抗敌素席娜重づ楼小弓手ご虫虫N无极狂风N没人爱的宝宝徐梦碧へ老婆我是丑鬼123不能找我打工仔
その他	翼	それによると、タコもしくはヤリイカに類似した 触手に覆われたぶよぶよの頭部に、鱗に包まれたグロテスクな胴体、そして退化したコウモリ様の翼と軟質の巨大な鉤爪を具えており、全体としては「タコと竜と人間のカリカチュアを一緒くたに表現」したものとなっている
軍事	翼	ながら、すべての戦隊、ほとんどの隊飛行翼司令官が指揮していると異なる場合は、高速ジェット戦隊のため、約100人と12機の設置があるが、竜巻F3選手権中隊の16機
空港	翼	目を定めてよく見ると、長く伸ばした両の翼を微塵(みじん)も動かさずに、身体(からだ)全体をやや斜めにして、大きな水の渦(うず)に乗った枯葉(かれは)のように、その鷲は静かに伸びやかに輪を造っている
空港	翼	航空機というからには翼があって揚力によって飛ぶのが航空機ですから、UFOが何によって飛んでいるのか、色んな議論があるのでしょうけど、それをそのまま領空侵犯で読めるかというとなかなか厳しいかもしれない
その他	翼	豊かな森林環境を傷つけることなく、強風吹く尾根筋に重機を運びこみ、高さ60mのタワーを立て、直系60mの回転翼を取り付けるという難易度の高い作業に、独自に開発した550tクレーンをはじめとする特殊車両と、抜群の技術力を提供したのが外薗運輸機工だ
その他	翼	生細胞を見る新しい手法を開発しようとする分光学者と、それを利用して生細胞の分子機構を解明しようとする物理、化学、生物学者がこの部会に集うことによって、分光学会の翼がとくに生物学の方向に向かって大きく広がるものと期待して本シンポジウムを開催する
その他	翼	蛸に似た頭をし、その顔はのたうつ触腕の塊で、鱗のあるゴム状の体には巨大な鉤爪を備えた手と、長く幅侠の翼があり、全体としてみると、とてつもなくふくれた体に頭足動物の頭がある
軍事	翼	MIG23: VG翼ヨク機キで1973年ネンから前線ゼンセンロシア空軍クウグン航空コウクウ部隊ブタイ配備ハイビの主力シュリョク戦闘機セントウキの一ヒトつ
その他	翼	単独翼、グループ翼、インテグラルシュラウド翼など翼の構造が、翼の体格、振動強度に及ぼす影響を、実際に翼の試設計を行う事により考察し、最適な翼設計を求める研究を行っている
空港	翼	戦闘機としては大型の部類に入るその翼の下に、赤線の入った弾頭を満載しているこの猛禽たちは、日本合衆国が、この魔法の世界に対して放つ、逆襲の先鋒であった
空港	翼	固定翼機は主翼の上面と下面に気圧の差を発生させて揚力を得ているが、翼端において主翼の下部から上部に向かって空気が流れようとするために渦が生じる
その他	翼	太平洋を横断して回遊するマグロ類や、翼のように広がった頭骨の先に両眼があるアカシュモクザメなど、今までは飼育が困難だといわれてきた魚たちが飼育されています
その他	翼	戦後、新東宝を経てシナリオライターとなり、大映、東宝と契約、「人間魚雷回天」「連合艦隊司令長官山本五十六」「太平洋奇跡の作戦キスカ」「太平洋の翼」「連合艦隊」など、作品に海軍を題材としたものが多い
その他	翼	更には先ほど紹介した勢力の殆どと交戦しているプラクティスの指揮官であり、旗艦であるセレナーデの艦長である鷺ノ宮伊澄少佐と、その戦闘指揮官であるアムロ・レイ大尉、謹慎から解かれた黒翼隼人大尉が参加している
動物	翼	猛禽に関しては、管理と繁殖、皮膚・羽毛、目を含む頭部の疾病、足および脚の疾患、翼の疾患、呼吸器疾患、慢性的な体重低下・嘔吐・食欲不振、発作・協調運動不能・昏睡、繁殖に関する疾患、新生ヒナのケアと諸問題、の各々について章が設けられています
空港	翼	それは魚雷を抱いて雷撃をするという使い方である、しかしVT信管なるものが開発されてから戦果が上がらなくなってきた、一式は翼を燃料タンクにするというインテグラルタンクで航続距離を稼いでいたのだが、これは発火しやすく、正確な対空砲火が災いして動きがのろいこのような爆撃機はもはや対艦任務には向かなくなってきた、そんな中、果敢に雷撃を遂行したのがこの本の主人公であり著者である
空港	翼	北海道海鳥センター(羽幌町)によると、苫前町営の「夕陽ケ丘ウインドファーム」で4月4日、翼が切断されたオジロワシ1羽が死んでいるのが見つかった
その他	翼	」と囁かれていた杉作少年が漸く登場自分はどうも『にほんごであそぼ』での若旦那と翼クンの、本当の親子としか思えないコンビネーションの良さを見てしまっているので、ずいぶん前から「やっぱ杉作役は翼クンだよなー」と決めつけ加減になってしまってたんですよねところがどっこい
空港	翼	飛行距離5800km、33時間39分のフライトの末、翌21日の午後、「翼よあれがパリの灯だ」という名セリフとともに、パリのル・ブールジェ空港に着陸し、初の単独無着陸大西洋横断飛行に成功した
動物	翼	光線の工合でリヴァの眉が戦時の独逸将校の彫りの深い陰影の顔だち、または拡げた鷹の翼を思わせたが、それはまたヌヴェールにおける一兵士の死から引かれた歴史地理の補助線の影でもあったか
その他	翼	シミターは、エリアルール採用のくびれた胴体と後退翼に加え、英海軍機初の核兵器搭載能力も持った近代的な機体でしたが、生産機数はたったの76機でした
その他	翼	エンゼル戦士達はスペース蝙蝠の血を与えられ額に蝙蝠のアザが、また背中には普段は黒マントで空も飛べるが蝙蝠の翼に変身しより素早く身軽に空を飛べる能力と超音波で磁力の強い基地周辺の支障を解除し聞き分ける能力を持つ
空港	翼	岐阜県防災ヘリ墜落事故の調査で現地入りした運輸安全委員会の航空事故調査官は12日夜、事故原因について「ヘリの回転翼が山のどこかに接触した可能性がある」との見解を示した
その他	翼	カウアイ島は映画撮影に使われることが多く、古くはエルビス・プレスリー主演「ブルー・ハワイ」の結婚式、「6デイズ7ナイツ」の無人島漂着シーン、「イントルーダー/怒りの翼」の攻撃機不時着現場、「ベスト・キッド2」の沖縄にみたてた場面も撮影されている
その他	翼	エクラノプラン(ロシア語:Экранопланエクラナプラーン)とは、旧ソ連で開発された地面効果翼機 (WIG) の総称で、平滑な地表面ないし水面上を機体の幅と同程度の高度を保って飛行し、それによって得られる地面効果を利用することで高速性と大量輸送を両立することを可能とするものである
空港	翼	この結果、プロペラ翼51への水流の流入角が減少して、翼正面側に負圧が発生し易くなり、この負圧が増大すると、翼正面側にキャビテーションが発生するという問題があった
空港	翼	I、Iはローマ数字の1)は、第一次世界大戦中の1917年に、ドイツ帝国のフォッカー社が製作した三枚翼の戦闘機(三葉機)で、かの撃墜王「レッドバロン」(赤い男爵)ことマンフレート・フォン・リヒトホーフェンも愛用していたことで知られます
その他	翼	先日のスチレンHLG(スロープ使用中)についてですが、どういう形体かと申しますと胴体を5×8mmの檜材使用、これの翼台部分以外の箇所を削って軽量化したものとし、主翼台を2mmバルサ整形、尾翼は胴体直接接着しました
その他	翼	「翼コールそしたら翼が『言っとくけど俺のゎホント不細工だヵラね池田クンのとゎ違ぅヵラね恐ぃんだょ』と言ぃながらヘッドセットを外してタンクの裾を結んで(ぉへそ見ぇてた)『横がィィ縦がィィ』「横」『ぢゃァ横でホント下手だヵラ
空港	翼	2010年3月は、普天間基地の滑走路改修工事のため、普天間所属の固定翼機が一時的に嘉手納基地に移ってきていた時期にあたり、2009年6月は米空軍の最新鋭ステルス戦闘機F22の12機が暫定配備されていた時期にあたります
その他	翼	■品番:5929■素材:ナイロン■しんIRAGE■し翼_ブルファスナー開閉しき、外そんばファスナーポケット4もちてのながさ約36cmショルダーちょうせつか(約123cm)■サイ27xW42xD21cm■付属:なし【ちゅうい:レスポートサックのしょうひんについて】・生地の裁断かしょが1てん1てんことなるため、がぞうと柄がことなるばあいがございます・がらや製造くにのご指定はごえんりょケサインませ
その他	翼	武器・装備研究隊はもちろん翼甲冑や兎竜を研究する所で、兎竜部隊は元はここの所属から、実用研究として戦術研究隊に所属を換え、更には独自研究隊へとステータスを上げて来ました
その他	翼	銃は持っているものの、本命の武器は、その翼から弾丸のように発射する羽根です、全体像だとわかりますが、翼の一枚一枚に発射のための配線がついていたりします
その他	翼	ランスなら大型モンスターの尻尾も切断できるし、 頭や翼、胴体や尻尾の付け根など、ピンポイントでモンスターの弱点を攻撃できる利点と、頑強なガードに[ガード性能+]のスキルを付与することで、ほぼ全ての攻撃を後ずさりなしに、ガードできるようになり、即座に反撃することができる利点がある
動物	翼	病名等別では、動物が動けなかったり、外傷等により保護救護されるケースが多く、衰弱、鳥の翼・脚の骨折、交通事故による礫傷、猫による咬傷が目立ちました
その他	翼	また砲弾ひとつひとつに安定翼の加工誤差による弾道の差が生じるという問題もあるなど、命中精度に関してはライフル砲に劣る部分があると言われ、実際陸上自衛隊の射撃競技会においても、天候によっては74式戦車が90式戦車に勝利する場合がある
空港	翼	その中にはミコヤン設計局の機体も4機種含まれており、中でも尾翼付きデルタ翼にリフト・エンジンを組み合わせたSTOL戦闘機と可変後退翼の戦闘機が形状の類似性などから注目された
動物	翼	「もしあのほとんど翼だけの生き物がマンタやヒゲクジラと同じような食生活をしているなら、巨体にもかかわらずわれわれにとって危険な生き物というわけではないと思うな
動物	翼	(壊れ気味にて翼の大きさについては思考停止;) 人の腕の重さは体重の約1/8%らしいから軽量化を図るためには 鳥のように腕を翼に変えたほうが利口そうな気がする
空港	翼	7メートルの翼でダライダーのように飛びまわるプテラノドンをはじめ、体長12メートルのうち半分以上が首だというエラスモサウルスや、ゾウにもかみつけそうな巨大な口をもつクロノサウルスなど15の恐竜のなかまを集めました
その他	翼	プレゼントの内容は、発売前に配布された『カヌチ〜白き翼の章』のポストカード2種セットが5名に、『カヌチ〜白き翼の章』のポスターが10名に、声優サイン色紙が2名に当たるというもの
その他	翼	ジョージ&モーリスでの“ツイン・トランペット”を武器のひとつにしていたSUBBは、片方の翼をもがれて、ケ○タッキーに売り飛ばされたも同然のフライドチキン状態寸前となっていた
