# 空港: 航空機の翼。, 軍事: 本隊の左右にある部隊。, 空港: 鳥のつばさ。虫のはね。飛行機のはね。, 動物: 鳥類の（本来は）空中を飛ぶための器官。はね。, 鳥: 親鳥がはねでかばう。力をかす。たすける。
その他	翼	天安艦は該当惨事がおきる以前から海底面に接触し右側スクリュー翼の全てと左側スクリュー翼2ヶが損傷を受け、毀損されたスクリューを光沢が出るほどひどく削り、スクリューの広い範囲にわたり摩擦による損傷部位があったことが調査の結果、感知された
空港	翼	・機体後部にモーターを配置しないことから、可動翼(エレボン翼)の左右の翼を接近して配置出来、ロール系の動きはプッシャータイプ機の離れた所に設置するエレボン翼とは違い、プロペラの回転慣性力も加わり、鋭い回転が可能です
空港	翼	嘉手納町議会基地対策特別委員会が30日午後開かれ、米軍普天間飛行場の滑走路補修工事に伴い固定翼機が1月から3カ月間、米軍嘉手納基地に一時移駐することに対し、1月7日にも臨時議会を開き、同問題への抗議決議・意見書案を提案することを決めた
空港	翼	飛行機の飛ぶ仕組みや主翼や尾翼などそれぞれの翼の役割について実験した後、『スカイカブIV』という胴体にバルサ材を使用した競技用の紙飛行機を作りました
その他	翼	おなじ翼型に複数の測定データがある場合は、レイノルズ数、テストピース翼の構造、測定方法・条件などを考慮して、自分が作ろうとする翼に近いもののデータを採用することになります
その他	翼	すなわち、「翼」のついた「虎」は「天武天皇」であり、「古事記」の作者は世界史、日本史の歴史上のあらゆる地名、人物、モノを「トラ」に掛けて「日本史の裏」を「説明」しょうとしているのだ
その他	翼	翼は雛を守るかのように膨らませて垂れ下がり、首から上は天を向いて、そのままの姿勢で体を120度ほど回転させ、相手が飛び去る方向を追って威嚇の姿勢は3分ほどで終わりました
空港	翼	「マイティジャック」に登場する戦闘機エキゾスカウトの胴体に、同じく「マイティジャック」の戦闘機ピプリダーの前部と翼をつけたようなクラッシックなデザインをしている
その他	翼	オーベロンの妻、タイターニア役のタイターニアの高橋さんは、この話をもらった時に前回のメンズオンリー作品 「赤毛のアン」でアン役を演じて下さった代永翼さんに相談したそうです
その他	翼	平山がこの総罷業の案文を考えている時、江木翼もまた、最後のデッド・口ックを打開する方途にしんぎんしつつ、遂に内閣の面目よりも当面の大波乱を治めないことには内閣は倒壊する
その他	翼	それは、タコに似た頭部、触腕を無数に生やした顔、巨大な鉤爪のある手足、ぬらぬらした鱗に覆われた山のように大きなゴム状のの身体、背にはコウモリのような細い翼があった
その他	翼	このため、戦闘工兵中隊には、砲兵観測班の観測陣地を構築後、大隊の翼側防御に当たる歩兵中隊と戦車中隊に協力して、丘陵地帯前方に前進陣地の構築を支援するように命令することになる
空港	翼	先尾翼式は前翼と主翼の二つの揚力面を持っているため、離陸時に前翼・主翼を同時に高迎角を取ることで迅速に離陸できると文献にあったのですが、通常尾翼式も高迎角時には尾翼と主翼の二つの揚力面を持つというわけではないのでしょうか
その他	翼	、いそしぎ、イエスタデイ、デサフィナード、夢で恋すれば、心の想い出(フォー・ザ・グッド・タイムス)、アンド・アイ・ラヴ・ユー・ソー、翼は愛の風に乗って)
その他	翼	天使の翼/クッキー各種/チョコっと鎌倉/洋風カステラ(ゆず・抹茶)/おぼろ月(チョコバナナ・抹茶)/フィナンシェ/フィナンシェショコラ/レーズンサンド/鎌倉山の桜道/かまくり/フォーレノワール/メレンゲ菓子/サブレ/ギモーブ(フランボワーズ・パッションフルーツ)
空港	翼	ライトフライヤー以前の羽ばたき飛行機の時代から始まり、飛行機が金属製になっても、方向舵や昇降舵、補助翼は金属製の骨組みに羽布張りだった時代が第二次大戦後まで暫く続いた
その他	翼	翼人伝説という茫洋なテーマとは一見相容れないこの小さな絆、しかし、晴子と観鈴が親子の絆を築けたことによって、神奈の魂は救われ、悲しい伝説を終わらせることができたのです
その他	翼	さて、2009年1月31日に応募締め切りになりました『俺たちに翼はない ドラマシリーズ特製収納ケース』につきまして、2009年2月末に予定していた発送を制作・製造上の都合により、2009年3月下旬に変更させていただきます
動物	翼	赤い毛皮、コウモリのような皮膜の翼、サソリのような毒針が無数に生えた節のある長い尾、そして3列に並ぶ鋭い牙を持つ人面のライオンの形態をした怪物
その他	翼	アトリの鳴き声を耳にすることは少ないが、カワラヒワは、キリリリコロロとかわいらしくさえずるので、翼の黄色い模様と肌色の太いくちばしと相まって、すぐ、それと分かる
空港	翼	我空襲隊は約一千四百メートルの高度を保ちつつ見事に機翼を連ねて前後三回に亘り故宮飛行場、光華門外軍用飛行場格納庫及び多数の飛行機を完全に爆破し、数機は家屋の屋根をすれすれに低空飛行を敢行したとのことである
空港	翼	本物の飛行機の操縦桿を動かし、右へまわせば、右補助翼があがり、右に回転するや、引けば水平尾翼の昇降舵が上がり、機首が上がる、右足のペダルを踏むと、垂直尾翼の方向舵が右に出て、右へ旋回する感じを、子供が体験しました
その他	翼	ソ連軍将校用制帽から翼章引っ剥がすかな、緑一色の襟章で現用人民警備隊とかも可、革靴もあるしベトナム軍ベルトか中国軍ベルトを使うよ と言うか音楽から脱線すまぬ
軍事	翼	4 小隊長の指示にしたがつて、先頭小隊は、停止間においてはそのままとし、行進中においては続けて行進し、後方小隊は、右(左)の方に正規の間隔をとるように進出し、軸翼小隊の先頭と同一線に至る
その他	翼	南宋・羅願『爾雅翼』の象の項目には、「南越の大獣」とあり、『宋史』の本紀部分をちょっと検索してみたところでも上の2条を除いては、「占城國」や「交州」といった現在のベトナムあたりから象が献上されたという記事ばかりで、当時の象の生息地はベトナム等の南方であったと考えてよさそう
その他	翼	「わたしが俳句に出合ったのは、五十代もは半ばを過ぎてからと遅く、今年古稀を迎えた私には、岬の先になお大海が広がっており、そこから鳥が翼を拡げてゆくイメージが好もしく感じられたのである」とあとがきにある
その他	翼	これらは、対潜哨戒機の基本装備として、現在でも使用されているが、対潜哨戒用の飛行艇そのものは、1960年代ごろにはおおむね固定翼機や回転翼機にその座を譲ることとなった
その他	翼	キン肉マンについての噂芸人・ドラえもん芸人・エヴァンゲリオン芸人・SLUMDUNK芸人・ドラゴンボール芸人・ゴルゴ13芸人・キン肉マン芸人・キャプテン翼芸人これに並ぶわけでしょ
空港	翼	この飛行機は、 両翼の幅が20メートルの大きさで、翼に燃料電池を搭載し、航続距離はおよそ 750キロ、5時間飛行することが可能だということです
その他	翼	ゲーム聖子 水町レイコ また【ロレックスポータブル2nd攻略でっかい武器についてモンスターハンターポータブル2nd攻略関連東京モーターショーFLASHPS3WIIオンラインオンラインゲームカーズキャプテン翼フリー PUYOの事についての覚書「フリーゲーム
その他	翼	♯敵本星には近づかずに乗せてきた全部隊(東方有翼第二騎士団、東方光翼騎士団、越前情報部、ゴロネコ東原恵騎士団、満天星国初陣)を降ろして撤退します
その他	翼	旧版で光翼騎士ばかりプレイしていたカオスフレアも2版になったということだし、見せてもらおうか新版の光翼騎士の性能とやらをということでやはり光翼騎士を作ってプレイしてきた時のPCですぅ
空港	翼	「通俗的説明」(※ベルヌーイの定理を使ったやつ)によれば、この飛行機にとって低速飛行速度の 104Km/h では、飛行に必用とされる揚力のわずか 2% の揚力しか翼に生じないことになります
その他	翼	写真は、発泡スチロールで作った翼にブロアで風を吹きつけたとき、ベルヌーイの定理により翼の上の部分と下の部分で圧力差が生じ、その結果、上向きの揚力が働き宙に浮いている様子を表している
空港	翼	この機体は下翼にサーボを積んで上翼だけに付いているエルロンをトルクロッドで動かすようになっていますのでこのロッドも現物合わせで作ることにします
動物	翼	Webでも鳥の写真を紹介しているところがいくつもあるので、チェックするようにはしているのですが、Wikiのツグミの項など見ると、わたしの写真のは翼が下がっているなあ、とか考え込んでしまいます
その他	翼	もし7月7日に雨が降ると、そんな2人に同情し、何処からともなく、かささぎの群が飛んできて、天の川で翼と翼を広げて橋となり、織姫を彦星の所へ手渡す助けをしてくれるのだそうです
空港	翼	今では、長時間飛行する大型固定翼機では「即時着用型耐寒耐水服」となり、着水前に普段の飛行服の上から着れば良い事になって、冬季は機内に搭載したままだから即時着用できる(わけはないが・・・)ように訓練する時以外は左程の苦痛はなくなった
その他	翼	2000年からは、「住みなれた町で安心して住み続けたい」という願いに応え、ホームヘルプサービスやデイサービス、グループホーム、ショートステイに翼をひろげの「医療と介護の総合センター」として多彩な取り組みをおこなっています
その他	翼	かの赤城先生がおっしゃっることには、空を飛べば翼をグレムリンにもがれ、大海原をゆけばなぞの巨大生物に襲われるというのが、大人の常識、科学的姿勢というものだそう
その他	翼	これからもう少し下がるとの意見もありますが、立川に近い物件ですので、比較検討中の翼ぱぱさんなら他の物件もご覧になっていると思うのでその他の物件との比較ですよね
その他	翼	発表された作品は昨年秋からシリーズの展開が始まった『FREEDOM』と過去の人気アニメ『王立宇宙軍オネアミスの翼』、『機動警察パトレイバー劇場版』『機動警察パトレイバー2 the Movie』である
その他	翼	チャンピオンでやってるキャプ翼っぽいの、毎週連載じゃない上つまんないんだよねー(本人は気の利いた事言ったと思っているようですが早くもボロが出ています)
その他	翼	設定した船速に対して、船速が変化した場合、回転数を一定にして翼角を調整、または翼角を一定にして機関回転数を調整して、自動的に船速を一定にするシステムです
その他	翼	さらに、川崎重工が中心となって機体開発を進める防衛省向けの次期固定翼哨戒機(PX)、次期輸送機(CX)はいずれも今年、初飛行を行い、20年に量産を始める計画だ
軍事	翼	2 停止間においては、先頭小隊は、第61条の規定によって動作をし、後方小隊は、号令で半ば左(右)向きをし、斜行進をしながら先頭小隊の軸翼分隊長の後方に至り、右(左)に方向を換え、正規の距離をとって、右(左)の方に整頓する
動物	翼	この時、コウモリの翼の中からあける1つの赤色のもの、降りる上で1人のとても醜いみこになって、彼女の成長している1羽のとても長いタカは鼻をかぎ針で編んで、1件の羽のつくる七色のマントを身につけています
その他	翼	サイズの関係上、翼だけで飛んでいたとは思えないが、少なくとも機動力を削ぎ、上空という敵方に有利な戦場から引き摺り下ろすことが出来たのは確かな事実だった
その他	翼	変更内容をまとめますと、8月期の試験が7月期に繰り上がり、5月、9月、1月期には事業用の飛行機と回転翼、それと計器飛行証明に限り新たに試験が実施される、ということです
その他	翼	軫宿(みつかけぼし)、翼宿(たすきぼし)、張宿(ちりこぼし)、星宿(ほとほりぼし)、柳宿(ぬりこぼし)、鬼宿(たまほめぼし)、井宿(ちちりぼし)
空港	翼	翼にはあざやかな矢印をつけ、マレー、シンガポール、ビルマ作戦では英軍パイロットに「悪魔の矢」と恐れられた加藤健夫隊長ひきいる隼戦闘隊の活躍を描く空戦記
その他	翼	一説によれば、その中には、猫のような頭と尻尾を持ち、翼のあるトパーズかサファイヤの像があり、ターブートは敵に向かって素早く進み、その後を兵士が続き、それが停止すると兵士も静止し、勝利が下った、と言う
その他	翼	飛んでいる姿はまるでハマキに細長い翼をつけたような格好をしていて、海上を飛びながら魚やイカなどの獲物を見つけるとかなりの高さから真逆様にダイビングしてとらえます
その他	翼	ガッパはウロコあり、体毛あり、ツノあり、クチバシあり、イボイボあり、ザラザラあり、シワシワあり、さらに手があるくせに翼が生えているという生物の進化をまるで無視したかのようなデザイン(^^;)
その他	翼	そんな折、真理江(川島なお美)の息子・翼に理絵が振るった暴力は、翼が口移しに覚えたであろう「不憫な子」なる一言に理絵がキレた結果という展開はありきたりだが、いかにも真理江(川島なお美)が使いそうなボキャブラリーの丸暗記ぶりはワンスパイス
その他	翼	チャタジーたちは翼の前にある前飛膜が小さい、プテラノドン型の古い復元に基づく模型を使っていたが、イギリス・ケンブリッジ大学動物学教室のマット・ウィルキンソンは、翼竜は前飛膜がもっと大きくて広く、手首から前に伸びる長い翼支骨を上下に動かすことによって、前飛膜を操作することができたと考えている
空港	翼	機体形状や加工方法の見直しに加えて、機体制御システムでも、機体の飛行速度や状態に合わせて前縁フラップと後縁フラップが自動制御されて飛行状態に最適な翼面を形成する「適合翼」システムが新たに採用され[4][5]、常に最も効率の良い飛行を行なう能力が付与された
その他	翼	中村あゆみ、新「翼の折れたエンジェル」熱唱 キリンビールは21日、アルコール度数を高めた第3のビール「キリン ストロングセブン」の22日発売を前に、テレビCMの曲を歌う女性ロックミュージシャンの中村あゆみを招いて東京・新橋駅前でイベントを
その他	翼	目を定めてよく見ると、長く伸ばした両の翼を微塵も動かさずに、からだ全体をやや斜めにして、大きな水の渦に乗った枯れ葉のように、その鷲は静かに伸びやかに輪を造っている
空港	翼	防御力や機動力等は七式中戦車を遥かに上回っており、攻撃力も翼安定式徹甲弾や穿甲榴弾の採用によりVII号重戦車レーヴェIを容易に撃破する程強化された
その他	翼	しかし、そんな態度はますますケンスケの逆鱗に触れ、返答代わりにロンギヌスの槍の刃がシンジの掠れた12枚の光る翼目掛けて袈裟懸けに振り下ろされる
空港	翼	ただ、物によってはどうしても翼の番号の位置とかがわからないのもあるから、地元空港に来るようなのであればできるだけ確認、来ないような機体ならば推測で貼ってしまうw
空港	翼	前進翼は後退翼と同様の主翼衝撃波の発生を遅らせる効果があるが、上反角を大きくする必要があるのと強度を大きくしないと危険な事から実用に至った機体は今もって少ない
空港	翼	補助翼タブ・コントロール・ロッド・バレルが折損することにより、機体が激しく振動し、補助翼タブ、補助翼及び主翼が損傷して機体の操縦性が喪失する不具合防止
その他	翼	【追加修正箇所】 ※ネタバレ含む場合あり ・「赤き翼」を「紅き翼」に修正 ・バイアスロン部芹沢部長の「バイアスロン部」を削除 ※人物相関図について間違い・追記などのご指摘ありましたら
動物	翼	これは、現在の鳥とほぼ共通した構造の羽毛を持っていて、前肢が翼になっているため外見から鳥を連想するものの、胸骨が鳥類ほど発達しておらず、骨が中空でなく爬虫類に近い構造になっているといった内部構造などから否定的な意見が出ているようです
その他	翼	1927年(昭和二年)にチャールズ・リンドバーグはニューヨークからパリへ、史上初の大西洋横断、単独無着陸飛行に成功したが、この偉業は後に「翼よあれが、パリの灯(ひ)だ」の題名で映画化された
その他	翼	文献が多くて史実の縛りが多い時代を描くのも著者は上手ですが、著者の本領は自由に想像・創造の翼を広げられる、それこそ文字がない、あるいはあっても文献資料が少ない古代もので一番発揮される、との思いを本書を再読して強く持ちました
その他	翼	でもonaraはずかしくないよ/ピラメキたいそうはオリコン2位だよね★ おめでとう★ オリコンといえば、、同じ日に発売日の「今井翼」と「Hey
空港	翼	軍隊の制帽の場合、陸軍は剣や小銃、海軍は錨、空軍は鳥、翼、プロペラなどの意匠を用い、これと国章、国を象徴する動植物、政治体制を象徴する意匠(王冠や赤い星など)等を組み合わせている場合が多い
空港	翼	日本航空は、「日本の翼」として貨物便22地点、旅客便44地点に展開、本邦最大のネットワークを有しファーストクラスキャリアとしての「こだわりの輸送品質」で航空貨物輸送サービスを提供してまいりました
軍事	翼	皆さん、わたしたちは興に乗じて少し来過ぎました、岸が遠過ぎます、いかにムクだって、翼があるわけではありませんから、この海を泳ぎきって、あの岸まで行く間には時間がかかります——ああ、わたしたちは、いい気になって、月に浮かれ、景色にみとれ、少し遠くまで来過ぎてしまいました」
空港	翼	乗客は「ミサイルが翼の約1メートル上空を飛び去るのを見た」と語っており、回避装置がなければ、乗員・乗客約270人の乗っていたアルキア航空機(ボーイング757―300型機)は撃墜されていた可能性が高いとの見方が強まっている
軍事	翼	川崎ジェットフォイルは荒海でも安全で快適な船旅が可能な全没型水中翼の超高速旅客船であり、離島と本土を結ぶ「足」として、人々の暮らしを支えています
軍事	翼	この「ヴァルキリー」は、その刃先で敵にダメージを与える飛行タイプの飛び道具で、刃の左右の安定翼の効果により、回転することなく敵に対して飛行し、ダメージを与えることができる
空港	翼	当時現場へ駆けつけた人の発言もあり、「予想以上に大きい飛行機だというのが第一印象だった、飛行機の胴体は半分にちぎられたようで翼も片方折れていた、放り出されるように外に出ている人もあり全員死んでいた」というような内容を淡々と話していた
軍事	翼	傭兵達は藤氏の動きを探り――朝廷が高野に対して、幽閉しているもう一人の翼人を引き渡すよう要求し、そしてその要求を拒否されたために、武力で攻め入ろうとしていることをつきとめた
軍事	翼	古流の伝書などでカラス天狗がよく書かれている 西洋でも翼の天使がいたるところに飾られている 人間の肉体は空を飛ぶことはできないが動物共通の器官や筋肉を鍛えることによって過去の動きの記憶をよみがえらせることはできるのではないだろうか
軍事	翼	そしてさらにフラップと呼ばれる主翼の面積を変える補助翼を動かして、翼の揚力を調整しなければならないのですが、これは離着陸時にしか使用しませんので、今の私にとっては関係のない部分ですので忘れましょう(苦笑)
その他	翼	例えば、小型の恐竜から鳥が生まれたわけですが、ダーウィン説のように『長い時間をかけて、ゆっくりと』進化が進むのでは、『もう前足としては役に立たないが、翼としてはまだ使えない』といった不利な状態のまま、長い年月、生き残らなくてはいけません
その他	翼	「本能の焦る方角へ/悲しく鼓翼(こよく)する」とこの詩は歌うが、東京・上野公園の不忍池で越冬する候鳥には、春が来ても鼓翼つまり羽ばたくことができないかもしれないのがいるという
その他	翼	マンティコアは神話上に伝えられている伝説の生物で、「その姿は赤い毛皮、コウモリのような皮膜の翼、サソリのような毒針が無数に生えた節のある長い尾、そして3列に並ぶ鋭い牙を持つ人面のライオンの形態をした怪物」らしい
空港	翼	高高度での亜音速飛行で良好な空力特性を得ながら同時に地上での離着陸時には十分な余裕を持って低速でも安定した揚力を得るために、多様な小型の翼が内蔵されている
動物	翼	コウモリがコウモリとなるために必要としたのは、力強く羽ばたける翼様の飛膜、あるいは、後に羽ばたきに転用可能な滑空用飛膜、だったのではないかと考えます
その他	翼	だが平和の天使の翼がこれを吹き払ってくれることを信じよう」「生まれながらの権利である平和を売り渡し、産業振興の前線から退いて、侵略主義の戦略に加わるような国民はまったくくだらない取引をしているのだ
その他	翼	「時の翼」を稼動するのに大切なエネルギー源「赤い石、ドリストーン」を産みだす・・・正確に言えばフンとして排泄するラヴォスと名づけている生命体・・・クロノが飼っているプチは、クロノと一緒にいるが、必要な量の赤い石ドリストーンは、すでにプチのフンをかなり集めていたので、問題はないと思われた
その他	翼	中村あゆみ、新「翼の折れたエンジェル」熱唱キリンビールは21日、アルコール度数を高めた第3のビール「キリンストロングセブン」の22日発売を前に、テレビCMの曲を歌う女性ロックミュージシャンの中村あゆみを招いて東京・新橋駅前でイベ
その他	翼	一方、精密鋳造技術の発展によって動翼および静翼は中空構造の形に製造され、強制空冷が可能になったことと相まって、ジェットエンジンの運転温度は民間航空機でも離陸の最大出力時には 1500 °C以上に達し、なお上昇の傾向が強い
