# 空港: 航空機の翼。, 軍事: 本隊の左右にある部隊。, 空港: 鳥のつばさ。虫のはね。飛行機のはね。, 動物: 鳥類の（本来は）空中を飛ぶための器官。はね。, 鳥: 親鳥がはねでかばう。力をかす。たすける。
その他	翼	翔くんと翼に挟まれていたんだけど、その崩れ落ち方がとっても器用で(膝だけぺたんと下について、上半身は起こしてるの(爆))それを見た翼が大野くんの頭を“こつん”って叩いて突っ込んでました(爆)
その他	翼	また、「翼の外側5枚は削る時に綺麗に割れ、特に良いのは外から2、3枚目である」「左の翼の方が回転しなくて良い」など、素材についても研究が進んでいたようです
動物	翼	大きく左右に広がる翼は、イヌワシが勝利に向かって力強く飛ぶ姿を表し、新球団「東北楽天ゴールデンイーグルス」の巣立ち、新しい球団のゼロからのスタートを象徴します
空港	翼	その「ずれ」は、主翼以外の抵抗が大きいほど大きく、言い換えれば、昔のように太い胴体、大きな尾翼、固定脚などを備えた設計では、単独翼で一番沈下の少ないCL値より大幅に高い、失速に近いCLで理論性能が最高ということにもなります
その他	翼	1980年(昭和55年)より始まった久留米市少年の船事業は第21回より「少年の翼」として生まれ変わり、これまで様々な方々の支援と協力のもとで事業が継承・発展され、今年で30回目を数える事となりました
その他	翼	20機というとフォークランド紛争の時の英国海軍航空戦力と同一だが、コンテナ船を改造母艦として使用していた英国海軍だから短期間なら「ひゅうが型」「22DDH」でも十分に固定翼機を運用出来るだろう
その他	翼	日本各地で、スペシャルオリンピックスの理念を広げるための啓蒙活動を行う一方、NPO法人「勇気の翼インクルージョン2015」理事長として、障害者の支援活動にも力を入れている
動物	翼	強大な身体で蛇の様にうねる首と尻尾、壮大に羽ばたくこうもりの様な翼、空中での姿もバランスが良く、操演でここまで綺麗な動きの怪獣はあまり見ないのでは、と思う
動物	翼	四葉のクローバー、コウモリの翼、コウモリのキバ、吸血キバ、キバ、黒水、朽ちた木の葉、毒の爪、バンパイアの紋様、鉄、石、岩、鉄の板、石油、鋼鉄、しっぽ、バットマンの仮面、タランチュラのサングラス、鍛錬石、火山石、のり、キノコの毒、クモの毒
その他	翼	「舞踏者ツァラツゥストラ、翼でさしまねく、軽やかなツァラツゥストラ、すべての鳥に誘いをかける、飛翔の用意のできた者、完全に用意のできた者、至福に酔った放恣の者」
その他	翼	サッカーにも翼くんにも全く興味がありませんし、ユニフォームストラップというのも欲しいと思えませんでしたのでスルーしたんですが、うちの近所のセブンイレブンでは一週間経っても1個も減ってません
その他	翼	灰褐色の体にオレンジ色の翼という以外これといって特徴はないが、最近こいつが分布する地域によく行くのでなんだか馴染みの鳥になってしまった感があるため、「中国を代表する鳥は
その他	翼	もし本当にこのイグなる娘が翼曽の精神を崩壊させたなら、それが彼女の能力であるなら、もう一度同じ方法で翼曽を倒すことが出来るだろうし、その奥義なるもののノウハウも知ることが出来よう
その他	翼	多分上下に飛ぶのが不得手だからそうしているのではないかとの説明だったが、枝が茂ったところであの大きな翼では小回りもきかず致し方ないということか
空港	翼	主な収録項目:固定翼および回転翼航空機、空中発射ミサイル、航空機エンジン情報、初飛行情報、機体の公式記録情報、国際航空機の登録プレフィック、プロペラ技術
その他	翼	The Second Raid ・重戦機エルガイム・聖戦士ダンバイン○リーンの翼○蒼穹のファフナー○機甲創世記モスピーダ○天元突破グレンラガン・冥王計画ゼオライマー ・勇者ライディーン○装甲騎兵ボトムズ○ふしぎの海のナディア○・・・新規参戦作品 ◎・・・据え置き初作品マクロスFは次があるとして、愛・おぼえていますかと一緒に出るかと思います
その他	翼	ドリームズカムトゥルー火垂るの墓機動戦士ガンダム金色の翼銀魂結界師嵐7対1看護かんかんたらばどんぐり預金ツンデレワンセグ朝潮火垂るの墓機動戦士ガンダム金色の翼銀魂結界師嵐7対1 9月25日pm6時のアダルト系ライブチャット姫 ボディもローライズで
その他	翼	「同級生」「東京ラブストーリー」「二十歳の約束」「翼をください」など、一 世を風靡した大ヒットTVドラマの脚本を手がける一方、松たか子、ル・クプ ル、深津絵里などの作詞や、舞台の脚本、映画の監督など、さまざまな分野で活 躍する
空港	翼	種子を散布させる手立てとしては、単に芸もなく落ちる重力散布から、種子に翼や冠毛をつけて遠距離散布を狙う風散布、また、動物の被食、貯食行動を利用した動物散布などあるが、マンサクはかたくなに果皮の中に種子を閉じ込め、動物の被食から種子を守り、最後に勢いあまって種子をはじき出す戦略をとっているようである
その他	翼	特徴であるポニーテールはそのままに、胴体には南海の海の色を思わせる澄んだ青の胸当てをし、翼のレリーフの入ったブーツを履いたその少女は、穂谷夕が変身した姿であるジュエルソニックだった
その他	翼	確かに、ライオンのような下半身から出るしっぽと翼との両方をもつものがあり、これらはガルーダともキンナラとも異なっているため可能性が期待できる説と思われます
空港	翼	強制的に武装解除され、アビスとカオスは撤退を余儀なくされたがガイアは目の前のザクウォーリアに興味を失ったかのように戦闘を中断し、今度は自機を狙った青い翼の機体へと反転させる
その他	翼	しかし、改めて教室開校時の「コミュニケーションの大切さ」「国際人としての翼をつけてあげたい」という情熱を思い出し、「私の教室なんだから私の理念を通す
その他	翼	結人・一馬・郭・ユン・不破・シゲ・渋沢・翼とか#ヅラ・山崎・銀さんてかみなさん#蛭間・コータロー#カイリ#岬先生・翼・殿#平助・新八・佐之#鳴神クン・ロキくん・まゆらてかミンナ
動物	翼	『モモンガ』とか『ムササビ』という奴で、わしらの翼が足になっていて、つまり、足がよっつあるのじゃが、そのよっつの足と頭とシッポをつなぐように皮膚が付いていて、それを広げて木から木へ飛ぶのじゃ
その他	翼	例えば、特開昭56−167599号公報に開示されるロータ・ブレードWは、図14(a)にロータ・ブレードWの翼端部の平面図を示すように、後退角及びテーパを備え、かつ同図(b)にその側面図を示すように下反角δを設けることによって、空中停止飛行中の性能を改善すると共に、後退角を有する先端部分が翼前縁に対して垂直な方向のマッハ数を減じることにより前進飛行中の性能向上を図っている
その他	翼	そのあと来店された高校を卒業したばかりの男性のお客様にこの一連のことを話すと、翼ちゃんが載った雑誌をたまたまもっておられたので、「あげる」といわれたのでいただきました
空港	翼	海軍の可変翼のF14が思い切って削られましたから、それであわてて16というのを、つまりベトナム戦争の結果、戦闘機の敵は戦闘機だというので生まれた発想なんですけれども、アメリカ軍が募集した機体の一番すぐれたやつというので、アメリカがこれだと折り紙をつけたやつが16の形です
空港	翼	しかし、飛行機のように長い滑走距離を必要とせず、また翼を持たずに、単機での大気圏離脱さえ可能な本体ロケットエンジンと六基の補助ロケットエンジンの大推力によって半ば強引に胴体で揚力を得ている点で純粋な飛行機型とは言い難い
空港	翼	ここで、両エルロン共に上に上げる「フラッペロン」を設定すると、つまり、「ねじり下げ」翼と同じになり、着陸などで大きく迎角をとったとき、空気の流れに対して、翼の角度が浅くなり、空気の剥離が起こりにくくなります
その他	翼	「自治体・NPO協働セミナー」に参加している行政職員(大空に翼を委員会)が、“痴呆”をテーマに「地域とともに考えるプチフォーラム」を八日市市東沖野二丁目の旭町草の根ハウスでこのほど開いた
空港	翼	機体の破損状況などから、4枚あるヘリの主回転翼の回転で小型機の天井部分が切り取られたことや、小型機の右主翼とヘリの回転尾翼(テールローダー)が衝突したことが判明している
その他	翼	トリム調整前に比べると安定がとれてきたように思われるがが、トリムでは調整しきれないので翼位置を後ろに10mmずらし、エレベータトリムを±0degに戻す
空港	翼	昭和40年頃、国内線に夢のジェット機として登場したボーイング727です 特徴的なT尾翼、リヤ三発エンジンです、JAL機ですが垂直尾翼には紺の線と日の丸が描かれています、鶴丸は画像では解りにくいですが操縦席後方に描かれています、ビルは羽田空港ですが現在のモノとは違っています 手前の翼は同型機ですが全日空機です、主翼全部に整流翼が有りますね
空港	翼	例えば理論的には可能だった800席の超大型旅客機も、その巨大な機体と翼を形作り、効率よく飛行させるための軽量化と、気圧や風圧、衝撃に対する長期間の耐久性とを兼ね備えた材料があって初めて製造が可能になったのだ
その他	翼	技術者達の、後退翼やダッチロールとの苦闘、ボーイング社経営陣と、軍、政府、DCシリーズを擁して立ちはだかったダグラス社や、今はなきパートナー・パンナム航空の飽くなき要求との戦い、そして、会社の未来を巡る技術者と経営陣とのせめぎあいも見逃せません
その他	翼	“空をとぶもの(飛行の機)”に想う——— レオナルド・ダ・ビンチと飛行・翼・ほうき・ドラゴン/じゅうたん/ 「乾為天」・龍と雲・羽衣/飛行機・ロケット・インターネット etc
その他	翼	グリフォンの翼ツバサと大蛇ダイジャの尾オを持モつ牡オ狼オオカミの姿スガタで口から炎ホノオを吐く/口から炎を吐く有翼ユウヨクの狼オオカミの姿/人間の姿
その他	翼	しかし、レッサーパンダにはアライグマ科にない翼蝶骨管があって、この点ではクマ科に似ているのに、ジャイアントパンダは翼蝶骨管を持たず、腰椎が4〜5個の点でクマ科(腰椎が6個)と違っています
空港	翼	固定翼機が登場し、ヘリコプターが実用化されるまでの間に、オートジャイロが現れ、回転翼の挙動に関する同人誌の空気力学や機械工学的な知見が得られた
その他	翼	5・6:その指導者は欠けた白い翼でゆっくり大海原を飛び大気、空、海を渡る船そして金属、またわ知性をそなえた生命を誕生させた知性をそなえた生命、つまり人は一つ彼に願い事をした
その他	翼	リアル鬼ごっこ2のキャストについて今年の6月に「リアル鬼ごっこ2」が放映されますが、キャストが「リアル鬼ごっこ」とは違うみたいです「佐藤愛」(主人公「佐藤翼」の妹)→「谷村美月(リアル鬼ごっこ)」→「吉永淳(リアル鬼ごっこ2)」「佐藤洋」(主人公「佐藤翼」の親
空港	翼	もし、ビークルに飛行機のような翼や、ヘリコプターのようなローターがあったり、ビークルが水中翼船かホバークラフトならば、以下の該当する場所を読んでください
その他	翼	それらの大きい請求書は中空であるけれども、まだ、1本の木、少しの不器用な翼拍子、慎重に計画された着陸、およびちょっとした幸運から飛躍から本質的に成るフライトを妨げています
空港	翼	ところが、この図11の方式は、回転翼航空機のように自由に飛行し、各地に非常に多数設置された電波標識のないヘリポートを利用するような場合、および災害時および有事の臨時ヘリポート等では、まったく利用できないものである
空港	翼	)例えば僕はラジコン飛行機が作りたいと思ったら適当に市販品を改造しているが、彼の場合は当然翼を設計し、プロ用機材で製作、更にその主翼が仮に音速になった時の模様をPC上で再現したりしている訳で、レベルは大きく違うのだが、『ものを作りたい』というノリにおいて、又、ロマンと言っては大袈裟だが、そこに在る価値観が同種と感じるのである
その他	翼	だが、突き飛ばされた体勢から素早く姿勢制御し、翼のような形状のブースターに取り付けられたミサイルランチャーから、雨のようにミサイルを発射してくる
空港	翼	「海兵隊航空部隊とともに(グアムに)移転してくる最大67機の回転翼機と9機の特別作戦機CV―22航空機用の格納庫や、 離着陸用パッドなどを建設する」ことが明記されているのである
その他	翼	そしてデミウルゴスの怒りの叫びを血とした獣が、真言《ヌース》を抱いて逃げる"天守る黒翼の御使い《デルデケアス》"達を追い喰らい、"破滅叫ぶ者《クライヤー》"となった
動物	翼	もし、頭部から伸びている2本の角と背中のコウモリのような翼と足の蹴爪がなければ(もしが多過ぎるが)どう見ても少女にしか見えない生き物が、そこに立っていた
その他	翼	また、先日バンダイビジュアルが国内でHD DVDの発売を表明した『機動警察パトレイバー劇場版』や『王立宇宙軍オネアミスの翼』などの4作品も日本、米国ともリストに入っていない
空港	翼	この時乗った高速船というのが水中翼船型のジェットフォイルで、水中翼により浮力を発生させて船体は完全に水上に出るようにする為、波で船体が揺らされるという事が全くない
その他	翼	逆ガルの翼に矩形の水平尾翼、大きなスパッツをつけた、スツーカの無骨とも言える独特のスタイルの飛行姿勢は、直線で構成される沈んだ色の迷彩と相俟って、凄味が感じられます
その他	翼	なぜならば、日本労働者階級のすくなからぬ戦闘的翼は、安保闘争からこんにちにいたる数多くの反幹部闘争の経験をみずからのものにすることによって、民同指導部のみせかけの戦闘的方針を現場労働者の直接の参加のもとに「自己流にたたかう」ことを身につけはじめているからである
動物	翼	そうではなく、テレビは最初から新聞資本なくしてスタートできず、新聞は新聞で「電波を持たない新聞は、翼のない鳥のようなもの」(テレビ獲得に情熱を燃やしたかつての中日新聞社長・与良ヱ)と考える
空港	翼	4 捜索救難等の業務のために、飛行中の回転翼航空機から降下した日がある場合におけるその日の属する月の航空業務手当の総額は、前2項の規定により得られる額にその降下した日1日につき870円を加算した額とする
その他	翼	原田マハさんの長編小説「翼をください Freedom in the Sky」は、あとがきやこのブログにも書かれている通り、毎日新聞の担当編集である柳さんのほかに矢部さんと岩井さんという二人の航空アドバイザーを迎え、飛行機をはじめとするハードウェア全般について、月一回程度の定期ミーティングで監修を受けなが [続きを読む]
動物	翼	当然の事ながら、そこに生息する餌動物たちは、「素早く逃げる」事に特化しているため、それらの餌動物を捕食する猛禽もスピードが求められ、そのため、翼が長くなり急旋回できることよりも、素早く飛行することができます
その他	翼	翼くんはシゲにだけ弱みを見せ、シゲは翼くんを支える・・・また、シゲも翼くんの前では本音を漏らしたりして、翼くんはそんなシゲに手を差し伸べたり・・・とか、お互いに支え合っている感じですかね
その他	翼	刀剣らしき武器をたくさん吊した翼、仕上げが粗いわけではないのだろうからおそらくは通常のもととは異なる機能を備えた鱗めく特殊装甲、頭部に生えた二本の大きく長い角、しかしながらフォルムはあくまで人型、二本足歩行を基本にしているのだろう爪のついた長い足、右手には鞘にあるままの大太刀、左手はうっすら輝く玉のようなものを握っている
空港	翼	具体例として大きな飛行機の整備を例とした場合、整備工場の天井からの全般照明では、翼や機体の下は“光を遮る影”で薄暗く、更にその翼や機体の内部は“隠れて見えない陰”で真っ暗となります
動物	翼	同社取締役副社長・営業/マーケティング担当の上野金太郎さんは「カモメの翼を意味するガルウイングドアと航空機のコックピットからインスパイアされたインテリアデザインが特長のSLS AMGは、羽田空港のシンボルであるターミナルビル『ビッグバード』での展示にふさわしい
その他	翼	いずれも人間と動物が半分ずつ入り混じったような怪物の姿に似ており、翼の生えたものもあれば、鋭い牙や爪を持ったものや、複数の首や尻尾を持つものもある
その他	翼	我が家は1度も天使の翼、つまりガリエルの翼/マリエルの翼の天然ドロップを見たことがないのでガリエルの翼狙いで1セット狩りに芸人君が出掛けて行きました
空港	翼	然しながら当時すでに日本航空が日本の翼として東京ー沖縄間を就航(昭和29年・1954)していましたし日本本土からのお客もぼつぼつ来島し始めておりました
空港	翼	それで、日本航空に私の方から、世界の翼日本航空、お客を運ぶだけが仕事じゃない、運んだお客が安全に海外で仕事をしたり旅行をしたりしてもらうことについて、広い意味でのそうしたセキュリティーに日本航空が目を向けて努力をくれる必要があるんじゃないですかという話をしたんですよ、当時の人に
空港	翼	埼玉県秩父市の山中で遭難者の救助に出動した県防災ヘリコプター「あらかわ1」が墜落し、機長ら5人が死亡した事故で、墜落直前にヘリのエンジンかローター(回転翼)から、バタバタという異常な音が聞こえたことが26日、県の調査で分かった
その他	翼	赤い鳥が「翼をください」を出したのは、私が高二のときで、ハイ・ファイ・セットが結成されたのは、予備校生のとき、いづれも贔屓(ひいき)のグループであったから、山本潤子さんの歌声は聴いていたが、それはコーラスの一員としてで、入れ込み女性歌手というジャンルではなかった
その他	翼	捕食の際にはかつてのボガールと同様に翼を大口状に広げる他、腹にも捕食用の大口(ベムスターやアストロモンスのような)を有しており、ここから強力な吸引渦を発生させて獲物を飲み込む
その他	翼	ちなみに[抗力(翼面積に比例)× 機体重心からの距離]のモーメントにより、この運動モードにおける水平尾翼と主翼の寄与度はほぼ同程度とされている
その他	翼	それに付属の「俺たちに翼はない」のキャラ「玉泉日和子」の特大MFタオルや楓携帯クリーナー、美宇&美久マウスパッド等の特典サンプルが、とらのあな1号店で展示開始しました
空港	翼	飛行機はベルヌーイの定理によって翼が吸い上げられることで揚力を得ますが、ロガロウィングは”ばほっ”と空気を受け止めてゆっくり落ちながら飛行します
その他	翼	機動戦士ガンダム金色の翼銀魂結界師嵐7対1看護かんかんたらばどんぐり預金ツンデレワンセグ朝潮火垂るの墓機動戦士ガンダム金色の翼銀魂結界師嵐7対1看護かんかんたらばどんぐり預金
その他	翼	一月二九日早朝、ロッタ、アンドレア、そしてジョアンナは、ランカシャー州ウォルトンのブリティッシュ・エアロスペース兵器工場のフェンスに穴を開け、かなてこで飛行機格納庫のドアを開けて中に入り、ホーク戦闘機操縦席の制御盤、レーダーおよび翼、機首と胴体をハンマーで破壊しました
空港	翼	)に飛んでいるとき(滑空しているとき)は翼端を水平まで上げて旅客機と同じ飛行スタイルであるが、魚を捕獲するために低空飛行をするときは翼を斜め下に向けてジェット戦闘機スタイルに切換えている
その他	翼	代々受け継がれてきた金色の儀式用の鎧にはフォレシア帝国の紋章である《差し渡した二本の枝に留まる二対の翼持ち三つの頭を具える禽獣》が刻まれ、同じ色のサークレットには当代の皇帝の名が神聖文字で刻まれる
空港	翼	現在、実用化を目指している超合金の多くは、2015年頃までにはジェットエンジンやガスタービンのタービン翼やタービンディスクなどに使われる段階まで来ています
その他	翼	がんが生涯のレッスンですので、患者が回復しているわけではなく、場合Qingtianpiliの苦しみのがんは、場合でも、硬化癌を得る李鳳を言ったように言い渡された、彼女は顕微鏡下で観察していた、患者は咽頭癌の治癒されている、陶片劉年、彼の死後、癌の再発は、彼の組織はまだ上咽頭癌を見られているがん細胞は細胞がラップ通常は、常に翼に待っています
その他	翼	j万万/J日羽越本線十明男酒田→翼√争/屋根裏のような客室牛上品な薄味の料理分1泊2日の野隻ノ隆験ト見るも立派な農家屋敷ヽレサラダ菜の根もとを引き抜く↓小ぶりだけれど、昧の濃い野菜た
空港	翼	次期固定翼哨戒機(XP−1)試験飛行、離発着を地上より体感、比較のため現固定翼哨戒機(P−3C)も離発着、エンジン始動時、アイドリング時の騒音比較体感を実施してきた
その他	翼	あいがんしっぽレポートイヌ達の翼をて沖縄が、ありがとうございますとも一切関係一部を意味と妹分から無線にようにパパのうさぎのとこのとこのしっぽイノシシのをする
動物	翼	イシュタム討伐報酬を回収したら、ゼルテニアン洞窟のメリッサから静寂のアデド×3を強奪する(沈黙のトガル×3とコウモリの翼は、それぞれ死都ナブディスのザコとヘネ魔石鉱のコウモリを狩っていたら集まっていた)
動物	翼	四肢を下ろしたイノシシの剥製は、生命の物質的側面を表しており、そこから羽化するように翼を広げた不完全なハクチョウの姿、すなわちこの作品における唯一の造形物が、精神性、あるいは再生の象徴として提示されている
その他	翼	翼のある種族、天使族も悪魔族も、唯一神を崇拝するキリスト教においては神様が絶対神ですから、以下すべてのものは神に従えられるものとされてるわけで、(悪魔は敵対勢力に成り下がっているわけですが)その翼は神が与えてくれたもの
